Date;Year;Month;Type;sentiment;sentiment_score;sentence
2001-08-21;2001;August;Minute;Negative;0.8188016414642334;in addition increasingly persuasive evidence indicated that realized capital gains from the sale of homes were a source of fairly significant amounts of consumer purchasing power in the economy
2001-08-21;2001;August;Minute;Positive;0.9916568994522095;tax rebates declining energy prices and widespread discounting of retail prices were cited as positive factors in support of consumer spending on a wide range of goods and services
2001-08-21;2001;August;Minute;Positive;0.9897833466529846;in their review of developments in key sectors of the economy members again emphasized the ongoing strength in household spending and its vital role in moderating the weakness in overall economic activity
2001-08-21;2001;August;Minute;Negative;0.9897728562355042;there also were some recent indications of declining consumer confidence and many retailers had become less optimistic about the outlook for sales over the balance of the year
2001-08-21;2001;August;Minute;Negative;0.9860227108001709;at the same time members cited some still quite tentative signs that declines in manufacturing had slowed or that activity had steadied in some depressed industries
2001-08-21;2001;August;Minute;Negative;0.9926122426986694;weakness continued to be concentrated in manufacturing notably in the hightech sector and in hightech service industries
2001-08-21;2001;August;Minute;Neutral;0.7667596936225891;statistical evidence of an ongoing though gradual worsening in overall business conditions was supported by anecdotal reports from around the nation
2001-08-21;2001;August;Minute;Negative;0.9865879416465759;the reduced pressures on resources along with expectations of some further declines in energy prices were seen by many members as likely to foster a modest deceleration in many measures of wages and prices
2001-08-21;2001;August;Minute;Negative;0.992967963218689;with regard to the outlook for inflation members reported on widespread indications of some slackening in what were still generally tight labor markets and also noted that capacity utilization rates had declined substantially in many industries
2001-08-21;2001;August;Minute;Negative;0.9386283755302429;nonetheless the members recognized that the recovery in business fixed investment the major source of weakness in the economy was likely to follow a more extended period of adjustment than had been anticipated in their earlier forecasts
2001-08-21;2001;August;Minute;Negative;0.54816734790802;a number of major industrial economies were growing more slowly than had been expected earlier in the summer
2001-08-21;2001;August;Minute;Negative;0.984957218170166;indications that the softening was spreading more generally were still fairly limited as suggested by employment data and anecdotal reports
2001-08-21;2001;August;Minute;Positive;0.9660618901252747;homebuilding generally had remained robust in recent months as relatively low mortgage interest rates continued to offset weakness in employment and incomes and the negative effects of declining stock market wealth
2001-08-21;2001;August;Minute;Neutral;0.5112144351005554;in sum the timing of the pickup in the growth of the economy had again been pushed back
2001-08-21;2001;August;Minute;Negative;0.9931765794754028;for now however there were few signs that overall housing activity might be softening though members noted that potentially bearish factors relating to the outlook for consumer spending might at some point also affect housing
2001-08-21;2001;August;Minute;Positive;0.9913027286529541;most regions continued to report strong housing markets albeit with evidence of some weakening in sales of highpriced homes in a number of areas
2001-08-21;2001;August;Minute;Negative;0.9900570511817932;on the negative side financial difficulties in a number of states were being met in part through higher taxes that implied at least some offset to the federal tax relief
2001-08-21;2001;August;Minute;Neutral;0.9914458990097046;the impetus could not be measured precisely but it was reflected in available anecdotal reports
2001-08-21;2001;August;Minute;Positive;0.9877347350120544;the tax rebates currently being distributed undoubtedly were having a limited but positive effect on consumers which likely would continue over coming months
2001-08-21;2001;August;Minute;Positive;0.9881267547607422;fiscal policy developments were a supportive factor in the economy
2001-08-21;2001;August;Minute;Positive;0.9892633557319641;even so leaner inventories had favorable implications for production going forward
2001-08-21;2001;August;Minute;Negative;0.9828810691833496;unexpected weakness in final demands would of course lead to additional efforts to pare inventories which would tend to damp and delay the rebound
2001-08-21;2001;August;Minute;Positive;0.9641520977020264;moreover the reductions in income tax rates would have an ongoing effect in boosting disposable household incomes
2001-08-21;2001;August;Minute;Negative;0.9943373799324036;the persistence of substantial inventory liquidation was another negative factor in the current performance of the economy
2001-08-21;2001;August;Minute;Positive;0.987592875957489;in the context of a still favorable outlook for continued elevated rates of technological progress business firms reportedly had not yet exploited many potentially profitable investment opportunities
2001-08-21;2001;August;Minute;Positive;0.9921537041664124;while the nearterm outlook for business investment was not promising and considerable uncertainty surrounded the timing of the eventual upturn members remained optimistic about the longerterm prospects for capital expenditures
2001-08-21;2001;August;Minute;Negative;0.9839300513267517;indeed history strongly suggested that capital spending might well fall below sustainable levels for a time as business firms over adjusted on the downside to previously excessive or misdirected buildups of capital resources
2001-08-21;2001;August;Minute;Negative;0.981450080871582;market forecasts of business profits were progressively being reduced and as a consequence members saw little likelihood of a marked turnaround in business capital investment over the months ahead despite some elements of strength such as sizable construction projects involving public utilities energy and in some areas public works
2001-08-21;2001;August;Minute;Negative;0.9932821989059448;business capital expenditures appeared to be slowing sharply further after posting large declines earlier in the year in conjunction with the marking down of the expected growth of demand for and profitability of capital equipment weak sales the emergence of substantial excess capacity in many industries notably in hightech facilities and the resulting decline in earnings
2001-08-21;2001;August;Minute;Negative;0.9440327286720276;while considerable progress reportedly had been made by numerous business firms in reducing their inventories to bring them into better alignment with sales a rebound to inventory accumulation did not appear imminent for the economy as a whole
2001-08-21;2001;August;Minute;Positive;0.9898712038993835;with household spending already elevated relative to income and its rate of increase unlikely to strengthen materially if at all under foreseeable nearterm economic conditions the anticipated upturn in overall economic expansion would depend critically on business investment spending and in turn on improved prospects for business profits and cash flows
