Date;Year;Month;Type;sentiment;sentiment_score;sentence
2021-02-18;2021;February;REPORT;Neutral;0.9894351363182068;in this context it had to be emphasised that the measures put in place were appropriate in view of the current outlook but were also designed to react flexibly and equally to either potentially less favourable developments or upside surprises
2021-02-18;2021;February;REPORT;Positive;0.7420996427536011;it was seen as essential to convey that the governing council was committed to maintaining a steady presence in the markets to ensure favourable financing conditions
2021-02-18;2021;February;REPORT;Negative;0.8048856258392334;moreover the point was made that the governing council needed to stress that there was no room for complacency
2021-02-18;2021;February;REPORT;Neutral;0.9532044529914856;it was also felt that the governing council should reiterate its vigilance with regard to developments in the exchange rate and their implications for the inflation outlook
2021-02-18;2021;February;REPORT;Neutral;0.9931641221046448;in addition the governing council needed to state that it continued to stand ready to adjust all of its instruments including the deposit facility rate dfr as appropriate to ensure that inflation moved toward its aim in a sustained manner
2021-02-18;2021;February;REPORT;Positive;0.4751453697681427;finally in view of the sharp contraction of the euro area economy it was deemed important for the governing council to emphasise the need for continued and ambitious fiscal policies to support the recovery
2021-02-18;2021;February;REPORT;Neutral;0.9906718730926514;monetary policy decisions and communication taking into account the foregoing discussion among the members upon a proposal by the president the governing council decided to reconfirm its very accommodative monetary policy stance
2021-02-18;2021;February;REPORT;Neutral;0.9903668165206909;first the interest rate on the main refinancing operations and the interest rates on the marginal lending facility and the deposit facility would remain unchanged at 000 025 and 050 respectively
2021-02-18;2021;February;REPORT;Neutral;0.9919579029083252;the governing council expected the key ecb interest rates to remain at their present or lower levels until it had seen the inflation outlook robustly converge to a level sufficiently close to but below 2 within its projection horizon and such convergence had been consistently reflected in underlying inflation dynamics
2021-02-18;2021;February;REPORT;Neutral;0.9826827049255371;second the governing council would continue the purchases under the pepp with a total envelope of 1850 billion
2021-02-18;2021;February;REPORT;Neutral;0.9891040325164795;the governing council would conduct net asset purchases under the pepp until at least the end of march 2022 and in any case until it judged that the coronavirus crisis phase was over
2021-02-18;2021;February;REPORT;Neutral;0.9870567917823792;the purchases under the pepp would be conducted to preserve favourable financing conditions over the pandemic period
2021-02-18;2021;February;REPORT;Neutral;0.9146376252174377;if favourable financing conditions could be maintained with asset purchase flows that did not exhaust the envelope over the net purchase horizon of the pepp the envelope need not be used in full
2021-02-18;2021;February;REPORT;Neutral;0.9891389012336731;equally the envelope could be recalibrated if required to maintain favourable financing conditions to help counter the negative pandemic shock to the path of inflation
2021-02-18;2021;February;REPORT;Neutral;0.9897304773330688;the governing council would continue to reinvest the principal payments from maturing securities purchased under the pepp until at least the end of 2023 in any case the future rolloff of the pepp portfolio would be managed to avoid interference with the appropriate monetary policy stance
2021-02-18;2021;February;REPORT;Neutral;0.9833637475967407;third net purchases under the app would continue at a monthly pace of 20 billion
2021-02-18;2021;February;REPORT;Neutral;0.9931260347366333;the governing council continued to expect monthly net asset purchases under the app to run for as long as necessary to reinforce the accommodative impact of its policy rates and to end shortly before it started raising the key ecb interest rates
2021-02-18;2021;February;REPORT;Positive;0.9726808667182922;the governing council also intended to continue reinvesting in full the principal payments from maturing securities purchased under the app for an extended period of time past the date when it started raising the key ecb interest rates and in any case for as long as necessary to maintain favourable liquidity conditions and an ample degree of monetary accommodation
2021-02-18;2021;February;REPORT;Positive;0.9712967276573181;finally the governing council would continue to provide ample liquidity through its refinancing operations
2021-02-18;2021;February;REPORT;Positive;0.9779184460639954;in particular the third series of targeted longerterm refinancing operations tltro iii remained an attractive source of funding for banks supporting bank lending to firms and households
2021-02-18;2021;February;REPORT;Neutral;0.9922322034835815;the governing council continued to stand ready to adjust all of its instruments as appropriate to ensure that inflation moved towards its aim in a sustained manner in line with its commitment to symmetry
