Date;Year;Month;Type;sentiment;sentiment_score;sentence
2021-02-18;2021;February;REPORT;Neutral;0.9830545783042908;however taking the two quarters together developments remained broadly in line with the december baseline projection overall
2021-02-18;2021;February;REPORT;Neutral;0.9810696840286255;it was also recalled that an extension of the containment measures beyond the fourth quarter of 2020 had been incorporated into the december staff projections
2021-02-18;2021;February;REPORT;Negative;0.9663044810295105;however it was highlighted that in response to the increase in cases of infection further measures had been taken or had been announced in many euro area countries which had led to tighter restrictions than had been anticipated in the december projections
2021-02-18;2021;February;REPORT;Negative;0.9878990054130554;moreover it was argued that the fast rebound in growth foreseen in the december staff projections might be too optimistic with growth in the second quarter of 2021 possibly at risk from extended lockdowns
2021-02-18;2021;February;REPORT;Negative;0.9949900507926941;in addition vaccination rollouts were proving to be slow and concern was also expressed about the possible impact of the spread of new more virulent mutations of the virus which had proliferated following the december holiday period
2021-02-18;2021;February;REPORT;Neutral;0.8108779191970825;at the same time it was noted that the economic costs of containment measures were now lower than in spring 2020 as the measures were more targeted and firms had learned to better adjust to the restrictions
2021-02-18;2021;February;REPORT;Neutral;0.7151542901992798;in addition it was emphasised that although containment measures were stricter governments were also providing more fiscal support which would cushion the shortterm impact of tighter restrictions
2021-02-18;2021;February;REPORT;Neutral;0.9552780389785767;while the delay in the vaccination rollouts relative to earlier expectations was likely to contribute to longerlasting restrictions this could be attributed mainly to logistics and was seen as affecting the time frame rather than changing the picture substantially
2021-02-18;2021;February;REPORT;Negative;0.9934982061386108;it was underlined that economic developments continued to be uneven across sectors with the services sector being more adversely affected by the new restrictions on social interaction and mobility than the industrial sector
2021-02-18;2021;February;REPORT;Neutral;0.8382404446601868;there was also heterogeneity across euro area countries
2021-02-18;2021;February;REPORT;Negative;0.9769997596740723;although fiscal policy measures were continuing to support households and firms consumers were seen as remaining cautious in the light of the pandemic and its impact on employment and earnings
2021-02-18;2021;February;REPORT;Positive;0.9906371235847473;however reference was also made to the high level of accumulated household savings and the potential pentup demand which would contribute to a swift rebound in consumption once containment measures were eased
2021-02-18;2021;February;REPORT;Negative;0.9940271377563477;at the same time weaker corporate balance sheets and uncertainty about the economic outlook were seen to be still weighing on business investment
2021-02-18;2021;February;REPORT;Neutral;0.6894952654838562;members highlighted the dichotomy between risks to the shortterm outlook and more positive developments in the medium term
2021-02-18;2021;February;REPORT;Positive;0.988105058670044;the rollout of vaccines which had started in late december allowed for greater confidence in the resolution of the health crisis
2021-02-18;2021;February;REPORT;Negative;0.8372470140457153;however it would take time until widespread immunity was achieved and further setbacks related to the pandemic could not be ruled out
2021-02-18;2021;February;REPORT;Positive;0.9890584349632263;so far the improvement in the macroeconomic outlook appeared to be driven more by external factors than by domestic factors which was beneficial for the euro area as an open economy particularly for the manufacturing sector
2021-02-18;2021;February;REPORT;Positive;0.9916455149650574;looking ahead the recovery of the euro area economy should be supported by favourable financing conditions an expansionary fiscal stance and a recovery in demand as containment measures were lifted and uncertainty receded
2021-02-18;2021;February;REPORT;Negative;0.9887595176696777;however reference was also made in the discussion to the continued risk of a cliffedge effect from a premature removal of fiscal stimulus as well as from weaker corporate and banking sector balance sheets given the risk of a surge in corporate insolvencies and nonperforming loans
2021-02-18;2021;February;REPORT;Negative;0.8827913403511047;overall members assessed that the risks surrounding the euro area growth outlook remained tilted to the downside but had become less pronounced compared with the situation in the autumn prior to the news on vaccines
2021-02-18;2021;February;REPORT;Negative;0.9867903590202332;improved prospects for the global economy the agreement on future euuk relations and the start of vaccination campaigns were encouraging but the ongoing pandemic and its implications for economic and financial conditions continued to be sources of downside risk
2021-02-18;2021;February;REPORT;Positive;0.45993196964263916;regarding fiscal policies an ambitious and coordinated fiscal stance was seen as remaining critical in view of the sharp contraction in the euro area economy
2021-02-18;2021;February;REPORT;Negative;0.9938090443611145;to this end continued support from national fiscal policies was warranted given weak demand from firms and households related to the worsening of the pandemic and the intensification of containment measures
2021-02-18;2021;February;REPORT;Neutral;0.9625647068023682;at the same time it was emphasised that fiscal measures taken in response to the pandemic emergency should as much as possible remain targeted and temporary in nature
2021-02-18;2021;February;REPORT;Negative;0.9932299852371216;there was also concern that although european leaders had agreed to deliver the largest support package ever financed by the eu budget progress on implementation was slow and challenging
2021-02-18;2021;February;REPORT;Neutral;0.975071370601654;the key role of the next generation eu package was underlined as was the importance of it becoming operational without delay
2021-02-18;2021;February;REPORT;Neutral;0.7266263365745544;member states were called upon to accelerate the ratification process to finalise their recovery and resilience plans promptly and to deploy the funds for productive public spending accompanied by productivityenhancing structural policies
2021-02-18;2021;February;REPORT;Positive;0.9866837859153748;this would allow the next generation eu programme to contribute to a faster stronger and more uniform recovery and would increase economic resilience and the growth potential of member states economies thereby also supporting the effectiveness of monetary policy in the euro area
2021-02-18;2021;February;REPORT;Positive;0.7307786345481873;such structural policies were particularly important in addressing longstanding structural and institutional weaknesses and in accelerating the green and digital transitions
2021-02-18;2021;February;REPORT;Neutral;0.9838751554489136;with regard to price developments there was broad agreement with the assessment presented by mr lane in his introduction
2021-02-18;2021;February;REPORT;Neutral;0.9907755255699158;euro area annual inflation had remained unchanged at 03 in december
2021-02-18;2021;February;REPORT;Neutral;0.9321905970573425;on the basis of current energy price dynamics headline inflation was likely to increase in the coming months in part supported by the end of the temporary vat reduction in germany
2021-02-18;2021;February;REPORT;Negative;0.9929543137550354;however underlying price pressures were expected to remain subdued owing to weak demand notably in the tourism and travelrelated sectors as well as to low wage pressures and the appreciation of the euro
2021-02-18;2021;February;REPORT;Negative;0.9791186451911926;once the impact of the pandemic had faded a recovery in demand supported by accommodative fiscal and monetary policies would put upward pressure on inflation over the medium term
2021-02-18;2021;February;REPORT;Neutral;0.9917716383934021;surveybased measures and marketbased indicators of longerterm inflation expectations remained at low levels although marketbased indicators of inflation expectations had increased slightly
2021-02-18;2021;February;REPORT;Neutral;0.9911794066429138;in discussing recent inflation developments members agreed that while broadly in line with the december 2020 staff projections headline inflation was at a very low level and in december underlying inflation had reached a historical low
2021-02-18;2021;February;REPORT;Negative;0.976920485496521;although stronger global demand and higher commodity prices would help to push up inflation price pressures generally remained subdued so that achieving a robust convergence to the ecbs mediumterm inflation aim remained a challenge with favourable developments for the economy and inflation all being contingent on progress in curbing the spread of the pandemic
2021-02-18;2021;February;REPORT;Negative;0.9780069589614868;it was emphasised that the mediumterm outlook for inflation was surrounded by a high level of uncertainty given the unprecedented pandemic situation and longstanding questions about changes in the underlying determinants of inflation
2021-02-18;2021;February;REPORT;Negative;0.9815464615821838;this elevated uncertainty was related not only to the strength of the postpandemic economic recovery but also to the relative importance of demand versus supply factors in different sectors of the economy and to questions about the strength of passthrough from financing conditions to inflation
2021-02-18;2021;February;REPORT;Negative;0.7576563358306885;in addition there continued to be acute measurement issues related to the relevant weights in the price indices during the pandemic period
2021-02-18;2021;February;REPORT;Negative;0.7678017020225525;the projected gradual recovery in inflation in the baseline scenario was seen to remain broadly valid but it was highlighted that inflation was only projected to be 14 in 2023 at the same time there appeared to be little risk of deflation at this juncture with inflation expected to rise in the short term owing to higher energy prices and the reversal of a temporary tax reduction in one jurisdiction together with the rapid recovery in activity expected after restrictions were lifted
2021-02-18;2021;February;REPORT;Positive;0.9836084246635437;it could also not be ruled out that in the course of 2021 inflation dynamics might be stronger than foreseen in the projections at least temporarily in the light of global developments and especially if there was a stronger than expected rebound in activity in the second half of the year
2021-02-18;2021;February;REPORT;Negative;0.6896645426750183;the point was made however that such a temporary boost to inflation should not be mistaken for a sustained increase which was still likely to emerge only slowly
2021-02-18;2021;February;REPORT;Neutral;0.9694288969039917;members reviewed the latest exchange rate developments noting that the recent persistent trend appreciation of the euro had reversed since the start of 2021 possible adverse implications of a further appreciation of the euro for the inflation outlook were reiterated
2021-02-18;2021;February;REPORT;Neutral;0.7014161944389343;it was noted that the nominal effective exchange rate was at a historically high level and had already had a negative impact on inflation although it was also highlighted that the impact of exchange rate movements on inflation might be overestimated in standard models
2021-02-18;2021;February;REPORT;Neutral;0.993904173374176;regarding recent developments in inflation expectations members noted that according to the ecbs latest spf longerterm inflation expectations were unchanged at 17 while marketbased indicators of inflation expectations had increased
2021-02-18;2021;February;REPORT;Neutral;0.9841048121452332;the fiveyear forward inflationlinked swap rate five years ahead now stood at 132 ie
2021-02-18;2021;February;REPORT;Neutral;0.48488548398017883;back at prepandemic levels
2021-02-18;2021;February;REPORT;Positive;0.980076014995575;it was regarded as positive that the pandemic had barely affected longerterm inflation expectations and given the adaptive nature of inflation expectations it was argued that an increase in inflation could have a positive impact on inflation expectations in the future
2021-02-18;2021;February;REPORT;Neutral;0.915039598941803;it was also noted however that the increase in marketbased measures in the euro area was mainly due to global factors
2021-02-18;2021;February;REPORT;Neutral;0.984751284122467;turning to the monetary analysis members broadly agreed with the assessment provided by mr lane in his introduction
2021-02-18;2021;February;REPORT;Neutral;0.9519705176353455;the annual growth rates of broad money m3 and narrow money m1 had been high in november at 110 and 145 respectively
2021-02-18;2021;February;REPORT;Neutral;0.9759441614151001;it was highlighted that recent money growth had been mainly due to the eurosystems ongoing asset purchases with monetary dynamics therefore driven more by developments on the asset side than on the liability side of the eurosystem balance sheet
2021-02-18;2021;February;REPORT;Positive;0.9607816934585571;attention was drawn to the recent developments in loans to the private sector which had been characterised by moderate lending to nonfinancial corporations and resilient lending to households
2021-02-18;2021;February;REPORT;Positive;0.9847737550735474;it was noted that at 69 the annual growth rate of lending to nonfinancial corporations appeared robust
2021-02-18;2021;February;REPORT;Negative;0.9946781396865845;however this was mainly reflecting the very strong increase in lending in the first half of the year while the monthly lending flows had moderated since the end of the summer which could translate into weak investment dynamics over time
2021-02-18;2021;February;REPORT;Negative;0.8404272794723511;however it was also argued that firms had built up sizeable precautionary buffers and the recent slowdown in credit should not be interpreted as the start of a financial amplification cycle
2021-02-18;2021;February;REPORT;Negative;0.9906802773475647;at the same time concerns were expressed about a possible deterioration in firms financial positions looking ahead as and when public support measures were phased out
2021-02-18;2021;February;REPORT;Negative;0.979923665523529;views were exchanged on the interpretation of the results of the bank lending survey bls for the fourth quarter of 2020 which reported a continued net tightening of credit standards on loans to firms
2021-02-18;2021;February;REPORT;Negative;0.9927331209182739;this tightening was mainly driven by heightened risk perceptions among banks in a context of continued uncertainty about the economic recovery and concerns about borrower creditworthiness
2021-02-18;2021;February;REPORT;Negative;0.9942724704742432;it was underlined that in the perception of banks the recession seemed to be harming the creditworthiness of nonfinancial companies as crisisrelated bankruptcies could trigger a surge in nonperforming loans npls when payment holidays and moratoria expired
2021-02-18;2021;February;REPORT;Negative;0.9947210550308228;on the one hand it was argued that the results of the bls warranted careful monitoring as they could signal a further tightening ahead with corresponding negative consequences for credit flows and economic activity
2021-02-18;2021;February;REPORT;Negative;0.9946119785308838;in addition the results highlighted the role of structural weaknesses in the euro area banking sector such as overcapacity high npls low profitability and slow progress on digitalisation
2021-02-18;2021;February;REPORT;Negative;0.9819230437278748;on the other hand it was recalled that reported credit standards had tightened much less than in previous crisis episodes while stateguaranteed loans had led to a significant relaxation of credit standards in the second quarter and the recent tightening thus could be interpreted as a return to more normal conditions
2021-02-18;2021;February;REPORT;Neutral;0.9844214916229248;monetary policy stance and policy considerations members took note of the assessments of financial and financing conditions provided by ms schnabel and mr lane in their introductions which had remained favourable since the governing councils meeting in december also on account of the ecbs recalibrated monetary policy package which had been well received by financial markets
2021-02-18;2021;February;REPORT;Neutral;0.9516568779945374;financial markets had remained calm with several standard indicators of financial conditions signalling a degree of accommodation comparable to or higher than that prevailing at the start of the pandemic
2021-02-18;2021;February;REPORT;Negative;0.9810667037963867;although euro area riskfree rates had risen slightly since the december meeting sovereign and credit spreads had been resilient bond market conditions had remained favourable  also for corporate bonds  and bank lending rates were close to their historical lows for both households and firms
2021-02-18;2021;February;REPORT;Negative;0.5872185230255127;when taking the increase in marketbased inflation expectations into account real yields were at historical lows
2021-02-18;2021;February;REPORT;Negative;0.7778258919715881;it was observed that expectations of substantial us fiscal support had led to a steepening of the us treasury yield curve which had only affected yields in the euro area to a limited extent as a significant decoupling of yields could be observed
2021-02-18;2021;February;REPORT;Neutral;0.8792241215705872;moreover euro area stock prices had increased further since the december meeting while the euro exchange rate was broadly stable amid some volatility
2021-02-18;2021;February;REPORT;Negative;0.727267861366272;it was noted that staff analysis suggested that recent exchange rate developments had been driven less by policy shocks and more by global risk sentiment
2021-02-18;2021;February;REPORT;Negative;0.9903851747512817;concerns were voiced however over developments in the exchange rate that might have negative implications for euro area financial conditions and ultimately consequences for the inflation outlook
2021-02-18;2021;February;REPORT;Neutral;0.9724791646003723;members agreed that ample monetary stimulus remained essential to preserve favourable financing conditions over the pandemic period
2021-02-18;2021;February;REPORT;Positive;0.9483351707458496;overall the monetary policy stance was assessed to have remained very accommodative and to have helped preserve the favourable financing conditions that were necessary to counter the downward impact of the pandemic on the projected path of inflation
2021-02-18;2021;February;REPORT;Positive;0.9480058550834656;recent financial market developments confirmed that the governing councils decision to focus on the extended duration of the pandemic emergency measures the preservation of favourable financing conditions and the flexibility of the pepp had so far proven effective
2021-02-18;2021;February;REPORT;Neutral;0.9337753057479858;the view was held that favourable financing conditions needed to prevail for some time in order to provide continued support to the flow of credit to all sectors of the economy and to counter possible macrofinancial amplification effects
2021-02-18;2021;February;REPORT;Neutral;0.9658535122871399;against this background it was recalled that the projected path of inflation in the december eurosystem staff macroeconomic projections continued to be distant from the governing councils mediumterm inflation aim
2021-02-18;2021;February;REPORT;Neutral;0.7834420204162598;while the december package had been calibrated with the objective to counter the downward impact of the pandemic on the projected path of inflation the view was held that the governing council should allow real interest rates to decline if financing conditions eased on account of an increase in inflation expectations
2021-02-18;2021;February;REPORT;Positive;0.9878692030906677;as the inflation outlook was falling significantly short of the governing councils aim lower real yields would provide additional support for a faster return to price stability
2021-02-18;2021;February;REPORT;Neutral;0.7762249708175659;at the same time it was maintained that not every increase in nominal yields should be interpreted as an unwarranted tightening of financing conditions and trigger a corresponding policy response
2021-02-18;2021;February;REPORT;Positive;0.8586496710777283;it was noted that nominal yields were not an appropriate benchmark for assessing whether financing conditions remained favourable as they could rise because of a better economic outlook and higher inflation expectations
2021-02-18;2021;February;REPORT;Negative;0.9717164039611816;what mattered from a monetary policy perspective was the evolution of real rates which had declined to record low levels in recent weeks
2021-02-18;2021;February;REPORT;Neutral;0.9847085475921631;overall it was widely felt that the recalibration of instruments decided on in december remained appropriate and wellbalanced while all instruments needed to remain on the table with due consideration of benefits and possible unintended side effects
2021-02-18;2021;February;REPORT;Neutral;0.9828904271125793;it was also emphasised that a holistic approach was needed when defining the relevant range of financing conditions to be targeted in a broad and flexible manner for all sectors of the economy private and public
2021-02-18;2021;February;REPORT;Neutral;0.9759525656700134;it should also comprise bank lending rates as well as credit volumes and conditions for households and firms take into account economic and market developments and ultimately be anchored in the mediumterm outlook for price stability
2021-02-18;2021;February;REPORT;Neutral;0.9915962815284729;all members agreed with mr lanes proposal to reconfirm the existing monetary policy measures
2021-02-18;2021;February;REPORT;Neutral;0.9916606545448303;it was argued that monetary policy should keep a steady hand and that the measures that were put in place in december should be given time to take full effect
2021-02-18;2021;February;REPORT;Neutral;0.956864595413208;moreover the economic outlook was judged to be evolving broadly in line with the december eurosystem staff projections and the present configuration of monetary policy tools was deemed supportive and flexible enough to address the current situation
2021-02-18;2021;February;REPORT;Neutral;0.9864451289176941;overall members also widely agreed that there was no room for complacency and that the governing council had to continue to stand ready and use all of its instruments as appropriate to ensure a robust convergence of inflation towards its aim
2021-02-18;2021;February;REPORT;Positive;0.7296916842460632;members agreed that the monetary measures in place including those adopted since the onset of the pandemic were effective and proportionate in supporting growth and inflation and that the balance of the benefits and costs remained positive
2021-02-18;2021;February;REPORT;Positive;0.9772196412086487;the purchases under the pepp contributed to preserving favourable financing conditions for all sectors while the third series of targeted longerterm refinancing operations tltro iii remained an attractive source of funding for banks supporting bank lending to firms and households
2021-02-18;2021;February;REPORT;Positive;0.9881445169448853;the continued reinvestments of principal payments from maturing securities purchased under the pepp and the asset purchase programme app were enhancing favourable financing conditions by signalling a continued presence of the eurosystem in the markets over the pandemic period and beyond
2021-02-18;2021;February;REPORT;Neutral;0.9842050671577454;the purchases under the pepp would continue to be conducted flexibly according to market conditions to preserve favourable financing conditions over the pandemic period with a view to countering the downward impact of the pandemic on the projected path of inflation
2021-02-18;2021;February;REPORT;Positive;0.7451436519622803;in addition the flexibility of purchases over time across asset classes and among jurisdictions would continue to support the smooth transmission of monetary policy
2021-02-18;2021;February;REPORT;Neutral;0.9803928732872009;in this regard the dual role of the pepp was stressed
2021-02-18;2021;February;REPORT;Neutral;0.9874914884567261;as regards communication members broadly agreed with the elements proposed by mr lane in his introduction
2021-02-18;2021;February;REPORT;Negative;0.9919899106025696;on the one hand it was deemed important to stress that the current inflation outlook remained disappointing with an inflation rate well below 2 in the baseline scenario
2021-02-18;2021;February;REPORT;Positive;0.9537506699562073;on the other hand a balanced presentation of the outlook was called for as some uncertainties regarding the international developments had been resolved in a more positive way than expected
