Date;Year;Month;Type;sentiment;sentiment_score;sentence
2021-02-18;2021;February;REPORT;Negative;0.5391020774841309;meeting of 2021 january 2021 account of the monetary policy meeting of the governing council of the european central bank held in frankfurt am main on wednesday and thursday 2021 january 2021 1 review of financial economic and monetary developments and policy options financial market developments ms schnabel reviewed the financial market developments since the governing councils previous monetary policy meeting on 910 december 2020 new global coronavirus covid19 infections had reached a record high in the previous week and the risk of more protracted containment measures was rising amid the emergence of more infectious mutations of the virus and a pace of vaccination that was proceeding more slowly than expected
2021-02-18;2021;February;REPORT;Positive;0.9926608800888062;sentiment in financial markets however had improved noticeably at the start of the year mainly reflecting expectations of additional fiscal stimulus in the united states sparking reflation trades
2021-02-18;2021;February;REPORT;Negative;0.46395808458328247;the us treasury yield curve had steepened significantly led by the long end reflecting an increase in both inflation expectations and real rates
2021-02-18;2021;February;REPORT;Neutral;0.9730789661407471;the euro area overnight index swap ois curve by contrast remained close to its flattest historical level and had steepened only marginally over the past two weeks
2021-02-18;2021;February;REPORT;Neutral;0.9919025301933289;the euro area gdpweighted yield curve had also remained very close to the level observed at the time of the governing councils 910 december 2020 monetary policy meeting
2021-02-18;2021;February;REPORT;Positive;0.755950927734375;however stable nominal yields in the euro area masked opposing underlying developments
2021-02-18;2021;February;REPORT;Negative;0.9948025941848755;while medium to longterm inflation expectations had increased at the same pace as in the united states real yields in the euro area had resisted upward pressure and had in fact declined to record low levels
2021-02-18;2021;February;REPORT;Neutral;0.9738376140594482;there had also been a repricing at the short end of the curve
2021-02-18;2021;February;REPORT;Neutral;0.8909368515014648;both in the united states and in the euro area ois forward curves had continued to shift upwards since the start of 2021 broadly reflecting higher interest rate expectations
2021-02-18;2021;February;REPORT;Negative;0.5376317501068115;crossasset price correlations were consistent with the view that the market was becoming more sanguine about the economic outlook despite the risk of strict lockdowns being extended further in the near future
2021-02-18;2021;February;REPORT;Positive;0.9896713495254517;price and flow data on global equity markets suggested that a further improvement in risk sentiment and a recovery in longterm earnings expectations had so far outweighed any impact from the rise in riskfree rates
2021-02-18;2021;February;REPORT;Positive;0.9879992008209229;global stock markets had posted further gains and the euro stoxx 50 index was now close to reaching precovid19 pandemic levels
2021-02-18;2021;February;REPORT;Positive;0.8030509352684021;the recent price gains had also been backed by continued inflows into global equities
2021-02-18;2021;February;REPORT;Negative;0.990441083908081;assets under management in investment funds had increased by more than 10 since early november 2020 at the same time stock prices could eventually become vulnerable to a rise in real yields globally
2021-02-18;2021;February;REPORT;Neutral;0.9769757390022278;the excess cape yield ie
2021-02-18;2021;February;REPORT;Neutral;0.9001981616020203;the inverse of the cyclically adjusted priceearnings ratio minus the real tenyear bond yield continued to be high at present meaning that investors had not necessarily lowered the premium they demanded for holding riskier assets
2021-02-18;2021;February;REPORT;Negative;0.9851426482200623;nonetheless a more sustained rise in real rates could rapidly lower the relative attractiveness of equities and thereby pose the risk of a more broadbased repricing
2021-02-18;2021;February;REPORT;Neutral;0.9695292115211487;such risks of price corrections were not evenly distributed across the equity universe
2021-02-18;2021;February;REPORT;Negative;0.984835684299469;the distribution of the priceearnings ratio across firms in the euro stoxx 50 index was currently much wider than it had been on average over the past 20 years also reflecting that the recovery remained highly uneven
2021-02-18;2021;February;REPORT;Neutral;0.9408708810806274;credit markets had shown a similar resilience to the risk of higher rates
2021-02-18;2021;February;REPORT;Negative;0.970035970211029;corporate credit spreads in the euro area had continued to narrow marginally over the past few weeks
2021-02-18;2021;February;REPORT;Positive;0.9024584889411926;the arrival of vaccines and the recalibration of measures decided upon by the governing council in december 2020 had fostered a further compression of risk premia in this market segment to levels close to those prevailing before the covid19 pandemic
2021-02-18;2021;February;REPORT;Positive;0.9683917164802551;in foreign exchange markets rising us government bond yields had interrupted the depreciation trend in the us dollar that had gained further momentum after the governing councils previous monetary policy meeting
2021-02-18;2021;February;REPORT;Negative;0.9902565479278564;since the georgia runoff elections the euro exchange rate versus the us dollar had dropped and had temporarily even fallen below the levels that had prevailed at the time of that monetary policy meeting
2021-02-18;2021;February;REPORT;Positive;0.8455458283424377;us real rates had been a key factor boosting global portfolio rebalancing and risktaking
2021-02-18;2021;February;REPORT;Negative;0.9811893701553345;so to the extent that investors saw the risks surrounding these rates as increasingly skewed to the upside an important driver behind recent exchange rate developments could lose steam
2021-02-18;2021;February;REPORT;Positive;0.9900367259979248;taken together the recent financial market developments had left a broadbased positive mark on financial conditions in the euro area
2021-02-18;2021;February;REPORT;Negative;0.8690683245658875;sovereign real yields had dropped spreads had remained resilient stock prices and inflation expectations had risen and the euro exchange rate versus the us dollar had reversed its appreciation trend
2021-02-18;2021;February;REPORT;Positive;0.975816547870636;this was a strong vote of confidence in the governing councils decision to focus on the duration of its policy support and on the preservation of favourable financing conditions to protect the current highly accommodative stance in an environment of continued high uncertainty
2021-02-18;2021;February;REPORT;Neutral;0.9768292307853699;the global environment and economic and monetary developments in the euro area mr lane reviewed the global environment and recent economic and monetary developments in the euro area
2021-02-18;2021;February;REPORT;Negative;0.9057954549789429;as regards the external environment the global recovery continued towards the end of the year although the slight fall in the global composite output purchasing managers index pmi to 535 in december signalled weakening momentum
2021-02-18;2021;February;REPORT;Positive;0.9921972155570984;despite a surge in new covid19 infections recent data and forecasts indicated an overall more optimistic outlook for global activity than previously expected based on stronger economic growth in the united states but also on strong economic data from china and the euuk trade deal
2021-02-18;2021;February;REPORT;Negative;0.9846426844596863;while the mediumterm outlook was improving rising covid19 cases and the resulting containment measures posed nearterm headwinds to growth until vaccinations contained the pandemic which was expected towards mid2021
2021-02-18;2021;February;REPORT;Neutral;0.8919894099235535;compared with the first wave of covid19 infections and containment measures in the spring of 2020 services had been affected less in november and december
2021-02-18;2021;February;REPORT;Positive;0.8757498264312744;trade developments had also been more resilient during the new wave of the pandemic
2021-02-18;2021;February;REPORT;Positive;0.9853169322013855;oil prices had continued the recovery that started in spring 2020 and had increased by 15 since the governing councils december monetary policy meeting to above usd 55 per barrel driven by higher demand as well as some factors limiting supply
2021-02-18;2021;February;REPORT;Negative;0.8186876773834229;at the same time the euro had appreciated slightly amid some volatility against the us dollar 02 but had depreciated slightly in effective terms 02 while commodity prices for metals and food had risen sharply supported by a strong rebound in commodity demand in the second half of 2020 turning to the euro area the more restrictive and extended lockdowns were weighing on the shortterm growth outlook
2021-02-18;2021;February;REPORT;Negative;0.9327115416526794;the economic impact of the pandemic continued to affect services in particular while manufacturing had remained resilient
2021-02-18;2021;February;REPORT;Positive;0.9912516474723816;according to the latest pmi data for december activity in the services sector had continued to shrink while manufacturing activity had continued to increase on the back of robust developments in global trade
2021-02-18;2021;February;REPORT;Negative;0.9826786518096924;the economic impact of the lockdowns seemed to have moderated compared with the first wave of the pandemic in spring 2020 according to the european commission survey confidence in the services sector was less subdued in most countries in the recent wave likely reflecting the fact that the economy had adapted better to the restrictions
2021-02-18;2021;February;REPORT;Negative;0.8181944489479065;fiscal transfers had continued to buffer euro area households disposable income in the second half of 2020 compensating for weak labour income
2021-02-18;2021;February;REPORT;Negative;0.9785445928573608;with many services unavailable during the lockdowns consumers were forced to save pushing up the household savings rate
2021-02-18;2021;February;REPORT;Neutral;0.3536517322063446;in terms of the distribution younger households were drawing more on their savings as their financial situation deteriorated while older households were more able to save
2021-02-18;2021;February;REPORT;Neutral;0.7407755851745605;whether and when these savings would be used for consumption in the future was likely to affect the outlook for the euro area economy over the coming quarters
2021-02-18;2021;February;REPORT;Negative;0.9464249014854431;with regard to labour market developments the euro area unemployment rate had stood at 83 in november 2020 01 percentage points lower than in october
2021-02-18;2021;February;REPORT;Negative;0.9959484934806824;labour demand remained weak overall and the job market was providing only limited opportunities for those looking for new jobs
2021-02-18;2021;February;REPORT;Positive;0.9774936437606812;at the same time job retention schemes especially shorttime work schemes had contained unemployment and helped to stabilise household incomes
2021-02-18;2021;February;REPORT;Negative;0.6651667356491089;turning to nominal developments hicp inflation and hicp inflation excluding food and energy hicpx remained at 03 and 02 respectively in december 2020 euro area inflation had fallen from prepandemic levels of above 1 and had remained persistently negative since august 2020 owing to developments not only in energy prices but also in goods and services prices
2021-02-18;2021;February;REPORT;Neutral;0.991952121257782;a broad range of measures of underlying inflation had moved sideways with measures excluding volatile items and indirect tax changes declining less since the beginning of the pandemic
2021-02-18;2021;February;REPORT;Negative;0.9889123439788818;most of the decline in nonenergy industrial goods inflation could be attributed to the weakness in clothing and footwear inflation which could be expected to be corrected to some extent after the pandemic
2021-02-18;2021;February;REPORT;Neutral;0.8514479994773865;negotiated wages had continued their broad sideways movement despite the large amounts of slack in the economy and the labour market as many wage agreements had been concluded before the pandemic
2021-02-18;2021;February;REPORT;Positive;0.917076587677002;looking ahead headline inflation was likely to turn positive again in january 2021 and to increase further over the course of the year with the phasingout of the temporary cut in the german valueadded tax vat rate from january 2021 being one factor
2021-02-18;2021;February;REPORT;Negative;0.9518324732780457;hicp weights were expected to change substantially in 2021 as a result of the changes in consumption patterns during the pandemic adding to the already elevated uncertainty surrounding the inflation outlook
2021-02-18;2021;February;REPORT;Neutral;0.9916103482246399;according to the survey of professional forecasters spf for the first quarter of 2021 inflation expectations were broadly unchanged
2021-02-18;2021;February;REPORT;Neutral;0.6312544345855713;hicp inflation was expected to stand at 09 in 2021 13 in 2022 and 15 in 2023 looking further ahead the spf continued to expect headline inflation five years ahead to reach 17
2021-02-18;2021;February;REPORT;Negative;0.9757422208786011;marketbased measures of longerterm inflation expectations had increased and the odds of very low inflation had declined
2021-02-18;2021;February;REPORT;Neutral;0.9793432950973511;reviewing the latest developments in euro area financial conditions the path of riskfree rates suggested that rate cut expectations were largely absent and longterm riskfree rates had increased
2021-02-18;2021;February;REPORT;Neutral;0.9891512393951416;risk assets had been stable and stood close to their precrisis levels
2021-02-18;2021;February;REPORT;Positive;0.9851230978965759;turning to money and credit developments money growth had been buoyant with the annual growth of m3 increasing from 105 in october 2020 to 110 in november
2021-02-18;2021;February;REPORT;Neutral;0.7700177431106567;eurosystem asset purchases remained the main source of money creation while the contribution of bank credit to the private sector had continued to moderate
2021-02-18;2021;February;REPORT;Negative;0.9900009632110596;the annual growth of loans to euro area nonfinancial corporations was still affected by the strong expansion of loans in the spring of 2020 and was broadly unchanged at 69 in november while shortterm loan dynamics had continued to weaken driven by both demand factors and supply factors
2021-02-18;2021;February;REPORT;Neutral;0.9877482652664185;the annual growth of loans to euro area households had remained broadly unchanged at 31 in november
2021-02-18;2021;February;REPORT;Negative;0.9925611615180969;based on the january 2021 bank lending survey bls for the euro area credit standards for loans to firms had tightened in the fourth quarter of 2020 driven by banks heightened risk perceptions and concerns about borrowers creditworthiness
2021-02-18;2021;February;REPORT;Negative;0.9915986061096191;banks expected a further tightening of credit standards for firms in the first quarter of 2021 reflecting continued uncertainty about the development of the pandemic and its effects on the credit risk of borrowers
2021-02-18;2021;February;REPORT;Neutral;0.6811057925224304;credit standards for loans to households for house purchase had continued to tighten in the fourth quarter of 2020 but less so than in the previous two quarters
2021-02-18;2021;February;REPORT;Neutral;0.9915575981140137;nominal costs of debt financing for nonfinancial corporations had been broadly unchanged in december at historically low levels
2021-02-18;2021;February;REPORT;Neutral;0.9696335196495056;turning to fiscal policies the fiscal support planned for 2021 was sizeable but would possibly be extended depending on the development of the pandemic against the background of strengthened and extended covid19related restrictions
2021-02-18;2021;February;REPORT;Positive;0.9902240633964539;from 2021 the next generation eu ngeu package was expected to provide a strong contribution particularly to public investment if ambitious government plans were fulfilled
2021-02-18;2021;February;REPORT;Positive;0.9846439361572266;monetary policy considerations and policy options summing up mr lane remarked that the launch of vaccination campaigns across the euro area was an important milestone in the resolution of the ongoing health crisis
2021-02-18;2021;February;REPORT;Negative;0.9939968585968018;however the nearterm outlook was challenging on account of the renewed surge in infections the emergence of virus mutations and the more restrictive containment measures imposed in many euro area countries over the past few months
2021-02-18;2021;February;REPORT;Negative;0.9546623826026917;the highfrequency data and incoming survey indicators for the fourth quarter of 2020 and the initial weeks of 2021 signalled a significant weakening in the services sector albeit to a lesser degree than during the first wave of the pandemic in spring 2020 activity in the manufacturing sector had continued its recovery supported by foreign demand
2021-02-18;2021;February;REPORT;Positive;0.7879666686058044;output was likely to have contracted in the fourth quarter of 2020 and the intensification of the pandemic posed some downside risks to output in the first quarter of 2021 looking beyond the first quarter there were reasons for cautious optimism about the prospect of a recovery in the course of 2021 in addition to the rollout of vaccination campaigns there were signs of an improvement in the global economic outlook
2021-02-18;2021;February;REPORT;Positive;0.988128125667572;furthermore the euuk trade deal was a positive development compared with the december 2020 eurosystem staff macroeconomic projections
2021-02-18;2021;February;REPORT;Negative;0.9869656562805176;at the same time uncertainty remained high especially relating to the dynamics of the pandemic and the timely implementation of vaccination campaigns
2021-02-18;2021;February;REPORT;Negative;0.752422034740448;inflation remained subdued amid weak demand and significant slack in labour and product markets with hicp and hicpx inflation unchanged in december at 03 and 02 respectively
2021-02-18;2021;February;REPORT;Negative;0.9901401400566101;although headline inflation was likely to increase in the coming months on the basis of current energy price dynamics and supported in part by the end of the temporary vat reduction in germany underlying price pressures were expected to remain muted owing to weak demand  notably in the tourism and travelrelated sectors  as well as to low wage pressures and the appreciation of the euro
2021-02-18;2021;February;REPORT;Neutral;0.9909977912902832;surveybased measures and marketbased indicators of longerterm inflation expectations remained at low levels although there had been a slight pickup in marketbased indicators of inflation expectations
2021-02-18;2021;February;REPORT;Positive;0.9926028847694397;financial market sentiment had remained positive underpinned by ample fiscal and monetary policy support and amid global reflation hopes that had been fuelled by expectations of substantial us fiscal stimulus
2021-02-18;2021;February;REPORT;Neutral;0.9912541508674622;in currency markets developments in the euro exchange rate should continue to be monitored with regard to their possible implications for the mediumterm inflation outlook
2021-02-18;2021;February;REPORT;Positive;0.6231870651245117;in broad terms financing conditions in the euro area were generally supportive for both the bond market and bank lending
2021-02-18;2021;February;REPORT;Neutral;0.6609722971916199;nonetheless it was important to monitor the recent increase in nominal riskfree rates which could be attributed to the spillover from the more substantial increase in us yields
2021-02-18;2021;February;REPORT;Neutral;0.9187203645706177;looking ahead assessing the impact of upward pressure on nominal yields on the favourability of financing conditions would be an important task in the context of future updates to the inflation outlook
2021-02-18;2021;February;REPORT;Neutral;0.7992503046989441;in assessing the favourability of financing conditions it would also be important to bear in mind the continued net tightening of credit standards that had been reported in the january bls
2021-02-18;2021;February;REPORT;Positive;0.9797134399414062;ample monetary policy support remained essential
2021-02-18;2021;February;REPORT;Positive;0.7943730354309082;the comprehensive policy package announced in december would contribute to preserving favourable financing conditions over the pandemic period
2021-02-18;2021;February;REPORT;Positive;0.9891020655632019;this would help to reduce uncertainty and bolster confidence encouraging consumer spending and business investment underpinning economic activity and safeguarding mediumterm price stability
2021-02-18;2021;February;REPORT;Negative;0.968014657497406;overall the risks surrounding the euro area growth outlook remained tilted to the downside but had become less pronounced
2021-02-18;2021;February;REPORT;Positive;0.9907417297363281;the news about the global economy the agreement on future euuk relations and the launch of vaccination campaigns was encouraging
2021-02-18;2021;February;REPORT;Negative;0.9875922799110413;however the ongoing pandemic and its implications for economic and financial conditions continued to be sources of downside risk
2021-02-18;2021;February;REPORT;Neutral;0.9892796874046326;against this background mr lane proposed that the governing council should reconfirm its existing monetary policy measures
2021-02-18;2021;February;REPORT;Positive;0.8137366771697998;in its communication the governing council needed to i highlight that the incoming data confirmed the december baseline assessment of a pronounced nearterm impact of the pandemic on the economy and a protracted weakness in inflation ii emphasise that ample monetary stimulus remained essential to preserve favourable financing conditions over the pandemic period for all sectors of the economy iii stress that this would help to reduce uncertainty and bolster confidence which would encourage consumer spending and business investment underpin economic activity and safeguard mediumterm price stability iv reiterate that it would purchase flexibly under the pepp according to market conditions and with a view to preventing a tightening of financing conditions that was inconsistent with countering the downward impact of the pandemic on the projected path of inflation and v reiterate that it continued to stand ready to adjust all of its instruments as appropriate to ensure that inflation moved towards its aim in a sustained manner in line with the commitment to symmetry
2021-02-18;2021;February;REPORT;Neutral;0.9889533519744873;2 governing councils discussion and monetary policy decisions economic and monetary analyses with regard to the economic analysis members generally agreed with the assessment of the current economic situation in the euro area and the risks to activity provided by mr lane in his introduction
2021-02-18;2021;February;REPORT;Negative;0.9840865731239319;overall the incoming data confirmed the previous baseline assessment of a pronounced nearterm impact of the pandemic on the economy and a protracted weakness in inflation
2021-02-18;2021;February;REPORT;Positive;0.9910168647766113;as regards the external environment members also broadly shared the assessment provided by mr lane in his introduction that there were signs of an improvement in the global economic outlook
2021-02-18;2021;February;REPORT;Positive;0.9899927973747253;in particular attention was drawn to positive news on the evolution of trade and growth in china and other asian economies to the additional us fiscal stimulus package and the final results of the us elections which could lead to substantial further fiscal stimulus and to the successful conclusion of an euuk trade agreement
2021-02-18;2021;February;REPORT;Negative;0.9880241751670837;on the geopolitical front it appeared that there was less uncertainty on the whole
2021-02-18;2021;February;REPORT;Negative;0.9899780750274658;at the same time the pandemic and the ongoing public health crisis continued to pose serious risks to the global economy
2021-02-18;2021;February;REPORT;Positive;0.9870922565460205;turning to euro area developments following a sharp contraction in the first half of 2020 euro area real gdp had rebounded strongly rising by 124 quarter on quarter in the third quarter although remaining well below prepandemic levels
2021-02-18;2021;February;REPORT;Negative;0.9918049573898315;members considered that incoming economic data surveys and highfrequency indicators suggested that the resurgence of the pandemic and the associated intensification of containment measures had likely led to a decline in activity in the fourth quarter of 2020 although this was less pronounced than had been envisaged in the december 2020 eurosystem staff macroeconomic projections
2021-02-18;2021;February;REPORT;Negative;0.9157237410545349;conversely the recent intensification of the pandemic was expected to weigh more heavily on activity in the first quarter of 2021 than had been foreseen earlier
