Date;Year;Month;Type;sentiment;sentiment_score;sentence
2013-01-30;2013;January;Minute;Neutral;0.9884985089302063;the committee directs the desk to maintain its policy of rolling over maturing treasury securities into new issues and its policy of reinvesting principal payments on all agency debt and agency mortgagebacked securities in agency mortgagebacked securities
2013-01-30;2013;January;Minute;Neutral;0.9879816174507141;the system open market account manager and the secretary will keep the committee informed of ongoing developments regarding the systems balance sheet that could affect the attainment over time of the committees objectives of maximum employment and price stability
2013-01-30;2013;January;Minute;Neutral;0.9910176992416382;similarly one member raised a question about whether the statement language adequately captured the importance of the committees assessment of the likely efficacy and costs in its asset purchase decisions but the committee decided to maintain the current language pending a review planned for the march meeting of its asset purchases
2013-01-30;2013;January;Minute;Negative;0.9911206364631653;although members saw strains in global financial markets as having eased somewhat they continued to see an increase in such strains as well as slower global growth and a greaterthanexpected fiscal tightening in the united states as downside risks to the economy
2013-01-30;2013;January;Minute;Neutral;0.4791789948940277;however members generally expected that with appropriately accommodative monetary policy economic growth would proceed at a moderate pace and the unemployment rate would gradually decline toward levels they judged to be consistent with the committees dual mandate
2013-01-30;2013;January;Minute;Negative;0.993564784526825;employment had continued to expand at a moderate pace but the unemployment rate remained elevated
2013-01-30;2013;January;Minute;Negative;0.9944416880607605;however many participants also expressed some concerns about potential costs and risks arising from further asset purchases
2013-01-30;2013;January;Minute;Negative;0.8202427625656128;several participants discussed the possible complications that additional purchases could cause for the eventual withdrawal of policy accommodation a few mentioned the prospect of inflationary risks and some noted that further asset purchases could foster market behavior that could undermine financial stability
2013-01-30;2013;January;Minute;Neutral;0.9838864207267761;several participants noted that a very large portfolio of longduration assets would under certain circumstances expose the federal reserve to significant capital losses when these holdings were unwound but others pointed to offsetting factors and one noted that losses would not impede the effective operation of monetary policy
2013-01-30;2013;January;Minute;Negative;0.9935516119003296;a few also raised concerns about the potential effects of further asset purchases on the functioning of particular financial markets although a couple of other participants noted that there had been little evidence to date of such effects
2013-01-30;2013;January;Minute;Neutral;0.9891340136528015;in light of this discussion the staff was asked for additional analysis ahead of future meetings to support the committees ongoing assessment of the asset purchase program
2013-01-30;2013;January;Minute;Neutral;0.9933058619499207;several participants emphasized that the committee should be prepared to vary the pace of asset purchases either in response to changes in the economic outlook or as its evaluation of the efficacy and costs of such purchases evolved
2013-01-30;2013;January;Minute;Neutral;0.9927005171775818;for example one participant argued that purchases should vary incrementally from meeting to meeting in response to incoming information about the economy
2013-01-30;2013;January;Minute;Positive;0.5122843384742737;a number of participants stated that an ongoing evaluation of the efficacy costs and risks of asset purchases might well lead the committee to taper or end its purchases before it judged that a substantial improvement in the outlook for the labor market had occurred
2013-01-30;2013;January;Minute;Positive;0.6294960379600525;several others argued that the potential costs of reducing or ending asset purchases too soon were also significant or that asset purchases should continue until a substantial improvement in the labor market outlook had occurred
2013-01-30;2013;January;Minute;Positive;0.9067952036857605;a few participants noted examples of past instances in which policymakers had prematurely removed accommodation with adverse effects on economic growth employment and price stability they also stressed the importance of communicating the committees commitment to maintaining a highly accommodative stance of policy as long as warranted by economic conditions
2013-01-30;2013;January;Minute;Neutral;0.9685431122779846;in this regard a number of participants discussed the possibility of providing monetary accommodation by holding securities for a longer period than envisioned in the committees exit principles either as a supplement to or a replacement for asset purchases
2013-01-30;2013;January;Minute;Neutral;0.9893966913223267;participants also discussed the economic thresholds in the committees forward guidance on the path of the federal funds rate
2013-01-30;2013;January;Minute;Neutral;0.980494499206543;on the whole participants judged that financial markets had adapted to the shift from datebased communication to guidance based on economic thresholds without difficulty although a few participants stated that communications challenges remained
2013-01-30;2013;January;Minute;Neutral;0.5100017189979553;for example one participant commented that some market participants appeared to have incorrectly interpreted the thresholds as triggers that when reached would necessarily lead to an immediate rise in the federal funds rate
2013-01-30;2013;January;Minute;Neutral;0.9932061433792114;a couple of participants noted that this policy tool would be more effective if the committee were able to communicate a consensus expectation for the path of the federal funds rate after a threshold was crossed
2013-01-30;2013;January;Minute;Neutral;0.9565526247024536;one participant also indicated a preference for lowering the threshold for the unemployment rate as a means of providing additional accommodation
2013-01-30;2013;January;Minute;Negative;0.9950528740882874;committee policy action committee members saw the information received over the intermeeting period as suggesting that growth in economic activity had paused in recent months in large part because of weatherrelated disruptions and other transitory factors
2013-01-30;2013;January;Minute;Negative;0.9948132038116455;the vote encompassed approval of the statement below to be released at 215 pm information received since the federal open market committee met in december suggests that growth in economic activity paused in recent months in large part because of weatherrelated disruptions and other transitory factors
2013-01-30;2013;January;Minute;Negative;0.9905960559844971;in this regard several participants stressed the economic and social costs of high unemployment as well as the potential for negative effects on the economys longerterm path of a prolonged period of underutilization of resources
2013-01-30;2013;January;Minute;Negative;0.9928024411201477;employment has continued to expand at a moderate pace but the unemployment rate remains elevated
2013-01-30;2013;January;Minute;Negative;0.6546517610549927;inflation has been running somewhat below the committees longerrun objective apart from temporary variations that largely reflect fluctuations in energy prices
2013-01-30;2013;January;Statement;Neutral;0.8732967972755432;consistent with its statutory mandate the committee seeks to foster maximum employment and price stability
2013-01-30;2013;January;Statement;Negative;0.5387471914291382;the committee expects that with appropriate policy accommodation economic growth will proceed at a moderate pace and the unemployment rate will gradually decline toward levels the committee judges consistent with its dual mandate
2013-01-30;2013;January;Statement;Negative;0.9930554032325745;although strains in global financial markets have eased somewhat the committee continues to see downside risks to the economic outlook
2013-01-30;2013;January;Statement;Neutral;0.9651286005973816;the committee also anticipates that inflation over the medium term likely will run at or below its 2 percent objective
2013-01-30;2013;January;Statement;Positive;0.9018937945365906;to support a stronger economic recovery and to help ensure that inflation over time is at the rate most consistent with its dual mandate the committee will continue purchasing additional agency mortgagebacked securities at a pace of 40 billion per month and longerterm treasury securities at a pace of 45 billion per month
2013-01-30;2013;January;Statement;Neutral;0.9871074557304382;the committee is maintaining its existing policy of reinvesting principal payments from its holdings of agency debt and agency mortgagebacked securities in agency mortgagebacked securities and of rolling over maturing treasury securities at auction
2013-01-30;2013;January;Statement;Positive;0.9868695139884949;taken together these actions should maintain downward pressure on longerterm interest rates support mortgage markets and help to make broader financial conditions more accommodative
2013-01-30;2013;January;Statement;Positive;0.9655691385269165;longerterm inflation expectations have remained stable
2013-01-30;2013;January;Statement;Neutral;0.9840449094772339;the committee will closely monitor incoming information on economic and financial developments in coming months
2013-01-30;2013;January;Statement;Neutral;0.9903820157051086;in determining the size pace and composition of its asset purchases the committee will as always take appropriate account of the likely efficacy and costs of such purchases
2013-01-30;2013;January;Statement;Positive;0.9747303128242493;to support continued progress toward maximum employment and price stability the committee expects that a highly accommodative stance of monetary policy will remain appropriate for a considerable time after the asset purchase program ends and the economic recovery strengthens
2013-01-30;2013;January;Statement;Positive;0.9831171035766602;in particular the committee decided to keep the target range for the federal funds rate at 0 to 14 percent and currently anticipates that this exceptionally low range for the federal funds rate will be appropriate at least as long as the unemployment rate remains above 612 percent inflation between one and two years ahead is projected to be no more than a half percentage point above the committees 2 percent longerrun goal and longerterm inflation expectations continue to be well anchored
2013-01-30;2013;January;Statement;Neutral;0.9889450669288635;in determining how long to maintain a highly accommodative stance of monetary policy the committee will also consider other information including additional measures of labor market conditions indicators of inflation pressures and inflation expectations and readings on financial developments
2013-01-30;2013;January;Statement;Neutral;0.9936867356300354;when the committee decides to begin to remove policy accommodation it will take a balanced approach consistent with its longerrun goals of maximum employment and inflation of 2 percent
2013-01-30;2013;January;Statement;Neutral;0.9644071459770203;voting for the fomc monetary policy action were ben s bernanke chairman william c dudley vice chairman james bullard elizabeth a duke charles l evans jerome h powell sarah bloom raskin eric s rosengren jeremy c stein daniel k tarullo and janet l yellen
2013-01-30;2013;January;Minute;Negative;0.972317636013031;risk spreads on speculativegrade bonds narrowed substantially and spreads on investmentgrade bonds decreased as well
2013-01-30;2013;January;Statement;Neutral;0.9473351240158081;if the outlook for the labor market does not improve substantially the committee will continue its purchases of treasury and agency mortgagebacked securities and employ its other policy tools as appropriate until such improvement is achieved in a context of price stability
2013-01-30;2013;January;Statement;Negative;0.6614285707473755;inflation has been running somewhat below the committees longerrun objective apart from temporary variations that largely reflect fluctuations in energy prices
2013-01-30;2013;January;Statement;Negative;0.9870045781135559;voting against the action was esther l george who was concerned that the continued high level of monetary accommodation increased the risks of future economic and financial imbalances and over time could cause an increase in longterm inflation expectations
2013-01-30;2013;January;Statement;Negative;0.9928024411201477;employment has continued to expand at a moderate pace but the unemployment rate remains elevated
2013-01-30;2013;January;Minute;Positive;0.9655691385269165;longerterm inflation expectations have remained stable
2013-01-30;2013;January;Minute;Neutral;0.8732967972755432;consistent with its statutory mandate the committee seeks to foster maximum employment and price stability
2013-01-30;2013;January;Minute;Negative;0.5387471914291382;the committee expects that with appropriate policy accommodation economic growth will proceed at a moderate pace and the unemployment rate will gradually decline toward levels the committee judges consistent with its dual mandate
2013-01-30;2013;January;Minute;Negative;0.9930554032325745;although strains in global financial markets have eased somewhat the committee continues to see downside risks to the economic outlook
2013-01-30;2013;January;Minute;Neutral;0.9651286005973816;the committee also anticipates that inflation over the medium term likely will run at or below its 2 percent objective
2013-01-30;2013;January;Minute;Positive;0.9018937945365906;to support a stronger economic recovery and to help ensure that inflation over time is at the rate most consistent with its dual mandate the committee will continue purchasing additional agency mortgagebacked securities at a pace of 40 billion per month and longerterm treasury securities at a pace of 45 billion per month
2013-01-30;2013;January;Minute;Neutral;0.9871074557304382;the committee is maintaining its existing policy of reinvesting principal payments from its holdings of agency debt and agency mortgagebacked securities in agency mortgagebacked securities and of rolling over maturing treasury securities at auction
2013-01-30;2013;January;Minute;Positive;0.9868695139884949;taken together these actions should maintain downward pressure on longerterm interest rates support mortgage markets and help to make broader financial conditions more accommodative
2013-01-30;2013;January;Minute;Neutral;0.9840449094772339;the committee will closely monitor incoming information on economic and financial developments in coming months
2013-01-30;2013;January;Minute;Neutral;0.9473351240158081;if the outlook for the labor market does not improve substantially the committee will continue its purchases of treasury and agency mortgagebacked securities and employ its other policy tools as appropriate until such improvement is achieved in a context of price stability
2013-01-30;2013;January;Minute;Neutral;0.9903820157051086;in determining the size pace and composition of its asset purchases the committee will as always take appropriate account of the likely efficacy and costs of such purchases
2013-01-30;2013;January;Minute;Positive;0.9747303128242493;to support continued progress toward maximum employment and price stability the committee expects that a highly accommodative stance of monetary policy will remain appropriate for a considerable time after the asset purchase program ends and the economic recovery strengthens
2013-01-30;2013;January;Minute;Positive;0.9832518100738525;in particular the committee decided to keep the target range for the federal funds rate at 0 to 14 percent and currently anticipates that this exceptionally low range for the federal funds rate will be appropriate at least as long as the unemployment rate remains above 612 percent inflation between one and two years ahead is projected to be no more than a half percentage point above the committees 2 percent longerrun goal and longerterm inflation expectations continue to be well anchored
2013-01-30;2013;January;Minute;Neutral;0.9889450669288635;in determining how long to maintain a highly accommodative stance of monetary policy the committee will also consider other information including additional measures of labor market conditions indicators of inflation pressures and inflation expectations and readings on financial developments
2013-01-30;2013;January;Minute;Neutral;0.9936867356300354;when the committee decides to begin to remove policy accommodation it will take a balanced approach consistent with its longerrun goals of maximum employment and inflation of 2 percent
2013-01-30;2013;January;Minute;Neutral;0.882091224193573;voting for this
2013-01-30;2013;January;Statement;Negative;0.9944242835044861;information received since the federal open market committee met in december suggests that growth in economic activity paused in recent months in large part because of weatherrelated disruptions and other transitory factors
2013-01-30;2013;January;Minute;Positive;0.9904858469963074;household spending and business fixed investment advanced and the housing sector has shown further improvement
2013-01-30;2013;January;Minute;Positive;0.9848757386207581;policy was also aimed at improving the labor market outlook
2013-01-30;2013;January;Statement;Positive;0.9904858469963074;household spending and business fixed investment advanced and the housing sector has shown further improvement
2013-01-30;2013;January;Minute;Positive;0.9430963397026062;most participants commented that the committees asset purchases had been effective in easing financial conditions and helping stimulate economic activity and many pointed in particular to the support that low longerterm interest rates had provided to housing or consumer durable purchases
2013-01-30;2013;January;Minute;Neutral;0.98201984167099;at its january meeting the bank of japan restated its monetary policy framework replacing its inflation goal of 1 percent with an inflation target of 2 percent and announced it would commence a program of asset purchases in january 2014 with no predetermined limit on the maximum amount ultimately purchased
2013-01-30;2013;January;Minute;Positive;0.8889662027359009;yields on longterm japanese sovereign bonds rose a few basis points on net over the intermeeting period but yields on other foreign benchmark sovereign bonds increased more reflecting both the improvement in global sentiment and reduced expectations for additional monetary accommodation as the european central bank and the bank of england kept their policy rates on hold and appeared to signal less likelihood of further easing
2013-01-30;2013;January;Minute;Neutral;0.8537612557411194;staff economic outlook in the economic forecast prepared by the staff for the january meeting of the fomc the nearterm projection for real gdp growth was revised up in large part because the fiscal policy legislation enacted in early january was slightly less restrictive than the staff had assumed
2013-01-30;2013;January;Minute;Neutral;0.9850755929946899;the staffs mediumterm forecast for real gdp growth was essentially unchanged
2013-01-30;2013;January;Minute;Negative;0.5452467799186707;with fiscal policy still anticipated to be tighter this year than last year the staff expected that increases in real gdp would only moderately exceed the growth rate of potential output
2013-01-30;2013;January;Minute;Positive;0.9915173053741455;in 2014 and 2015 real gdp was projected to accelerate gradually supported by an eventual lessening of fiscal policy restraint increases in consumer and business sentiment further improvements in credit availability and financial conditions and accommodative monetary policy
2013-01-30;2013;January;Minute;Positive;0.9907376170158386;the expansion in economic activity was expected to slowly reduce the slack in labor and product markets over the projection period and progress in reducing the unemployment rate was anticipated to be gradual
2013-01-30;2013;January;Minute;Neutral;0.9588728547096252;the yens depreciation appeared to occur in part in response to statements from japans new prime minister who urged the bank of japan to ease policy more aggressively
2013-01-30;2013;January;Minute;Neutral;0.9772403836250305;the staffs forecast for inflation was little changed from that prepared for the december fomc meeting
2013-01-30;2013;January;Minute;Negative;0.9802098870277405;participants views on current conditions and the economic outlook in their discussion of the economic situation meeting participants indicated that they viewed the information received during the intermeeting period as suggesting that apart from some temporary factors that had led to a pause in overall output growth in recent months the economy remained on a moderate growth path
2013-01-30;2013;January;Minute;Positive;0.9608713984489441;in particular participants saw the economic outlook as little changed or modestly improved relative to the december meeting
2013-01-30;2013;January;Minute;Negative;0.9604382514953613;most participants judged that there had been some reduction in downside risks facing the economy strains in global financial markets had eased somewhat and us fiscal policymakers had come to a partial resolution of the socalled fiscal cliff
2013-01-30;2013;January;Minute;Positive;0.9734572172164917;supported by a highly accommodative stance of monetary policy the housing sector was strengthening and the unemployment rate appeared likely to continue its gradual decline
2013-01-30;2013;January;Minute;Neutral;0.9152526259422302;nearly all participants anticipated that inflation over the mediumterm would run at or below the committees 2 percent objective
2013-01-30;2013;January;Minute;Neutral;0.8268329501152039;in their discussion of the household sector participants noted various factors influencing consumer spending
2013-01-30;2013;January;Minute;Positive;0.9881802797317505;some participants stated that low interest rates appeared to be contributing to strong sales of autos or more generally of consumer durables
2013-01-30;2013;January;Minute;Positive;0.7969233393669128;the staff continued to project that inflation would be subdued through 2015 that forecast is based on the expectation that crude oil prices will trend down slowly from their current levels the boost to retail food prices from last summers drought will be temporary and relatively small longerrun inflation expectations will remain stable and significant resource slack will persist over the forecast period
2013-01-30;2013;January;Minute;Neutral;0.6228476166725159;against the yen however the dollar appreciated substantially
2013-01-30;2013;January;Minute;Positive;0.9747495651245117;as global risk sentiment improved the dollar depreciated against the euro and most emerging market currencies
2013-01-30;2013;January;Minute;Positive;0.4149622619152069;on net global equity prices rose and euroarea peripheral spreads narrowed
2013-01-30;2013;January;Minute;Neutral;0.9165582656860352;outstanding volumes of corporate bonds commercial and industrial loans and nonfinancial commercial paper all expanded
2013-01-30;2013;January;Minute;Positive;0.9462426900863647;in addition the committees highly accommodative policy was seen as helping keep inflation over the medium term closer to its longerrun goal of 2 percent than would otherwise have been the case
2013-01-30;2013;January;Minute;Negative;0.9897449612617493;the pace of gross public issuance of equity by nonfinancial firms remained solid in the fourth quarter but it was subdued in january likely because of seasonal factors
2013-01-30;2013;January;Minute;Negative;0.9939849972724915;conditions in the commercial real estate sector continued to be strained amid elevated vacancy and delinquency rates
2013-01-30;2013;January;Minute;Positive;0.9001424908638;however issuance of commercial mortgagebacked securities strengthened during the fourth quarter and spreads on those securities narrowed over the intermeeting period
2013-01-30;2013;January;Minute;Positive;0.967592716217041;conforming home mortgage rates edged up on net after touching new lows during the intermeeting period
2013-01-30;2013;January;Minute;Positive;0.9258682727813721;yields on residential mortgagebacked securities mbs rose by more leaving the spread between the primary mortgage rate and mbs yields narrower
2013-01-30;2013;January;Minute;Negative;0.9620572328567505;mortgage refinancing originations in december and january stayed near their highest levels since the housing market began to recover
2013-01-30;2013;January;Minute;Positive;0.8649030327796936;the share of existing mortgages that were seriously delinquent edged down in october and november but remained high
2013-01-30;2013;January;Minute;Positive;0.9616015553474426;consumer credit expanded briskly again in october and november
2013-01-30;2013;January;Minute;Positive;0.9912785887718201;nonrevolving credit continued to increase at a robust pace because of growth in student and auto loans while revolving credit moved roughly sideways
2013-01-30;2013;January;Minute;Negative;0.9958094358444214;growth of bank credit in the fourth quarter slowed to about half its pace compared with earlier in the year as loan growth declined
