Date;Year;Month;Type;sentiment;sentiment_score;sentence
2013-01-30;2013;January;Minute;Neutral;0.9885349869728088;authorization for foreign currency operations amended effective on january 29 2013 1 the federal open market committee authorizes and directs the federal reserve bank of new york for the system open market account to the extent necessary to carry out the committees foreign currency directive and express authorizations by the committee pursuant thereto and in conformity with such procedural instructions as the committee may issue from time to time a to purchase and sell the following foreign currencies in the form of cable transfers through spot or forward transactions on the open market at home and abroad including transactions with the us treasury with the us exchange stabilization fund established by section 10 of the gold reserve act of 1934 with foreign monetary authorities with the bank for international settlements and with other international financial institutions australian dollars brazilian reais canadian dollars danish kroner euro japanese yen korean won mexican pesos new zealand dollars norwegian kroner pounds sterling singapore dollars swedish kronor swiss francs b to hold balances of and to have outstanding forward contracts to receive or to deliver the foreign currencies listed in paragraph a above
2013-01-30;2013;January;Minute;Neutral;0.9792113304138184;c to draw foreign currencies and to permit foreign banks to draw dollars under the reciprocal currency arrangements listed in paragraph 2 below provided that drawings by either party to any such arrangement shall be fully liquidated within 12 months after any amount outstanding at that time was first drawn unless the committee because of exceptional circumstances specifically authorizes a delay
2013-01-30;2013;January;Minute;Neutral;0.9868277311325073;d to maintain an overall open position in all foreign currencies not exceeding 250 billion
2013-01-30;2013;January;Minute;Neutral;0.9863057136535645;consistent with committee practice the chairman if feasible will consult with the committee before making any instruction under this paragraph
2013-01-30;2013;January;Minute;Neutral;0.9890426993370056;these transactions shall be conducted with prior notice to the committee
2013-01-30;2013;January;Minute;Neutral;0.9768012762069702;the outstanding amount of such transactions of the type described in paragraph 1b shall not exceed 5 billion at any given time
2013-01-30;2013;January;Minute;Neutral;0.9778895974159241;the aggregate par value of such transactions of the type described in paragraph 1a shall not exceed 5 billion per calendar year
2013-01-30;2013;January;Minute;Neutral;0.9901037812232971;annual organizational matters2 in the agenda for this meeting it was reported that advices of the election of the following members and alternate members of the federal open market committee for a term beginning january 29 2013 had been received and that these individuals had executed their oaths of office
2013-01-30;2013;January;Minute;Neutral;0.941109299659729;the elected members and alternate members were as follows william c dudley president of the federal reserve bank of new york with christine cumming first vice president of the federal reserve bank of new york as alternate
2013-01-30;2013;January;Minute;Neutral;0.9025458693504333;eric rosengren president of the federal reserve bank of boston with charles i plosser president of the federal reserve bank of philadelphia as alternate
2013-01-30;2013;January;Minute;Neutral;0.911549985408783;charles l evans president of the federal reserve bank of chicago with sandra pianalto president of the federal reserve bank of cleveland as alternate
2013-01-30;2013;January;Minute;Neutral;0.9107652902603149;james bullard president of the federal reserve bank of st louis with richard w fisher president of the federal reserve bank of dallas as alternate
2013-01-30;2013;January;Minute;Neutral;0.9247583746910095;esther l george president of the federal reserve bank of kansas city with narayana kocherlakota president of the federal reserve bank of minneapolis as alternate
2013-01-30;2013;January;Minute;Neutral;0.9460728168487549;by unanimous vote the following officers of the federal open market committee were selected to serve until the selection of their successors at the first regularly scheduled meeting of the committee in 2014 ben bernanke chairman william c dudley vice chairman william b english secretary and economist deborah j danker deputy secretary matthew m luecke assistant secretary david w skidmore assistant secretary michelle a smith assistant secretary scott g alvarez general counsel thomas c baxter deputy general counsel richard m ashton assistant general counsel steven b kamin economist david w wilcox economist thomas a connors troy davig michael p leahy james j mcandrews stephen a meyer david reifschneider daniel g sullivan geoffrey tootell christopher j waller william wascher associate economists by unanimous vote the federal reserve bank of new york was selected to execute transactions for the system open market account
2013-01-30;2013;January;Minute;Neutral;0.9805877804756165;by unanimous vote simon potter was selected to serve at the pleasure of the committee as manager system open market account on the understanding that his selection was subject to being satisfactory to the federal reserve bank of new york
2013-01-30;2013;January;Minute;Neutral;0.961624801158905;secretarys note advice subsequently was received that the selection of mr potter as manager was satisfactory to the federal reserve bank of new york
2013-01-30;2013;January;Minute;Neutral;0.9746153354644775;by unanimous vote the authorization for domestic open market operations was approved with two amendments
2013-01-30;2013;January;Minute;Neutral;0.9889674782752991;the first broadened the actions that the open market desk may take at the chairmans instruction during an intermeeting period to include transactions to address temporary disruptions of an operational or highly unusual nature in us dollar funding markets
2013-01-30;2013;January;Minute;Negative;0.9859398603439331;for example if secured funding rates were to increase to high levels in the wake of a natural disaster the risk of a broader more systemic disruption to the functioning of asset markets could result
2013-01-30;2013;January;Minute;Negative;0.9046920537948608;in this case the prospect that repurchase operations could potentially alleviate some of the market strains might warrant immediate action
2013-01-30;2013;January;Minute;Neutral;0.9884166121482849;consistent with committee practice the chairman if feasible would consult with the committee before making any such instruction
2013-01-30;2013;January;Minute;Neutral;0.9892497062683105;the second amendment harmonized the language referring to the committees longerrun objectives with that in the committees statement on longerrun goals and monetary policy strategy
2013-01-30;2013;January;Minute;Neutral;0.8816870450973511;the guidelines for the conduct of system open market operations in federalagency issues remained suspended
2013-01-30;2013;January;Minute;Neutral;0.9861656427383423;authorization for domestic open market operations amended effective on january 29 2013 1 the federal open market committee authorizes and directs the federal reserve bank of new york to the extent necessary to carry out the most recent domestic policy directive adopted at a meeting of the committee a to buy or sell us government securities including securities of the federal financing bank and securities that are direct obligations of or fully guaranteed as to principal and interest by any agency of the united states in the open market from or to securities dealers and foreign and international accounts maintained at the federal reserve bank of new york on a cash regular or deferred delivery basis for the system open market account at market prices and for such account to exchange maturing us government and federal agency securities with the treasury or the individual agencies or to allow them to mature without replacement and b to buy or sell in the open market us government securities and securities that are direct obligations of or fully guaranteed as to principal and interest by any agency of the united states for the system open market account under agreements to resell or repurchase such securities or obligations including such transactions as are commonly referred to as repo and reverse repo transactions in 65 business days or less at rates that unless otherwise expressly authorized by the committee shall be determined by competitive bidding after applying reasonable limitations on the volume of agreements with individual counterparties
2013-01-30;2013;January;Minute;Neutral;0.9893301129341125;for this purpose the overall open position in all foreign currencies is defined as the sum disregarding signs of net positions in individual currencies excluding changes in dollar value due to foreign exchange rate movements and interest accruals
2013-01-30;2013;January;Minute;Neutral;0.980324923992157;mr tarullo abstained because he did not think the statement had advanced the cause of achieving or communicating greater consensus in the policy views of the committee
2013-01-30;2013;January;Minute;Neutral;0.9888685941696167;the net position in a single foreign currency is defined as holdings of balances in that currency plus outstanding contracts for future receipt minus outstanding contracts for future delivery of that currency ie as the sum of these elements with due regard to sign
2013-01-30;2013;January;Minute;Neutral;0.9893088340759277;3 all transactions in foreign currencies undertaken under paragraph 1a above shall unless otherwise expressly authorized by the committee be at prevailing market rates
2013-01-30;2013;January;Minute;Neutral;0.9807115197181702;c any operation that might generate a substantial volume of trading in a particular currency by the system even though the change in the systems net position in that currency might be less than the limits specified in 1b
2013-01-30;2013;January;Minute;Neutral;0.980781078338623;d any swap drawing proposed by a foreign bank not exceeding the larger of i 200 million or ii 15 percent of the size of the swap arrangement
2013-01-30;2013;January;Minute;Neutral;0.991287887096405;2 the manager shall clear with the committee or with the subcommittee if the subcommittee believes that consultation with the full committee is not feasible in the time available or with the chairman if the chairman believes that consultation with the subcommittee is not feasible in the time available a any operation that would result in a change in the systems overall open position in foreign currencies exceeding 15 billion since the most recent regular meeting of the committee
2013-01-30;2013;January;Minute;Neutral;0.978226363658905;b any swap drawing proposed by a foreign bank exceeding the larger of i 200 million or ii 15 percent of the size of the swap arrangement
2013-01-30;2013;January;Minute;Neutral;0.9859132170677185;3 the manager shall also consult with the subcommittee or the chairman about proposed swap drawings by the system and about any operations that are not of a routine character
2013-01-30;2013;January;Minute;Neutral;0.9873451590538025;4 the federal open market committee authorizes the federal reserve bank of new york to undertake transactions of the type described in paragraphs 1 2 and 5 of the foreign authorization and foreign exchange and investment transactions that it may be otherwise authorized to undertake from time to time for the purpose of testing operational readiness
2013-01-30;2013;January;Minute;Neutral;0.9786994457244873;the aggregate amount of such transactions shall not exceed 25 billion per calendar year
2013-01-30;2013;January;Minute;Neutral;0.9844581484794617;b any operation that would result in a change on any day in the systems net position in a single foreign currency exceeding 150 million or 300 million when the operation is associated with repayment of swap drawings
2013-01-30;2013;January;Minute;Neutral;0.9890426993370056;these transactions shall be conducted with prior notice to the committee
2013-01-30;2013;January;Minute;Neutral;0.9854543209075928;2 to achieve this end the system shall a undertake spot and forward purchases and sales of foreign exchange
2013-01-30;2013;January;Minute;Neutral;0.9735816121101379;b maintain reciprocal currency swap arrangements with selected foreign central banks
2013-01-30;2013;January;Minute;Neutral;0.9803426861763;c cooperate in other respects with central banks of other countries and with international monetary institutions
2013-01-30;2013;January;Minute;Neutral;0.9896832704544067;3 transactions may also be undertaken a to adjust system balances in light of probable future needs for currencies
2013-01-30;2013;January;Minute;Neutral;0.967158854007721;b to provide means for meeting system and treasury commitments in particular currencies and to facilitate operations of the exchange stabilization fund
2013-01-30;2013;January;Minute;Neutral;0.9856696724891663;c for such other purposes as may be expressly authorized by the committee
2013-01-30;2013;January;Minute;Neutral;0.9870411157608032;4 system foreign currency operations shall be conducted a in close and continuous consultation and cooperation with the united states treasury b in cooperation as appropriate with foreign monetary authorities and c in a manner consistent with the obligations of the united states in the international monetary fund regarding exchange arrangements under imf article iv
2013-01-30;2013;January;Minute;Neutral;0.9897936582565308;foreign currency directive reaffirmed january 29 2013 1 system operations in foreign currencies shall generally be directed at countering disorderly market conditions provided that market exchange rates for the us dollar reflect actions and behavior consistent with imf article iv section 1
2013-01-30;2013;January;Minute;Neutral;0.9907631278038025;1 the manager shall clear with the subcommittee or with the chairman if the chairman believes that consultation with the subcommittee is not feasible in the time available a any operation that would result in a change in the systems overall open position in foreign currencies exceeding 300 million on any day or 600 million since the most recent regular meeting of the committee
2013-01-30;2013;January;Minute;Neutral;0.9844857454299927;all operations undertaken pursuant to such clearances shall be reported promptly to the committee
2013-01-30;2013;January;Minute;Neutral;0.9862372875213623;procedural instructions with respect to foreign currency operations amended effective on january 29 2013 in conducting operations pursuant to the authorization and direction of the federal open market committee as set forth in the authorization for foreign currency operations and the foreign currency directive the federal reserve bank of new york through the manager system open market account manager shall be guided by the following procedural understandings with respect to consultations and clearances with the committee the foreign currency subcommittee and the chairman of the committee unless otherwise directed by the committee
2013-01-30;2013;January;Minute;Neutral;0.9918803572654724;for the purpose of providing an investment return on system holdings of foreign currencies or for the purpose of adjusting interest rates paid or received in connection with swap drawings transactions with foreign central banks may be undertaken at nonmarket exchange rates
2013-01-30;2013;January;Minute;Neutral;0.9916362762451172;4 it shall be the normal practice to arrange with foreign central banks for the coordination of foreign currency transactions
2013-01-30;2013;January;Minute;Neutral;0.9875217080116272;in making operating arrangements with foreign central banks on system holdings of foreign currencies the federal reserve bank of new york shall not commit itself to maintain any specific balance unless authorized by the federal open market committee
2013-01-30;2013;January;Minute;Neutral;0.9876569509506226;any agreements or understandings concerning the administration of the accounts maintained by the federal reserve bank of new york with the foreign banks designated by the board of governors under section 2145 of regulation n shall be referred for review and approval to the committee
2013-01-30;2013;January;Minute;Neutral;0.9806621074676514;5 foreign currency holdings shall be invested to ensure that adequate liquidity is maintained to meet anticipated needs and so that each currency portfolio shall generally have an average duration of no more than 18 months calculated as macaulay duration
2013-01-30;2013;January;Minute;Neutral;0.9662337899208069;such investments may include buying or selling outright obligations of or fully guaranteed as to principal and interest by a foreign government or agency thereof buying such securities under agreements for repurchase of such securities selling such securities under agreements for the resale of such securities and holding various time and other deposit accounts at foreign institutions
2013-01-30;2013;January;Minute;Neutral;0.9809397459030151;in addition when appropriate in connection with arrangements to provide investment facilities for foreign currency holdings us government securities may be purchased from foreign central banks under agreements for repurchase of such securities within 30 calendar days
2013-01-30;2013;January;Minute;Negative;0.9908060431480408;optionimplied volatility for the sp 500 index over the near term dipped to its lowest level since early 2007 the optionimplied price of insurance against downside risk on the index at longer horizons remained elevated
2013-01-30;2013;January;Minute;Neutral;0.9750142097473145;the foreign currency subcommittee consists of the chairman and vice chairman of the committee the vice chairman of the board of governors and such other member of the board as the chairman may designate or in the absence of members of the board serving on the subcommittee other board members designated by the chairman as alternates and in the absence of the vice chairman of the committee the vice chairmans alternate
2013-01-30;2013;January;Minute;Neutral;0.9830638766288757;meetings of the subcommittee shall be called at the request of any member or at the request of the manager system open market account manager for the purposes of reviewing recent or contemplated operations and of consulting with the manager on other matters relating to the managers responsibilities
2013-01-30;2013;January;Minute;Neutral;0.9896770119667053;at the request of any member of the subcommittee questions arising from such reviews and consultations shall be referred for determination to the federal open market committee
2013-01-30;2013;January;Minute;Neutral;0.9820842146873474;7 the chairman is authorized a with the approval of the committee to enter into any needed agreement or understanding with the secretary of the treasury about the division of responsibility for foreign currency operations between the system and the treasury b to keep the secretary of the treasury fully advised concerning system foreign currency operations and to consult with the secretary on policy matters relating to foreign currency operations c from time to time to transmit appropriate reports and information to the national advisory council on international monetary and financial policies
2013-01-30;2013;January;Minute;Neutral;0.987575113773346;8 staff officers of the committee are authorized to transmit pertinent information on system foreign currency operations to appropriate officials of the treasury department
2013-01-30;2013;January;Minute;Neutral;0.988798201084137;9 all federal reserve banks shall participate in the foreign currency operations for system account in accordance with paragraph 3g1 of the board of governors statement of procedure with respect to foreign relationships of federal reserve banks dated january 1 1944
2013-01-30;2013;January;Minute;Neutral;0.987722635269165;10 the federal open market committee authorizes the federal reserve bank of new york to undertake transactions of the type described in paragraphs 1 2 and 5 and foreign exchange and investment transactions that it may be otherwise authorized to undertake from time to time for the purpose of testing operational readiness
2013-01-30;2013;January;Minute;Neutral;0.9786994457244873;the aggregate amount of such transactions shall not exceed 25 billion per calendar year
2013-01-30;2013;January;Minute;Neutral;0.9890426993370056;these transactions shall be conducted with prior notice to the committee
2013-01-30;2013;January;Minute;Neutral;0.9814239144325256;2 the federal open market committee directs the federal reserve bank of new york to maintain reciprocal currency arrangements swap arrangements for the system open market account for periods up to a maximum of 12 months with the following foreign banks which are among those designated by the board of governors of the federal reserve system under section 2145 of regulation n relations with foreign banks and bankers and with the approval of the committee to renew such arrangements on maturity foreign bank amount of arrangement millions of dollars equivalent bank of canada 2000 bank of mexico 3000 any changes in the terms of existing swap arrangements and the proposed terms of any new arrangements that may be authorized shall be referred for review and approval to the committee
2013-01-30;2013;January;Minute;Positive;0.7119616270065308;yields on speculativegrade corporate bonds decreased over the intermeeting period and yields on investmentgrade corporate bonds were up a bit
2013-01-30;2013;January;Minute;Neutral;0.9841237664222717;2 the federal open market committee authorizes the federal reserve bank of new york to undertake transactions of the type described in paragraphs 1a and 1b from time to time for the purpose of testing operational readiness
2013-01-30;2013;January;Minute;Neutral;0.9080721735954285;net debt financing by nonfinancial firms increased in the fourth quarter
2013-01-30;2013;January;Minute;Neutral;0.9488428831100464;in their discussion of monetary policy for the period ahead members saw the economic outlook as relatively little changed since the previous meeting
2013-01-30;2013;January;Minute;Positive;0.9913342595100403;accordingly all but one member judged that maintaining the highly accommodative stance of monetary policy was warranted in order to foster a stronger economic recovery in a context of price stability
2013-01-30;2013;January;Minute;Neutral;0.9942116141319275;the committee agreed that it would be appropriate to continue purchases of mbs at a pace of 40 billion per month and purchases of longerterm treasury securities at a pace of 45 billion per month as well as to maintain the committees reinvestment policies
2013-01-30;2013;January;Minute;Neutral;0.9908621311187744;the committee also retained its forward guidance about the federal funds rate including the thresholds on the unemployment and inflation rates
2013-01-30;2013;January;Minute;Positive;0.9452564120292664;some members remarked favorably on the move away from providing calendar dates in the forward guidance and toward highlighting the economic conditionality of future monetary policy
2013-01-30;2013;January;Minute;Negative;0.9926407933235168;one member dissented from the committees policy decision expressing concern that the continued high level of monetary accommodation increased the risks of future economic and financial imbalances and over time could cause an increase in longterm inflation expectations
2013-01-30;2013;January;Minute;Neutral;0.5186485052108765;in the statement to be released following the meeting the committee made relatively small modifications to the language of its december statement including to acknowledge both the pause in economic growth during the fourth quarter and some easing of the strains in global financial markets
2013-01-30;2013;January;Minute;Neutral;0.9570165276527405;members generally continued to anticipate that with longerterm inflation expectations stable and slack in resource utilization remaining inflation over the medium term would run at or below the committees longerrun objective of 2 percent
2013-01-30;2013;January;Minute;Neutral;0.9455990791320801;in light of the importance of ongoing us fiscal concerns members discussed whether to include a reference to unresolved fiscal issues but decided to refrain
2013-01-30;2013;January;Minute;Neutral;0.9731003642082214;at the conclusion of the discussion the committee voted to authorize and direct the federal reserve bank of new york until it was instructed otherwise to execute transactions in the system account in accordance with the following domestic policy directive consistent with its statutory mandate the federal open market committee seeks monetary and financial conditions that will foster maximum employment and price stability
2013-01-30;2013;January;Minute;Neutral;0.9900033473968506;in particular the committee seeks conditions in reserve markets consistent with federal funds trading in a range from 0 to 14 percent
2013-01-30;2013;January;Minute;Neutral;0.9888494610786438;the committee directs the desk to undertake open market operations as necessary to maintain such conditions
2013-01-30;2013;January;Minute;Neutral;0.9877594113349915;the desk is directed to continue purchasing longerterm treasury securities at a pace of about 45 billion per month and to continue purchasing agency mortgagebacked securities at a pace of about 40 billion per month
2013-01-30;2013;January;Minute;Neutral;0.9897848963737488;the committee also directs the desk to engage in dollar roll and coupon swap transactions as necessary to facilitate settlement of the federal reserves agency mbs transactions
