Date;Year;Month;Type;sentiment;sentiment_score;sentence
2013-01-30;2013;January;Minute;Neutral;0.9542254209518433;the unemployment rate was 78 percent in december below its average in the third quarter while the labor force participation rate was the same as its thirdquarter average
2013-01-30;2013;January;Minute;Positive;0.9919952154159546;staff review of the economic situation the information reviewed at the january 2930 meeting indicated that the expansion in overall economic activity slowed in the fourth quarter of last year reflecting weatherrelated disruptions and other transitory factors but private domestic final demand grew at a solid rate
2013-01-30;2013;January;Minute;Negative;0.9867812991142273;employment continued to increase at a moderate pace and the unemployment rate though still high was lower at the end of the fourth quarter than in the preceding quarter
2013-01-30;2013;January;Minute;Neutral;0.9856513738632202;developments in financial markets and the federal reserves balance sheet the manager of the system open market account soma reported on developments in domestic and foreign financial markets as well as the system open market operations during the period since the fomc met on december 1112 2012 by unanimous vote the committee ratified the open market desks domestic transactions over the intermeeting period
2013-01-30;2013;January;Minute;Negative;0.9759020209312439;consumer price inflation was subdued and measures of longerrun inflation expectations remained stable
2013-01-30;2013;January;Minute;Positive;0.7615739703178406;private nonfarm employment expanded in december at about the same rate as in the fourth quarter as a whole while government employment decreased
2013-01-30;2013;January;Minute;Neutral;0.976382315158844;there were no intervention operations in foreign currencies for the systems account over the intermeeting period
2013-01-30;2013;January;Minute;Negative;0.9949977397918701;the rate of longduration unemployment and the share of workers employed part time for economic reasons edged down in december but both measures were still elevated
2013-01-30;2013;January;Minute;Neutral;0.8921273350715637;broader indicators of manufacturing production such as the diffusion indexes of new orders from the national and regional manufacturing surveys were at levels consistent with only modest increases in factory output in the near term
2013-01-30;2013;January;Minute;Positive;0.9791127443313599;manufacturing production increased briskly in november and december after declining in october when activity was disrupted by hurricane sandy
2013-01-30;2013;January;Minute;Negative;0.981656014919281;as a result factory output expanded only slightly in the fourth quarter as a whole and the rate of manufacturing capacity utilization was only a little higher in december than in the third quarter
2013-01-30;2013;January;Minute;Negative;0.9960387945175171;the production of motor vehicles and parts increased considerably in the fourth quarter but factory output outside of the motor vehicle sector declined somewhat
2013-01-30;2013;January;Minute;Neutral;0.9919893145561218;automakers schedules indicated that the pace of motor vehicle assemblies in the first quarter would be roughly the same as in the fourth quarter
2013-01-30;2013;January;Minute;Positive;0.989910900592804;increases in real personal consumption expenditures picked up somewhat in the fourth quarter boosted importantly by higher spending on motor vehicles
2013-01-30;2013;January;Minute;Neutral;0.9657952785491943;by unanimous vote the committee reaffirmed its program for security of fomc information
2013-01-30;2013;January;Minute;Positive;0.9800187945365906;after being roughly flat in the third quarter households real disposable income rose considerably in part reflecting an acceleration of income payments in anticipation of increases in individual income tax rates after the turn of the year
2013-01-30;2013;January;Minute;Neutral;0.7289270758628845;the rate of privatesector hiring along with indicators of job openings and firms hiring plans was generally muted but remained consistent with continued moderate increases in employment in the coming months
2013-01-30;2013;January;Minute;Neutral;0.9870665669441223;by unanimous vote the rules of procedure were amended to change the quorum requirements to state that a meeting of the fomc could not be convened without a representative of a reserve bank
2013-01-30;2013;January;Minute;Neutral;0.9805607795715332;therefore the committees policy decisions reflect its longerrun goals its mediumterm outlook and its assessments of the balance of risks including risks to the financial system that could impede the attainment of the committees goals
2013-01-30;2013;January;Minute;Neutral;0.9915860891342163;the committee intends to reaffirm these principles and to make adjustments as appropriate at its annual organizational meeting each january
2013-01-30;2013;January;Minute;Negative;0.9952011108398438;in december and january consumer sentiment was more downbeat than in the previous several months
2013-01-30;2013;January;Minute;Positive;0.9013422727584839;such clarity facilitates wellinformed decisionmaking by households and businesses reduces economic and financial uncertainty increases the effectiveness of monetary policy and enhances transparency and accountability which are essential in a democratic society
2013-01-30;2013;January;Minute;Negative;0.8526409864425659;inflation employment and longterm interest rates fluctuate over time in response to economic and financial disturbances
2013-01-30;2013;January;Minute;Neutral;0.8903452157974243;moreover monetary policy actions tend to influence economic activity and prices with a lag
2013-01-30;2013;January;Minute;Neutral;0.991215705871582;the inflation rate over the longer run is primarily determined by monetary policy and hence the committee has the ability to specify a longerrun goal for inflation
2013-01-30;2013;January;Minute;Neutral;0.9944270849227905;the committee judges that inflation at the rate of 2 percent as measured by the annual change in the price index for personal consumption expenditures is most consistent over the longer run with the federal reserves statutory mandate
2013-01-30;2013;January;Minute;Positive;0.9851807355880737;communicating this inflation goal clearly to the public helps keep longerterm inflation expectations firmly anchored thereby fostering price stability and moderate longterm interest rates and enhancing the committees ability to promote maximum employment in the face of significant economic disturbances
2013-01-30;2013;January;Minute;Neutral;0.9901801347732544;by unanimous vote the policy on external communications of committee participants and the policy on external communications of federal reserve system staff were amended to clarify the precise beginning and end of the communication blackout period surrounding regular meetings of the federal open market committee fomc
2013-01-30;2013;January;Minute;Neutral;0.9865283966064453;the maximum level of employment is largely determined by nonmonetary factors that affect the structure and dynamics of the labor market
2013-01-30;2013;January;Minute;Neutral;0.987992525100708;consequently it would not be appropriate to specify a fixed goal for employment rather the committees policy decisions must be informed by assessments of the maximum level of employment recognizing that such assessments are necessarily uncertain and subject to revision
2013-01-30;2013;January;Minute;Neutral;0.9863144159317017;the committee considers a wide range of indicators in making these assessments
2013-01-30;2013;January;Minute;Neutral;0.9836665391921997;information about committee participants estimates of the longerrun normal rates of output growth and unemployment is published four times per year in the fomcs summary of economic projections
2013-01-30;2013;January;Minute;Negative;0.7444294691085815;for example in the most recent projections fomc participants estimates of the longerrun normal rate of unemployment had a central tendency of 52 percent to 60 percent unchanged from one year ago but substantially higher than the corresponding interval several years earlier
2013-01-30;2013;January;Minute;Neutral;0.9931102991104126;in setting monetary policy the committee seeks to mitigate deviations of inflation from its longerrun goal and deviations of employment from the committees assessments of its maximum level
2013-01-30;2013;January;Minute;Neutral;0.9799959063529968;these objectives are generally complementary
2013-01-30;2013;January;Minute;Neutral;0.9925462603569031;however under circumstances in which the committee judges that the objectives are not complementary it follows a balanced approach in promoting them taking into account the magnitude of the deviations and the potentially different time horizons over which employment and inflation are projected to return to levels judged consistent with its mandate
2013-01-30;2013;January;Minute;Neutral;0.9625793099403381;these factors may change over time and may not be directly measurable
2013-01-30;2013;January;Minute;Negative;0.9942176342010498;conditions in the housing sector continued to improve but construction activity remained at a relatively low level restrained by tight underwriting standards for mortgage loans and the substantial inventory of foreclosed and distressed properties
2013-01-30;2013;January;Minute;Positive;0.9840252995491028;morepositive investor sentiment regarding the outlook for global economic growth along with some optimism about a federal debt ceiling deal may also have contributed to the increase in yields
2013-01-30;2013;January;Minute;Neutral;0.6604688167572021;home prices increased further in november
2013-01-30;2013;January;Minute;Positive;0.9817110300064087;in japan indicators of production and exports remained weak however household consumption showed some improvement and the new government introduced a large fiscal stimulus program and called for aggressive monetary easing to end deflation
2013-01-30;2013;January;Minute;Positive;0.9918435215950012;in emerging market economies real gdp growth is estimated to have picked up in china in the fourth quarter consistent with other chinese indicators that pointed to an improvement in activity
2013-01-30;2013;January;Minute;Positive;0.9405719041824341;production and exports rebounded at yearend in a number of other emerging asian economies as well
2013-01-30;2013;January;Minute;Neutral;0.818898618221283;inflation generally remained well contained in both advanced foreign economies and emerging market economies
2013-01-30;2013;January;Minute;Positive;0.991290807723999;staff review of the financial situation us financial market conditions improved on net between the december and january fomc meetings largely in response to the partial resolution of the issues associated with the socalled fiscal cliff a positive start to the corporate earnings reporting season and some favorable policy developments in europe
2013-01-30;2013;January;Minute;Positive;0.9842108488082886;the expected path of the federal funds rate based on market quotes moved up on balance over the intermeeting period likely reflecting a somewhat more positive assessment of the economic outlook
2013-01-30;2013;January;Minute;Neutral;0.5440142154693604;results from the desks survey of primary dealers conducted prior to the january meeting showed that dealers continued to view the third quarter of 2015 as the most likely time of the first increase in the target federal funds rate
2013-01-30;2013;January;Minute;Negative;0.9876986742019653;in the euro area industrial production and retail sales were below their thirdquarter levels through november and real gdp contracted in the united kingdom
2013-01-30;2013;January;Minute;Negative;0.9907378554344177;in addition the median dealer continued to see the first quarter of 2014 as the most likely time for the committees asset purchases to conclude although fewer dealers than in december expected those purchases to continue beyond 2014 treasury coupon yields increased over the intermeeting period including a notable rise just after yearend when passage of the american taxpayer relief act of 2012 apparently lessened concerns about the risk of substantially higher fiscal drag on growth in the near term
2013-01-30;2013;January;Minute;Neutral;0.9762724041938782;measures of inflation compensation derived from nominal and inflationprotected treasury securities rose slightly over the intermeeting period
2013-01-30;2013;January;Minute;Neutral;0.8570839762687683;conditions in shortterm dollar funding markets were generally little changed on balance yearend funding pressures were modest overall and roughly in line with market expectations
2013-01-30;2013;January;Minute;Neutral;0.9535252451896667;the outstanding amount of unsecured commercial paper issued by european financial institutions increased noticeably
2013-01-30;2013;January;Minute;Positive;0.9888378381729126;indicators of the condition of domestic financial institutions generally improved over the intermeeting period
2013-01-30;2013;January;Minute;Negative;0.9643774032592773;a broad index of bank stock prices rose and the median spread on credit default swaps of the largest banking organizations moved lower
2013-01-30;2013;January;Minute;Positive;0.9856679439544678;broad us equity price indexes increased on net over the intermeeting period buoyed by many of the same factors that contributed to the rise in treasury yields
2013-01-30;2013;January;Minute;Positive;0.986308753490448;in addition the fourthquarter earnings reporting season started off well as earnings and revenue results were above analysts expectations for a higherthanaverage number of firms
2013-01-30;2013;January;Minute;Neutral;0.9913647174835205;the committee seeks to explain its monetary policy decisions to the public as clearly as possible
2013-01-30;2013;January;Minute;Negative;0.9943729639053345;economic growth in the advanced foreign economies appeared to remain weak in the fourth quarter
2013-01-30;2013;January;Minute;Negative;0.9950873255729675;increases in average hourly earnings for all employees picked up a little in the fourth quarter but continued to be fairly subdued
2013-01-30;2013;January;Minute;Negative;0.9831234216690063;available measures of labor compensation indicated that recent gains in nominal wages remained relatively slow
2013-01-30;2013;January;Minute;Positive;0.9848731756210327;in the fourth quarter sales of both new and existing homes were higher than in the previous quarter
2013-01-30;2013;January;Minute;Positive;0.932561993598938;real business expenditures on equipment and software rose briskly in the fourth quarter after declining moderately in the preceding quarter
2013-01-30;2013;January;Minute;Negative;0.9950608611106873;although nominal new orders for nondefense capital goods excluding aircraft also increased markedly last quarter the level of orders remained below shipments
2013-01-30;2013;January;Minute;Neutral;0.7424837946891785;moreover other recent forwardlooking indicators such as surveys of business conditions and capital spending plans suggested that outlays for business equipment would rise only modestly in the coming months
2013-01-30;2013;January;Minute;Negative;0.9952378273010254;real business spending for nonresidential construction declined somewhat in the fourth quarter and remained at a relatively low level
2013-01-30;2013;January;Minute;Negative;0.42798662185668945;a reduction in the accumulation of nonfarm business inventories subtracted a considerable amount from the change in real gross domestic product gdp in the fourth quarter
2013-01-30;2013;January;Minute;Negative;0.9938246011734009;real federal government purchases decreased substantially in the fourth quarter primarily because of a sharp decline in defense spending that followed a marked increase in the previous quarter
2013-01-30;2013;January;Minute;Neutral;0.5642364621162415;real state and local government purchases decreased slightly in the fourth quarter
2013-01-30;2013;January;Minute;Positive;0.5346309542655945;the us international trade deficit widened substantially in november as imports rose more quickly than exports
2013-01-30;2013;January;Minute;Positive;0.98639976978302;the rise in imports was fairly broadbased led by strong increases in consumer goods while the increase in exports mainly reflected higher sales of capital goods and automotive products
2013-01-30;2013;January;Minute;Negative;0.9900824427604675;exports to europe posted another significant decline in november
2013-01-30;2013;January;Minute;Negative;0.9929592609405518;based on data for october and november and an estimate of the trade data for december the advance release of the national income and product accounts showed that real net exports of goods and services made a small negative arithmetic contribution to the change in us real gdp in the fourth quarter with exports declining more than imports
2013-01-30;2013;January;Minute;Negative;0.49969738721847534;overall us consumer prices increased more slowly in the fourth quarter than in the previous quarter
2013-01-30;2013;January;Minute;Negative;0.9949557185173035;consumer energy prices declined in november and december and survey data indicated that retail gasoline prices fell further in the first few weeks of january
2013-01-30;2013;January;Minute;Positive;0.9658542275428772;consumer food prices continued to rise at a faster pace in november and december than in the third quarter likely reflecting the ongoing effects of last summers drought
2013-01-30;2013;January;Minute;Neutral;0.4860089123249054;in the fourth quarter the rise in consumer prices excluding food and energy slowed
2013-01-30;2013;January;Minute;Neutral;0.9785100221633911;nearterm inflation expectations from the thomson reutersuniversity of michigan surveys of consumers rose a little in december and early january longerterm inflation expectations were unchanged
2013-01-30;2013;January;Minute;Positive;0.99128258228302;starts of both new singlefamily homes and multifamily units advanced in the fourth quarter and permits also rose which pointed to additional gains in construction in the coming months
2013-01-30;2013;January;Minute;Positive;0.9323207139968872;statement on longerrun goals and monetary policy strategy amended effective on january 29 2013 the federal open market committee fomc is firmly committed to fulfilling its statutory mandate from the congress of promoting maximum employment stable prices and moderate longterm interest rates
2013-01-30;2013;January;Minute;Neutral;0.9866754412651062;6 all operations undertaken pursuant to the preceding paragraphs shall be reported promptly to the foreign currency subcommittee and the committee
2013-01-30;2013;January;Minute;Neutral;0.991121768951416;all participants but one supported making only minor wording changes to the statement on longerrun goals and monetary policy strategy
2013-01-30;2013;January;Minute;Neutral;0.9842049479484558;4 in order to ensure the effective conduct of open market operations the federal open market committee authorizes the federal reserve bank of new york to lend on an overnight basis us government securities and securities that are direct obligations of any agency of the united states held in the system open market account to dealers at rates that shall be determined by competitive bidding
2013-01-30;2013;January;Minute;Neutral;0.98915034532547;the federal reserve bank of new york shall set a minimum lending fee consistent with the objectives of the program and apply reasonable limitations on the total amount of a specific issue that may be auctioned and on the amount of securities that each dealer may borrow
2013-01-30;2013;January;Minute;Neutral;0.965355396270752;the federal reserve bank of new york may reject bids that could facilitate a dealers ability to control a single issue as determined solely by the federal reserve bank of new york
2013-01-30;2013;January;Minute;Neutral;0.9795234203338623;the federal reserve bank of new york may lend securities on longer than an overnight basis to accommodate weekend holiday and similar trading conventions
2013-01-30;2013;January;Minute;Neutral;0.981793999671936;5 in order to ensure the effective conduct of open market operations while assisting in the provision of shortterm investments or other authorized services for foreign and international accounts maintained at the federal reserve bank of new york and accounts maintained at the federal reserve bank of new york as fiscal agent of the united states pursuant to section 15 of the federal reserve act the federal open market committee authorizes and directs the federal reserve bank of new york a for the system open market account to sell us government securities and securities that are direct obligations of or fully guaranteed as to principal and interest by any agency of the united states to such accounts on the bases set forth in paragraph 1a under agreements providing for the resale by such accounts of those securities in 65 business days or less on terms comparable to those available on such transactions in the market b for the new york bank account when appropriate to undertake with dealers subject to the conditions imposed on purchases and sales of securities in paragraph lb repurchase agreements in us government securities and securities that are direct obligations of or fully guaranteed as to principal and interest by any agency of the united states and to arrange corresponding sale and repurchase agreements between its own account and such foreign international and fiscal agency accounts maintained at the bank and c for the new york bank account when appropriate to buy us government securities and obligations that are direct obligations of or fully guaranteed as to principal and interest by any agency of the united states from such foreign and international accounts maintained at the bank under agreements providing for the repurchase by such accounts of those securities on the same business day
2013-01-30;2013;January;Minute;Neutral;0.9498903751373291;transactions undertaken with such accounts under the provisions of this paragraph may provide for a service fee when appropriate
2013-01-30;2013;January;Minute;Neutral;0.9808270931243896;6 in the execution of the committees decision regarding policy during any intermeeting period the committee authorizes and directs the federal reserve bank of new york upon the instruction of the chairman of the committee to i adjust somewhat in exceptional circumstances the degree of pressure on reserve positions and hence the intended federal funds rate and to take actions that result in material changes in the composition and size of the assets in the system open market account other than those anticipated by the committee at its most recent meeting or ii undertake transactions of the type described in paragraphs 1a and 1b in order to appropriately address temporary disruptions of an operational or highly unusual nature in us dollar funding markets
2013-01-30;2013;January;Minute;Neutral;0.9829891324043274;3 in order to ensure the effective conduct of open market operations the federal open market committee authorizes the federal reserve bank of new york to use agents in agency mbsrelated transactions
2013-01-30;2013;January;Minute;Neutral;0.9913384914398193;any such adjustment as described in clause i shall be made in the context of the committees discussion and decision at its most recent meeting and the committees longrun objectives to foster maximum employment and price stability and shall be based on economic financial and monetary developments during the intermeeting period
2013-01-30;2013;January;Minute;Neutral;0.9848471283912659;the committee voted unanimously to amend the authorization for foreign currency operations and the procedural instructions with respect to foreign currency operations and to reaffirm the foreign currency directive in the form shown below
2013-01-30;2013;January;Minute;Neutral;0.9751632809638977;the approval of these documents included approval of the systems warehousing agreement with the us treasury
2013-01-30;2013;January;Minute;Neutral;0.9862213134765625;the authorization for foreign currency operations and the procedural instructions with respect to foreign currency operations were amended to include the authority to conduct smallvalue operations against the full range of foreign transactions that the desk is authorized to conduct
2013-01-30;2013;January;Minute;Neutral;0.9918053150177002;this change was made to allow for prudent testing of operational readiness and is similar in purpose to the amendment that the committee approved in june 2012 to the authorization for domestic open market operations
