Date;Year;Month;Type;sentiment;sentiment_score;sentence
2013-01-30;2013;January;Minute;Positive;0.9868908524513245;according to the january senior loan officer opinion survey on bank lending practices domestic banks continued to ease somewhat their lending standards and some loan terms on balance they also experienced an increase in demand on net in most major loan categories in the fourth quarter
2013-01-30;2013;January;Minute;Positive;0.9864987134933472;m2 and its largest component liquid deposits expanded robustly in december
2013-01-30;2013;January;Minute;Neutral;0.9762240052223206;initial data suggested that the expiration of unlimited deposit insurance on noninterestbearing transaction accounts at yearend had only a limited effect on bank deposits through early january
2013-01-30;2013;January;Minute;Positive;0.9902741312980652;the monetary base expanded at a strong rate in december reflecting growth in both currency and reserve balances
2013-01-30;2013;January;Minute;Positive;0.9914965629577637;foreign financial conditions improved over the intermeeting period as markets responded favorably to the passage of fiscal policy legislation in the united states and to further progress in addressing euroarea strains
2013-01-30;2013;January;Minute;Positive;0.988651692867279;it was also noted that continued deleveraging by households was improving their financial positions which would likely support increased spending
2013-01-30;2013;January;Minute;Positive;0.9921613335609436;holiday shopping reportedly was relatively solid and reflecting the improvement in the housing market demand for home furnishings and construction materials was up
2013-01-30;2013;January;Minute;Positive;0.9914453029632568;issuance of consumer assetbacked securities remained strong in the fourth quarter
2013-01-30;2013;January;Minute;Positive;0.6942650675773621;participants remarked on the ongoing recovery in the housing market pointing variously to rising house prices growth in residential construction and sales and the lower inventory of homes for sale
2013-01-30;2013;January;Minute;Negative;0.9931748509407043;similarly one participant cited empirical analysis showing that employment growth was lower in the states where a greater share of small businesses identified lack of demand as their most important business problem
2013-01-30;2013;January;Minute;Negative;0.993252694606781;several participants expressed concern that continuation of only slow job growth and persistently high longduration unemployment could lead to permanent damage to the labor market
2013-01-30;2013;January;Minute;Neutral;0.9935250282287598;participants generally saw recent price developments as consistent with their projections that inflation would remain at or below the committees 2 percent objective over the medium run
2013-01-30;2013;January;Minute;Positive;0.8553670048713684;there was little evidence of wage or cost pressures outside of isolated sectors and measures of inflation expectations remained stable
2013-01-30;2013;January;Minute;Negative;0.9942434430122375;however a few participants expressed concerns that the current highly accommodative stance of monetary policy posed upside risks to inflation in the medium or longer term
2013-01-30;2013;January;Minute;Neutral;0.9801061749458313;participants also touched on the implications for monetary policy of changes in estimates of the economys potential output
2013-01-30;2013;January;Minute;Negative;0.9940345883369446;a number of participants thought that the growth of potential output had been reduced in recent years possibly in part because restrictive financial conditions and weak economic activity in the aftermath of the financial crisis had reduced investment business formation and the pace of adoption of new technologies
2013-01-30;2013;January;Minute;Negative;0.9874423146247864;many of these participants worried that should the economy continue to operate below potential for too long reduced investment and underutilization of labor could further undermine the growth of potential output over time
2013-01-30;2013;January;Minute;Negative;0.950171947479248;a couple of participants noted that uncertainties concerning both the level of and the source of shifts in potential output made it difficult to base decisions about monetary policy on realtime measures of the output gap
2013-01-30;2013;January;Minute;Negative;0.9173681735992432;participants noted that financial conditions appeared to have been supported by the recent fiscal agreement a perceived reduction in the risk that the debt ceiling would not be raised in a timely manner accommodative monetary policy and actions taken by european authorities
2013-01-30;2013;January;Minute;Positive;0.9887747764587402;several participants mentioned that domestic credit conditions appeared to have improved automobile loans were expanding rapidly and it was reported that competition to make commercial and industrial loans was robust
2013-01-30;2013;January;Minute;Negative;0.9884160757064819;although mortgage availability was still limited a couple of participants indicated that they expected increased competition to bring about some lessening of the restraints on mortgage credit
2013-01-30;2013;January;Minute;Negative;0.9691214561462402;in general after having been depressed for some time investor appetite for risk had increased
2013-01-30;2013;January;Minute;Negative;0.993901252746582;a few participants commented that the committees accommodative policies were intended in part to promote a more balanced approach to risktaking but several others expressed concern about the potential for excessive risktaking and adverse consequences for financial stability
2013-01-30;2013;January;Minute;Negative;0.9937052130699158;however some participants were concerned that the recent increase in the payroll tax could have a significant negative effect on spending particularly on the part of lowerincome consumers
2013-01-30;2013;January;Minute;Negative;0.9721667170524597;some participants mentioned the potential for a sharp increase in longerterm interest rates to adversely affect financial stability and indicated their interest in further work on this topic
2013-01-30;2013;January;Minute;Neutral;0.9849525094032288;the committee again discussed the possible benefits and costs of additional asset purchases
2013-01-30;2013;January;Minute;Negative;0.9945523142814636;for example a couple of participants noted evidence suggesting that a shift in the relationship between the unemployment rate and the level of job vacancies in recent years was unlikely to persist as the economy recovered and unemployment benefits returned to customary levels
2013-01-30;2013;January;Minute;Negative;0.9955329895019531;a few others however pointed to evidence that weak aggregate demand was the primary factor restraining job growth citing data and analyses in support of the view that there was still a substantial margin of slack in the labor market
2013-01-30;2013;January;Minute;Negative;0.9948434829711914;with regard to europe participants continued to see downside risks to growth emanating from that region given its unresolved imbalances and weak economic outlook
2013-01-30;2013;January;Minute;Negative;0.9922366738319397;one participant reported that firms in his district continued to have difficulty finding workers with suitable skills suggesting that labor market mismatch was a factor deterring job growth
2013-01-30;2013;January;Minute;Negative;0.993062436580658;nonetheless it was noted that mortgage credit remained tight and the fraction of homeowners with mortgage balances exceeding the value of their homes remained high
2013-01-30;2013;January;Minute;Positive;0.9900845289230347;anecdotal reports suggested that uncertainty about the evolution of the economy and government policy continued to restrain firms hiring and capital spending decisions but the passage of fiscal legislation in early january helped resolve some of the uncertainty about federal tax policy
2013-01-30;2013;January;Minute;Positive;0.9853445887565613;moreover it was noted that businesses were in a good position to expand once they came to view the economic environment as more favorable
2013-01-30;2013;January;Minute;Negative;0.7933242321014404;in general participants indicated that relative to the recent past more business contacts reported an improvement in confidence and some cautious optimism about the economic outlook
2013-01-30;2013;January;Minute;Positive;0.9886928796768188;reports from a number of industries across the country also suggested a more positive assessment of future prospects particularly in the automotive energy and technology sectors
2013-01-30;2013;January;Minute;Negative;0.977686882019043;however reports from the nonautomotive manufacturing sector were less positive
2013-01-30;2013;January;Minute;Positive;0.986244261264801;in agriculture record payouts from crop insurance following last years drought supported farm incomes and land prices continued to rise
2013-01-30;2013;January;Minute;Positive;0.9422875046730042;reports on business conditions in the commercial real estate sector were more mixed but on the whole somewhat improved
2013-01-30;2013;January;Minute;Neutral;0.9452078342437744;survey data from one district indicated that more than half of the respondents expected to increase employment this year with many citing expected sales growth as the reason
2013-01-30;2013;January;Minute;Positive;0.991584300994873;a number of participants thought it likely that higher home values and low mortgage rates were helping support other sectors of the economy as well and a couple saw the housing market as having the potential to cause overall growth to be stronger than expected this year
2013-01-30;2013;January;Minute;Positive;0.9872045516967773;participants generally welcomed an apparent pickup in economic growth in parts of asia and saw reduced risk that the chinese economy would slow abruptly but it was noted that no economy was currently in a position to lead global growth higher
2013-01-30;2013;January;Minute;Negative;0.9918261766433716;the passage of legislation in early january resolved some of the uncertainties surrounding the federal fiscal outlook but nearterm uncertainties remained including the prospect of automatic budget cuts
2013-01-30;2013;January;Minute;Neutral;0.7430481314659119;participants generally agreed that fiscal negotiations could develop in a way that would result in significantly greater drag on economic growth than in their baseline outlook
2013-01-30;2013;January;Minute;Positive;0.9920144081115723;one participant noted positive news about the fiscal position of the states in some cases revenues had risen sufficiently to enable increases in state government spending and employment
2013-01-30;2013;January;Minute;Positive;0.9897087216377258;in their comments on labor market developments participants viewed the decline in the unemployment rate from the third quarter to the fourth and the continued moderate gains in payroll employment as consistent with a gradually improving job market
2013-01-30;2013;January;Minute;Negative;0.9915715456008911;the strength of exports reportedly varied with indications of higher demand from mexico but some relatively pessimistic readings from firms about business conditions in europe
2013-01-30;2013;January;Minute;Positive;0.4959679841995239;however the unemployment rate remained well above estimates of its longerrun normal level and other indicators such as the share of longterm unemployed and the number of people working part time for economic reasons suggested that the recovery in the labor market was far from complete
