Date;Year;Month;Type;sentiment;sentiment_score;sentence
2013-07-31;2013;July;Minute;Positive;0.9924861192703247;recent high readings on consumer confidence and boosts to household wealth from increased equity and real estate prices suggested that consumer spending would gather momentum in the second half of the year
2013-07-31;2013;July;Minute;Negative;0.9949295520782471;nonetheless some participants felt that as a result of recent financial market developments overall financial market conditions had tightened significantly importantly reflecting larger term premiums and they expressed concern that the higher level of longerterm interest rates could be a significant factor holding back spending and economic growth
2013-07-31;2013;July;Minute;Positive;0.9923303723335266;the housing sector continued to pick up as indicated by increases in house prices low inventories of homes for sale and strong demand for construction
2013-07-31;2013;July;Minute;Positive;0.9868695139884949;taken together these actions should maintain downward pressure on longerterm interest rates support mortgage markets and help to make broader financial conditions more accommodative
2013-07-31;2013;July;Minute;Neutral;0.9871074557304382;the committee is maintaining its existing policy of reinvesting principal payments from its holdings of agency debt and agency mortgagebacked securities in agency mortgagebacked securities and of rolling over maturing treasury securities at auction
2013-07-31;2013;July;Minute;Neutral;0.6695400476455688;to support a stronger economic recovery and to help ensure that inflation over time is at the rate most consistent with its dual mandate the committee decided to continue purchasing additional agency mortgagebacked securities at a pace of 40 billion per month and longerterm treasury securities at a pace of 45 billion per month
2013-07-31;2013;July;Minute;Neutral;0.9853386878967285;the committee recognizes that inflation persistently below its 2 percent objective could pose risks to economic performance but it anticipates that inflation will move back toward its objective over the medium term
2013-07-31;2013;July;Minute;Negative;0.9941036105155945;the committee sees the downside risks to the outlook for the economy and the labor market as having diminished since the fall
2013-07-31;2013;July;Minute;Neutral;0.7849620580673218;the committee expects that with appropriate policy accommodation economic growth will pick up from its recent pace and the unemployment rate will gradually decline toward levels the committee judges consistent with its dual mandate
2013-07-31;2013;July;Minute;Neutral;0.8732967972755432;consistent with its statutory mandate the committee seeks to foster maximum employment and price stability
2013-07-31;2013;July;Minute;Positive;0.9864259958267212;partly reflecting transitory influences inflation has been running below the committees longerrun objective but longerterm inflation expectations have remained stable
2013-07-31;2013;July;Minute;Negative;0.9950830936431885;household spending and business fixed investment advanced and the housing sector has been strengthening but mortgage rates have risen somewhat and fiscal policy is restraining economic growth
2013-07-31;2013;July;Minute;Negative;0.9929326772689819;labor market conditions have shown further improvement in recent months on balance but the unemployment rate remains elevated
2013-07-31;2013;July;Minute;Negative;0.8956011533737183;the vote encompassed approval of the statement below to be released at 200 pm information received since the federal open market committee met in june suggests that economic activity expanded at a modest pace during the first half of the year
2013-07-31;2013;July;Minute;Neutral;0.9840449094772339;the committee will closely monitor incoming information on economic and financial developments in coming months
2013-07-31;2013;July;Minute;Neutral;0.9879816174507141;the system open market account manager and the secretary will keep the committee informed of ongoing developments regarding the systems balance sheet that could affect the attainment over time of the committees objectives of maximum employment and price stability
2013-07-31;2013;July;Minute;Neutral;0.9893332123756409;the committee also directs the desk to engage in dollar roll and coupon swap transactions as necessary to facilitate settlement of the federal reserves agency mortgagebacked securities transactions
2013-07-31;2013;July;Minute;Neutral;0.9877594113349915;the desk is directed to continue purchasing longerterm treasury securities at a pace of about 45 billion per month and to continue purchasing agency mortgagebacked securities at a pace of about 40 billion per month
2013-07-31;2013;July;Minute;Neutral;0.9888494610786438;the committee directs the desk to undertake open market operations as necessary to maintain such conditions
2013-07-31;2013;July;Minute;Neutral;0.9900033473968506;in particular the committee seeks conditions in reserve markets consistent with federal funds trading in a range from 0 to 14 percent
2013-07-31;2013;July;Minute;Neutral;0.9731003642082214;at the conclusion of the discussion the committee voted to authorize and direct the federal reserve bank of new york until it was instructed otherwise to execute transactions in the system account in accordance with the following domestic policy directive consistent with its statutory mandate the federal open market committee seeks monetary and financial conditions that will foster maximum employment and price stability
2013-07-31;2013;July;Minute;Positive;0.9840829968452454;the committee decided to indicate in the statement that it reaffirmed its viewrather than simply expectsthat a highly accommodative stance of monetary policy will remain appropriate for a considerable time after the asset purchase program ends and the economic recovery strengthens
2013-07-31;2013;July;Minute;Negative;0.9824187159538269;the committee also considered whether to add more information concerning the contingent outlook for asset purchases to the policy statement but judged that doing so might prompt an unwarranted shift in market expectations regarding asset purchases
2013-07-31;2013;July;Minute;Negative;0.9291151165962219;in addition to updating its description of the state of the economy the committee decided to underline its concern about recent shortfalls of inflation from its longerrun goal by including in the statement an indication that it recognizes that inflation persistently below its 2 percent objective could pose risks to economic performance while also noting that it continues to anticipate that inflation will move back toward its objective over the medium term
2013-07-31;2013;July;Minute;Neutral;0.9920802712440491;members also discussed the wording of the policy statement to be issued following the meeting
2013-07-31;2013;July;Minute;Positive;0.9876740574836731;in addition the committee reaffirmed its intention to keep the target federal funds rate at 0 to 14 percent and retained its forward guidance that it anticipates that this exceptionally low range for the federal funds rate will be appropriate at least as long as the unemployment rate remains above 612 percent inflation between one and two years ahead is projected to be no more than a half percentage point above the committees 2 percent longerrun goal and longerterm inflation expectations continue to be well anchored
2013-07-31;2013;July;Minute;Neutral;0.9532321691513062;at the conclusion of its discussion the committee decided to continue adding policy accommodation by purchasing additional mbs at a pace of 40 billion per month and longerterm treasury securities at a pace of 45 billion per month and to maintain its existing reinvestment policies
2013-07-31;2013;July;Minute;Neutral;0.9884985089302063;the committee directs the desk to maintain its policy of rolling over maturing treasury securities into new issues and its policy of reinvesting principal payments on all agency debt and agency mortgagebacked securities in agency mortgagebacked securities
2013-07-31;2013;July;Minute;Positive;0.9872372150421143;the committee will continue its purchases of treasury and agency mortgagebacked securities and employ its other policy tools as appropriate until the outlook for the labor market has improved substantially in a context of price stability
2013-07-31;2013;July;Minute;Neutral;0.9920755624771118;the committee is prepared to increase or reduce the pace of its purchases to maintain appropriate policy accommodation as the outlook for the labor market or inflation changes
2013-07-31;2013;July;Minute;Neutral;0.9884893298149109;in determining the size pace and composition of its asset purchases the committee will continue to take appropriate account of the likely efficacy and costs of such purchases as well as the extent of progress toward its economic objectives
2013-07-31;2013;July;Statement;Neutral;0.9644071459770203;voting for the fomc monetary policy action were ben s bernanke chairman william c dudley vice chairman james bullard elizabeth a duke charles l evans jerome h powell sarah bloom raskin eric s rosengren jeremy c stein daniel k tarullo and janet l yellen
2013-07-31;2013;July;Statement;Neutral;0.9936867356300354;when the committee decides to begin to remove policy accommodation it will take a balanced approach consistent with its longerrun goals of maximum employment and inflation of 2 percent
2013-07-31;2013;July;Statement;Neutral;0.9889450669288635;in determining how long to maintain a highly accommodative stance of monetary policy the committee will also consider other information including additional measures of labor market conditions indicators of inflation pressures and inflation expectations and readings on financial developments
2013-07-31;2013;July;Statement;Positive;0.9832518100738525;in particular the committee decided to keep the target range for the federal funds rate at 0 to 14 percent and currently anticipates that this exceptionally low range for the federal funds rate will be appropriate at least as long as the unemployment rate remains above 612 percent inflation between one and two years ahead is projected to be no more than a half percentage point above the committees 2 percent longerrun goal and longerterm inflation expectations continue to be well anchored
2013-07-31;2013;July;Statement;Positive;0.9859720468521118;to support continued progress toward maximum employment and price stability the committee today reaffirmed its view that a highly accommodative stance of monetary policy will remain appropriate for a considerable time after the asset purchase program ends and the economic recovery strengthens
2013-07-31;2013;July;Statement;Neutral;0.9884893298149109;in determining the size pace and composition of its asset purchases the committee will continue to take appropriate account of the likely efficacy and costs of such purchases as well as the extent of progress toward its economic objectives
2013-07-31;2013;July;Statement;Neutral;0.9920755624771118;the committee is prepared to increase or reduce the pace of its purchases to maintain appropriate policy accommodation as the outlook for the labor market or inflation changes
2013-07-31;2013;July;Statement;Positive;0.9872372150421143;the committee will continue its purchases of treasury and agency mortgagebacked securities and employ its other policy tools as appropriate until the outlook for the labor market has improved substantially in a context of price stability
2013-07-31;2013;July;Statement;Neutral;0.9840449094772339;the committee will closely monitor incoming information on economic and financial developments in coming months
2013-07-31;2013;July;Statement;Positive;0.9868695139884949;taken together these actions should maintain downward pressure on longerterm interest rates support mortgage markets and help to make broader financial conditions more accommodative
2013-07-31;2013;July;Statement;Neutral;0.9871074557304382;the committee is maintaining its existing policy of reinvesting principal payments from its holdings of agency debt and agency mortgagebacked securities in agency mortgagebacked securities and of rolling over maturing treasury securities at auction
2013-07-31;2013;July;Statement;Neutral;0.6695400476455688;to support a stronger economic recovery and to help ensure that inflation over time is at the rate most consistent with its dual mandate the committee decided to continue purchasing additional agency mortgagebacked securities at a pace of 40 billion per month and longerterm treasury securities at a pace of 45 billion per month
2013-07-31;2013;July;Statement;Neutral;0.9853386878967285;the committee recognizes that inflation persistently below its 2 percent objective could pose risks to economic performance but it anticipates that inflation will move back toward its objective over the medium term
2013-07-31;2013;July;Statement;Negative;0.9941036105155945;the committee sees the downside risks to the outlook for the economy and the labor market as having diminished since the fall
2013-07-31;2013;July;Minute;Negative;0.9938430786132812;however a few participants expressed concern that higher household wealth might not translate into greater consumer spending cautioning that household income growth remained slow that households might not treat the additions to wealth arising from recent equity price increases as lasting or that households scope to extract housing equity for the purpose of increasing their expenditures was less than in the past
2013-07-31;2013;July;Statement;Neutral;0.8732967972755432;consistent with its statutory mandate the committee seeks to foster maximum employment and price stability
2013-07-31;2013;July;Statement;Positive;0.9864259958267212;partly reflecting transitory influences inflation has been running below the committees longerrun objective but longerterm inflation expectations have remained stable
2013-07-31;2013;July;Statement;Negative;0.9950830936431885;household spending and business fixed investment advanced and the housing sector has been strengthening but mortgage rates have risen somewhat and fiscal policy is restraining economic growth
2013-07-31;2013;July;Statement;Negative;0.9929326772689819;labor market conditions have shown further improvement in recent months on balance but the unemployment rate remains elevated
2013-07-31;2013;July;Statement;Negative;0.7164786458015442;information received since the federal open market committee met in june suggests that economic activity expanded at a modest pace during the first half of the year
2013-07-31;2013;July;Minute;Neutral;0.882091224193573;voting for this
2013-07-31;2013;July;Minute;Neutral;0.9936867356300354;when the committee decides to begin to remove policy accommodation it will take a balanced approach consistent with its longerrun goals of maximum employment and inflation of 2 percent
2013-07-31;2013;July;Minute;Neutral;0.9889450669288635;in determining how long to maintain a highly accommodative stance of monetary policy the committee will also consider other information including additional measures of labor market conditions indicators of inflation pressures and inflation expectations and readings on financial developments
2013-07-31;2013;July;Minute;Positive;0.9832518100738525;in particular the committee decided to keep the target range for the federal funds rate at 0 to 14 percent and currently anticipates that this exceptionally low range for the federal funds rate will be appropriate at least as long as the unemployment rate remains above 612 percent inflation between one and two years ahead is projected to be no more than a half percentage point above the committees 2 percent longerrun goal and longerterm inflation expectations continue to be well anchored
2013-07-31;2013;July;Minute;Positive;0.9859720468521118;to support continued progress toward maximum employment and price stability the committee today reaffirmed its view that a highly accommodative stance of monetary policy will remain appropriate for a considerable time after the asset purchase program ends and the economic recovery strengthens
2013-07-31;2013;July;Minute;Negative;0.656463086605072;at the same time a few others pointed to the contingent plan that had been articulated on behalf of the committee the previous month and suggested that it might soon be time to slow somewhat the pace of purchases as outlined in that plan
2013-07-31;2013;July;Minute;Neutral;0.9904372096061707;a few members emphasized the importance of being patient and evaluating additional information on the economy before deciding on any changes to the pace of asset purchases
2013-07-31;2013;July;Statement;Neutral;0.7849620580673218;the committee expects that with appropriate policy accommodation economic growth will pick up from its recent pace and the unemployment rate will gradually decline toward levels the committee judges consistent with its dual mandate
2013-07-31;2013;July;Minute;Neutral;0.9887136816978455;while a range of views were expressed regarding the cumulative improvement in the labor market since last fall almost all committee members agreed that a change in the purchase program was not yet appropriate
2013-07-31;2013;July;Minute;Positive;0.9787036776542664;some participants also stated that financial developments during the intermeeting period might have helped put the financial system on a more sustainable footing insofar as those developments were associated with an unwinding of unsustainable speculative positions or an increase in term premiums from extraordinarily low levels
2013-07-31;2013;July;Minute;Positive;0.7849617004394531;several others however judged that the rise in rates was likely to exert relatively little restraint or that the increase in equity prices and easing in bank lending standards would largely offset the effects of the rise in longerterm interest rates
2013-07-31;2013;July;Minute;Positive;0.5839059948921204;a number of participants mentioned that by the end of the intermeeting period market expectations of the future course of monetary policy both with regard to asset purchases and with regard to the path of the federal funds rate appeared well aligned with their own expectations
2013-07-31;2013;July;Minute;Neutral;0.7752618193626404;subsequent federal reserve communications which emphasized that decisions about the two policy tools were distinct and underscored that a highly accommodative stance of monetary policy would remain appropriate for a considerable period after purchases are completed were seen as having helped clarify the committees policy strategy
2013-07-31;2013;July;Minute;Negative;0.9212574362754822;moreover investors may have perceived that committee communications about the possibility of slowing the pace of asset purchases also implied a higher probability of an earlier firming of the federal funds rate
2013-07-31;2013;July;Minute;Negative;0.8255703449249268;a few participants suggested that this shift occurred in part because committee participants economic projections released following the june meeting generally showed a somewhat more favorable outlook than those of private forecasters or because the june policy statement and press conference were seen as indicating relatively little concern about inflation readings which had been low and declining
2013-07-31;2013;July;Minute;Negative;0.9954505562782288;in discussing the increases in us longerterm interest rates that occurred in the wake of the june fomc meeting and the associated press conference meeting participants pointed to heightened financial market uncertainty about the path of monetary policy and a shift of market expectations toward less policy accommodation
2013-07-31;2013;July;Minute;Negative;0.7070624828338623;both domestic and foreign asset markets were volatile at times during the intermeeting period reacting to policy communications and data releases
2013-07-31;2013;July;Minute;Negative;0.6897533535957336;a number of others however viewed the low inflation readings as largely reflecting persistently deficient aggregate demand implying that inflation could remain below 2 percent for a protracted period and further supporting the case for highly accommodative monetary policy
2013-07-31;2013;July;Minute;Positive;0.9557312726974487;a few participants who felt that the recent low inflation rates were unlikely to persist or that the low pce inflation readings might be marked up in future data revisions suggested that as transitory factors receded and the pace of recovery improved inflation could be expected to return to 2 percent reasonably quickly
2013-07-31;2013;July;Minute;Neutral;0.9869374632835388;recent readings on inflation were below the committees longerrun objective of 2 percent in part reflecting transitory factors and participants expressed a range of views about how soon inflation would return to 2 percent
2013-07-31;2013;July;Minute;Negative;0.9895048141479492;however one participant thought that sluggish productivity performance was likely to persist implying that the recent pace of output growth would be sufficient to maintain employment gains near current rates
2013-07-31;2013;July;Minute;Neutral;0.7968381643295288;some participants pointed out that once productivity growth picked up faster economic growth would be required to support further increases in employment along the lines seen of late
2013-07-31;2013;July;Minute;Positive;0.8171666860580444;it was noted that employment growth had been stronger than would have been expected given the recent pace of output growth reflecting weak gains in productivity
2013-07-31;2013;July;Minute;Negative;0.9916375279426575;nonetheless the unemployment rate remained elevated and the continuing low readings on the participation rate and the employmenttopopulation ratio together with a high incidence of workers being employed part time for economic reasons were generally seen as indicating that overall labor market conditions remained weak
2013-07-31;2013;July;Minute;Positive;0.9917488098144531;the june employment report showed continued solid gains in payrolls
2013-07-31;2013;July;Minute;Neutral;0.8279770612716675;it was noted however that fiscal restriction by state and local governments seemed to be easing
2013-07-31;2013;July;Minute;Negative;0.9902065396308899;moreover uncertainty about the effects of the federal spending sequestration and related furloughs clouded the outlook
2013-07-31;2013;July;Minute;Negative;0.9949341416358948;participants reported further signs that the tightening in federal fiscal policy restrained economic activity in the first half of the year cuts in government purchases and grants reportedly had been a factor contributing to slower growth in sales and equipment orders in some parts of the country and consumer spending seemed to have been held back by tax increases
2013-07-31;2013;July;Minute;Positive;0.9859555959701538;although a stepup in business investment was likely to be a necessary element of the projected pickup in economic growth reports from businesses ranged from those contacts who expressed heightened optimism to those who suggested that little acceleration was likely in the second half of the year
2013-07-31;2013;July;Minute;Positive;0.9871029257774353;manufacturing activity was reported to have picked up in a number of districts and activity in the energy sector remained at a high level
2013-07-31;2013;July;Minute;Negative;0.9790319204330444;in the business sector the outlook still appeared to be mixed
2013-07-31;2013;July;Minute;Negative;0.8815250992774963;nonetheless refinancing activity was down sharply and the incoming data would need to be watched carefully for signs of a greaterthananticipated effect of higher mortgage rates on housing activity more broadly
2013-07-31;2013;July;Minute;Positive;0.984112560749054;while recent mortgage rate increases might serve to restrain housing activity several participants expressed confidence that the housing recovery would be resilient in the face of the higher rates variously citing pentup housing demand banks increasing willingness to make mortgage loans strong consumer confidence stilllow real interest rates and expectations of continuing rises in house prices
2013-07-31;2013;July;Minute;Neutral;0.4644099473953247;however in the view of the one member who dissented from the policy statement the improvement in the labor market was an important reason for calling for a more explicit statement from the committee that asset purchases would be reduced in the near future
2013-07-31;2013;July;Minute;Neutral;0.9792155027389526;in looking ahead meeting participants commented on several considerations pertaining to the course of monetary policy
2013-07-31;2013;July;Minute;Neutral;0.9807929992675781;first almost all participants confirmed that they were broadly comfortable with the characterization of the contingent outlook for asset purchases that was presented in the june postmeeting press conference and in the july monetary policy testimony
2013-07-31;2013;July;Statement;Negative;0.9870045781135559;voting against the action was esther l george who was concerned that the continued high level of monetary accommodation increased the risks of future economic and financial imbalances and over time could cause an increase in longterm inflation expectations
2013-07-31;2013;July;Minute;Positive;0.9357099533081055;and if economic conditions continued to develop broadly as anticipated the committee would reduce the pace of purchases in measured steps and conclude the purchase program around the middle of 2014 at that point if the economy evolved along the lines anticipated the recovery would have gained further momentum unemployment would be in the vicinity of 7 percent and inflation would be moving toward the committees 2 percent objective
