Date;Year;Month;Type;sentiment;sentiment_score;sentence
2013-07-31;2013;July;Minute;Negative;0.9553785920143127;however other measures of labor utilizationincluding the labor force participation rate and the numbers of discouraged workers and those working part time for economic reasonssuggested more modest improvement and other indicators of labor demand such as rates of hiring and quits remained low
2013-07-31;2013;July;Minute;Neutral;0.9393239617347717;under that outlook if economic conditions improved broadly as expected the committee would moderate the pace of its securities purchases later this year
2013-07-31;2013;July;Minute;Positive;0.9917560815811157;the unemployment rate had declined considerably since then and recent gains in payroll employment had been solid
2013-07-31;2013;July;Minute;Positive;0.6851757168769836;in considering the likely path for the committees asset purchases members discussed the degree of improvement in the labor market outlook since the purchase program began last fall
2013-07-31;2013;July;Minute;Negative;0.9873074293136597;members recognized however that inflation persistently below the committees 2 percent objective could pose risks to economic performance
2013-07-31;2013;July;Minute;Neutral;0.9748905897140503;inflation was running below the committees longerrun objective partly reflecting transitory influences but longerrun inflation expectations were stable and the committee anticipated that inflation would move back toward its 2 percent objective over the medium term
2013-07-31;2013;July;Minute;Negative;0.9948771595954895;with economic activity and employment continuing to grow despite tighter fiscal policy and with global financial conditions less strained overall members generally continued to see the downside risks to the outlook for the economy and the labor market as having diminished since last fall
2013-07-31;2013;July;Minute;Negative;0.9392135143280029;the committee expected that with appropriate policy accommodation economic growth would pick up from its recent pace resulting in a gradual decline in the unemployment rate toward levels consistent with the committees dual mandate
2013-07-31;2013;July;Minute;Negative;0.9960269927978516;household spending and business fixed investment advanced and the housing sector was strengthening but mortgage rates had risen somewhat and fiscal policy was restraining economic growth
2013-07-31;2013;July;Minute;Negative;0.9932534098625183;labor market conditions showed further improvement in recent months on balance but the unemployment rate remained elevated
2013-07-31;2013;July;Minute;Negative;0.9385846853256226;committee policy action committee members viewed the information received over the intermeeting period as suggesting that economic activity expanded at a modest pace during the first half of the year
2013-07-31;2013;July;Minute;Neutral;0.9240559935569763;the latter enhancement to the forward guidance might be seen as reinforcing the message that the committee was willing to defend its longerterm inflation goal from below as well as from above
2013-07-31;2013;July;Minute;Positive;0.9912545680999756;in their discussion of monetary policy for the period ahead members judged that a highly accommodative stance of monetary policy was warranted in order to foster a stronger economic recovery and sustained improvement in labor market conditions in a context of price stability
2013-07-31;2013;July;Minute;Neutral;0.9899770617485046;a number of participants also remarked on the possible usefulness of providing additional information on the committees intentions regarding adjustments to the federal funds rate after the 612 percent unemployment rate threshold was reached in order to strengthen or clarify the committees forward guidance
2013-07-31;2013;July;Minute;Neutral;0.977620542049408;one participant suggested that the committee could announce an additional lower set of thresholds for inflation and unemployment another indicated that the committee could provide guidance stating that it would not raise its target for the federal funds rate if the inflation rate was expected to run below a given level at a specific horizon
2013-07-31;2013;July;Minute;Negative;0.9842116236686707;while participants viewed the future path of purchases as contingent on economic and financial developments one participant indicated discomfort with the contingent plan on the grounds that the references to specific dates could be misinterpreted by the public as suggesting that the purchase program would be wound down on a moreorless preset schedule rather than in a manner dependent on the state of the economy
2013-07-31;2013;July;Minute;Neutral;0.7359206080436707;a few participants while comfortable with the plan stressed the need to avoid putting too much emphasis on the 7 percent value for the unemployment rate which they saw only as illustrative of conditions that could obtain at the time when the asset purchases are completed
2013-07-31;2013;July;Minute;Neutral;0.9878195524215698;generally however participants were satisfied that investors had come to understand the datadependent nature of the committees thinking about asset purchases
2013-07-31;2013;July;Minute;Negative;0.9819851517677307;most participants saw the provision of such information which would reaffirm the contingent outlook presented following the june meeting as potentially useful however many also saw possible difficulties such as the challenge of conveying the desired information succinctly and with adequate nuance and the associated risk of again raising uncertainty about the committees policy intentions
2013-07-31;2013;July;Minute;Neutral;0.9912520051002502;second participants considered whether it would be desirable to include in the committees policy statement additional information regarding the committees contingent outlook for asset purchases
2013-07-31;2013;July;Minute;Neutral;0.9838343858718872;several participants favored including such additional information in the policy statement to be released following the current meeting several others indicated that providing such information would be most useful when the time came for the committee to begin reducing the pace of its securities purchases reasoning that earlier inclusion might trigger an unintended tightening of financial conditions
2013-07-31;2013;July;Minute;Neutral;0.945543646812439;finally the potential for clarifying or strengthening the committees forward guidance for the federal funds rate was discussed
2013-07-31;2013;July;Minute;Neutral;0.9818659424781799;in general there was support for maintaining the current numerical thresholds in the forward guidance
2013-07-31;2013;July;Minute;Negative;0.9920598268508911;a few participants expressed concern that a decision to lower the unemployment threshold could potentially lead the public to view the unemployment threshold as a policy variable that could not only be moved down but also up thereby calling into question the credibility of the thresholds and undermining their effectiveness
2013-07-31;2013;July;Minute;Neutral;0.9911365509033203;nonetheless several participants were willing to contemplate lowering the unemployment threshold if additional accommodation were to become necessary or if the committee wanted to adjust the mix of policy tools used to provide the appropriate level of accommodation
2013-07-31;2013;July;Minute;Neutral;0.9350484609603882;a few participants saw other forms of communication as better suited for this purpose
