Date;Year;Month;Type;sentiment;sentiment_score;sentence
2023-05-03;2023;May;Minute;Negative;0.9416191577911377;with inflation well above the committees longerrun 2 percent objective and core inflation showing only some signs of moderation participants expected that a period of belowtrend growth in real gdp and some softening in labor market conditions would be needed to bring aggregate supply and aggregate demand into better balance and reduce inflationary pressures over time
2023-05-03;2023;May;Minute;Neutral;0.8127036690711975;participants generally noted that the actions taken by the federal reserve and other government agencies in response to developments in the banking sector had been effective in largely reducing stress
2023-05-03;2023;May;Minute;Negative;0.9873723387718201;many participants commented that the recent developments in the banking sector had contributed to some tightening of lending standards beyond that which had occurred during previous quarters especially among small and midsized banks
2023-05-03;2023;May;Minute;Neutral;0.9867579340934753;however several participants observed that highfrequency measures of consumer sentiment had not yet shown significant changes following the bankingsector developments
2023-05-03;2023;May;Minute;Negative;0.7529298067092896;some participants noted that small businesses tend to rely on small and midsized banks as primary sources of credit and therefore may disproportionally bear the effects of tighter lending conditions
2023-05-03;2023;May;Minute;Negative;0.8639571070671082;participants judged that stress in the banking sector would in coming quarters likely induce banks to tighten lending standards by more than they would have in response to higher interest rates alone
2023-05-03;2023;May;Minute;Neutral;0.7190240621566772;however participants generally noted that it was too early to assess with confidence the magnitude and persistence of these effects on economic activity
2023-05-03;2023;May;Minute;Positive;0.9928866028785706;in their discussion of the household sector participants noted that consumer spending showed strength in the first quarter supported by gains in personal disposable income
2023-05-03;2023;May;Minute;Positive;0.9890542030334473;they also remarked that the quarterly strength was driven mainly by very strong spending growth in january while real spending fell modestly over february and march
2023-05-03;2023;May;Minute;Negative;0.9897088408470154;consistent with that slowing participants anticipated that consumer spending would likely grow at a subdued rate over the remainder of 2023 reflecting in large part the effects of the tightening in financial conditions over the past year
2023-05-03;2023;May;Minute;Neutral;0.8197321891784668;participants remarked that higher interest rates would continue to restrain interestsensitive expenditures by households such as those on housing and durable goods
2023-05-03;2023;May;Minute;Negative;0.9948530793190002;some participants mentioned that access to credit had not yet appeared to have declined significantly since the recent onset of stress in the banking sector
2023-05-03;2023;May;Minute;Negative;0.9197989702224731;in discussing the likely effects on inflation of recent bankingsector developments several participants remarked that tighter credit conditions may not put much downward pressure on inflation in part because lower credit availability could restrain aggregate supply as well as aggregate demand
2023-05-03;2023;May;Minute;Positive;0.9890186786651611;they noted that conditions in the banking sector had broadly improved since early march with the initial deposit outflows experienced by some regional and smaller banks moderating substantially over subsequent weeks
2023-05-03;2023;May;Minute;Positive;0.8319507837295532;participants emphasized that with appropriate firming of monetary policy wellanchored longerterm inflation expectations would support a return of inflation to the committees 2 percent longerrun goal
2023-05-03;2023;May;Minute;Positive;0.9788511991500854;the labor market continued to be tight with robust job gains in recent months and the unemployment rate remained low
2023-05-03;2023;May;Minute;Negative;0.9926488995552063;participants also noted that recent developments in the banking sector would likely result in tighter credit conditions for households and businesses which would weigh on economic activity hiring and inflation
2023-05-03;2023;May;Minute;Neutral;0.8976139426231384;however the extent of these effects remained uncertain
2023-05-03;2023;May;Minute;Neutral;0.9924471378326416;against this backdrop all participants agreed that it was appropriate to raise the target range for the federal funds rate 25 basis points to 5 percent to 514 percent
2023-05-03;2023;May;Minute;Neutral;0.987545907497406;all participants agreed that it was also appropriate to continue the process of reducing the federal reserves securities holdings as described in its previously announced plans for reducing the size of the federal reserves balance sheet
2023-05-03;2023;May;Minute;Neutral;0.9929365515708923;in discussing the policy outlook participants generally agreed that in light of the lagged effects of cumulative tightening in monetary policy and the potential effects on the economy of a further tightening in credit conditions the extent to which additional increases in the target range may be appropriate after this meeting had become less certain
2023-05-03;2023;May;Minute;Negative;0.7120717167854309;economic activity had expanded at a modest pace in the first quarter
2023-05-03;2023;May;Minute;Neutral;0.9913496971130371;participants agreed that it would be important to closely monitor incoming information and assess the implications for monetary policy
2023-05-03;2023;May;Minute;Negative;0.5431602001190186;one such factor was the degree and timing with which cumulative policy tightening restrained economic activity and reduced inflation with some participants commenting that they saw evidence that the past years tightening was beginning to have its intended effect
2023-05-03;2023;May;Minute;Negative;0.9895205497741699;another factor was the degree to which tighter credit conditions for households and businesses resulting from events in the banking sector would weigh on activity and reduce inflation which participants agreed was very uncertain
2023-05-03;2023;May;Minute;Neutral;0.9796321988105774;participants also discussed several riskmanagement considerations that could bear on future policy decisions
2023-05-03;2023;May;Minute;Negative;0.973719596862793;a few assessed that there were upside risks to economic growth
2023-05-03;2023;May;Minute;Positive;0.9849034547805786;several participants noted that longerterm measures of inflation expectations from surveys of households and businesses remained well anchored
2023-05-03;2023;May;Minute;Negative;0.9945058226585388;however almost all participants commented that downside risks to growth and upside risks to unemployment had increased because of the possibility that bankingsector developments could lead to further tightening of credit conditions and weigh on economic activity
2023-05-03;2023;May;Minute;Neutral;0.9926828742027283;in determining the extent to which additional policy firming may be appropriate to return inflation to 2 percent over time various participants noted specific factors that should bear on future decisions on policy actions
2023-05-03;2023;May;Minute;Neutral;0.9848096966743469;in their consideration of appropriate monetary policy actions at this meeting participants concurred that inflation remained substantially elevated relative to the committees longerrun goal of 2 percent
2023-05-03;2023;May;Minute;Negative;0.5057439208030701;additional factors included the progress toward returning inflation to the committees longerrun goal of 2 percent and the pace at which labor market conditions softened and economic growth slowed
2023-05-03;2023;May;Minute;Neutral;0.9384973049163818;a few participants noted the importance of orderly functioning of the market for us treasury securities or stressed the importance of the appropriate authorities continuing to address issues related to the resilience of the market
2023-05-03;2023;May;Minute;Neutral;0.958587646484375;a number of participants emphasized that the federal reserve should maintain readiness to use its liquidity tools as well as its microprudential and macroprudential regulatory and supervisory tools to mitigate future financial stability risks
2023-05-03;2023;May;Minute;Negative;0.9887233972549438;in discussing sources of downside risk to economic activity participants referenced the possibility that the cumulative tightening of monetary policy could affect economic activity more than expected and that further strains in the banking sector could prove more substantial than anticipated
2023-05-03;2023;May;Minute;Negative;0.9935617446899414;some participants also noted concerns that the statutory limit on federal debt might not be raised in a timely manner threatening significant disruptions to the financial system and tighter financial conditions that weaken the economy
2023-05-03;2023;May;Minute;Positive;0.9812270402908325;regarding risks to inflation participants cited the possibility that price pressures could prove more persistent than anticipated because of for example strongerthanexpected consumer spending and a tight labor market especially if the effect of bank stress on economic activity proved modest
2023-05-03;2023;May;Minute;Negative;0.9858335852622986;however a few participants cited the possibility that further tightening of credit conditions could slow household spending and reduce business investment and hiring all of which would support the ongoing rebalancing of supply and demand in product and labor markets and reduce inflation pressures
2023-05-03;2023;May;Minute;Neutral;0.9675810933113098;in their discussion of financial stability various participants commented on recent developments in the banking sector
2023-05-03;2023;May;Minute;Negative;0.9902181029319763;these participants noted that the banking system was sound and resilient that actions taken by the federal reserve in coordination with other government agencies had served to calm conditions in that sector but that stresses remained
2023-05-03;2023;May;Minute;Neutral;0.9084863066673279;participants judged that risks to the outlook for economic activity were weighted to the downside although a few noted the risks were two sided
2023-05-03;2023;May;Minute;Negative;0.9706965088844299;a number of participants noted that the banking sector was well capitalized overall and that the most significant issues in the banking system appeared to be limited to a small number of banks with poor riskmanagement practices or substantial exposure to specific vulnerabilities
2023-05-03;2023;May;Minute;Negative;0.9924585223197937;these vulnerabilities included significant unrealized losses on assets resulting from rising interest rates heavy reliance on uninsured deposits or strained profitability amid higher funding costs
2023-05-03;2023;May;Minute;Negative;0.9950586557388306;some participants additionally noted that because of weak fundamentals for cre such as high vacancy rates in the office segment high exposure to such assets was a vulnerability for some banks
2023-05-03;2023;May;Minute;Negative;0.6817214488983154;participants also commented on the susceptibility of some nonbank financial institutions to runs or instability
2023-05-03;2023;May;Minute;Neutral;0.9433626532554626;these included money market funds which had recently experienced large cash inflows hedge funds which tend to use substantial leverage and may hold concentrated positions in some assets with low or zero margin thinly capitalized nonbank mortgage servicers and digital asset entities
2023-05-03;2023;May;Minute;Neutral;0.7193143963813782;many participants mentioned that it is essential that the debt limit be raised in a timely manner to avoid the risk of severely adverse dislocations in the financial system and the broader economy
2023-05-03;2023;May;Minute;Negative;0.9938965439796448;participants noted that risks associated with the recent banking stress had led them to raise their already high assessment of uncertainty around their economic outlooks
