Date;Year;Month;Type;sentiment;sentiment_score;sentence
2021-12-15;2021;December;Minute;Neutral;0.9832474589347839;the labor force participation rate and the employmenttopopulation ratio both moved up in november
2021-12-15;2021;December;Minute;Negative;0.6410460472106934;privatesector job openings as measured by the job openings and labor turnover survey remained well above prepandemic levels quits rates also stayed elevated despite edging down in october
2021-12-15;2021;December;Minute;Neutral;0.9833239912986755;the fourweek moving average of initial claims for regular state unemployment insurance moved lower through early december and was at a level similar to that seen before the pandemic
2021-12-15;2021;December;Minute;Positive;0.964219331741333;recent weekly estimates of privatesector payrolls constructed by the boards staff using data provided by the payroll processor adp pointed to a further increase in private employment through early december
2021-12-15;2021;December;Minute;Positive;0.9867841005325317;average hourly earnings rose 48 percent over the 12 months ending in november with sizable wage gains observed across most sectors
2021-12-15;2021;December;Minute;Negative;0.6247283816337585;inflation readings remained high and various indicators suggested that inflationary pressures had broadened in recent months
2021-12-15;2021;December;Minute;Neutral;0.9515739679336548;total pce price inflation was 50 percent over the 12 months ending in october and core pce price inflation which excludes changes in consumer energy prices and many consumer food prices was 41 percent over the same period
2021-12-15;2021;December;Minute;Neutral;0.9831455945968628;surveybased measures of medium and longerrun inflation expectationsâincluding those from the university of michigan surveys of consumers the federal reserve bank of new yorks survey of consumer expectations and the survey of professional forecastersâleveled off after having risen over the past year
2021-12-15;2021;December;Minute;Neutral;0.98454350233078;in november the 12month change in the consumer price index cpi was 68 percent while core cpi inflation was 49 percent over the same period
2021-12-15;2021;December;Minute;Positive;0.5760161280632019;real pce growth appeared to be picking up in the fourth quarter despite an upturn in covid19 cases the waning effect of previous fiscal stimulus measures lingering supply bottlenecks and recent increases in consumer prices
2021-12-15;2021;December;Minute;Positive;0.9902452230453491;in particular real expenditures on retail goods rose solidly again in october and outlays for services strengthened
2021-12-15;2021;December;Minute;Positive;0.9903650879859924;the unemployment rate declined from 48 percent in september to 42 percent in november the unemployment rates for african americans and hispanics also declined substantially over this period but both rates remained well above the national average
2021-12-15;2021;December;Minute;Neutral;0.925581157207489;in november however the components of the nominal retail sales data used to estimate pce stepped down possibly reflecting some holiday sales having been pulled forward to october
2021-12-15;2021;December;Minute;Negative;0.99574214220047;light motor vehicle sales in october and november were below their thirdquarter average though they were up on net relative to september as extremely low dealer inventories continued to constrain sales
2021-12-15;2021;December;Minute;Neutral;0.9637119770050049;housing demand remained strong but indicators of housingsector activity including housing starts and home sales were generally little changed in october
2021-12-15;2021;December;Minute;Neutral;0.7878777980804443;the trimmed mean measure of 12month pce inflation constructed by the federal reserve bank of dallas was 26 percent in october an increase of 06 percentage point relative to two months earlier
2021-12-15;2021;December;Minute;Negative;0.9948711395263672;total nonfarm payroll employment rose solidly on average in october and november but the average gain was below that seen in recent quarters
2021-12-15;2021;December;Minute;Neutral;0.9917295575141907;consistent with the previous normalization principles some participants expressed a preference for the federal reserves asset holdings to consist primarily of treasury securities in the longer run
2021-12-15;2021;December;Minute;Positive;0.9894696474075317;labor market conditions continued to improve in october and november and measures of compensation had risen sharply so far this year
2021-12-15;2021;December;Minute;Positive;0.9865684509277344;some participants commented that removing policy accommodation by relying more on balance sheet reduction and less on increases in the policy rate could help limit yield curve flattening during policy normalization
2021-12-15;2021;December;Minute;Negative;0.9903478622436523;a few of these participants raised concerns that a relatively flat yield curve could adversely affect interest margins for some financial intermediaries which may raise financial stability risks
2021-12-15;2021;December;Minute;Neutral;0.8744074106216431;however a couple of other participants referenced staff analysis and previous experience in noting that many factors can affect longerdated yields making it difficult to judge how a different policy mix would affect the shape of the yield curve
2021-12-15;2021;December;Minute;Neutral;0.9534968733787537;many participants judged that the appropriate pace of balance sheet runoff would likely be faster than it was during the previous normalization episode
2021-12-15;2021;December;Minute;Positive;0.6838910579681396;many participants also judged that monthly caps on the runoff of securities could help ensure that the pace of runoff would be measured and predictable particularly given the shorter weighted average maturity of the federal reserves treasury security holdings
2021-12-15;2021;December;Minute;Neutral;0.9523345828056335;participants discussed considerations regarding the longerrun size of the balance sheet consistent with the efficient and effective implementation of monetary policy in an amplereserves regime
2021-12-15;2021;December;Minute;Neutral;0.8485544919967651;participants noted that the current size of the balance sheet is elevated and would likely remain so for some time after the process of normalizing the balance sheet was under way
2021-12-15;2021;December;Minute;Neutral;0.9901110529899597;consumer price inflation through octoberâas measured by the 12month percentage change in the price index for personal consumption expenditures pceâremained elevated
2021-12-15;2021;December;Minute;Neutral;0.6697041988372803;several participants noted that the level of reserves that would ultimately be needed to implement monetary policy effectively is uncertain because the underlying demand for reserves by banks is time varying
2021-12-15;2021;December;Minute;Neutral;0.9849776029586792;participants noted that it would be important to carefully monitor developments in money markets as the level of reserves fell to help inform the committees eventual assessment of the appropriate level for the balance sheet in the longer run
2021-12-15;2021;December;Minute;Negative;0.9044789671897888;some participants expressed the view that the srf would help ensure interest rate control as the size of the balance sheet approached its longerrun level several participants noted that the srf could facilitate a faster runoff of the balance sheet than might otherwise be the case several participants raised the possibility that the establishment of the srf could reduce the demand for reserves in the longer run suggesting that the longerrun balance sheet could be smaller than otherwise
2021-12-15;2021;December;Minute;Neutral;0.9802078604698181;participants also discussed the composition of the federal reserves asset holdings
2021-12-15;2021;December;Minute;Negative;0.9727621078491211;shortages of construction materials appeared to have hampered building completions and there was limited availability of lots ready for construction
2021-12-15;2021;December;Minute;Neutral;0.9744723439216614;to achieve such a composition some participants favored reinvesting principal from agency mbs into treasury securities relatively soon or letting agency mbs run off the balance sheet faster than treasury securities
2021-12-15;2021;December;Minute;Neutral;0.9882532954216003;participants welcomed additional analysis from the staff on issues related to normalization and agreed that continuing their deliberations at upcoming meetings would be useful
2021-12-15;2021;December;Minute;Positive;0.8772237300872803;staff review of the economic situation the information available at the time of the december 14â15 meeting suggested that us real gdp growth was picking up in the fourth quarter after having slowed in the third quarter
2021-12-15;2021;December;Minute;Neutral;0.8107674717903137;in light of this uncertainty and the committees previous experience a couple of participants expressed a preference to allow for a substantial buffer level of reserves to support interest rate control
2021-12-15;2021;December;Minute;Negative;0.99407958984375;growth in business fixed investment appeared to be rising at a slow pace again in the fourth quarter as supply bottlenecks continued to weigh on business equipment spending and the limited availability of construction materials was still holding back spending on nonresidential structures
2021-12-15;2021;December;Minute;Negative;0.992968738079071;however growth in state and local government purchases appeared to be moderating as payrolls decreased in october and november and nominal state and local construction expenditures in october were only a little above their thirdquarter level
2021-12-15;2021;December;Minute;Neutral;0.8299954533576965;motor vehicle output moved up in october from its low level in september as most assembly plants previously shuttered by semiconductor chip shortages had reopened
2021-12-15;2021;December;Minute;Positive;0.9586735367774963;shortterm funding markets were stable while participation in the on rrp facility increased further
2021-12-15;2021;December;Minute;Neutral;0.9309425354003906;overall financing conditions for businesses and households remained accommodative except for small businesses and nonprime borrowers
2021-12-15;2021;December;Minute;Neutral;0.9935402274131775;market participants views on the expected path for the federal funds rateâas implied by a straight read of overnight index swap quotesâsuggested that they had pulled forward expected rate increases more into 2022 and 2023 compared with the timing they anticipated at the time of the previous fomc meeting
2021-12-15;2021;December;Minute;Positive;0.9734272956848145;the potential for a less accommodative policy stance over the next few years contributed to a notable rise in two and fiveyear treasury yields
2021-12-15;2021;December;Minute;Negative;0.9946014881134033;on net inflation compensation had declined moderately since the november fomc meeting as heightened concerns about the inflation outlook appeared to be outweighed by increases in the perceived prospects for tighter monetary policy and by fears about the course of the pandemic
2021-12-15;2021;December;Minute;Negative;0.9863697290420532;renewed concerns about the course of the pandemic also contributed to a decline in the 10year treasury yield on net over the intermeeting period despite strongerthananticipated data on economic activity and surprisingly high inflation
2021-12-15;2021;December;Minute;Positive;0.9895167946815491;broad equity indexes were little changed on net since the previous fomc meeting as strong economic data appeared to offset concerns regarding monetary policy inflation and the pandemic
2021-12-15;2021;December;Minute;Negative;0.9906083345413208;in afes sovereign yields declined and major equity indexes edged down
2021-12-15;2021;December;Minute;Neutral;0.9730206727981567;spreads of both investment and speculativegrade corporate bonds widened moderately and spreads of municipal bonds were little changed
2021-12-15;2021;December;Minute;Neutral;0.9873844385147095;throughout the period the effective federal funds rate remained at 8 basis points apart from a brief decrease on the november monthend and the sofr remained at 5 basis points
2021-12-15;2021;December;Minute;Neutral;0.966242253780365;participation in on rrp operations increased slightly to an average of 15 trillion
2021-12-15;2021;December;Minute;Neutral;0.9025472402572632;foreign asset prices fluctuated over the intermeeting period in response to central bank communications headlines regarding covidrelated restrictions in some countries and the spread of the omicron variant
2021-12-15;2021;December;Minute;Positive;0.6971774101257324;on net afe sovereign yields declined major foreign equity indexes generally edged down and the broad dollar index increased modestly
2021-12-15;2021;December;Minute;Negative;0.9953230023384094;emerging market economy eme sovereign spreads widened and capital flows into emededicated funds turned slightly negative in the second half of november partly in response to concerns about the omicron variant
2021-12-15;2021;December;Minute;Negative;0.9879574179649353;a credit agency declared two heavily indebted chinese property developers to be in restricted default hurting asset prices in chinas real estate sector but spillovers to broader financial markets were limited
2021-12-15;2021;December;Minute;Positive;0.5360530614852905;in domestic credit markets financing conditions for nonfinancial corporations remained accommodative
2021-12-15;2021;December;Minute;Positive;0.7410591244697571;shortterm funding markets were stable over the intermeeting period
2021-12-15;2021;December;Minute;Neutral;0.6188165545463562;in domestic markets broad equity price indexes were little changed equity market volatility increased markedly and spreads on corporate bonds widened moderately
2021-12-15;2021;December;Minute;Negative;0.9742489457130432;pandemicrelated fears as well as concerns about inflation and tighter monetary policy apparently weighed on risky asset prices despite continued robust economic data
2021-12-15;2021;December;Minute;Negative;0.9956908822059631;even so longerdated treasury yields declined on net in part reflecting renewed concerns among market participants about the course of the pandemic and associated safehaven flows
2021-12-15;2021;December;Minute;Positive;0.9853928685188293;outside of motor vehicles manufacturing production also rose in october partly reflecting the continued recovery from the effects of hurricane ida on the output of the petrochemical refining and plastic resins industries
2021-12-15;2021;December;Minute;Neutral;0.9609856605529785;total real government purchases appeared to be rising moderately again in the fourth quarter
2021-12-15;2021;December;Minute;Neutral;0.7917205691337585;federal defense spending rose on net in october and november relative to the third quarter
2021-12-15;2021;December;Minute;Neutral;0.9779613018035889;they emphasized that the decision to initiate runoff would be data dependent
2021-12-15;2021;December;Minute;Positive;0.9737439155578613;after reaching a record level in september the us international trade deficit narrowed in october reflecting a large rebound in exports
2021-12-15;2021;December;Minute;Positive;0.8908980488777161;the export rebound was broad based with sizable increases in real exports of industrial supplies capital goods agricultural products and consumer goods
2021-12-15;2021;December;Minute;Positive;0.8086867332458496;exports of automotive products also picked up after having been low in recent months
2021-12-15;2021;December;Minute;Neutral;0.6406019330024719;real imports were little changed in october with increases in imports of automotive products and consumer goods offset by a decline in industrial supplies
2021-12-15;2021;December;Minute;Negative;0.9901040196418762;shipping congestion and other bottlenecks continued to restrain overall trade in goods
2021-12-15;2021;December;Minute;Negative;0.9959707856178284;exports and imports of services edged up in october but remained low relative to prepandemic levels largely because international travel was still depressed
2021-12-15;2021;December;Minute;Positive;0.9901728630065918;incoming data were consistent with a pickup in foreign economic growth in the current quarter driven mainly by the reopening of asian economies following lockdowns earlier in the year to contain a resurgence of covid19 cases
2021-12-15;2021;December;Minute;Positive;0.9912254214286804;strong gains in intraasian trade and solid readings of purchasing managers indexes also provided some early signs that production bottlenecks in the region were easing
2021-12-15;2021;December;Minute;Negative;0.9947242140769958;in contrast the introduction of new public health restrictions in europe in response to a new wave of covid19 infections appeared to have restrained economic activity in some european economies
2021-12-15;2021;December;Minute;Negative;0.9611048698425293;more recently the detection and rapid spread of the omicron variant prompted new international travel restrictions in many foreign economies
2021-12-15;2021;December;Minute;Neutral;0.767979085445404;inflation abroad continued to rise mostly driven by further increases in retail energy and food prices
2021-12-15;2021;December;Minute;Positive;0.9401144981384277;in addition cost pressures from persistent bottlenecks in supply and transportation were reflected in recordhigh input and output price components of the purchasing managers indexes
2021-12-15;2021;December;Minute;Negative;0.9910063147544861;staff review of the financial situation over the intermeeting period rising inflation and fomc communications appeared to have put substantial upward pressure on shorterdated treasury yields
2021-12-15;2021;December;Minute;Neutral;0.7289240956306458;manufacturing output increased in october and available indicators of production were consistent with another gain in november
2021-12-15;2021;December;Minute;Positive;0.9912550449371338;they noted that current conditions included a stronger economic outlook higher inflation and a larger balance sheet and thus could warrant a potentially faster pace of policy rate normalization
2021-12-15;2021;December;Minute;Positive;0.9834697842597961;participants also judged the federal reserve to be better positioned for normalization than in the past as the amplereserves framework and the federal reserves current interest rate control tools including interest on reserve balances and the overnight reverse repurchase agreement on rrp facility are in place and working well
2021-12-15;2021;December;Minute;Neutral;0.9911409616470337;almost all participants agreed that it would likely be appropriate to initiate balance sheet runoff at some point after the first increase in the target range for the federal funds rate
2021-12-15;2021;December;Statement;Neutral;0.9674882888793945;voting for the monetary policy action were jerome h powell chair john c williams vice chair thomas i barkin raphael w bostic michelle w bowman lael brainard richard h clarida mary c daly charles l evans randal k quarles and christopher j waller
2021-12-15;2021;December;Statement;Neutral;0.9654251337051392;implementation note issued december 15 2021
2021-12-15;2021;December;Minute;Neutral;0.9565704464912415;developments in financial markets and open market operations the manager turned first to a discussion of financial market developments over the period
2021-12-15;2021;December;Minute;Positive;0.5892408490180969;financial markets responded to significant new information about the economy and monetary policy as well as the emergence of the omicron variant
2021-12-15;2021;December;Minute;Neutral;0.9619089365005493;overall domestic financial conditions tightened modestly but remained near historically accommodative levels
2021-12-15;2021;December;Minute;Positive;0.9831287264823914;expectations for an earlier reduction in federal reserve policy accommodation lifted shortterm interest rates and supported the dollar
2021-12-15;2021;December;Minute;Neutral;0.9639490842819214;while prices of equities that are sensitive to covid19 risks declined significantly the sp 500 index was little changed
2021-12-15;2021;December;Statement;Neutral;0.9620710015296936;the committees assessments will take into account a wide range of information including readings on public health labor market conditions inflation pressures and inflation expectations and financial and international developments
2021-12-15;2021;December;Minute;Negative;0.8746179938316345;over the period market participants considered potential drivers of the notable decline in farforward sovereign yields in the united states and other advanced economies
2021-12-15;2021;December;Minute;Neutral;0.9923101663589478;the significant comovement between farforward yields and the share prices of firms most affected by social distancing was consistent with this interpretation
2021-12-15;2021;December;Minute;Negative;0.9937554597854614;in addition to the effects of the pandemic on risk sentiment some discussed the potential for covid to become endemic possibly resulting in modestly lower potential growth over time and a lower longrun neutral level of the federal funds rate
2021-12-15;2021;December;Minute;Negative;0.6193219423294067;regarding the outlook for us monetary policy expectations for a reduction in policy accommodation shifted forward notably
2021-12-15;2021;December;Minute;Neutral;0.9758272171020508;respondents to the open market desks surveys of primary dealers and market participants broadly projected that the committee would quicken the pace of reduction in the federal reserves net purchases of treasury securities and agency mortgagebacked securities mbs and the median respondent projected net asset purchases to end in march 2022 the median respondents projected timing for the first increase in the target range for the federal funds rate also moved earlier from the first quarter of 2023 to june 2022 although the desk surveys and interest rate futures indicated expectations for earlier increases in the target range than at the time of the november meeting expectations for the federal funds rate at longer horizons did not appear to have risen
2021-12-15;2021;December;Minute;Negative;0.9895784258842468;in addition the average of probability distributions for the federal funds rate reported in the desk surveys suggested considerable uncertainty about the path of the federal funds rate as survey respondents placed significant odds on a range of outcomes
2021-12-15;2021;December;Minute;Neutral;0.99090975522995;with the likely timing of the beginning of the removal of policy accommodation considered closer market participants began to discuss how balance sheet policy might feature in the committees plan for reducing accommodation when warranted although expectations for the timing of the first decline in the balance sheet were diffuse
2021-12-15;2021;December;Minute;Neutral;0.9533230662345886;the manager turned next to a discussion of foreign developments
2021-12-15;2021;December;Minute;Positive;0.6982808709144592;news of the omicron variant reportedly drove safehaven flows into sovereign bonds pushing term premiums lower
2021-12-15;2021;December;Minute;Negative;0.9810428619384766;foreign policysensitive rates were relatively steady over the intermeeting period as several central banks in advanced foreign economies afes signaled somewhat cautious approaches to the removal of policy accommodation
2021-12-15;2021;December;Statement;Neutral;0.9935547709465027;the committee would be prepared to adjust the stance of monetary policy as appropriate if risks emerge that could impede the attainment of the committees goals
2021-12-15;2021;December;Statement;Positive;0.9784249067306519;the federal reserves ongoing purchases and holdings of securities will continue to foster smooth market functioning and accommodative financial conditions thereby supporting the flow of credit to households and businesses
2021-12-15;2021;December;Statement;Positive;0.9391180276870728;the federal reserve is committed to using its full range of tools to support the us economy in this challenging time thereby promoting its maximum employment and price stability goals
2021-12-15;2021;December;Statement;Positive;0.9916785955429077;with progress on vaccinations and strong policy support indicators of economic activity and employment have continued to strengthen
2021-12-15;2021;December;Statement;Neutral;0.9097614288330078;the sectors most adversely affected by the pandemic have improved in recent months but continue to be affected by covid19
2021-12-15;2021;December;Minute;Positive;0.9919961094856262;gross corporate bond issuance by both investment and speculativegrade borrowers was solid and gross leveraged loan issuance was robust
2021-12-15;2021;December;Statement;Positive;0.9868516325950623;job gains have been solid in recent months and the unemployment rate has declined substantially
2021-12-15;2021;December;Statement;Negative;0.9672179818153381;supply and demand imbalances related to the pandemic and the reopening of the economy have continued to contribute to elevated levels of inflation
2021-12-15;2021;December;Statement;Positive;0.9787548184394836;overall financial conditions remain accommodative in part reflecting policy measures to support the economy and the flow of credit to us households and businesses
2021-12-15;2021;December;Statement;Neutral;0.9842625856399536;in assessing the appropriate stance of monetary policy the committee will continue to monitor the implications of incoming information for the economic outlook
2021-12-15;2021;December;Statement;Negative;0.6007865071296692;the path of the economy continues to depend on the course of the virus
