Date;Year;Month;Type;sentiment;sentiment_score;sentence
2021-12-15;2021;December;Statement;Negative;0.9790144562721252;risks to the economic outlook remain including from new variants of the virus
2021-12-15;2021;December;Statement;Neutral;0.9899333119392395;the committee seeks to achieve maximum employment and inflation at the rate of 2 percent over the longer run
2021-12-15;2021;December;Statement;Neutral;0.9914352297782898;in support of these goals the committee decided to keep the target range for the federal funds rate at 0 to 14 percent
2021-12-15;2021;December;Statement;Neutral;0.9942377805709839;with inflation having exceeded 2 percent for some time the committee expects it will be appropriate to maintain this target range until labor market conditions have reached levels consistent with the committees assessments of maximum employment
2021-12-15;2021;December;Statement;Neutral;0.9471086859703064;in light of inflation developments and the further improvement in the labor market the committee decided to reduce the monthly pace of its net asset purchases by 20 billion for treasury securities and 10 billion for agency mortgagebacked securities
2021-12-15;2021;December;Statement;Neutral;0.9810640811920166;beginning in january the committee will increase its holdings of treasury securities by at least 40 billion per month and of agency mortgageâbacked securities by at least 20 billion per month
2021-12-15;2021;December;Statement;Neutral;0.9919176697731018;the committee judges that similar reductions in the pace of net asset purchases will likely be appropriate each month but it is prepared to adjust the pace of purchases if warranted by changes in the economic outlook
2021-12-15;2021;December;Statement;Positive;0.9909629225730896;progress on vaccinations and an easing of supply constraints are expected to support continued gains in economic activity and employment as well as a reduction in inflation
2021-12-15;2021;December;Minute;Neutral;0.9667997360229492;however participants judged that the appropriate timing of balance sheet runoff would likely be closer to that of policy rate liftoff than in the committees previous experience
2021-12-15;2021;December;Minute;Neutral;0.9483757019042969;market participants continued to focus on risks related to economic and financial developments in china though nearterm concerns had moderated some following steps by chinese authorities to ease policy
2021-12-15;2021;December;Minute;Positive;0.5471155643463135;overall the transition to a slower pace of purchases had gone smoothly
2021-12-15;2021;December;Minute;Neutral;0.9842602610588074;participants judged that several aspects of the previous approach remained applicable in the current environment
2021-12-15;2021;December;Minute;Neutral;0.992355227470398;in particular they noted that the principles and plans underlying policy normalization were communicated in advance of any decisions or actions which enhanced the publics understanding and thus the effectiveness of monetary policy during that period
2021-12-15;2021;December;Minute;Neutral;0.6612944006919861;at the same time participants remarked that the previous experience highlighted the benefits of maintaining the flexibility to adjust the details of the approach to normalization in response to economic and financial developments
2021-12-15;2021;December;Minute;Neutral;0.9714755415916443;participants generally emphasized that as in the previous normalization episode and as expressed in the committees statement on longerrun goals and monetary policy strategy changes in the target range for the federal funds rate should be the committees primary means for adjusting the stance of monetary policy in support of its maximumemployment and pricestability objectives
2021-12-15;2021;December;Minute;Negative;0.9560203552246094;this preference reflected the view that there is less uncertainty about the effects of changes in the federal funds rate on the economy than about the effects of changes in the federal reserves balance sheet
2021-12-15;2021;December;Minute;Neutral;0.9921942949295044;moreover participants stated that the federal funds rate is a more familiar tool to the general public and therefore is advantageous for communication purposes
2021-12-15;2021;December;Minute;Neutral;0.9710205793380737;a few participants also noted that when the federal funds rate is away from the effective lower bound elb the committee could more nimbly change interest rate policy than balance sheet policy in response to economic conditions
2021-12-15;2021;December;Minute;Neutral;0.9879128336906433;finally the staff reviewed the experience of foreign central banks with policy normalization
2021-12-15;2021;December;Minute;Neutral;0.9832159876823425;participants also discussed some key differences between current economic conditions and those that prevailed during the previous episode and remarked that the committee would have to take these differences into account in removing policy accommodation
2021-12-15;2021;December;Minute;Neutral;0.9767146110534668;they also observed that the federal reserves balance sheet was much larger both in dollar terms and relative to nominal gross domestic product gdp than it was at the end of the third largescale asset purchase program in late 2014 participants noted that the current weighted average maturity of the federal reserves treasury holdings was shorter than at the beginning of the previous normalization episode
2021-12-15;2021;December;Minute;Neutral;0.9657238721847534;some observed that as a result depending on the size of any caps put on the pace of runoff the balance sheet could potentially shrink faster than last time if the committee followed its previous approach in phasing out the reinvestment of maturing treasury securities and principal payments on agency mbs
2021-12-15;2021;December;Minute;Negative;0.9941527247428894;however several participants raised concerns about vulnerabilities in the treasury market and how those vulnerabilities could affect the appropriate pace of balance sheet normalization
2021-12-15;2021;December;Minute;Neutral;0.8055238127708435;a couple of participants noted that the srf could help to mitigate such concerns
2021-12-15;2021;December;Minute;Negative;0.8039824366569519;some participants judged that a significant amount of balance sheet shrinkage could be appropriate over the normalization process especially in light of abundant liquidity in money markets and elevated usage of the on rrp facility
2021-12-15;2021;December;Minute;Neutral;0.9879603385925293;participants had an initial discussion about the appropriate conditions and timing for starting balance sheet runoff relative to raising the federal funds rate from the elb
2021-12-15;2021;December;Minute;Neutral;0.9719685912132263;they also discussed how this relative timing might differ from the previous experience in which balance sheet runoff commenced almost two years after policy rate liftoff when the normalization of the federal funds rate was judged to be well under way
2021-12-15;2021;December;Minute;Positive;0.9924619793891907;most notably participants remarked that the current economic outlook was much stronger with higher inflation and a tighter labor market than at the beginning of the previous normalization episode
2021-12-15;2021;December;Minute;Neutral;0.9633110761642456;turning to desk operations and money markets the manager noted that the desk had reduced net purchases of treasury securities and agency mbs in accordance with the directive issued at the november meeting
2021-12-15;2021;December;Minute;Neutral;0.98401939868927;the staff presentation included assessments of the implications for the yield curve of alternative settings of the two tools the relative uncertainty of the effects of each tool and the challenges associated with conducting and communicating policy with multiple tools
2021-12-15;2021;December;Minute;Neutral;0.9873839616775513;the staff reviewed the previous normalization episode including how the committee commenced normalization by raising the target range for the federal funds rate and then reducing the federal reserves asset holdings in a gradual and predictable manner as well as the timing of these steps
2021-12-15;2021;December;Minute;Negative;0.9907301068305969;in money markets news that a path had emerged to a resolution of the debt ceiling impasse led yields on treasury bills maturing in december and january to decline
2021-12-15;2021;December;Minute;Neutral;0.9697368741035461;following the resolution the treasury was expected to increase bill issuance to restore the treasury general account to more normal levels
2021-12-15;2021;December;Minute;Neutral;0.911203920841217;market participants generally were not anticipating significant strains in money market conditions over year end
2021-12-15;2021;December;Minute;Positive;0.9323233366012573;in discussing recently established backstop facilities the manager noted continued progress towards expanding access to the standing repurchase agreement repo facility srf to depository institutions a number of institutions were currently in the process of becoming srf counterparties
2021-12-15;2021;December;Minute;Neutral;0.9845923781394958;the federal reserve also continued to onboard new counterparties for the foreign and international monetary authorities repo facility and customers to the facility now represented the majority of foreign and international monetary authorities custody holdings of treasury securities at the federal reserve bank of new york
2021-12-15;2021;December;Minute;Neutral;0.9932047128677368;the temporary dollar liquidity swap lines established in march 2020 were set to expire on december 31 the committees foreign currency directive would be updated at the january meeting to reflect the expiration of those lines
2021-12-15;2021;December;Minute;Neutral;0.9763138890266418;finally the manager provided an update on the transition away from libor london interbank offered rate
2021-12-15;2021;December;Minute;Neutral;0.9924964904785156;the staff then discussed some of the channels through which policy rate and balance sheet actions affect financial conditions and alternative ways these tools could be deployed to reduce policy accommodation in support of the committees macroeconomic goals
2021-12-15;2021;December;Minute;Positive;0.9673115611076355;overall considerable progress had been made in the transition away from libor to the secured overnight financing rate sofr in cash and derivatives markets
2021-12-15;2021;December;Minute;Neutral;0.9851465821266174;by unanimous vote the committee ratified the desks domestic transactions over the intermeeting period
2021-12-15;2021;December;Minute;Neutral;0.9661104083061218;there were no intervention operations in foreign currencies for the systems account during the intermeeting period
2021-12-15;2021;December;Minute;Neutral;0.984977126121521;discussion of policy normalization considerations participants began a discussion of a range of topics associated with the eventual normalization of the stance of monetary policy
2021-12-15;2021;December;Minute;Neutral;0.9895033836364746;the topics included the lessons learned from the committees previous experience with policy normalization alternative approaches for removing policy accommodation the timing and sequencing of policy normalization actions and the appropriate size and composition of the federal reserves balance sheet in the longer run
2021-12-15;2021;December;Minute;Neutral;0.9151013493537903;they agreed that their discussion at this meeting would be helpful background for the committees future decisions regarding policy normalization
2021-12-15;2021;December;Minute;Neutral;0.9895229935646057;no decisions regarding the committees approach were made at the meeting
2021-12-15;2021;December;Minute;Neutral;0.9831176996231079;the participants discussion was preceded by staff presentations
2021-12-15;2021;December;Minute;Neutral;0.9103831648826599;however a few key areas of work remained
2021-12-15;2021;December;Minute;Negative;0.9958332180976868;equity raised through traditional initial public offerings also was strong but equity issuance through special purpose acquisition companies remained much weaker than earlier this year
2021-12-15;2021;December;Minute;Neutral;0.9842625856399536;in assessing the appropriate stance of monetary policy the committee will continue to monitor the implications of incoming information for the economic outlook
2021-12-15;2021;December;Minute;Negative;0.9358437061309814;the share of paycheck protection program loans in ci loan balances at banks continued to fall in the third quarter amid ongoing forgiveness of those loans
2021-12-15;2021;December;Minute;Neutral;0.9885011911392212;such a change would result in reducing the monthly pace of net purchases of treasury securities by 20 billion and of agency mbs by 10 billion starting in january
2021-12-15;2021;December;Minute;Neutral;0.9784772992134094;participants also expected that economic conditions would evolve in a manner such that similar reductions in the pace of net asset purchases would be appropriate each subsequent month resulting in an end to net asset purchases in midmarch a few months sooner than participants had anticipated at the november fomc meeting
2021-12-15;2021;December;Minute;Neutral;0.9917130470275879;in addition participants remarked that the committee should continue to be prepared to adjust the pace of purchases if warranted by changes in the economic outlook
2021-12-15;2021;December;Minute;Neutral;0.9211628437042236;participants continued to stress that maintaining flexibility to implement appropriate policy adjustments on the basis of riskmanagement considerations should be a guiding principle in conducting policy in the current highly uncertain environment
2021-12-15;2021;December;Minute;Neutral;0.993308424949646;participants generally noted that given their individual outlooks for the economy the labor market and inflation it may become warranted to increase the federal funds rate sooner or at a faster pace than participants had earlier anticipated
2021-12-15;2021;December;Minute;Neutral;0.9911602139472961;some participants also noted that it could be appropriate to begin to reduce the size of the federal reserves balance sheet relatively soon after beginning to raise the federal funds rate
2021-12-15;2021;December;Minute;Positive;0.9893189072608948;some participants judged that a less accommodative future stance of policy would likely be warranted and that the committee should convey a strong commitment to address elevated inflation pressures
2021-12-15;2021;December;Minute;Neutral;0.9891806244850159;participants judged that it would be appropriate to double the pace of the ongoing reduction in net asset purchases
2021-12-15;2021;December;Minute;Neutral;0.9920156002044678;these participants noted however that a measured approach to tightening policy would help enable the committee to assess incoming data and be in position to react to the full range of plausible economic outcomes
2021-12-15;2021;December;Minute;Neutral;0.9419907927513123;they noted that the sectors most adversely affected by the pandemic had improved in recent months but continued to be affected by covid19
2021-12-15;2021;December;Minute;Positive;0.9897019863128662;job gains had been solid in recent months and the unemployment rate had declined substantially
2021-12-15;2021;December;Minute;Negative;0.9215418100357056;they remarked that supply and demand imbalances related to the pandemic and the reopening of the economy had continued to contribute to elevated levels of inflation
2021-12-15;2021;December;Minute;Positive;0.9762451648712158;overall financial conditions remained accommodative in part reflecting policy measures to support the economy and the flow of credit to us households and businesses
2021-12-15;2021;December;Minute;Negative;0.5673364400863647;members also acknowledged that the path of the economy continued to depend on the course of the virus
2021-12-15;2021;December;Minute;Negative;0.9879635572433472;progress on vaccinations and an easing of supply constraints were expected to support continued gains in economic activity and employment as well as a reduction in inflation but risks to the economic outlook remained including from new variants of the virus
2021-12-15;2021;December;Minute;Neutral;0.9826819896697998;as elevated inflation had persisted for longer than they had previously anticipated members agreed that it was appropriate to remove the reference to transitory factors affecting inflation in the postmeeting statement and instead note that supply and demand imbalances have continued to contribute to elevated inflation
2021-12-15;2021;December;Minute;Positive;0.9906607270240784;committee policy action in their discussion of monetary policy for this meeting members agreed that with progress on vaccinations and strong policy support indicators of economic activity and employment had continued to strengthen
2021-12-15;2021;December;Minute;Neutral;0.9903388619422913;members also agreed that with the emergence of the omicron variant it was appropriate to note the risk of new variants of the virus in their assessment of risks to the economic outlook
2021-12-15;2021;December;Minute;Neutral;0.5743770003318787;they remarked that a quicker conclusion of net asset purchases would better position the committee to set policy to address the full range of plausible economic outcomes
2021-12-15;2021;December;Minute;Negative;0.6170641779899597;some participants also remarked that there could be circumstances in which it would be appropriate for the committee to raise the target range for the federal funds rate before maximum employment had been fully achievedâfor example if the committee judged that its employment and pricestability goals were not complementary in light of economic developments and that inflation pressures and inflation expectations were moving materially and persistently higher in a way that could impede the attainment of the committees longerrun goals
2021-12-15;2021;December;Minute;Positive;0.9804434180259705;a few participants however noted that longterm inflation expectations remained well anchored citing stable readings of marketbased inflation compensation measures or the generally low level of longerterm bond yields
2021-12-15;2021;December;Minute;Negative;0.9934098124504089;participants observed that uncertainty about the economic outlook remained high
2021-12-15;2021;December;Minute;Neutral;0.9895337224006653;most agreed that risks to inflation were weighted to the upside
2021-12-15;2021;December;Minute;Negative;0.974297046661377;several participants pointed to the possibility that structural factors that kept inflation low in the previous decade such as technological changes demographics and the proximity of the elb in an environment of low equilibrium interest rates may reemerge when the effects of the pandemic abate
2021-12-15;2021;December;Minute;Negative;0.9898905754089355;a couple of others noted the risk that persistent real wage growth in excess of productivity growth could trigger inflationary wageâprice dynamics
2021-12-15;2021;December;Minute;Neutral;0.7339568138122559;participants generally continued to stress uncertainties associated with the labor marketâin particular the evolution of labor force participationâand with the length of time required to resolve the supply chain situation
2021-12-15;2021;December;Minute;Negative;0.9896845817565918;many participants noted that the pandemic particularly new variants of the virus continued to pose downside risks to economic activity and upside risks to inflation
2021-12-15;2021;December;Minute;Neutral;0.5698859095573425;in light of elevated inflation pressures and the strengthening labor market participants judged that the increase in policy accommodation provided by the ongoing pace of net asset purchases was no longer necessary
2021-12-15;2021;December;Minute;Positive;0.875917911529541;in their consideration of the stance of monetary policy participants reaffirmed the federal reserves commitment to using its full range of tools to support the us economy during this challenging time thereby promoting the committees statutory goals of maximum employment and price stability
2021-12-15;2021;December;Minute;Neutral;0.9921694397926331;participants agreed that the committees criteria of inflation rising to 2 percent and moderately exceeding 2 percent for some time had been more than met
2021-12-15;2021;December;Minute;Negative;0.8137178421020508;all participants remarked that inflation had continued to run notably above 2 percent reflecting supply and demand imbalances related to the pandemic and the reopening of the economy
2021-12-15;2021;December;Minute;Positive;0.9904612898826599;with respect to the maximumemployment criterion participants noted that the labor market had been making rapid progress as measured by a variety of indicators including solid job gains reported in recent months a substantial further decline in a range of unemployment rates to levels well below those prevailing a year ago and a labor force participation rate that had recently edged up
2021-12-15;2021;December;Minute;Neutral;0.9300941228866577;many participants judged that if the current pace of improvement continued labor markets would fast approach maximum employment
2021-12-15;2021;December;Minute;Neutral;0.9880592226982117;several participants remarked that they viewed labor market conditions as already largely consistent with maximum employment
2021-12-15;2021;December;Minute;Neutral;0.9889856576919556;in support of the committees goals of maximum employment and inflation at the rate of 2 percent over the longer run participants judged that it would be appropriate for the committee to keep the target range for the federal funds rate at 0 to 14 percent until labor market conditions had reached levels consistent with the committees assessments of maximum employment a condition most participants judged could be met relatively soon if the recent pace of labor market improvements continued
2021-12-15;2021;December;Minute;Positive;0.9894165396690369;a few participants remarked that maximum employment consistent with price stability evolves over time and that further improvements in labor markets were likely over subsequent years as the economy continued to expand
2021-12-15;2021;December;Minute;Neutral;0.9879976511001587;participants discussed the progress the economy had made toward the criteria the committee had specified in its forward guidance for the federal funds rate
2021-12-15;2021;December;Minute;Neutral;0.9586466550827026;a couple of participants pointed to reports of higher inflation expectations of businesses and of increased use of costofliving adjustments in wage negotiations as early developments that could potentially affect the anchoring of inflation expectations
2021-12-15;2021;December;Minute;Neutral;0.89069664478302;members agreed that the federal reserve was committed to using its full range of tools to support the us economy in this challenging time thereby promoting its maximum employment and price stability goals
2021-12-15;2021;December;Minute;Neutral;0.9919658899307251;members agreed that the postmeeting statement should be updated to reflect the committees assessment of the progress the economy had made toward the criteria specified in its forward guidance for the target range for the federal funds rate
2021-12-15;2021;December;Minute;Negative;0.9672179818153381;supply and demand imbalances related to the pandemic and the reopening of the economy have continued to contribute to elevated levels of inflation
2021-12-15;2021;December;Minute;Positive;0.9787548184394836;overall financial conditions remain accommodative in part reflecting policy measures to support the economy and the flow of credit to us households and businesses
2021-12-15;2021;December;Minute;Negative;0.6007865071296692;the path of the economy continues to depend on the course of the virus
2021-12-15;2021;December;Minute;Positive;0.9909629225730896;progress on vaccinations and an easing of supply constraints are expected to support continued gains in economic activity and employment as well as a reduction in inflation
2021-12-15;2021;December;Minute;Negative;0.9790144562721252;risks to the economic outlook remain including from new variants of the virus
2021-12-15;2021;December;Minute;Neutral;0.9899333119392395;the committee seeks to achieve maximum employment and inflation at the rate of 2 percent over the longer run
2021-12-15;2021;December;Minute;Neutral;0.9914352297782898;in support of these goals the committee decided to keep the target range for the federal funds rate at 0 to 14 percent
2021-12-15;2021;December;Minute;Positive;0.9868516325950623;job gains have been solid in recent months and the unemployment rate has declined substantially
2021-12-15;2021;December;Minute;Neutral;0.9942377805709839;with inflation having exceeded 2 percent for some time the committee expects it will be appropriate to maintain this target range until labor market conditions have reached levels consistent with the committees assessments of maximum employment
2021-12-15;2021;December;Minute;Neutral;0.9810640811920166;beginning in january the committee will increase its holdings of treasury securities by at least 40 billion per month and of agency mortgageâbacked securities by at least 20 billion per month
2021-12-15;2021;December;Minute;Neutral;0.9919176697731018;the committee judges that similar reductions in the pace of net asset purchases will likely be appropriate each month but it is prepared to adjust the pace of purchases if warranted by changes in the economic outlook
