Date;Year;Month;Type;sentiment;sentiment_score;sentence
2005-12-13;2005;December;Minute;Positive;0.9923094511032104;the economic expansion had shown considerable resilience in the face of higher energy prices and hurricanerelated disruptions suggesting greater underlying strength than had been apparent at the time of the november meeting
2005-12-13;2005;December;Minute;Negative;0.9936621189117432;a slowing of house price increases by restraining the expansion of consumption and a moderation in the pace of new building were expected to reduce the growth of aggregate demand somewhat in coming quarters
2005-12-13;2005;December;Minute;Negative;0.9904265999794006;a downshift in attitudes regarding the outlook for the housing sector could have significant market effects in part by damping the demand for houses by investors and speculators
2005-12-13;2005;December;Minute;Negative;0.7878923416137695;moreover measures of labor compensation showed only moderate gains while relatively wide profit margins could allow firms to absorb somewhat larger increases in labor and other costs without boosting prices
2005-12-13;2005;December;Minute;Negative;0.975771963596344;moreover energy prices generally had fallen back on balance since earlier in the fall and much of the increases in inflation expectations posted in the aftermath of the hurricanes had reversed
2005-12-13;2005;December;Minute;Negative;0.9897498488426208;recent data suggested that thus far indirect effects of elevated energy prices on core inflation had been muted
2005-12-13;2005;December;Minute;Negative;0.994340181350708;in their discussion of prices participants indicated that their concerns about nearterm inflation pressures had eased somewhat over the intermeeting period
2005-12-13;2005;December;Minute;Positive;0.9909546971321106;participants noted that robust competitionincluding that from foreign producersand further substantial gains in productivity were helping to contain cost and price pressures
2005-12-13;2005;December;Minute;Positive;0.9920414090156555;supportive financial conditions and an apparent increase in confidence had contributed to a pickup in growth abroad
2005-12-13;2005;December;Minute;Positive;0.9903429746627808;despite possible firming of monetary policy by some foreign central banks and the rise in the foreign exchange value of the dollar owing to global demands for dollar assets a good portion of the recent strength in foreign economic growth was expected to persist and provide support for us exports
2005-12-13;2005;December;Minute;Positive;0.9882867932319641;economic activity also could be buoyed by developments in other sectors of the economy
2005-12-13;2005;December;Minute;Positive;0.9811615943908691;participants noted that the improved performance of investment suggested that the expansion was becoming more balanced with strengthening business spending potentially offsetting some moderation in the growth of household spending from the elevated rates of recent years
2005-12-13;2005;December;Minute;Negative;0.9059925079345703;in part the pickup may have reflected an increase in business confidence as the economy proved resilient in the face of this years substantial adverse shocks
2005-12-13;2005;December;Minute;Neutral;0.8624908328056335;business investment spending had accelerated some since midyear
2005-12-13;2005;December;Minute;Negative;0.9861473441123962;to date however the national data on home prices sales and construction activity did not suggest a significant weakening in the sector
2005-12-13;2005;December;Minute;Positive;0.8033419251441956;increased federal government outlays were expected to boost output a little next year
