Date;Year;Month;Type;sentiment;sentiment_score;sentence
2022-12-14;2022;December;Minute;Positive;0.9402692914009094;in the context of achieving the committees broadbased and inclusive maximumemployment goal a number of participants commented that as the labor market moved into better balance the unemployment rate for some demographic groupsâparticularly african americans and hispanicsâwould likely increase by more than the national average
2022-12-14;2022;December;Minute;Negative;0.9789935350418091;with inflation still well above the committees longerrun goal of 2 percent participants agreed that inflation was unacceptably high
2022-12-14;2022;December;Minute;Positive;0.7051280736923218;participants recognized that russias war against ukraine was causing tremendous human and economic hardship
2022-12-14;2022;December;Minute;Positive;0.9864664673805237;participants reaffirmed their strong commitment to returning inflation to the committees 2 percent objective
2022-12-14;2022;December;Minute;Positive;0.9632999897003174;participants concurred that the inflation data received for october and november showed welcome reductions in the monthly pace of price increases but they stressed that it would take substantially more evidence of progress to be confident that inflation was on a sustained downward path
2022-12-14;2022;December;Minute;Neutral;0.9953540563583374;participants generally noted that the committees future decisions regarding policy would continue to be informed by the incoming data and their implications for the outlook for economic activity and inflation and that the committee would continue to make decisions meeting by meeting
2022-12-14;2022;December;Minute;Negative;0.9154518842697144;in light of the heightened uncertainty regarding the outlooks for both inflation and real economic activity most participants emphasized the need to retain flexibility and optionality when moving policy to a more restrictive stance
2022-12-14;2022;December;Minute;Negative;0.9854230880737305;in view of the persistent and unacceptably high level of inflation several participants commented that historical experience cautioned against prematurely loosening monetary policy
2022-12-14;2022;December;Minute;Neutral;0.5020033717155457;no participants anticipated that it would be appropriate to begin reducing the federal funds rate target in 2023 participants generally observed that a restrictive policy stance would need to be maintained until the incoming data provided confidence that inflation was on a sustained downward path to 2 percent which was likely to take some time
2022-12-14;2022;December;Minute;Neutral;0.9898629188537598;with inflation staying persistently above the committees 2 percent goal and the labor market remaining very tight all participants had raised their assessment of the appropriate path of the federal funds rate relative to their assessment at the time of the september meeting
2022-12-14;2022;December;Minute;Neutral;0.9921762347221375;in determining the pace of future increases in the target range participants judged that it would be appropriate to take into account the cumulative tightening of monetary policy the lags with which monetary policy affects economic activity and inflation and economic and financial developments
2022-12-14;2022;December;Minute;Neutral;0.9856624007225037;in discussing the policy outlook participants continued to anticipate that ongoing increases in the target range for the federal funds rate would be appropriate to achieve the committees objectives
2022-12-14;2022;December;Minute;Neutral;0.9883179068565369;against this backdrop all participants agreed that it was appropriate to raise the target range for the federal funds rate 50 basis points at this meeting and to continue the process of reducing the federal reserves securities holdings as described in the plans for reducing the size of the federal reserves balance sheet that the committee issued in may
2022-12-14;2022;December;Minute;Negative;0.9911406636238098;even so participants agreed that inflation remained well above the committees longerrun goal of 2 percent while the labor market remained very tight contributing to upward pressures on wages and prices
2022-12-14;2022;December;Minute;Neutral;0.5233809351921082;in their consideration of appropriate monetary policy actions at this meeting participants concurred that the committee had made significant progress over the past year in moving toward a sufficiently restrictive stance of monetary policy
2022-12-14;2022;December;Minute;Negative;0.9934433698654175;they noted that sources of such risks included the potential for more persistent inflation inducing more restrictive policy responses the prospect of unexpected negative shocks tipping the economy into a recession in an environment of subdued growth and the possibility of households and businesses concerns about the outlook restraining their spending sufficiently to reduce aggregate output
2022-12-14;2022;December;Minute;Neutral;0.9101422429084778;a number of participants judged that the risks to the outlook for economic activity were weighted to the downside
2022-12-14;2022;December;Minute;Negative;0.9737488627433777;participants saw a number of uncertainties surrounding the outlook for inflation stemming from factors abroad such as chinas relaxation of its zerocovid policies russias continuing war against ukraine and effects of synchronous policy firming by major central banks
2022-12-14;2022;December;Minute;Positive;0.58962082862854;participants observed that a slowing in the pace of rate increases at this meeting would better allow the committee to assess the economys progress toward the committees goals of maximum employment and price stability as monetary policy approached a stance that was sufficiently restrictive to achieve these goals
2022-12-14;2022;December;Minute;Positive;0.5426623225212097;participants generally noted that the uncertainty associated with their economic outlooks was high and that the risks to the inflation outlook remained tilted to the upside
2022-12-14;2022;December;Minute;Negative;0.9879756569862366;participants cited the possibility that price pressures could prove to be more persistent than anticipated due to for example the labor market staying tight for longer than anticipated
2022-12-14;2022;December;Minute;Negative;0.9932299852371216;some participants also noted that by some measures firms markups were still elevated and that a continued subdued expansion in aggregate demand would likely be needed to reduce remaining upward pressure on inflation
2022-12-14;2022;December;Minute;Neutral;0.9871410131454468;regarding housing services inflation many participants observed that measures of rent based on new leases were indicating a deceleration which would be reflected in the measures of shelter inflation with some lag
2022-12-14;2022;December;Minute;Neutral;0.9880384206771851;participants noted that in the latest inflation data the pace of increase for prices of core services excluding shelterâwhich represents the largest component of core pce price inflationâwas high
2022-12-14;2022;December;Minute;Negative;0.9436547160148621;they also remarked that this component of inflation has tended to be closely linked to nominal wage growth and therefore would likely remain persistently elevated if the labor market remained very tight
2022-12-14;2022;December;Minute;Positive;0.9582595825195312;participants observed that measures from surveys of households and businesses as well as from financial markets generally indicated that longerterm inflation expectations remained well anchored while shortterm inflation expectations had come down
2022-12-14;2022;December;Minute;Negative;0.992028534412384;consequently while there were few signs of adverse wageprice dynamics at present they assessed that bringing down this component of inflation to mandateconsistent levels would require some softening in the growth of labor demand to bring the labor market back into better balance
2022-12-14;2022;December;Minute;Negative;0.9517719745635986;participants noted that core goods prices declined in the october and november cpi data consistent with easing supply bottlenecks
2022-12-14;2022;December;Minute;Negative;0.9735347032546997;several participants commented that the longer inflation remained well above the 2 percent goal the greater the risk that longerterm inflation expectations could become unanchored
2022-12-14;2022;December;Minute;Neutral;0.9350321292877197;such a development if it materialized would make it much more costly to bring inflation down to achieve the committees statutory objectives of maximum employment and price stability
2022-12-14;2022;December;Minute;Negative;0.8594384789466858;participants noted that since the november meeting financial conditions had eased with the marketimplied path for the federal funds rate beyond 2023 and longerterm yields coming down noticeably
2022-12-14;2022;December;Minute;Neutral;0.988678514957428;a few participants remarked that the current configuration of nominal yields with longerterm yields lower than shorterterm yields had historically preceded recessions and hence bore watching
2022-12-14;2022;December;Minute;Negative;0.7506943345069885;however a couple of them also noted that the current inversion of the yield curve could reflect in part that investors expect the nominal policy rate to decline because of a fall in inflation over time
2022-12-14;2022;December;Minute;Positive;0.8766118884086609;however participants stressed that the committees ongoing monetary policy tightening to achieve a stance that will be sufficiently restrictive to return inflation to 2 percent is essential for ensuring that longerterm expectations remain well anchored
