Date;Year;Month;Type;sentiment;sentiment_score;sentence
2022-12-14;2022;December;Minute;Positive;0.786985456943512;in contrast interest rates in credit card offers continued to increase reflecting the higher prime rate that was quickly passed through
2022-12-14;2022;December;Minute;Positive;0.8166463971138;interest rates on auto loans also rose steadily through november
2022-12-14;2022;December;Minute;Negative;0.9945559501647949;credit continued to be generally available to businesses and households but high borrowing costs appeared to weigh on financing volumes in many markets
2022-12-14;2022;December;Minute;Negative;0.7146995067596436;issuance of investmentgrade corporate bonds rebounded somewhat in late october and november from earlier subdued levels while speculativegrade issuance remained soft
2022-12-14;2022;December;Minute;Positive;0.4954761266708374;new launches of leveraged loans picked up in november particularly for higherrated firms
2022-12-14;2022;December;Minute;Negative;0.9636737108230591;business loan originations continued to expand in october and november but at a slower pace than observed in previous months
2022-12-14;2022;December;Minute;Negative;0.9904614090919495;commercial real estate cre loans outstanding at commercial banks continued to increase in october and november but the recent pace was somewhat lower than in previous months
2022-12-14;2022;December;Minute;Positive;0.9912254214286804;nonetheless the volume of ci lending remained solid overall
2022-12-14;2022;December;Minute;Positive;0.6630820631980896;in addition banks increased cre originations to multifamily and industrial properties relative to office properties reflecting caution in the context of rising office vacancies
2022-12-14;2022;December;Minute;Negative;0.9929606318473816;moreover commercial mortgagebacked securities cmbs issuance softened somewhat in october amid elevated financing costs and tighter underwriting standards
2022-12-14;2022;December;Minute;Negative;0.9824405312538147;credit availability to small businesses appeared to have tightened further this fall with the share of small firms reporting that it was more difficult to obtain credit than three months earlier trending up through november
2022-12-14;2022;December;Minute;Negative;0.9836981296539307;residential mortgage rates fell on net after the november fomc meeting
2022-12-14;2022;December;Minute;Positive;0.7853015065193176;ci loans continued to grow in october and november but decelerated relative to the thirdquarter pace moderating the robust rate of growth observed earlier this year
2022-12-14;2022;December;Minute;Negative;0.8962407112121582;municipal bond yields also decreased across rating categories
2022-12-14;2022;December;Minute;Negative;0.9900151491165161;broad stock price indexes increased likely reflecting reduced concerns about the inflation outlook and the associated implications for the future path of policy
2022-12-14;2022;December;Minute;Negative;0.9812198877334595;yields for corporate bonds declined while borrowing costs for leveraged loans remained at an elevated level
2022-12-14;2022;December;Minute;Positive;0.985237181186676;in domestic credit markets changes in borrowing costs were mixed during the intermeeting period but remained above levels observed at the end of the previous tightening cycle
2022-12-14;2022;December;Minute;Negative;0.99142986536026;optionimplied volatility measures for exchange rates and benchmark foreign yields declined but remained elevated by historical norms amid a high degree of uncertainty around global inflation and the prospects for a reopening of the chinese economy
2022-12-14;2022;December;Minute;Positive;0.49745309352874756;emerging market fund outflows moderated and turned to inflows later in the intermeeting period
2022-12-14;2022;December;Minute;Positive;0.9902455806732178;investors reacted positively to news of an easing of covid restrictions in china which drove risky asset prices significantly higher despite nearterm challenges associated with the health policy shift
2022-12-14;2022;December;Minute;Neutral;0.9870204925537109;the foreign exchange value of the dollar depreciated against most foreign currencies particularly against those of advanced foreign economies in part reflecting a narrowing of nearterm yield differentials between the united states and other advanced economies
2022-12-14;2022;December;Minute;Positive;0.9373025894165039;foreign financial conditions broadly eased over the intermeeting period largely driven by lowerthanexpected us inflation data
2022-12-14;2022;December;Minute;Neutral;0.712474524974823;net yields on money market funds rose further over the intermeeting period mostly passing through the increase in administered rates while bank deposit rates increased only slightly in october and november
2022-12-14;2022;December;Minute;Negative;0.9440727829933167;daily takeup in the on rrp facility declined modestly consistent with the recent firming in overnight repo rates
2022-12-14;2022;December;Minute;Negative;0.75239098072052;in secured markets repo rates were below the on rrp offering rate less frequently than in the previous intermeeting period
2022-12-14;2022;December;Minute;Positive;0.9824385046958923;conditions in shortterm funding markets remained stable over the intermeeting period with the november increase in the target range for the federal funds rate and the associated increases in the federal reserves administered rates passing through quickly to overnight money market rates
2022-12-14;2022;December;Minute;Negative;0.991219699382782;in line with reduced investor concerns about the inflation outlook spreads of interest rates on corporate debt mortgagebacked securities and municipal bonds to comparableduration treasury yields all narrowed over the intermeeting period
2022-12-14;2022;December;Minute;Neutral;0.9796556234359741;on net the onemonth optionimplied volatility on the sp 500âthe vixâdecreased notably and was around the middle of its range since mid2020
2022-12-14;2022;December;Minute;Neutral;0.53598552942276;bank interest rates for commercial and industrial ci loans continued to trend up in the third quarter
2022-12-14;2022;December;Minute;Neutral;0.9802827835083008;credit was readily available in the residential mortgage market for highcreditscore borrowers who met standard conforming loan criteria
2022-12-14;2022;December;Minute;Neutral;0.9912481307983398;the longerrun projections represented each participants assessment of the rate to which each variable would be expected to converge over time under appropriate monetary policy and in the absence of further shocks to the economy
2022-12-14;2022;December;Minute;Negative;0.8342785835266113;the number of home purchases and refinance mortgage rate locks edged lower at subdued levels despite recent declines in mortgage interest rates
2022-12-14;2022;December;Minute;Negative;0.9733274579048157;in line with those developments inflation compensation measures based on inflation swaps declined notably especially for shorter maturities
2022-12-14;2022;December;Minute;Negative;0.9928843975067139;moreover the sluggish growth in real private domestic spending expected over the next year a subdued global economic outlook and persistently tight financial conditions were seen as tilting the risks to the downside around the baseline projection for real economic activity and the staff still viewed the possibility of a recession sometime over the next year as a plausible alternative to the baseline
2022-12-14;2022;December;Minute;Negative;0.7469406127929688;with inflation still elevated the staff continued to view the risks to the inflation projection as skewed to the upside
2022-12-14;2022;December;Minute;Neutral;0.9561764597892761;in 2025 both total and core pce price inflation were expected to be near 2 percent
2022-12-14;2022;December;Minute;Negative;0.7214599251747131;core goods inflation was anticipated to slow further housing services inflation was expected to peak in 2023 and then move down while core nonhousing services inflation was forecast to move down as wage growth eased
2022-12-14;2022;December;Minute;Negative;0.9796352982521057;with the effects of supplyâdemand imbalances in goods markets expected to unwind further and labor and product markets projected to become less tight the staff continued to forecast that inflation would decline markedly over the next two years
2022-12-14;2022;December;Minute;Neutral;0.8844956159591675;with all these changes output was expected to move below the staffs estimate of potential near the end of 2024âa year later than in the previous forecastâand to remain below potential in 2025 likewise the unemployment rate was expected to move above the staffs estimate of its natural rate near the end of 2024 and remain above it in 2025 on a fourquarter change basis total pce price inflation was expected to be 55 percent in 2022 while core inflation was expected to be 47 percent both lower than in the november projection
2022-12-14;2022;December;Minute;Negative;0.9924531579017639;moreover the staff assumed a slower pace of decline in the natural rate of unemployment over the near term in response to recent estimates suggesting that jobmatching efficiency was not improving as fast as previously anticipated
2022-12-14;2022;December;Minute;Negative;0.9918323755264282;the staff slightly lowered its outlook for potential output reflecting a lower expected trend in labor force participation
2022-12-14;2022;December;Minute;Negative;0.9941207766532898;nevertheless the forecast for us real gdp growth through 2025 remained subdued
2022-12-14;2022;December;Minute;Negative;0.9271355867385864;broad financial conditions were projected to be somewhat less restrictive than previously assumed as the effects of a higher path for equity values and a lower path for the dollar more than offset a higher mediumterm trajectory for interest rates
2022-12-14;2022;December;Minute;Negative;0.9943203926086426;recent data suggested that real gdp growth in the second half of 2022 was stronger than previously expected but economic growth was still forecast to slow markedly in 2023 from its secondhalf pace
2022-12-14;2022;December;Minute;Negative;0.991576611995697;staff economic outlook the forecast for us economic activity prepared by the staff for the december fomc meeting was not as weak as the november projection
2022-12-14;2022;December;Minute;Positive;0.9853326678276062;while delinquency rates on credit cards remained low relative to their historical range those on auto loans surpassed their prepandemic peak
2022-12-14;2022;December;Minute;Positive;0.8774516582489014;in contrast delinquency rates for credit cards and auto loans continued to rise over the third quarter
2022-12-14;2022;December;Minute;Negative;0.9939042925834656;delinquencies on conventional mortgages continued to trend down through october while those on federal housing administration mortgages ticked up a bit from low levels
2022-12-14;2022;December;Minute;Positive;0.9919639825820923;the credit quality of most households remained solid overall
2022-12-14;2022;December;Minute;Negative;0.9675662517547607;in addition the credit quality of nonagency cmbs loan borrowers deteriorated slightly with average delinquency rates ticking up in september and october driven by the office and retail sectors
2022-12-14;2022;December;Minute;Negative;0.9894030094146729;delinquencies on ci loans stayed flat and those on small businesses loans continued to edge up but delinquencies remained low relative to historical levels
2022-12-14;2022;December;Minute;Positive;0.9703416228294373;the credit quality of businesses that borrow from banks remained sound on balance
2022-12-14;2022;December;Minute;Positive;0.9926823973655701;overall the credit quality of municipalities remained robust amid strong revenues at state and local governments
2022-12-14;2022;December;Minute;Neutral;0.9855011105537415;however measures of expected default probabilities for corporate bonds and leveraged loans had increased from their levels at the beginning of the year in recent months
2022-12-14;2022;December;Minute;Negative;0.9940542578697205;default rates on corporate bonds and leveraged loans remained at very low levels
2022-12-14;2022;December;Minute;Negative;0.9947758913040161;leveraged loans experienced net downgrades in october but the pace of net downgrades slowed substantially in recent weeks
2022-12-14;2022;December;Minute;Positive;0.9790257811546326;the volume of speculativegrade corporate bond downgrades slightly exceeded upgrades in october and november while for investmentgrade corporate bonds the volume of upgrades turned positive on net in november
2022-12-14;2022;December;Minute;Positive;0.9911899566650391;the credit quality of nonfinancial corporations remained solid
2022-12-14;2022;December;Minute;Positive;0.9845184087753296;bank credit data also indicate that the expansion in credit card balances continued in october before slowing in early november
2022-12-14;2022;December;Minute;Positive;0.9913827776908875;consumer credit remained available for most consumers through september with auto loans and credit card debt growing at a robust pace
2022-12-14;2022;December;Minute;Positive;0.9134093523025513;in contrast home equity lines of credit helocs grew notably in recent months on net potentially reflecting homeowners using helocs as a preferred way of extracting home equity in the presence of high mortgage rates
2022-12-14;2022;December;Minute;Negative;0.9947157502174377;credit availability for households with lower credit scores was considerably tighter at levels comparable with what prevailed before the pandemic
2022-12-14;2022;December;Minute;Negative;0.9943752288818359;mediumtolongerterm nominal treasury yields declined substantially over the intermeeting period driven primarily by lowerthanexpected inflation data releases which appeared to prompt a substantial reduction in investors concerns about the possibility that inflation would remain high for a long period
2022-12-14;2022;December;Minute;Negative;0.7303920984268188;on balance the unemployment rate for african americans edged down over those two months while the unemployment rate for hispanics increased slightly the unemployment rates for both groups remained above the national measure
2022-12-14;2022;December;Minute;Positive;0.9911909699440002;credit flows moderated a bit in recent months and the credit quality of businesses and most households remained solid
2022-12-14;2022;December;Minute;Positive;0.6969133019447327;staff review of the economic situation the information available at the time of the december 13â14 meeting suggested that us real gross domestic product gdp was increasing at a modest pace in the fourth quarter of 2022 after expanding strongly in the third quarter
2022-12-14;2022;December;Minute;Neutral;0.9661104083061218;there were no intervention operations in foreign currencies for the systems account during the intermeeting period
2022-12-14;2022;December;Minute;Neutral;0.9851465821266174;by unanimous vote the committee ratified the desks domestic transactions over the intermeeting period
2022-12-14;2022;December;Minute;Neutral;0.8345550894737244;the manager pro tem noted that if transitory pressures emerged in money markets the federal reserves backstop facilities are available to support effective policy implementation and smooth market functioning
2022-12-14;2022;December;Minute;Negative;0.9413800835609436;looking ahead to year end market participants anticipated limited pressures
2022-12-14;2022;December;Minute;Neutral;0.9385349750518799;staff indicated that they would continue to monitor money market conditions closely as balance sheet reduction proceeds
2022-12-14;2022;December;Minute;Negative;0.6327900886535645;over time greater competition among banks for funding could contribute to drawdowns in the on rrp facility
2022-12-14;2022;December;Minute;Neutral;0.9847733974456787;in addition survey information suggested that banks expected to move deposit rates modestly higher relative to the target range in coming months
2022-12-14;2022;December;Minute;Neutral;0.8796220421791077;in recent months banks continued to increase their use of wholesale funding
2022-12-14;2022;December;Minute;Negative;0.7988767623901367;on rrp balances declined on net as money market funds shifted investments out of the on rrp facility reportedly in favor of higher rates available in repo markets
2022-12-14;2022;December;Minute;Positive;0.9677368402481079;repurchase agreement repo rates firmed modestly relative to the overnight reverse repurchase agreement on rrp facility rate over the period with balance sheet reduction reportedly contributing in part to an increase in the demand for financing of treasury securities
2022-12-14;2022;December;Minute;Positive;0.6756518483161926;the manager pro tem turned next to a discussion of operations and money markets and assessed that balance sheet runoff was proceeding smoothly
2022-12-14;2022;December;Minute;Negative;0.9939202070236206;in contrast the marketimplied path of the federal funds rate in 2024 shifted down by as much as 34 percentage point over the period likely reflecting declining risk premiums
2022-12-14;2022;December;Minute;Negative;0.6011281609535217;the surveybased estimate of the expected policy path in 2024 continued to suggest a decline in the target range for the federal funds rate over 2024 little changed from the path anticipated in the november survey
2022-12-14;2022;December;Minute;Neutral;0.9651398062705994;regarding the outlook for monetary policy both market and desk surveybased measures indicated expectations for the committee to maintain elevated policy rates through 2023 in the december survey the median respondents modal expectation for the path of the federal funds rate in 2023 shifted higher by 25 basis points relative to the november survey
2022-12-14;2022;December;Minute;Negative;0.966929018497467;both market and surveybased measures continued to point to expectations for a moderation of inflation over the coming year
2022-12-14;2022;December;Minute;Neutral;0.8493813872337341;however the desk surveybased measures of inflation expectations were little changed from the prior survey suggesting that falling inflation risk premiums may have contributed to the moves
2022-12-14;2022;December;Minute;Negative;0.9928652048110962;regarding the outlook for inflation in the united states inflation compensation implied by treasury inflation protected securities declined over the period responding to lowerthanexpected consumer price index cpi data and a sizable drop in oil prices
2022-12-14;2022;December;Minute;Negative;0.990947425365448;while the spillovers from this situation had been significant among other crypto lenders and exchanges the collapse was not seen as posing broader market risks to the financial system
2022-12-14;2022;December;Minute;Negative;0.9108439683914185;in other market developments the manager pro tem noted the failure of a prominent cryptoasset exchange
2022-12-14;2022;December;Minute;Negative;0.9935997724533081;in foreign exchange markets moderating concerns about the potential for highly elevated us interest rates spurred a depreciation in the foreign exchange value of the dollar
2022-12-14;2022;December;Minute;Negative;0.9831885695457458;however equity market contacts noted risks to growth ahead and earnings expectations for coming quarters had been marked down
2022-12-14;2022;December;Minute;Positive;0.778050422668457;equity markets moved higher
2022-12-14;2022;December;Minute;Negative;0.9896450042724609;consistent with the decline in volatility modelbased measures suggested that a drop in term premiums accounted for much of the decline in treasury yields over the period
2022-12-14;2022;December;Minute;Negative;0.9898501634597778;measures of implied volatility across financial markets declined somewhat from the elevated levels observed in october
2022-12-14;2022;December;Minute;Positive;0.9922939538955688;central bank communications signaling a slower pace of policy rate increases appeared to contribute to improved sentiment
2022-12-14;2022;December;Minute;Positive;0.519362211227417;following several months of tightening financial conditions eased over the period as investor concerns about global risks edged lower and incoming data showed nascent signs of a moderation in inflationary pressures
2022-12-14;2022;December;Minute;Neutral;0.9484078884124756;developments in financial markets and open market operations the manager pro tem turned first to a discussion of developments in financial markets
2022-12-14;2022;December;Minute;Neutral;0.9818759560585022;a summary of economic projections was released to the public following the conclusion of the meeting
2022-12-14;2022;December;Minute;Negative;0.97950279712677;labor market conditions eased somewhat over october and november but remained quite tight
2022-12-14;2022;December;Minute;Negative;0.9421316385269165;the expected path of the federal funds rate implied by a straight read of financial market quotes ended the intermeeting period lower largely reflecting data releases that pointed to a largerthanexpected moderation in inflation
2022-12-14;2022;December;Minute;Negative;0.9885885715484619;consumer price inflationâas measured by the 12month percent change in the price index for personal consumption expenditures pceâstepped down in october but continued to be elevated
2022-12-14;2022;December;Minute;Neutral;0.9234006404876709;the unemployment rate moved up 02 percentage point to 37 percent in october and remained at that rate in november
2022-12-14;2022;December;Minute;Negative;0.9753890037536621;borrowing costs declined on net over the intermeeting period
2022-12-14;2022;December;Minute;Negative;0.9925520420074463;stock market indexes rose on balance likely reflecting reduced concerns about the inflation outlook and market volatility declined notably
2022-12-14;2022;December;Minute;Negative;0.9686269760131836;staff review of the financial situation over the intermeeting period treasury yields and measures of inflation compensation declined on net and the implied path of the federal funds rate in 2023 ended modestly lower
2022-12-14;2022;December;Minute;Negative;0.9802097678184509;in response to high inflation many central banks further tightened monetary policy albeit at a slower pace in some cases
2022-12-14;2022;December;Minute;Negative;0.9848191738128662;despite tentative signs of easing in foreign headline inflation core inflationary pressures remained elevated in many countries
2022-12-14;2022;December;Minute;Negative;0.993827760219574;weaker global demand and high interest rates also weighed on activity in emerging market economies
2022-12-14;2022;December;Minute;Positive;0.9863868951797485;in china authorities began to ease social restrictions even as covid cases surged raising the prospect of significant disruptions to economic activity in the near term but also a faster reopening
2022-12-14;2022;December;Minute;Negative;0.994522213935852;high inflation continued to contribute to a decline in real disposable incomes which together with disruptions to energy supplies depressed economic activity especially in europe
2022-12-14;2022;December;Minute;Negative;0.9949330687522888;foreign economic activity grew at a moderate pace in the third quarter but more recent data pointed to weakening growth weighed down by the economic fallout of russias war against ukraine and a covid19related slowdown in china
2022-12-14;2022;December;Minute;Neutral;0.4780142605304718;exports of services rose in part as travel exports continued to recover while imports of services were little changed
2022-12-14;2022;December;Minute;Positive;0.5005427002906799;real goods imports rose driven by increases in imports of industrial supplies which more than offset declines in imports of capital goods and consumer goods
2022-12-14;2022;December;Minute;Negative;0.9918225407600403;real goods exports fell led by declines in exports of industrial supplies and consumer goods
2022-12-14;2022;December;Minute;Negative;0.8932616710662842;after narrowing in the third quarter the nominal us international trade deficit widened in october
2022-12-14;2022;December;Minute;Negative;0.9889330863952637;a decrease in factory output would be consistent with recent readings from national and regional manufacturing surveys which showed declining new orders and a drawdown in order backlogs
2022-12-14;2022;December;Minute;Negative;0.9874101281166077;manufacturing production increased only modestly in october and the available data pointed to a decline in november
2022-12-14;2022;December;Minute;Negative;0.994249701499939;in contrast residential investment looked to be contracting sharply further and growth in business fixed investment seemed to be slowing markedly with tepid gains in equipment and intangibles spending and continued declines in nonresidential structures investment
2022-12-14;2022;December;Minute;Positive;0.3858174681663513;after expanding at a moderate pace in the third quarter real pce growth appeared to have picked up in the fourth quarter
2022-12-14;2022;December;Minute;Positive;0.9754526615142822;a preliminary estimate of the staffs common inflation expectations index which combines information from many indicators of inflation expectations and inflation compensation edged down in the fourth quarter but continued to be above prepandemic levels
2022-12-14;2022;December;Minute;Negative;0.9933295249938965;the cpi along with data from the producer price index pointed to a further slowing in pce price inflation in november
2022-12-14;2022;December;Minute;Neutral;0.8653537631034851;in november the 12month change in the cpi stepped down to 71 percent and core cpi inflation dropped to 60 percent
