Date;Year;Month;Type;sentiment;sentiment_score;sentence
2022-12-14;2022;December;Minute;Neutral;0.9899998307228088;the trimmed mean measure of 12month pce price inflation constructed by the federal reserve bank of dallas remained at 47 percent in october
2022-12-14;2022;December;Minute;Neutral;0.6360357403755188;core pce price inflation which excludes changes in consumer energy prices and many consumer food prices was 50 percent over the 12 months ending in october down 02 percentage point from its september reading
2022-12-14;2022;December;Minute;Negative;0.883368968963623;total pce price inflation was 60 percent over the 12 months ending in october 03 percentage point below the september figure
2022-12-14;2022;December;Minute;Negative;0.9909687638282776;consumer price inflation remained elevated but had eased in recent months
2022-12-14;2022;December;Minute;Positive;0.9525689482688904;compensation per hour cph in the business sector rose 40 percent over the four quarters ending in the third quarter but the reported increase likely understated the true pace of increase in cph as the lower secondquarter employment data from the quarterly census of employment and wages had not yet been incorporated in the cph measure
2022-12-14;2022;December;Minute;Positive;0.9132542014122009;average hourly earnings rose 51 percent over the 12 months ending in november close to the pace recorded in the employment cost index of hourly compensation in the private sector over the 12 months ending in september
2022-12-14;2022;December;Minute;Neutral;0.9163062572479248;nominal wage growth continued to be elevated and remained above the pace judged to be consistent with the fomcs 2 percent inflation objective
2022-12-14;2022;December;Minute;Positive;0.9649901390075684;the privatesector job openings rate as measured by the job openings and labor turnover survey moved back down in october but remained high
2022-12-14;2022;December;Minute;Negative;0.9926838278770447;both the labor force participation rate and the employmenttopopulation ratio declined a little over the past two months
2022-12-14;2022;December;Minute;Positive;0.9875001311302185;total nonfarm payroll employment posted solid gains in october and november that were slower than the average monthly pace seen over the earlier part of the year
2022-12-14;2022;December;Minute;Negative;0.9747807383537292;in their discussion of current economic conditions participants noted that recent indicators pointed to modest growth of spending and production
2022-12-14;2022;December;Minute;Neutral;0.9865541458129883;participants views on current conditions and the economic outlook in conjunction with this fomc meeting participants submitted their projections of the most likely outcomes for real gdp growth the unemployment rate and inflation for each year from 2022 through 2025 and over the longer run based on their individual assessments of appropriate monetary policy including the path of the federal funds rate
2022-12-14;2022;December;Minute;Negative;0.9903265833854675;inflation remained elevated reflecting supply and demand imbalances related to the pandemic higher food and energy prices and broader price pressures
2022-12-14;2022;December;Minute;Neutral;0.9763945937156677;engage in dollar roll and coupon swap transactions as necessary to facilitate settlement of the federal reserves agency mbs transactions
2022-12-14;2022;December;Minute;Neutral;0.9744095206260681;allow modest deviations from stated amounts for reinvestments if needed for operational reasons
2022-12-14;2022;December;Minute;Neutral;0.9839217662811279;reinvest into agency mortgagebacked securities mbs the amount of principal payments from the federal reserves holdings of agency debt and agency mbs received in each calendar month that exceeds a cap of 35 billion per month
2022-12-14;2022;December;Minute;Neutral;0.9845697283744812;redeem treasury coupon securities up to this monthly cap and treasury bills to the extent that coupon principal payments are less than the monthly cap
2022-12-14;2022;December;Minute;Neutral;0.9886915683746338;roll over at auction the amount of principal payments from the federal reserves holdings of treasury securities maturing in each calendar month that exceeds a cap of 60 billion per month
2022-12-14;2022;December;Minute;Neutral;0.9865732192993164;conduct overnight reverse repurchase agreement operations at an offering rate of 43 percent and with a percounterparty limit of 160 billion per day the percounterparty limit can be temporarily increased at the discretion of the chair
2022-12-14;2022;December;Minute;Neutral;0.9875195026397705;conduct overnight repurchase agreement operations with a minimum bid rate of 45 percent and with an aggregate operation limit of 500 billion the aggregate operation limit can be temporarily increased at the discretion of the chair
2022-12-14;2022;December;Minute;Neutral;0.9914928078651428;at the conclusion of the discussion the committee voted to authorize and direct the federal reserve bank of new york until instructed otherwise to execute transactions in the soma in accordance with the following domestic policy directive for release at 200 pm effective december 15 2022 the federal open market committee directs the desk to undertake open market operations as necessary to maintain the federal funds rate in a target range of 414 to 412 percent
2022-12-14;2022;December;Minute;Neutral;0.9541975259780884;members agreed that their assessments will take into account a wide range of information including readings on public health labor market conditions inflation pressures and inflation expectations and financial and international developments
2022-12-14;2022;December;Minute;Neutral;0.9930220246315002;they would be prepared to adjust the stance of monetary policy as appropriate if risks emerge that could impede the attainment of the committees goals
2022-12-14;2022;December;Minute;Neutral;0.9900767207145691;members agreed that in assessing the appropriate stance of monetary policy they would continue to monitor the implications of incoming information for the economic outlook
2022-12-14;2022;December;Minute;Positive;0.9609696865081787;all members affirmed that the committee is strongly committed to returning inflation to its 2 percent objective
2022-12-14;2022;December;Minute;Neutral;0.9681426882743835;in addition members agreed that they would continue reducing the federal reserves holdings of treasury securities and agency debt and agency mortgagebacked securities as described in the plans for reducing the size of the federal reserves balance sheet that were issued in may
2022-12-14;2022;December;Minute;Neutral;0.993553638458252;members agreed that in determining the pace of future increases in the target range they would take into account the cumulative tightening of monetary policy the lags with which monetary policy affects economic activity and inflation and economic and financial developments
2022-12-14;2022;December;Minute;Neutral;0.991744339466095;members anticipated that ongoing increases in the target range would be appropriate in order to attain a stance of monetary policy that is sufficiently restrictive to return inflation to 2 percent over time
2022-12-14;2022;December;Minute;Neutral;0.984677791595459;in support of these goals members agreed to raise the target range for the federal funds rate to 414 to 412 percent
2022-12-14;2022;December;Minute;Neutral;0.9934412240982056;members agreed that the committee seeks to achieve maximum employment and inflation at the rate of 2 percent over the longer run
2022-12-14;2022;December;Minute;Neutral;0.6032674312591553;members concurred that they remained highly attentive to inflation risks
2022-12-14;2022;December;Minute;Negative;0.9668525457382202;they also agreed that the war and related events were contributing to upward pressure on inflation and were weighing on global economic activity
2022-12-14;2022;December;Minute;Positive;0.5958238840103149;members observed that russias war against ukraine was causing tremendous human and economic hardship
2022-12-14;2022;December;Minute;Negative;0.9719744324684143;members agreed that inflation had remained elevated reflecting supply and demand imbalances related to the pandemic higher food and energy prices and broader price pressures
2022-12-14;2022;December;Minute;Positive;0.846127450466156;members also concurred that job gains had been robust in recent months and the unemployment rate had remained low
2022-12-14;2022;December;Minute;Neutral;0.9498153924942017;committee policy action in their discussion of monetary policy for this meeting members agreed that recent indicators pointed to modest growth in spending and production
2022-12-14;2022;December;Minute;Neutral;0.9869832992553711;participants generally observed that maintaining a restrictive policy stance for a sustained period until inflation is clearly on a path toward 2 percent is appropriate from a riskmanagement perspective
2022-12-14;2022;December;Minute;Neutral;0.9265024662017822;a couple of participants noted that risks to the inflation outlook were becoming more balanced
2022-12-14;2022;December;Minute;Neutral;0.9821130633354187;participants generally indicated that upside risks to the inflation outlook remained a key factor shaping the outlook for policy
2022-12-14;2022;December;Minute;Negative;0.9704774618148804;the other risk was that the lagged cumulative effect of policy tightening could end up being more restrictive than is necessary to bring down inflation to 2 percent and lead to an unnecessary reduction in economic activity potentially placing the largest burdens on the most vulnerable groups of the population
2022-12-14;2022;December;Minute;Negative;0.9911531805992126;one risk was that an insufficiently restrictive monetary policy could cause inflation to remain above the committees target for longer than anticipated leading to unanchored inflation expectations and eroding the purchasing power of households especially for those already facing difficulty making ends meet
2022-12-14;2022;December;Minute;Neutral;0.931156575679779;many participants highlighted that the committee needed to continue to balance two risks
2022-12-14;2022;December;Minute;Negative;0.9904224872589111;the vote also encompassed approval of the statement below for release at 200 pm recent indicators point to modest growth in spending and production
2022-12-14;2022;December;Minute;Neutral;0.9679390788078308;participants discussed a number of riskmanagement considerations related to the conduct of monetary policy
2022-12-14;2022;December;Minute;Negative;0.9893519282341003;inflation remains elevated reflecting supply and demand imbalances related to the pandemic higher food and energy prices and broader price pressures
2022-12-14;2022;December;Minute;Negative;0.9873927235603333;the war and related events are contributing to upward pressure on inflation and are weighing on global economic activity
2022-12-14;2022;December;Minute;Negative;0.7827465534210205;nonetheless job gains had been robust in recent months and the unemployment rate had remained low
2022-12-14;2022;December;Statement;Neutral;0.9573324918746948;for media inquiries please email email protected or call 2024522955 implementation note issued december 14 2022
2022-12-14;2022;December;Statement;Neutral;0.971501350402832;voting for the monetary policy action were jerome h powell chair john c williams vice chair michael s barr michelle w bowman lael brainard james bullard susan m collins lisa d cook esther l george philip n jefferson loretta j mester and christopher j waller
2022-12-14;2022;December;Statement;Neutral;0.9620710015296936;the committees assessments will take into account a wide range of information including readings on public health labor market conditions inflation pressures and inflation expectations and financial and international developments
2022-12-14;2022;December;Statement;Neutral;0.9935547709465027;the committee would be prepared to adjust the stance of monetary policy as appropriate if risks emerge that could impede the attainment of the committees goals
2022-12-14;2022;December;Statement;Neutral;0.9842625856399536;in assessing the appropriate stance of monetary policy the committee will continue to monitor the implications of incoming information for the economic outlook
2022-12-14;2022;December;Statement;Positive;0.8863226771354675;the committee is strongly committed to returning inflation to its 2 percent objective
2022-12-14;2022;December;Statement;Neutral;0.9429877996444702;in addition the committee will continue reducing its holdings of treasury securities and agency debt and agency mortgagebacked securities as described in the plans for reducing the size of the federal reserves balance sheet that were issued in may
2022-12-14;2022;December;Statement;Neutral;0.9874606728553772;in determining the pace of future increases in the target range the committee will take into account the cumulative tightening of monetary policy the lags with which monetary policy affects economic activity and inflation and economic and financial developments
2022-12-14;2022;December;Statement;Neutral;0.9913269877433777;the committee anticipates that ongoing increases in the target range will be appropriate in order to attain a stance of monetary policy that is sufficiently restrictive to return inflation to 2 percent over time
2022-12-14;2022;December;Statement;Neutral;0.9843814373016357;in support of these goals the committee decided to raise the target range for the federal funds rate to 414 to 412 percent
2022-12-14;2022;December;Statement;Neutral;0.9899333119392395;the committee seeks to achieve maximum employment and inflation at the rate of 2 percent over the longer run
2022-12-14;2022;December;Statement;Neutral;0.4900936782360077;the committee is highly attentive to inflation risks
2022-12-14;2022;December;Statement;Negative;0.9873927235603333;the war and related events are contributing to upward pressure on inflation and are weighing on global economic activity
2022-12-14;2022;December;Statement;Negative;0.6584630012512207;russias war against ukraine is causing tremendous human and economic hardship
2022-12-14;2022;December;Statement;Negative;0.9893519282341003;inflation remains elevated reflecting supply and demand imbalances related to the pandemic higher food and energy prices and broader price pressures
2022-12-14;2022;December;Statement;Positive;0.8155920505523682;job gains have been robust in recent months and the unemployment rate has remained low
2022-12-14;2022;December;Statement;Negative;0.9892306923866272;recent indicators point to modest growth in spending and production
2022-12-14;2022;December;Minute;Neutral;0.882091224193573;voting for this
2022-12-14;2022;December;Minute;Neutral;0.9620710015296936;the committees assessments will take into account a wide range of information including readings on public health labor market conditions inflation pressures and inflation expectations and financial and international developments
2022-12-14;2022;December;Minute;Neutral;0.9935547709465027;the committee would be prepared to adjust the stance of monetary policy as appropriate if risks emerge that could impede the attainment of the committees goals
2022-12-14;2022;December;Minute;Neutral;0.9842625856399536;in assessing the appropriate stance of monetary policy the committee will continue to monitor the implications of incoming information for the economic outlook
2022-12-14;2022;December;Minute;Positive;0.8863226771354675;the committee is strongly committed to returning inflation to its 2 percent objective
2022-12-14;2022;December;Minute;Neutral;0.9429877996444702;in addition the committee will continue reducing its holdings of treasury securities and agency debt and agency mortgagebacked securities as described in the plans for reducing the size of the federal reserves balance sheet that were issued in may
2022-12-14;2022;December;Minute;Neutral;0.9874606728553772;in determining the pace of future increases in the target range the committee will take into account the cumulative tightening of monetary policy the lags with which monetary policy affects economic activity and inflation and economic and financial developments
2022-12-14;2022;December;Minute;Neutral;0.9913269877433777;the committee anticipates that ongoing increases in the target range will be appropriate in order to attain a stance of monetary policy that is sufficiently restrictive to return inflation to 2 percent over time
2022-12-14;2022;December;Minute;Neutral;0.9843814373016357;in support of these goals the committee decided to raise the target range for the federal funds rate to 414 to 412 percent
2022-12-14;2022;December;Minute;Neutral;0.9899333119392395;the committee seeks to achieve maximum employment and inflation at the rate of 2 percent over the longer run
2022-12-14;2022;December;Minute;Neutral;0.4900936782360077;the committee is highly attentive to inflation risks
2022-12-14;2022;December;Minute;Negative;0.6584630012512207;russias war against ukraine is causing tremendous human and economic hardship
2022-12-14;2022;December;Minute;Positive;0.987658679485321;several participants commented that the medians of participants assessments for the appropriate path of the federal funds rate in the summary of economic projections which tracked notably above marketbased measures of policy rate expectations underscored the committees strong commitment to returning inflation to its 2 percent goal
2022-12-14;2022;December;Minute;Positive;0.8155920505523682;job gains have been robust in recent months and the unemployment rate has remained low
2022-12-14;2022;December;Minute;Neutral;0.9428696036338806;a number of participants emphasized that it would be important to clearly communicate that a slowing in the pace of rate increases was not an indication of any weakening of the committees resolve to achieve its pricestability goal or a judgment that inflation was already on a persistent downward path
2022-12-14;2022;December;Minute;Positive;0.9905058741569519;under an appropriately restrictive path of monetary policy participants expected labor market supply and demand to come into better balance over time easing upward pressures on nominal wages and prices
2022-12-14;2022;December;Minute;Negative;0.9920513033866882;with the labor force participation rate little changed since the beginning of 2022 some participants commented that labor supply appeared to be constrained by structural factors such as early retirements reduced availability or increased cost of childcare more costly transportation and reduced immigration
2022-12-14;2022;December;Minute;Positive;0.9596617817878723;participants commented that labor demand had remained strong to date despite the slowdown in economic growth with a few remarking that some business contacts reported that they would be keen to retain workers even in the face of slowing demand for output because of their recent experiences of labor shortages and hiring challenges
2022-12-14;2022;December;Minute;Negative;0.9892804026603699;participants generally concluded that there remained a large imbalance between labor supply and labor demand as indicated by the stilllarge number of job openings and elevated nominal wage growth
2022-12-14;2022;December;Minute;Negative;0.9933248162269592;nevertheless they noted that some other measures of employmentâsuch as those based on the bureau of labor statistics household survey and the quarterly census of employment and wagesâsuggested that job growth in 2022 may have been weaker than indicated by payroll employment
2022-12-14;2022;December;Minute;Positive;0.9341248273849487;some participants pointed out that payroll gains had remained robust even as they slowed in recent months
2022-12-14;2022;December;Minute;Negative;0.5943718552589417;several participants commented that there were tentative signs of labor market imbalances improving including declines in job openings and quits over the second half of 2022 as well as reports from district contacts that they were seeing more qualified job applicants for open positions than earlier in the year
2022-12-14;2022;December;Minute;Negative;0.8595654964447021;participants observed that the labor market had remained very tight with the unemployment rate near a historically low level robust payroll gains a high level of job vacancies and elevated nominal wage growth
2022-12-14;2022;December;Minute;Negative;0.9954304695129395;a couple of participants noted that high costs for inputs like diesel feed and fertilizer were creating challenges for the agricultural sector
2022-12-14;2022;December;Minute;Negative;0.9364980459213257;several participants commented that they saw diminished risks of severe disruption from the european unions embargo and the group of sevens price cap on russian oil exports
2022-12-14;2022;December;Minute;Neutral;0.9775124192237854;participants also discussed the developments in energy and agricultural sectors
2022-12-14;2022;December;Minute;Neutral;0.9187548756599426;even so participants remarked that the improvements in supply chains had not been uniform and supply shortages remained for some types of goods
2022-12-14;2022;December;Minute;Negative;0.9894932508468628;based on discussions with district contacts as well as a survey of firms chief financial officers some participants commented that while businesses were generally optimistic about their own prospects they expressed increasing concern about the general economic outlook for 2023 participants noted signs of continued easing in supply bottlenecks with a couple citing district contacts reports of declines in shipping costs and delivery times
2022-12-14;2022;December;Minute;Negative;0.9943513870239258;with regard to the business sector participants noted that growth in investment spending appeared modest and was being restrained by high borrowing costs and an outlook for slow growth of final demand although views on investment prospects varied across businesses and districts
2022-12-14;2022;December;Minute;Negative;0.8050912618637085;a couple of participants remarked on anecdotes or concerns from builder contacts about contract cancellations by purchasers no longer able to qualify for loans at higher interest rates
2022-12-14;2022;December;Minute;Negative;0.9953294992446899;participants commented that higher mortgage interest rates had notably restrained housing activity and that they expected housing activity to remain weak
2022-12-14;2022;December;Minute;Negative;0.9949964284896851;overall participants assessed that there was considerable uncertainty around the consumer spending outlook
2022-12-14;2022;December;Minute;Positive;0.4298225939273834;they also observed that many households were increasingly using credit to finance spending
2022-12-14;2022;December;Minute;Negative;0.9550511837005615;several participants remarked that budgets were stretched for lowtomoderateincome households and that many consumers were shifting their spending to less expensive alternatives
2022-12-14;2022;December;Minute;Negative;0.9283334016799927;a couple of other participants however commented that excess savings particularly among lowincome households appeared to be lower and declining more rapidly than previously thought or that the savings the majority of which appeared to be held by higherincome households might continue to be largely unspent
2022-12-14;2022;December;Minute;Neutral;0.8774489164352417;a couple of participants remarked that excess savings likely would continue to support consumption spending for a while
2022-12-14;2022;December;Minute;Positive;0.9927071928977966;in their discussion of the household sector participants noted that growth in consumer spending in september and october had been stronger than they had previously expected likely supported by a strong labor market and households running down excess savings accumulated during the pandemic
2022-12-14;2022;December;Minute;Positive;0.584290087223053;with inflation remaining unacceptably high participants expected that a sustained period of belowtrend real gdp growth would be needed to bring aggregate supply and aggregate demand into better balance and thereby reduce inflationary pressures
2022-12-14;2022;December;Minute;Negative;0.9902476668357849;participants remarked that although real gdp appeared to have rebounded moderately in the second half of 2022 after declining somewhat in the first half economic activity appeared likely to expand in 2023 at a pace well below its trend growth rate
2022-12-14;2022;December;Minute;Neutral;0.9600883722305298;the effects of those actions were especially notable in interestsensitive sectors particularly housing
2022-12-14;2022;December;Minute;Negative;0.9511027336120605;participants observed that the growth of economic activity had slowed significantly in 2022 from the previous years robust pace partly in response to the committees policy actions
2022-12-14;2022;December;Minute;Negative;0.47077369689941406;against this background participants continued to be highly attentive to inflation risks
2022-12-14;2022;December;Minute;Negative;0.991904616355896;the war and related events were contributing to upward pressure on inflation and were weighing on global economic activity
2022-12-14;2022;December;Minute;Negative;0.9561942219734192;participants noted that because monetary policy worked importantly through financial markets an unwarranted easing in financial conditions especially if driven by a misperception by the public of the committees reaction function would complicate the committees effort to restore price stability
