Date;Year;Month;Type;sentiment;sentiment_score;sentence
2022-09-21;2022;September;Minute;Negative;0.9920946955680847;these global headwinds included heightened risk of recession in europe a slowdown in economic activity occurring in china and the ongoing global economic implications of russias war against ukraine
2022-09-21;2022;September;Minute;Neutral;0.9811827540397644;in 2025 core inflation was expected to be 21 percent
2022-09-21;2022;September;Minute;Negative;0.9839335083961487;participants judged that the war and related events were creating additional upward pressure on inflation and were weighing on global economic activity
2022-09-21;2022;September;Minute;Negative;0.9928501844406128;participants saw supply bottlenecks as likely continuing for a while longer and a couple commented that constraints on production were increasingly taking the form of labor shortages rather than parts shortages
2022-09-21;2022;September;Minute;Negative;0.9899162650108337;participants observed that recent indicators of consumer spending and business investment suggested modest increases in those spending categories but noted that activity in interestsensitive sectors weakened appreciably
2022-09-21;2022;September;Minute;Positive;0.9811750650405884;participants observed that the labor market had remained very tight as evidenced by a historically low unemployment rate elevated job vacancies and quit rates a low pace of layoffs robust employment gains and high nominal wage growth
2022-09-21;2022;September;Minute;Negative;0.9784925580024719;a number of participants commented that a wageâprice spiral had not yet developed but cited its possible emergence as a risk
2022-09-21;2022;September;Minute;Negative;0.9908051490783691;some participants noted rising labor tensions a new round of global energy price increases further disruptions in supply chains and a largerthanexpected passthrough of wage increases into price increases as potential shocks that if they materialized could compound an already challenging inflation problem
2022-09-21;2022;September;Minute;Neutral;0.9879912734031677;participants agreed that the uncertainty associated with their economic outlooks was high and that risks to their inflation outlook were weighted to the upside
2022-09-21;2022;September;Minute;Negative;0.96709144115448;a few participants discussed the increased dispersion of longerterm inflation expectations across respondents in various surveys with an increase in the number of respondents reporting relatively low expectations of future inflation acknowledged as a key driver of the increased dispersion but with a couple of participants citing higher inflation expectations among some survey respondents as a cause for concern and a reason not to be complacent about longerterm inflation expectations remaining well anchored
2022-09-21;2022;September;Minute;Negative;0.9905912280082703;some stressed that a more prolonged period of elevated inflation would increase the risk of inflation expectations becoming unanchored making it much more costly to bring inflation down
2022-09-21;2022;September;Minute;Positive;0.9883728623390198;participants remarked that the committees affirmation of its strong commitment to its pricestability objective together with its forceful policy actions had likely helped keep longerrun inflation expectations anchored
2022-09-21;2022;September;Minute;Neutral;0.9597257971763611;in assessing inflation expectations participants noted that longerterm expectations appeared to remain well anchored as reflected in a broad range of surveys of households businesses and forecasters as well as measures obtained from financial markets
2022-09-21;2022;September;Minute;Neutral;0.6261780858039856;several participants commented that while households across the income distribution were burdened by elevated inflation those at the lower end of the income distribution were particularly harmed as a larger share of their income was spent on housing and other necessities
2022-09-21;2022;September;Minute;Negative;0.9625430703163147;various factors were cited as likely to contribute to this outcome including the committees tightening of its policy stance a gradual easing of supply and demand imbalances in labor and product markets and the likelihood that weaker consumer demand would result in a reduction of business profit margins from their current elevated levels
2022-09-21;2022;September;Minute;Negative;0.9789507985115051;with respect to the medium term participants judged that inflation pressures would gradually recede in coming years
2022-09-21;2022;September;Minute;Negative;0.9930652379989624;numerous contributing factors were cited as supporting this view including labor market tightness and the resulting upward pressure on nominal wages continuing supply chain disruptions and the persistent nature of increases in services prices particularly shelter prices
2022-09-21;2022;September;Minute;Negative;0.9478195905685425;participants commented that they expected inflation pressures to persist in the near term
2022-09-21;2022;September;Minute;Negative;0.910098671913147;these participants considered this development as potentially indicating that the shift of household spending from goods to services might be having a smaller effect on goods prices than they expected or that the supply bottlenecks and labor shortages were taking longer to be resolved
2022-09-21;2022;September;Minute;Negative;0.9341777563095093;several participants noted the continued elevated rates of increase in core goods prices
2022-09-21;2022;September;Minute;Neutral;0.8991734981536865;a few participants reported that business contacts in certain retail sectorsâsuch as used cars and apparelâwere planning to cut prices in order to help reduce their inventories
2022-09-21;2022;September;Minute;Negative;0.9923161268234253;participants judged that a softening in the labor market would be needed to ease upward pressures on wages and prices
2022-09-21;2022;September;Minute;Negative;0.6594526171684265;price pressures had remained elevated and had persisted across a broad array of product categories
2022-09-21;2022;September;Minute;Positive;0.9551605582237244;participants commented that recent inflation data generally had come in above expectations and that correspondingly inflation was declining more slowly than they had previously been anticipating
2022-09-21;2022;September;Minute;Positive;0.7880439162254333;participants observed that inflation remained unacceptably high and well above the committees longerrun goal of 2 percent
2022-09-21;2022;September;Minute;Negative;0.903100311756134;a few participants particularly stressed the high uncertainty associated with the expected future path of the unemployment rate and commented that the unemployment rate could rise by considerably more than in the staff forecast
2022-09-21;2022;September;Minute;Neutral;0.9724223017692566;a few participants remarked that employers facing particularly acute labor shortages were those associated with professional occupations service industries skilled trades and smaller firms
2022-09-21;2022;September;Minute;Negative;0.993044912815094;a couple of participants remarked that in light of challenges in hiring businesses might be less willing to reduce their staffing levels in the event of a weakening in general economic activity
2022-09-21;2022;September;Minute;Negative;0.984211266040802;several commented that they considered it likely that the transition would occur primarily through reduced job vacancies and slower job creation
2022-09-21;2022;September;Minute;Negative;0.9816177487373352;participants expected that the transition toward a softer labor market would be accompanied by an increase in the unemployment rate
2022-09-21;2022;September;Minute;Negative;0.9856003522872925;some participants noted a number of developments consistent with the labor market moving toward better balance including a lower rate of job turnover a moderation in employment growth and an increase in the labor force participation rate for primeage workers
2022-09-21;2022;September;Minute;Negative;0.9640023708343506;participants anticipated that the supply and demand imbalances in the labor market would gradually diminish and the unemployment rate would likely rise somewhat importantly reflecting the effects of tighter monetary policy
2022-09-21;2022;September;Minute;Negative;0.948826253414154;however several participants assessed that the scope for further improvement in labor force participation was likely limited especially in view of the sizable contribution that retirements had made to the previous decline in the participation rate
2022-09-21;2022;September;Minute;Positive;0.978661298751831;energy prices had declined in recent months but remained considerably higher than in 2021 and upside risks to energy prices remained
