Date;Year;Month;Type;sentiment;sentiment_score;sentence
2022-09-21;2022;September;Minute;Positive;0.9452113509178162;the gradual reduction in on rrp balances could also be facilitated by rising competition among banks in seeking deposits
2022-09-21;2022;September;Minute;Negative;0.9861392378807068;both of these developments would ease downward pressure on yields on safe shortterm investments
2022-09-21;2022;September;Minute;Positive;0.6602572798728943;issuance of shortterm securities was likely to increase in coming periods and as more clarity emerged in the economic and policy outlook demand for shortterm assets could moderate
2022-09-21;2022;September;Minute;Negative;0.9903095364570618;the staff continued to anticipate that on rrp takeup would decline in coming quarters from its currently elevated levels as money market participants responded to shifting conditions
2022-09-21;2022;September;Minute;Positive;0.6895438432693481;amid strong demand for shortterm investments takeup at the overnight reverse repurchase agreement on rrp facility was relatively steady at elevated levels
2022-09-21;2022;September;Minute;Positive;0.9877198338508606;labor demand remained strong and the labor market continued to be very tight
2022-09-21;2022;September;Minute;Negative;0.9952130317687988;however the staffs estimate of potential output in recent history was revised down significantly in response to continued disappointing productivity growth and the sluggish gains in labor force participation seen so far this year moreover this lower trajectory for potential output was expected to persist throughout the forecast period
2022-09-21;2022;September;Minute;Negative;0.9924460053443909;in addition to russias war in ukraine weakening activity abroad and ongoing supply chain bottlenecks the possibility that a persistent reduction in inflation could require a greaterthanassumed amount of tightening in financial conditions was viewed by the staff as a salient downside risk to their forecast for real activity
2022-09-21;2022;September;Minute;Neutral;0.990423321723938;although the staff continued to project that core inflation would step down over the next two yearsâreflecting the anticipated resolution of supplyâdemand imbalances and a labor market that was expected to become less tightâcore inflation was revised up in each year of the projection
2022-09-21;2022;September;Minute;Neutral;0.9034900665283203;committee policy action in their discussion of monetary policy for this meeting members agreed that recent indicators had pointed to modest growth in spending and production
2022-09-21;2022;September;Minute;Negative;0.9951653480529785;a few of these participants noted that this possibility was heightened by factors beyond the committees actions including the tightening of monetary policy stances abroad and the weakening global economic outlook that were also likely to restrain domestic economic activity in the period ahead
2022-09-21;2022;September;Minute;Negative;0.7245983481407166;several participants observed that as policy moved into restrictive territory risks would become more twosided reflecting the emergence of the downside risk that the cumulative restraint in aggregate demand would exceed what was required to bring inflation back to 2 percent
2022-09-21;2022;September;Minute;Negative;0.9919082522392273;several participants underlined the need to maintain a restrictive stance for as long as necessary with a couple of these participants stressing that historical experience demonstrated the danger of prematurely ending periods of tight monetary policy designed to bring down inflation
2022-09-21;2022;September;Minute;Neutral;0.5824880003929138;many participants emphasized that the cost of taking too little action to bring down inflation likely outweighed the cost of taking too much action
2022-09-21;2022;September;Minute;Neutral;0.811556339263916;in light of the broadbased and unacceptably high level of inflation the intermeeting news of higherthanexpected inflation and upside risks to the inflation outlook participants remarked that purposefully moving to a restrictive policy stance in the near term was consistent with riskmanagement considerations
2022-09-21;2022;September;Minute;Negative;0.9810373187065125;these policy moves would therefore prevent the far greater economic pain associated with entrenched high inflation including the even tighter policy and more severe restraint on economic activity that would then be needed to restore price stability
2022-09-21;2022;September;Minute;Neutral;0.98455411195755;they agreed that by moving its policy purposefully toward an appropriately restrictive stance the committee would help ensure that elevated inflation did not become entrenched and that inflation expectations did not become unanchored
2022-09-21;2022;September;Minute;Negative;0.613947331905365;participants observed that a period of real gdp growth below its trend rate very likely accompanied by some softening in labor market conditions was required
2022-09-21;2022;September;Minute;Neutral;0.5260368585586548;they noted also that inflation had not yet responded appreciably to policy tightening and that a significant reduction in inflation would likely lag that of aggregate demand
2022-09-21;2022;September;Minute;Neutral;0.9503030180931091;most participants remarked that although some interestsensitive categories of spendingâsuch as housing and business fixed investmentâhad already started to respond to the tightening of financial conditions a sizable portion of economic activity had yet to display much response
2022-09-21;2022;September;Minute;Positive;0.8806467056274414;participants observed that this tightening had led to substantial increases in real interest rates across the maturity spectrum
2022-09-21;2022;September;Minute;Negative;0.809370756149292;participants noted that the committees commitment to restoring price stability together with its purposeful policy actions and communications had contributed to a notable tightening of financial conditions over the past year that would likely help reduce inflation pressures by restraining aggregate demand
2022-09-21;2022;September;Minute;Positive;0.846127450466156;members also concurred that job gains had been robust in recent months and the unemployment rate had remained low
2022-09-21;2022;September;Minute;Neutral;0.9680831432342529;in their assessment of the effects of policy actions and communications to date participants concurred that the committees actions to raise expeditiously the target range for the federal funds rate demonstrated its resolve to lower inflation to 2 percent and to keep inflation expectations anchored at levels consistent with that longerrun goal
2022-09-21;2022;September;Minute;Negative;0.9613853096961975;they further observed that a significant reduction in the committees holdings of securities was in progress and that this process was contributing to the move to a restrictive policy stance
2022-09-21;2022;September;Minute;Neutral;0.9849759936332703;participants noted that in keeping with the committees plans for reducing the size of the federal reserves balance sheet balance sheet runoff had moved up to its maximum planned pace in september and would continue at that pace
2022-09-21;2022;September;Minute;Neutral;0.9628864526748657;many participants indicated that once the policy rate had reached a sufficiently restrictive level it likely would be appropriate to maintain that level for some time until there was compelling evidence that inflation was on course to return to the 2 percent objective
2022-09-21;2022;September;Minute;Neutral;0.9930944442749023;participants observed that as the stance of monetary policy tightened further it would become appropriate at some point to slow the pace of policy rate increases while assessing the effects of cumulative policy adjustments on economic activity and inflation
2022-09-21;2022;September;Minute;Neutral;0.9820468425750732;several participants noted that particularly in the current highly uncertain global economic and financial environment it would be important to calibrate the pace of further policy tightening with the aim of mitigating the risk of significant adverse effects on the economic outlook
2022-09-21;2022;September;Minute;Neutral;0.941088080406189;participants judged that the pace and extent of policy rate increases would continue to depend on the implications of incoming information for the outlook for economic activity and inflation and on risks to the outlook
2022-09-21;2022;September;Minute;Neutral;0.9792966246604919;many participants noted that with inflation well above the committees 2 percent objective and showing little sign so far of abating and with supply and demand imbalances in the economy continuing they had raised their assessment of the path of the federal funds rate that would likely be needed to achieve the committees goals
2022-09-21;2022;September;Minute;Neutral;0.9529825448989868;participants judged that the committee needed to move to and then maintain a more restrictive policy stance in order to meet the committees legislative mandate to promote maximum employment and price stability
2022-09-21;2022;September;Minute;Neutral;0.988491415977478;in discussing potential policy actions at upcoming meetings participants continued to anticipate that ongoing increases in the target range for the federal funds rate would be appropriate to achieve the committees objectives
2022-09-21;2022;September;Minute;Positive;0.8363755941390991;participants reaffirmed their strong commitment to returning inflation to the committees 2 percent objective with many stressing the importance of staying on this course even as the labor market slowed
2022-09-21;2022;September;Minute;Neutral;0.5984203219413757;policymakers observed that the rate hike at this meeting was another step toward making the committees monetary policy stance sufficiently restrictive to help ease supply and demand imbalances and to bring inflation back to 2 percent
2022-09-21;2022;September;Minute;Neutral;0.988212525844574;against this backdrop all participants agreed that it was appropriate to raise the target range for the federal funds rate 75 basis points at this meeting and to continue the process of reducing the federal reserves securities holdings as described in the plans for reducing the size of the federal reserves balance sheet that the committee issued in may
2022-09-21;2022;September;Minute;Negative;0.9923644065856934;participants observed that recent indicators of production and spending had pointed to modest growth while job gains had been robust and the unemployment rate had remained low
2022-09-21;2022;September;Minute;Neutral;0.9915140867233276;a couple of participants remarked that after the process of balance sheet reduction was well under way it would be appropriate for the committee to consider sales of agency mbs in order to enable suitable progress toward a longerrun soma portfolio composed primarily of treasury securities
2022-09-21;2022;September;Minute;Neutral;0.4700298607349396;in their consideration of the appropriate stance of monetary policy participants concurred that the labor market was very tight and that inflation was far above the committees 2 percent inflation objective
2022-09-21;2022;September;Minute;Positive;0.5958238840103149;members observed that russias war against ukraine was causing tremendous human and economic hardship
2022-09-21;2022;September;Minute;Neutral;0.43588170409202576;members remarked that they remained highly attentive to inflation risks
2022-09-21;2022;September;Minute;Neutral;0.9245206117630005;as a result the staffs estimate of the output gap was revised up considerably this year and while the staff projection still had the output gap closing in coming years the level of output was expected to be slightly above potential at the end of 2025 likewise the unemployment rate was expected to rise more slowly than in the july projection and to be slightly below the staffs estimate of its natural rate at the end of 2025 on a 12month change basis total pce price inflation was expected to be 51 percent in 2022 and core inflation was expected to be 43 percent
2022-09-21;2022;September;Minute;Neutral;0.882091224193573;voting for this
2022-09-21;2022;September;Minute;Neutral;0.9620710015296936;the committees assessments will take into account a wide range of information including readings on public health labor market conditions inflation pressures and inflation expectations and financial and international developments
2022-09-21;2022;September;Minute;Neutral;0.9935547709465027;the committee would be prepared to adjust the stance of monetary policy as appropriate if risks emerge that could impede the attainment of the committees goals
2022-09-21;2022;September;Minute;Neutral;0.9842625856399536;in assessing the appropriate stance of monetary policy the committee will continue to monitor the implications of incoming information for the economic outlook
2022-09-21;2022;September;Minute;Positive;0.8863226771354675;the committee is strongly committed to returning inflation to its 2 percent objective
2022-09-21;2022;September;Minute;Neutral;0.9429877996444702;in addition the committee will continue reducing its holdings of treasury securities and agency debt and agency mortgagebacked securities as described in the plans for reducing the size of the federal reserves balance sheet that were issued in may
2022-09-21;2022;September;Minute;Neutral;0.985952615737915;in support of these goals the committee decided to raise the target range for the federal funds rate to 3 to 314 percent and anticipates that ongoing increases in the target range will be appropriate
2022-09-21;2022;September;Minute;Neutral;0.9899333119392395;the committee seeks to achieve maximum employment and inflation at the rate of 2 percent over the longer run
2022-09-21;2022;September;Minute;Neutral;0.4900936782360077;the committee is highly attentive to inflation risks
2022-09-21;2022;September;Minute;Negative;0.9892710447311401;the war and related events are creating additional upward pressure on inflation and are weighing on global economic activity
2022-09-21;2022;September;Minute;Negative;0.6584630012512207;russias war against ukraine is causing tremendous human and economic hardship
2022-09-21;2022;September;Minute;Negative;0.9893519282341003;inflation remains elevated reflecting supply and demand imbalances related to the pandemic higher food and energy prices and broader price pressures
2022-09-21;2022;September;Minute;Negative;0.9714306592941284;they also agreed that the war and related events were creating additional upward pressure on inflation and were weighing on global economic activity
2022-09-21;2022;September;Minute;Positive;0.8155920505523682;job gains have been robust in recent months and the unemployment rate has remained low
2022-09-21;2022;September;Minute;Neutral;0.9763945937156677;engage in dollar roll and coupon swap transactions as necessary to facilitate settlement of the federal reserves agency mbs transactions
2022-09-21;2022;September;Minute;Neutral;0.9744095206260681;allow modest deviations from stated amounts for reinvestments if needed for operational reasons
2022-09-21;2022;September;Minute;Neutral;0.9839217662811279;reinvest into agency mortgagebacked securities mbs the amount of principal payments from the federal reserves holdings of agency debt and agency mbs received in each calendar month that exceeds a cap of 35 billion per month
2022-09-21;2022;September;Minute;Neutral;0.9845697283744812;redeem treasury coupon securities up to this monthly cap and treasury bills to the extent that coupon principal payments are less than the monthly cap
2022-09-21;2022;September;Minute;Neutral;0.9886915683746338;roll over at auction the amount of principal payments from the federal reserves holdings of treasury securities maturing in each calendar month that exceeds a cap of 60 billion per month
2022-09-21;2022;September;Minute;Neutral;0.986933708190918;conduct overnight reverse repurchase agreement operations at an offering rate of 305 percent and with a percounterparty limit of 160 billion per day the percounterparty limit can be temporarily increased at the discretion of the chair
2022-09-21;2022;September;Minute;Neutral;0.9874776601791382;conduct overnight repurchase agreement operations with a minimum bid rate of 325 percent and with an aggregate operation limit of 500 billion the aggregate operation limit can be temporarily increased at the discretion of the chair
2022-09-21;2022;September;Minute;Neutral;0.9917731881141663;at the conclusion of the discussion the committee voted to authorize and direct the federal reserve bank of new york until instructed otherwise to execute transactions in the soma in accordance with the following domestic policy directive for release at 200 pm effective september 22 2022 the federal open market committee directs the desk to undertake open market operations as necessary to maintain the federal funds rate in a target range of 3 to 314 percent
2022-09-21;2022;September;Minute;Positive;0.9382729530334473;members affirmed that the committee was strongly committed to returning inflation to its 2 percent objective
2022-09-21;2022;September;Minute;Neutral;0.969402015209198;they also noted that their assessments would take into account a wide range of information including readings on public health labor market conditions inflation pressures and inflation expectations and financial and international developments
2022-09-21;2022;September;Minute;Neutral;0.9933342933654785;members agreed that in assessing the appropriate stance of monetary policy they would continue to monitor the implications of incoming information for the economic outlook and that they would be prepared to adjust the stance of monetary policy as appropriate if risks emerged that could impede the attainment of the committees goals
2022-09-21;2022;September;Minute;Neutral;0.9716023802757263;in addition members agreed that the committee would continue reducing its holdings of treasury securities and agency debt and agency mbs as described in the plans for reducing the size of the federal reserves balance sheet issued in may
2022-09-21;2022;September;Minute;Neutral;0.9905672669410706;in their assessment of the monetary policy stance necessary for achieving the committees maximumemployment and pricestability goals the committee decided to raise the target range for the federal funds rate to 3 to 314 percent and anticipated that ongoing increases in the target range would be appropriate
2022-09-21;2022;September;Minute;Negative;0.9904224872589111;the vote also encompassed approval of the statement below for release at 200 pm recent indicators point to modest growth in spending and production
2022-09-21;2022;September;Minute;Negative;0.9831492304801941;several participants noted that the monetary policy tightening under way in many other economies would affect global financial markets and foreign real gdp growth with the potential for spillovers to the us economy
2022-09-21;2022;September;Minute;Negative;0.9396576881408691;members agreed that inflation remained elevated reflecting supply and demand imbalances related to the pandemic higher food and energy prices and broader price pressures
2022-09-21;2022;September;Minute;Neutral;0.9289273619651794;participants broadly judged the risks to real gdp growth to be weighted to the downside with various global headwinds most prominently cited as contributing factors
2022-09-21;2022;September;Minute;Neutral;0.7338294982910156;participants discussed how they perceived challenging supply conditions to be evolving
2022-09-21;2022;September;Minute;Negative;0.9957551956176758;a couple of participants noted that businesses were constrained in undertaking new capital projects as they faced higher financing costs persistent challenges associated with supply bottlenecks and hiring difficulties resulting from the continued tightness of the labor market
2022-09-21;2022;September;Minute;Negative;0.9945906400680542;several participants mentioned that manufacturing activity had slowed
2022-09-21;2022;September;Minute;Negative;0.9353600144386292;with regard to the business sector participants observed that growth in investment spending appeared modest
2022-09-21;2022;September;Minute;Negative;0.9881070852279663;participants observed that the notable slowdown in residential investment and other interestsensitive spending had continued reflecting the effect of the committees monetary policy actions and tighter financial conditions
2022-09-21;2022;September;Minute;Neutral;0.5244525671005249;these participants also noted that the composition of spending by lowtomoderateincome householdsâwho were affected to a greater degree by high food energy and shelter pricesâwas changing with discretionary expenditures being cut and purchases shifting to lowercost options
2022-09-21;2022;September;Minute;Positive;0.9691686034202576;several participants noted that spending appeared to have held up relatively well especially among higherincome households
2022-09-21;2022;September;Minute;Positive;0.9919167160987854;in their discussion of the household sector participants noted that consumer spending grew moderately reflecting strength in the labor market the elevated level of household savings accumulated during the pandemic and a strong aggregate householdsector balance sheet
2022-09-21;2022;September;Minute;Positive;0.6824216246604919;participants noted that a period of belowtrend real gdp growth would help reduce inflationary pressures and set the stage for the sustained achievement of the committees objectives of maximum employment and price stability
2022-09-21;2022;September;Minute;Negative;0.9941061735153198;participants generally anticipated that the us economy would grow at a belowtrend pace in this and the coming few years with the labor market becoming less tight as monetary policy assumed a restrictive stance and global headwinds persisted
2022-09-21;2022;September;Minute;Positive;0.934687614440918;several participants noted that the continued strength in the labor market as well as the data on gross domestic income raised the possibility that the current gdp data could understate the strength in economic activity this year
2022-09-21;2022;September;Minute;Negative;0.6616315245628357;participants revised down their projections of real gdp growth for this year from their projections in june
2022-09-21;2022;September;Minute;Negative;0.9871243238449097;with regard to the economic outlook participants noted that recent data pointed to modest growth in economic activity over the second half of this year
2022-09-21;2022;September;Minute;Positive;0.7116596698760986;many participants remarked that their business contacts were reporting signs of relief in supply bottlenecks such as declines in shipping costs and delivery times and rising inventories while several participants saw little improvement in the supply situation
2022-09-21;2022;September;Minute;Positive;0.74712073802948;against this background participants remained highly attentive to inflation risks
2022-09-21;2022;September;Minute;Positive;0.7051280736923218;participants recognized that russias war against ukraine was causing tremendous human and economic hardship
2022-09-21;2022;September;Minute;Negative;0.9903265833854675;inflation remained elevated reflecting supply and demand imbalances related to the pandemic higher food and energy prices and broader price pressures
2022-09-21;2022;September;Minute;Positive;0.9169718623161316;job gains had been robust in recent months and the unemployment rate had remained low
2022-09-21;2022;September;Minute;Negative;0.980525553226471;in their discussion of current economic conditions participants noted that recent indicators had pointed to modest growth in spending and production
2022-09-21;2022;September;Minute;Neutral;0.9818759560585022;a summary of economic projections was released to the public following the conclusion of the meeting
2022-09-21;2022;September;Minute;Neutral;0.9912481307983398;the longerrun projections represented each participants assessment of the rate to which each variable would be expected to converge over time under appropriate monetary policy and in the absence of further shocks to the economy
2022-09-21;2022;September;Minute;Neutral;0.9865541458129883;participants views on current conditions and the economic outlook in conjunction with this fomc meeting participants submitted their projections of the most likely outcomes for real gdp growth the unemployment rate and inflation for each year from 2022 through 2025 and over the longer run based on their individual assessments of appropriate monetary policy including the path of the federal funds rate
2022-09-21;2022;September;Minute;Negative;0.8260932564735413;the staff also pointed to the possibility that wage increases could put a greaterthanexpected amount of upward pressure on price inflation and the possibility that inflation expectations could become unanchored given the large rise in inflation seen over the past year as additional upside risks to the inflation forecast
2022-09-21;2022;September;Minute;Negative;0.9544849991798401;the staff viewed the risks to the inflation projection as skewed to the upside on the grounds that supply conditions might not improve as much as expected and energy prices might rise sharply again
2022-09-21;2022;September;Minute;Negative;0.9673566222190857;total pce inflation was expected to move down further in 2024 to 2 percent and to remain at 2 percent in 2025 the staff continued to judge that the risks to the baseline projection for real activity were skewed to the downside
2022-09-21;2022;September;Minute;Negative;0.930374264717102;total pce price inflation was expected to decline to 26 percent in 2023 as core inflation slowed and energy prices declined
