Date;Year;Month;Type;sentiment;sentiment_score;sentence
2004-03-16;2004;March;Minute;Neutral;0.7439689636230469;the pace of economic expansion was forecasted to be sufficient to reduce resource slack over this year and next although the employment data received over the intermeeting period indicated that this process would begin from a higher rate of unused resources than had been previously expected
2004-03-16;2004;March;Minute;Positive;0.9854359030723572;also inventory investment was anticipated to rise gradually as businesses became more convinced that final demand was expanding along a sustainable track
2004-03-16;2004;March;Minute;Negative;0.8586521148681641;the budget pressures that had constrained state and local government expenditures of late were easing in some cases and federal outlays were expected to rise
2004-03-16;2004;March;Minute;Positive;0.9924942255020142;business spending on equipment and software was seen as increasing briskly as a result of sizable profits an improving outlook for demand and continued favorable financing conditions
2004-03-16;2004;March;Minute;Positive;0.9749209880828857;investment spending had continued to advance and the manufacturing sector which had lagged the rest of the economy earlier in the expansion had extended recent gains
2004-03-16;2004;March;Minute;Negative;0.979989230632782;those firms as a result were more wary about committing to new investment plans or increased hiring
2004-03-16;2004;March;Minute;Negative;0.9940913319587708;despite the gains in spending and production however employment growth had been disappointing
2004-03-16;2004;March;Minute;Negative;0.9948055148124695;the reasons for the reduced optimism were not entirely clear but may have included higher energy and commodity prices as well as renewed concerns about terrorism
2004-03-16;2004;March;Minute;Positive;0.8479225635528564;however members anticipated that sales would pick up again partly in response to an anticipated rebound in incentives
2004-03-16;2004;March;Minute;Positive;0.8563683032989502;financial markets also seemed a little less positive about the outlook with stock prices lower and some risk spreads wider than at the time of the last meeting
2004-03-16;2004;March;Minute;Positive;0.9910893440246582;looking forward gains in employment and the passthrough of higher productivity to wages and salaries were also expected to boost consumer spending even as the stimulus to growth from tax cuts faded and increases in home and equity prices likely slowed from their rapid pace in recent quarters
2004-03-16;2004;March;Minute;Negative;0.9834205508232117;by contrast sales of motor vehicles had fallen back noticeably reflecting in part reductions in incentives
2004-03-16;2004;March;Minute;Neutral;0.9087601900100708;committee members noted that sales had been bolstered by rising asset prices and the effects of last years tax cuts on refunds and final payments
2004-03-16;2004;March;Minute;Positive;0.9923322200775146;consumer spending outside the auto sector had remained strong with data and retail contacts generally suggesting continued growth in sales this year
2004-03-16;2004;March;Minute;Positive;0.9478948712348938;however some of the moderation may have owed to the effects of severe winter weather rather than more lasting influences and the recent decline in mortgage interest rates was expected to support the housing sector going forward
2004-03-16;2004;March;Minute;Negative;0.9953687191009521;committee members noted that activity in the housing sector while still quite elevated had fallen back from its extraordinary pace of late last year
2004-03-16;2004;March;Minute;Negative;0.5969277024269104;reports from some contacts suggested that speculative forces might be boosting housing demand in some parts of the country with concomitant effects on prices suggesting the possibility that house prices might be moving into the high end of the range that could be consistent with fundamentals
2004-03-16;2004;March;Minute;Negative;0.9944820404052734;the commercial real estate sector remained weak on balance although some members suggested that market conditions were stabilizing and in a few cases even beginning to improve
2004-03-16;2004;March;Minute;Negative;0.9795223474502563;despite this generally upbeat assessment a number of members reported that firms were investing primarily to replace old equipment or to reduce costs but remained hesitant to expand capacity
2004-03-16;2004;March;Minute;Positive;0.9810760021209717;members anticipated vigorous growth in investment outlays going forward supported by rapid productivity growth high profits and cash flow and accommodative financial markets
2004-03-16;2004;March;Minute;Positive;0.9925920963287354;in their comments about demand in key sectors of the economy members indicated that investment spending had continued to expand at a robust pace
2004-03-16;2004;March;Minute;Positive;0.778778076171875;the extent and duration of the resulting restraint on hiring were difficult to assess however and the committee continued to expect employment growth to pick up as the expansion progressed
2004-03-16;2004;March;Minute;Negative;0.9878857135772705;lingering business caution likely accounted for a good deal of the lag in job creation but some members also pointed to a number of other factors that might be restraining hiring including ongoing opportunities to increase efficiency through organizational changes and new investments the effects on labor costs of increases in the costs of benefits and in some selected industries and regions a shortage of job candidates with appropriate skills
2004-03-16;2004;March;Minute;Negative;0.9946568012237549;some members also pointed to the persistent weakness in employment which might be seen as reducing the odds that household spending would continue to expand briskly once the stimulative effects of tax cuts waned
