Date;Year;Month;Type;sentiment;sentiment_score;sentence
2009-06-24;2009;June;Minute;Negative;0.9946172833442688;the large number of people working part time for economic reasons and the prevalence of permanent job reductions rather than temporary layoffs suggested that labor market conditions were even more difficult than indicated by the unemployment rate
2009-06-24;2009;June;Minute;Negative;0.9949120879173279;with the recovery projected to be rather sluggish most participants anticipated that the employment situation was likely to be downbeat for some time
2009-06-24;2009;June;Minute;Negative;0.9931074976921082;anecdotal reports suggested that the weakness in activity was widespread across many industries and extended to the service sector
2009-06-24;2009;June;Minute;Positive;0.9925658702850342;however some meeting participants highlighted evidence from regional surveys that pointed to a stabilization or even a slight pickup in manufacturing in some areas and positive signs were apparent in the energy and agriculture sectors
2009-06-24;2009;June;Minute;Negative;0.9957062602043152;participants noted an improvement in business sentiment in many districts but contacts remained quite uncertain about the timing and extent of the recovery elevated uncertainty was said to be inhibiting capital spending in many cases
2009-06-24;2009;June;Minute;Negative;0.4271928668022156;many businesses had been successful in working down inventories of unsold goods
2009-06-24;2009;June;Minute;Positive;0.986461341381073;in addition many participants noted that productivity growth had been surprisingly strong in recent quarters
2009-06-24;2009;June;Minute;Positive;0.6464552283287048;some participants noted that as this process continues increases in sales will have to be met by increases in production which would in turn support growth in hours worked and eventually in investment outlays
2009-06-24;2009;June;Minute;Negative;0.9947690367698669;in europe for example unemployment was also rising sharply and financial strains remained significant
2009-06-24;2009;June;Minute;Negative;0.9164322018623352;some participants thought that recovery there was likely to lag behind that of the united states
2009-06-24;2009;June;Minute;Positive;0.9795807003974915;in asia the outlook appeared more promising with some evidence that the rate of decline in activity was diminishing
2009-06-24;2009;June;Minute;Neutral;0.5958865880966187;recent information from china suggested that economic growth may be picking up there
2009-06-24;2009;June;Minute;Negative;0.9227539896965027;still some participants mentioned that growth in that region was likely to remain importantly dependent on exports to major industrial economies that were likely to recover slowly
2009-06-24;2009;June;Minute;Negative;0.9835891723632812;although recent increases in oil and other commodity prices were likely to raise headline inflation over the near term most participants expected core inflation to remain subdued for some time
2009-06-24;2009;June;Minute;Positive;0.9732913374900818;many participants noted that the global nature of this recession meant that growth abroad was not likely to bolster us exports and so contribute to a recovery in the united states
2009-06-24;2009;June;Minute;Neutral;0.9724438786506653;the committee directs the desk to purchase agency debt agency mbs and longerterm treasury securities during the intermeeting period with the aim of providing support to private credit markets and economic activity
2009-06-24;2009;June;Minute;Neutral;0.9864250421524048;the timing and pace of these purchases should depend on conditions in the markets for such securities and on a broader assessment of private credit market conditions
2009-06-24;2009;June;Minute;Positive;0.9065227508544922;the committee anticipates that the combination of outright purchases and various liquidity facilities outstanding will cause the size of the federal reserves balance sheet to expand significantly in coming months
2009-06-24;2009;June;Statement;Negative;0.9941607117652893;information received since the federal open market committee met in april suggests that the pace of economic contraction is slowing
2009-06-24;2009;June;Statement;Positive;0.990365207195282;conditions in financial markets have generally improved in recent months
2009-06-24;2009;June;Statement;Negative;0.9925191402435303;household spending has shown further signs of stabilizing but remains constrained by ongoing job losses lower housing wealth and tight credit
2009-06-24;2009;June;Statement;Positive;0.9922276139259338;although economic activity is likely to remain weak for a time the committee continues to anticipate that policy actions to stabilize financial markets and institutions fiscal and monetary stimulus and market forces will contribute to a gradual resumption of sustainable economic growth in a context of price stability
2009-06-24;2009;June;Statement;Neutral;0.9193922281265259;the prices of energy and other commodities have risen of late
2009-06-24;2009;June;Statement;Negative;0.990063488483429;however substantial resource slack is likely to dampen cost pressures and the committee expects that inflation will remain subdued for some time
2009-06-24;2009;June;Minute;Neutral;0.882091224193573;voting for this
2009-06-24;2009;June;Statement;Neutral;0.7005747556686401;in these circumstances the federal reserve will employ all available tools to promote economic recovery and to preserve price stability
2009-06-24;2009;June;Statement;Positive;0.5451339483261108;as previously announced to provide support to mortgage lending and housing markets and to improve overall conditions in private credit markets the federal reserve will purchase a total of up to 125 trillion of agency mortgagebacked securities and up to 200 billion of agency debt by the end of the year
2009-06-24;2009;June;Statement;Neutral;0.9628608226776123;in addition the federal reserve will buy up to 300 billion of treasury securities by autumn
2009-06-24;2009;June;Statement;Neutral;0.9758480191230774;the committee will continue to evaluate the timing and overall amounts of its purchases of securities in light of the evolving economic outlook and conditions in financial markets
2009-06-24;2009;June;Statement;Neutral;0.9847075939178467;the federal reserve is monitoring the size and composition of its balance sheet and will make adjustments to its credit and liquidity programs as warranted
2009-06-24;2009;June;Statement;Neutral;0.9486177563667297;voting for the fomc monetary policy action were ben s bernanke chairman william c dudley vice chairman elizabeth a duke charles l evans donald l kohn jeffrey m lacker dennis p lockhart daniel k tarullo kevin m warsh and janet l
2009-06-24;2009;June;Minute;Positive;0.9900045990943909;market sentiment toward the syndicated leveraged loan market also improved with the average bid price increasing noticeably and bidasked spreads narrowing a bit further
2009-06-24;2009;June;Statement;Positive;0.878486156463623;the committee will maintain the target range for the federal funds rate at 0 to 14 percent and continues to anticipate that economic conditions are likely to warrant exceptionally low levels of the federal funds rate for an extended period
2009-06-24;2009;June;Minute;Neutral;0.9847075939178467;the federal reserve is monitoring the size and composition of its balance sheet and will make adjustments to its credit and liquidity programs as warranted
2009-06-24;2009;June;Minute;Neutral;0.9758480191230774;the committee will continue to evaluate the timing and overall amounts of its purchases of securities in light of the evolving economic outlook and conditions in financial markets
2009-06-24;2009;June;Minute;Neutral;0.9628608226776123;in addition the federal reserve will buy up to 300 billion of treasury securities by autumn
2009-06-24;2009;June;Minute;Neutral;0.9383237957954407;the desk is expected to purchase up to 200 billion in housingrelated agency debt by the end of this year
2009-06-24;2009;June;Minute;Neutral;0.9356728196144104;the desk is expected to purchase up to 125 trillion of agency mbs by the end of the year
2009-06-24;2009;June;Minute;Neutral;0.9500414133071899;the desk is expected to purchase up to 300 billion of longerterm treasury securities by the end of the third quarter
2009-06-24;2009;June;Minute;Neutral;0.9879816174507141;the system open market account manager and the secretary will keep the committee informed of ongoing developments regarding the systems balance sheet that could affect the attainment over time of the committees objectives of maximum employment and price stability
2009-06-24;2009;June;Statement;Neutral;0.5576603412628174;yellen
2009-06-24;2009;June;Minute;Negative;0.9924936294555664;the vote encompassed approval of the statement below to be released at 215 pm information received since the federal open market committee met in april suggests that the pace of economic contraction is slowing
2009-06-24;2009;June;Minute;Positive;0.990365207195282;conditions in financial markets have generally improved in recent months
2009-06-24;2009;June;Minute;Negative;0.9925191402435303;household spending has shown further signs of stabilizing but remains constrained by ongoing job losses lower housing wealth and tight credit
2009-06-24;2009;June;Minute;Positive;0.9730887413024902;businesses are cutting back on fixed investment and staffing but appear to be making progress in bringing inventory stocks into better alignment with sales
2009-06-24;2009;June;Minute;Positive;0.9922276139259338;although economic activity is likely to remain weak for a time the committee continues to anticipate that policy actions to stabilize financial markets and institutions fiscal and monetary stimulus and market forces will contribute to a gradual resumption of sustainable economic growth in a context of price stability
2009-06-24;2009;June;Minute;Neutral;0.9193922281265259;the prices of energy and other commodities have risen of late
2009-06-24;2009;June;Minute;Negative;0.990063488483429;however substantial resource slack is likely to dampen cost pressures and the committee expects that inflation will remain subdued for some time
2009-06-24;2009;June;Minute;Neutral;0.7005747556686401;in these circumstances the federal reserve will employ all available tools to promote economic recovery and to preserve price stability
2009-06-24;2009;June;Minute;Positive;0.878486156463623;the committee will maintain the target range for the federal funds rate at 0 to 14 percent and continues to anticipate that economic conditions are likely to warrant exceptionally low levels of the federal funds rate for an extended period
2009-06-24;2009;June;Minute;Positive;0.5451339483261108;as previously announced to provide support to mortgage lending and housing markets and to improve overall conditions in private credit markets the federal reserve will purchase a total of up to 125 trillion of agency mortgagebacked securities and up to 200 billion of agency debt by the end of the year
2009-06-24;2009;June;Minute;Negative;0.991635799407959;reports from district contacts suggested that workweeks were being trimmed and that total hours worked were falling significantly
2009-06-24;2009;June;Minute;Negative;0.9909119606018066;some participants pointed out that households financial strains may be encouraging many individuals to enter the labor market despite difficult labor market conditions
2009-06-24;2009;June;Statement;Positive;0.9730887413024902;businesses are cutting back on fixed investment and staffing but appear to be making progress in bringing inventory stocks into better alignment with sales
2009-06-24;2009;June;Minute;Negative;0.9797772765159607;although some improvements were evident in new and continuing unemployment insurance claims and the may payroll report was less weak than expected job losses remained substantial over the intermeeting period and the unemployment rate continued to rise rapidly
2009-06-24;2009;June;Minute;Neutral;0.9144885540008545;closedend residential mortgages decreased originations were reportedly strong but were more than offset by loan sales to the governmentsponsored enterprises
2009-06-24;2009;June;Minute;Negative;0.9819501638412476;the amount of outstanding consumer loans originated by banks shrank during april and may the quantity of consumer loans on banks balance sheets decreased even more because of a number of large credit card securitizations
2009-06-24;2009;June;Minute;Neutral;0.9872093200683594;the dollar depreciated substantially during the intermeeting period against all other major currencies
2009-06-24;2009;June;Minute;Negative;0.987557053565979;this decline appeared to be driven by a renewed sense of optimism about global growth prospects leading investors to shift away from safehaven assets in the united states to riskier assets elsewhere
2009-06-24;2009;June;Minute;Positive;0.9866907596588135;libortoois spreads in euros and sterling decreased and several foreign banks took advantage of improved financial conditions to raise capital and increase issuance of debt outside of government guarantee programs
2009-06-24;2009;June;Minute;Positive;0.992089033126831;the improved access to capital markets and better economic outlook buoyed bank stocks which helped headline equity indexes move higher
2009-06-24;2009;June;Minute;Negative;0.9624627828598022;home equity loans edged downthe first monthly decline in this category since october 2006partly because of banks reductions in existing lines of credit
2009-06-24;2009;June;Minute;Positive;0.990451455116272;most stock markets in emerging market economies rose considerably and mutual fund flows into those markets strengthened
2009-06-24;2009;June;Minute;Neutral;0.8980504274368286;the bank of england the bank of canada and the bank of japan kept their policy rates constant over the intermeeting period but the bank of england increased the size of its planned asset purchases from 75 billion to 125 billion
2009-06-24;2009;June;Minute;Neutral;0.9543187618255615;the bank of japan continued purchasing commercial paper corporate bonds equities and government bonds
2009-06-24;2009;June;Minute;Neutral;0.8909053802490234;chinese authorities held the renminbi nearly unchanged against the dollar and several central banks intervened to purchase dollars attempting to slow the dollars depreciation against their currencies
2009-06-24;2009;June;Minute;Negative;0.978005588054657;staff economic outlookin the forecast prepared for the june meeting the staff revised upward its outlook for economic activity during the remainder of 2009 and for 2010 consumer spending appeared to have stabilized since the start of the year sales and starts of new homes were flattening out and the recent declines in capital spending did not look as severe as those that had occurred around the turn of the year
2009-06-24;2009;June;Minute;Positive;0.9762953519821167;recent declines in payroll employment and industrial production while still sizable were smaller than those registered earlier in 2009 household wealth was higher corporate bond rates had fallen the value of the dollar was lower the outlook for foreign activity was better and financial stress appeared to have eased somewhat more than had been anticipated in the staff forecast prepared for the prior fomc meeting
2009-06-24;2009;June;Minute;Positive;0.9830202460289001;the projected boost to aggregate demand from these factors more than offset the negative effects of higher oil prices and mortgage rates
2009-06-24;2009;June;Minute;Neutral;0.9473674297332764;the european central bank lowered its main policy rate 25 basis points to 1 percent and announced that it would purchase up to 60 billion in covered bonds
2009-06-24;2009;June;Minute;Negative;0.9672415256500244;the staff projected that real gdp would decline at a substantially slower rate in the second quarter than it had in the first quarter and then increase in the second half of 2009 though less rapidly than potential output
2009-06-24;2009;June;Minute;Negative;0.9861876964569092;ci loans dropped in may amid subdued origination activity and broadbased paydowns of outstanding loans
2009-06-24;2009;June;Minute;Negative;0.9871366024017334;the rise in currency diminished likely reflecting primarily a waning in foreign demand
2009-06-24;2009;June;Minute;Negative;0.8145463466644287;rising labor force participation contributed to the increase in the unemployment rate
2009-06-24;2009;June;Minute;Positive;0.7994081974029541;market sentiment toward the financial sector improved over the intermeeting period reflecting in part the release of the supervisory capital assessment program scap results for the nations 19 largest bank holding companies bhcs on may 7 nearly all the bhcs evaluated had enough tier 1 capital to absorb the higher losses envisioned under the hypothetical more adverse scenario however 10 institutions were required to enhance their capital structure to put greater emphasis on common equity
2009-06-24;2009;June;Minute;Neutral;0.4929104447364807;following the announcement of the scap results the 19 evaluated institutions raised or announced plans to raise around 70 billion in common equity through public offerings conversion of preferred stock and asset sales
2009-06-24;2009;June;Minute;Neutral;0.9675936102867126;these offerings accounted for most of the recordhigh total financial equity issuance in may
2009-06-24;2009;June;Minute;Neutral;0.9686143398284912;the evaluated bhcs have also issued additional debt under the federal deposit insurance corporations temporary liquidity guarantee program tlgp as well as nonguaranteed debt
2009-06-24;2009;June;Minute;Neutral;0.9602774381637573;on june 9 the treasury announced that 10 large financial institutions were eligible to repay the 68 billion in capital that they had received through the troubled asset relief program tarp
2009-06-24;2009;June;Minute;Neutral;0.9367485642433167;commercial bank credit increased slightly in may following six consecutive monthly declines but the turnaround reflected a rise in securities holdings and in the volatile other loans categorythat is loans other than commercial and industrial ci real estate and consumer loans
2009-06-24;2009;June;Minute;Negative;0.9941681623458862;cds spreads for banking organizations declined considerably over the intermeeting period although they remained well above historical norms
2009-06-24;2009;June;Minute;Neutral;0.9771232604980469;gross bond issuance by nonfinancial corporations was robust in may
2009-06-24;2009;June;Minute;Positive;0.5440179109573364;investmentgrade issuance rebounded after a lull in april
2009-06-24;2009;June;Minute;Neutral;0.9389194846153259;speculativegrade issuance was the highest since june 2007 but issuance of lowerrated speculativegrade bonds remained minimal
2009-06-24;2009;June;Minute;Positive;0.883598268032074;meanwhile the federal government issued large amounts of debt and state and local government debt was estimated to have expanded moderately
2009-06-24;2009;June;Minute;Negative;0.9533188343048096;the expansion of m2 slowed significantly in april and may as the reallocation of household wealth toward the safety and liquidity of m2 assets evidently moderated
2009-06-24;2009;June;Minute;Negative;0.9813186526298523;retail money market mutual funds and small time deposits contracted in both months probably in response to declining interest rates on these assets
2009-06-24;2009;June;Minute;Negative;0.6168113946914673;the level of privatesector debt was estimated to have remained about unchanged in the second quarter as a further modest decline in household debt about offset a slight increase in nonfinancial business debt
2009-06-24;2009;June;Minute;Neutral;0.8809475302696228;the staff also revised up its projection for the increase in real gdp in 2010 to a pace above the growth rate of potential gdp
2009-06-24;2009;June;Minute;Positive;0.9189740419387817;stock price indexes for the banking sector and the broader financial sectors rose significantly
2009-06-24;2009;June;Minute;Positive;0.9756816029548645;recent readings on core consumer prices had come in a bit higher than expected in addition the rise in energy prices lessfavorable import prices and the absence of any downward movement in inflation expectations led the staff to raise its mediumterm inflation outlook
2009-06-24;2009;June;Minute;Positive;0.9730111956596375;still participants generally noted that the improvement in market conditions was in part due to ongoing support from various government programs and that underlying financial conditions remained fragile
2009-06-24;2009;June;Minute;Negative;0.9676198363304138;credit was tight with some banks quite reluctant to lend
2009-06-24;2009;June;Minute;Negative;0.9909713268280029;worsening credit quality especially for consumer and commercial real estate loans was seen as an important reason for reduced lending and tighter terms and banks could face substantial losses in their loan portfolios in coming quarters
2009-06-24;2009;June;Minute;Negative;0.9957893490791321;many participants noted that obtaining financing for commercial real estate projects remained extremely difficult amid worsening fundamentals in the sector
2009-06-24;2009;June;Minute;Negative;0.9939814209938049;consumer spending appeared no longer to be declining but nonetheless remained weak
2009-06-24;2009;June;Minute;Negative;0.9941484928131104;the continued sluggishness in consumer expenditures mainly reflected falling employment sharply lower wealth as a result of earlier steep declines in asset prices and tight credit conditions
2009-06-24;2009;June;Minute;Positive;0.9903239011764526;increases in equity prices had favorable effects on household wealth and overall sentiment
2009-06-24;2009;June;Minute;Negative;0.9953565001487732;because these factors were not seen as likely to dissipate quickly most participants judged that consumer spending would continue to be subdued for some time
2009-06-24;2009;June;Minute;Positive;0.9390915632247925;participants also observed that while personal income had expanded briskly of late those increases had been boosted by special onetime factors such as fiscal stimulus and large costofliving adjustments for social security recipients
2009-06-24;2009;June;Minute;Negative;0.9948689937591553;indicators of singlefamily starts and sales suggested that housing activity may be leveling out but most participants viewed the sector as still vulnerable to further weakness
2009-06-24;2009;June;Minute;Negative;0.993496298789978;some expressed concern that the increases in mortgage rates seen over the intermeeting period had the potential to further depress the demand for housing and thus impede an economic recovery
2009-06-24;2009;June;Minute;Negative;0.9867525100708008;others noted that foreclosures were continuing at a very high rate and could push house prices down further and add to inventories of unsold homes holding back housing activity and weighing on household wealth
2009-06-24;2009;June;Minute;Neutral;0.830147385597229;as a consequence the staff projected that the unemployment rate would rise further in 2009 but would edge down in 2010 meanwhile the staff forecast for inflation was marked up
2009-06-24;2009;June;Minute;Negative;0.9831878542900085;labor market conditions were of particular concern to meeting participants
2009-06-24;2009;June;Minute;Negative;0.986844003200531;given the significant uncertainties in the economic outlook a sizable reduction in the saving rate seemed unlikely in the near term some saw the possibility of further increases in the household saving rate
2009-06-24;2009;June;Minute;Positive;0.981029212474823;corporate credit markets continued to improve and markets for assetbacked securities also showed an increasing amount of activity supported in part by the talf
2009-06-24;2009;June;Minute;Negative;0.9937718510627747;personal income was likely to contract for a time going forward as the effects of these factors waned and there was some risk that consumer spending might also decline as a consequence
2009-06-24;2009;June;Minute;Positive;0.9874253869056702;developments in financial markets over the intermeeting period were seen as broadly positive reflecting at least in part a reduction in the perceived risk of further severely adverse outcomes
2009-06-24;2009;June;Minute;Neutral;0.9642683267593384;participants views and committee policy actionin conjunction with this fomc meeting all meeting participantsthe five members of the board of governors and the presidents of the 12 federal reserve banksprovided projections for economic growth the unemployment rate and consumer price inflation for each year from 2009 through 2011 and over a longer horizon
2009-06-24;2009;June;Minute;Positive;0.9802129864692688;in particular many participants noted that the results of the scap helped bolster confidence in banks and led to large infusions of private capital in that sector
2009-06-24;2009;June;Minute;Neutral;0.9913126826286316;longerrun projections represent each participants assessment of the rate to which each variable would be expected to converge over time under appropriate monetary policy and in the absence of further shocks
2009-06-24;2009;June;Minute;Neutral;0.8038955330848694;in their discussion of the economic situation and outlook participants generally agreed that the information received since the april meeting indicated that the economic contraction was slowing and that the decline in activity could cease before long
2009-06-24;2009;June;Minute;Positive;0.9925780892372131;business and household confidence had picked up some and survey data and anecdotal reports showed improved expectations for the future
