Date;Year;Month;Type;sentiment;sentiment_score;sentence
2009-06-03;2009;June;Minute;Neutral;0.4663838744163513;the relative stability of the resale market over this period coincided with a heightened proportion of transactions involving bankowned and other distressed properties
2009-06-03;2009;June;Minute;Negative;0.6119592189788818;real investment in equipment and software es continued to contract however the decline in the second quarter appeared likely to be smaller than in either of the two preceding quarters
2009-06-03;2009;June;Minute;Positive;0.9760923385620117;the apparent stabilization in housing demand was likely due in part to the improvement in housing affordability that resulted from low mortgage rates and declining house prices
2009-06-03;2009;June;Minute;Negative;0.9916375279426575;rates for conforming 30year fixedrate mortgages rose on net between late april and late june but remained below the levels seen over most of 2008 although the market for privatelabel nonprime mortgages remained closed spreads between rates for jumbo and standard conforming loans narrowed substantially since march
2009-06-03;2009;June;Minute;Negative;0.9943655729293823;meanwhile national house prices continued to decline
2009-06-03;2009;June;Minute;Negative;0.9912810921669006;the principal determinants of investment were still weak business output dropped further in the first quarter the user cost of capital was higher than it was a year earlier and credit remained tight
2009-06-03;2009;June;Minute;Positive;0.4816872179508209;data suggested a substantial increase in outlays for nonresidential construction in march and april concentrated in energyrelated sectors
2009-06-03;2009;June;Minute;Negative;0.9908890128135681;the contraction in spending on computing equipment appeared to be leveling off although businesses continued to cut their real outlays on software
2009-06-03;2009;June;Minute;Negative;0.9907584190368652;real spending on equipment outside of hightech and transportation seemed to have dropped less rapidly in the second quarter than in the first quarter
2009-06-03;2009;June;Minute;Negative;0.9930893778800964;outside of the energyrelated sectors demand for nonresidential building remained extremely weak and financing difficult to obtain
2009-06-03;2009;June;Minute;Negative;0.9845676422119141;although the months supply of nonfarm business inventories remained elevated large production cutbacks in recent quarters allowed producers to stem the rise in stocks relative to sales
2009-06-03;2009;June;Minute;Negative;0.9943981766700745;however corporate bond yields eased considerably in the weeks leading to the june meeting and monthly surveys of business conditions and sentiment were generally less downbeat than earlier in the year
2009-06-03;2009;June;Minute;Neutral;0.8649231791496277;sales of existing singlefamily homes had been fairly steady from late 2008 through may
2009-06-03;2009;June;Minute;Negative;0.9811543822288513;outlays on transportation equipment seemed to be firming after shrinking for an extended period and the incoming data on shipments and orders of nondefense capital goods pointed to a moderation in the rate of decrease in other major components of es
2009-06-03;2009;June;Minute;Negative;0.9090532660484314;however the pace of new home sales was still very low in april and the months supply of new homes remained quite elevated relative to sales despite a decrease in the stock of unsold new singlefamily homes to a level roughly onehalf of its mid2006 peak
2009-06-03;2009;June;Minute;Negative;0.9838623404502869;outside the transportation and hightech sectors most industries continued to cut production in both april and may though at a slower pace than over the preceding five months
2009-06-03;2009;June;Minute;Negative;0.9949295520782471;in contrast activity in the much smaller multifamily sector fell significantly further reflecting a sharp deterioration in the fundamentals in that sector
2009-06-03;2009;June;Minute;Neutral;0.7070006132125854;singlefamily housing starts edged up in may and adjusted permit issuance for singlefamily houses was a little above the level of starts as it had been since january
2009-06-03;2009;June;Minute;Positive;0.720853328704834;measures of consumer sentiment while remaining at levels typically seen during recessions improved markedly from the historical lows recorded around the turn of the year
2009-06-03;2009;June;Minute;Negative;0.6969250440597534;in addition equity prices recorded substantial gains in april and may reversing a small portion of the prior wealth declines
2009-06-03;2009;June;Minute;Positive;0.9891425967216492;the fundamental determinants of consumer demand appeared to have improved a bit despite the ongoing decline in employment real disposable personal income rose in the first quarter and posted another sizable gain in april as various provisions of the american recovery and reinvestment act of 2009 boosted transfer payments and reduced personal taxes
2009-06-03;2009;June;Minute;Neutral;0.9846545457839966;real outlays on services were reported to have picked up some in april from the average monthly gain seen over the first three months of the year
2009-06-03;2009;June;Minute;Neutral;0.6305508613586426;sales of light motor vehicles in april and may were slightly higher than the firstquarter average
2009-06-03;2009;June;Minute;Neutral;0.9901198148727417;on the basis of the latest retail sales data real expenditures on goods other than motor vehicles appeared to have risen slightly in may and to have changed little on net since the turn of the year
2009-06-03;2009;June;Minute;Positive;0.905498743057251;real personal consumption expenditures rose somewhat in the first quarter after falling in the second half of 2008 and available data suggested that spending was holding reasonably steady in the second quarter
2009-06-03;2009;June;Minute;Neutral;0.9105015397071838;the production of commercial aircraft moved up
2009-06-03;2009;June;Minute;Negative;0.9901285767555237;the production of motor vehicles and parts dropped sharply in may principally because of extended plant shutdowns at general motors and chrysler
2009-06-03;2009;June;Minute;Positive;0.9894344210624695;in the hightech sector computer output fell at a pace similar to that in the first quarter but nearterm indicators of production turned somewhat less negative and global semiconductor sales climbed in april for the second consecutive month
2009-06-03;2009;June;Minute;Negative;0.9595133662223816;the us international trade deficit widened slightly in april as a decrease in imports was more than offset by a drop in exports
2009-06-03;2009;June;Minute;Negative;0.9935046434402466;manufacturing output also fell in those months and the factory operating rate dipped further in may
2009-06-03;2009;June;Minute;Negative;0.9946467280387878;the steep decline in the demand for new singlefamily houses seemed to have abated
2009-06-03;2009;June;Minute;Negative;0.9941011071205139;most major categories of exports fell with exports of machinery industrial supplies and consumer goods exhibiting significant declines
2009-06-03;2009;June;Minute;Neutral;0.5788785815238953;yields on nominal treasury coupon securities increased on net over the intermeeting period
2009-06-03;2009;June;Minute;Negative;0.992958664894104;imports of machinery and industrial supplies displayed significant decreases and imports of services fell moderately
2009-06-03;2009;June;Minute;Negative;0.730024516582489;industrial production decreased in april and may but at a slower pace than in the first quarter
2009-06-03;2009;June;Minute;Positive;0.844612181186676;the market for repurchase agreements saw slight improvement with bidasked spreads for most types of transactions narrowing a bit and haircuts roughly unchanged
2009-06-03;2009;June;Minute;Positive;0.946252703666687;these spreads narrowed to levels not seen since early 2008 transaction volume rose modestly and tentative signs of increased liquidity reportedly emerged
2009-06-03;2009;June;Minute;Negative;0.9792892932891846;pressures in shortterm bank funding markets eased further as evidenced by declines in london interbank offered rate libor fixings and in spreads between one and threemonth libor and comparablematurity overnight index swap ois rates
2009-06-03;2009;June;Minute;Positive;0.9901571273803711;some of the rise in inflation compensation may have reflected an increase in inflation expectations but an improvement in liquidity in the market for treasury inflationprotected securities and mortgagerelated hedging flows may have boosted inflation compensation as well
2009-06-03;2009;June;Minute;Negative;0.8274363279342651;in addition inflation compensation rose over the intermeeting period as yields on inflationindexed treasury securities increased much less than those on their nominal counterparts
2009-06-03;2009;June;Minute;Negative;0.9918797612190247;these moves likely reflected a number of factors including investors perceptions of an improvement in the economic outlook decreased concerns about the risk of deflation a reversal of flighttoquality flows and selling of longduration assets as exposure to mortgage prepayment risk dropped with a rise in mortgage rates
2009-06-03;2009;June;Minute;Negative;0.9445062875747681;however in the days following the release of the may employment report which was read as being significantly less negative than anticipated market participants marked up their expected path for the federal funds rate
2009-06-03;2009;June;Minute;Neutral;0.9891154766082764;the expected path of the federal funds rate implied by futures prices was largely unchanged by the release of the committees statement and minutes
2009-06-03;2009;June;Minute;Negative;0.9490460753440857;the release of the april fomc minutes three weeks later prompted a reversal of this move as market participants reportedly focused on the suggestion that the total size of the purchase program might need to be increased at some point to spur a more rapid pace of recovery
2009-06-03;2009;June;Minute;Neutral;0.960020899772644;staff review of the financial situationthe decision by the fomc at its april 2829 meeting to leave the target range for the federal funds rate unchanged and the accompanying statement indicating that the fomc would maintain the size of the largescale asset purchase program were largely anticipated but yields on treasury securities rose slightly as a few investors apparently had seen some chance that the committee would expand the purchase program
2009-06-03;2009;June;Minute;Negative;0.9938748478889465;increases in average hourly earnings also slowed further in april and may
2009-06-03;2009;June;Minute;Negative;0.9927700161933899;although the rise in hourly compensation in the nonfarm business sector picked up slightly in the first quarter the employment cost index decelerated further
2009-06-03;2009;June;Minute;Neutral;0.9454430341720581;the incoming data on labor costs were mixed
2009-06-03;2009;June;Minute;Neutral;0.582132875919342;the value of imports of goods and services also edged down after remaining about unchanged in march
2009-06-03;2009;June;Minute;Negative;0.9885455965995789;nevertheless these prices remained well below their yearearlier levels
2009-06-03;2009;June;Minute;Negative;0.9915526509284973;survey measures of longterm inflation expectations showed no signs of moving lower despite the considerable margin of labor and productmarket slack present in the economy
2009-06-03;2009;June;Minute;Neutral;0.8942962288856506;nearterm inflation expectations in the reutersuniversity of michigan surveys of consumers remained steady in may and then rose somewhat in the preliminary june survey
2009-06-03;2009;June;Minute;Neutral;0.9841164946556091;core inflation was slightly higher from march to may than during the preceding three months although core prices posted fairly small increases apart from a taxinduced jump in tobacco prices
2009-06-03;2009;June;Minute;Negative;0.9937115907669067;in the united states headline consumer prices were little changed between march and may held down by declines in the prices of food and energy over that period
2009-06-03;2009;June;Minute;Positive;0.9918997287750244;financial conditions continued to improve in most emerging market economies
2009-06-03;2009;June;Minute;Positive;0.990623414516449;in china retail sales and fixedasset investment rose strongly
2009-06-03;2009;June;Minute;Positive;0.9847205877304077;for the second quarter indicators suggested a broader stabilization of activity in emerging market economies
2009-06-03;2009;June;Minute;Positive;0.9888289570808411;in emerging market economies incoming data showed that firstquarter real gross domestic product gdp contracted sharply in mexico hong kong malaysia and singapore edged up in korea and expanded considerably in india and indonesia
2009-06-03;2009;June;Minute;Positive;0.9869731068611145;purchasing managers indexes rebounded from the exceptionally low levels reached in the first quarter and industrial production stabilized somewhat
2009-06-03;2009;June;Minute;Negative;0.9873422384262085;recent indicators however suggested that the pace of contraction likely moderated in the second quarter
2009-06-03;2009;June;Minute;Negative;0.9952697157859802;domestic demand fell in all major economies led by doubledigit declines in fixed investment and sizable negative contributions of inventories to growth
2009-06-03;2009;June;Minute;Negative;0.9886922836303711;the decline in output in the advanced foreign economies deepened in the first quarter
2009-06-03;2009;June;Minute;Positive;0.7649926543235779;the value of oil imports also rose as higher prices outweighed lower volumes
2009-06-03;2009;June;Minute;Negative;0.661414623260498;imports of consumer goods increased
2009-06-03;2009;June;Minute;Negative;0.9736475944519043;at earlier stages of processing the producer price index for core intermediate materials continued to decline through may albeit at a slower pace than that seen at the end of 2008 spot commodity prices which had moved higher over the first four months of 2009 rose more rapidly since the end of april
2009-06-03;2009;June;Minute;Negative;0.5785951614379883;the fourweek moving average of initial claims for unemployment insurance fell back a little but the number of individuals receiving unemployment insurance benefits continued to increase
2009-06-03;2009;June;Minute;Negative;0.9388155341148376;staff projections suggested that the size of the federal reserves balance sheet might peak late this year and decline gradually thereafter
2009-06-03;2009;June;Minute;Negative;0.7580316066741943;the unemployment rate however rose further in may to 94 percent
2009-06-03;2009;June;Minute;Neutral;0.9569034576416016;some participants thought that increases in purchases of treasury securities might have little or no effect on longterm interest rates unless the increases were very sizable given the large amount of current and projected supply of treasury securities
2009-06-03;2009;June;Minute;Negative;0.985163152217865;the federal reserve was already purchasing a very large fraction of new currentcoupon agency mbs and agency debt and further increasing the scale of those programs could compromise market functioning
2009-06-03;2009;June;Minute;Neutral;0.9921334981918335;a number of potential modifications to those programs were presented for the committees consideration including possible expansions in their size extensions of the duration of securities purchased steps to increase the flexibility of those purchases both within each program and across programs in response to shortterm market developments and possible approaches to winding down purchases as the programs near completion
2009-06-03;2009;June;Minute;Neutral;0.9897453188896179;the staff also reviewed the experience to date with the federal reserves purchases of treasury securities agency debt securities and agency mbs
2009-06-03;2009;June;Minute;Positive;0.9694631695747375;in part that result reflected the fact that many institutions had raised capital lately in addition the leverage ratios for most institutions were well above the regulatory minimums at the end of the first quarter
2009-06-03;2009;June;Minute;Neutral;0.8518524169921875;the analysis concluded that with few exceptions banks regulatory leverage ratios defined as tier 1 capital divided by total average assets were likely to remain comfortably above regulatory minimums even with the substantial growth in reserve balances projected to occur in coming months and even if there were some erosion in bank capital
2009-06-03;2009;June;Minute;Negative;0.9794715642929077;an important issue was whether the further increase in reserve balances that is likely to result from the federal reserves alreadyannounced program of asset purchases could lead banks to limit their lending and acquisition of securities in order to prevent an excessive decline in their capital ratios
2009-06-03;2009;June;Minute;Neutral;0.981295108795166;the staff also provided the committee with an analysis of the potential adverse effects of very high reserve balances on bank capital ratios
2009-06-03;2009;June;Minute;Positive;0.9137126803398132;ensuring that policy accommodation can ultimately be withdrawn smoothly and at the appropriate time would remain a top priority of the federal reserve
2009-06-03;2009;June;Minute;Neutral;0.9938938021659851;in discussing the staff presentation meeting participants generally agreed that the federal reserve either already had or could develop tools to remove policy accommodation when appropriate
2009-06-03;2009;June;Minute;Neutral;0.9682987332344055;some of those tools were focused primarily on shaping or strengthening the demand for reserves while others were designed to provide greater control over the supply of reserves
2009-06-03;2009;June;Minute;Neutral;0.9323813319206238;in a related discussion the staff briefed the committee on a number of possible tools that the federal reserve might employ to foster effective control of the federal funds rate in the context of a much expanded balance sheet
2009-06-03;2009;June;Minute;Negative;0.857438325881958;changes in market valuations were thus seen as unlikely to have significant implications for the systems net income
2009-06-03;2009;June;Minute;Neutral;0.9698256850242615;however while the federal reserve would retain the option of selling securities before they mature or are prepaid as a means of tightening policy when appropriate it was not expected to have to do so
2009-06-03;2009;June;Minute;Negative;0.9920200705528259;others were concerned that announcements of substantial additional purchases could add to perceptions that the federal debt was being monetized
2009-06-03;2009;June;Minute;Negative;0.9509409070014954;the analysis also suggested that the market value of the federal reserves securities holdings could decline appreciably under some scenarios
2009-06-03;2009;June;Minute;Neutral;0.8541646003723145;the analysis indicated that the federal reserve was likely to earn substantial net interest income over the next few years under most interest rate scenarios
2009-06-03;2009;June;Minute;Neutral;0.9887780547142029;the staff also presented information on the possible implications of substantial changes in the size and composition of the federal reserves balance sheet for the systems net income
2009-06-03;2009;June;Minute;Neutral;0.9800500273704529;the staff reported on projections of the federal reserves balance sheet under various assumptions about economic and financial conditions and the associated path of monetary policy
2009-06-03;2009;June;Minute;Neutral;0.9541947841644287;the federal reserve bank of new york may reject bids which could facilitate a dealers ability to control a single issue as determined solely by the federal reserve bank of new york
2009-06-03;2009;June;Minute;Neutral;0.98915034532547;the federal reserve bank of new york shall set a minimum lending fee consistent with the objectives of the program and apply reasonable limitations on the total amount of a specific issue that may be auctioned and on the amount of securities that each dealer may borrow
2009-06-03;2009;June;Minute;Neutral;0.9849480986595154;3 in order to ensure the effective conduct of open market operations the federal open market committee authorizes the federal reserve bank of new york to lend on an overnight basis us government securities and securities that are direct obligations of any agency of the united states held in the system open market account to dealers at rates that shall be determined by competitive bidding
2009-06-03;2009;June;Minute;Neutral;0.9819174408912659;the committee voted unanimously to amend paragraph 3 of the authorization for domestic open market operations with the text underlined below
2009-06-03;2009;June;Minute;Neutral;0.991132915019989;lending agency securities was viewed as a technical modification to the existing overnight securities lending program that would support functioning of agency debt markets
2009-06-03;2009;June;Minute;Neutral;0.9903509020805359;the committee reviewed a staff proposal that would authorize the desk to lend as part of the federal reserves regular overnight securities lending operations securities held in the soma portfolio that are direct obligations of federal agencies
2009-06-03;2009;June;Minute;Neutral;0.9792425632476807;there were no open market operations in foreign currencies for the systems account over the intermeeting period
2009-06-03;2009;June;Minute;Neutral;0.9878183603286743;by unanimous vote the committee ratified those transactions
2009-06-03;2009;June;Minute;Neutral;0.9911237955093384;the manager also reported on system open market operations in treasury securities and in agency debt and agency mortgagebacked securities mbs during the period since the committees april 2829 meeting
2009-06-03;2009;June;Minute;Neutral;0.9472000002861023;developments in financial markets and the federal reserves balance sheetthe manager of the system open market account soma reported on recent developments in domestic and foreign financial markets
2009-06-03;2009;June;Minute;Neutral;0.9859504103660583;spreads on a2p2rated commercial paper and aarated assetbacked commercial paper were little changed on net since late april remaining at the low end of their ranges over the previous 18 months
2009-06-03;2009;June;Minute;Neutral;0.9484865665435791;the staff presented one scenario however in which aggressive increases in shortterm interest rates significantly reduced system net income relative to a baseline scenario
2009-06-03;2009;June;Minute;Negative;0.9919465184211731;while most members did not see largescale purchases of treasury securities as likely to be a source of inflation pressures given the weak economic outlook public concern about monetization could have adverse implications for inflation expectations
2009-06-03;2009;June;Minute;Neutral;0.6365174651145935;the asset purchase programs were intended to support economic activity by improving market functioning and reducing interest rates on mortgage loans and other longterm credit to households and businesses relative to what they otherwise would have been
2009-06-03;2009;June;Minute;Neutral;0.99125075340271;but the committee had not set specific objectives for longerterm interest rates and participants did not consider it appropriate to allow the desk discretion to adjust the size and composition of the federal reserves asset purchases in response to shortrun fluctuations in market interest rates
2009-06-03;2009;June;Minute;Negative;0.9719028472900391;thus aggregate hours worked by this group fell at a slower pace in april and may than on average over the previous seven months
2009-06-03;2009;June;Minute;Neutral;0.9908185601234436;in addition average weekly hours of production and nonsupervisory workers on private payrolls which had dropped substantially from september to march were essentially unchanged in april and may
2009-06-03;2009;June;Minute;Negative;0.9822937846183777;nonfarm payrolls continued to shrink but the decline was the smallest since september
2009-06-03;2009;June;Minute;Negative;0.9941171407699585;the demand for labor weakened further in may albeit less rapidly than in earlier months
2009-06-03;2009;June;Minute;Neutral;0.9564260244369507;consumer price inflation was fairly quiescent in recent months although the upturn in energy prices appeared likely to boost headline inflation in june
2009-06-03;2009;June;Minute;Negative;0.9761718511581421;in addition the recent declines in capital spending were smaller than those recorded earlier in the year
2009-06-03;2009;June;Minute;Negative;0.9916558265686035;but the reductions in employment and industrial production had slowed somewhat consumer spending appeared to be holding reasonably steady after shrinking in the second half of 2008 and sales and construction of singlefamily homes had apparently flattened out
2009-06-03;2009;June;Minute;Negative;0.994407057762146;employment was still falling and manufacturers had cut production further in response to excess inventories and soft demand
2009-06-03;2009;June;Minute;Negative;0.9932645559310913;staff review of the economic situationthe information reviewed at the june 2324 meeting suggested that the economy remained very weak though declines in activity seemed to be lessening
2009-06-03;2009;June;Minute;Neutral;0.977167546749115;however if financial stresses do not moderate as expected the board and the fomc were prepared to extend the terms of some or all of the facilities as needed to promote financial stability and economic growth
2009-06-03;2009;June;Minute;Neutral;0.8055910468101501;board members and fomc participants noted their expectation that a number of these facilities may not need to be extended beyond february 1 2010 if the recent improvements in market conditions continue
