Date;Year;Month;Type;sentiment;sentiment_score;sentence
2009-06-03;2009;June;Minute;Neutral;0.9749374985694885;should market conditions appear to warrant the resumption of schedule 1 tslf or top auctions the account manager is to consult with the chairman and if possible the board and the federal open market committee
2009-06-03;2009;June;Minute;Neutral;0.9608975648880005;the federal reserve bank of new york is directed to suspend operations of the term securities lending facility options program top effective immediately
2009-06-03;2009;June;Minute;Neutral;0.9924376606941223;the federal reserve bank of new york is directed to conduct schedule 2 tslf auctions initially on a monthly basis in amounts of 75 billion the reserve bank is directed to reduce over time the amounts provided through the tslf as market conditions warrant
2009-06-03;2009;June;Minute;Neutral;0.9736077189445496;however the federal reserve bank of new york is directed to suspend schedule 1 tslf auctions effective immediately
2009-06-03;2009;June;Minute;Neutral;0.9879770874977112;the federal open market committee extends until february 1 2010 its authorizations for the federal reserve bank of new york to provide a term securities lending facility subject to the same collateral interest rate and other conditions previously established by the committee
2009-06-03;2009;June;Minute;Neutral;0.9893910884857178;in addition the fomc extended the temporary reciprocal currency arrangements swap lines between the federal reserve and other central banks to february 1 2010 the fomc unanimously passed the following resolution to extend the temporary swap arrangements and the tslf the federal open market committee extends until february 1 2010 its authorizations for the federal reserve bank of new york to engage in temporary reciprocal currency arrangements swap arrangements with foreign central banks under the conditions previously established by the committee
2009-06-03;2009;June;Minute;Positive;0.501764714717865;some participants noted that in principle the committee could formulate a plan for asset purchases that would respond to economic and financial developments in a way that might better promote monetary policy objectives
2009-06-03;2009;June;Minute;Negative;0.9929110407829285;most however thought that formulating and communicating such a plan would be very difficult potentially leading to an increase in market uncertainty regarding federal reserve actions and intentions
2009-06-03;2009;June;Minute;Neutral;0.99236661195755;many participants agreed however that it was appropriate for the desk to make small adjustments to the size and timing of purchases aimed at fostering market liquidity and improving market functioning
2009-06-03;2009;June;Minute;Neutral;0.9924646615982056;participants discussed the merits of including securities backed by adjustablerate mortgages in mbs purchases and of tapering off purchases of securities as the asset purchase programs were being completed but the committee did not reach a decision on those issues at the meeting
2009-06-03;2009;June;Minute;Neutral;0.9894738793373108;the staff presented policymakers with proposals for extensions modifications and terminations of various liquidity programs
2009-06-03;2009;June;Minute;Negative;0.897403359413147;a number of the credit and liquidity facilities that the federal reserve had established in the course of the financial crisis were scheduled to expire on october 30 use of most of the liquidity facilities had declined in recent months as market conditions had improved
2009-06-03;2009;June;Minute;Positive;0.9591106176376343;despite the high level of joblessness the labor force participation rate moved up for a second consecutive month to a level close to where it was at the beginning of the recession
2009-06-03;2009;June;Minute;Negative;0.9951516389846802;still meeting participants judged that market conditions remained fragile and that concerns about counterparty credit risk and access to liquidity both of which had ebbed notably in recent months could increase again
2009-06-03;2009;June;Minute;Negative;0.9869763255119324;if the federal reserves backup liquidity facilities were terminated prematurely such developments might put renewed pressure on some financial institutions and markets and tighten credit conditions for businesses and households
2009-06-03;2009;June;Minute;Negative;0.910690188407898;the period over yearend was seen as posing heightened risks given the usual pressures in financial markets at that time
2009-06-03;2009;June;Minute;Neutral;0.9859498143196106;in these circumstances participants agreed that most facilities should be extended into early next year
2009-06-03;2009;June;Minute;Positive;0.6855259537696838;however participants also judged that improved market conditions and declining use of the facilities warranted scaling back suspending or tightening access to several programs including the term auction facility taf the term securities lending facility tslf and the assetbacked commercial paper money market mutual fund liquidity facility amlf
2009-06-03;2009;June;Minute;Neutral;0.9880395531654358;following the presentation and discussion of the staff proposal the board voted unanimously to extend the amlf the commercial paper funding facility cpff the primary dealer credit facility pdcf and the tslf through february 1 2010 the board did not extend the money market investor funding facility mmiff beyond october 30 the extension of the tslf required the approval of the federal open market committee fomc as that facility was established under the joint authority of the board and the fomc
2009-06-03;2009;June;Minute;Neutral;0.8818594813346863;the board and the fomc jointly decided to suspend some tslf auctions and to reduce the size and frequency of others
2009-06-03;2009;June;Minute;Negative;0.9868619441986084;moreover participants viewed the availability of the liquidity facilities as a factor that had contributed to the reduction in financial strains
2009-06-03;2009;June;Minute;Negative;0.9938473105430603;over the intermeeting period functioning in the market for treasury securities generally improved and trading picked up but some strains remained
2009-06-03;2009;June;Minute;Negative;0.9957062602043152;participants noted an improvement in business sentiment in many districts but contacts remained quite uncertain about the timing and extent of the recovery elevated uncertainty was said to be inhibiting capital spending in many cases
2009-06-03;2009;June;Minute;Negative;0.9945871829986572;such spreads however remained somewhat wide for longerdated issues apparently reflecting concerns about volatility linked to mortgagerelated hedging flows
2009-06-03;2009;June;Minute;Negative;0.9786449670791626;substantial resource slack was also likely to keep price inflation low in the future
2009-06-03;2009;June;Minute;Negative;0.9950951337814331;although the measured increase in productivity might reflect cyclical factors rather than changes in the underlying trend and was subject to data revisions growth in unit labor costs was expected to continue to be restrained in coming quarters
2009-06-03;2009;June;Minute;Positive;0.986461341381073;in addition many participants noted that productivity growth had been surprisingly strong in recent quarters
2009-06-03;2009;June;Minute;Negative;0.9940898418426514;several measures of labor compensation had slowed in recent quarters as unemployment mounted and wages were not likely to exert any significant upward pressures on prices given the expectation that labor market conditions were likely to deteriorate further in coming months and probably would not improve quickly thereafter
2009-06-03;2009;June;Minute;Negative;0.9835891723632812;although recent increases in oil and other commodity prices were likely to raise headline inflation over the near term most participants expected core inflation to remain subdued for some time
2009-06-03;2009;June;Minute;Negative;0.9227539896965027;still some participants mentioned that growth in that region was likely to remain importantly dependent on exports to major industrial economies that were likely to recover slowly
2009-06-03;2009;June;Minute;Neutral;0.5958865880966187;recent information from china suggested that economic growth may be picking up there
2009-06-03;2009;June;Minute;Positive;0.9795807003974915;in asia the outlook appeared more promising with some evidence that the rate of decline in activity was diminishing
2009-06-03;2009;June;Minute;Negative;0.9164322018623352;some participants thought that recovery there was likely to lag behind that of the united states
2009-06-03;2009;June;Minute;Negative;0.9947690367698669;in europe for example unemployment was also rising sharply and financial strains remained significant
2009-06-03;2009;June;Minute;Positive;0.9732913374900818;many participants noted that the global nature of this recession meant that growth abroad was not likely to bolster us exports and so contribute to a recovery in the united states
2009-06-03;2009;June;Minute;Positive;0.6464552283287048;some participants noted that as this process continues increases in sales will have to be met by increases in production which would in turn support growth in hours worked and eventually in investment outlays
2009-06-03;2009;June;Minute;Negative;0.4271928668022156;many businesses had been successful in working down inventories of unsold goods
2009-06-03;2009;June;Minute;Neutral;0.882091224193573;voting for this
2009-06-03;2009;June;Minute;Negative;0.9672222137451172;participants noted the considerable uncertainty surrounding estimates of the output and unemployment gaps and the extent of their effects on prices
2009-06-03;2009;June;Minute;Positive;0.9925658702850342;however some meeting participants highlighted evidence from regional surveys that pointed to a stabilization or even a slight pickup in manufacturing in some areas and positive signs were apparent in the energy and agriculture sectors
2009-06-03;2009;June;Minute;Negative;0.9949120879173279;with the recovery projected to be rather sluggish most participants anticipated that the employment situation was likely to be downbeat for some time
2009-06-03;2009;June;Minute;Negative;0.9946172833442688;the large number of people working part time for economic reasons and the prevalence of permanent job reductions rather than temporary layoffs suggested that labor market conditions were even more difficult than indicated by the unemployment rate
2009-06-03;2009;June;Minute;Negative;0.991635799407959;reports from district contacts suggested that workweeks were being trimmed and that total hours worked were falling significantly
2009-06-03;2009;June;Minute;Negative;0.9909119606018066;some participants pointed out that households financial strains may be encouraging many individuals to enter the labor market despite difficult labor market conditions
2009-06-03;2009;June;Minute;Negative;0.8145463466644287;rising labor force participation contributed to the increase in the unemployment rate
2009-06-03;2009;June;Minute;Negative;0.9797772765159607;although some improvements were evident in new and continuing unemployment insurance claims and the may payroll report was less weak than expected job losses remained substantial over the intermeeting period and the unemployment rate continued to rise rapidly
2009-06-03;2009;June;Minute;Negative;0.9831878542900085;labor market conditions were of particular concern to meeting participants
2009-06-03;2009;June;Minute;Negative;0.9867525100708008;others noted that foreclosures were continuing at a very high rate and could push house prices down further and add to inventories of unsold homes holding back housing activity and weighing on household wealth
2009-06-03;2009;June;Minute;Negative;0.993496298789978;some expressed concern that the increases in mortgage rates seen over the intermeeting period had the potential to further depress the demand for housing and thus impede an economic recovery
2009-06-03;2009;June;Minute;Negative;0.9948689937591553;indicators of singlefamily starts and sales suggested that housing activity may be leveling out but most participants viewed the sector as still vulnerable to further weakness
2009-06-03;2009;June;Minute;Negative;0.9937718510627747;personal income was likely to contract for a time going forward as the effects of these factors waned and there was some risk that consumer spending might also decline as a consequence
2009-06-03;2009;June;Minute;Positive;0.9390915632247925;participants also observed that while personal income had expanded briskly of late those increases had been boosted by special onetime factors such as fiscal stimulus and large costofliving adjustments for social security recipients
2009-06-03;2009;June;Minute;Negative;0.986844003200531;given the significant uncertainties in the economic outlook a sizable reduction in the saving rate seemed unlikely in the near term some saw the possibility of further increases in the household saving rate
2009-06-03;2009;June;Minute;Negative;0.9953565001487732;because these factors were not seen as likely to dissipate quickly most participants judged that consumer spending would continue to be subdued for some time
2009-06-03;2009;June;Minute;Negative;0.9931074976921082;anecdotal reports suggested that the weakness in activity was widespread across many industries and extended to the service sector
2009-06-03;2009;June;Minute;Negative;0.9933813810348511;however most agreed that even taking account of such uncertainty the economy was almost certainly operating well below its potential and that significant price pressures were unlikely to materialize in the near and medium terms
2009-06-03;2009;June;Minute;Negative;0.9877790808677673;moreover participants pointed out that some measures of inflation expectations had edged up recently from very low readings perhaps reflecting in part reduced concerns about deflation and were now at levels close to those prevailing prior to the onset of the crisis
2009-06-03;2009;June;Minute;Negative;0.9907564520835876;a few participants were concerned that inflation expectations could continue to rise especially in light of the federal reserves greatly expanded balance sheet and the associated large volume of reserves in the banking system and that as a result inflation could temporarily rise above levels consistent with the committees dual objectives of maximum employment and stable prices
2009-06-03;2009;June;Minute;Neutral;0.9280926585197449;the ontherunofftherun premium narrowed considerably at the short end of the yield curve
2009-06-03;2009;June;Minute;Neutral;0.9847075939178467;the federal reserve is monitoring the size and composition of its balance sheet and will make adjustments to its credit and liquidity programs as warranted
2009-06-03;2009;June;Minute;Neutral;0.9758480191230774;the committee will continue to evaluate the timing and overall amounts of its purchases of securities in light of the evolving economic outlook and conditions in financial markets
2009-06-03;2009;June;Minute;Neutral;0.9628608226776123;in addition the federal reserve will buy up to 300 billion of treasury securities by autumn
2009-06-03;2009;June;Minute;Positive;0.5451339483261108;as previously announced to provide support to mortgage lending and housing markets and to improve overall conditions in private credit markets the federal reserve will purchase a total of up to 125 trillion of agency mortgagebacked securities and up to 200 billion of agency debt by the end of the year
2009-06-03;2009;June;Minute;Positive;0.878486156463623;the committee will maintain the target range for the federal funds rate at 0 to 14 percent and continues to anticipate that economic conditions are likely to warrant exceptionally low levels of the federal funds rate for an extended period
2009-06-03;2009;June;Minute;Neutral;0.7005747556686401;in these circumstances the federal reserve will employ all available tools to promote economic recovery and to preserve price stability
2009-06-03;2009;June;Minute;Negative;0.990063488483429;however substantial resource slack is likely to dampen cost pressures and the committee expects that inflation will remain subdued for some time
2009-06-03;2009;June;Minute;Neutral;0.9193922281265259;the prices of energy and other commodities have risen of late
2009-06-03;2009;June;Minute;Positive;0.9922276139259338;although economic activity is likely to remain weak for a time the committee continues to anticipate that policy actions to stabilize financial markets and institutions fiscal and monetary stimulus and market forces will contribute to a gradual resumption of sustainable economic growth in a context of price stability
2009-06-03;2009;June;Minute;Positive;0.9730887413024902;businesses are cutting back on fixed investment and staffing but appear to be making progress in bringing inventory stocks into better alignment with sales
2009-06-03;2009;June;Minute;Negative;0.9925191402435303;household spending has shown further signs of stabilizing but remains constrained by ongoing job losses lower housing wealth and tight credit
2009-06-03;2009;June;Minute;Positive;0.990365207195282;conditions in financial markets have generally improved in recent months
2009-06-03;2009;June;Minute;Negative;0.9924936294555664;the vote encompassed approval of the statement below to be released at 215 pm information received since the federal open market committee met in april suggests that the pace of economic contraction is slowing
2009-06-03;2009;June;Minute;Neutral;0.9879816174507141;the system open market account manager and the secretary will keep the committee informed of ongoing developments regarding the systems balance sheet that could affect the attainment over time of the committees objectives of maximum employment and price stability
2009-06-03;2009;June;Minute;Neutral;0.9500414133071899;the desk is expected to purchase up to 300 billion of longerterm treasury securities by the end of the third quarter
2009-06-03;2009;June;Minute;Neutral;0.9356728196144104;the desk is expected to purchase up to 125 trillion of agency mbs by the end of the year
2009-06-03;2009;June;Minute;Negative;0.9866111278533936;most participants however expected that inflation would remain subdued for some time
2009-06-03;2009;June;Minute;Neutral;0.9917697906494141;in their discussion of monetary policy for the period ahead committee members agreed that the stance of monetary policy should not be changed at this meeting
2009-06-03;2009;June;Minute;Neutral;0.9817952513694763;given the prospects for weak economic activity substantial resource slack and subdued inflation the committee agreed that it should maintain its target range for the federal funds rate at 0 to 14 percent
2009-06-03;2009;June;Minute;Negative;0.9895790219306946;the future path of the federal funds rate would depend on the committees evolving expectations for the economy but for now members thought it most likely that the federal funds rate would need to be maintained at an exceptionally low level for an extended period given their forecasts for only a gradual upturn in activity and the lack of inflation pressures
2009-06-03;2009;June;Minute;Neutral;0.9875271916389465;the committee also agreed that changes to its program of asset purchases were not warranted at this time
2009-06-03;2009;June;Minute;Negative;0.9821590781211853;although an expansion of such purchases might provide additional support to the economy the effects of further asset purchases especially purchases of treasury securities on the economy and on inflation expectations were uncertain
2009-06-03;2009;June;Minute;Negative;0.9941484928131104;the continued sluggishness in consumer expenditures mainly reflected falling employment sharply lower wealth as a result of earlier steep declines in asset prices and tight credit conditions
2009-06-03;2009;June;Minute;Positive;0.9842590093612671;moreover it seemed likely that economic activity was in the process of leveling out and the considerable improvements in financial markets over recent months were likely to lend further support to aggregate demand
2009-06-03;2009;June;Minute;Neutral;0.7765012383460999;at the conclusion of the discussion the committee voted to authorize and direct the federal reserve bank of new york until it was instructed otherwise to execute transactions in the system account in accordance with the following domestic policy directive the federal open market committee seeks monetary and financial conditions that will foster price stability and promote sustainable growth in output
2009-06-03;2009;June;Minute;Neutral;0.9889217615127563;to further its longrun objectives the committee seeks conditions in reserve markets consistent with federal funds trading in a range from 0 to 14 percent
2009-06-03;2009;June;Minute;Neutral;0.9724438786506653;the committee directs the desk to purchase agency debt agency mbs and longerterm treasury securities during the intermeeting period with the aim of providing support to private credit markets and economic activity
2009-06-03;2009;June;Minute;Neutral;0.9864250421524048;the timing and pace of these purchases should depend on conditions in the markets for such securities and on a broader assessment of private credit market conditions
2009-06-03;2009;June;Minute;Positive;0.9065227508544922;the committee anticipates that the combination of outright purchases and various liquidity facilities outstanding will cause the size of the federal reserves balance sheet to expand significantly in coming months
2009-06-03;2009;June;Minute;Neutral;0.9383237957954407;the desk is expected to purchase up to 200 billion in housingrelated agency debt by the end of this year
2009-06-03;2009;June;Minute;Neutral;0.9917671084403992;accordingly the committee agreed that the asset purchase programs should proceed for now on the schedule announced at previous meetings
2009-06-03;2009;June;Minute;Negative;0.9939814209938049;consumer spending appeared no longer to be declining but nonetheless remained weak
2009-06-03;2009;June;Minute;Negative;0.9704610705375671;still in light of the signs that economic activity was stabilizing most participants saw less downside risk to their expectations for inflation
2009-06-03;2009;June;Minute;Negative;0.9909713268280029;worsening credit quality especially for consumer and commercial real estate loans was seen as an important reason for reduced lending and tighter terms and banks could face substantial losses in their loan portfolios in coming quarters
2009-06-03;2009;June;Minute;Positive;0.9866907596588135;libortoois spreads in euros and sterling decreased and several foreign banks took advantage of improved financial conditions to raise capital and increase issuance of debt outside of government guarantee programs
2009-06-03;2009;June;Minute;Negative;0.987557053565979;this decline appeared to be driven by a renewed sense of optimism about global growth prospects leading investors to shift away from safehaven assets in the united states to riskier assets elsewhere
2009-06-03;2009;June;Minute;Neutral;0.9872093200683594;the dollar depreciated substantially during the intermeeting period against all other major currencies
2009-06-03;2009;June;Minute;Negative;0.9819501638412476;the amount of outstanding consumer loans originated by banks shrank during april and may the quantity of consumer loans on banks balance sheets decreased even more because of a number of large credit card securitizations
2009-06-03;2009;June;Minute;Neutral;0.9144885540008545;closedend residential mortgages decreased originations were reportedly strong but were more than offset by loan sales to the governmentsponsored enterprises
2009-06-03;2009;June;Minute;Negative;0.9624627828598022;home equity loans edged downthe first monthly decline in this category since october 2006partly because of banks reductions in existing lines of credit
2009-06-03;2009;June;Minute;Negative;0.9861876964569092;ci loans dropped in may amid subdued origination activity and broadbased paydowns of outstanding loans
2009-06-03;2009;June;Minute;Neutral;0.9367485642433167;commercial bank credit increased slightly in may following six consecutive monthly declines but the turnaround reflected a rise in securities holdings and in the volatile other loans categorythat is loans other than commercial and industrial ci real estate and consumer loans
2009-06-03;2009;June;Minute;Negative;0.9871366024017334;the rise in currency diminished likely reflecting primarily a waning in foreign demand
2009-06-03;2009;June;Minute;Negative;0.9813186526298523;retail money market mutual funds and small time deposits contracted in both months probably in response to declining interest rates on these assets
2009-06-03;2009;June;Minute;Negative;0.9533188343048096;the expansion of m2 slowed significantly in april and may as the reallocation of household wealth toward the safety and liquidity of m2 assets evidently moderated
2009-06-03;2009;June;Minute;Positive;0.883598268032074;meanwhile the federal government issued large amounts of debt and state and local government debt was estimated to have expanded moderately
2009-06-03;2009;June;Minute;Neutral;0.9389194846153259;speculativegrade issuance was the highest since june 2007 but issuance of lowerrated speculativegrade bonds remained minimal
2009-06-03;2009;June;Minute;Positive;0.5440179109573364;investmentgrade issuance rebounded after a lull in april
2009-06-03;2009;June;Minute;Negative;0.6168113946914673;the level of privatesector debt was estimated to have remained about unchanged in the second quarter as a further modest decline in household debt about offset a slight increase in nonfinancial business debt
2009-06-03;2009;June;Minute;Positive;0.9189740419387817;stock price indexes for the banking sector and the broader financial sectors rose significantly
