Date;Year;Month;Type;sentiment;sentiment_score;sentence
1999-07-15;1999;July;REPORT;Neutral;0.9846023321151733;it states that it can be noted that the designs which have meanwhile been published differ from the actual appearance of the euro banknotes
1999-07-15;1999;July;REPORT;Neutral;0.8089455366134644;what does this mean
1999-07-15;1999;July;REPORT;Neutral;0.9757869243621826;will we be getting other banknotes than those you are showing us pictures of here or 
1999-07-15;1999;July;REPORT;Neutral;0.9330637454986572;would you please elaborate
1999-07-15;1999;July;REPORT;Neutral;0.8962730765342712;duisenberg christian you went to the ecofin
1999-07-15;1999;July;REPORT;Neutral;0.9602281451225281;can you give a report on individual criteria
1999-07-15;1999;July;REPORT;Neutral;0.8683416843414307;noyer no unfortunately i cannot give any report
1999-07-15;1999;July;REPORT;Neutral;0.9918280839920044;i think reference is made to a report that had traditionally been made by the european monetary institute during the time of the preparation of all the decisions on which countries would join the euro area from the beginning
1999-07-15;1999;July;REPORT;Neutral;0.978255569934845;that report was taking care of all criteria
1999-07-15;1999;July;REPORT;Neutral;0.895218014717102;the ecb has simply continued this practice
1999-07-15;1999;July;REPORT;Neutral;0.9687274098396301;not because there is any possible consequence but because we have the technical knowledge and habit of doing this with the help of all the national central banks of the eurosystem
1999-07-15;1999;July;REPORT;Neutral;0.9707090854644775;it might be helpful for governments to have a number of technical analyses in looking at their own fiscal stances
1999-07-15;1999;July;REPORT;Neutral;0.966793954372406;it does not look at all at the short term of course
1999-07-15;1999;July;REPORT;Neutral;0.675396740436554;it looks more at the medium term and at the risks that may arise if a number of improvements are not pursued and if there are adverse developments in the medium or long term in for instance the real economy
1999-07-15;1999;July;REPORT;Negative;0.5965437293052673;but to take the most obvious example if the governments were all sticking to exactly 3 and then in the case of a future recession it would obviously be extremely difficult for governments to not breach the 3
1999-07-15;1999;July;REPORT;Positive;0.8971536159515381;so we say in that case there is a strong reason why sticking to the stability and growth pact will give you the room for manoeuvre
1999-07-15;1999;July;REPORT;Neutral;0.9719191789627075;that is the global assessment
1999-07-15;1999;July;REPORT;Neutral;0.8280059099197388;but it does not point to any risk of such a development in the short term
1999-07-15;1999;July;REPORT;Neutral;0.4758165776729584;first because progress has been made and second because economic developments are going to look better as the president has explained
1999-07-15;1999;July;REPORT;Negative;0.9558082222938538;so it cannot be concluded from this that there is a risk in the foreseeable future
1999-07-15;1999;July;REPORT;Neutral;0.8608230352401733;in the analysis that we have done many times and that has been very clear to all of you either from the monthly bulletins or from other publications we have repeatedly said that an actual implementation of the stability and growth pact and of the programmes that all countries have designed for themselves are very important as a safeguard against any kind of downward trend in the future
1999-07-15;1999;July;REPORT;Negative;0.9550106525421143;it does not mean that we foresee that there will be any slowdown of economic growth in the foreseeable future
1999-07-15;1999;July;REPORT;Neutral;0.9652737379074097;so there is no immediate implication for one country or another
1999-07-15;1999;July;REPORT;Neutral;0.8961992859840393;question what about the individual countries
1999-07-15;1999;July;REPORT;Neutral;0.9545408487319946;noyer well there is an analysis of all countries  yes
1999-07-15;1999;July;REPORT;Neutral;0.8926922082901001;but it is not pointing at a specific risk of a breach in specific countries
1999-07-15;1999;July;REPORT;Neutral;0.9746798872947693;for all countries it analyses the strengths and weaknesses in the fiscal consolidation process which of course are different  the balance is different from one country to the other
1999-07-15;1999;July;REPORT;Neutral;0.7248064279556274;but it is not pointing at certain countries in saying that there is a special risk of breaching the 3
1999-07-15;1999;July;REPORT;Neutral;0.9670553803443909;this is not the objective of the analysis
1999-07-15;1999;July;REPORT;Neutral;0.9453119039535522;it is more to give analytical help to countries to better shape their process of fiscal consolidation
1999-07-15;1999;July;REPORT;Positive;0.9810070395469666;duisenberg and to add one sentence as i told you the meeting today was attended by the president of the ecofin council mr niinistö and  i must say to our great satisfaction  he reported that the ecofin council had at its last meeting unanimously endorsed its commitment to the stability and growth pact and we were very pleased with that
1999-07-15;1999;July;REPORT;Neutral;0.5199878215789795;as far as the 50 billion euro in foreign reserves are concerned i do not think that they have already been turned over
1999-07-15;1999;July;REPORT;Neutral;0.9655461311340332;and it is not that important either because all foreign exchange reserves already come under the management of the ecb whether they are in the hand of or still in the coffers of the national central banks
1999-07-15;1999;July;REPORT;Neutral;0.8553785085678101;the third question on the appearance of the banknotes dont read to much in that
1999-07-15;1999;July;REPORT;Neutral;0.9118711352348328;essentially nothing has changed
1999-07-15;1999;July;REPORT;Neutral;0.9753140807151794;to give you one example why the banknotes  when they are issued  will look slightly different from those that were published as illustrations some time ago in those that have been published there was a fake signature
1999-07-15;1999;July;REPORT;Neutral;0.9098379015922546;ultimately there will be my signature  that is the difference
1999-07-15;1999;July;REPORT;Neutral;0.980639636516571;and another difference to mention another example is that the banknotes also bear the word euro in greek letters
1999-07-15;1999;July;REPORT;Neutral;0.963394820690155;in the ultimate series the word euro will still be there in greek letters but it will be somewhat shadier than in those published earlier
1999-07-15;1999;July;REPORT;Neutral;0.5929049849510193;question mr duisenberg two questions concerning your monetary bias
1999-07-15;1999;July;REPORT;Positive;0.5293039083480835;the first one given the current situation on the money market a change to a variable rate may have some positive effects
1999-07-15;1999;July;REPORT;Neutral;0.96978360414505;was such a change to variable rate tender discussed today or on any other occasion lately
1999-07-15;1999;July;REPORT;Neutral;0.8851324319839478;duisenberg it was not discussed today
1999-07-15;1999;July;REPORT;Neutral;0.9748289585113525;it will be discussed in the coming months
1999-07-15;1999;July;REPORT;Neutral;0.9338894486427307;whether the system will change is still open
1999-07-15;1999;July;REPORT;Neutral;0.6568917036056519;question the second question about the creeping bias
1999-07-15;1999;July;REPORT;Neutral;0.9878458380699158;do you intend to keep the public informed about the changes in the bias of the ecb  just like the fed did lately  or is it up to the fedwatchers to decipher the statements that come in the form of the monthly bulletins
1999-07-15;1999;July;REPORT;Neutral;0.9294414520263672;what exactly is your monetary stance at the moment
1999-07-15;1999;July;REPORT;Neutral;0.9453392624855042;duisenberg yes we do intend to be as open and transparent as we possibly can
1999-07-15;1999;July;REPORT;Neutral;0.9748712182044983;and as your colleague had already concluded from the monthly bulletin there might have been some slight change in tone that was confirmed today in my statement and we will monitor the developments in the months to come very carefully
1999-07-15;1999;July;REPORT;Neutral;0.9398666620254517;question i would like to know whether the euro notes which were stolen near paris  the printing plates  whether you have got them back and are you going to be able to use them
1999-07-15;1999;July;REPORT;Neutral;0.5421129465103149;and is it a problem for you that there are 10 printing works which are going to produce the euro notes
1999-07-15;1999;July;REPORT;Neutral;0.7037670612335205;they do not always have the same printing machines so that there may be quality differences
1999-07-15;1999;July;REPORT;Negative;0.8174319863319397;are you worried about that
1999-07-15;1999;July;REPORT;Neutral;0.8294156789779663;noyer the first question actually the material was not stolen near paris as far as i know but nobody knows where it disappeared
1999-07-15;1999;July;REPORT;Neutral;0.96630859375;somewhere in the air probably
1999-07-15;1999;July;REPORT;Neutral;0.9533747434616089;it was a crossborder transfer
1999-07-15;1999;July;REPORT;Neutral;0.907086193561554;but the real answer is that it has not been found but it could not have been used because it was not final
1999-07-15;1999;July;REPORT;Neutral;0.9168509840965271;the stolen material is of no use at all
1999-07-15;1999;July;REPORT;Neutral;0.9313874244689941;we have changed the features to have something that is absolutely safe
1999-07-15;1999;July;REPORT;Neutral;0.7999856472015381;duisenberg i can take the second question
1999-07-15;1999;July;REPORT;Negative;0.5953836441040039;is it a problem no
1999-07-15;1999;July;REPORT;Neutral;0.9893752336502075;when there are 10 printing works producing these banknotes it is monitored very very carefully that they are identical across the 10 printing works involved
1999-07-15;1999;July;REPORT;Positive;0.7487955689430237;i might add that the start of production yesterday was a total success in all printing works
1999-07-15;1999;July;REPORT;Neutral;0.9098008871078491;question so you are saying that todays reportin the frankfurter allgemeine zeitung is wrong
1999-07-15;1999;July;REPORT;Neutral;0.8272042274475098;duisenberg that is correct
1999-07-15;1999;July;REPORT;Neutral;0.8924999833106995;question could you just very briefly tell us a little bit more about the safety features of the new euro banknotes
1999-07-15;1999;July;REPORT;Neutral;0.8629649877548218;duisenberg the answer is no
1999-07-15;1999;July;REPORT;Neutral;0.7490155696868896;we will not reveal at this time specifics of the extensive safety features which have been incorporated into the new banknotes but we will start an extensive information campaign well before the actual issuance of the banknotes to make the public and the experts the cashiers at banks and in the retail sector very familiar with the safety features as they have been incorporated
1999-07-15;1999;July;REPORT;Neutral;0.7784836292266846;question president duisenberg the ecb is lending money to banks at lower rates but bonds are being issued at higher rates
1999-07-15;1999;July;REPORT;Negative;0.792560875415802;now is this something you are having misgivings about
1999-07-15;1999;July;REPORT;Neutral;0.57427579164505;do you not think that your accommodating monetary policy is not being taken seriously
1999-07-15;1999;July;REPORT;Negative;0.6514686942100525;duisenberg the shortterm interest rates have hardly moved over the past six weeks
1999-07-15;1999;July;REPORT;Neutral;0.9887702465057373;the threemonth interest rates were at 26 and in the last few days they have moved up to 27
1999-07-15;1999;July;REPORT;Negative;0.8068737387657166;so that is not a cause for concern
1999-07-15;1999;July;REPORT;Neutral;0.9745556712150574;at the long end of the yield curve there has been a significant move to an average yield for government paper of now 49 which is one of the factors i have discussed in my introductory statement
1999-07-15;1999;July;REPORT;Negative;0.9627618789672852;it is not a cause of concern which would in our opinion threaten price stability
1999-07-15;1999;July;REPORT;Neutral;0.9707826972007751;but this has to be monitored very closely
1999-07-15;1999;July;REPORT;Neutral;0.8139537572860718;question when looking at the upcoming situation regarding price stability has your assessment been influenced by the possibility of the degree  however small  of imported inflation from the lower exchange rate of the euro against the dollar
1999-07-15;1999;July;REPORT;Neutral;0.9807969331741333;duisenberg we continuously assess that and we then come to the same conclusions that you had formulated so adequately in the article you published yesterday
1999-07-15;1999;July;REPORT;Neutral;0.9590032696723938;question there have been many calls on european policy makers to improve their coordination of comments on the euro
1999-07-15;1999;July;REPORT;Neutral;0.9790170788764954;do you think the politicians comments on the euro are on balance helpful or would you prefer that the ecb or you as president had sole responsibility for commenting on the development of the currency
1999-07-15;1999;July;REPORT;Negative;0.5474388599395752;duisenberg well that is an unrealistic prospect
1999-07-15;1999;July;REPORT;Neutral;0.9702393412590027;we do agree  both politicians and the ecb  that it is important to speak with one voice even if we do it through many mouths
1999-07-15;1999;July;REPORT;Neutral;0.9842023849487305;contact european central bank directorate general communications sonnemannstrasse 20 60314 frankfurt am main germany 49 69 1344 7455 mediaecbeuropaeu reproduction is permitted provided that the source is acknowledged
1999-07-15;1999;July;REPORT;Neutral;0.8690058588981628;media contacts
