Date;Year;Month;Type;sentiment;sentiment_score;sentence
2020-07-29;2020;July;Minute;Positive;0.9896401166915894;the surge in manufacturing production was led by appreciable gains in the output of motor vehicles and related parts following extended automaker shutdowns from midmarch through april
2020-07-29;2020;July;Minute;Neutral;0.9304106831550598;in contrast output in the mining sectorâwhich includes crude oil extractionâdecreased further reflecting the effects of stilllow crude oil prices
2020-07-29;2020;July;Minute;Neutral;0.9760261178016663;total real government purchases appeared to have increased moderately on balance in the second quarter
2020-07-29;2020;July;Minute;Positive;0.9513959884643555;federal defense spending continued to rise through june and nondefense purchases were likely boosted in the second quarter by fiscal policy measures taken in response to the coronavirus
2020-07-29;2020;July;Minute;Negative;0.9883211255073547;in contrast state and local purchases looked to have declined markedly as the payrolls of these governments shrank further in june and nominal state and local construction expenditures decreased on net over april and may
2020-07-29;2020;July;Minute;Negative;0.9778483510017395;the nominal us international trade deficit widened in may relative to april as exports decreased more than imports
2020-07-29;2020;July;Minute;Negative;0.564651370048523;the fall in exports was broad based across goods categories while lower imports of automotive products more than offset higher imports of consumer goods and industrial supplies
2020-07-29;2020;July;Minute;Negative;0.9941902160644531;following aprils historic plunge exports and imports of services fell a bit further in may driven by the continued suspension of most international travel
2020-07-29;2020;July;Minute;Negative;0.9949722290039062;the consumer sentiment measures from both the michigan survey and the conference board survey improved notably in june but fell back somewhat in july
2020-07-29;2020;July;Minute;Negative;0.9765058159828186;altogether the available data suggested that net exports were a significant drag on the rate of change in real gdp in the second quarter
2020-07-29;2020;July;Minute;Positive;0.952523946762085;however wage and salary income increased strongly in may though to a level still below its february value and unemployment insurance benefits continued to be substantial leaving the personal saving rate quite elevated
2020-07-29;2020;July;Minute;Negative;0.9944164752960205;moreover recent highfrequency indicators of spending on many consumer servicesâsuch as restaurant dining hotel accommodations and air travelâremained very subdued
2020-07-29;2020;July;Minute;Negative;0.9849684834480286;the unemployment rate moved down further to 111 percent but it continued to be far above its level at the beginning of the year
2020-07-29;2020;July;Minute;Positive;0.990458607673645;the unemployment rates for african americans asians and hispanics declined on balance over the past two months but remained well above the national average
2020-07-29;2020;July;Minute;Neutral;0.6780354976654053;both the labor force participation rate and the employmenttopopulation ratio increased further in june
2020-07-29;2020;July;Minute;Negative;0.994881272315979;initial claims for unemployment insurance benefits continued to decrease on net through the middle of july but the pace of declines had slowed in recent weeks
2020-07-29;2020;July;Minute;Positive;0.9691182374954224;in addition weekly estimates of privatesector payrolls constructed by the boards staff using data provided by the payroll processor adp along with some other highfrequency measuresâsuch as employment at small businesses and job postingsâsuggested that employment gains had slowed since midjune but likely were still strong
2020-07-29;2020;July;Minute;Negative;0.9939238429069519;total pce price inflation was 05 percent over the 12 months ending in may reflecting both weak aggregate demand and a considerable drop in consumer energy prices
2020-07-29;2020;July;Minute;Neutral;0.9448114037513733;core pce price inflation which excludes changes in consumer food and energy prices was 10 percent over the same 12month period
2020-07-29;2020;July;Minute;Neutral;0.9929459691047668;in contrast the trimmed mean measure of 12âmonth pce price inflation constructed by the federal reserve bank of dallas was 20 percent in may
2020-07-29;2020;July;Minute;Neutral;0.9255989789962769;the consumer price index cpi increased 06 percent over the 12 months ending in june while core cpi inflation was 12 percent over the same period
2020-07-29;2020;July;Minute;Positive;0.9891716837882996;on a monthly basis the available data indicated that consumer pricesâas measured by the pce price index in may and the cpi in juneâhad turned up after having fallen in march and april this rebound was evident in many price categories that were most affected by socialdistancing measures
2020-07-29;2020;July;Minute;Neutral;0.9817250370979309;recent readings on surveybased measures of longerrun inflation expectations were little changed on balance
2020-07-29;2020;July;Minute;Neutral;0.9910745024681091;the university of michigan surveys of consumers measure for the next 5 to 10 years was unchanged on net from may to early july the threeyearahead measure from the federal reserve bank of new yorks survey of consumer expectations edged down in june but remained within its recent range
2020-07-29;2020;July;Minute;Positive;0.9842684268951416;real pce rebounded robustly in may with particularly strong growth in spending for consumer goods but more moderate gains in expenditures for consumer services
2020-07-29;2020;July;Minute;Positive;0.9221064448356628;in june the components of retail sales used by the bureau of economic analysis to estimate pce along with light motor vehicle sales increased further
2020-07-29;2020;July;Minute;Negative;0.9940366744995117;overall however real consumer spending remained well below the levels that prevailed at the beginning of the year
2020-07-29;2020;July;Minute;Negative;0.987794041633606;real disposable personal income fell back in may primarily reflecting the waning of the substantial boost that federal stimulus payments had provided in april
2020-07-29;2020;July;Minute;Negative;0.9929647445678711;the staff judged that asset valuation pressures were notable
2020-07-29;2020;July;Statement;Neutral;0.9902087450027466;the committee will continue to monitor the implications of incoming information for the economic outlook including information related to public health as well as global developments and muted inflation pressures and will use its tools and act as appropriate to support the economy
2020-07-29;2020;July;Minute;Negative;0.9910470843315125;the staff assessed vulnerabilities due to nonfinancial leverage to have risen from moderate to notable reflecting declines in household incomes and business profits such declines implied less resilient borrowers
2020-07-29;2020;July;Minute;Positive;0.9911976456642151;overall financial conditions had improved in part reflecting policy measures to support the economy and the flow of credit to us households businesses and communities
2020-07-29;2020;July;Minute;Neutral;0.89069664478302;members agreed that the federal reserve was committed to using its full range of tools to support the us economy in this challenging time thereby promoting its maximum employment and price stability goals
2020-07-29;2020;July;Minute;Neutral;0.909353494644165;members stated that the path of the economy would depend significantly on the course of the virus
2020-07-29;2020;July;Minute;Negative;0.9944568872451782;in addition members agreed that the ongoing public health crisis would weigh heavily on economic activity employment and inflation in the near term and was posing considerable risks to the economic outlook over the medium term
2020-07-29;2020;July;Minute;Neutral;0.9919881820678711;in light of these developments members decided to maintain the target range for the federal funds rate at 0 to 14 percent
2020-07-29;2020;July;Minute;Positive;0.912349283695221;members stated that they expected to maintain this target range until they were confident that the economy had weathered recent events and was on track to achieve the committees maximum employment and price stability goals
2020-07-29;2020;July;Minute;Negative;0.9943622350692749;consumer price inflation was being held down by weaker demand and significantly lower oil prices
2020-07-29;2020;July;Minute;Neutral;0.9927640557289124;members agreed that they would continue to monitor the implications of incoming information for the economic outlookâincluding information related to public healthâas well as global developments and muted inflation pressures and that they would use the committees tools and act as appropriate to support the economy
2020-07-29;2020;July;Minute;Neutral;0.987831175327301;this assessment would take into account a wide range of information including measures of labor market conditions indicators of inflation pressures and inflation expectations and readings on financial and international developments
2020-07-29;2020;July;Minute;Neutral;0.9710991382598877;to support the flow of credit to households and businesses members agreed that over coming months it would be appropriate for the federal reserve to increase its holdings of treasury securities and agency rmbs and cmbs at least at the current pace to sustain smooth market functioning thereby fostering effective transmission of monetary policy to broader financial conditions
2020-07-29;2020;July;Minute;Neutral;0.9825169444084167;in addition members agreed that the desk would continue to offer largescale overnight and term repo operations
2020-07-29;2020;July;Minute;Neutral;0.9895288348197937;members noted that they would closely monitor developments and be prepared to adjust their plans as appropriate
2020-07-29;2020;July;Minute;Neutral;0.9922744631767273;at the conclusion of the discussion the committee voted to authorize and direct the federal reserve bank of new york until instructed otherwise to execute transactions in the soma in accordance with the following domestic policy directive for release at 200 pm effective july 30 2020 the federal open market committee directs the desk to undertake open market operations as necessary to maintain the federal funds rate in a target range of 0 to 14 percent
2020-07-29;2020;July;Minute;Positive;0.972775399684906;increase the system open market account holdings of treasury securities agency mortgagebacked securities mbs and agency commercial mortgagebacked securities cmbs at least at the current pace to sustain smooth functioning of markets for these securities thereby fostering effective transmission of monetary policy to broader financial conditions
2020-07-29;2020;July;Minute;Neutral;0.9937465190887451;in determining the timing and size of future adjustments to the stance of monetary policy members noted that they would assess realized and expected economic conditions relative to the committees maximumemployment objective and its symmetric 2 percent inflation objective
2020-07-29;2020;July;Minute;Negative;0.9948846697807312;following sharp declines economic activity and employment had picked up somewhat in recent months but remained well below their levels at the beginning of the year
2020-07-29;2020;July;Minute;Positive;0.8632540106773376;committee policy action in their discussion of monetary policy for this meeting members agreed that the coronavirus outbreak was causing tremendous human and economic hardship across the united states and around the world
2020-07-29;2020;July;Minute;Neutral;0.915407657623291;a couple of participants remarked on the value of yield caps and targets as a means of reinforcing forward guidance on asset purchases thereby providing insurance against adverse movements in market expectations regarding the path of monetary policy and as a tool that could help limit the amount of asset purchases that the committee would need to make in pursuing its dualmandate goals
2020-07-29;2020;July;Minute;Neutral;0.9920938611030579;participants observed that it would be important to continue to monitor developments closely and that the committee would be prepared to adjust its plans as appropriate
2020-07-29;2020;July;Minute;Neutral;0.9893460869789124;participants discussed the current stance of monetary policy and the circumstances under which they might increase monetary policy accommodation or clarify their intentions regarding policy
2020-07-29;2020;July;Minute;Neutral;0.9702933430671692;participants generally judged that the committees policy actions over the past several months had provided substantial accommodation several of them observed that the committees asset purchases which were designed to support financial market functioning and the smooth flow of credit were likely also providing a degree of policy accommodation
2020-07-29;2020;July;Minute;Neutral;0.8135386109352112;noting the increase in uncertainty about the economic outlook over the intermeeting period several participants suggested that additional accommodation could be required to promote economic recovery and return inflation to the committees 2 percent objective
2020-07-29;2020;July;Minute;Positive;0.9839125275611877;some participants observed that due to the nature of the shock that the us economy was experiencing strong fiscal policy support would be necessary to encourage expeditious improvements in labor market conditions
2020-07-29;2020;July;Minute;Neutral;0.991183876991272;with regard to the outlook for monetary policy beyond this meeting a number of participants noted that providing greater clarity regarding the likely path of the target range for the federal funds rate would be appropriate at some point
2020-07-29;2020;July;Minute;Neutral;0.989389955997467;concerning the possible form that revised policy communications might take these participants commented on outcomebased forward guidanceâunder which the committee would undertake to maintain the current target range for the federal funds rate at least until one or more specified economic outcomes was achievedâand also touched on calendarbased forward guidanceâunder which the current target range would be maintained at least until a particular calendar date
2020-07-29;2020;July;Minute;Neutral;0.9899508357048035;in the context of outcomebased forward guidance various participants mentioned using thresholds calibrated to inflation outcomes unemployment rate outcomes or combinations of the two as well as combinations with calendarbased guidance
2020-07-29;2020;July;Minute;Neutral;0.9919970631599426;in addition many participants commented that it might become appropriate to frame communications regarding the committees ongoing asset purchases more in terms of their role in fostering accommodative financial conditions and supporting economic recovery
2020-07-29;2020;July;Minute;Positive;0.6327617764472961;more broadly in discussing the policy outlook a number of participants observed that completing a revised statement on longerrun goals and monetary policy strategy would be very helpful in providing an overarching framework that would help guide the committees future policy actions and communications
2020-07-29;2020;July;Minute;Neutral;0.9891000390052795;a majority of participants commented on yield caps and targetsâapproaches that cap or target interest rates along the yield curveâas a monetary policy tool
2020-07-29;2020;July;Minute;Negative;0.9373164176940918;of those participants who discussed this option most judged that yield caps and targets would likely provide only modest benefits in the current environment as the committees forward guidance regarding the path of the federal funds rate already appeared highly credible and longerterm interest rates were already low
2020-07-29;2020;July;Minute;Neutral;0.9637460112571716;many of these participants also pointed to potential costs associated with yield caps and targets
2020-07-29;2020;July;Minute;Negative;0.9704713821411133;among these costs participants noted the possibility of an excessively rapid expansion of the balance sheet and difficulties in the design and communication of the conditions under which such a policy would be terminated especially in conjunction with forward guidance regarding the policy rate
2020-07-29;2020;July;Minute;Neutral;0.990182101726532;in light of these concerns many participants judged that yield caps and targets were not warranted in the current environment but should remain an option that the committee could reassess in the future if circumstances changed markedly
2020-07-29;2020;July;Minute;Neutral;0.6019757390022278;conduct term and overnight repurchase agreement operations to support effective policy implementation and the smooth functioning of shortterm us dollar funding markets
2020-07-29;2020;July;Minute;Neutral;0.9912332892417908;in addition participants noted that it was appropriate that the desk would continue to offer largescale overnight and term repo operations
2020-07-29;2020;July;Minute;Neutral;0.9784850478172302;roll over at auction all principal payments from the federal reserves holdings of treasury securities and reinvest all principal payments from the federal reserves holdings of agency debt and agency mbs in agency mbs and all principal payments from holdings of agency cmbs in agency cmbs
2020-07-29;2020;July;Minute;Neutral;0.9763945937156677;engage in dollar roll and coupon swap transactions as necessary to facilitate settlement of the federal reserves agency mbs transactions
2020-07-29;2020;July;Statement;Negative;0.9905408024787903;weaker demand and significantly lower oil prices are holding down consumer price inflation
2020-07-29;2020;July;Statement;Positive;0.9917077422142029;overall financial conditions have improved in recent months in part reflecting policy measures to support the economy and the flow of credit to us households and businesses
2020-07-29;2020;July;Statement;Neutral;0.8081761598587036;the path of the economy will depend significantly on the course of the virus
2020-07-29;2020;July;Statement;Negative;0.9910157918930054;the ongoing public health crisis will weigh heavily on economic activity employment and inflation in the near term and poses considerable risks to the economic outlook over the medium term
2020-07-29;2020;July;Statement;Neutral;0.9911989569664001;in light of these developments the committee decided to maintain the target range for the federal funds rate at 0 to 14 percent
2020-07-29;2020;July;Statement;Positive;0.9691215753555298;the committee expects to maintain this target range until it is confident that the economy has weathered recent events and is on track to achieve its maximum employment and price stability goals
2020-07-29;2020;July;Statement;Negative;0.9948176741600037;following sharp declines economic activity and employment have picked up somewhat in recent months but remain well below their levels at the beginning of the year
2020-07-29;2020;July;Statement;Neutral;0.9645574688911438;implementation note issued july 29 2020
2020-07-29;2020;July;Statement;Neutral;0.9859616160392761;this assessment will take into account a wide range of information including measures of labor market conditions indicators of inflation pressures and inflation expectations and readings on financial and international developments
2020-07-29;2020;July;Statement;Positive;0.9690056443214417;to support the flow of credit to households and businesses over coming months the federal reserve will increase its holdings of treasury securities and agency residential and commercial mortgagebacked securities at least at the current pace to sustain smooth market functioning thereby fostering effective transmission of monetary policy to broader financial conditions
2020-07-29;2020;July;Statement;Neutral;0.8959978818893433;in addition the open market desk will continue to offer largescale overnight and term repurchase agreement operations
2020-07-29;2020;July;Statement;Neutral;0.9862427711486816;the committee will closely monitor developments and is prepared to adjust its plans as appropriate
2020-07-29;2020;July;Statement;Neutral;0.9633825421333313;voting for the monetary policy action were jerome h powell chair john c williams vice chair michelle w bowman lael brainard richard h clarida patrick harker robert s kaplan neel kashkari loretta j mester and randal k quarles
2020-07-29;2020;July;Minute;Positive;0.6867406964302063;in particular highyield and investmentgrade corporate bond spreads were within historical norms and commercial real estate prices were continuing to increase despite rising vacancy rates
2020-07-29;2020;July;Statement;Neutral;0.9914621710777283;in determining the timing and size of future adjustments to the stance of monetary policy the committee will assess realized and expected economic conditions relative to its maximum employment objective and its symmetric 2 percent inflation objective
2020-07-29;2020;July;Statement;Positive;0.5905473232269287;the coronavirus outbreak is causing tremendous human and economic hardship across the united states and around the world
2020-07-29;2020;July;Statement;Positive;0.9391180276870728;the federal reserve is committed to using its full range of tools to support the us economy in this challenging time thereby promoting its maximum employment and price stability goals
2020-07-29;2020;July;Minute;Neutral;0.882091224193573;voting for this
2020-07-29;2020;July;Minute;Positive;0.8064998984336853;the vote also encompassed approval of the statement below for release at 200 pm the federal reserve is committed to using its full range of tools to support the us economy in this challenging time thereby promoting its maximum employment and price stability goals
2020-07-29;2020;July;Minute;Positive;0.5905473232269287;the coronavirus outbreak is causing tremendous human and economic hardship across the united states and around the world
2020-07-29;2020;July;Minute;Negative;0.9948176741600037;following sharp declines economic activity and employment have picked up somewhat in recent months but remain well below their levels at the beginning of the year
2020-07-29;2020;July;Minute;Negative;0.9905408024787903;weaker demand and significantly lower oil prices are holding down consumer price inflation
2020-07-29;2020;July;Minute;Positive;0.9917077422142029;overall financial conditions have improved in recent months in part reflecting policy measures to support the economy and the flow of credit to us households and businesses
2020-07-29;2020;July;Minute;Neutral;0.8081761598587036;the path of the economy will depend significantly on the course of the virus
2020-07-29;2020;July;Minute;Negative;0.9910157918930054;the ongoing public health crisis will weigh heavily on economic activity employment and inflation in the near term and poses considerable risks to the economic outlook over the medium term
2020-07-29;2020;July;Minute;Neutral;0.9911989569664001;in light of these developments the committee decided to maintain the target range for the federal funds rate at 0 to 14 percent
2020-07-29;2020;July;Minute;Positive;0.9691215753555298;the committee expects to maintain this target range until it is confident that the economy has weathered recent events and is on track to achieve its maximum employment and price stability goals
2020-07-29;2020;July;Minute;Neutral;0.9902087450027466;the committee will continue to monitor the implications of incoming information for the economic outlook including information related to public health as well as global developments and muted inflation pressures and will use its tools and act as appropriate to support the economy
2020-07-29;2020;July;Minute;Neutral;0.9914621710777283;in determining the timing and size of future adjustments to the stance of monetary policy the committee will assess realized and expected economic conditions relative to its maximum employment objective and its symmetric 2 percent inflation objective
2020-07-29;2020;July;Minute;Neutral;0.9859616160392761;this assessment will take into account a wide range of information including measures of labor market conditions indicators of inflation pressures and inflation expectations and readings on financial and international developments
2020-07-29;2020;July;Minute;Positive;0.9690056443214417;to support the flow of credit to households and businesses over coming months the federal reserve will increase its holdings of treasury securities and agency residential and commercial mortgagebacked securities at least at the current pace to sustain smooth market functioning thereby fostering effective transmission of monetary policy to broader financial conditions
2020-07-29;2020;July;Minute;Neutral;0.8959978818893433;in addition the open market desk will continue to offer largescale overnight and term repurchase agreement operations
2020-07-29;2020;July;Minute;Neutral;0.9862427711486816;the committee will closely monitor developments and is prepared to adjust its plans as appropriate
2020-07-29;2020;July;Minute;Neutral;0.9781313538551331;allow modest deviations from stated amounts for purchases and reinvestments if needed for operational reasons
2020-07-29;2020;July;Minute;Positive;0.977482795715332;these actions would be helpful in sustaining smooth market functioning thereby fostering the effective transmission of monetary policy to broader financial conditions
2020-07-29;2020;July;Minute;Neutral;0.9864346981048584;conduct overnight reverse repurchase agreement operations at an offering rate of 000 percent and with a percounterparty limit of 30 billion per day the percounterparty limit can be temporarily increased at the discretion of the chair
