Date;Year;Month;Type;sentiment;sentiment_score;sentence
2017-12-28;2017;December;Monetary Policy Decisions;Neutral;0.9864639043807985;notes the range of underlying measures consists of the following hicp excluding energy hicp excluding unprocessed food and energy hicp excluding food and energy hicp excluding food energy travelrelated items and clothing the 10 trimmed mean the 30 trimmed mean the median of the hicp and a measure based on a dynamic factor model
2017-12-28;2017;December;Monetary Policy Decisions;Neutral;0.9787784814834596;chart 16 measures of underlying inflation annual percentage changes sources eurostat and ecb calculations
2017-12-28;2017;December;Monetary Policy Decisions;Negative;0.7353305816650391;overall measures of underlying inflation have not yet shown convincing signs of a sustained upward trend
2017-12-28;2017;December;Monetary Policy Decisions;Neutral;0.9856514930725098;novembers hicp inflation excluding food and energy stood close to its levels at the turn of last year
2017-12-28;2017;December;Monetary Policy Decisions;Negative;0.9862759113311768;this overall decline since september was due in part to large declines in inflation for certain services items including education fees in italy and transportrelated insurance in germany
2017-12-28;2017;December;Monetary Policy Decisions;Neutral;0.9755359292030334;hicp inflation excluding food and energy was 09 in november 2017 unchanged from october but down from 11 in september see chart 16
2017-12-28;2017;December;Monetary Policy Decisions;Negative;0.8502171635627747;measures of underlying inflation have moderated somewhat recently in part owing to special factors
2017-12-28;2017;December;Monetary Policy Decisions;Neutral;0.9592061638832092;note the latest observations are for november 2017 flash estimates
2017-12-28;2017;December;Monetary Policy Decisions;Neutral;0.969014585018158;these developments are in sharp contrast with those during the period prior to the crisis when both indebtedness and investment were on the rise see chart 12
2017-12-28;2017;December;Monetary Policy Decisions;Neutral;0.9808741211891174;chart 15 contributions of components to euro area headline hicp inflation annual percentage changes percentage point contributions sources eurostat and ecb calculations
2017-12-28;2017;December;Monetary Policy Decisions;Neutral;0.9355613589286804;the november increase reflects mainly higher energy price inflation marginally offset by a small decrease in food price inflation
2017-12-28;2017;December;Monetary Policy Decisions;Neutral;0.988569438457489;according to eurostats flash estimate euro area annual hicp inflation rose to 15 in november from 14 in october returning to the level recorded in september see chart 15
2017-12-28;2017;December;Monetary Policy Decisions;Neutral;0.9680593609809875;headline inflation increased slightly in november
2017-12-28;2017;December;Monetary Policy Decisions;Neutral;0.6348761916160583;this assessment is also broadly reflected in the december 2017 eurosystem staff macroeconomic projections for the euro area which foresee annual hicp inflation at 15 in 2017 14 in 2018 15 in 2019 and 17 in 2020 compared with the september 2017 ecb staff macroeconomic projections the outlook for headline hicp inflation has been revised up mainly reflecting higher oil and food prices
2017-12-28;2017;December;Monetary Policy Decisions;Positive;0.976175844669342;underlying inflation is expected to rise gradually over the medium term supported by the ecbs monetary policy measures the continuing economic expansion the corresponding absorption of economic slack and rising wage growth
2017-12-28;2017;December;Monetary Policy Decisions;Neutral;0.9522435665130616;looking ahead on the basis of current futures prices for oil annual rates of headline inflation are likely to moderate in the coming months mainly reflecting base effects in energy prices before increasing again
2017-12-28;2017;December;Monetary Policy Decisions;Negative;0.8888115882873535;at the same time measures of underlying inflation have moderated somewhat recently in part owing to special factors
2017-12-28;2017;December;Monetary Policy Decisions;Neutral;0.990548312664032;prices and costs according to eurostats flash estimate euro area annual hicp inflation was 15 in november up from 14 in october
2017-12-28;2017;December;Monetary Policy Decisions;Neutral;0.9634332060813904;the method used for calculating the ranges involving a correction for exceptional events is documented in new procedure for constructing eurosystem and ecb staff projection ranges ecb december 2009 available on the ecbs website
2017-12-28;2017;December;Monetary Policy Decisions;Neutral;0.988416850566864;the width of the ranges is twice the average absolute value of these differences
2017-12-28;2017;December;Monetary Policy Decisions;Neutral;0.9858799576759338;chart 14 euro area real gdp including projections quarteronquarter percentage changes sources eurostat and the article entitled december 2017 eurosystem staff macroeconomic projections for the euro area published on the ecbs website on 14 december 2017 notes the ranges shown around the central projections are based on the differences between actual outcomes and previous projections carried out over a number of years
2017-12-28;2017;December;Monetary Policy Decisions;Neutral;0.9622942805290222;the risks surrounding the euro area growth outlook are broadly balanced
2017-12-28;2017;December;Monetary Policy Decisions;Neutral;0.9338570237159728;compared with the september 2017 ecb staff macroeconomic projections the outlook for real gdp growth has been revised upwards substantially
2017-12-28;2017;December;Monetary Policy Decisions;Neutral;0.6528306603431702;the increase in energy inflation was larger than anticipated stemming from the latest substantial increases in oil prices
2017-12-28;2017;December;Monetary Policy Decisions;Negative;0.961738348007202;since 2013 this trend has reversed with the recovery in investment being accompanied by household deleveraging
2017-12-28;2017;December;Monetary Policy Decisions;Negative;0.9624993205070496;in 2008 household indebtedness started to rise while housing investment began to decline
2017-12-28;2017;December;Monetary Policy Decisions;Neutral;0.9408236145973206;since the onset of the euro area crisis developments in housing investment and household indebtedness have moved in opposite directions
2017-12-28;2017;December;Monetary Policy Decisions;Neutral;0.973492443561554;the euro appreciated visàvis the currencies of some emerging and advanced economies including the swiss franc by 21 the japanese yen by 20 and the chinese renminbi and also appreciated against the currencies of most noneuro area eu member states apart from the polish zloty and the czech koruna against which it depreciated by 07 and 18 respectively
2017-12-28;2017;December;Monetary Policy Decisions;Neutral;0.9107221364974976;there was also a depreciation in the euro visàvis the pound sterling by 38 and against the currencies of a number of emerging economies in asia
2017-12-28;2017;December;Monetary Policy Decisions;Neutral;0.9181358814239502;since peaking at the beginning of the review period the euro has depreciated visàvis the us dollar by 20 see chart 9 reflecting both expectations about future policies and related macroeconomic news
2017-12-28;2017;December;Monetary Policy Decisions;Negative;0.9921659231185912;however this is masking some uneven developments across currency pairs
2017-12-28;2017;December;Monetary Policy Decisions;Neutral;0.9912459254264832;notes the vertical grey line denotes the start of the review period on 7 september 2017 the latest observation is for 13 december 2017 in foreign exchange markets the euro has remained broadly unchanged
2017-12-28;2017;December;Monetary Policy Decisions;Neutral;0.975257396697998;chart 8 euro area and us equity price indices index 1 january 2015  100 sources thomson reuters and ecb calculations
2017-12-28;2017;December;Monetary Policy Decisions;Negative;0.9892148375511168;in the euro area market expectations regarding equity price volatility decreased marginally remaining at the low levels which have prevailed throughout 2017 while in the united states they declined overall
2017-12-28;2017;December;Monetary Policy Decisions;Negative;0.9720012545585632;the equity prices of us nfcs and banks were 7 and 19 higher respectively at the end of the review period also reflecting the favourable market perception of a us corporate tax reform
2017-12-28;2017;December;Monetary Policy Decisions;Positive;0.9923657774925232;euro area equity prices are also still being underpinned by the robust economic outlook and the ensuing increase in earnings expectations
2017-12-28;2017;December;Monetary Policy Decisions;Neutral;0.9396737813949584;equity prices of euro area nfcs and banks were around 4 higher at the end of the review period owing partly to a reduction in perceived geopolitical risk see chart 8
2017-12-28;2017;December;Monetary Policy Decisions;Neutral;0.9916470050811768;notes the vertical grey line denotes the start of the review period on 7 september 2017 the latest observation is for 13 december 2017 euro area equity prices increased
2017-12-28;2017;December;Monetary Policy Decisions;Neutral;0.9706966280937196;chart 7 euro area corporate bond spreads basis points sources iboxx indices and ecb calculations
2017-12-28;2017;December;Monetary Policy Decisions;Positive;0.9850645661354064;the low level and further compression of corporate bond spreads is consistent with a strengthening economic recovery
2017-12-28;2017;December;Monetary Policy Decisions;Neutral;0.9684865474700928;chart 9 changes in the exchange rate of the euro visàvis selected currencies percentages source ecb
2017-12-28;2017;December;Monetary Policy Decisions;Negative;0.5072086453437805;spreads on noninvestmentgrade and financial sector debt also declined falling by 11 basis points and 16 basis points respectively see chart 7
2017-12-28;2017;December;Monetary Policy Decisions;Negative;0.6320765018463135;liquidity conditions are discussed in more detail in box 2 spreads on corporate bonds declined further during the period under review
2017-12-28;2017;December;Monetary Policy Decisions;Positive;0.5596535801887512;excess liquidity increased by about 121 billion to around 1898 billion owing to ongoing purchases under the eurosystems asset purchase programme
2017-12-28;2017;December;Monetary Policy Decisions;Neutral;0.6834576725959778;owing to idiosyncratic factors the eonia rose to a high of 24 basis points at the end of november
2017-12-28;2017;December;Monetary Policy Decisions;Neutral;0.9830394387245178;the eonia stood at an average of 35 basis points
2017-12-28;2017;December;Monetary Policy Decisions;Neutral;0.9735687375068665;chart 6 eonia forward rates percentages per annum sources thomson reuters and ecb calculations
2017-12-28;2017;December;Monetary Policy Decisions;Negative;0.8721147179603577;the fact that the curve remains in negative territory until around mid2020 is consistent with market participants expectations of a negative rate on the ecbs deposit facility for a prolonged period of time
2017-12-28;2017;December;Monetary Policy Decisions;Neutral;0.9756514430046082;the eonia forward curve shifted slightly upwards at short maturities and slightly downwards at longer maturities see chart 6
2017-12-28;2017;December;Monetary Policy Decisions;Neutral;0.9930853843688964;the vertical grey line denotes the start of the review period on 7 september 2017 the latest observation is for 13 december 2017 the euro overnight index average eonia forward curve was broadly unchanged
2017-12-28;2017;December;Monetary Policy Decisions;Neutral;0.9830769896507264;notes the spread is calculated by subtracting the tenyear ois rate from the sovereign yield
2017-12-28;2017;December;Monetary Policy Decisions;Neutral;0.5835155248641968;furthermore the idiosyncratic falls in portugal and italy were largely responsible for the decline in the gdpweighted euro area tenyear sovereign bond yield as shown in chart 4 chart 5 euro area sovereign bond spreads visàvis the ois rate percentages per annum sources thomson reuters and ecb calculations
2017-12-28;2017;December;Monetary Policy Decisions;Negative;0.9822108149528505;in the latter two countries a more favourable assessment of the sovereigns creditworthiness by some of the major rating agencies contributed to the compression in spreads in line with the overall improvement in the euro area macroeconomic environment
2017-12-28;2017;December;Monetary Policy Decisions;Neutral;0.9074239134788512;the declines ranged from 3 basis points in germany to 20 basis points in italy and around 100 basis points in portugal see chart 5
2017-12-28;2017;December;Monetary Policy Decisions;Neutral;0.9236657023429872;notes the vertical grey line denotes the start of the review period on 7 september 2017 the latest observation is for 13 december 2017 sovereign bond spreads visàvis riskfree overnight index swap ois rates fell in a number of euro area countries
2017-12-28;2017;December;Monetary Policy Decisions;Negative;0.9640726447105408;on 7 december investmentgrade nfc bond spreads over the corresponding aaarated euro area average yield curve were on average 16 basis points lower than in early september and around 80 basis points below their levels in march 2016 prior to the announcement of the corporate sector purchase programme
2017-12-28;2017;December;Monetary Policy Decisions;Negative;0.9953593611717224;one possible explanation for the weak inflation in producer prices for nonfood consumer goods despite robust price pressures at the earlier stages of the production and pricing chain is that margins are being squeezed
2017-12-28;2017;December;Monetary Policy Decisions;Neutral;0.9877334833145142;notes eer38 is the nominal effective exchange rate of the euro against the currencies of 38 of the euro areas most important trading partners
2017-12-28;2017;December;Monetary Policy Decisions;Positive;0.989012598991394;real gdp growth is supported by growth in private consumption and investment as well as exports benefitting from the broadbased global recovery
2017-12-28;2017;December;Monetary Policy Decisions;Positive;0.9634724855422974;housing investment increased by 13 in the second quarter of 2017 reflecting a continuation of the recovery in the euro area as a whole and in many individual euro area countries
2017-12-28;2017;December;Monetary Policy Decisions;Positive;0.9914173483848572;the recovery in housing markets is expected to continue to drive growth
2017-12-28;2017;December;Monetary Policy Decisions;Positive;0.9893373250961304;as a consequence consumer confidence is now close to its historical highs signalling strong underlying consumption dynamics in the near term
2017-12-28;2017;December;Monetary Policy Decisions;Positive;0.9839301705360411;consumer confidence rose further in november 2017 as a result of households being more optimistic about their future financial circumstances and the general situation in the euro area
2017-12-28;2017;December;Monetary Policy Decisions;Positive;0.671615719795227;the savings ratio has declined in the last few quarters mainly reflecting both an improvement in households economic and financial situation and the low interest rate environment which is reducing their propensity to save
2017-12-28;2017;December;Monetary Policy Decisions;Positive;0.99199378490448;the ecbs monetary policy measures which have eased financing conditions also remain supportive of household spending
2017-12-28;2017;December;Monetary Policy Decisions;Positive;0.9913088083267212;this growth particularly in durable goods has been underpinned by the recovery in labour market conditions and rising real wages per employee
2017-12-28;2017;December;Monetary Policy Decisions;Negative;0.9901122450828552;private consumption growth slowed slightly in the third quarter of 2017 to 03 quarter on quarter down from 05 in the previous quarter
2017-12-28;2017;December;Monetary Policy Decisions;Positive;0.9905142784118652;improving labour markets continue to support income growth and consumer spending
2017-12-28;2017;December;Monetary Policy Decisions;Neutral;0.9849910140037536;notes the latest observations are for the third quarter of 2017 for employment and hours worked and october 2017 for the unemployment rate
2017-12-28;2017;December;Monetary Policy Decisions;Neutral;0.9681558609008788;chart 11 developments in the euro area labour market lefthand scale index q1 2008  100 righthand scale percentages sources eurostat and ecb calculations
2017-12-28;2017;December;Monetary Policy Decisions;Negative;0.9812009930610656;at the same time there are increasing signs of labour shortages in some countries and sectors
2017-12-28;2017;December;Monetary Policy Decisions;Positive;0.9890223741531372;survey information points to continued improvements in labour market conditions in the period ahead
2017-12-28;2017;December;Monetary Policy Decisions;Positive;0.9911518692970276;all changes are computed using the exchange rates prevailing on 13 december 2017 economic activity the euro area economic expansion continues to be solid and broadbased across countries and sectors
2017-12-28;2017;December;Monetary Policy Decisions;Positive;0.9878202676773072;the number of people who have been unemployed for at least 12 months expressed as a percentage of the labour force has also continued to fall but remains well above its precrisis level
2017-12-28;2017;December;Monetary Policy Decisions;Negative;0.9863761067390442;the decline has been broadbased across age and gender groups
2017-12-28;2017;December;Monetary Policy Decisions;Neutral;0.9247263669967652;1 the unemployment rate in the euro area stood at 88 in october 2017 which is its lowest level since january 2009 see chart 11
2017-12-28;2017;December;Monetary Policy Decisions;Neutral;0.9442965984344482;this is despite both fulltime workers and parttime workers working more hours on average as these increases were offset by the shift in the composition of employment towards a higher proportion of parttime workers
2017-12-28;2017;December;Monetary Policy Decisions;Negative;0.970275580883026;employment currently stands 12 above the precrisis peak recorded in the first quarter of 2008 total hours worked also continued to recover although average hours worked per person employed have remained broadly stable
2017-12-28;2017;December;Monetary Policy Decisions;Positive;0.5616632103919983;employment rose further by 04 quarter on quarter in the third quarter of 2017 resulting in an annual increase of 17
2017-12-28;2017;December;Monetary Policy Decisions;Positive;0.9916662573814392;notes the latest observations are for the third quarter of 2017 euro area labour markets continue to exhibit strong dynamics
2017-12-28;2017;December;Monetary Policy Decisions;Neutral;0.9667536020278932;chart 10 euro area real gdp and its components quarteronquarter percentage changes and quarteronquarter percentage point contributions source eurostat
2017-12-28;2017;December;Monetary Policy Decisions;Positive;0.98640638589859;on the production side activity was broadbased with strong value added growth in industry excluding construction and slightly lower growth in the construction and services sectors
2017-12-28;2017;December;Monetary Policy Decisions;Neutral;0.8259997367858887;the main driver continued to be domestic demand notably fixed investment spending and to a lesser extent net exports and changes in inventories
2017-12-28;2017;December;Monetary Policy Decisions;Positive;0.4963940680027008;real gdp increased by 06 quarter on quarter in the third quarter of 2017 following growth of 07 in the previous quarter see chart 10
2017-12-28;2017;December;Monetary Policy Decisions;Positive;0.9793325662612916;euro area real gdp is foreseen to grow by 24 in 2017 23 in 2018 19 in 2019 and 17 in 2020 the economic expansion in the euro area continues to be buoyant and is broadbased across countries and sectors
2017-12-28;2017;December;Monetary Policy Decisions;Positive;0.4689944386482239;compared with the september 2017 ecb staff macroeconomic projections the december 2017 eurosystem staff macroeconomic projections revised the outlook for gdp growth upwards substantially
2017-12-28;2017;December;Monetary Policy Decisions;Positive;0.9907714128494264;the latest survey results and incoming data confirm robust growth momentum in the near term
2017-12-28;2017;December;Monetary Policy Decisions;Negative;0.9105966091156006;longterm unemployment ie
2017-12-28;2017;December;Monetary Policy Decisions;Neutral;0.9885355830192566;moreover this pattern was not only seen in the average forecasts reported by the spf but also for the large majority of individual forecasters
2017-12-28;2017;December;Monetary Policy Decisions;Neutral;0.9527704119682312;in the world inputoutput database76 the upstream hubs ie
2017-12-28;2017;December;Monetary Policy Decisions;Negative;0.9655578136444092;over the period 201315 these whiskers lie mostly below the zero line which indicates that a large majority of respondents overestimated both wage growth and unemployment
2017-12-28;2017;December;Monetary Policy Decisions;Neutral;0.9854875802993774;inputoutput data can be used in order to gather information on countries valueadded structures63 and can be complemented with trade price data in order to investigate the price and nonprice factors behind the evolution of market shares
2017-12-28;2017;December;Monetary Policy Decisions;Neutral;0.901800811290741;as intermediate inputs cross borders several times within production chains tracing valueadded flows can be crucial for the assessment of the effective contribution of a country to the world market
2017-12-28;2017;December;Monetary Policy Decisions;Neutral;0.8137396574020386;22 global value chains and export market shares with gvc integration gross exports might not gauge a countrys international contribution to trade in terms of value added
2017-12-28;2017;December;Monetary Policy Decisions;Neutral;0.973383903503418;cit ecb and ecb staff calculations
2017-12-28;2017;December;Monetary Policy Decisions;Neutral;0.9710507988929749;chart 3 comparison of vareer ioreer and conventional reer indices index q1 1999  100 sources bems and johnson 2015 op
2017-12-28;2017;December;Monetary Policy Decisions;Neutral;0.9344962239265442;in macroeconomic analysis it would thus be beneficial to look at gvc reers which could provide useful complementary insights into competitiveness developments
2017-12-28;2017;December;Monetary Policy Decisions;Positive;0.9625139832496644;in the case of the euro area countries most affected by the crisis however the evolution of reers see the examples of spain and portugal in chart 3 shows that both the vareer and to a larger extent the ioreer measures point to stronger losses in competitiveness in the years preceding the crisis and correspondingly larger gains in the postcrisis period
2017-12-28;2017;December;Monetary Policy Decisions;Neutral;0.9847685098648072;across euro area countries a comparison of the dynamics of gvc reers with conventional reers delivers broadly consistent messages
2017-12-28;2017;December;Monetary Policy Decisions;Neutral;0.975226640701294;an interesting finding is that the gvc reers show larger changes in price competitiveness for the euro area countries that were most affected by the crisis thus suggesting that they might have been useful in the detection of precrisis country vulnerabilities
2017-12-28;2017;December;Monetary Policy Decisions;Neutral;0.9905300736427308;in a second step the arithmetic average of the absolute values of these percentage deviations is calculated in order to obtain the average absolute percentage deviation
2017-12-28;2017;December;Monetary Policy Decisions;Neutral;0.9908162355422974;in a first step for each of the given countrys trading partners the percentage deviation of its gvcbased trade weight from its conventional trade weight is calculated
2017-12-28;2017;December;Monetary Policy Decisions;Neutral;0.9846889972686768;note the average absolute percentage deviation of gvcbased trade weights from conventional trade weights is calculated as follows for any given country
2017-12-28;2017;December;Monetary Policy Decisions;Neutral;0.973383903503418;cit ecb and ecb staff calculations
2017-12-28;2017;December;Monetary Policy Decisions;Neutral;0.9803709983825684;chart 2 average absolute deviation of vareer and ioreer country weights from conventional trade weights percentages sources bems and johnson 2015 op
2017-12-28;2017;December;Monetary Policy Decisions;Neutral;0.973383903503418;cit ecb and ecb staff calculations
2017-12-28;2017;December;Monetary Policy Decisions;Neutral;0.964914321899414;table 1 coefficient of correlation with gross trade weights vareer and ioreer weights sources bems and johnson 2015 op
2017-12-28;2017;December;Monetary Policy Decisions;Neutral;0.986199140548706;it turns out that in most cases valueadded and inputoutputbased trade weights on average deviate by around 50 from the conventional trade weights and in some cases the average absolute percentage deviation is even higher than 100
2017-12-28;2017;December;Monetary Policy Decisions;Neutral;0.989065408706665;in order to illustrate this chart 2 shows for each country the average of the absolute percentage deviations of its trading partners valueadded and inputoutputbased trade weights from conventional trade weights
2017-12-28;2017;December;Monetary Policy Decisions;Neutral;0.9580572247505188;on first inspection the different weights look highly correlated for the majority of countries with the exception of some small countries lithuania luxembourg and slovakia which have a correlation coefficient below 08 however despite the high degree of correlation absolute differences between gvc weights and conventional trade weights are substantial
