Date;Year;Month;Type;sentiment;sentiment_score;sentence
2017-12-28;2017;December;Monetary Policy Decisions;Neutral;0.9453471899032592;euro area exports contain significantly less labour value added than gross output revealing that exporting firms rely more heavily on imported inputs andor capital chart 10
2017-12-28;2017;December;Monetary Policy Decisions;Positive;0.6736130118370056;81 the overall importance of labour in both euro area output and exports decreased slightly from 1997 to 2011 among the five largest euro area economies germany is characterised by the highest shares of labour value added
2017-12-28;2017;December;Monetary Policy Decisions;Positive;0.5484133362770081;aggregating sectoral data at the country level helps to disentangle the evolution of the labour valueadded contribution for different skill groups within the euro area
2017-12-28;2017;December;Monetary Policy Decisions;Negative;0.9639536142349244;32 the impact of global value chains on labour value added hours worked and compensation between 1997 and 2011 unskilled labours valueadded share in the euro area has substantially declined whereas skilled labours share has increased
2017-12-28;2017;December;Monetary Policy Decisions;Neutral;0.9897629022598268;spillovers are aggregated by using the sectors respective gdp weights in total gdp of the aggregate considered
2017-12-28;2017;December;Monetary Policy Decisions;Neutral;0.9880749583244324;notes in panel b the impact of the sector reported on each other sector i is computed as and the overall impact as  with domestic samecountry effects euro area effects and effects on the rest of the countries in the sample rest of the world being calculated by considering the affected sectors
2017-12-28;2017;December;Monetary Policy Decisions;Neutral;0.8867557048797607;77 overall this analysis suggests that there is significant scope for propagation of sectoral shocks through global supply chains
2017-12-28;2017;December;Monetary Policy Decisions;Neutral;0.9008206725120544;80 chart a spillovers from specific sectors sources wiod 2013 release and ecb calculations
2017-12-28;2017;December;Monetary Policy Decisions;Neutral;0.9824543595314026;obviously the supply chain impact is the greatest in the domestic economy affecting 27 and 30 sectors respectively blue bars but it also affects many other sectors in the euro area yellow bars and even spills over to other countries and involves a total of 236 and 172 sectors respectively red bars
2017-12-28;2017;December;Monetary Policy Decisions;Neutral;0.956141710281372;the car industry in germany and the electronics and optical equipment sector in china illustrate how changes in real value added propagate to other domestic sectors the euro area and the rest of the world chart a
2017-12-28;2017;December;Monetary Policy Decisions;Neutral;0.96746426820755;for example the transport equipment sector ie
2017-12-28;2017;December;Monetary Policy Decisions;Neutral;0.9852140545845032;this exercise identifies spillovers that stem solely from a change in real value added in the affected sectors
2017-12-28;2017;December;Monetary Policy Decisions;Neutral;0.987279176712036;the impact of a change in real value added in any sector can be traced and quantified by using the estimated coefficients from the model
2017-12-28;2017;December;Monetary Policy Decisions;Neutral;0.9860351085662842;this means that the change in activity of a sector is related to the change in activity of both its input providers and its customers
2017-12-28;2017;December;Monetary Policy Decisions;Neutral;0.7293168306350708;the spillover effects are positive and of sizeable magnitude and their significance is not lost when including other determinants of sector is activity employment and capital the countrys activity and global factors agriculture fuel and metal prices and us interest rates
2017-12-28;2017;December;Monetary Policy Decisions;Neutral;0.961770236492157;79 the regressions confirm that upstream and downstream spillovers through supply chains are significant
2017-12-28;2017;December;Monetary Policy Decisions;Neutral;0.9857254028320312;the threshold is endogenously determined by the model and allows the identification of the most important sectors for spillover transmission
2017-12-28;2017;December;Monetary Policy Decisions;Neutral;0.991756558418274;the aggregate is constructed such that only sectors with a weight above a certain level r are included in the average
2017-12-28;2017;December;Monetary Policy Decisions;Neutral;0.9878029227256776;78 the estimation controls for other observed factors determining the activity of sector i  as well as common unobserved time factors in the error term  and are weighted averages of the value added of a selected group of upstream and downstream sectors where  stands for up and down and the weight measures the bilateral importance of the valueadded contribution and is inversely proportional to the bilateral distance
2017-12-28;2017;December;Monetary Policy Decisions;Neutral;0.986112892627716;in the model the change in real value added of sector i is related to its past values and to the previous periods change in value added of a set of direct and indirect upstream and downstream sectors
2017-12-28;2017;December;Monetary Policy Decisions;Neutral;0.9833130240440368;box 2 identification of sectoral spillovers in the global economy prepared by erik frohm and vanessa gunnella to investigate the transmission of shocks through global supply chains a nonlinear panel model is estimated
2017-12-28;2017;December;Monetary Policy Decisions;Neutral;0.6044352650642395;when these and other hub sectors ties to the rest of the value chains are severed spillovers gradually diminish and become statistically insignificant
2017-12-28;2017;December;Monetary Policy Decisions;Neutral;0.975982427597046;euro area countries in particular have been increasingly participating in crossborder production chains stimulated by a harmonised regulatory framework within the european union eu and integration in a common currency area
2017-12-28;2017;December;Monetary Policy Decisions;Neutral;0.9757615923881532;activity spills over via these sectors to many other trading partners
2017-12-28;2017;December;Monetary Policy Decisions;Neutral;0.5406913161277771;as a result production processes have become internationally fragmented trade in intermediate goods and services has substantially increased around 60 of world trade is estimated to be in intermediate goods and the gross value of exports has become much higher than the value added originating in each exporting country
2017-12-28;2017;December;Monetary Policy Decisions;Neutral;0.9865553379058838;section 5 summarises the main themes of the article and concludes with perspectives over the medium and the long term
2017-12-28;2017;December;Monetary Policy Decisions;Neutral;0.9820126295089722;section 4 assesses the potential implications of shale oil for the global supply curve and the equilibrium price based on microlevel evidence
2017-12-28;2017;December;Monetary Policy Decisions;Neutral;0.9753376245498656;box 2 discusses the historical decomposition of the oil price focusing on the period of shale oil production
2017-12-28;2017;December;Monetary Policy Decisions;Neutral;0.9763935208320618;box 1 provides details of the structural var svar model of the global oil market used to assess the relevance of supply and demand factors in which two types of strategies are distinguished depending on whether opec acts to protect its market share the strategic approach or to stabilise oil prices around a target value the accommodative approach
2017-12-28;2017;December;Monetary Policy Decisions;Neutral;0.943290948867798;it is structured as follows sections 2 and 3 review oil price dynamics and market fundamentals both before and during the shale oil age with a particular focus on the market shares of major oil producing countries notably the united states following the revolution set in motion by the shale oil industry
2017-12-28;2017;December;Monetary Policy Decisions;Neutral;0.9840351343154908;this article describes the evolution of the oil market during the shale oil age the shifts in opecs production strategies and the effects of both of these developments on oil prices
2017-12-28;2017;December;Monetary Policy Decisions;Neutral;0.8760823011398315;had opec accepted the fact that in its role as swing supplier it was now competing with shale oil producers
2017-12-28;2017;December;Monetary Policy Decisions;Negative;0.9939711093902588;persistently low prices and producer nations impaired public finances prompted opecs decision in november 2016 to change its policy again and restrain production in an effort to rebalance the oil market which had been swamped with inventory
2017-12-28;2017;December;Monetary Policy Decisions;Negative;0.6861160397529602;in november 2014 production targets were abandoned in an attempt to regain market share this aim was achieved but at the cost of a drop in oil prices of more than half
2017-12-28;2017;December;Monetary Policy Decisions;Neutral;0.4737527966499328;opecs production decisions during the shale oil age  which began around 2011  have been particularly influenced by the evolving supply conditions in the united states
2017-12-28;2017;December;Monetary Policy Decisions;Positive;0.9159952998161316;by this point the us energy information administration us eia had made several positive reassessments of shale oil in terms of both future quantities and life span suggesting that permanent changes were occurring in the global oil market
2017-12-28;2017;December;Monetary Policy Decisions;Positive;0.9243402481079102;however the subsequent inversion of the oil streams in the pipelines and the creation of additional rail capacity in 2014 combined with the repeal of the export ban a year later served to close the gap between us and international oil prices and bring us shale oil into the global arena
2017-12-28;2017;December;Monetary Policy Decisions;Neutral;0.6398755311965942;prices for energy products became cheaper in the united states than in the rest of the world
2017-12-28;2017;December;Monetary Policy Decisions;Neutral;0.9674339294433594;quality differentials for delivery in landlocked stocking points such as the west texas intermediate wti benchmark32 the main benchmark used in the united states were priced at an increasing discount
2017-12-28;2017;December;Monetary Policy Decisions;Negative;0.9854627847671508;both of these factors led to an extraordinary buildup of inventory depressing oil prices within the united states
2017-12-28;2017;December;Monetary Policy Decisions;Negative;0.6398701071739197;in particular the oil streams in the us canadian and mexican pipeline systems were only able to absorb flows from the periphery into the internal us states and exports of us crude oil were banned by a law which had been introduced for national security reasons
2017-12-28;2017;December;Monetary Policy Decisions;Neutral;0.4904731810092926;initially shale oil was essentially a us phenomenon as both technical and legislative issues limited its global impact
2017-12-28;2017;December;Monetary Policy Decisions;Positive;0.8723077774047852;after three decades of steady decline us oil production provided the largest contribution to global supply growth in the period from 2012 to 2014 and today rivals that of saudi arabia and russia in terms of its share of global oil production
2017-12-28;2017;December;Monetary Policy Decisions;Positive;0.895926833152771;the shale oil revolution has attracted significant interest because it marks a historical and unexpected turning point in us energy production trends
2017-12-28;2017;December;Monetary Policy Decisions;Negative;0.6094282269477844;the surge in shale oil production since 2011 is generally considered to have created a structural transformation of the oil market however several questions remain open to what extent has that transformation so far affected the supply and demand factors which drive the oil price and what is its relevance over the longer term
2017-12-28;2017;December;Monetary Policy Decisions;Neutral;0.9852461218833924;understanding the drivers of oil price movements is fundamental to an assessment of their persistence and of the implications for inflation expectations as well as ultimately to the ability to tailor the monetary policy response
2017-12-28;2017;December;Monetary Policy Decisions;Negative;0.9664795994758606;this poses a challenge for projections as oil prices account for most of the prediction errors in inflation rates
2017-12-28;2017;December;Monetary Policy Decisions;Neutral;0.9049249291419984;1 introduction commodities and oil in particular remain the most important source of volatility in consumer price inflation
2017-12-28;2017;December;Monetary Policy Decisions;Positive;0.9739571213722228;however according to their projections and given current extraction technology prices must rise to around usd 6570 per barrel over the medium term if shale oil production is to continue expanding profitably at a robust pace
2017-12-28;2017;December;Monetary Policy Decisions;Neutral;0.9853126406669616;analysts expect oil prices to remain in a range consistent with the production costs of the major marginal producers  currently assessed to be around usd 50 per barrel over the short term
2017-12-28;2017;December;Monetary Policy Decisions;Positive;0.9204020500183104;the prolonged period of oversupply and low oil prices between the end of 2014 and the third quarter of 2016 was a result of the interplay of these factors the partial recovery in prices which occurred in 2017 reflects a gradual rebalancing of the market following the global supply restraint agreed by opec and major nonopec producers
2017-12-28;2017;December;Monetary Policy Decisions;Neutral;0.9394638538360596;shale oil is the key novel factor affecting the structure of the oil market and influencing opecs decisions whether to target price stabilisation or market share
2017-12-28;2017;December;Monetary Policy Decisions;Neutral;0.9231698513031006;2 a narrative of preshale oil price dynamics developments in the oil price in the years preceding the global financial crisis sowed the seeds for the shale oil revolution
2017-12-28;2017;December;Monetary Policy Decisions;Negative;0.7270195484161377;the steep rise in price from usd 23 per barrel in 2003 to an alltime high of usd 145 per barrel on the eve of the global financial crisis was primarily a reflection of surging demand in major emerging economies such as china see charts 1 and 4
2017-12-28;2017;December;Monetary Policy Decisions;Neutral;0.7654393315315247;on the supply side while nonopec producers were struggling to keep up with expanding consumption opecs preference  according to the empirical analysis  was to maintain a relatively tight market and exploit its renewed power to influence market equilibrium see chart 3
2017-12-28;2017;December;Monetary Policy Decisions;Neutral;0.9520658254623412;chart 1 brent and wti crude spot prices since 2000 usd per barrel sources bloomberg datastream and ecb staff calculations
2017-12-28;2017;December;Monetary Policy Decisions;Neutral;0.7297987937927246;40 this model set up rests on the ability to pin down strategic and accommodative opec behaviour in reaction to nonopec supply shocks
2017-12-28;2017;December;Monetary Policy Decisions;Neutral;0.9905601143836976;the key identifying assumptions are sign restrictions imposed on the impact responses of the five variables to the structural shocks no magnitude restriction is added
2017-12-28;2017;December;Monetary Policy Decisions;Neutral;0.965238094329834;the vector c contains the intercepts al is a matrix polynomial in the lag operator and is a vector of reduced form error terms
2017-12-28;2017;December;Monetary Policy Decisions;Neutral;0.9865257740020752;the model contains 24 lags and employs monthly data from february 1973 to april 2017 with the following reduced form representation is a vector of five endogenous variables including 1 the monthly percentage change in opec crude oil production 2 the monthly percentage change in nonopec crude oil production 3 the growth rate of the interpolated global gdp 4 the logreal price of oil brent crude deflated by the us consumer price index and 5 the monthly changes in global oil inventories measured as changes in oecd crude oil stocks and in us crude oil inventories
2017-12-28;2017;December;Monetary Policy Decisions;Neutral;0.8381421566009521;the rapid rise of shale oil production is therefore likely to have brought about changes in opecs production plans39
2017-12-28;2017;December;Monetary Policy Decisions;Neutral;0.9238418936729432;shifts between approaches depend among other factors on the production capacity of competitors
2017-12-28;2017;December;Monetary Policy Decisions;Neutral;0.9863706827163696;38 using the strategic approach opec production follows the same dynamics as that of nonopec producers amplifying the impact of the shock on oil prices whereas using the accommodative approach opec tends to offset nonopec changes in production attenuating oil price fluctuations
2017-12-28;2017;December;Monetary Policy Decisions;Neutral;0.9877695441246032;in the framework of this model opec can decide to protect its market share the strategic approach target a desired oil price level the accommodative approach or adopt any combination of the two
2017-12-28;2017;December;Monetary Policy Decisions;Neutral;0.9879623055458068;by analogy with kilian and murphy a svar model can be used to identify global and speculative demand shocks and specifically to distinguish between two supply shocks  strategic and accommodative  depending on how opec reacts to nonopec production changes
2017-12-28;2017;December;Monetary Policy Decisions;Neutral;0.9216522574424744;in particular kilian and murphy37 show that both current and forwardlooking demand for oil are driven by expectations about future activity that is by speculative demand
2017-12-28;2017;December;Monetary Policy Decisions;Neutral;0.9665004014968872;35 this view persisted in the literature until the end of the second half of 2000 when an increasing consensus identified global demand conditions as the key factor in explaining oil price movements in certain episodes such as in the runup to the 2008 crisis36
2017-12-28;2017;December;Monetary Policy Decisions;Neutral;0.8801109194755554;according to early literature published in the aftermath of the two oil crises of the 1970s supply factors were the major drivers of price and the macroeconomic effects of oil market shocks were unrelated to the nature of the underlying shock
2017-12-28;2017;December;Monetary Policy Decisions;Neutral;0.937667727470398;box 1 a bayesian structural var model incorporating different supply shocks prepared by irma alonso álvarez and virginia di nino this box presents an overview of a structural var svar model of the global oil market used to assess the relevance of supply and demand factors and provides certain insights regarding the debate about which factors dominate oil market dynamics
2017-12-28;2017;December;Monetary Policy Decisions;Neutral;0.9783666729927064;this article investigates the reasons for this delayed reaction and provides an assessment of the relative importance of supply and demand factors in driving oil price developments in the wake of the shale oil revolution
2017-12-28;2017;December;Monetary Policy Decisions;Neutral;0.9709998965263368;chart 4 contribution to annual oil demand growth 20002010 percentage points sources international energy agency iea and ecb staff calculations
2017-12-28;2017;December;Monetary Policy Decisions;Neutral;0.9549344182014464;chart 3 contribution to annual crude oil supply growth 20002010 percentage points lefthand scale usd per barrel righthand scale sources us eia bloomberg and ecb staff calculations
2017-12-28;2017;December;Monetary Policy Decisions;Neutral;0.9877741932868958;however prices rebounded ahead of firming improvements in global economic conditions as a result of a very substantial production cut by opec of almost three million barrels per day that was not fully reversed until 2012 it can be seen that opecs policies are motivated by a series of macro and micro factors as market conditions change box 1 details a possible empirical framework which may be established to partially evaluate these factors
2017-12-28;2017;December;Monetary Policy Decisions;Negative;0.6163573861122131;the decline in annual consumption was particularly severe in the united states and more than offset the growth in demand in some emerging economies
2017-12-28;2017;December;Monetary Policy Decisions;Negative;0.901310920715332;the global financial crisis dramatically reduced economic activity and demand for crude oil and pushed prices below usd 40 per barrel in early 2009 see charts 3 and 4
2017-12-28;2017;December;Monetary Policy Decisions;Negative;0.8258007764816284;the gap between global demand and supply was exacerbated by two major disruptions a drop of 60 in venezuelan oil production34 caused by a protracted strike which took place at the national oil company petróleos de venezuela in late 2002 in an attempt to force the thenpresident to call early elections and the second gulf war in 2003 given the general market conditions opec was able to maintain a relatively tight market balance in order to support high oil prices during this period prior to the global financial crisis see box 1
2017-12-28;2017;December;Monetary Policy Decisions;Negative;0.993886411190033;in particular new lows in prices in the aftermath of the asian financial crisis of 1997 had restrained field investments for years and conventional production which lacked spare capacity was unable to expand and respond to the growing demand from china and other emerging economies
2017-12-28;2017;December;Monetary Policy Decisions;Positive;0.7187778353691101;over the same period 20032007 opec regained influence on the oil market by addressing increasing demand from fastdeveloping emerging economies and stepping in to compensate for significant and protracted disruptions in production
2017-12-28;2017;December;Monetary Policy Decisions;Positive;0.9703131914138794;33 the extraction of oil and natural gas from shale rock formations has had a lasting effect on the us energy mix and markedly reduced the united states dependency on external energy this has in turn helped reduce the perennial us trade deficit
2017-12-28;2017;December;Monetary Policy Decisions;Neutral;0.4041921496391296;the development of shale oil production also benefited from the fact that resources were located in sparsely populated areas and that in the united states land ownership rights include rights to subsurface minerals and environmental regulation is less strict than in for example europe
2017-12-28;2017;December;Monetary Policy Decisions;Positive;0.5906559228897095;mediumsized energy companies generally more financially constrained than the multinationals took advantage of these capital inflows to further develop horizontal drilling and hydraulic fracturing techniques in the united states making shale oil production viable and profitable
2017-12-28;2017;December;Monetary Policy Decisions;Neutral;0.9881040453910828;the latest observations are for 19 october 2017 against this background capital flowed to the shale oil industry to finance investments in research and development
2017-12-28;2017;December;Monetary Policy Decisions;Neutral;0.9777334928512572;note the chart plots the difference spread between brent crude and wti prices
2017-12-28;2017;December;Monetary Policy Decisions;Neutral;0.983746349811554;note the latest observations are for 19 october 2017 chart 2 changes in the price differential between brent crude and wti since 2000 usd per barrel sources bloomberg datastream and ecb staff calculations
2017-12-28;2017;December;Monetary Policy Decisions;Neutral;0.9875948429107666;notes the value for the final month of a year is taken as the value for that year
2017-12-28;2017;December;Monetary Policy Decisions;Negative;0.9322375059127808;however major producers of conventional oil and members of the organization of petroleum exporting countries opec in particular have been slow to adapt their production policies
2017-12-28;2017;December;Monetary Policy Decisions;Positive;0.8137198686599731;articles the oil market in the age of shale oil prepared by irma alonso álvarez and virginia di nino us shale oil production has expanded greatly since 2011 and now rivals that of russia and saudi arabia in terms of market share
2017-12-28;2017;December;Monetary Policy Decisions;Positive;0.9644860625267028;enhancing the functioning of the draft budgetary plan review exercise is important particularly in order to address budgetary imbalances in economically favourable times so as to have more fiscal space in a future cyclical downturn
2017-12-28;2017;December;Monetary Policy Decisions;Neutral;0.9876356720924376;17 this refers to the plans of germany latvia lithuania luxembourg the netherlands and finland all under the sgps preventive arm and is one more than the number of countries whose plans were found to be fully compliant last year
2017-12-28;2017;December;Monetary Policy Decisions;Neutral;0.9832468628883362;based on its 2017 autumn economic forecast the commission finds that only six of the eighteen draft budgetary plans are fully compliant with the sgp
2017-12-28;2017;December;Monetary Policy Decisions;Positive;0.9908706545829772;16 the eurogroup also noted that at the same time the improving economic conditions call for the need to rebuild fiscal buffers while continuing to strengthen the economies growth potential
2017-12-28;2017;December;Monetary Policy Decisions;Neutral;0.666967511177063;15 this is also in keeping with the view that when the output gap is small finetuning of support of the macroeconomy by fiscal policies is not warranted
