Date;Year;Month;Type;sentiment;sentiment_score;sentence
2000-03-21;2000;March;Minute;Positive;0.9865003228187561;retail sales continued to increase rapidly in january and february against the backdrop of strong growth in disposable income and household wealth and elevated consumer confidence
2000-03-21;2000;March;Minute;Positive;0.9906670451164246;the recent strength in orders for many types of equipment pointed to further advances in spending in coming months
2000-03-21;2000;March;Minute;Negative;0.9712597131729126;deliveries of aircraft continued to be held down by the labor strike at boeing
2000-03-21;2000;March;Minute;Positive;0.9806469678878784;shipments of computing and communications equipment surged after the century rollover and shipments of other nonaircraft goods rose moderately
2000-03-21;2000;March;Minute;Positive;0.8680837154388428;business spending on durable equipment and software and on nonresidential structures increased sharply in january
2000-03-21;2000;March;Minute;Negative;0.9943826198577881;sales of existing homes also declined in january continuing a trend that had begun last july but inventories of existing homes for sale evidently were at very low levels
2000-03-21;2000;March;Minute;Positive;0.9918564558029175;residential housing activity remained strong in the first two months of the year
2000-03-21;2000;March;Minute;Negative;0.9685326218605042;the demand for housing associated with continuing gains in jobs and incomes had remained ebullient despite an appreciable increase in mortgage rates
2000-03-21;2000;March;Minute;Positive;0.9563905000686646;total private housing starts in january and february held at the high december level as a surge in starts of multifamily units offset a downturn in starts of singlefamily homes
2000-03-21;2000;March;Minute;Positive;0.9856013655662537;outlays for services rose briskly in january latest data part of the gain resulted from higher spending for heating as temperatures in many parts of the country dropped to more seasonable levels
2000-03-21;2000;March;Minute;Positive;0.9545460343360901;purchases of goods other than motor vehicles picked up substantially further with gains widespread across most major categories
2000-03-21;2000;March;Minute;Positive;0.654017448425293;expenditures for nonresidential structures turned up last autumn and rose rapidly in january
2000-03-21;2000;March;Minute;Positive;0.9886713027954102;sales of light vehicles surged over the januaryfebruary period
2000-03-21;2000;March;Minute;Negative;0.9810266494750977;although sales of new singlefamily homes fell in january latest data the decline followed a december pace that was the highest monthly rate in more than twenty years
2000-03-21;2000;March;Minute;Positive;0.9912249445915222;office and other commercial construction activity was robust while industrial building was little changed
2000-03-21;2000;March;Minute;Positive;0.9801771640777588;consumer prices jumped in february as energy prices surged
2000-03-21;2000;March;Minute;Negative;0.986236035823822;in manufacturing stocks increased moderately further in january however shipments grew by more and the aggregate stockshipments ratio for the sector declined to a new low
2000-03-21;2000;March;Minute;Neutral;0.9908156394958496;however the advance in this earnings measure in the twelve months ended in february was about the same as that in the previous twelvemonth period
2000-03-21;2000;March;Minute;Negative;0.9946087598800659;the continuing strength in manufacturing lifted the factory operating rate further but capacity utilization stayed a little below its longterm average
2000-03-21;2000;March;Minute;Positive;0.9056304097175598;with regard to labor costs average hourly earnings grew at a slightly faster rate in january and february than they had in the fourth quarter of last year
2000-03-21;2000;March;Minute;Neutral;0.9230027198791504;at earlier stages of processing however producer prices registered somewhat larger increases than those for finished goods in both the januaryfebruary period and the twelve months ended in february
2000-03-21;2000;March;Minute;Neutral;0.9388107061386108;at the producer level prices of finished goods other than food and energy changed little in january and february and their rise during the twelve months ended in february was somewhat smaller than the advance during the previous twelvemonth period
2000-03-21;2000;March;Minute;Neutral;0.9885138869285583;moreover the increase in consumer prices of items other than food and energy during the twelve months ended in february was the same as the change during the previous twelvemonth period
2000-03-21;2000;March;Minute;Positive;0.9190720915794373;the pace of accumulation of manufacturing and trade inventories slowed somewhat in january from the elevated rate in the fourth quarter however sales grew briskly and the aggregate inventorysales ratio edged down from an already very low level
2000-03-21;2000;March;Minute;Neutral;0.982279360294342;abstracting from energy prices however consumer price inflation was moderate in january and february
2000-03-21;2000;March;Minute;Positive;0.9901822209358215;economic activity in the developing countries also picked up further with asian countries registering the largest gains
2000-03-21;2000;March;Minute;Negative;0.9157752990722656;the japanese economy was still the notable exception though some favorable signs were evident
2000-03-21;2000;March;Minute;Positive;0.989006519317627;the available information suggested that economic expansion continued to be robust in most foreign industrial economies
2000-03-21;2000;March;Minute;Negative;0.9399270415306091;the drop in exports was concentrated in computers semiconductors aircraft chemicals and consumer goods while the increase in imports was primarily in oil and automotive products
2000-03-21;2000;March;Minute;Negative;0.9608993530273438;the us trade deficit in goods and services climbed to a new high in january with the value of exports retreating from the peak reached in december and the value of imports rising sharply
2000-03-21;2000;March;Minute;Neutral;0.9857237935066223;both wholesale and retail inventories increased in line with sales and inventorysales ratios for these sectors stayed at the bottom of their respective ranges over the past twelve months
2000-03-21;2000;March;Minute;Neutral;0.9796287417411804;price inflation had remained moderate in recent months with the exception of higher energy prices
2000-03-21;2000;March;Minute;Negative;0.9937164187431335;by contrast output of aircraft and parts weakened again
2000-03-21;2000;March;Minute;Neutral;0.9797323942184448;this preference motivated his recommendation to extend temporarily the authority to operate in the broader range of collateral
2000-03-21;2000;March;Minute;Positive;0.9898855686187744;industrial production was up sharply in the early months of the year reflecting large gains in the manufacturing and utilities sectors
2000-03-21;2000;March;Minute;Neutral;0.9608244895935059;at its meeting on february 12 2000 the committee adopted a directive that called for a slight tightening of conditions in reserve markets consistent with an increase of ï½ percentage point in the federal funds rate to an average of about 534 percent
2000-03-21;2000;March;Minute;Neutral;0.9742053151130676;meeting of the federal open market committee held on february 12 2000 were approved
2000-03-21;2000;March;Minute;Neutral;0.984740674495697;the manager of the system open market account reported on recent developments in foreign exchange markets
2000-03-21;2000;March;Minute;Neutral;0.9874088764190674;there were no open market operations in foreign currencies for the systems account in the period since the previous meeting and thus no vote was required of the committee
2000-03-21;2000;March;Minute;Neutral;0.9896412491798401;the manager also reported on developments in domestic financial markets and on system open market transactions in government securities and federal agency obligations during the period february 2 2000 through march 20 2000 by unanimous vote the committee ratified these transactions
2000-03-21;2000;March;Minute;Neutral;0.9858798384666443;at its meeting in august 1999 the committee had voted to expand the collateral that could be accepted in system repurchase transactions and had authorized the use of reverse repurchase agreements
2000-03-21;2000;March;Minute;Neutral;0.9880557060241699;these authorizations were scheduled to expire at the end of april 2000 at this meeting the manager proposed that the authority to use the broader range of collateral be extended until the first meeting in 2001 and that the authority to engage in reverse repurchase agreements be made permanent
2000-03-21;2000;March;Minute;Neutral;0.9888527393341064;the principal effect of the expanded collateral authorized last august together with the use of triparty repurchase agreements was to allow passthrough mortgage securities of gnma fnma and fhlmc and stripped securities of the us treasury and federal government agencies to be taken as collateral for repurchase transactions
2000-03-21;2000;March;Minute;Negative;0.9752377271652222;direct treasury obligations remained the preferred means for meeting the systems needs but anticipated paydowns of marketable federal debt associated with projected budget surpluses were likely to limit the systems ability in the future to continue to add substantially to holdings even on a temporary basis without generating undesirable market repercussions
2000-03-21;2000;March;Minute;Neutral;0.9925360679626465;in this setting the manager recommended that a broadgauge study be undertaken to consider alternative asset classes and selection criteria that could be appropriate for the system open market account soma with particular attention to alternatives to the current reliance on net additions to outright holdings of treasury securities as the sole means of effectuating the upward trend in the asset side of the systems balance sheet
2000-03-21;2000;March;Minute;Neutral;0.9841684699058533;pending the completion of that study and the committees consideration of alternative asset allocations the manager suggested that the desk could rely on temporary operations with relatively long maturities to meet the growth in underlying reserve needs that could not comfortably be met by further outright purchases of treasury securities
2000-03-21;2000;March;Minute;Neutral;0.9701389074325562;in implementing these temporary operations the manager expressed a preference to distribute the systems demand for collateral as broadly as possible in order to minimize the impact on spread relationships in the financing market
2000-03-21;2000;March;Minute;Neutral;0.988401472568512;the required size of the longerterm temporary operations would depend on how much of the permanent reserve need could be met by outright purchases of treasury securities
2000-03-21;2000;March;Minute;Neutral;0.9877219796180725;the manager noted that the desirability of maintaining a liquid bill portfolio suggested that system holdings of any bill issue should be limited to 3540 percent of the outstanding amount
2000-03-21;2000;March;Minute;Neutral;0.990845263004303;with issue sizes declining such limits might mean that from time to time some portion of the systems maturing bill holdings would be redeemed rather than rolled over in treasury auctions
2000-03-21;2000;March;Minute;Neutral;0.9768747091293335;the manager also intended to roll over maturing holdings of treasury coupon issues in auctions and to add to the systems portfolio to meet permanent reserve needs by purchasing coupon securities in the secondary market
2000-03-21;2000;March;Minute;Neutral;0.9895948171615601;however the amount that could be added through outright purchases without disturbing the treasury market would have to be gauged over time relative to conditions in the market as treasury issuance patterns evolved in response to system purchases and treasury buybacks of coupon securities
2000-03-21;2000;March;Minute;Negative;0.9917308688163757;the civilian unemployment rate at 41 percent in february was just above its 1999 low and initial claims for unemployment insurance were at an extremely low level in early march
2000-03-21;2000;March;Minute;Positive;0.9920769929885864;labor demand remained robust in january and february with the average increase in private nonfarm payroll employment over the two months only a little below the strong pace of 1999 job growth in manufacturing and construction was solid while hiring in the services sector slowed appreciably
2000-03-21;2000;March;Minute;Neutral;0.909634530544281;price inflation was still moderate except for the upturn in energy prices in recent months
2000-03-21;2000;March;Minute;Neutral;0.6542955040931702;labor markets continued to be very tight but there were few signs of any acceleration in labor costs
2000-03-21;2000;March;Minute;Positive;0.9900380373001099;although the growth in domestic demand was being met partly through rising imports industrial production and nonfarm payrolls were expanding briskly
2000-03-21;2000;March;Minute;Positive;0.9323261976242065;consumer spending and business fixed investment were still trending upward strongly and housing demand was holding at a high level
2000-03-21;2000;March;Minute;Positive;0.9842924475669861;within manufacturing output of hightech equipment was notably strong but production of motor vehicles and parts also recorded a sizable advance on balance over the januaryfebruary period
2000-03-21;2000;March;Minute;Positive;0.9293777346611023;the information reviewed at this meeting suggested that the expansion of economic activity remained rapid
2000-03-21;2000;March;Minute;Neutral;0.98967045545578;the federal open market committee authorizes and directs the federal reserve bank of new york to the extent necessary to carry out the most recent domestic policy directive adopted at a meeting of the committee c to sell us government securities and securities that are direct obligations of or fully guaranteed as to principal and interest by any agency of the united states to dealers for system open market account under agreements for the resale by dealers of such securities or obligations in 90 calendar days or less at rates that unless otherwise expressly authorized by the committee shall be determined by competitive bidding after applying reasonable limitations on the volume of agreements with individual dealers
2000-03-21;2000;March;Minute;Neutral;0.9868677854537964;the members voted unanimously to adopt on a permanent basis subject to the annual review required for all the committees instruments paragraph 1 c of the authorization for domestic open market operations in the form reproduced below
2000-03-21;2000;March;Minute;Neutral;0.9850637912750244;the manager indicated that he did not expect to use reverse rps on a regular basis until the systems new trading system became operational but in conjunction with existing triparty arrangements there might be occasions in the interim when the timing of open market operations would make it desirable to use them instead of matched salepurchase transactions
2000-03-21;2000;March;Minute;Neutral;0.49539098143577576;such agreements are equivalent to matched salepurchase transactions which the manager has long been authorized to use but reverse rps have the advantage of much greater flexibility because they are the common practice in financial markets
2000-03-21;2000;March;Minute;Neutral;0.9875855445861816;at the conclusion of this discussion the committee voted unanimously to extend the suspension of several provisions of the guidelines for the conduct of system operations in federal agency issues until the first regularly scheduled meeting in 2001 the committee also accepted a proposal by the manager to make permanent the authority to use reverse repurchase agreements in the conduct of open market operations
2000-03-21;2000;March;Minute;Neutral;0.9793917536735535;they noted that the requested temporary expansion of authority pending the committees consideration of the completed study should not be read as indicating in any way how the committee might ultimately choose to allocate the portfolio and any interim operations in the broader range of collateral should be capable of being unwound without adverse market consequences
2000-03-21;2000;March;Minute;Neutral;0.9861527681350708;the committee then turned to a discussion of the economic and financial outlook and the implementation of monetary policy over the intermeeting period ahead
2000-03-21;2000;March;Minute;Neutral;0.9228745102882385;the members agreed that this action was needed to help bring the growth of aggregate demand into better alignment with the expansion of potential aggregate supply and thereby help avert rising inflationary pressures
2000-03-21;2000;March;Minute;Neutral;0.9856363534927368;all the members endorsed the proposal for a study of the issues associated with the systems asset allocation in light of declining treasury debt
2000-03-21;2000;March;Minute;Neutral;0.9267484545707703;open market operations during the intermeeting period were directed toward implementing the desired slightly greater pressure on reserve positions and the federal funds rate averaged very close to the committees 534 percent target
2000-03-21;2000;March;Minute;Negative;0.983991265296936;in the housing sector building activity generally remained at a high level though slipping a bit in some parts of the country and there were only limited indications that the rise in mortgage interest rates was holding down residential construction
2000-03-21;2000;March;Minute;Negative;0.9695745706558228;on the other hand housing and other construction activity reportedly was being retarded by shortages of labor and in some areas of materials as well
2000-03-21;2000;March;Minute;Neutral;0.9643793106079102;on balance recent developments did not augur any significant changes in homebuilding
2000-03-21;2000;March;Minute;Positive;0.9899139404296875;the improved economic outlook for most of the nations important trading partners in association with the fading effects of the dollars earlier appreciation pointed to faster expansion in exports and recent anecdotal reports were broadly consistent with such a development
2000-03-21;2000;March;Minute;Negative;0.6833038926124573;growth in imports was expected to moderate over time though imports currently were still rising rapidly
2000-03-21;2000;March;Minute;Negative;0.9924323558807373;even so prospective developments in the foreign trade sector were not likely to provide much relief to demand pressures on the us economy
2000-03-21;2000;March;Minute;Neutral;0.9784890413284302;with regard to the outlook for inflation members saw little evidence to date of any acceleration in core inflation and unit costs for nonfinancial corporations were unchanged in the fourth quarter
2000-03-21;2000;March;Minute;Negative;0.9942752718925476;despite such welcome developments members expressed concern about indications of a less benign inflation climate
2000-03-21;2000;March;Minute;Negative;0.9524697661399841;the direct and indirect effects of higher fuel prices the rise in other import prices increasing medical costs and some deterioration in surveys of inflation expectations could begin to show through to higher underlying inflation
2000-03-21;2000;March;Minute;Negative;0.9833287000656128;more fundamentally however the members believed that current growth in aggregate demand should it persist would continue to exceed the expansion of potential output and by putting added pressure on already tight labor markets would at some point foster inflationary imbalances that would undermine the economic expansion
2000-03-21;2000;March;Minute;Neutral;0.9863172173500061;in the committees discussion of policy for the intermeeting period ahead all the members endorsed a proposal to tighten reserve conditions by a slight amount consistent with an increase in the federal funds rate to a level of 6 percent
2000-03-21;2000;March;Minute;Positive;0.98919278383255;persisting strength in aggregate domestic demand had been accommodated thus far without a pickup in underlying inflation because of the remarkable acceleration in productivity and because of two safety valvesthe economys ability to draw on the pool of available workers and to finance the rapid growth in imports relative to exports
2000-03-21;2000;March;Minute;Negative;0.9865552186965942;however a further acceleration in productivity was unlikely to boost the economys growth potential sufficiently to satisfy the expansion in aggregate demand without some slowing in the latter
2000-03-21;2000;March;Statement;Neutral;0.9875077605247498;the discount rate is the rate charged depository institutions when they borrow shortterm adjustment credit from their district federal reserve banks
2000-03-21;2000;March;Minute;Neutral;0.8267454504966736;in addition the two safety valves could not be counted on to work indefinitely
2000-03-21;2000;March;Minute;Negative;0.9332939982414246;in these circumstances the members saw substantial risks of rising pressures on labor and other resources and of higher inflation that called for some further firming of monetary policy at this meeting
2000-03-21;2000;March;Minute;Neutral;0.9842442274093628;they agreed though that because a significant acceleration in inflation did not appear to be imminent and because uncertainties continued to surround the economic outlook a gradual approach to policy adjustments was warranted
2000-03-21;2000;March;Minute;Neutral;0.9835995435714722;the members also agreed that the risks remained weighted mainly in the direction of greater inflation pressures and that further tightening actions might be necessary to bring about financial conditions that were sufficiently firm to contain upward pressures on labor costs and prices
2000-03-21;2000;March;Statement;Neutral;0.9438860416412354;against the background of its longrun goals of price stability and sustainable economic growth and of the information currently available the committee believes the risks are weighted mainly toward conditions that may generate heightened inflation pressures in the foreseeable future
2000-03-21;2000;March;Statement;Negative;0.9901566505432129;the committee remains concerned that increases in demand will continue to exceed the growth in potential supply which could foster inflationary imbalances that would undermine the economys record economic expansion
2000-03-21;2000;March;Statement;Neutral;0.9908105134963989;economic conditions and considerations addressed by the committee are essentially the same as when the committee met in february
2000-03-21;2000;March;Statement;Neutral;0.9650769233703613;in a related action the board of governors approved a 25 basis point increase in the discount rate to 512 percent
2000-03-21;2000;March;Statement;Neutral;0.9115561246871948;the federal open market committee voted today to raise its target for the federal funds rate by 25 basis points to 6 percent
2000-03-21;2000;March;Minute;Negative;0.9885069131851196;that risk was underscored by the increased volatility of the stock market
2000-03-21;2000;March;Minute;Neutral;0.9288923144340515;votes for this action
2000-03-21;2000;March;Minute;Neutral;0.8895837068557739;to further its longrun objectives the committee in the immediate future seeks conditions in reserve markets consistent with increasing the federal funds rate to an average of around 6 percent
2000-03-21;2000;March;Minute;Neutral;0.778681755065918;at the conclusion of this discussion the committee voted to authorize and direct the federal reserve bank of new york until it was instructed otherwise to execute transactions in the system account in accordance with the following policy directive the federal open market committee seeks monetary and financial conditions that will foster price stability and promote sustainable growth in output
2000-03-21;2000;March;Minute;Neutral;0.5907711982727051;the members agreed that the press statement to be issued shortly after this meeting should continue to highlight their view that even after todays tightening move the risks would remain tilted toward heightened inflation pressures
2000-03-21;2000;March;Minute;Positive;0.8186636567115784;even after taking account of the lagged effects of the considerable tightening that already had been implemented since mid1999 additional tightening might well be needed to ensure that financial conditions would adjust sufficiently to bring aggregate demand into better balance with potential supply and thereby counter a possible escalation of pressures on labor costs and prices
2000-03-21;2000;March;Minute;Neutral;0.9823869466781616;looking ahead the committee would continue to assess the need for further tightening to contain inflation
2000-03-21;2000;March;Minute;Negative;0.9809864163398743;some members commented that although a more forceful policy move of 50 basis points might be needed at some point measured and predictable policy tightening moves such as the one contemplated today still were desirable in current circumstances which included somewhat unsettled financial markets
2000-03-21;2000;March;Minute;Neutral;0.9667483568191528;the vote also encompassed approval of the sentence below for inclusion in the press statement to be released shortly after the meeting against the background of its longrun goals of price stability and sustainable economic growth and of the information currently available the committee believes the risks are weighted mainly toward conditions that may generate heightened inflation pressures in the foreseeable future
