Date;Year;Month;Type;sentiment;sentiment_score;sentence
2000-03-21;2000;March;Minute;Negative;0.9951452612876892;while the associated capital investments undoubtedly had contributed to the acceleration in productivity some members expressed concern that the historically elevated valuations of many hightech stocks were subject to a sizable market adjustment at some point
2000-03-21;2000;March;Statement;Neutral;0.9855368733406067;in taking the discount rate action the federal reserve board approved requests submitted by the boards of directors of the federal reserve banks of boston new york philadelphia cleveland richmond atlanta chicago st louis minneapolis kansas city and san francisco
2000-03-21;2000;March;Minute;Positive;0.9918780326843262;factors underlying business optimism included robust growth in revenues and profits and the ready availability of both debt and equity financing
2000-03-21;2000;March;Minute;Positive;0.9921442270278931;in addition solid economic expansion abroad was expected to boost the growth of us exports for some period ahead
2000-03-21;2000;March;Minute;Negative;0.9882178902626038;as a result the growth of spending on consumer durables and houses was expected to slow in addition business investment in equipment and software was projected to decelerate following a firstquarter surge that partly reflected information technology expenditures that had been postponed until after the century rollover
2000-03-21;2000;March;Minute;Positive;0.8222009539604187;the expansion of domestic final demand increasingly would be held back by the anticipated waning of positive wealth effects associated with large earlier gains in equity prices and by higher interest rates
2000-03-21;2000;March;Minute;Negative;0.9429079294204712;the staff forecast prepared for this meeting suggested that the economic expansion would moderate gradually from its currently elevated pace to a rate around or perhaps a little below the growth of the economys estimated potential
2000-03-21;2000;March;Minute;Negative;0.942963719367981;the divergence at least until recently in the stock market between the valuations of hightech firms and those of more traditional established firms was inducing a redirection of investment funds to business activities that were perceived to be more productive
2000-03-21;2000;March;Minute;Negative;0.9048357009887695;in addition the surging prices of technologyrelated equities might have spurred depositors to shift some of their m2 balances into equity mutual funds
2000-03-21;2000;March;Minute;Negative;0.6915162801742554;core price inflation was projected to increase somewhat over the forecast horizon partly as a result of rising import prices and some firming of gains in nominal labor compensation in persistently tight labor markets that would not be fully offset by productivity growth
2000-03-21;2000;March;Minute;Negative;0.9910071492195129;the growth of m2 and m3 slowed in february partly reflecting an unwinding of y2k effects and rising opportunity costs of holding liquid balances
2000-03-21;2000;March;Minute;Negative;0.8142548203468323;the dollar rose against the australian dollar british pound canadian dollar and the euro as investors apparently revised down their expectations of the extent of monetary tightening in those countries
2000-03-21;2000;March;Minute;Neutral;0.9864835143089294;in foreign exchange markets the tradeweighted value of the dollar changed little over the intermeeting period against a basket of major currencies
2000-03-21;2000;March;Minute;Neutral;0.939283549785614;most major indexes of equity prices moved up appreciably on net over the intermeeting period
2000-03-21;2000;March;Minute;Negative;0.8702595829963684;on balance over the intermeeting period interest rates on private instruments registered small mixed changes while yields on longerterm treasury securities declined significantly
2000-03-21;2000;March;Minute;Negative;0.9905515909194946;subsequently market rates moved up in response to the receipt of data that signaled persisting strength of the economy but they turned back down in response to new information indicating continued low inflation and to greater volatility in equity prices
2000-03-21;2000;March;Minute;Neutral;0.9393156170845032;the committees action and its announcement that the risks were weighted in the direction of rising inflation were widely anticipated and had little immediate effect on market yields
2000-03-21;2000;March;Minute;Negative;0.9706874489784241;by contrast the dollar declined against the japanese yen and the currencies of a number of other important trading partners notably the mexican peso and the brazilian real
2000-03-21;2000;March;Minute;Positive;0.7917699813842773;in the committees discussion of current and prospective economic developments members commented as they had at earlier meetings that they saw little evidence of any slowing in the rapid expansion of domestic economic activity but they also saw few signs to date of significant acceleration in inflation
2000-03-21;2000;March;Minute;Negative;0.9903007745742798;the growth of total domestic nonfinancial debt slowed early in the year as large federal debt paydowns resumed following the sharp buildup of treasury balances prior to yearend
2000-03-21;2000;March;Minute;Positive;0.9912883043289185;large increases in imports were helping to satisfy the impressive growth in demand
2000-03-21;2000;March;Minute;Neutral;0.6636563539505005;the advance included not only notable strength in the hightech sector but brisk spending in a number of other areas as well
2000-03-21;2000;March;Minute;Positive;0.9911175966262817;the growth in aggregate demand continued to display remarkable vigor evidently driven by high levels of consumer and business confidence and accommodative financial markets
2000-03-21;2000;March;Minute;Positive;0.9564653038978577;after moderating toward the end of 1999 in part because of caution ahead of the century date change business fixed investment again appeared to be expanding at a vigorous pace
2000-03-21;2000;March;Minute;Positive;0.9852356910705566;even so further increases in household incomes along with the lagged wealth effects of the sharp earlier advances in stock market prices seemed likely to sustain relatively strong consumer spending for some period of time
2000-03-21;2000;March;Minute;Negative;0.988555371761322;the members noted that equity prices generally had posted further gains during the intermeeting period but in their view the large increases of recent years were not likely to be repeated and an absence of such gains would have a restraining effect on consumer expenditures over time
2000-03-21;2000;March;Minute;Negative;0.794294536113739;some moderation in such spending to a pace more in line with the growth in household incomes was cited as a reasonable expectation given underlying factors such as the large buildup of durable goods in consumer hands the rise in consumer debt loads and the effects of higher oil prices
2000-03-21;2000;March;Minute;Positive;0.9824559688568115;with regard to developments in key sectors of the economy consumer spending had remained particularly robust thus far this year according to reports from most parts of the nation
2000-03-21;2000;March;Minute;Positive;0.9902865886688232;of key importance was the prospective performance of the stock market whose robust gains in recent years had undoubtedly boosted consumer confidence and spending
2000-03-21;2000;March;Minute;Positive;0.98903489112854;in their comments about economic conditions across the nation members referred to anecdotal and other evidence of widespread strength in business activity which in many areas appeared to be rising appreciably further from already high levels
2000-03-21;2000;March;Minute;Negative;0.9937406182289124;nonetheless given the persistence of rapid growth in aggregate demand beyond growth in aggregate supply and very tight conditions in labor markets the members continued to be concerned about the risks of rising inflation
2000-03-21;2000;March;Minute;Negative;0.6641085147857666;the experience of recent years amply demonstrated however that the extent to which prospective growth in demand might exceed further expansion in the economys potential and the implications for inflation were subject to a wide range of uncertainty as to both degree and timing
2000-03-21;2000;March;Minute;Positive;0.992263674736023;contributing to that continuing imbalance the strengthening of most foreign industrial economies and the diminishing effects of the earlier appreciation of the dollar were likely to boost further foreign demand for us output
2000-03-21;2000;March;Minute;Negative;0.9935061931610107;looking ahead however members reiterated earlier concerns that aggregate demand could continue to grow faster than potential aggregate supply even under optimistic assumptions regarding future productivity gains
2000-03-21;2000;March;Minute;Positive;0.9924023151397705;at the same time aggregate supply also continued to record strong gains amid indications of further acceleration in productivity
2000-03-21;2000;March;Minute;Negative;0.9802029132843018;agriculture continued to be a notable exception though members also reported signs of softening in housing and other construction activity in some areas
