Date;Year;Month;Type;sentiment;sentiment_score;sentence
2011-12-13;2011;December;Minute;Negative;0.9952318072319031;in the leveraged loan market the extension of loans stepped up somewhat in november but remained sluggish relative to its average pace earlier in the year
2011-12-13;2011;December;Minute;Negative;0.8436825275421143;the rate of newly delinquent prime mortgagesthe pace at which mortgages transition from current to delinquentseemed to have slowed but overall delinquency rates on residential mortgages remained elevated
2011-12-13;2011;December;Minute;Negative;0.9937838315963745;indicators of home prices and the credit quality of older mortgage loans remained weak
2011-12-13;2011;December;Minute;Negative;0.9923244714736938;but low mortgage rates appeared to have only modest effects on the rate of mortgage refinancing likely because of tight underwriting standards and low levels of home equity
2011-12-13;2011;December;Minute;Negative;0.9884918928146362;interest rates on residential mortgages were little changed on net over the intermeeting period and remained at historically low levels
2011-12-13;2011;December;Minute;Negative;0.9956106543540955;prices of most types of commercial properties continued to be depressed while both vacancy rates and delinquency rates for commercial properties stayed close to their recent highs
2011-12-13;2011;December;Minute;Negative;0.992073118686676;issuance of commercial mortgagebacked securities cmbs was light amid deteriorating liquidity conditions in the cmbs market
2011-12-13;2011;December;Minute;Neutral;0.540579080581665;consumer credit rose slightly in the third quarter
2011-12-13;2011;December;Minute;Negative;0.9947380423545837;financing conditions for commercial real estate appeared to remain strained over the intermeeting period
2011-12-13;2011;December;Minute;Neutral;0.4391353130340576;nonfinancial commercial paper outstanding and commercial and industrial loans continued to expand at a moderate pace
2011-12-13;2011;December;Minute;Negative;0.9948967099189758;cds spreads for european banks remained elevated as these institutions faced increasingly strained conditions in shortterm funding markets
2011-12-13;2011;December;Minute;Negative;0.5530827045440674;yields on investmentgrade and speculativegrade corporate bonds rose on balance over the period and their spreads over yields on comparablematurity treasury securities were somewhat wider
2011-12-13;2011;December;Minute;Negative;0.994367778301239;in the wake of the bankruptcy of mf global market participants also expressed renewed concerns about securities dealers that rely heavily on shortterm wholesale funding markets particularly those institutions not affiliated with commercial banking institutions
2011-12-13;2011;December;Minute;Negative;0.9618605375289917;while the sp 500 index ended the period slightly higher on net equity prices for most major us banking firms were lower and their cds spreads widened
2011-12-13;2011;December;Minute;Negative;0.9662445783615112;credit default swap cds spreads and equity prices of large us banking organizations remained volatile over the intermeeting period
2011-12-13;2011;December;Minute;Negative;0.9818741083145142;dealers also noted that demand for funding all types of securities decreased over the same reference period
2011-12-13;2011;December;Minute;Negative;0.9458397030830383;in the december 2011 senior credit officer opinion survey on dealer financing terms dealers reported a moderate tightening of credit terms over the preceding three months on securities financing transactions and overthecounter derivatives markets trades particularly for financial counterparties
2011-12-13;2011;December;Minute;Positive;0.8972439169883728;by contrast in secured funding markets spreads on assetbacked commercial paper were relatively steady for us and most europeanbased issuers and rates on repurchase agreements across various types of collateral were stable
2011-12-13;2011;December;Minute;Neutral;0.9875491857528687;in dollar funding markets the spread of the threemonth london interbank offered rate libor over the overnight index swap ois rate of the same maturity widened noticeably during the intermeeting period
2011-12-13;2011;December;Minute;Negative;0.9843644499778748;some european financial institutions reportedly faced significant pressures in unsecured dollar funding markets
2011-12-13;2011;December;Minute;Neutral;0.9849967956542969;the aggregate volume of credit card solicitations in recent months remained at levels comparable to those before the financial crisis in 2008 though the volume sent to lowincome households was still well below the levels at that time
2011-12-13;2011;December;Minute;Positive;0.924296498298645;the debt of nonfinancial firms increased in november with corporate bond issuance particularly robust as some firms reportedly were eager to issue bonds before yearend
2011-12-13;2011;December;Minute;Positive;0.9907920360565186;meanwhile consumer credit quality improved further in recent months with delinquency rates on credit card loans declining nearly to historical lows and delinquency rates on nonrevolving credit at commercial banks retreating to precrisis levels
2011-12-13;2011;December;Minute;Positive;0.9927753210067749;nonetheless the staff continued to project that the pace of economic activity would pick up gradually in 2012 and 2013 supported by accommodative monetary policy further increases in credit availability and improvements in consumer and business sentiment
2011-12-13;2011;December;Minute;Positive;0.9921912550926208;m2 expanded at a solid pace in november likely reflecting increased demand for safe and liquid assets given concerns over european financial developments
2011-12-13;2011;December;Minute;Negative;0.992350161075592;following the six major central banks currency swap announcement some measures of shortterm funding costs moderated but they remained elevated
2011-12-13;2011;December;Minute;Neutral;0.9478506445884705;over the forecast period the gains in real gdp were anticipated to be sufficient to reduce the slack in product and labor markets only slowly and the unemployment rate was expected to remain elevated at the end of 2013 the staffs projection for inflation was little changed from the forecast prepared for the november fomc meeting
2011-12-13;2011;December;Minute;Negative;0.9235084652900696;however the mediumterm projection for real gdp growth in the december forecast was lower than the one presented in november primarily reflecting revisions to the staffs view regarding developments in europe and their implications for the us economy
2011-12-13;2011;December;Minute;Neutral;0.7321781516075134;staff economic outlook in the economic forecast prepared for the december fomc meeting the staffs projection for the increase in real gdp in the near term was little changed as the recent data on spending production and the labor market were on balance in line with the staffs expectations at the time of the previous forecast
2011-12-13;2011;December;Minute;Neutral;0.9503478407859802;as a precautionary measure the bank of england announced a new liquidity facility that will auction term sterling funds against a wide range of collateral
2011-12-13;2011;December;Minute;Neutral;0.9887987971305847;the ecb reduced its minimum bid rate by 25 basis points at both its november and december meetings relaxed its collateral and reserve requirements and stated that it would begin to offer threeyear funds at fixed rates
2011-12-13;2011;December;Minute;Neutral;0.9901691675186157;chinas central bank cut its reserve requirements by 50 basis points and the central bank of brazil lowered its policy rate by the same amount
2011-12-13;2011;December;Minute;Negative;0.9710656404495239;with inflationary pressures waning and the downside risks to the global economic outlook increasing some central banks eased policy
2011-12-13;2011;December;Minute;Neutral;0.9855132699012756;the foreign exchange value of the dollar appreciated on balance over the intermeeting period
2011-12-13;2011;December;Minute;Neutral;0.9550440907478333;equity prices in both advanced and emerging market economies fluctuated widely with advanced country equities little changed on net and emerging market equities ending the period lower
2011-12-13;2011;December;Minute;Neutral;0.9354549646377563;issuance of consumer credit assetbacked securities increased substantially in november
2011-12-13;2011;December;Minute;Negative;0.9895297884941101;several european banks announced large declines in thirdquarter profits in part reflecting writedowns of their holdings of greek sovereign debt
2011-12-13;2011;December;Minute;Negative;0.8785044550895691;euro funding pressures also moved higher over the period with euro liborois spreads continuing to rise
2011-12-13;2011;December;Minute;Neutral;0.5049630403518677;against the background of higher dollar funding costs in the market and the reduction in the charge on dollar liquidity swaps demand at the tender by the european central bank ecb of threemonth dollar liquidity in december jumped to more than 50 billion from less than 500 million at the november auction
2011-12-13;2011;December;Minute;Neutral;0.9876354336738586;implied basis spreads from the foreign exchange swap market rose substantially over november but reversed a portion of that increase immediately following the central banks swap announcement
2011-12-13;2011;December;Minute;Positive;0.9367226362228394;german sovereign yields increased as well
2011-12-13;2011;December;Minute;Positive;0.9305496215820312;spreads of yields on most peripheral euroarea countries debt over yields on german debt ended the period higher on net
2011-12-13;2011;December;Minute;Negative;0.9918633699417114;but these spreads subsequently narrowed in anticipation of the european union eu summit meeting on december 9 and in reaction to the swap announcement by the federal reserve and the other central banks on november 30 near the end of the period sovereign spreads widened again amid market participants apparent concerns that the actions announced at the eu summit would prove to be less effective than they previously had anticipated
2011-12-13;2011;December;Minute;Neutral;0.44997313618659973;over most of november yields on many euroarea sovereign bondsincluding those of italy spain belgium and francealong with yields on debt issued by the european financial stability facility rose sharply relative to the yield on german government bonds
2011-12-13;2011;December;Minute;Negative;0.968900203704834;although currency increased at a robust pace reserve balances declined by more reflecting a temporary decrease in the size of the soma as a result of lags in the settlement of mbs reinvestment transactions
2011-12-13;2011;December;Minute;Negative;0.9828636050224304;in contrast the monetary base declined in november
2011-12-13;2011;December;Minute;Neutral;0.9794973134994507;in part offshore deposits which are no longer excluded from the federal deposit insurance corporation assessment base appeared to be shifting to onshore offices
2011-12-13;2011;December;Minute;Neutral;0.9796691536903381;in addition maturities for repurchase agreements involving sovereign bonds of euroarea countries other than germany reportedly shortened
2011-12-13;2011;December;Minute;Negative;0.9950488209724426;early in the intermeeting period conditions in shortterm wholesale funding markets appeared to deteriorate somewhat
2011-12-13;2011;December;Minute;Positive;0.9917683601379395;conditions in the labor market seemed to have improved somewhat while overall consumer price inflation continued to be more modest than earlier in the year and measures of longrun inflation expectations remained stable
2011-12-13;2011;December;Minute;Neutral;0.9862970113754272;yields on currentcoupon agency mbs also ended the period about unchanged
2011-12-13;2011;December;Minute;Negative;0.9948422312736511;real business spending for nonresidential construction moved up in october but was still at a low level reflecting high vacancy rates and restricted credit conditions for construction loans
2011-12-13;2011;December;Minute;Negative;0.9725605249404907;also survey measures of business conditions and sentiment remained at relatively downbeat levels in november
2011-12-13;2011;December;Minute;Negative;0.9947358965873718;nominal orders and shipments of nondefense capital goods excluding aircraft edged down in october and the slowing accumulation of unfilled orders suggested that increases in outlays for business equipment would be muted in subsequent months
2011-12-13;2011;December;Minute;Negative;0.9934765696525574;real business spending on equipment and software seemed to be decelerating
2011-12-13;2011;December;Minute;Negative;0.9960682392120361;sales of new and existing homes remained slow in recent months and home prices moved down further
2011-12-13;2011;December;Minute;Negative;0.988386332988739;starts and permits for new singlefamily homes in october stayed around the low levels that prevailed since the middle of last year
2011-12-13;2011;December;Minute;Negative;0.9938272833824158;activity in the housing market continued to be depressed by the substantial inventory of foreclosed and distressed properties and by weak demand that reflected tight credit conditions for mortgage loans and uncertainty about future home prices
2011-12-13;2011;December;Minute;Negative;0.9946005344390869;but consumer sentiment was still at a subdued level in early december despite some improvement in recent months
2011-12-13;2011;December;Minute;Positive;0.9839449524879456;in november nominal retail sales excluding purchases at motor vehicle and parts outlets expanded further and sales of light motor vehicles stepped up
2011-12-13;2011;December;Minute;Positive;0.9920672178268433;nonetheless overall real personal consumption expenditures pce rose modestly in october following significant gains in the previous month as spending for consumer goods continued to increase at a strong pace while outlays for consumer services were roughly flat
2011-12-13;2011;December;Minute;Neutral;0.9907999634742737;inventories in most industries looked to be reasonably well aligned with sales although motor vehicle stocks continued to be lean
2011-12-13;2011;December;Minute;Negative;0.9872443079948425;revised estimates indicated that households real disposable income declined in the second and third quarters and the net wealth of households decreased in the third quarter
2011-12-13;2011;December;Minute;Positive;0.972910463809967;factory output outside of the motor vehicle sector also continued to rise and the rate of manufacturing capacity utilization moved up
2011-12-13;2011;December;Minute;Positive;0.9922472238540649;industrial production rose in october reflecting in part a rebound in motor vehicle production from the effects of supply chain disruptions earlier in the year
2011-12-13;2011;December;Minute;Negative;0.9765219688415527;initial claims for unemployment insurance moved down on net since early november but were still at a level consistent with only modest employment gains and indicators of job openings and businesses hiring plans were little changed
2011-12-13;2011;December;Minute;Negative;0.9934298396110535;nevertheless employment at state and local governments declined further and both longduration unemployment and the share of workers employed part time for economic reasons remained elevated
2011-12-13;2011;December;Minute;Negative;0.9537920951843262;the unemployment rate dropped to 86 percent in november and private nonfarm employment continued to increase moderately during the past two months
2011-12-13;2011;December;Minute;Negative;0.9798277616500854;the upward pressure on consumer prices from the increases in commodity and import prices earlier in the year was expected to continue to subside in the current quarter
2011-12-13;2011;December;Minute;Positive;0.7844374775886536;staff review of the economic situation the information reviewed at the december 13 meeting indicated that us economic activity expanded moderately despite some apparent slowing in the growth of foreign economies and strains in global financial markets
2011-12-13;2011;December;Minute;Neutral;0.976382315158844;there were no intervention operations in foreign currencies for the systems account over the intermeeting period
2011-12-13;2011;December;Minute;Neutral;0.9851465821266174;by unanimous vote the committee ratified the desks domestic transactions over the intermeeting period
2011-12-13;2011;December;Minute;Neutral;0.9596999883651733;developments in financial markets and the federal reserves balance sheet the manager of the system open market account soma reported on developments in domestic and foreign financial markets during the period since the federal open market committee fomc met on november 12 2011 he also reported on system open market operations including the ongoing reinvestment into agencyguaranteed mortgagebacked securities mbs of principal payments received on soma holdings of agency debt and agencyguaranteed mbs as well as the operations related to the maturity extension program authorized at the september 2021 fomc meeting
2011-12-13;2011;December;Minute;Negative;0.8827371597290039;however motor vehicle assemblies were scheduled to only edge higher on balance in the coming months and broader indicators of manufacturing activity such as the diffusion indexes of new orders from the national and regional manufacturing surveys were at levels that suggested only modest increases in production in the near term
2011-12-13;2011;December;Minute;Negative;0.9339536428451538;in the government sector real federal defense purchases appeared to have stepped down in october and november from their level in the third quarter
2011-12-13;2011;December;Minute;Negative;0.9787834882736206;at the state and local level real purchases seemed to be decreasing at a slower pace in recent months than earlier in the year
2011-12-13;2011;December;Minute;Negative;0.9845297336578369;the us international trade deficit narrowed in october as imports decreased more than exports
2011-12-13;2011;December;Minute;Positive;0.8309195637702942;both shortterm nominal treasury yields and the expected path of the federal funds rate implied by money market futures quotes were essentially unchanged on balance over the intermeeting period while longerdated treasury yields ended the period slightly higher
2011-12-13;2011;December;Minute;Positive;0.9884032607078552;over the following weeks movements in yields were reportedly driven by shifts in investors assessments of the european situation and by us economic data that were somewhat stronger than they expected
2011-12-13;2011;December;Minute;Neutral;0.9846416115760803;yields on nominal treasury securities were little changed following the release of the november fomc statement
2011-12-13;2011;December;Minute;Negative;0.988701581954956;nevertheless investors appeared to remain cautious
2011-12-13;2011;December;Minute;Positive;0.9762015342712402;investor concerns about developments in europe intensified early in the period but subsequently eased a bit amid signs that european authorities were moving toward agreement on a comprehensive framework to address fiscal and financial vulnerabilities and after the federal reserve and five other major central banks announced enhanced currency swap arrangements including lower charges on existing dollar liquidity swap lines
2011-12-13;2011;December;Minute;Negative;0.9702275991439819;staff review of the financial situation the risks associated with the fiscal and financial difficulties in europe remained the focus of attention in financial markets over the intermeeting period and contributed to heightened volatility in a wide range of asset markets
2011-12-13;2011;December;Minute;Negative;0.9743490815162659;among emerging market economies real gdp in brazil was flat in the third quarter while exports from china slowed in recent months although chinese domestic demand appeared to remain strong
2011-12-13;2011;December;Minute;Negative;0.9918485879898071;in other advanced foreign economies real gdp in japan rebounded in the third quarter from the effects of the earthquake in march and real gdp recovered in canada as oil production picked up after several months of shutdowns however available indicators of manufacturing activity in both of these economies pointed to declines during the fourth quarter
2011-12-13;2011;December;Minute;Negative;0.994083821773529;measures of business and consumer confidence in the euro area continued to decline in recent months
2011-12-13;2011;December;Minute;Negative;0.9936878085136414;moreover industrial production in the region fell sharply in september and indicators of manufacturing activity in october and november pointed to lower output
2011-12-13;2011;December;Minute;Negative;0.9857434630393982;real gross domestic product gdp in the euro area barely edged up in the third quarter
2011-12-13;2011;December;Minute;Negative;0.9943076968193054;foreign economic growth especially in the euro area appeared to weaken in recent months
2011-12-13;2011;December;Minute;Positive;0.5744356513023376;unit labor costs edged up over the past four quarters
2011-12-13;2011;December;Minute;Negative;0.980442464351654;compensation per hour in the nonfarm business sector increased moderately over the year ending in the third quarter while the 12month change in average hourly earnings for all employees remained low in october and november
2011-12-13;2011;December;Minute;Negative;0.9853111505508423;measures of labor compensation indicated that nominal wage gains continued to be subdued
2011-12-13;2011;December;Minute;Positive;0.9741044044494629;nearterm inflation expectations from the thomson reutersuniversity of michigan surveys of consumers declined in early december and longerterm inflation expectations remained stable
2011-12-13;2011;December;Minute;Negative;0.9244881868362427;consumer prices excluding food and energy also continued to rise at a more modest pace in october than earlier in the year
2011-12-13;2011;December;Minute;Negative;0.9845046997070312;increases in consumer food prices in october were substantially slower than the average pace in the preceding months of this year
2011-12-13;2011;December;Minute;Negative;0.9883484244346619;consumer prices for energy decreased and survey data indicated that gasoline prices declined further in november
2011-12-13;2011;December;Minute;Negative;0.9550556540489197;indeed the pce price index edged down in october
2011-12-13;2011;December;Minute;Negative;0.9887505173683167;inflation continued to decrease relative to earlier in the year
2011-12-13;2011;December;Minute;Positive;0.6618559956550598;reductions in exports of industrial supplies and consumer goods led by a few particularly volatile components outweighed the gains in capital goods
2011-12-13;2011;December;Minute;Negative;0.5847253799438477;declines in imports of petroleum products reflecting lower prices and lesser volumes nonoil industrial supplies and automotive products more than offset increases in capital goods consumer goods and food
2011-12-13;2011;December;Minute;Neutral;0.9927298426628113;indicators of inflation expectations derived from nominal and inflationprotected treasury securities posted mixed changes on net over the period and remained at the low end of their recent ranges
2011-12-13;2011;December;Minute;Neutral;0.3829311728477478;with longrun inflation expectations stable and substantial slack in labor and product markets anticipated to persist over the forecast period the staff continued to project that inflation would be subdued in 2012 and 2013 participants views on current conditions and the economic outlook in their discussion of the economic situation and outlook meeting participants agreed that the information received since their previous meeting indicated that economic activity was expanding at a moderate rate notwithstanding some apparent slowing in global economic growth
2011-12-13;2011;December;Minute;Negative;0.9166446924209595;market reaction to the announcements by fannie mae and freddie mac on november 15 regarding the expansion of the home affordable refinance program was limited
2011-12-13;2011;December;Minute;Negative;0.9863407611846924;labor market conditions improved some in recent months but the unemployment rate remained elevated despite a noticeable drop in november
2011-12-13;2011;December;Minute;Positive;0.8787809014320374;inflation has moderated since earlier in the year and longerterm inflation expectations have remained stable
2011-12-13;2011;December;Minute;Negative;0.9958677291870117;household spending has continued to advance but business fixed investment appears to be increasing less rapidly and the housing sector remains depressed
2011-12-13;2011;December;Minute;Negative;0.9916953444480896;while indicators point to some improvement in overall labor market conditions the unemployment rate remains elevated
2011-12-13;2011;December;Minute;Positive;0.9774600267410278;the vote encompassed approval of the statement below to be released at 215 pm information received since the federal open market committee met in november suggests that the economy has been expanding moderately notwithstanding some apparent slowing in global growth
2011-12-13;2011;December;Minute;Neutral;0.9879816174507141;the system open market account manager and the secretary will keep the committee informed of ongoing developments regarding the systems balance sheet that could affect the attainment over time of the committees objectives of maximum employment and price stability
2011-12-13;2011;December;Minute;Neutral;0.9904356002807617;the committee directs the desk to engage in dollar roll transactions as necessary to facilitate settlement of the federal reserves agency mbs transactions
