Date;Year;Month;Type;sentiment;sentiment_score;sentence
2011-11-02;2011;November;Minute;Neutral;0.9750074148178101;on balance since the september fomc meeting treasury yields on shorterdated securities and the expected path of the federal funds rate implied by money market futures quotes were not much changed
2011-11-02;2011;November;Minute;Negative;0.5972065329551697;yields on investment and speculativegrade corporate bonds edged lower on net over the period leaving their spreads to treasury securities slightly narrower
2011-11-02;2011;November;Minute;Negative;0.9952911138534546;gross public equity issuance by nonfinancial firms continued to be very weak in september and october with a large number of firms shelving planned initial public offerings amid the volatility in equity markets
2011-11-02;2011;November;Minute;Positive;0.9830907583236694;earnings reports for nonfinancial firms generally came in somewhat better than investors expected and about in line with secondquarter levels
2011-11-02;2011;November;Minute;Neutral;0.9827378392219543;credit flows for nonfinancial firms were mixed in september and october
2011-11-02;2011;November;Minute;Negative;0.9952446818351746;european bank cds spreads remained elevated and these institutions continued to face somewhat strained conditions in shortterm bank funding markets
2011-11-02;2011;November;Minute;Neutral;0.9543191194534302;on net equity prices for us banking firms were not much changed over the period since the last fomc meeting while their cds spreads were a bit higher
2011-11-02;2011;November;Minute;Positive;0.9538633227348328;thirdquarter us bank earnings reports generally met investors expectations
2011-11-02;2011;November;Minute;Neutral;0.8145032525062561;investor sentiment toward these financial institutions was strongly influenced by changes in investors assessments of the risks associated with the european fiscal and banking problems and the exposure of various financial institutions to europe
2011-11-02;2011;November;Minute;Negative;0.928451418876648;credit default swap cds spreads and equity prices of large us banking organizations were again volatile over the period
2011-11-02;2011;November;Minute;Neutral;0.9943841695785522;measures of nearterm inflation compensation derived from nominal and inflationprotected treasury securities rose slightly over the intermeeting period while similar measures of longerterm inflation compensation were about unchanged
2011-11-02;2011;November;Minute;Neutral;0.9630686044692993;yields on treasury securities with maturities beyond 10 years moved down
2011-11-02;2011;November;Minute;Neutral;0.9698780179023743;although equity markets were volatile broad us equity price indexes ended the intermeeting period little changed
2011-11-02;2011;November;Minute;Positive;0.7756269574165344;investor sentiment was strongly influenced by prospects for europe as market participants remained highly attuned to developments regarding possible steps to contain the fiscal and banking problems there
2011-11-02;2011;November;Minute;Negative;0.9773707389831543;yields on currentcoupon agency mbs also moved lower on the announcement that the federal reserve would begin to reinvest principal payments on agency securities in agency mbs
2011-11-02;2011;November;Minute;Negative;0.9880955219268799;in addition the announcement that the federal reserve would lengthen the average maturity of its portfolio by purchasing longerterm treasury securities and selling an equivalent amount of shorterterm treasury securities reportedly contributed to the decline in longerterm yields on the day
2011-11-02;2011;November;Minute;Negative;0.9910408854484558;investors reportedly viewed the committees assessment of the economic outlook as more downbeat than anticipated
2011-11-02;2011;November;Minute;Negative;0.9767433404922485;longerterm treasury yields declined appreciably following the release of the september fomc statement
2011-11-02;2011;November;Minute;Positive;0.9876222014427185;economic data releases that were on balance somewhat better than market participants expected provided some support to financial markets
2011-11-02;2011;November;Minute;Negative;0.5197242498397827;staff review of the financial situation financial markets were quite volatile over the period since the september fomc meeting
2011-11-02;2011;November;Minute;Neutral;0.9894573092460632;foreign inflation remained contained although the reversal of earlier increases in energy prices appeared to be passing through to consumer price inflation relatively slowly in some countries
2011-11-02;2011;November;Minute;Positive;0.9847256541252136;elsewhere indicators were somewhat more upbeat with employment in canada continuing to rise through september while gdp growth in china over the year ending in the third quarter was a little less than in the first half of the year but still quite robust
2011-11-02;2011;November;Minute;Negative;0.9939513206481934;however recent data pointed to considerable weakness in the euroarea economy
2011-11-02;2011;November;Minute;Positive;0.8052718043327332;foreign economic activity appeared to have largely recovered from the effects of the japanese disaster in march as production in japan rebounded and supply disruptions waned
2011-11-02;2011;November;Minute;Neutral;0.9796993136405945;similarly the 12month change in average hourly earnings for all employees remained subdued in september
2011-11-02;2011;November;Minute;Negative;0.9372729659080505;the employment cost index increased at a modest rate over the year ending in the third quarter and compensation per hour in the nonfarm business sector appeared to have decalerated somewhat last quarter
2011-11-02;2011;November;Minute;Positive;0.9909237027168274;over the following weeks movements in yields were driven by shifts in investors assessments of the ongoing efforts to address the european fiscal and banking situation and by somewhat strongerthanexpected us economic data
2011-11-02;2011;November;Minute;Negative;0.9790596961975098;the pace of bond financing by investmentgrade nonfinancial corporations slowed some in october from its robust september pace while bond issuance by speculativegrade firms was limited
2011-11-02;2011;November;Minute;Positive;0.9872073531150818;commercial and industrial ci loans accelerated following the already strong increases seen over the first half of the year
2011-11-02;2011;November;Minute;Negative;0.9919354915618896;in the leveraged loan market issuance financed by institutional investors slowed significantly in the third quarter
2011-11-02;2011;November;Minute;Neutral;0.9790880680084229;benchmark sovereign yields increased over the period but spreads of yields on 10year sovereign bonds of the most vulnerable euroarea countries over yields on german bunds were little changed on net
2011-11-02;2011;November;Minute;Negative;0.9880425930023193;measures of labor compensation showed that wage increases continued to be subdued
2011-11-02;2011;November;Minute;Negative;0.9886037111282349;for most of the period market participants seemed heartened by european leaders efforts to address the fiscal and financial challenges present in the euro area although the news late in the period on a possible greek referendum sent stock prices down sharply
2011-11-02;2011;November;Minute;Positive;0.9863916635513306;after falling sharply in august and early september foreign equity prices rose with stocks in the euro area outperforming those in most other economies
2011-11-02;2011;November;Minute;Negative;0.9950639605522156;foreign financial markets remained volatile over the intermeeting period and funding pressures for many european financial institutions continued
2011-11-02;2011;November;Minute;Positive;0.9765204787254333;the monetary base also grew moderately as its major componentsreserve balances and currencyincreased over the period
2011-11-02;2011;November;Minute;Negative;0.5303912162780762;some of the factors that contributed to m2 growth over the summer such as concerns about european financial developments and equity market volatility persisted and supported elevated levels of m2 deposits but did not trigger additional sizable inflows
2011-11-02;2011;November;Minute;Negative;0.9944297671318054;m2 grew at a modest pace in september and october well below the rapid rate seen in july and august
2011-11-02;2011;November;Minute;Neutral;0.7836271524429321;demand for loans reportedly was little changed on balance over the third quarter
2011-11-02;2011;November;Minute;Neutral;0.7928512692451477;in particular domestic banks reported little change in their standards on ci loans over the third quarter on net compared with more widespread reports of easing in the previous several quarters
2011-11-02;2011;November;Minute;Negative;0.9269027709960938;the october senior loan officer opinion survey on bank lending practices showed less net easing of lending standards by domestic banks than in the past few surveys
2011-11-02;2011;November;Minute;Positive;0.9668566584587097;closedend residential mortgage loans held by banks also increased amid the modest pickup in refinancing activity while cre loans contracted
2011-11-02;2011;November;Minute;Negative;0.9713647365570068;consumer loans on banks books advanced modestly in the third quarter ending a twoyear string of quarterly declines
2011-11-02;2011;November;Minute;Neutral;0.9132184386253357;that growth was concentrated among large domestic banks and noneuropean foreign institutions
2011-11-02;2011;November;Minute;Positive;0.8875439167022705;core commercial bank loans expanded slightly in the third quarter
2011-11-02;2011;November;Minute;Positive;0.7126454710960388;delinquency rates for several categories of consumer loans remained low a reflection in part of tighter underwriting standards that shifted the composition of borrowers toward those with stronger credit histories
2011-11-02;2011;November;Minute;Neutral;0.6978760361671448;issuance of consumer credit assetbacked securities continued at a moderate pace through midoctober
2011-11-02;2011;November;Minute;Positive;0.9907519817352295;growth in nonrevolving credit which had been volatile due to a shift in the timing of student loan originations stepped down from the pace seen earlier in the year but remained solid in recent months
2011-11-02;2011;November;Minute;Negative;0.983521580696106;consumer credit decreased in august
2011-11-02;2011;November;Minute;Negative;0.9952548742294312;the pace at which performing prime mortgages became newly delinquent rose over the summer but remained below last years levels
2011-11-02;2011;November;Minute;Negative;0.9929054975509644;indicators of home prices remained weak reflecting a large inventory of unsold properties and modest demand for homes
2011-11-02;2011;November;Minute;Neutral;0.6045870184898376;however in october the federal housing finance agency announced changes to the home affordable refinance program to expand eligibility and takeup among borrowers with mortgages backed by fannie mae and freddie mac
2011-11-02;2011;November;Minute;Negative;0.995037853717804;the recent low rates appeared to have only a modest effect on the pace of mortgage refinancing as tight underwriting standards and low home equity continued to limit the access of many households to the mortgage market
2011-11-02;2011;November;Minute;Negative;0.9935883283615112;interest rates on residential mortgages changed little on net over the intermeeting period but remained at historically low levels
2011-11-02;2011;November;Minute;Negative;0.995050847530365;prices of most types of commercial properties remained depressed and aggregate vacancy and delinquency rates for commercial properties were close to their recent highs
2011-11-02;2011;November;Minute;Negative;0.9852811694145203;issuance of commercial mortgagebacked securities cmbs slowed further in the third quarter amid widening cmbs spreads and only a small number of deals were in the pipeline for the rest of the year
2011-11-02;2011;November;Minute;Negative;0.9929742813110352;financing conditions for commercial real estate cre markets appeared to have deteriorated in some respects
2011-11-02;2011;November;Minute;Positive;0.9880574941635132;nonfinancial commercial paper outstanding posted solid growth in october
2011-11-02;2011;November;Minute;Positive;0.6517477035522461;nearterm inflation expectations from the thomson reutersuniversity of michigan surveys of consumers in october continued to be well below the elevated level seen in the spring and longerterm inflation expectations in the survey remained stable
2011-11-02;2011;November;Minute;Neutral;0.9704294800758362;in light of the significant challenges associated with the adoption of such frameworks participants agreed that it would not be advisable to make such a change under present circumstances
2011-11-02;2011;November;Minute;Neutral;0.8196061253547668;overall us consumer price inflation as measured by the pce price index was more moderate in the third quarter than in the first half of the year
2011-11-02;2011;November;Minute;Neutral;0.6608906984329224;in addition some participants noted that such an approach would involve substantial operational hurdles including the difficulty of specifying an appropriate target level
2011-11-02;2011;November;Minute;Positive;0.45357537269592285;several participants observed that the efficacy of nominal gdp targeting depended crucially on some strong assumptions including the premise that the committee could make a credible commitment to maintaining such a strategy over a long time horizon and that policymakers would continue adhering to that strategy even in the face of a significant increase in inflation
2011-11-02;2011;November;Minute;Negative;0.9933484196662903;more broadly a number of participants expressed concern that switching to a new policy framework could heighten uncertainty about future monetary policy risk unmooring longerterm inflation expectations or fail to address risks to financial stability
2011-11-02;2011;November;Minute;Neutral;0.9675619006156921;other simulations suggested that the singleminded pursuit of a pricelevel target would not be very effective in fostering maximum sustainable employment it was noted however that pricelevel targeting where the central bank maintained flexibility to stabilize economic activity over the short term could generate economic outcomes that would be more consistent with the dual mandate
2011-11-02;2011;November;Minute;Positive;0.9912028312683105;the staff presented model simulations that suggested that nominal gdp targeting could in principle be helpful in promoting a stronger economic recovery in a context of longerrun price stability
2011-11-02;2011;November;Minute;Neutral;0.9936485886573792;the committee also considered policy strategies that would involve the use of an intermediate target such as nominal gross domestic product gdp or the price level
2011-11-02;2011;November;Minute;Neutral;0.988663375377655;one participant pointed to those uncertainties as instead supporting the use of thresholds as a way of managing potential inflation risks associated with additional accommodation
2011-11-02;2011;November;Minute;Negative;0.9925422668457031;moreover others suggested that such an approach could be problematic in light of significant uncertainties about the longerrun normal rate of unemployment
2011-11-02;2011;November;Minute;Negative;0.6286216378211975;however several participants noted that such thresholds could be confusing in the absence of a clear expression of the committees longerterm goals
2011-11-02;2011;November;Minute;Neutral;0.898444652557373;in this vein a number of participants expressed support for the possibility of clarifying the conditionality of the committees forward guidance about the trajectory of the federal funds rate through setting numerical thresholds for unemployment and inflation that would warrant exceptionally low levels for the policy rate
2011-11-02;2011;November;Minute;Neutral;0.9900986552238464;given the potential pitfalls of pursuing commitment strategies extending far out into the future many participants thought that the committee should consider policies intended to accrue some of the gains from conditional commitments and to perform well in a wide range of alternative scenarios
2011-11-02;2011;November;Minute;Neutral;0.9175494909286499;indeed one participant suggested that additional purchases of longerterm securities would be a clearer and more effective way to provide additional monetary accommodation when the federal funds rate was near its lower bound
2011-11-02;2011;November;Minute;Negative;0.9856536984443665;however many pointed out that the implementation of such a strategy could pose substantial communication challenges and that the benefits would be diminished if the strategy was not fully credible
2011-11-02;2011;November;Minute;Neutral;0.9597740173339844;some participants noted that conditional commitments might be particularly helpful in providing additional accommodation and mitigating downside risks when the policy rate is close to its effective lower bound because a central bank can commit to a shallower interest rate trajectory than investors would expect if policymakers followed a purely discretionary approach
2011-11-02;2011;November;Minute;Positive;0.9279600977897644;as noted in the staff briefing economic theory and model simulations suggested that a policy strategy involving such commitments could foster better macroeconomic outcomes than a discretionary approach of reoptimizing policy at every meeting so long as the public understood the central banks strategy and believed that policymakers would follow through on those commitments
2011-11-02;2011;November;Minute;Neutral;0.9915425777435303;committee participants shared their views regarding the potential merits and pitfalls of making conditional commitments regarding the future course of monetary policy
2011-11-02;2011;November;Minute;Neutral;0.9933170080184937;the chairman asked the subcommittee on communications to give consideration to a possible statement of the committees longerrun goals and policy strategy and he also encouraged the subcommittee to explore potential approaches for incorporating information about participants assessments of appropriate monetary policy into the summary of economic projections
2011-11-02;2011;November;Minute;Neutral;0.9920836687088013;more broadly a majority of participants agreed that it could be beneficial to formulate and publish a statement that would elucidate the committees policy approach and participants generally expressed interest in providing additional information to the public about the likely future path of the target federal funds rate
2011-11-02;2011;November;Minute;Neutral;0.9590824842453003;many participants pointed to the merits of specifying an explicit longerrun inflation goal but it was noted that such a step could be misperceived as placing greater weight on price stability than on maximum employment consequently some suggested that a numerical inflation goal would need to be set forth within a context that clearly underscored the committees commitment to fostering both parts of its dual mandate
2011-11-02;2011;November;Minute;Neutral;0.9886626601219177;it was noted that many central banks around the world pursue an explicit inflation objective maintain flexibility to stabilize economic activity and seek to communicate their forecasts and policy plans as clearly as possible
2011-11-02;2011;November;Minute;Neutral;0.9880164265632629;no decision was made at this meeting to change the committees policy strategy or communications
2011-11-02;2011;November;Minute;Neutral;0.9832426905632019;monetary policy strategies and communication the staff gave a presentation on alternative monetary policy strategies and meeting participants discussed those alternatives as well as potential approaches for enhancing the clarity of their public communications
2011-11-02;2011;November;Minute;Neutral;0.976382315158844;there were no intervention operations in foreign currencies for the systems account over the intermeeting period
2011-11-02;2011;November;Minute;Neutral;0.9851465821266174;by unanimous vote the committee ratified the desks domestic transactions over the intermeeting period
2011-11-02;2011;November;Minute;Neutral;0.985765278339386;the manager reported on system open market operations including the ongoing reinvestment into agencyguaranteed mortgagebacked securities mbs of principal payments received on soma holdings of agency debt and agencyguaranteed mbs as well as the operations related to the maturity extension program authorized at the september 2021 fomc meeting
2011-11-02;2011;November;Minute;Neutral;0.9816680550575256;developments in financial markets and the federal reserves balance sheet the manager of the system open market account soma reported on developments in domestic and foreign markets during the period since the federal open market committee fomc met on september 2021 2011 he also discussed the developments in connection with the bankruptcy filing of mf global holdings ltd and its finance subsidiary mf global finance usa inc and with the termination of mf global inc as a primary dealer
2011-11-02;2011;November;Minute;Neutral;0.8174458146095276;some reversal of safehaven flows in october reportedly led the dollar to give back most of the gains it registered in late september leaving the broad nominal foreign exchange value of the dollar little changed on balance relative to its level at the time of the september fomc meeting
2011-11-02;2011;November;Minute;Positive;0.989280641078949;staff review of the economic situation the information reviewed at the november 12 meeting indicated that the pace of economic activity strengthened somewhat in the third quarter reflecting in part a reversal of the temporary factors that weighed on economic growth in the first half of the year
2011-11-02;2011;November;Minute;Negative;0.9897114038467407;consumer prices for food and energy increased last quarter at a slower pace than earlier in the year and consumer prices excluding food and energy rose a bit less than in the preceding quarter
2011-11-02;2011;November;Minute;Negative;0.9942740797996521;however labor market conditions continued to be weak
2011-11-02;2011;November;Minute;Negative;0.44895321130752563;inflation for other goods and services also appeared to have moderated and measures of longerrun inflation expectations remained stable
2011-11-02;2011;November;Minute;Positive;0.59144127368927;as a result net exports were estimated to have made a small positive contribution to real gdp growth in the third quarter a contribution of about the same size as in the second quarter
2011-11-02;2011;November;Minute;Positive;0.9913293123245239;the advance release of the thirdquarter data for the national income and product accounts showed real exports of goods and services expanding faster than real imports
2011-11-02;2011;November;Minute;Negative;0.8832026720046997;the dip in imports was the result of lower purchases of capital goods automotive products and consumer goods which outweighed an increase in petroleum imports
2011-11-02;2011;November;Minute;Negative;0.9823926091194153;the decrease in exports reflected lower sales of automotive products and capital goods which more than offset increases in exports of industrial supplies and consumer goods
2011-11-02;2011;November;Minute;Negative;0.49508801102638245;the us international trade deficit was virtually the same in august as it was in july as both exports and imports moved down only by small amounts
2011-11-02;2011;November;Minute;Negative;0.9704556465148926;at the state and local level real purchases declined in the third quarter at a noticeably slower rate than in the first half of the year as the pace of reductions in payrolls eased and construction spending rose slightly
2011-11-02;2011;November;Minute;Positive;0.8186430931091309;real federal purchases increased in the third quarter as defense expenditures continued to rise from unusually low levels early in the year more than offsetting a decrease in nondefense spending
2011-11-02;2011;November;Minute;Neutral;0.889384388923645;in the third quarter businesses increased their inventories at a much slower pace than in the second quarter and inventorytosales ratios in most industries appeared to be in a comfortable range
2011-11-02;2011;November;Minute;Negative;0.9934991598129272;real business expenditures for nonresidential construction also rose appreciably in the third quarter but spending was still at a relatively low level and continued to be held back by elevated vacancy rates and tight credit conditions for construction loans
2011-11-02;2011;November;Minute;Negative;0.9895184636116028;nevertheless survey measures of business conditions and sentiment in october suggested that firms remained cautious
2011-11-02;2011;November;Minute;Positive;0.9743947386741638;moreover new orders for nondefense capital goods continued to run ahead of shipments in august and september the buildup of unfilled orders pointed toward further increases in spending for business equipment in subsequent months
2011-11-02;2011;November;Minute;Neutral;0.8500468134880066;real business purchases of equipment and software expanded appreciably in the third quarter
2011-11-02;2011;November;Minute;Negative;0.9957120418548584;sales of new and existing homes continued to be soft in recent months and home prices trended lower
2011-11-02;2011;November;Minute;Negative;0.9946568012237549;although starts and permits for new singlefamily homes edged up in september they stayed near the depressed levels seen since the middle of last year
