Date;Year;Month;Type;sentiment;sentiment_score;sentence
2011-11-02;2011;November;Minute;Negative;0.9947524070739746;housing market activity remained very weak held down by the large overhang of foreclosed and distressed properties along with limited demand in an environment of uncertainty about future home prices and tight underwriting standards for mortgage loans
2011-11-02;2011;November;Minute;Negative;0.9952777624130249;moreover consumer sentiment continued to be downbeat in october
2011-11-02;2011;November;Minute;Negative;0.9647725820541382;however real disposable income declined in the third quarter as increases in consumer prices more than offset small gains in nominal income
2011-11-02;2011;November;Minute;Positive;0.7975558042526245;motor vehicle purchases increased significantly in september to a level well above that in the spring when availability of some models was limited by supply chain disruptions and sales of new light motor vehicles stepped up further in october
2011-11-02;2011;November;Minute;Positive;0.9773653745651245;real personal consumption expenditures pce rose briskly in september but posted a more moderate gain for the third quarter as a whole
2011-11-02;2011;November;Minute;Neutral;0.8551188111305237;motor vehicle assemblies were scheduled to rise further in the fourth quarter but broader indicators of nearterm manufacturing activity such as the diffusion indexes of new orders from the national and regional manufacturing surveys remained at levels consistent with only modest increases in production in the coming months
2011-11-02;2011;November;Minute;Negative;0.9950931072235107;output in the motor vehiclerelated sectors continued to step up following the disruptions associated with the earthquake in japan earlier in the year but the pace of factory production outside of those sectors was sluggish
2011-11-02;2011;November;Minute;Positive;0.9120339155197144;industrial production rose modestly in september and the manufacturing capacity utilization rate edged up
2011-11-02;2011;November;Minute;Negative;0.9851698279380798;initial claims for unemployment insurance have edged down since the middle of september but have remained at a level consistent with only modest employment growth and most indicators of businesses hiring plans have showed no improvement
2011-11-02;2011;November;Minute;Negative;0.9916572570800781;the unemployment rate held at 91 percent in september and both longduration unemployment and the share of workers employed part time for economic reasons were still high
2011-11-02;2011;November;Minute;Negative;0.9945783615112305;meanwhile employment in the state and local government sector continued to trend lower
2011-11-02;2011;November;Minute;Negative;0.9649989008903503;nonetheless the pace of privatesector job gains in the third quarter as a whole was less than it was in the first half of the year
2011-11-02;2011;November;Minute;Positive;0.9079130291938782;private nonfarm employment rose modestly in september boosted in part by the return of communications workers who were on strike in august
2011-11-02;2011;November;Minute;Negative;0.9897679686546326;overall consumer price inflation was more moderate than earlier in the year as prices of energy and some commodities declined from their recent peaks
2011-11-02;2011;November;Minute;Neutral;0.9623393416404724;at the end of october japanese officials intervened in foreign exchange markets through sales of yen
2011-11-02;2011;November;Minute;Negative;0.9908255934715271;those included persistent weakness in the labor and housing markets stilltight credit conditions for many households and small businesses low consumer and business confidence fiscal consolidation at all levels of government and elevated volatility in financial markets
2011-11-02;2011;November;Minute;Neutral;0.9666628241539001;korea and japan announced that they would increase the size and scope of their bilateral currency swap arrangements expanding the size of their existing wonyen swap arrangement and establishing a 30 billion facility in which dollars could be swapped for either won or yen
2011-11-02;2011;November;Minute;Negative;0.9952161312103271;business investment in equipment and software has continued to expand but investment in nonresidential structures is still weak and the housing sector remains depressed
2011-11-02;2011;November;Minute;Positive;0.9061412215232849;household spending has increased at a somewhat faster pace in recent months
2011-11-02;2011;November;Minute;Negative;0.9945064187049866;nonetheless recent indicators point to continuing weakness in overall labor market conditions and the unemployment rate remains elevated
2011-11-02;2011;November;Minute;Positive;0.9889591932296753;the vote encompassed approval of the statement below to be released at 1230 pm information received since the federal open market committee met in september indicates that economic growth strengthened somewhat in the third quarter reflecting in part a reversal of the temporary factors that had weighed on growth earlier in the year
2011-11-02;2011;November;Minute;Neutral;0.9879816174507141;the system open market account manager and the secretary will keep the committee informed of ongoing developments regarding the systems balance sheet that could affect the attainment over time of the committees objectives of maximum employment and price stability
2011-11-02;2011;November;Minute;Neutral;0.9904356002807617;the committee directs the desk to engage in dollar roll transactions as necessary to facilitate settlement of the federal reserves agency mbs transactions
2011-11-02;2011;November;Minute;Neutral;0.9877525568008423;the committee also directs the desk to maintain its existing policies of rolling over maturing treasury securities into new issues and of reinvesting principal payments on all agency debt and agency mortgagebacked securities in the system open market account in agency mortgagebacked securities in order to maintain the total face value of domestic securities at approximately 26 trillion
2011-11-02;2011;November;Minute;Neutral;0.991280734539032;the committee directs the desk to continue the maturity extension program it began in september to purchase by the end of june 2012 treasury securities with remaining maturities of approximately 6 years to 30 years with a total face value of 400 billion and to sell treasury securities with remaining maturities of 3 years or less with a total face value of 400 billion
2011-11-02;2011;November;Minute;Neutral;0.9889217615127563;to further its longrun objectives the committee seeks conditions in reserve markets consistent with federal funds trading in a range from 0 to 14 percent
2011-11-02;2011;November;Minute;Neutral;0.7765012383460999;at the conclusion of the discussion the committee voted to authorize and direct the federal reserve bank of new york until it was instructed otherwise to execute transactions in the system account in accordance with the following domestic policy directive the federal open market committee seeks monetary and financial conditions that will foster price stability and promote sustainable growth in output
2011-11-02;2011;November;Minute;Neutral;0.9946144223213196;with respect to the statement to be released following the meeting members agreed that only relatively small changes were needed to reflect the modest improvement in the economic outlook and to note that the committee would continue to implement its policy steps from recent meetings
2011-11-02;2011;November;Minute;Positive;0.8626419305801392;the committee reiterated that it will regularly review the size and composition of its securities holdings and that it is prepared to adjust those holdings as appropriate to promote a stronger economic recovery in the context of price stability
2011-11-02;2011;November;Minute;Neutral;0.9927046895027161;with the committee in the process of reviewing its monetary policy strategies and communication and no additional accommodation being provided at this meeting a few members indicated that they could support the committees decision even though they had not favored recent policy actions
2011-11-02;2011;November;Minute;Negative;0.8715634942054749;one member dissented from the policy decision on the grounds that additional monetary policy accommodation was warranted at this time
2011-11-02;2011;November;Minute;Neutral;0.9944222569465637;however it was noted that any such accommodation would likely be more effective if it were provided in the context of a future communications initiative and most of these members agreed that they could support retention of the current policy stance at this meeting
2011-11-02;2011;November;Minute;Neutral;0.9595509171485901;a few members indicated that they believed the economic outlook might warrant additional policy accommodation
2011-11-02;2011;November;Minute;Neutral;0.9823933839797974;however members generally preferred to retain the existing forward guidance at least for now
2011-11-02;2011;November;Minute;Neutral;0.988304615020752;a few members expressed interest in using language specifying a period of time during which the federal funds rate was expected to remain exceptionally low rather than a calendar date arguing that such language might be better to indicate a constant stance of monetary policy over time
2011-11-02;2011;November;Minute;Negative;0.980776846408844;in addition the committee agreed to keep the target range for the federal funds rate at 0 to 14 percent and to reiterate its expectation that economic conditionsincluding low rates of resource utilization and a subdued outlook for inflation over the medium runare likely to warrant exceptionally low levels for the federal funds rate at least through mid2013
2011-11-02;2011;November;Minute;Neutral;0.9915270209312439;the committee decided to maintain its existing policy of reinvesting principal payments from its holdings of agency debt and agency mbs in agency mbs and of rolling over maturing treasury securities at auction
2011-11-02;2011;November;Minute;Neutral;0.9871684312820435;accordingly in the discussion of monetary policy for the period ahead all committee members agreed to continue the program of extending the average maturity of the federal reserves holdings of securities as announced in september
2011-11-02;2011;November;Minute;Neutral;0.9239413738250732;members generally anticipated that unemployment would decline only gradually from levels significantly above those that the committee would expect to prevail in the longer run with inflation likely to settle at levels at or below those consistent with the committees dual mandate
2011-11-02;2011;November;Minute;Negative;0.9939160943031311;however overall labor market conditions remained weak
2011-11-02;2011;November;Minute;Positive;0.9907475709915161;committee policy action members noted that information received over the intermeeting period pointed to somewhat stronger economic growth in the third quarter partly reflecting a reversal of temporary factors that had depressed economic growth in the first half of the year
2011-11-02;2011;November;Minute;Neutral;0.9694017171859741;it was noted that us inflation had been influenced relatively more by commodity price fluctuations in recent years because commodity prices reflect global economic conditions us inflation might be less affected by domestic factors and more linked to the global outlook than in the past
2011-11-02;2011;November;Minute;Negative;0.9554770588874817;other participants instead saw inflation risks as tilted to the downside in light of their expectations for persistent resource slack
2011-11-02;2011;November;Minute;Positive;0.7174436450004578;a few participants felt that the continuation of the current stance of monetary policy coupled with the possibility of a rebound in energy and commodity prices posed some upside risks to inflation
2011-11-02;2011;November;Minute;Negative;0.9933388829231262;inflation appears to have moderated since earlier in the year as prices of energy and some commodities have declined from their peaks
2011-11-02;2011;November;Minute;Neutral;0.9841071367263794;a number of participants saw the risks to the outlook for inflation as roughly balanced
2011-11-02;2011;November;Minute;Positive;0.9655691385269165;longerterm inflation expectations have remained stable
2011-11-02;2011;November;Minute;Negative;0.972937285900116;the committee continues to expect a moderate pace of economic growth over coming quarters and consequently anticipates that the unemployment rate will decline only gradually toward levels that the committee judges to be consistent with its dual mandate
2011-11-02;2011;November;Statement;Neutral;0.9628652334213257;voting against the action was charles l evans who supported additional policy accommodation at this time
2011-11-02;2011;November;Statement;Neutral;0.9639257192611694;voting for the fomc monetary policy action were ben s bernanke chairman william c dudley vice chairman elizabeth a duke richard w fisher narayana kocherlakota charles i plosser sarah bloom raskin daniel k tarullo and janet l yellen
2011-11-02;2011;November;Statement;Positive;0.9811782240867615;the committee will continue to assess the economic outlook in light of incoming information and is prepared to employ its tools to promote a stronger economic recovery in a context of price stability
2011-11-02;2011;November;Statement;Negative;0.9875297546386719;the committee also decided to keep the target range for the federal funds rate at 0 to 14 percent and currently anticipates that economic conditionsincluding low rates of resource utilization and a subdued outlook for inflation over the medium runare likely to warrant exceptionally low levels for the federal funds rate at least through mid2013
2011-11-02;2011;November;Statement;Neutral;0.9859819412231445;the committee will regularly review the size and composition of its securities holdings and is prepared to adjust those holdings as appropriate
2011-11-02;2011;November;Statement;Neutral;0.9881928563117981;the committee is maintaining its existing policies of reinvesting principal payments from its holdings of agency debt and agency mortgagebacked securities in agency mortgagebacked securities and of rolling over maturing treasury securities at auction
2011-11-02;2011;November;Statement;Neutral;0.9544665813446045;to support a stronger economic recovery and to help ensure that inflation over time is at levels consistent with the dual mandate the committee decided today to continue its program to extend the average maturity of its holdings of securities as announced in september
2011-11-02;2011;November;Statement;Neutral;0.9857256412506104;however the committee will continue to pay close attention to the evolution of inflation and inflation expectations
2011-11-02;2011;November;Statement;Neutral;0.9778512120246887;the committee also anticipates that inflation will settle over coming quarters at levels at or below those consistent with the committees dual mandate as the effects of past energy and other commodity price increases dissipate further
2011-11-02;2011;November;Statement;Negative;0.9893577694892883;moreover there are significant downside risks to the economic outlook including strains in global financial markets
2011-11-02;2011;November;Statement;Negative;0.972937285900116;the committee continues to expect a moderate pace of economic growth over coming quarters and consequently anticipates that the unemployment rate will decline only gradually toward levels that the committee judges to be consistent with its dual mandate
2011-11-02;2011;November;Statement;Neutral;0.8732967972755432;consistent with its statutory mandate the committee seeks to foster maximum employment and price stability
2011-11-02;2011;November;Statement;Positive;0.9655691385269165;longerterm inflation expectations have remained stable
2011-11-02;2011;November;Minute;Neutral;0.9741557240486145;the first round of the threemonth us dollar auctions that major foreign central banks announced on september 15 was held in october demand was quite limited and only the european central bank ecb drew on its swap line with the federal reserve
2011-11-02;2011;November;Statement;Negative;0.9952161312103271;business investment in equipment and software has continued to expand but investment in nonresidential structures is still weak and the housing sector remains depressed
2011-11-02;2011;November;Statement;Positive;0.9061412215232849;household spending has increased at a somewhat faster pace in recent months
2011-11-02;2011;November;Statement;Negative;0.9945064187049866;nonetheless recent indicators point to continuing weakness in overall labor market conditions and the unemployment rate remains elevated
2011-11-02;2011;November;Statement;Positive;0.9905757904052734;information received since the federal open market committee met in september indicates that economic growth strengthened somewhat in the third quarter reflecting in part a reversal of the temporary factors that had weighed on growth earlier in the year
2011-11-02;2011;November;Minute;Neutral;0.882091224193573;voting for this
2011-11-02;2011;November;Minute;Positive;0.9811782240867615;the committee will continue to assess the economic outlook in light of incoming information and is prepared to employ its tools to promote a stronger economic recovery in a context of price stability
2011-11-02;2011;November;Minute;Negative;0.9875297546386719;the committee also decided to keep the target range for the federal funds rate at 0 to 14 percent and currently anticipates that economic conditionsincluding low rates of resource utilization and a subdued outlook for inflation over the medium runare likely to warrant exceptionally low levels for the federal funds rate at least through mid2013
2011-11-02;2011;November;Minute;Neutral;0.9859819412231445;the committee will regularly review the size and composition of its securities holdings and is prepared to adjust those holdings as appropriate
2011-11-02;2011;November;Minute;Neutral;0.9881928563117981;the committee is maintaining its existing policies of reinvesting principal payments from its holdings of agency debt and agency mortgagebacked securities in agency mortgagebacked securities and of rolling over maturing treasury securities at auction
2011-11-02;2011;November;Minute;Neutral;0.9544665813446045;to support a stronger economic recovery and to help ensure that inflation over time is at levels consistent with the dual mandate the committee decided today to continue its program to extend the average maturity of its holdings of securities as announced in september
2011-11-02;2011;November;Minute;Neutral;0.9857256412506104;however the committee will continue to pay close attention to the evolution of inflation and inflation expectations
2011-11-02;2011;November;Minute;Neutral;0.9778512120246887;the committee also anticipates that inflation will settle over coming quarters at levels at or below those consistent with the committees dual mandate as the effects of past energy and other commodity price increases dissipate further
2011-11-02;2011;November;Minute;Negative;0.9893577694892883;moreover there are significant downside risks to the economic outlook including strains in global financial markets
2011-11-02;2011;November;Minute;Neutral;0.8732967972755432;consistent with its statutory mandate the committee seeks to foster maximum employment and price stability
2011-11-02;2011;November;Minute;Negative;0.9910750389099121;they pointed to the further dissipation of the effects of earlier increases in the prices of energy and some commodities the significant slack in resource utilization the continued subdued growth in labor compensation and wellanchored inflation expectations as factors likely to contribute to the moderation in inflation over time
2011-11-02;2011;November;Statement;Negative;0.9933388829231262;inflation appears to have moderated since earlier in the year as prices of energy and some commodities have declined from their peaks
2011-11-02;2011;November;Minute;Positive;0.9053404927253723;a few participants however mentioned the possibility that economic growth could be more rapid than currently expected particularly if gains in output and employment led to a virtuous cycle of improvements in household balance sheets increased confidence and easier credit conditions
2011-11-02;2011;November;Minute;Positive;0.9819703102111816;a few participants noted that recent government initiatives aimed at helping highloantovalue borrowers refinance could be useful steps toward stabilizing the housing market
2011-11-02;2011;November;Minute;Negative;0.9945436716079712;the housing sector continued to be depressed and some meeting participants indicated that the elevated supply of available homes and the overhang of foreclosures together with limited access to mortgage credit were continuing to put downward pressure on house prices and housing construction
2011-11-02;2011;November;Minute;Negative;0.995403528213501;in addition households appeared to remain pessimistic about the prospects for their future income the job market was still weak consumer confidence was historically very low and credit conditions for many households were still tight
2011-11-02;2011;November;Minute;Negative;0.9917661547660828;others noted that the recent pickup in consumer spending outpaced growth in aftertax incomes and was accompanied by a decline in the saving rate raising doubts about its sustainability unless income growth picked up
2011-11-02;2011;November;Minute;Negative;0.9561794400215149;some participants thought that the effects of balance sheet deleveraging might be running their course or that such effects could be less powerful than had been thought
2011-11-02;2011;November;Minute;Positive;0.9924243688583374;in the household sector incoming data on retail sales were somewhat stronger than expected and participants reported scattered optimism among their contacts regarding the prospects for holiday spending
2011-11-02;2011;November;Minute;Negative;0.9909794330596924;with longerterm inflation expectations remaining stable the effects of earlier increases in the prices of energy and other commodities continuing to wane and low levels of resource utilization restraining increases in prices and wages most participants anticipated that inflation would settle over coming quarters at or below levels they judged to be most consistent with their dual mandate
2011-11-02;2011;November;Minute;Negative;0.9906110167503357;moreover the recovery was still subject to significant downside risks including strains in global financial markets
2011-11-02;2011;November;Minute;Negative;0.9880790114402771;while they believed that the economic recovery would continue to be supported by accommodative monetary policy ongoing improvements in households and businesses financial positions and pentup demand for goods and services a number of factors were seen as likely to continue to restrain the pace of economic growth
2011-11-02;2011;November;Minute;Negative;0.9230703115463257;nonetheless most participants anticipated that the pace of economic growth would remain moderate over coming quarters
2011-11-02;2011;November;Minute;Positive;0.9923502802848816;more broadly final demand from consumers and businesses was stronger than had been expected at the time of the september fomc meeting
2011-11-02;2011;November;Minute;Positive;0.9911856055259705;participants noted that global supply chain disruptions associated with the natural disaster in japan had diminished and that the prices of energy and some commodities had come down from their recent peaks easing strains on household budgets and likely contributing to a somewhat stronger pace of consumer spending in recent months
2011-11-02;2011;November;Minute;Positive;0.9847560524940491;in their discussion of the economic situation and outlook meeting participants regarded the information received during the intermeeting period as indicating that economic growth had strengthened somewhat in the third quarter reflecting in part a reversal of temporary factors that had weighed on the economic recovery in the first half of the year
2011-11-02;2011;November;Minute;Neutral;0.9802598357200623;participants forecasts are described in more detail in the summary of economic projections which is attached as an addendum to these minutes
2011-11-02;2011;November;Minute;Neutral;0.9006834626197815;although participants had revised downward their projections for growth since their previous forecasts in june they continued to anticipate that economic growth would pick up and the unemployment rate would decline gradually through 2014 they also continued to project that inflation would settle at or below levels consistent with the committees dual mandate
2011-11-02;2011;November;Minute;Neutral;0.9904597997665405;longerrun projections represent each participants assessment of the rate to which each variable would be expected to converge over time under appropriate monetary policy and in the absence of further shocks to the economy
2011-11-02;2011;November;Minute;Neutral;0.9505531787872314;with longerrun inflation expectations stable and significant slack anticipated to persist in labor and product markets the staff continued to expect prices to rise at a subdued pace in 2012 and 2013 participants views on current conditions and the economic outlook in conjunction with this fomc meeting all participantsthe five members of the board of governors and the presidents of the 12 federal reserve banksprovided projections of output growth the unemployment rate and inflation for each year from 2011 through 2014 and over the longer run
2011-11-02;2011;November;Minute;Negative;0.8881914019584656;the upward pressure on consumer prices from the rise in commodity and import prices early in the year was anticipated to ease further in the current quarter
