Date;Year;Month;Type;sentiment;sentiment_score;sentence
2011-11-02;2011;November;Minute;Neutral;0.9893338084220886;over the forecast period the increase in real gdp was projected to be sufficient to reduce the slack in product and labor markets only slowly and the unemployment rate was expected to remain elevated at the end of 2013 the staffs forecast for inflation was essentially unchanged from the projection prepared for the september fomc meeting
2011-11-02;2011;November;Minute;Neutral;0.9919691681861877;consequently the staffs outlook for economic activity over the medium term was similar to the projection prepared for the september fomc meeting
2011-11-02;2011;November;Minute;Negative;0.9919703006744385;moreover many of the factors that have been restraining the recovery such as the large overhang of vacant houses tight credit conditions and elevated risk premiums remained in place
2011-11-02;2011;November;Minute;Negative;0.9939471483230591;however other important nearterm indicators of economic activity remained downbeat measures of consumer sentiment were still very low business surveys pointed to continued caution by firms conditions in the labor market remained weak and gains in manufacturing production outside of the motor vehiclerelated sectors were sluggish
2011-11-02;2011;November;Minute;Positive;0.9900862574577332;staff economic outlook with the recent data on spending particularly for consumer expenditures and business outlays for capital goods and nonresidential construction stronger than the staff anticipated at the time of the september fomc meeting the staffs nearterm projection for the rate of increase in real gdp was revised up
2011-11-02;2011;November;Minute;Negative;0.9938451051712036;the central banks of brazil indonesia and israel lowered their policy rates citing a potential slowdown in global growth
2011-11-02;2011;November;Minute;Neutral;0.8774527311325073;the bank of england and bank of japan each announced expansions of their respective asset purchase programs and the ecb announced that it would conduct two refinancing operations with maturities of slightly more than a year and launched a new covered bond purchase program
2011-11-02;2011;November;Minute;Positive;0.9140342473983765;a number of central banks announced additional measures to stimulate economic activity
2011-11-02;2011;November;Minute;Neutral;0.949241042137146;with respect to the outlook for inflation participants generally anticipated that inflation would recede further over coming quarters and would settle over the medium run at levels at or below those judged to be most consistent with the committees dual mandate
2011-11-02;2011;November;Minute;Negative;0.9941257238388062;business contacts in many parts of the country were reported to be cautious and uncertain about the economic and political outlook and so remained reluctant to hire or expand capacity
2011-11-02;2011;November;Minute;Positive;0.9523369669914246;however production in the manufacturing agriculture and energy sectors continued to increase and the auto sector was rebounding from earlier supply chain disruptions
2011-11-02;2011;November;Minute;Positive;0.9927392601966858;the staff continued to project that real gdp would accelerate gradually in 2012 and 2013 supported by accommodative monetary policy further improvements in credit conditions and a pickup in consumer and business sentiment from their current low levels
2011-11-02;2011;November;Minute;Negative;0.9901708960533142;input cost pressures were said to have abated somewhat while labor costs remained subdued
2011-11-02;2011;November;Minute;Negative;0.9066385626792908;it was also noted that the extended period of highly accommodative monetary policy could eventually lead to a buildup of financial imbalances
2011-11-02;2011;November;Minute;Positive;0.9433341026306152;in addition businesses in a number of regions reported ongoing capital investment to increase productivity
2011-11-02;2011;November;Minute;Negative;0.992478609085083;in addition participants noted the risk of a largerthanexpected fiscal tightening and the possibility that structural problems in the housing market had attenuated the transmission of monetary policy actions to the real economy
2011-11-02;2011;November;Minute;Negative;0.9867266416549683;risks included potential spillovers to us financial markets and institutions and so to the broader us economy if the european debt and banking crisis were to worsen significantly
2011-11-02;2011;November;Minute;Negative;0.9932212829589844;while recent incoming data suggested reduced odds that the economy would slide back into recession participants still saw significant downside risks to the outlook for economic growth
2011-11-02;2011;November;Minute;Negative;0.9641424417495728;while some factors were seen as likely to support growth going forwardsuch as pentup demand improvements in household and business balance sheets and accommodative monetary policyparticipants observed that the pace of economic recovery would likely continue to be held down for some time by persistent headwinds
2011-11-02;2011;November;Minute;Neutral;0.7705945372581482;regarding their overall outlook for economic activity participants generally agreed that even with the positive news received over the intermeeting period the most probable outcome was a moderate pace of economic growth over the medium run with only a gradual decline in the unemployment rate
2011-11-02;2011;November;Minute;Negative;0.9956888556480408;however other participants pointed to the subdued pace of gains in labor costs as a factor damping inflation and reports from contacts suggested that upward pressure on wages remained limited
2011-11-02;2011;November;Minute;Negative;0.9906554818153381;nonetheless some participants noted that core inflation had not come down as quickly or by as much as they had expected in light of the reduction in commodity prices perhaps suggesting that the level of potential output was lower than had been thought
2011-11-02;2011;November;Minute;Negative;0.5692952275276184;measures of core inflation also seemed to have declined in recent months and longerterm inflation expectations remained well anchored
2011-11-02;2011;November;Minute;Negative;0.8597197532653809;participants generally agreed that measures of total inflation appeared to have moderated since earlier in the year as prices of energy and some commodities declined from their peaks
2011-11-02;2011;November;Minute;Neutral;0.9870359301567078;participants also discussed the events surrounding the bankruptcy filing of mf global holdings ltd and saw the financial stability implications of this development as limited to date
2011-11-02;2011;November;Minute;Negative;0.9943506717681885;it was noted that very low interest rates were negatively affecting pension funds and the profitability of the life insurance industry
2011-11-02;2011;November;Minute;Negative;0.9941425919532776;contacts in the banking sector reported that us banks continued to be willing to extend loans to creditworthy borrowers but loan demand remained weak and competition for such borrowers was putting pressure on net interest margins
2011-11-02;2011;November;Minute;Negative;0.9935047626495361;in particular they pointed to very low levels of consumer and business confidence further efforts by households to deleverage cutbacks at all levels of government elevated financial market volatility stilltight credit conditions for some households and small businesses and the ongoing weakness in the labor and housing markets
2011-11-02;2011;November;Minute;Negative;0.9859731197357178;participants took note of the possible adverse effects on us financial markets and the broader us economy if european sovereign debt and banking problems intensified
2011-11-02;2011;November;Minute;Negative;0.993851900100708;some participants suggested that the persistently high level of unemployment reflected the impact of structural factors including mismatches between the skills of the unemployed and the skills demanded in sectors in which jobs were currently available
2011-11-02;2011;November;Minute;Positive;0.9923858642578125;participants observed however that the capital and liquidity positions of us banks had strengthened in recent quarters and that the credit quality of loans to businesses and households had improved further
2011-11-02;2011;November;Minute;Negative;0.987389326095581;consistent with this view some business contacts reportedly were concerned about the low quality of many job applicants while other contacts noted that workers with some specialized skills continued to be in short supply
2011-11-02;2011;November;Minute;Positive;0.9884015917778015;overall credit costs were low and profits and balance sheets at nonfinancial corporations were healthy with many firms continuing to hold very high levels of cash
2011-11-02;2011;November;Minute;Negative;0.9869713187217712;as a result they expected that unemployment would fall back as the economy recovered
2011-11-02;2011;November;Minute;Negative;0.993328332901001;some participants again warned that the exceptionally high level of longterm unemployment could ultimately lead to permanent negative effects on the skills and employment prospects of the unemployed
2011-11-02;2011;November;Minute;Negative;0.9946868419647217;however other participants indicated that such concerns were not new and that much of the current elevated level of unemployment reflected cyclical factors with one pointing to the lack of wage pressures as evidence
2011-11-02;2011;November;Minute;Negative;0.9951210618019104;liquidity in many markets worsened in part because financial institutions more reliant on shortterm funding markets reportedly pulled back from risktaking and became somewhat less willing to make markets
2011-11-02;2011;November;Minute;Neutral;0.9709228277206421;participants noted the announcement by european policymakers of a new package of measures to address greeces fiscal situation as well as the vulnerabilities of european banks and sovereigns
2011-11-02;2011;November;Minute;Negative;0.8973135352134705;however participants indicated that many details of the new plan had not yet been worked out and that a number of important issues remained unresolved
2011-11-02;2011;November;Minute;Neutral;0.7242974638938904;meeting participants observed that financial markets continued to be particularly volatile during the intermeeting period as investors responded to incoming economic data and to news regarding fiscal and financial developments in europe
2011-11-02;2011;November;Minute;Negative;0.9942706823348999;despite some signs of improvement of late the available indicators pointed to continued weakness in overall labor market conditions and the unemployment rate remained elevated
2011-11-28;2011;November;Minute;Negative;0.992073118686676;issuance of commercial mortgagebacked securities cmbs was light amid deteriorating liquidity conditions in the cmbs market
2011-11-28;2011;November;Minute;Negative;0.9956106543540955;prices of most types of commercial properties continued to be depressed while both vacancy rates and delinquency rates for commercial properties stayed close to their recent highs
2011-11-28;2011;November;Minute;Negative;0.9948967099189758;cds spreads for european banks remained elevated as these institutions faced increasingly strained conditions in shortterm funding markets
2011-11-28;2011;November;Minute;Negative;0.9947380423545837;financing conditions for commercial real estate appeared to remain strained over the intermeeting period
2011-11-28;2011;November;Minute;Negative;0.9952318072319031;in the leveraged loan market the extension of loans stepped up somewhat in november but remained sluggish relative to its average pace earlier in the year
2011-11-28;2011;November;Minute;Neutral;0.4391353130340576;nonfinancial commercial paper outstanding and commercial and industrial loans continued to expand at a moderate pace
2011-11-28;2011;November;Minute;Positive;0.924296498298645;the debt of nonfinancial firms increased in november with corporate bond issuance particularly robust as some firms reportedly were eager to issue bonds before yearend
2011-11-28;2011;November;Minute;Negative;0.5530827045440674;yields on investmentgrade and speculativegrade corporate bonds rose on balance over the period and their spreads over yields on comparablematurity treasury securities were somewhat wider
2011-11-28;2011;November;Minute;Negative;0.994367778301239;in the wake of the bankruptcy of mf global market participants also expressed renewed concerns about securities dealers that rely heavily on shortterm wholesale funding markets particularly those institutions not affiliated with commercial banking institutions
2011-11-28;2011;November;Minute;Negative;0.9458397030830383;in the december 2011 senior credit officer opinion survey on dealer financing terms dealers reported a moderate tightening of credit terms over the preceding three months on securities financing transactions and overthecounter derivatives markets trades particularly for financial counterparties
2011-11-28;2011;November;Minute;Negative;0.9662445783615112;credit default swap cds spreads and equity prices of large us banking organizations remained volatile over the intermeeting period
2011-11-28;2011;November;Minute;Negative;0.9818741083145142;dealers also noted that demand for funding all types of securities decreased over the same reference period
2011-11-28;2011;November;Minute;Positive;0.8972439169883728;by contrast in secured funding markets spreads on assetbacked commercial paper were relatively steady for us and most europeanbased issuers and rates on repurchase agreements across various types of collateral were stable
2011-11-28;2011;November;Minute;Negative;0.9843644499778748;some european financial institutions reportedly faced significant pressures in unsecured dollar funding markets
2011-11-28;2011;November;Minute;Neutral;0.9875491857528687;in dollar funding markets the spread of the threemonth london interbank offered rate libor over the overnight index swap ois rate of the same maturity widened noticeably during the intermeeting period
2011-11-28;2011;November;Minute;Negative;0.992350161075592;following the six major central banks currency swap announcement some measures of shortterm funding costs moderated but they remained elevated
2011-11-28;2011;November;Minute;Negative;0.9950488209724426;early in the intermeeting period conditions in shortterm wholesale funding markets appeared to deteriorate somewhat
2011-11-28;2011;November;Minute;Negative;0.9884918928146362;interest rates on residential mortgages were little changed on net over the intermeeting period and remained at historically low levels
2011-11-28;2011;November;Minute;Neutral;0.9927298426628113;indicators of inflation expectations derived from nominal and inflationprotected treasury securities posted mixed changes on net over the period and remained at the low end of their recent ranges
2011-11-28;2011;November;Minute;Neutral;0.9862970113754272;yields on currentcoupon agency mbs also ended the period about unchanged
2011-11-28;2011;November;Minute;Negative;0.9618605375289917;while the sp 500 index ended the period slightly higher on net equity prices for most major us banking firms were lower and their cds spreads widened
2011-11-28;2011;November;Minute;Negative;0.9923244714736938;but low mortgage rates appeared to have only modest effects on the rate of mortgage refinancing likely because of tight underwriting standards and low levels of home equity
2011-11-28;2011;November;Minute;Negative;0.9918633699417114;but these spreads subsequently narrowed in anticipation of the european union eu summit meeting on december 9 and in reaction to the swap announcement by the federal reserve and the other central banks on november 30 near the end of the period sovereign spreads widened again amid market participants apparent concerns that the actions announced at the eu summit would prove to be less effective than they previously had anticipated
2011-11-28;2011;November;Minute;Negative;0.8436825275421143;the rate of newly delinquent prime mortgagesthe pace at which mortgages transition from current to delinquentseemed to have slowed but overall delinquency rates on residential mortgages remained elevated
2011-11-28;2011;November;Minute;Neutral;0.9855132699012756;the foreign exchange value of the dollar appreciated on balance over the intermeeting period
2011-11-28;2011;November;Minute;Positive;0.8309195637702942;both shortterm nominal treasury yields and the expected path of the federal funds rate implied by money market futures quotes were essentially unchanged on balance over the intermeeting period while longerdated treasury yields ended the period slightly higher
2011-11-28;2011;November;Minute;Neutral;0.9550440907478333;equity prices in both advanced and emerging market economies fluctuated widely with advanced country equities little changed on net and emerging market equities ending the period lower
2011-11-28;2011;November;Minute;Negative;0.9895297884941101;several european banks announced large declines in thirdquarter profits in part reflecting writedowns of their holdings of greek sovereign debt
2011-11-28;2011;November;Minute;Neutral;0.9796691536903381;in addition maturities for repurchase agreements involving sovereign bonds of euroarea countries other than germany reportedly shortened
2011-11-28;2011;November;Minute;Negative;0.8785044550895691;euro funding pressures also moved higher over the period with euro liborois spreads continuing to rise
2011-11-28;2011;November;Minute;Neutral;0.5049630403518677;against the background of higher dollar funding costs in the market and the reduction in the charge on dollar liquidity swaps demand at the tender by the european central bank ecb of threemonth dollar liquidity in december jumped to more than 50 billion from less than 500 million at the november auction
2011-11-28;2011;November;Minute;Neutral;0.9876354336738586;implied basis spreads from the foreign exchange swap market rose substantially over november but reversed a portion of that increase immediately following the central banks swap announcement
2011-11-28;2011;November;Minute;Positive;0.9367226362228394;german sovereign yields increased as well
2011-11-28;2011;November;Minute;Negative;0.9937838315963745;indicators of home prices and the credit quality of older mortgage loans remained weak
2011-11-28;2011;November;Minute;Positive;0.9305496215820312;spreads of yields on most peripheral euroarea countries debt over yields on german debt ended the period higher on net
2011-11-28;2011;November;Minute;Negative;0.968900203704834;although currency increased at a robust pace reserve balances declined by more reflecting a temporary decrease in the size of the soma as a result of lags in the settlement of mbs reinvestment transactions
2011-11-28;2011;November;Minute;Negative;0.9828636050224304;in contrast the monetary base declined in november
2011-11-28;2011;November;Minute;Neutral;0.9794973134994507;in part offshore deposits which are no longer excluded from the federal deposit insurance corporation assessment base appeared to be shifting to onshore offices
2011-11-28;2011;November;Minute;Positive;0.9921912550926208;m2 expanded at a solid pace in november likely reflecting increased demand for safe and liquid assets given concerns over european financial developments
2011-11-28;2011;November;Minute;Neutral;0.9354549646377563;issuance of consumer credit assetbacked securities increased substantially in november
2011-11-28;2011;November;Minute;Positive;0.9907920360565186;meanwhile consumer credit quality improved further in recent months with delinquency rates on credit card loans declining nearly to historical lows and delinquency rates on nonrevolving credit at commercial banks retreating to precrisis levels
2011-11-28;2011;November;Minute;Neutral;0.9849967956542969;the aggregate volume of credit card solicitations in recent months remained at levels comparable to those before the financial crisis in 2008 though the volume sent to lowincome households was still well below the levels at that time
2011-11-28;2011;November;Minute;Neutral;0.540579080581665;consumer credit rose slightly in the third quarter
2011-11-28;2011;November;Minute;Negative;0.9166446924209595;market reaction to the announcements by fannie mae and freddie mac on november 15 regarding the expansion of the home affordable refinance program was limited
2011-11-28;2011;November;Minute;Neutral;0.44997313618659973;over most of november yields on many euroarea sovereign bondsincluding those of italy spain belgium and francealong with yields on debt issued by the european financial stability facility rose sharply relative to the yield on german government bonds
2011-11-28;2011;November;Minute;Positive;0.9884032607078552;over the following weeks movements in yields were reportedly driven by shifts in investors assessments of the european situation and by us economic data that were somewhat stronger than they expected
2011-11-28;2011;November;Minute;Negative;0.9934765696525574;real business spending on equipment and software seemed to be decelerating
2011-11-28;2011;November;Minute;Negative;0.988701581954956;nevertheless investors appeared to remain cautious
2011-11-28;2011;November;Minute;Negative;0.9947358965873718;nominal orders and shipments of nondefense capital goods excluding aircraft edged down in october and the slowing accumulation of unfilled orders suggested that increases in outlays for business equipment would be muted in subsequent months
2011-11-28;2011;November;Minute;Negative;0.9960682392120361;sales of new and existing homes remained slow in recent months and home prices moved down further
2011-11-28;2011;November;Minute;Negative;0.988386332988739;starts and permits for new singlefamily homes in october stayed around the low levels that prevailed since the middle of last year
2011-11-28;2011;November;Minute;Negative;0.9938272833824158;activity in the housing market continued to be depressed by the substantial inventory of foreclosed and distressed properties and by weak demand that reflected tight credit conditions for mortgage loans and uncertainty about future home prices
2011-11-28;2011;November;Minute;Negative;0.9946005344390869;but consumer sentiment was still at a subdued level in early december despite some improvement in recent months
2011-11-28;2011;November;Minute;Positive;0.9839449524879456;in november nominal retail sales excluding purchases at motor vehicle and parts outlets expanded further and sales of light motor vehicles stepped up
2011-11-28;2011;November;Minute;Positive;0.9920672178268433;nonetheless overall real personal consumption expenditures pce rose modestly in october following significant gains in the previous month as spending for consumer goods continued to increase at a strong pace while outlays for consumer services were roughly flat
2011-11-28;2011;November;Minute;Negative;0.9872443079948425;revised estimates indicated that households real disposable income declined in the second and third quarters and the net wealth of households decreased in the third quarter
2011-11-28;2011;November;Minute;Negative;0.8827371597290039;however motor vehicle assemblies were scheduled to only edge higher on balance in the coming months and broader indicators of manufacturing activity such as the diffusion indexes of new orders from the national and regional manufacturing surveys were at levels that suggested only modest increases in production in the near term
2011-11-28;2011;November;Minute;Negative;0.9725605249404907;also survey measures of business conditions and sentiment remained at relatively downbeat levels in november
2011-11-28;2011;November;Minute;Positive;0.972910463809967;factory output outside of the motor vehicle sector also continued to rise and the rate of manufacturing capacity utilization moved up
2011-11-28;2011;November;Minute;Negative;0.9765219688415527;initial claims for unemployment insurance moved down on net since early november but were still at a level consistent with only modest employment gains and indicators of job openings and businesses hiring plans were little changed
2011-11-28;2011;November;Minute;Negative;0.9934298396110535;nevertheless employment at state and local governments declined further and both longduration unemployment and the share of workers employed part time for economic reasons remained elevated
2011-11-28;2011;November;Minute;Negative;0.9537920951843262;the unemployment rate dropped to 86 percent in november and private nonfarm employment continued to increase moderately during the past two months
2011-11-28;2011;November;Minute;Positive;0.9917683601379395;conditions in the labor market seemed to have improved somewhat while overall consumer price inflation continued to be more modest than earlier in the year and measures of longrun inflation expectations remained stable
2011-11-28;2011;November;Minute;Positive;0.7844374775886536;staff review of the economic situation the information reviewed at the december 13 meeting indicated that us economic activity expanded moderately despite some apparent slowing in the growth of foreign economies and strains in global financial markets
2011-11-28;2011;November;Minute;Neutral;0.976382315158844;there were no intervention operations in foreign currencies for the systems account over the intermeeting period
2011-11-28;2011;November;Minute;Neutral;0.9851465821266174;by unanimous vote the committee ratified the desks domestic transactions over the intermeeting period
