Date;Year;Month;Type;sentiment;sentiment_score;sentence
2011-11-28;2011;November;Minute;Neutral;0.9596999883651733;developments in financial markets and the federal reserves balance sheet the manager of the system open market account soma reported on developments in domestic and foreign financial markets during the period since the federal open market committee fomc met on november 12 2011 he also reported on system open market operations including the ongoing reinvestment into agencyguaranteed mortgagebacked securities mbs of principal payments received on soma holdings of agency debt and agencyguaranteed mbs as well as the operations related to the maturity extension program authorized at the september 2021 fomc meeting
2011-11-28;2011;November;Minute;Negative;0.9710656404495239;with inflationary pressures waning and the downside risks to the global economic outlook increasing some central banks eased policy
2011-11-28;2011;November;Minute;Positive;0.9922472238540649;industrial production rose in october reflecting in part a rebound in motor vehicle production from the effects of supply chain disruptions earlier in the year
2011-11-28;2011;November;Minute;Negative;0.9948422312736511;real business spending for nonresidential construction moved up in october but was still at a low level reflecting high vacancy rates and restricted credit conditions for construction loans
2011-11-28;2011;November;Minute;Neutral;0.9907999634742737;inventories in most industries looked to be reasonably well aligned with sales although motor vehicle stocks continued to be lean
2011-11-28;2011;November;Minute;Negative;0.9339536428451538;in the government sector real federal defense purchases appeared to have stepped down in october and november from their level in the third quarter
2011-11-28;2011;November;Minute;Positive;0.9762015342712402;investor concerns about developments in europe intensified early in the period but subsequently eased a bit amid signs that european authorities were moving toward agreement on a comprehensive framework to address fiscal and financial vulnerabilities and after the federal reserve and five other major central banks announced enhanced currency swap arrangements including lower charges on existing dollar liquidity swap lines
2011-11-28;2011;November;Minute;Negative;0.9702275991439819;staff review of the financial situation the risks associated with the fiscal and financial difficulties in europe remained the focus of attention in financial markets over the intermeeting period and contributed to heightened volatility in a wide range of asset markets
2011-11-28;2011;November;Minute;Negative;0.9743490815162659;among emerging market economies real gdp in brazil was flat in the third quarter while exports from china slowed in recent months although chinese domestic demand appeared to remain strong
2011-11-28;2011;November;Minute;Negative;0.9918485879898071;in other advanced foreign economies real gdp in japan rebounded in the third quarter from the effects of the earthquake in march and real gdp recovered in canada as oil production picked up after several months of shutdowns however available indicators of manufacturing activity in both of these economies pointed to declines during the fourth quarter
2011-11-28;2011;November;Minute;Negative;0.994083821773529;measures of business and consumer confidence in the euro area continued to decline in recent months
2011-11-28;2011;November;Minute;Negative;0.9936878085136414;moreover industrial production in the region fell sharply in september and indicators of manufacturing activity in october and november pointed to lower output
2011-11-28;2011;November;Minute;Negative;0.9857434630393982;real gross domestic product gdp in the euro area barely edged up in the third quarter
2011-11-28;2011;November;Minute;Negative;0.9943076968193054;foreign economic growth especially in the euro area appeared to weaken in recent months
2011-11-28;2011;November;Minute;Positive;0.5744356513023376;unit labor costs edged up over the past four quarters
2011-11-28;2011;November;Minute;Negative;0.980442464351654;compensation per hour in the nonfarm business sector increased moderately over the year ending in the third quarter while the 12month change in average hourly earnings for all employees remained low in october and november
2011-11-28;2011;November;Minute;Negative;0.9853111505508423;measures of labor compensation indicated that nominal wage gains continued to be subdued
2011-11-28;2011;November;Minute;Positive;0.9741044044494629;nearterm inflation expectations from the thomson reutersuniversity of michigan surveys of consumers declined in early december and longerterm inflation expectations remained stable
2011-11-28;2011;November;Minute;Negative;0.9244881868362427;consumer prices excluding food and energy also continued to rise at a more modest pace in october than earlier in the year
2011-11-28;2011;November;Minute;Negative;0.9845046997070312;increases in consumer food prices in october were substantially slower than the average pace in the preceding months of this year
2011-11-28;2011;November;Minute;Negative;0.9883484244346619;consumer prices for energy decreased and survey data indicated that gasoline prices declined further in november
2011-11-28;2011;November;Minute;Negative;0.9550556540489197;indeed the pce price index edged down in october
2011-11-28;2011;November;Minute;Negative;0.9887505173683167;inflation continued to decrease relative to earlier in the year
2011-11-28;2011;November;Minute;Positive;0.6618559956550598;reductions in exports of industrial supplies and consumer goods led by a few particularly volatile components outweighed the gains in capital goods
2011-11-28;2011;November;Minute;Negative;0.5847253799438477;declines in imports of petroleum products reflecting lower prices and lesser volumes nonoil industrial supplies and automotive products more than offset increases in capital goods consumer goods and food
2011-11-28;2011;November;Minute;Negative;0.9845297336578369;the us international trade deficit narrowed in october as imports decreased more than exports
2011-11-28;2011;November;Minute;Negative;0.9787834882736206;at the state and local level real purchases seemed to be decreasing at a slower pace in recent months than earlier in the year
2011-11-28;2011;November;Minute;Neutral;0.9846416115760803;yields on nominal treasury securities were little changed following the release of the november fomc statement
2011-11-28;2011;November;Minute;Neutral;0.9901691675186157;chinas central bank cut its reserve requirements by 50 basis points and the central bank of brazil lowered its policy rate by the same amount
2011-11-28;2011;November;Minute;Positive;0.9689064621925354;inflation moderated from the rates earlier in the year and longerterm inflation expectations remained stable
2011-11-28;2011;November;Minute;Neutral;0.9503478407859802;as a precautionary measure the bank of england announced a new liquidity facility that will auction term sterling funds against a wide range of collateral
2011-11-28;2011;November;Minute;Negative;0.9834244847297668;a few others continued to judge that maintaining the current degree of policy accommodation beyond the near term would likely be inappropriate given their outlook for economic activity and inflation or questioned the efficacy of additional monetary policy actions in light of the nonmonetary headwinds restraining the recovery
2011-11-28;2011;November;Minute;Neutral;0.9883679747581482;a number of members indicated that current and prospective economic conditions could well warrant additional policy accommodation but they believed that any additional actions would be more effective if accompanied by enhanced communication about the committees longerrun economic goals and policy framework
2011-11-28;2011;November;Minute;Negative;0.9917739033699036;for now however the committee agreed to reiterate its anticipation that economic conditionsincluding low rates of resource utilization and a subdued outlook for inflation over the medium runare likely to warrant exceptionally low levels for the federal funds rate at least through mid2013
2011-11-28;2011;November;Minute;Neutral;0.9872560501098633;a number of members noted their dissatisfaction with the committees current approach for communicating its views regarding the appropriate path for monetary policy and looked forward to considering possible enhancements to the committees communications
2011-11-28;2011;November;Minute;Neutral;0.9854552745819092;with regard to the forward guidance to be included in the statement to be released following the meeting several members noted that the reference to mid2013 might need to be adjusted before long
2011-11-28;2011;November;Minute;Neutral;0.9900479316711426;in particular they agreed to continue the program of extending the average maturity of the federal reserves holdings of securities as announced in september to retain the existing policies regarding the reinvestment of principal payments from federal reserve holdings of securities and to keep the target range for the federal funds rate at 0 to 14 percent
2011-11-28;2011;November;Minute;Neutral;0.9904904365539551;as a result almost all members agreed to maintain the existing stance of monetary policy at this meeting
2011-11-28;2011;November;Minute;Neutral;0.9929385781288147;in their discussion of monetary policy for the period ahead committee members generally agreed that their overall assessments of the economic outlook had not changed greatly since their previous meeting
2011-11-28;2011;November;Minute;Neutral;0.9864171743392944;members also anticipated that inflation would settle over coming quarters at levels at or below those consistent with the dual mandate
2011-11-28;2011;November;Minute;Neutral;0.9713954925537109;for this meeting almost all members were willing to support maintaining the existing policy stance while emphasizing the importance of carefully monitoring economic developments given the uncertainties and risks attending the outlook
2011-11-28;2011;November;Minute;Negative;0.990001916885376;strains in global financial markets continued to pose significant downside risks to economic activity
2011-11-28;2011;November;Minute;Negative;0.9950183629989624;however available indicators pointed to some slowing in the pace of economic growth in europe and in some emerging market economies
2011-11-28;2011;November;Minute;Negative;0.983359158039093;inflation had moderated and longerterm inflation expectations remained stable
2011-11-28;2011;November;Minute;Negative;0.9924226403236389;while overall labor market conditions had improved some in recent months the unemployment rate remained elevated relative to levels that the committee anticipated would prevail in the longer run
2011-11-28;2011;November;Minute;Positive;0.960302472114563;committee policy action members viewed the information on us economic activity received over the intermeeting period as suggesting that the economy was expanding moderately
2011-11-28;2011;November;Minute;Negative;0.9909383058547974;a few participants argued that maintaining a highly accommodative stance of monetary policy over the medium run would erode the stability of inflation expectations
2011-11-28;2011;November;Minute;Negative;0.9947136044502258;some participants were concerned that inflation could rise as the recovery continued and some business contacts had reported that producers expected to see an increase in pricing power over time
2011-11-28;2011;November;Minute;Negative;0.8247028589248657;however a couple of participants noted that the rate of inflation over the past year had not fallen as much as would be expected if the gap in resource utilization were large suggesting that the level of potential output was lower than some current estimates
2011-11-28;2011;November;Minute;Negative;0.9944315552711487;indeed some expressed the concern that with the persistence of considerable resource slack inflation might run below mandateconsistent levels for some time
2011-11-28;2011;November;Minute;Positive;0.7595967054367065;more broadly many participants judged that the moderate expansion in economic activity that they were projecting and the associated gradual reduction in the current wide margins of slack in labor and product markets would be consistent with subdued inflation going forward
2011-11-28;2011;November;Minute;Negative;0.9736377596855164;members continued to expect a moderate pace of economic growth over coming quarters with the unemployment rate declining only gradually toward levels consistent with the committees dual mandate
2011-11-28;2011;November;Minute;Positive;0.9902750253677368;although some energy prices had recently increased many participants judged that the favorable trends in commodity prices might persist in the near term particularly in light of softer global activity and one noted that expanded crop production if realized would hold down agricultural prices
2011-11-28;2011;November;Minute;Neutral;0.9948275685310364;with respect to the statement members agreed that only relatively small modifications were needed to reflect the modest changes to economic conditions seen in the recent data and to note that the committee would continue to implement its policy steps from recent meetings
2011-11-28;2011;November;Minute;Neutral;0.9889217615127563;to further its longrun objectives the committee seeks conditions in reserve markets consistent with federal funds trading in a range from 0 to 14 percent
2011-11-28;2011;November;Minute;Neutral;0.9887987971305847;the ecb reduced its minimum bid rate by 25 basis points at both its november and december meetings relaxed its collateral and reserve requirements and stated that it would begin to offer threeyear funds at fixed rates
2011-11-28;2011;November;Minute;Neutral;0.882091224193573;voting for this
2011-11-28;2011;November;Minute;Positive;0.9811782240867615;the committee will continue to assess the economic outlook in light of incoming information and is prepared to employ its tools to promote a stronger economic recovery in a context of price stability
2011-11-28;2011;November;Minute;Negative;0.9875297546386719;the committee also decided to keep the target range for the federal funds rate at 0 to 14 percent and currently anticipates that economic conditionsincluding low rates of resource utilization and a subdued outlook for inflation over the medium runare likely to warrant exceptionally low levels for the federal funds rate at least through mid2013
2011-11-28;2011;November;Minute;Neutral;0.9859819412231445;the committee will regularly review the size and composition of its securities holdings and is prepared to adjust those holdings as appropriate
2011-11-28;2011;November;Minute;Neutral;0.9881928563117981;the committee is maintaining its existing policies of reinvesting principal payments from its holdings of agency debt and agency mortgagebacked securities in agency mortgagebacked securities and of rolling over maturing treasury securities at auction
2011-11-28;2011;November;Minute;Neutral;0.9544665813446045;to support a stronger economic recovery and to help ensure that inflation over time is at levels consistent with the dual mandate the committee decided today to continue its program to extend the average maturity of its holdings of securities as announced in september
2011-11-28;2011;November;Minute;Neutral;0.9857256412506104;however the committee will continue to pay close attention to the evolution of inflation and inflation expectations
2011-11-28;2011;November;Minute;Neutral;0.9934316277503967;the committee also anticipates that inflation will settle over coming quarters at levels at or below those consistent with the committees dual mandate
2011-11-28;2011;November;Minute;Neutral;0.7765012383460999;at the conclusion of the discussion the committee voted to authorize and direct the federal reserve bank of new york until it was instructed otherwise to execute transactions in the system account in accordance with the following domestic policy directive the federal open market committee seeks monetary and financial conditions that will foster price stability and promote sustainable growth in output
2011-11-28;2011;November;Minute;Negative;0.9898952841758728;strains in global financial markets continue to pose significant downside risks to the economic outlook
2011-11-28;2011;November;Minute;Neutral;0.8732967972755432;consistent with its statutory mandate the committee seeks to foster maximum employment and price stability
2011-11-28;2011;November;Minute;Positive;0.8787809014320374;inflation has moderated since earlier in the year and longerterm inflation expectations have remained stable
2011-11-28;2011;November;Minute;Negative;0.9958677291870117;household spending has continued to advance but business fixed investment appears to be increasing less rapidly and the housing sector remains depressed
2011-11-28;2011;November;Minute;Negative;0.9916953444480896;while indicators point to some improvement in overall labor market conditions the unemployment rate remains elevated
2011-11-28;2011;November;Minute;Positive;0.9774600267410278;the vote encompassed approval of the statement below to be released at 215 pm information received since the federal open market committee met in november suggests that the economy has been expanding moderately notwithstanding some apparent slowing in global growth
2011-11-28;2011;November;Minute;Neutral;0.9879816174507141;the system open market account manager and the secretary will keep the committee informed of ongoing developments regarding the systems balance sheet that could affect the attainment over time of the committees objectives of maximum employment and price stability
2011-11-28;2011;November;Minute;Neutral;0.9904356002807617;the committee directs the desk to engage in dollar roll transactions as necessary to facilitate settlement of the federal reserves agency mbs transactions
2011-11-28;2011;November;Minute;Neutral;0.9877525568008423;the committee also directs the desk to maintain its existing policies of rolling over maturing treasury securities into new issues and of reinvesting principal payments on all agency debt and agency mortgagebacked securities in the system open market account in agency mortgagebacked securities in order to maintain the total face value of domestic securities at approximately 26 trillion
2011-11-28;2011;November;Minute;Neutral;0.991280734539032;the committee directs the desk to continue the maturity extension program it began in september to purchase by the end of june 2012 treasury securities with remaining maturities of approximately 6 years to 30 years with a total face value of 400 billion and to sell treasury securities with remaining maturities of 3 years or less with a total face value of 400 billion
2011-11-28;2011;November;Minute;Negative;0.972937285900116;the committee continues to expect a moderate pace of economic growth over coming quarters and consequently anticipates that the unemployment rate will decline only gradually toward levels that the committee judges to be consistent with its dual mandate
2011-11-28;2011;November;Minute;Neutral;0.9642653465270996;most participants anticipated that inflation would continue to moderate
2011-11-28;2011;November;Minute;Negative;0.5697566270828247;one member preferred to undertake additional accommodation at this meeting and dissented from the policy decision
2011-11-28;2011;November;Minute;Negative;0.9934720993041992;some business contacts suggested that pricing pressures had diminished
2011-11-28;2011;November;Minute;Positive;0.9919183850288391;however one participant noted that some homebuilders were reporting that land prices were edging up and that financing was available from nontraditional sources suggesting that conditions in the housing market could be improving
2011-11-28;2011;November;Minute;Negative;0.9942185878753662;several participants observed that the ongoing weakness in the housing market came despite low borrowing rates and government initiatives to resolve problems in the foreclosure process
2011-11-28;2011;November;Minute;Negative;0.9848811626434326;participants generally saw few signs of recovery in the housing market with house prices continuing to decline in most areas and the overhang of foreclosed and distressed properties still substantial
2011-11-28;2011;November;Minute;Negative;0.9950489401817322;moreover some participants mentioned that households were likely still adjusting to the loss of wealth over the past few years which would weigh on consumer spending going forward
2011-11-28;2011;November;Minute;Positive;0.9607965350151062;as a result a number of those participants suggested that the recent stronger pace of consumer spending might not be sustained
2011-11-28;2011;November;Minute;Negative;0.9951944947242737;however others noted that real disposable personal income had weakened and that households remained pessimistic about their income prospects and uncertain about the economic outlook
2011-11-28;2011;November;Minute;Positive;0.9177646040916443;a few participants thought that the recent strength in motor vehicle sales and other consumer spending could reflect pentup demand from households for goods and services and so thought that it might persist for a time
2011-11-28;2011;November;Minute;Negative;0.9926878213882446;in discussing the household sector meeting participants generally commented that consumer spending in recent months had been stronger than expected and several reported cautious optimism among some of their business contacts about prospects for the holiday shopping season
2011-11-28;2011;November;Minute;Negative;0.989138662815094;in assessing the economic outlook participants judged that strains in global financial markets continued to pose significant downside risks
2011-11-28;2011;November;Minute;Negative;0.991610586643219;other factors that were expected to weigh on the pace of economic activity were the slowdown of economic activity abroad fiscal tightening in the united states high levels of uncertainty among households and businesses the weak housing market and household deleveraging
2011-11-28;2011;November;Minute;Negative;0.7085039019584656;the factors that participants cited as likely to restrain the pace of the economic expansion included an expectation that financial markets would remain unsettled until the fiscal and banking issues in the euro area were more fully addressed
2011-11-28;2011;November;Minute;Negative;0.5941240787506104;regarding the economic outlook participants continued to anticipate that economic activity would expand at a moderate rate in the coming quarters and that consequently the unemployment rate would decline only gradually
2011-11-28;2011;November;Minute;Negative;0.9863407611846924;labor market conditions improved some in recent months but the unemployment rate remained elevated despite a noticeable drop in november
2011-11-28;2011;November;Minute;Negative;0.995793342590332;consumer spending continued to advance but business fixed investment appeared to be decelerating and home sales and construction remained at very low levels
2011-11-28;2011;November;Minute;Neutral;0.3829311728477478;with longrun inflation expectations stable and substantial slack in labor and product markets anticipated to persist over the forecast period the staff continued to project that inflation would be subdued in 2012 and 2013 participants views on current conditions and the economic outlook in their discussion of the economic situation and outlook meeting participants agreed that the information received since their previous meeting indicated that economic activity was expanding at a moderate rate notwithstanding some apparent slowing in global economic growth
2011-11-28;2011;November;Minute;Negative;0.9798277616500854;the upward pressure on consumer prices from the increases in commodity and import prices earlier in the year was expected to continue to subside in the current quarter
2011-11-28;2011;November;Minute;Neutral;0.9478506445884705;over the forecast period the gains in real gdp were anticipated to be sufficient to reduce the slack in product and labor markets only slowly and the unemployment rate was expected to remain elevated at the end of 2013 the staffs projection for inflation was little changed from the forecast prepared for the november fomc meeting
2011-11-28;2011;November;Minute;Positive;0.9927753210067749;nonetheless the staff continued to project that the pace of economic activity would pick up gradually in 2012 and 2013 supported by accommodative monetary policy further increases in credit availability and improvements in consumer and business sentiment
2011-11-28;2011;November;Minute;Negative;0.9235084652900696;however the mediumterm projection for real gdp growth in the december forecast was lower than the one presented in november primarily reflecting revisions to the staffs view regarding developments in europe and their implications for the us economy
2011-11-28;2011;November;Minute;Positive;0.5839784741401672;longerrun inflation expectations were still well anchored
2011-11-28;2011;November;Minute;Neutral;0.7321781516075134;staff economic outlook in the economic forecast prepared for the december fomc meeting the staffs projection for the increase in real gdp in the near term was little changed as the recent data on spending production and the labor market were on balance in line with the staffs expectations at the time of the previous forecast
2011-11-28;2011;November;Minute;Positive;0.9740138053894043;reports from business contacts indicated that in addition to the rise in consumer spending activity in the manufacturing energy and agriculture sectors continued to advance in recent months
