Date;Year;Month;Type;sentiment;sentiment_score;sentence
2011-09-21;2011;September;Minute;Negative;0.871039092540741;in addition the federal funds market could contract as a result and the effective federal funds rate could become less reliably linked to other shortterm interest rates
2011-09-21;2011;September;Minute;Negative;0.9876902103424072;moreover many participants voiced concerns that reducing the ior rate risked costly disruptions to money markets and to the intermediation of credit and that the magnitude of such effects would be difficult to predict in advance
2011-09-21;2011;September;Minute;Negative;0.5691440105438232;however some others noted that a recent change in deposit insurance assessments had the effect of significantly reducing the net return that many banks receive from holding reserve balances
2011-09-21;2011;September;Minute;Negative;0.757436990737915;some participants observed that keeping the ior rate noticeably above the market rate on other safe shortterm instruments could be perceived as subsidizing some banking institutions
2011-09-21;2011;September;Minute;Positive;0.9788730144500732;several noted that reducing the ior rate could help signal the committees intention to keep the federal funds rate low
2011-09-21;2011;September;Minute;Positive;0.9875897169113159;a number of participants judged that a reduction would result in at least marginally lower money market rates and could help stimulate bank lending
2011-09-21;2011;September;Minute;Neutral;0.9815511703491211;participants discussed whether to reduce the ior rate weighing potential benefits and costs
2011-09-21;2011;September;Minute;Neutral;0.9915149211883545;a number of participants suggested that the committees periodic summary of economic projections could be used to provide more information about their views on the longerrun objectives and the likely evolution of monetary policy
2011-09-21;2011;September;Minute;Neutral;0.8870722651481628;others thought this risk of misinterpretation could be managed through careful communications
2011-09-21;2011;September;Minute;Negative;0.9490437507629395;however several participants saw a risk that any explicit statement of economic conditions specified in the committees forward guidance could be mistaken for a statement of its longerrun objectives
2011-09-21;2011;September;Minute;Negative;0.9942533373832703;however a number saw the potential effects on real economic activity as limited or only transitory particularly in the current environment of balance sheet deleveraging credit constraints and household and business uncertainty about the economic outlook
2011-09-21;2011;September;Minute;Neutral;0.9892570376396179;participants noted that a soma maturity extension program would not expand the federal reserves balance sheet or the level of reserve balances and that the scale of such a program was necessarily limited by the size of the federal reserves holdings of shorterterm securities so that it could not be repeated to provide further stimulus
2011-09-21;2011;September;Minute;Neutral;0.8809351325035095;a number of participants saw largescale asset purchases as potentially a more potent tool that should be retained as an option in the event that further policy action to support a stronger economic recovery was warranted
2011-09-21;2011;September;Minute;Neutral;0.9504138231277466;some judged that largescale asset purchases and the resulting expansion of the federal reserves balance sheet would be more likely to raise inflation and inflation expectations than to stimulate economic activity and argued that such tools should be reserved for circumstances in which the risk of deflation was elevated
2011-09-21;2011;September;Minute;Negative;0.9849854707717896;in commenting on the implications of a maturity extension program or another largescale asset purchase program several participants noted that the system should avoid holding a very large proportion of the outstanding stock of longerterm treasury securities in its portfolio because the result could be a deterioration in market functioning
2011-09-21;2011;September;Minute;Neutral;0.8966877460479736;a number of participants suggested directing some purchases or reinvestments into agency mbs however a couple of participants saw such actions as unlikely to have benefits or as a form of credit allocation
2011-09-21;2011;September;Minute;Neutral;0.9864757657051086;meeting participants expressed a range of views on the potential efficacy of policy tools tied to the size and composition of the federal reserves balance sheet
2011-09-21;2011;September;Minute;Neutral;0.9833868145942688;most participants indicated that they favored taking steps to increase further the transparency of monetary policy including providing more information about the committees longerrun policy objectives and about the factors that influence the committees policy decisions
2011-09-21;2011;September;Minute;Negative;0.9822279810905457;that said a number of participants expressed concerns about the conceptual issues associated with establishing and communicating explicit longerrun objectives for the unemployment rate or other measures of labor market conditions inasmuch as the longrun equilibrium levels of such measures are influenced importantly by nonmonetary factors are subject to change over time and are estimated with considerable uncertainty
2011-09-21;2011;September;Minute;Neutral;0.9832320213317871;in contrast participants noted that the longrun level of inflation is determined primarily by monetary policy
2011-09-21;2011;September;Minute;Neutral;0.9880037307739258;accordingly many felt that if the committee were to reach a consensus on more explicit statements of its longerrun objectives it would need to provide an indepth explanation to the public of how those objectives were determined and how they fit into the policymaking framework
2011-09-21;2011;September;Minute;Neutral;0.9880734086036682;participants generally saw the committees postmeeting statements as not well suited to communicate fully the committees thinking about its objectives and its policy framework and agreed that the committee would need to use other means to communicate that information or to supplement information in the statement
2011-09-21;2011;September;Minute;Neutral;0.9821902513504028;most participants also indicated that they saw advantages in being more transparent about the conditionality in the committees forward guidance by providing more information about the economic conditions to which the guidance refers
2011-09-21;2011;September;Minute;Neutral;0.8981120586395264;they judged that such a step could make the committees forward guidance more effective and increase the likelihood that financial markets would respond to incoming economic information in ways that would help monetary policy achieve its goals
2011-09-21;2011;September;Minute;Neutral;0.9902516603469849;participants generally agreed that a clear statement of the committees longerrun policy objectives could be helpful some noted that it would also be useful to clarify the linkage between these longerrun objectives and the committees approach to setting the stance of monetary policy in the short and medium run
2011-09-21;2011;September;Minute;Positive;0.9909769296646118;consumer credit increased at a solid pace in july as a sizable increase in nonrevolving creditdriven by a surge in federally funded student loansmore than offset a decrease in revolving credit
2011-09-21;2011;September;Statement;Negative;0.9933388829231262;inflation appears to have moderated since earlier in the year as prices of energy and some commodities have declined from their peaks
2011-09-21;2011;September;Minute;Negative;0.9947232007980347;delinquency rates for several categories of consumer loans moved down further in recent months with some reaching levels not seen since the 200809 recession began
2011-09-21;2011;September;Minute;Neutral;0.9126436710357666;one member who opposed the maturity extension program also opposed the change in reinvestment policy because he judged that it would not benefit housing markets
2011-09-21;2011;September;Minute;Negative;0.7580583095550537;members also noted that the change in reinvestment policy could help prevent the shares of outstanding longerterm treasury securities held by the federal reserve from reaching levels high enough to result in a deterioration in treasury market functioning
2011-09-21;2011;September;Minute;Negative;0.8320180177688599;this change in reinvestment policy was expected to help reduce the spread between yields on mortgagebacked securities and those on comparablematurity treasury securities seen this year and so contribute to lower mortgage rates
2011-09-21;2011;September;Minute;Neutral;0.9892561435699463;the effect of this change will be to keep the somas holdings of agency securities at an approximately constant level under the previous practice those holdings were declining on an ongoing basis
2011-09-21;2011;September;Minute;Neutral;0.9933885335922241;to help support conditions in mortgage markets the committee decided to reinvest principal received from its holdings of agency debt and agency mbs in agency mbs rather than continuing to reinvest in longerterm treasury securities as had been the committees practice for more than a year
2011-09-21;2011;September;Minute;Neutral;0.9864354729652405;most members also supported a change in the committees reinvestment policy
2011-09-21;2011;September;Minute;Neutral;0.9900684952735901;members noted however that the committee will continue to regularly review the size and composition of its securities holdings and that it is prepared to adjust those holdings as appropriate
2011-09-21;2011;September;Minute;Neutral;0.9778878092765808;a majority favored the first approach
2011-09-21;2011;September;Minute;Neutral;0.7581026554107666;members saw benefits to both approaches the former would provide the public greater clarity about the likely scale of the program and the latter might allow the committee greater flexibility to adjust the scale of the program in response to unexpected economic developments
2011-09-21;2011;September;Minute;Neutral;0.9940493106842041;the committee discussed whether to specify the parameters of the maturity extension program by stating its intention to complete the full set of transactions by june 2012 or by stating that it would undertake these transactions at a specified monthly pace
2011-09-21;2011;September;Minute;Neutral;0.9791426658630371;three members concluded that additional accommodation was not appropriate at this time
2011-09-21;2011;September;Minute;Neutral;0.9896780252456665;two members said that current conditions and the outlook could justify stronger policy action but they supported undertaking the maturity extension program at this meeting as it did not rule out additional steps at future meetings
2011-09-21;2011;September;Minute;Neutral;0.9847330451011658;while the scale of such a maturity extension program was necessarily limited by the amount of shorterterm securities in the soma portfolio most members judged the action as appropriate given economic conditions and the outlook
2011-09-21;2011;September;Minute;Neutral;0.38675329089164734;they expected this program to put downward pressure on longerterm interest rates and to help make broader financial conditions more accommodative
2011-09-21;2011;September;Minute;Neutral;0.9935175180435181;specifically those members supported a program under which the committee would announce its intention to purchase by the end of june 2012 400 billion of treasury securities with remaining maturities of 6 years to 30 years and to sell an equal amount of treasury securities with remaining maturities of 3 years or less
2011-09-21;2011;September;Minute;Neutral;0.8330985903739929;those viewing greater policy accommodation as appropriate at this meeting generally supported a maturity extension program that would combine asset purchases and sales to extend the average maturity of securities held in the soma without generating a substantial expansion of the federal reserves balance sheet or reserve balances
2011-09-21;2011;September;Minute;Positive;0.9888784289360046;while they recognized that monetary policy alone could not completely address the economys ills most members judged that additional accommodation could contribute importantly to better outcomes in terms of the committees dual mandate of maximum employment and price stability
2011-09-21;2011;September;Minute;Negative;0.9895833730697632;a few suggested that the juxtaposition of higher core inflation and somewhat lower unemployment could mean that the degree of slack in labor markets and the level of potential output were lower than the committee had thought
2011-09-21;2011;September;Minute;Positive;0.9515858292579651;some argued that the rise in core inflation from very low levels reflected the accommodative stance of monetary policy and indicated that the largescale asset purchases the committee undertook from november through june had been a successful response to the deflation risks of a year ago
2011-09-21;2011;September;Minute;Neutral;0.9852550029754639;many participants judged that the risks to the outlook for inflation were roughly balanced
2011-09-21;2011;September;Minute;Negative;0.6662718057632446;some saw mediumrun inflation risks as tilted to the downside in light of persistent resource slack some others argued that the accommodative stance of monetary policy and the upward trend in measures of core inflation this year suggested inflation risks were tilted to the upside
2011-09-21;2011;September;Minute;Negative;0.6501079797744751;participants generally judged that there was relatively little risk of deflation
2011-09-21;2011;September;Minute;Neutral;0.9598901867866516;one commented that surveys showed that forecasters saw a low likelihood of deflation a second however noted that a measure of the probability of deflation calculated from prices of treasury inflationprotected securities tips had declined as the federal reserve conducted its second largescale asset purchase program but more recently had been rising
2011-09-21;2011;September;Minute;Neutral;0.9886382222175598;at the same time the committee decided to maintain its existing policy of rolling over maturing treasury securities at auction
2011-09-21;2011;September;Minute;Negative;0.9945077300071716;participants saw considerable uncertainty surrounding the outlook for a gradual pickup in economic growth
2011-09-21;2011;September;Minute;Negative;0.5202784538269043;several commented that with households and businesses seeking to reduce leverage rather than to borrow and with housing markets in distress some of the normal mechanisms through which monetary policy actions are transmitted to the real economy appeared to be attenuated
2011-09-21;2011;September;Minute;Negative;0.9935094714164734;many participants saw significant downside risks to economic growth
2011-09-21;2011;September;Minute;Negative;0.9942677021026611;while they did not anticipate a downturn in economic activity several remarked that with growth slow the recovery was more vulnerable to adverse shocks
2011-09-21;2011;September;Minute;Negative;0.9859744906425476;risks included the possibility of more pronounced or more protracted deleveraging by households the chance of a largerthanexpected nearterm fiscal tightening and potential spillovers to the united states if the financial situation in europe were to worsen appreciably
2011-09-21;2011;September;Minute;Neutral;0.9930209517478943;participants agreed to consider further how best to use their monetary policy and liquidity tools to deal with such shocks if they were to occur
2011-09-21;2011;September;Minute;Neutral;0.6507113575935364;committee policy action in the discussion of monetary policy for the period ahead most members agreed that the revisions to the economic outlook warranted some additional monetary policy accommodation to support a stronger recovery and to help ensure that inflation over time was at a level consistent with the committees dual mandate
2011-09-21;2011;September;Minute;Negative;0.9953736662864685;it was again noted that the cyclical impetus to economic expansion appeared to be weaker than in past recoveries but that the reasons for the weakness were unclear contributing to greater uncertainty about the economic outlook
2011-09-21;2011;September;Minute;Neutral;0.9647526144981384;however some noted that core as well as headline inflation had moved up on balance since last fall
2011-09-21;2011;September;Minute;Negative;0.9550831317901611;the committee also decided to keep the target range for the federal funds rate at 0 to 14 percent and to reaffirm its anticipation that economic conditionsincluding low rates of resource utilization and a subdued outlook for inflation over the medium runare likely to warrant exceptionally low levels for the federal funds rate at least through mid2013
2011-09-21;2011;September;Minute;Negative;0.9950106143951416;the committee agreed that it was important to acknowledge in the statement to be released following the meeting that economic growth remained slow and that indicators pointed to continuing weakness in overall labor market conditions
2011-09-21;2011;September;Minute;Negative;0.9930227994918823;issuance of consumer assetbacked securities moved down in august but spreads on these securities remained low
2011-09-21;2011;September;Minute;Neutral;0.882091224193573;voting for this
2011-09-21;2011;September;Minute;Neutral;0.9895753860473633;it will continue to assess the economic outlook in light of incoming information and is prepared to employ its tools as appropriate
2011-09-21;2011;September;Minute;Positive;0.9751911759376526;the committee discussed the range of policy tools available to promote a stronger economic recovery in a context of price stability
2011-09-21;2011;September;Minute;Negative;0.9875297546386719;the committee also decided to keep the target range for the federal funds rate at 0 to 14 percent and currently anticipates that economic conditionsincluding low rates of resource utilization and a subdued outlook for inflation over the medium runare likely to warrant exceptionally low levels for the federal funds rate at least through mid2013
2011-09-21;2011;September;Minute;Neutral;0.9893165826797485;in addition the committee will maintain its existing policy of rolling over maturing treasury securities at auction
2011-09-21;2011;September;Minute;Neutral;0.9863514304161072;to help support conditions in mortgage markets the committee will now reinvest principal payments from its holdings of agency debt and agency mortgagebacked securities in agency mortgagebacked securities
2011-09-21;2011;September;Minute;Neutral;0.9859819412231445;the committee will regularly review the size and composition of its securities holdings and is prepared to adjust those holdings as appropriate
2011-09-21;2011;September;Minute;Neutral;0.9898056983947754;the committee intends to purchase by the end of june 2012 400 billion of treasury securities with remaining maturities of 6 years to 30 years and to sell an equal amount of treasury securities with remaining maturities of 3 years or less
2011-09-21;2011;September;Minute;Neutral;0.7944231033325195;to support a stronger economic recovery and to help ensure that inflation over time is at levels consistent with the dual mandate the committee decided today to extend the average maturity of its holdings of securities
2011-09-21;2011;September;Minute;Neutral;0.9857256412506104;however the committee will continue to pay close attention to the evolution of inflation and inflation expectations
2011-09-21;2011;September;Minute;Neutral;0.9778512120246887;the committee also anticipates that inflation will settle over coming quarters at levels at or below those consistent with the committees dual mandate as the effects of past energy and other commodity price increases dissipate further
2011-09-21;2011;September;Minute;Negative;0.9893577694892883;moreover there are significant downside risks to the economic outlook including strains in global financial markets
2011-09-21;2011;September;Minute;Negative;0.9484904408454895;the committee continues to expect some pickup in the pace of recovery over coming quarters but anticipates that the unemployment rate will decline only gradually toward levels that the committee judges to be consistent with its dual mandate
2011-09-21;2011;September;Minute;Neutral;0.8732967972755432;consistent with its statutory mandate the committee seeks to foster maximum employment and price stability
2011-09-21;2011;September;Minute;Positive;0.9655691385269165;longerterm inflation expectations have remained stable
2011-09-21;2011;September;Minute;Negative;0.9933388829231262;inflation appears to have moderated since earlier in the year as prices of energy and some commodities have declined from their peaks
2011-09-21;2011;September;Minute;Negative;0.5379511713981628;it also agreed to note that inflation appeared to have moderated since earlier in the year as prices of energy and some commodities had declined from their recent peaks and that longerterm inflation expectations remained stable
2011-09-21;2011;September;Minute;Negative;0.9935158491134644;members generally continued to expect some pickup in the pace of the economic recovery over coming quarters but anticipated that the unemployment rate would decline only gradually and agreed that there were significant downside risks to the economic outlook including strains in global financial markets
2011-09-21;2011;September;Minute;Neutral;0.914836585521698;the committee again anticipated that inflation would settle over coming quarters at levels at or below those consistent with the committees mandate as the effects of past energy and commodity price increases dissipate further
2011-09-21;2011;September;Minute;Neutral;0.7765012383460999;at the conclusion of the discussion the committee voted to authorize and direct the federal reserve bank of new york until it was instructed otherwise to execute transactions in the system account in accordance with the following domestic policy directive the federal open market committee seeks monetary and financial conditions that will foster price stability and promote sustainable growth in output
2011-09-21;2011;September;Minute;Neutral;0.9889217615127563;to further its longrun objectives the committee seeks conditions in reserve markets consistent with federal funds trading in a range from 0 to 14 percent
2011-09-21;2011;September;Minute;Neutral;0.9927797913551331;the committee directs the desk to purchase by the end of june 2012 treasury securities with remaining maturities of approximately 6 years to 30 years with a total face value of 400 billion and to sell treasury securities with remaining maturities of 3 years or less with a total face value of 400 billion
2011-09-21;2011;September;Minute;Neutral;0.9888357520103455;a couple of members noted that they would prefer to change the committees forward guidance to provide greater clarity about the economic conditions that would be likely to warrant maintaining exceptionally low levels of the target federal funds rate but no decision was taken on this point
2011-09-21;2011;September;Minute;Neutral;0.9874328970909119;the committee also directs the desk to maintain its existing policy of rolling over maturing treasury securities into new issues and to reinvest principal payments on all agency debt and agency mortgagebacked securities in the system open market account in agency mortgagebacked securities in order to maintain the total face value of domestic securities at approximately 26 trillion
2011-09-21;2011;September;Minute;Neutral;0.9879816174507141;the system open market account manager and the secretary will keep the committee informed of ongoing developments regarding the systems balance sheet that could affect the attainment over time of the committees objectives of maximum employment and price stability
2011-09-21;2011;September;Minute;Negative;0.9930160045623779;the vote encompassed approval of the statement below to be released at 215 pm information received since the federal open market committee met in august indicates that economic growth remains slow
2011-09-21;2011;September;Minute;Negative;0.9943846464157104;recent indicators point to continuing weakness in overall labor market conditions and the unemployment rate remains elevated
2011-09-21;2011;September;Minute;Negative;0.9823926687240601;household spending has been increasing at only a modest pace in recent months despite some recovery in sales of motor vehicles as supplychain disruptions eased
2011-09-21;2011;September;Minute;Negative;0.9946309328079224;investment in nonresidential structures is still weak and the housing sector remains depressed
2011-09-21;2011;September;Minute;Positive;0.6111712455749512;however business investment in equipment and software continues to expand
2011-09-21;2011;September;Minute;Neutral;0.9904356002807617;the committee directs the desk to engage in dollar roll transactions as necessary to facilitate settlement of the federal reserves agency mbs transactions
2011-09-21;2011;September;Minute;Negative;0.9958459734916687;several suggested that slowing growth in the united states and abroad made a new surge in commodity prices unlikely
2011-09-21;2011;September;Minute;Positive;0.9807074666023254;this program should put downward pressure on longerterm interest rates and help make broader financial conditions more accommodative
2011-09-21;2011;September;Minute;Neutral;0.913491427898407;longerterm inflation expectations had remained stable
