Date;Year;Month;Type;sentiment;sentiment_score;sentence
2008-07-24;2008;July;Minute;Negative;0.9902892112731934;some surveybased measures of yearahead inflation expectations moved up sharply in recent months longerterm inflation expectations were little changed recently but remained above their levels at the end of 2007 excluding food and energy sharp increases in the prices of products and services at earlier stages of processing continued to put upward pressures on business costs and consumer prices
2008-07-24;2008;July;Minute;Positive;0.990662157535553;real gdp growth in china moderated but remained strong
2008-07-24;2008;July;Minute;Neutral;0.9898651242256165;excluding these categories core consumer price inflation was elevated in june but on balance was running this year at about the same rate as last year
2008-07-24;2008;July;Minute;Neutral;0.4887174963951111;headline consumer price inflation in the united states stepped up in recent months largely as a result of sizable increases in food and energy prices
2008-07-24;2008;July;Minute;Negative;0.987414538860321;headline inflation rose further in much of the developing world largely owing to higher food and energy prices and several countries continued to face upward pressure on core inflation as well
2008-07-24;2008;July;Minute;Negative;0.995360791683197;incoming data suggested further slowing elsewhere in emerging asia and secondquarter activity appeared to have remained sluggish in mexico
2008-07-24;2008;July;Minute;Positive;0.3933633863925934;most major categories of nonoil imports rose in may imports of consumer goods increased rapidly
2008-07-24;2008;July;Minute;Negative;0.9850739240646362;weak secondquarter data on industrial production and sentiment in the euro area as well as on consumer expenditures and exports in japan suggested that the firstquarter strength in output growth was not sustained
2008-07-24;2008;July;Minute;Neutral;0.9693928360939026;in all the major advanced foreign economies rising food and fuel prices continued to drive overall inflation to recent highs but core measures of inflation generally rose only modestly
2008-07-24;2008;July;Minute;Negative;0.9939799308776855;conditions worsened considerably in the united kingdom with a deepening slump in the housing sector
2008-07-24;2008;July;Minute;Negative;0.993334174156189;across the advanced foreign economies information received since the last meeting pointed to subdued growth in the second quarter and increasing inflation pressures
2008-07-24;2008;July;Minute;Positive;0.9899411797523499;the increase in exports was supported by strong exports of industrial supplies particularly petroleum products and services
2008-07-24;2008;July;Minute;Positive;0.981451690196991;unit labor costs apparently continued to increase at a restrained pace during the second quarter reflecting only moderate gains in worker compensation and relatively strong productivity performance with little sign of higher overall inflation passing through to higher worker compensation
2008-07-24;2008;July;Minute;Negative;0.9940128922462463;in contrast the value of petroleum imports fell back despite higher prices and imports of automotive products also fell
2008-07-24;2008;July;Minute;Negative;0.9947339296340942;recent indicators for emerging market economies pointed to some slowing of growth in the second quarter
2008-07-24;2008;July;Minute;Neutral;0.984557032585144;at its june 2425 meeting the federal open market committee fomc kept its target for the federal funds rate at 2 percent
2008-07-24;2008;July;Minute;Neutral;0.798846960067749;although the decision was largely anticipated the policy statement was reportedly viewed by investors as placing more emphasis on the downside risks to growth than they had anticipated
2008-07-24;2008;July;Minute;Negative;0.9920557141304016;however labor markets softened further and financial markets remained under considerable stress
2008-07-24;2008;July;Minute;Positive;0.9807230830192566;depository institutions use of both overnight and term primary credit borrowing continued to be strong during the intermeeting period peaking in late june amid quarterend pressures
2008-07-24;2008;July;Minute;Negative;0.8302193880081177;the us international trade deficit narrowed in may as a large increase in exports of goods and services more than offset a moderate increase in imports
2008-07-24;2008;July;Minute;Positive;0.9827782511711121;spreads of the london interbank offered rate or libor over comparablematurity overnight index swap rates were unchanged to slightly higher and spreads on lowerrated nonfinancial and assetbacked commercial paper remained well above historical norms
2008-07-24;2008;July;Minute;Negative;0.9950131773948669;functioning in the interbank funding markets remained strained over the intermeeting period
2008-07-24;2008;July;Minute;Negative;0.745078444480896;measures of shorterhorizon inflation compensation derived from yields on inflationindexed treasury securities dropped over the intermeeting period as energy prices reversed some of their earlier rise while measures of longerterm inflation compensation rose slightly
2008-07-24;2008;July;Minute;Negative;0.8454591631889343;yields on longterm treasury securities declined less than those on shorterterm instruments and the yield curve steepened
2008-07-24;2008;July;Minute;Negative;0.8481360077857971;consistent with the revision in policy expectations yields on short and mediumterm nominal treasury coupon securities fell over the intermeeting period
2008-07-24;2008;July;Minute;Negative;0.9949435591697693;subsequently the semiannual monetary policy report to the congress and the accompanying testimony also led investors to mark down the expected path for the federal funds rate as did intensifying concerns about the health of financial institutions and the outlook for the housingrelated governmentsponsored enterprises gses
2008-07-24;2008;July;Minute;Neutral;0.945101261138916;the markets expected path of monetary policy moved down following the announcement of the committees decision at its june meeting to leave the target federal funds rate unchanged
2008-07-24;2008;July;Minute;Neutral;0.7232626080513;the committee indicated that it would continue to monitor economic and financial developments and would act as needed to promote sustainable economic growth and price stability
2008-07-24;2008;July;Minute;Negative;0.9619450569152832;although downside risks to growth remained they appeared to have diminished somewhat and the upside risks to inflation and inflation expectations increased
2008-07-24;2008;July;Minute;Positive;0.9894075989723206;the committee stated that the substantial easing of monetary policy to date combined with ongoing measures to foster market liquidity should help promote moderate growth over time
2008-07-24;2008;July;Minute;Negative;0.9931513071060181;however in light of the continued increases in the prices of energy and some other commodities and the elevated state of some indicators of inflation expectations uncertainty about the inflation outlook remained high
2008-07-24;2008;July;Minute;Neutral;0.981631338596344;the committee expected inflation to moderate later this year and next
2008-07-24;2008;July;Minute;Negative;0.9943215847015381;tight credit conditions the ongoing housing contraction and the rise in energy prices were likely to weigh on economic growth over the next few quarters
2008-07-24;2008;July;Minute;Positive;0.6489691734313965;the committees statement noted that recent information indicated that overall economic activity continued to expand partly because of some firming in household spending
2008-07-24;2008;July;Minute;Negative;0.8593740463256836;the ratio of bookvalue inventories to sales excluding motor vehicles ticked down again in may
2008-07-24;2008;July;Minute;Negative;0.9948116540908813;industrial production declined in the second quarter after having been flat over the previous two quarters
2008-07-24;2008;July;Minute;Negative;0.9946803450584412;however vacancy rates for commercial properties ticked up in the first quarter and the architectural billings index registered a string of weak readings from february to june
2008-07-24;2008;July;Minute;Neutral;0.9182299375534058;the unemployment rate rose in july and was about 1 percentage point above its level of a year earlier while the labor force participation rate was about unchanged
2008-07-24;2008;July;Minute;Neutral;0.6507428288459778;both the average workweek and aggregate hours edged down in july
2008-07-24;2008;July;Minute;Neutral;0.9436711668968201;nonbusiness services which include health and education remained the only notable source of net additions to employment
2008-07-24;2008;July;Minute;Neutral;0.9889816641807556;by industry the pattern of job losses was roughly similar to those earlier in the year although julys report showed a smaller decline in construction than earlier
2008-07-24;2008;July;Minute;Negative;0.9926359057426453;private nonfarm payroll employment fell in july at a pace only a bit less than the average monthly rate during the first six months of the year
2008-07-24;2008;July;Minute;Negative;0.7085040807723999;labor demand continued to contract in july
2008-07-24;2008;July;Minute;Neutral;0.9676731824874878;core consumer price inflation remained relatively stable while headline inflation was elevated as a result of large increases in food and energy prices
2008-07-24;2008;July;Minute;Negative;0.9938850998878479;however residential construction continued to fall sharply the labor market weakened further and industrial production declined
2008-07-24;2008;July;Minute;Positive;0.9906648397445679;both consumer and business spending recorded gains in the second quarter and net exports contributed importantly to the rise in real gross domestic product gdp
2008-07-24;2008;July;Minute;Negative;0.9442600607872009;the information reviewed at the august meeting indicated that the economy expanded at a moderate pace in the second quarter but recent financial market developments highlighted some of the stresses that the economy faced going forward
2008-07-24;2008;July;Minute;Neutral;0.9848207831382751;by unanimous vote the committee ratified these transactions
2008-07-24;2008;July;Minute;Neutral;0.9888836741447449;the manager also reported on developments in domestic financial markets and on system open market operations in government securities and federal agency obligations during the period since the previous meeting
2008-07-24;2008;July;Minute;Neutral;0.9813903570175171;there were no open market operations in foreign currencies for the systems account in the period since the previous meeting
2008-07-24;2008;July;Minute;Neutral;0.984740674495697;the manager of the system open market account reported on recent developments in foreign exchange markets
2008-07-24;2008;July;Minute;Neutral;0.9647376537322998;however new extensions of credit through the primary dealer credit facility pdcf were negligible during july
2008-07-24;2008;July;Minute;Negative;0.9920499920845032;motor vehicle assemblies tumbled in the second quarter because of soft demand and the effects of strikes
2008-07-24;2008;July;Minute;Negative;0.9941157102584839;production of hightech equipment continued to expand at a moderate pace however the available indicators of hightech manufacturing activity pointed to slower production in the current quarter
2008-07-24;2008;July;Minute;Negative;0.9929513335227966;the output of other manufacturing industries contracted on balance in the second quarter and indicators of nearterm production generally pointed to further declines including a sizable retrenchment in the scheduled production of motor vehicles
2008-07-24;2008;July;Minute;Positive;0.971322238445282;the factory utilization rate held steady in june at a rate below its longrun average but was still well above its low rate from 2001 through 2002 real personal consumption expenditures pce rose modestly in the second quarter after posting weak gains in the previous two quarters
2008-07-24;2008;July;Minute;Positive;0.9921667575836182;data through june continued to show a robust increase in nonresidential construction activity
2008-07-24;2008;July;Minute;Positive;0.8481680750846863;spending on computers and software rose at a moderate rate in the second quarter while outlays on other equipment improved a bit last quarter after having declined in the preceding two quarters
2008-07-24;2008;July;Minute;Negative;0.9949454665184021;in the business sector real spending on equipment and software declined in the second quarter as outlays on transportation equipment dropped sharply
2008-07-24;2008;July;Minute;Negative;0.9952282905578613;house prices remained on a downward trajectory
2008-07-24;2008;July;Minute;Negative;0.9936366081237793;tight conditions in the mortgage credit markets continued to restrain housing demand particularly for borrowers seeking nonconforming mortgages
2008-07-24;2008;July;Minute;Negative;0.9912352561950684;sales of existing singlefamily homes fell in june
2008-07-24;2008;July;Minute;Negative;0.9953733086585999;even though cuts in new construction continued to trim the level of new home inventories the months supply of new homes remained quite high because of the ongoing reductions in the demand for new houses
2008-07-24;2008;July;Minute;Negative;0.9926048517227173;real nonfarm inventories excluding motor vehicles fell sharply in the second quarter
2008-07-24;2008;July;Minute;Neutral;0.961967408657074;however available information suggested that this increase could be traced to morestringent building codes that took effect in new york city on july 1 which apparently led developers to move up some planned apartment projects
2008-07-24;2008;July;Minute;Negative;0.9947614073753357;singlefamily housing starts fell further in june leaving the pace of construction in this sector well below its december reading
2008-07-24;2008;July;Minute;Negative;0.9882291555404663;residential construction activity continued to descend rapidly but at a somewhat slower pace than during the second half of last year
2008-07-24;2008;July;Minute;Negative;0.9959138035774231;consumer sentiment rose a bit in july but remained at a depressed level
2008-07-24;2008;July;Minute;Negative;0.9947695136070251;the ratio of wealth to income likely declined again in the second quarter as equity prices declined on balance and house prices continued to fall
2008-07-24;2008;July;Minute;Neutral;0.9730991721153259;tax rebates provided a notable albeit temporary boost to income since the end of april but real disposable income excluding rebates was essentially flat in the second quarter
2008-07-24;2008;July;Minute;Negative;0.994907557964325;sales of motor vehicles which had begun to weaken earlier in the year fell sharply in june and again in july
2008-07-24;2008;July;Minute;Negative;0.9612115025520325;however real outlays for goods other than motor vehicles dropped noticeably in june after three months of robust gains
2008-07-24;2008;July;Minute;Positive;0.9726992845535278;starts of multifamily homes jumped in june to a level well above the range of readings seen over the past two years
2008-07-24;2008;July;Minute;Positive;0.987363874912262;on july 30 the board of governors and the fomc announced enhancements to existing liquidity facilities including extension of the pdcf and the term securities lending facility through january 30 2009 conditions in the market for treasury repurchase agreements were fairly stable although there was some deterioration of conditions in the market for agency collateral
2008-07-24;2008;July;Minute;Neutral;0.9450600147247314;on july 13 the treasury department proposed a plan to support the liquidity and solvency of the two gses and the board of governors of the federal reserve system announced that the federal reserve bank of new york was authorized to lend to the two institutions if necessary reducing somewhat market concerns about the gses
2008-07-24;2008;July;Minute;Negative;0.9947985410690308;corporate bond issuance slowed further as did lending by banks to businesses and households and issuance of leveraged loans remained very weak
2008-07-24;2008;July;Minute;Negative;0.8800789713859558;however others viewed these risks as having increased particularly in light of continued elevated readings on headline inflation the low level of the real federal funds rate anecdotal information suggesting that firms were having more success in passing higher costs on to their customers and some signs of an upward drift over recent months in investors expectations and uncertainty regarding inflation over the longer run moreover the recent decline in energy prices might well be reversed in coming months
2008-07-24;2008;July;Minute;Negative;0.9945986270904541;some viewed the upside risks to inflation as having diminished modestly over the intermeeting period mainly as a result of the drop in the prices of oil and some other commodities as well as the greater likelihood of persistent economic slack
2008-07-24;2008;July;Minute;Negative;0.994327962398529;participants expressed significant concerns about the upside risks to inflation especially the risk that persistently high headline inflation could result in an unmooring of longrun inflation expectations
2008-07-24;2008;July;Minute;Neutral;0.9448270201683044;and a number of participants noted that the outlook for slack in resource utilization should tend to limit the extent of passthrough contain the degree of inflation spillover to goods and services without high commodity content and reinforce the anticipated moderation in inflation
2008-07-24;2008;July;Minute;Negative;0.9945350885391235;however one participant mentioned the difficult pricing decisions of manufacturers who face a combination of elevated input costs along with weakening demand for their products
2008-07-24;2008;July;Minute;Neutral;0.8777119517326355;although measures of core inflation might well edge up later this year given the passthrough to final goods prices of earlier increases in the prices of energy and other inputs most participants anticipated that core inflation would edge back down during 2009 some participants reported that firms were increasingly using various pricing strategiessuch as escalation clauses or the imposition of fuel surchargesto pass higher costs on to their customers who were apparently becoming less resistant to such price adjustments
2008-07-24;2008;July;Minute;Neutral;0.9619606733322144;headline inflation was generally expected to moderate in coming quarters reflecting importantly an anticipated levelingout of prices for energy and other commodities
2008-07-24;2008;July;Minute;Neutral;0.9646198153495789;in contrast several other participants suggested that risks to the financial system had receded partly as a result of the implementation by the federal reserve of special liquidity facilities and that prevailing credit conditions were broadly consistent with the typical patterns observed during periods of weak growth or recession
2008-07-24;2008;July;Minute;Negative;0.9944249391555786;many participants noted that the financial system remained fragile with some expressing continued concern about the possibility of an adverse feedback loop in which tighter conditions in the mortgage market would contribute to further declines in the housing sector and additional losses for lenders leading to further tightening of lending terms and standards
2008-07-24;2008;July;Minute;Negative;0.9897873401641846;participants pointed to potential interactions between financial stresses and the housing market contraction as the primary source of continuing downside risks to growth
2008-07-24;2008;July;Minute;Negative;0.9956918358802795;indeed recent indications of a slowing global economy may have contributed to the marked declines in the prices of oil and some other commodities over the intermeeting period
2008-07-24;2008;July;Minute;Negative;0.9948093891143799;however many participants observed that decelerating activity in some foreign economies would tend to dampen export gains going forward
2008-07-24;2008;July;Minute;Positive;0.9919663667678833;growth in exports had provided substantial impetus to overall demand in the second quarter
2008-07-24;2008;July;Minute;Positive;0.9897211194038391;however the elevated level of energy prices was boosting investment in the oilproducing industry
2008-07-24;2008;July;Minute;Negative;0.9933381080627441;moreover some signs of weakness in the commercial real estate sector were seen as suggesting a slower pace of investment in nonresidential structures over coming quarters although that deceleration might be gradual due to the lags in the planning and execution of such projects
2008-07-24;2008;July;Minute;Negative;0.9923491477966309;a number of participants worried about the possibility that core inflation might fail to moderate next year unless the stance of monetary policy was tightened sooner than currently anticipated by financial markets
2008-07-24;2008;July;Minute;Negative;0.9934777021408081;all of these factorsin conjunction with tightened access to auto loans home equity lines of credit and other consumer loanswere viewed as pointing towards weak growth in personal consumption expenditures during the second half of 2008 the weaker outlook for consumer demand along with tighter credit conditions for businesses was expected to weigh on business spending going forward
2008-07-24;2008;July;Minute;Negative;0.9941258430480957;in addition members saw continuing downside risks to this outlook particularly reflecting possible further deterioration in financial conditions
2008-07-24;2008;July;Minute;Neutral;0.9449355602264404;against this backdrop nearly all members judged that leaving the federal funds rate unchanged at this meeting was appropriate and would most effectively promote progress toward the committees dual objectives of maximum employment and price stability
2008-07-24;2008;July;Minute;Negative;0.956214189529419;in longerterm credit markets yields on both investment and speculativegrade corporate bonds rose over the intermeeting period even though comparablematurity treasury yields declined slightly which resulted in a widening of already elevated spreads
2008-07-24;2008;July;Minute;Neutral;0.9288923144340515;votes for this action
2008-07-24;2008;July;Minute;Neutral;0.8524845838546753;the committee will continue to monitor economic and financial developments and will act as needed to promote sustainable economic growth and price stability
2008-07-24;2008;July;Minute;Negative;0.991878867149353;although downside risks to growth remain the upside risks to inflation are also of significant concern to the committee
2008-07-24;2008;July;Minute;Negative;0.9855504035949707;the committee expects inflation to moderate later this year and next year but the inflation outlook remains highly uncertain
2008-07-24;2008;July;Minute;Negative;0.9118224382400513;inflation has been high spurred by the earlier increases in the prices of energy and some other commodities and some indicators of inflation expectations have been elevated
2008-07-24;2008;July;Minute;Positive;0.9885725975036621;over time the substantial easing of monetary policy combined with ongoing measures to foster market liquidity should help to promote moderate economic growth
2008-07-24;2008;July;Minute;Negative;0.9930860996246338;tight credit conditions the ongoing housing contraction and elevated energy prices are likely to weigh on economic growth over the next few quarters
2008-07-24;2008;July;Minute;Negative;0.9940639138221741;however labor markets have softened further and financial markets remain under considerable stress
2008-07-24;2008;July;Minute;Positive;0.9900817275047302;economic activity expanded in the second quarter partly reflecting growth in consumer spending and exports
2008-07-24;2008;July;Minute;Neutral;0.985991895198822;the vote encompassed approval of the statement below to be released at 215 pm the federal open market committee decided today to keep its target for the federal funds rate at 2 percent
2008-07-24;2008;July;Minute;Neutral;0.9708858132362366;to further its longrun objectives the committee in the immediate future seeks conditions in reserve markets consistent with maintaining the federal funds rate at an average of around 2 percent
2008-07-24;2008;July;Minute;Neutral;0.7765012383460999;at the conclusion of the discussion the committee voted to authorize and direct the federal reserve bank of new york until it was instructed otherwise to execute transactions in the system account in accordance with the following domestic policy directive the federal open market committee seeks monetary and financial conditions that will foster price stability and promote sustainable growth in output
2008-07-24;2008;July;Minute;Neutral;0.9666787385940552;although members generally anticipated that the next policy move would likely be a tightening the timing and extent of any change in policy stance would depend on evolving economic and financial developments and the implications for the outlook for economic growth and inflation
2008-07-24;2008;July;Minute;Negative;0.9888380765914917;most members did not see the current stance of policy as particularly accommodative given that many households and businesses were facing elevated borrowing costs and reduced credit availability due to the effects of financial market strains as well as macroeconomic risks
2008-07-24;2008;July;Minute;Negative;0.8757040500640869;members generally anticipated that inflation would moderate however they emphasized the risks to the inflation outlook posed by persistent high readings on headline inflation and a possible unmooring of inflation expectations
