Date;Year;Month;Type;sentiment;sentiment_score;sentence
2008-07-24;2008;July;Minute;Negative;0.9614214897155762;lower equity prices and the ongoing deterioration in house prices had reduced household wealth significantly while real incomes had been diminished by earlier increases in the prices of food and energy
2008-07-24;2008;July;Minute;Negative;0.9933505654335022;in the committees discussion of monetary policy for the intermeeting period members agreed that labor markets had softened further that financial markets remained under considerable stress and that these factorsin conjunction with stillelevated energy prices and the ongoing housing contractionwould likely weigh on economic growth in coming quarters
2008-07-24;2008;July;Minute;Negative;0.9905146360397339;the unemployment rate jumped during the intermeeting period and participants generally anticipated that payroll employment would decline further in coming months
2008-07-24;2008;July;Minute;Positive;0.8379181623458862;nonetheless real gdp growth was anticipated to return to its potential rate in the second half of 2009 as housing activity leveled out and financial conditions became less restrictive
2008-07-24;2008;July;Minute;Negative;0.9732199311256409;all told the staff continued to expect that real gdp would rise at less than its potential rate through the first half of next year
2008-07-24;2008;July;Minute;Negative;0.9928592443466187;in the forecast prepared for the meeting the staff marked down its forecast of real gdp growth in the second half of 2008 and in 2009 although the increase in real gdp in the second quarter was a bit faster than anticipated at the time of the june meeting the labor market continued to weaken significantly financial conditions remained unfavorable consumer and business confidence was downbeat and manufacturing activity was contracting
2008-07-24;2008;July;Minute;Positive;0.9741088151931763;the expansion was broad based reflecting an acceleration in liquid deposits as well as renewed inflows to retail money market mutual funds and small time deposits
2008-07-24;2008;July;Minute;Positive;0.710816502571106;m2 expanded at a moderate pace in july reversing the deceleration in may and june
2008-07-24;2008;July;Minute;Neutral;0.7962971329689026;the tradeweighted index of the dollar against the currencies of major trading partners rose a bit on net
2008-07-24;2008;July;Minute;Positive;0.7562128305435181;pressures in the money markets of many major foreign economies eased slightly over the intermeeting period
2008-07-24;2008;July;Minute;Negative;0.7800596952438354;core pce price inflation was expected to pick up somewhat in the second half of this year mostly as a result of the upward pressures from this years runups in prices of energy and imports
2008-07-24;2008;July;Minute;Negative;0.994988203048706;in the secondary market issuance of mortgagebacked securities by gses appeared to have slowed in july from its strong secondquarter pace while issuance of securities backed by nonconforming loans and of commercial mortgagebacked securities remained nil
2008-07-24;2008;July;Minute;Positive;0.9224854111671448;over the intermeeting period spreads of rates on conforming residential mortgages over those on comparablematurity treasury securities moved higher
2008-07-24;2008;July;Minute;Positive;0.4366503953933716;concerns eased further as congress passed legislation which was subsequently signed by the president authorizing the treasury to provide liquidity and capital to the gses
2008-07-24;2008;July;Minute;Negative;0.9931023120880127;uncertainties about the financial condition of fannie mae and freddie mac added to market worries about the potential consequences of financial strains for the broader economy over the intermeeting period
2008-07-24;2008;July;Minute;Negative;0.9918006062507629;energy sector stocks significantly underperformed the broad indexes owing to recent declines in oil prices
2008-07-24;2008;July;Minute;Positive;0.9595953822135925;stock prices of financial firms fell sharply in midjuly but subsequently recouped most of those losses
2008-07-24;2008;July;Minute;Neutral;0.9288066029548645;for example automotive parts suppliers in one district had reported plans for laying off workers idling production and closing several plants
2008-07-24;2008;July;Minute;Negative;0.964536190032959;broad equity price indexes were volatile and declined modestly on net between the june and august fomc meetings
2008-07-24;2008;July;Minute;Negative;0.9929572343826294;offer rates on 30year jumbo mortgages also rose and credit for nonconforming mortgages remained difficult to obtain
2008-07-24;2008;July;Minute;Neutral;0.6566004157066345;core inflation was then expected to edge down in 2009 as the impetus from prior increases in the prices of imports energy and other commodities abated and the margin of slack in resource use widened
2008-07-24;2008;July;Minute;Negative;0.9925645589828491;yields on sovereign debt in the advanced foreign economies fell mainly because of declines in inflation compensation
2008-07-24;2008;July;Minute;Negative;0.9929827451705933;in their discussion of the economic situation and outlook many fomc participants noted that recent developments suggested that economic activity was likely to remain damped for several quarters
2008-07-24;2008;July;Minute;Negative;0.9947671890258789;while consumer spending had been bolstered temporarily by the effects of the tax rebates retail sales had weakened during late spring and auto sales had dropped sharply in both june and july
2008-07-24;2008;July;Minute;Negative;0.9950042366981506;many participants believed that these developments were likely to restrain aggregate demand and economic growth
2008-07-24;2008;July;Minute;Negative;0.9901264905929565;moreover broad equity price indexes had declined and borrowing costs for nonfinancial firms had increased including a recent rise in corporate bond yields across most risk categories
2008-07-24;2008;July;Minute;Negative;0.9939496517181396;while some financial institutions had strengthened their balance sheets with new capital issues raising new capital had become increasingly difficult
2008-07-24;2008;July;Minute;Negative;0.9928522706031799;declining mortgage asset values increased capital pressures on lenders exposed to real estate markets
2008-07-24;2008;July;Minute;Negative;0.7809731364250183;commercial banks had reported that terms and standards had been tightened on nearly all categories of loans
2008-07-24;2008;July;Minute;Negative;0.9948824644088745;reflecting these strains interest rates on residential mortgages had moved upward a development that was seen as potentially exacerbating the contraction in the housing sector
2008-07-24;2008;July;Minute;Negative;0.9938680529594421;heightened investor apprehension about the viability of fannie mae and freddie mac had eased following legislative action but pressures on these firms continued
2008-07-24;2008;July;Minute;Positive;0.5652576088905334;others however thought that the extent of such adverse effects was likely to be limited noting that bank lending had continued to grow at a moderate pace and that consumption and business capital spending had increased in the second quarter despite the tightening of credit terms
2008-07-24;2008;July;Minute;Negative;0.9949067234992981;however participants also expressed significant concerns about the upside risks to inflation particularly the risk that longerterm inflation expectations could become unmoored
2008-07-24;2008;July;Minute;Neutral;0.9802058935165405;accordingly most participants anticipated that inflation would moderate in coming quarters
2008-07-24;2008;July;Minute;Negative;0.9957503080368042;recent readings on inflation had been high but growth in unit labor costs had remained subdued and commodity prices had declined of late
2008-07-24;2008;July;Minute;Negative;0.9922115802764893;growth in overall economic activity was generally expected to be weak during the remainder of 2008 before recovering modestly next year and nearly all meeting participants saw continuing downside risks to growth
2008-07-24;2008;July;Minute;Negative;0.9933985471725464;moreover increasing concerns about financial institutions had contributed to a widening of some risk spreads and a further tightening of credit to households and businesses
2008-07-24;2008;July;Minute;Negative;0.994204580783844;although economic growth in the second quarter had apparently been boosted by fiscal stimulus resilience in consumption spending even before tax rebates were distributed and robust gains in exports recent indicators pointed to a nearterm deceleration in household spending and to softer export demand
2008-07-24;2008;July;Minute;Negative;0.8696166276931763;many participants referred to the adverse financial sector developments that had occurred over the intermeeting period
