Date;Year;Month;Type;sentiment;sentiment_score;sentence
2024-08-01;2024;August;Monetary Policy Decisions;Negative;0.990712344646454;looking ahead trade tensions and geopolitical uncertainty will continue to pose headwinds for the manufacturing sector
2024-08-01;2024;August;Monetary Policy Decisions;Positive;0.9827588200569152;however positive factors supporting the recovery in economic activity persist
2024-08-01;2024;August;Monetary Policy Decisions;Positive;0.9870457649230956;these include the continued strengthening of real incomes amid lower inflation and a favourable labour market the increasing momentum of the services sector and the gradually fading drag of monetary policy on demand expected over timechart 4pmi indicators across sectors of the economya manufacturingb servicesdiffusion indicesdiffusion indicessource sp global market intelligencenote the latest observations are for june 2024employment continues to increase supported by a growing labour force
2024-08-01;2024;August;Monetary Policy Decisions;Neutral;0.9318126440048218;employment and total hours worked rose by 03 quarter on quarter in the first quarter of 2024 chart 5
2024-08-01;2024;August;Monetary Policy Decisions;Neutral;0.9840436577796936;labour productivity remained unchanged as employment and hours worked increased at the same rate as gdp
2024-08-01;2024;August;Monetary Policy Decisions;Positive;0.9554799199104308;3 the implicit labour force inferred from the unemployment rate and the number of unemployed increased by 05 up to may this year and has been an important source of employment growth
2024-08-01;2024;August;Monetary Policy Decisions;Neutral;0.7221500873565674;the unemployment rate stood at 64 in may unchanged from april remaining at its lowest level since the euro was introduced
2024-08-01;2024;August;Monetary Policy Decisions;Negative;0.9273867011070251;labour demand remains at high levels although the job vacancy rate fell slightly in the first quarter of 2024 to 28 01 percentage points lower than in the previous quartershortterm labour market indicators point to ongoing employment growth in the second quarter of 2024 the monthly composite pmi employment indicator declined from 521 in may to 509 in june
2024-08-01;2024;August;Monetary Policy Decisions;Neutral;0.9421324729919434;the secondquarter average stands at 517 suggesting a further increase in employment chart 5
2024-08-01;2024;August;Monetary Policy Decisions;Neutral;0.7079838514328003;the positive perceptions of employment growth have been driven by the services sector as construction and manufacturing remain in contractionary territorychart 5euro area employment the pmi assessment of employment and the unemployment ratelefthand scale quarteronquarter percentage changes diffusion index righthand scale percentages of the labour forcesources eurostat sp global market intelligence and ecb calculationsnotes the two lines indicate monthly developments while the bars show quarterly data
2024-08-01;2024;August;Monetary Policy Decisions;Positive;0.9912303686141968;private consumption grew by 02 in the first quarter supported by a rebound in the consumption of goods having shown very weak dynamics in 2023 real disposable incomes increased in the first quarter of 2024 supported by the decline in inflation and robust nominal wage growth amid a resilient labour market
2024-08-01;2024;August;Monetary Policy Decisions;Negative;0.9791133999824524;the household saving ratio increased to 153 in the first quarter of 2024 chart 6 panel a as the gains in income were made against a background of still elevated uncertainty and restrictive financing conditions including tight standards for consumer credit
2024-08-01;2024;August;Monetary Policy Decisions;Negative;0.980144739151001;at the same time the ecbs assessment of the main findings from its recent contacts with nonfinancial companies points to a bottoming out of aggregate manufacturing activity see 
2024-08-01;2024;August;Monetary Policy Decisions;Positive;0.9917519688606262;surveys suggest that household spending growth will strengthen in the near term
2024-08-01;2024;August;Monetary Policy Decisions;Negative;0.9568666815757751;the european commissions consumer uncertainty indicator declined and the consumer confidence indicator improved in june
2024-08-01;2024;August;Monetary Policy Decisions;Negative;0.9950196743011476;however the latter is still below its prepandemic average reflecting subdued expectations for the economy and households own financial situations
2024-08-01;2024;August;Monetary Policy Decisions;Positive;0.9571408033370972;business expectations for demand in contactintensive services over the next three months remain strong while expected major purchases by consumers over the next 12 months have recovered to their prepandemic average chart 6 panel b
2024-08-01;2024;August;Monetary Policy Decisions;Neutral;0.9537460803985596;this evidence of an expected reduction in the divergence between consumer goods and services is supported by the results of the ecbs latest consumer expectations survey which indicate that the propensity to spend on major items over the next 12 months is rising while expected demand for tourist services remains highchart 6private consumption income and savings expectations for retail trade contactintensive services and major purchasesa consumption income and savingsb expectationsindex q4 2019  100 percentstandardised percentage balancessources eurostat european commission and ecb calculationsnotes in panel a income refers to household real adjusted disposable income and the household saving ratio is as a percentage of this income
2024-08-01;2024;August;Monetary Policy Decisions;Neutral;0.9826845526695251;in panel b business expectations for demand in contactintensive services and retail trade expectations refer to the next three months while consumer expectations for major purchases refer to the next 12 months the first series is standardised for the period january 200519 owing to data availability whereas the other two series are for the period 19992019 contactintensive services include accommodation travel and food services
2024-08-01;2024;August;Monetary Policy Decisions;Negative;0.7363718748092651;the latest observations are for the first quarter of 2024 for private consumption and june 2024 for expectations for contactintensive services retail trade and major purchasesbusiness investment saw a moderate rise in the first quarter of 2024 and shortterm indicators and surveys point to muted dynamics over the rest of 2024 chart 7 panel a
2024-08-01;2024;August;Monetary Policy Decisions;Positive;0.990265130996704;the pmi is expressed in terms of the deviation from 50 then divided by 10 the latest observations are for the first quarter of 2024 for employment june 2024 for the pmi assessment of employment and may 2024 for the unemployment rategrowth in private consumption remained modest at the start of 2024 but surveys suggest a strengthening of household spending dynamics
2024-08-01;2024;August;Monetary Policy Decisions;Negative;0.993643879890442;incoming hard data for the second quarter show mixed signals about the momentum in goods consumption with retail trade turnover increasing by 03 but car registrations declining by 37 in april and may relative to their firstquarter levels
2024-08-01;2024;August;Monetary Policy Decisions;Positive;0.9840633869171144;the main findings from the ecbs recent contacts with nonfinancial companies confirm this picture with contacts reporting a strong tourist season and increasing signs of a modest consumptionled recovery see box 4box 4
2024-08-01;2024;August;Monetary Policy Decisions;Negative;0.9661449790000916;most exclusionbased measures edged up in may but some such as hicp excluding unprocessed food and energy and hicpxx which refers to hicpx inflation excluding travelrelated items clothing and footwear decreased again in june
2024-08-01;2024;August;Monetary Policy Decisions;Negative;0.953674614429474;services inflation remained high and sticky
2024-08-01;2024;August;Monetary Policy Decisions;Positive;0.963170886039734;nonconstruction investment excluding irish intangibles rose by 05 quarter on quarter in the first quarter of 2024 recovering around 25 of its fall in the fourth quarter of 2023 across assets investment both in machinery and equipment and in intangibles had contributed positively to business investment since the pandemic
2024-08-01;2024;August;Monetary Policy Decisions;Negative;0.9936383366584778;contrary to expectations momentum in services prices and wages has picked up again recently
2024-08-01;2024;August;Monetary Policy Decisions;Neutral;0.6349744200706482;in part this likely reflects the increase in the national minimum wage in april as well as the resilience in activity
2024-08-01;2024;August;Monetary Policy Decisions;Positive;0.9905507564544678;the persistence in services inflation was one reason for the bank of england to remain cautious at its june monetary policy committee meeting and to hold its policy rate steady at 5252 economic activityreal gdp rose by 03 quarter on quarter in the first quarter of 2024 this pickup in growth after five quarters of broadly stagnant activity was led by services while value added in industry contracted
2024-08-01;2024;August;Monetary Policy Decisions;Positive;0.973876953125;the latest indicators including from surveys signal a continuation of the servicesdriven expansion in the second quarter
2024-08-01;2024;August;Monetary Policy Decisions;Negative;0.9947840571403505;given the weak industrial production data up to may it is likely that the manufacturing sector continued to exert a drag on growth
2024-08-01;2024;August;Monetary Policy Decisions;Negative;0.9938690066337584;survey data suggest that production in industry remains fragile as it is more exposed to the still tight monetary policy and global uncertainty
2024-08-01;2024;August;Monetary Policy Decisions;Positive;0.9896140694618224;overall the euro area economy is expected to continue to recover over the course of this year mainly supported by consumption driven by the strengthening of real incomes resulting from lower inflation and higher nominal wages
2024-08-01;2024;August;Monetary Policy Decisions;Positive;0.9906728863716124;moreover exports are anticipated to benefit from the improvement in global demand in the coming quarters although external competitiveness challenges pose a potential downside risk
2024-08-01;2024;August;Monetary Policy Decisions;Positive;0.5074256658554077;finally monetary policy should exert less of a drag on demand over timereal gdp grew by 03 quarter on quarter in the first quarter of 2024 net trade contributed positively to growth while domestic demand and changes in inventories made a negative contribution chart 3
2024-08-01;2024;August;Monetary Policy Decisions;Positive;0.965514063835144;excluding the sharp fall in irish nonconstruction investment the contribution from domestic demand is estimated to have been slightly positive
2024-08-01;2024;August;Monetary Policy Decisions;Positive;0.986227571964264;the recovery in economic activity was driven by valued added in services
2024-08-01;2024;August;Monetary Policy Decisions;Neutral;0.5729155540466309;2 incoming data suggest that real gdp growth likely continued to be servicesdriven in the second quarter
2024-08-01;2024;August;Monetary Policy Decisions;Neutral;0.913768231868744;industrial production contracted markedly in may with levels in the first two months of the second quarter unchanged compared to the first quarter
2024-08-01;2024;August;Monetary Policy Decisions;Positive;0.7745698094367981;the composite output purchasing managers index pmi stood at 516 in the second quarter up from 492 in the first quarter thus indicating positive growth and continuing the upward movement started in late 2023 across sectors the pmi for manufacturing output remained in contractionary territory in the second quarter and data for june showed that the gains made in april and may have been wiped out
2024-08-01;2024;August;Monetary Policy Decisions;Negative;0.9895636439323424;the pmis for total new orders and new export orders were similarly weak and given their more forwardlooking content this also points to weakness in the manufacturing sector in the third quarter chart 4 panel a
2024-08-01;2024;August;Monetary Policy Decisions;Neutral;0.9448757767677308;by contrast the pmi for services output remained in expansionary territory in the second quarter despite softening modestly in june chart 4 panel b
2024-08-01;2024;August;Monetary Policy Decisions;Positive;0.9902275800704956;moreover services production was 07 above its firstquarter level in aprilchart 3euro area real gdp and its componentsquarteronquarter percentage changes percentage point contributionssources eurostat and ecb calculationsnote the latest observations are for the first quarter of 2024forwardlooking survey data point to continued robust services in the third quarter of 2024 the european commissions business and consumer survey results for june suggest that expected demand for contactintensive services for the next three months remains robust particularly in travel services
2024-08-01;2024;August;Monetary Policy Decisions;Negative;0.9706900119781494;at the same time there are mixed signals about whether the weakness in the manufacturing sector has bottomed out
2024-08-01;2024;August;Monetary Policy Decisions;Positive;0.7855414152145386;confidence in the industry sector remained stable overall in june as firms threemonthahead production expectations and assessments of order books were largely unchanged
2024-08-01;2024;August;Monetary Policy Decisions;Negative;0.9952840209007264;nevertheless the european commissions business survey indicates that more firms are reporting abovenormal stocks of finished products suggesting that demand for goods remains weak
2024-08-01;2024;August;Monetary Policy Decisions;Positive;0.9734192490577698;economic activity has continued to expand at a similar pace in the second quarter
2024-08-01;2024;August;Monetary Policy Decisions;Positive;0.989122211933136;despite ongoing geopolitical tensions there has been no discernible trend indicating a shift away from china as a primary sourcing country see box 1in summary following the positive start to the year activity in the euro area economy is expected to continue to recover over the course of 2024 despite lingering uncertainty
2024-08-01;2024;August;Monetary Policy Decisions;Negative;0.9953705668449402;the pmis for output and for new orders in the capital goods sector in the second quarter point to ongoing weakness in this category of business investment
2024-08-01;2024;August;Monetary Policy Decisions;Neutral;0.9693117141723632;inflation excluding energy and food was 29 in june unchanged from may but up from 27 in april
2024-08-01;2024;August;Monetary Policy Decisions;Neutral;0.9849130511283876;while some measures of underlying inflation ticked up in may owing to oneoff factors most measures were either stable or edged down in june
2024-08-01;2024;August;Monetary Policy Decisions;Positive;0.954282522201538;domestic price pressures moderated in the first quarter of 2024 reflecting a stronger than expected decline in unit profits while wage growth remained elevated
2024-08-01;2024;August;Monetary Policy Decisions;Neutral;0.969676911830902;measures of longerterm inflation expectations mostly stand at around 2 while measures of shorterterm inflation expectations have decreasedeuro area headline inflation as measured in terms of the harmonised index of consumer prices hicp declined to 25 in june from 26 in may chart 8
2024-08-01;2024;August;Monetary Policy Decisions;Negative;0.7582013010978699;the decrease was driven by lower inflation rates for food and energy
2024-08-01;2024;August;Monetary Policy Decisions;Neutral;0.991415560245514;it followed an increase from 24 in april and confirmed earlier expectations that inflation would fluctuate around current levels partly owing to energyrelated base effectschart 8headline inflation and its main componentsannual percentage changes percentage point contributionssources eurostat and ecb calculationsnotes neig refers to nonenergy industrial goods
2024-08-01;2024;August;Monetary Policy Decisions;Positive;0.6324222683906555;the latest observations are for june 2024energy inflation decreased from 03 in may to 02 in june having turned positive in may after almost a year of negative rates
2024-08-01;2024;August;Monetary Policy Decisions;Negative;0.6667608022689819;the main drivers of the decrease were transport and liquid fuel prices
2024-08-01;2024;August;Monetary Policy Decisions;Negative;0.9933584332466124;these reflect the recent decline of oil prices and a sharp decline in refining margins for petrol
2024-08-01;2024;August;Monetary Policy Decisions;Negative;0.8493230938911438;finally monetary policy should exert less of a drag on demand over time3 prices and costseuro area headline inflation stood at 25 in june 2024 down from 26 in may
2024-08-01;2024;August;Monetary Policy Decisions;Negative;0.9905125498771667;electricity and gas prices increased but continued to contribute negatively to energy inflationfood inflation weakened further falling to 24 in june from 26 in may
2024-08-01;2024;August;Monetary Policy Decisions;Neutral;0.9645560383796692;processed food inflation decreased slightly in june to 27 after 28 in may
2024-08-01;2024;August;Monetary Policy Decisions;Negative;0.8774936199188232;the decline in the annual rate of change of food inflation was related to a downward base effect associated with the strong price increase in the more volatile unprocessed food component one year ago
2024-08-01;2024;August;Monetary Policy Decisions;Neutral;0.9292007684707642;hicp inflation excluding energy and food hicpx stood at 29 in june unchanged from may and up from 27 in april chart 9
2024-08-01;2024;August;Monetary Policy Decisions;Neutral;0.9211563467979432;in terms of components nonenergy industrial goods inflation stood at 07 in may and june down from 09 in april
2024-08-01;2024;August;Monetary Policy Decisions;Negative;0.8330945372581482;this is close to the prepandemic longterm average of 06 suggesting a possible end to the gradual fading of the impact of past upward shocks
2024-08-01;2024;August;Monetary Policy Decisions;Neutral;0.9836418628692628;services inflation was also unchanged between may and june at 41 having increased from 37 in april
2024-08-01;2024;August;Monetary Policy Decisions;Positive;0.984786093235016;the relatively greater persistence in services inflation compared with goods inflation is in line with strong wage growth and the more prominent role that labour costs play in the production of services
2024-08-01;2024;August;Monetary Policy Decisions;Neutral;0.4375134408473968;meanwhile indicators of underlying inflation showed mixed developments in may and june
2024-08-01;2024;August;Monetary Policy Decisions;Neutral;0.9039974212646484;energy prices are continuing to push inflation down but as base effects unwind in the second half of the year headline inflation is expected to increase again
2024-08-01;2024;August;Monetary Policy Decisions;Negative;0.9289804697036744;the decline was mainly driven by unprocessed food inflation 13 in june after 18 in may
2024-08-01;2024;August;Monetary Policy Decisions;Positive;0.988158404827118;in addition euro area exports should pick up over the coming quarters in parallel with improvements in global growth
2024-08-01;2024;August;Monetary Policy Decisions;Positive;0.9919791221618652;however declining inflation and robust wage growth are expected to underpin further increases in real disposable incomes and thus in private consumption
2024-08-01;2024;August;Monetary Policy Decisions;Negative;0.9872090816497804;trade tensions and geopolitical uncertainty will continue to pose headwinds for the manufacturing sector and therefore for investment
2024-08-01;2024;August;Monetary Policy Decisions;Negative;0.9028635025024414;the ecbs recent bank lending survey and the ecbs survey on the access to finance of enterprises in the euro area continued to report tight financing conditions in the second quarter
2024-08-01;2024;August;Monetary Policy Decisions;Positive;0.9879986047744752;feedback from the ecbs corporate contacts suggests that firms continue to invest in costsaving measures in a context of labour shortages and strong global competition
2024-08-01;2024;August;Monetary Policy Decisions;Negative;0.9951334595680236;however they expect investment to remain subdued this year amid still elevated uncertainty
2024-08-01;2024;August;Monetary Policy Decisions;Neutral;0.928129494190216;similarly the european commissions biannual investment survey suggests muted business investment growth in 2024 see box 3chart 7real private investment dynamics and survey dataa business investmentb housing investmentquarteronquarter percentage changes diffusion indicesquarteronquarter percentage changes percentage balances and diffusion indexsources eurostat european commission ec sp global market intelligence and ecb calculationsnotes lines indicate monthly developments while bars refer to quarterly data
2024-08-01;2024;August;Monetary Policy Decisions;Neutral;0.9807047247886658;the pmis are expressed in terms of the deviation from 50 in panel a business investment is measured by nonconstruction investment excluding irish intangibles
2024-08-01;2024;August;Monetary Policy Decisions;Neutral;0.9801228642463684;the lines refer to responses from the capital goods sector
2024-08-01;2024;August;Monetary Policy Decisions;Neutral;0.9881255626678468;the latest observations are for the first quarter of 2024 for business investment and june 2024 for the pmis
2024-08-01;2024;August;Monetary Policy Decisions;Neutral;0.9879401922225952;in panel b the line for the european commissions activity trend indicator refers to the building and specialised construction sectors assessment of the trend in activity over the preceding three months
2024-08-01;2024;August;Monetary Policy Decisions;Negative;0.5450549721717834;the latest observations are for the first quarter of 2024 for housing investment and june 2024 for the european commission survey and the pmishousing investment bounced back in the first quarter of 2024 but hard and soft indicators suggest that it likely contracted in the second quarter chart 7 panel b
2024-08-01;2024;August;Monetary Policy Decisions;Negative;0.8651083707809448;housing investment rose by 11 quarter on quarter in the first quarter mostly owing to the favourable oneoff effects of the mild weather in germany and generous fiscal incentives in italy
2024-08-01;2024;August;Monetary Policy Decisions;Negative;0.9939339756965636;however residential building permits stabilised at historically low levels suggesting that pressures from projects in the pipeline were limited
2024-08-01;2024;August;Monetary Policy Decisions;Negative;0.5815706253051758;moreover building and specialised construction output dropped by 04 in april 2024 compared with its average level in the first quarter of 2024 in addition surveybased activity measures such as the pmi for residential construction output and the european commissions indicator for building and specialised construction activity in the last three months remained in contractionary territory up to june
2024-08-01;2024;August;Monetary Policy Decisions;Negative;0.9902674555778505;the latter being mostly on account of a deterioration in demand
2024-08-01;2024;August;Monetary Policy Decisions;Negative;0.994570791721344;overall these developments suggest that housing investment is likely to have declined in the second quarter
2024-08-01;2024;August;Monetary Policy Decisions;Negative;0.989900529384613;looking ahead recent ecb surveys point to a moderation in the pace of decline
2024-08-01;2024;August;Monetary Policy Decisions;Positive;0.9283776879310608;in the may consumer expectations survey household expectations for the housing market remained depressed but more favourable than at the end of 2023 as reflected by the increased attractiveness of housing as a good investment
2024-08-01;2024;August;Monetary Policy Decisions;Positive;0.8345270752906799;in the july corporate telephone survey construction companies reported ongoing depressed activity but an expected recovery in the second half of 2024 in the july bank lending survey dynamics in credit standards and demand for housing loans are expected to improveeuro area exports stagnated in april 2024 despite the pickup in foreign demand
2024-08-01;2024;August;Monetary Policy Decisions;Positive;0.976527452468872;manufacturing export orders continued to contract sharply in june while the services sector showed more resilience with export orders remaining stable
2024-08-01;2024;August;Monetary Policy Decisions;Negative;0.992305338382721;the stagnation in export growth is in line with a broader trend of declining euro area market shares exacerbated by the supply bottlenecks and energy price shocks  with the euro area being more affected given its high level of integration in global value chains and the domestic nature of the gas shock
2024-08-01;2024;August;Monetary Policy Decisions;Positive;0.991909921169281;meanwhile import growth has shown signs of recovery with a 09 increase in import volumes of extraeuro area goods in april in threemonthonthreemonth terms amid stronger domestic consumption
2024-08-01;2024;August;Monetary Policy Decisions;Positive;0.9203181862831116;shipping costs are on the rise again particularly between china and europe as global demand strengthens and firms frontload christmas orders earlier than usual owing to red sea disruptions and longer transportation times see box 4
