Date;Year;Month;Type;sentiment;sentiment_score;sentence
2024-08-01;2024;August;Monetary Policy Decisions;Negative;0.9908370971679688;by contrast according to the ecbs recent contacts with nonfinancial companies investment in transport equipment has been hampered by the continued uncertainty surrounding the green transition and the downsizing of energyintensive industries see box 4
2024-08-01;2024;August;Monetary Policy Decisions;Neutral;0.8652187585830688;uk headline cpi inflation declined to 20 in may
2024-08-01;2024;August;Monetary Policy Decisions;Neutral;0.9004660248756409;it will keep policy rates sufficiently restrictive for as long as necessary to achieve this aim
2024-08-01;2024;August;Monetary Policy Decisions;Positive;0.991208791732788;growth was particularly strong in services although the industrial production and construction sectors also expanded
2024-08-01;2024;August;Monetary Policy Decisions;Negative;0.980480432510376;higher nominal wages alongside weak productivity have added to unit labour cost growth although it decelerated somewhat in the first quarter of this year
2024-08-01;2024;August;Monetary Policy Decisions;Negative;0.9685007333755492;owing to the staggered nature of wage adjustments and the large contribution of oneoff payments growth in labour costs will likely remain elevated over the near term
2024-08-01;2024;August;Monetary Policy Decisions;Negative;0.9698516726493835;at the same time recent data on compensation per employee have been in line with expectations and the latest survey indicators signal that wage growth will moderate over the course of next year
2024-08-01;2024;August;Monetary Policy Decisions;Negative;0.968953549861908;moreover profits contracted in the first quarter helping to offset the inflationary effects of higher unit labour costs and survey evidence suggests that profits should continue to be dampened in the near terminflation is expected to fluctuate around current levels for the rest of the year partly owing to energyrelated base effects
2024-08-01;2024;August;Monetary Policy Decisions;Negative;0.9911103248596193;it is then expected to decline towards the target over the second half of next year owing to weaker growth in labour costs the effects of the governing councils restrictive monetary policy and the fading impact of the past inflation surge
2024-08-01;2024;August;Monetary Policy Decisions;Neutral;0.5626776814460754;measures of longerterm inflation expectations have remained broadly stable with most standing at around 2risk assessmentthe risks to economic growth are tilted to the downside
2024-08-01;2024;August;Monetary Policy Decisions;Negative;0.9888675808906556;a weaker world economy or an escalation in trade tensions between major economies would weigh on euro area growth
2024-08-01;2024;August;Monetary Policy Decisions;Negative;0.974319577217102;russias unjustified war against ukraine and the tragic conflict in the middle east are major sources of geopolitical risk
2024-08-01;2024;August;Monetary Policy Decisions;Negative;0.9930031895637512;this may result in firms and households becoming less confident about the future and global trade being disrupted
2024-08-01;2024;August;Monetary Policy Decisions;Negative;0.9879639148712158;wages are still rising at an elevated rate making up for the past period of high inflation
2024-08-01;2024;August;Monetary Policy Decisions;Negative;0.9665135741233826;growth could also be lower if the effects of monetary policy turn out stronger than expected
2024-08-01;2024;August;Monetary Policy Decisions;Negative;0.636579692363739;upside risks to inflation also stem from the heightened geopolitical tensions which could push energy prices and freight costs higher in the near term and disrupt global trade
2024-08-01;2024;August;Monetary Policy Decisions;Negative;0.8892961740493774;moreover extreme weather events and the unfolding climate crisis more broadly could drive up food prices
2024-08-01;2024;August;Monetary Policy Decisions;Positive;0.9117323756217957;by contrast inflation may surprise on the downside if monetary policy dampens demand more than expected or if the economic environment in the rest of the world worsens unexpectedlyfinancial and monetary conditionsthe policy rate cut in june has been transmitted smoothly to money market interest rates while broader financial conditions have been somewhat volatile
2024-08-01;2024;August;Monetary Policy Decisions;Negative;0.961034655570984;financing costs remain restrictive as the previous policy rate increases continue to work their way through the transmission chain
2024-08-01;2024;August;Monetary Policy Decisions;Negative;0.7699906826019287;the average interest rate on new loans to firms edged down to 51 in may while mortgage rates remained unchanged at 38credit standards for loans remain tight
2024-08-01;2024;August;Monetary Policy Decisions;Negative;0.9529808163642884;according to the july 2024 bank lending survey standards for lending to firms tightened slightly in the second quarter while standards for mortgages eased moderately
2024-08-01;2024;August;Monetary Policy Decisions;Negative;0.9940253496170044;firms demand for loans fell slightly while households demand for mortgages rose for the first time since early 2022overall credit dynamics remain weak
2024-08-01;2024;August;Monetary Policy Decisions;Neutral;0.8669700622558594;bank lending to firms and households grew at an annual rate of 03 in may only marginally up from the previous month
2024-08-01;2024;August;Monetary Policy Decisions;Neutral;0.6993902325630188;the annual growth in broad money  as measured by m3  rose to 16 in may from 13 in aprilmonetary policy decisionsthe interest rate on the main refinancing operations and the interest rates on the marginal lending facility and the deposit facility remain unchanged at 425 450 and 375 respectivelythe asset purchase programme portfolio is declining at a measured and predictable pace as the eurosystem no longer reinvests the principal payments from maturing securitiesthe eurosystem no longer reinvests all of the principal payments from maturing securities purchased under the pandemic emergency purchase programme pepp reducing the pepp portfolio by 75 billion per month on average
2024-08-01;2024;August;Monetary Policy Decisions;Positive;0.6856920719146729;growth could be higher if inflation comes down more quickly than expected and rising confidence and real incomes mean that spending increases by more than anticipated or if the world economy grows more strongly than expectedinflation could turn out higher than anticipated if wages or profits increase by more than expected
2024-08-01;2024;August;Monetary Policy Decisions;Negative;0.8205751180648804;while some measures of underlying inflation ticked up in may owing to oneoff factors most measures were either stable or edged down in junedomestic inflation remains high
2024-08-01;2024;August;Monetary Policy Decisions;Neutral;0.9907841682434082;both goods price inflation and services price inflation were unchanged in june at 07 and 41 respectively
2024-08-01;2024;August;Monetary Policy Decisions;Neutral;0.9563978910446168;food prices went up by 24 in june  which is 02 percentage points less than in may  while energy prices remained essentially flat
2024-08-01;2024;August;Monetary Policy Decisions;Neutral;0.9836012721061708;economic financial and monetary developmentssummaryat its meeting on 18 july 2024 the governing council decided to keep the three key ecb interest rates unchanged
2024-08-01;2024;August;Monetary Policy Decisions;Neutral;0.9927963614463806;the incoming information broadly supports the governing councils previous assessment of the mediumterm inflation outlook
2024-08-01;2024;August;Monetary Policy Decisions;Neutral;0.9849130511283876;while some measures of underlying inflation ticked up in may owing to oneoff factors most measures were either stable or edged down in june
2024-08-01;2024;August;Monetary Policy Decisions;Negative;0.933431088924408;in line with expectations the inflationary impact of high wage growth has been buffered by profits
2024-08-01;2024;August;Monetary Policy Decisions;Negative;0.83070969581604;monetary policy is keeping financing conditions restrictive
2024-08-01;2024;August;Monetary Policy Decisions;Neutral;0.979242205619812;at the same time domestic price pressures are still high services inflation is elevated and headline inflation is likely to remain above the target well into next yearthe governing council is determined to ensure that inflation returns to its 2 mediumterm target in a timely manner
2024-08-01;2024;August;Monetary Policy Decisions;Neutral;0.9004660248756409;it will keep policy rates sufficiently restrictive for as long as necessary to achieve this aim
2024-08-01;2024;August;Monetary Policy Decisions;Neutral;0.9912155866622924;the governing council will continue to follow a datadependent and meetingbymeeting approach to determining the appropriate level and duration of restriction
2024-08-01;2024;August;Monetary Policy Decisions;Neutral;0.987787902355194;in particular its interest rate decisions will be based on its assessment of the inflation outlook in light of the incoming economic and financial data the dynamics of underlying inflation and the strength of monetary policy transmission
2024-08-01;2024;August;Monetary Policy Decisions;Negative;0.9817864298820496;the governing council is not precommitting to a particular rate patheconomic activitythe incoming information indicates that the euro area economy grew in the second quarter but likely at a slower pace than in the first quarter
2024-08-01;2024;August;Monetary Policy Decisions;Positive;0.9482516050338744;services continue to lead the recovery while industrial production and goods exports have been weak
2024-08-01;2024;August;Monetary Policy Decisions;Negative;0.9943813681602478;investment indicators point to muted growth in 2024 amid heightened uncertainty
2024-08-01;2024;August;Monetary Policy Decisions;Positive;0.9898641705513;looking ahead the recovery is expected to be supported by consumption driven by the strengthening of real incomes resulting from lower inflation and higher nominal wages
2024-08-01;2024;August;Monetary Policy Decisions;Positive;0.9893246293067932;moreover exports should pick up alongside a rise in global demand
2024-08-01;2024;August;Monetary Policy Decisions;Positive;0.9861361980438232;finally monetary policy should exert less of a drag on demand over timethe labour market remains resilient
2024-08-01;2024;August;Monetary Policy Decisions;Neutral;0.7561651468276978;the unemployment rate was unchanged at 64 in may remaining at its lowest level since the start of the euro
2024-08-01;2024;August;Monetary Policy Decisions;Positive;0.973738133907318;employment which grew by 03 in the first quarter was supported by a further increase in the labour force which expanded at the same rate
2024-08-01;2024;August;Monetary Policy Decisions;Neutral;0.8380939364433289;more jobs are likely to have been created in the second quarter mainly in the services sector
2024-08-01;2024;August;Monetary Policy Decisions;Positive;0.9878837466239928;firms are gradually reducing their job postings but from high levelsnational fiscal and structural policies should aim at making the economy more productive and competitive which would help to raise potential growth and reduce price pressures in the medium term
2024-08-01;2024;August;Monetary Policy Decisions;Positive;0.9874374270439148;an effective speedy and full implementation of the next generation eu programme progress towards capital markets union and the completion of banking union and a strengthening of the single market are key factors that would help foster innovation and increase investment in the green and digital transitions
2024-08-01;2024;August;Monetary Policy Decisions;Positive;0.9602161049842834;the governing council welcomes the european commissions recent guidance calling for eu member states to strengthen fiscal sustainability and the eurogroups statement on the fiscal stance for the euro area in 2025 implementing the eus revised economic governance framework fully and without delay will help governments bring down budget deficits and debt ratios on a sustained basisinflationannual inflation eased to 25 in june from 26 in may
2024-08-01;2024;August;Monetary Policy Decisions;Neutral;0.9898732900619508;the governing council intends to discontinue reinvestments under the pepp at the end of 2024the governing council will continue applying flexibility in reinvesting redemptions coming due in the pepp portfolio with a view to countering risks to the monetary policy transmission mechanism related to the pandemicas banks are repaying the amounts borrowed under the targeted longerterm refinancing operations the governing council will regularly assess how targeted lending operations and their ongoing repayment are contributing to its monetary policy stanceconclusionthe governing council decided at its meeting on 18 july 2024 to keep the three key ecb interest rates unchanged
2024-08-01;2024;August;Monetary Policy Decisions;Neutral;0.9792748093605042;the governing council is determined to ensure that inflation returns to its 2 mediumterm target in a timely manner
2024-08-01;2024;August;Monetary Policy Decisions;Neutral;0.9912155866622924;the governing council will continue to follow a datadependent and meetingbymeeting approach to determining the appropriate level and duration of restriction
2024-08-01;2024;August;Monetary Policy Decisions;Neutral;0.9913533329963684;in particular the interest rate decisions will be based on the governing councils assessment of the inflation outlook in light of the incoming economic and financial data the dynamics of underlying inflation and the strength of monetary policy transmission
2024-08-01;2024;August;Monetary Policy Decisions;Negative;0.9536033272743224;oil prices rebounded substantially after opec officials clarified that the phasing out of the voluntary cut in production announced at their june meeting would depend on prevailing market conditions which signalled the possibility of tighter supply conditions than initially expected
2024-08-01;2024;August;Monetary Policy Decisions;Negative;0.9939634203910828;geopolitical tensions including renewed fears of deepening conflict involving hezbollah in lebanon ukrainian drone strikes on russian oil facilities and houthi attacks on commercial shipping in the red sea have added to concerns over potential supply disruptions and supported oil prices
2024-08-01;2024;August;Monetary Policy Decisions;Negative;0.9862536191940308;european gas prices have declined by 55 despite supply outages in norway adding to market volatility
2024-08-01;2024;August;Monetary Policy Decisions;Negative;0.9893636703491212;overall volatility in the gas market seems to be stabilising at historical average levels as europe has managed to secure supplies from alternative sources and gas storage levels remain high
2024-08-01;2024;August;Monetary Policy Decisions;Neutral;0.5726726651191711;eu sanctions banning reexports of russian lng through eu ports are expected to have a modest impact on the gas market as they do not affect eu imports directly and transhipped russian volumes are relatively small
2024-08-01;2024;August;Monetary Policy Decisions;Negative;0.9922437071800232;metal prices have declined marginally while food prices have declined by around 7 driven by positive supply news for wheat crops and a continued moderation of cocoa pricesin the united states momentum in both activity and inflation has moderated
2024-08-01;2024;August;Monetary Policy Decisions;Negative;0.9935070276260376;real consumer spending was revised down for the first quarter of this year and the latest monthly data suggest that consumption growth could be equally tepid in the second quarter
2024-08-01;2024;August;Monetary Policy Decisions;Negative;0.9943976402282716;this represents a significant deceleration from the pace recorded in the second half of 2023 moreover 206000 jobs were added in the nonfarm sector in june leading to a significant slowdown in the second quarter relative to the first quarter confirming that the us labour market is cooling
2024-08-01;2024;August;Monetary Policy Decisions;Negative;0.8729732632637024;average hourly earnings growth has also fallen substantially from its peak in march 2022 but at 39 remains as stated by federal reserve officials incompatible with the 2 inflation target
2024-08-01;2024;August;Monetary Policy Decisions;Neutral;0.985162913799286;annual headline cpi inflation decreased to 30 in june while core inflation fell marginally to 33
2024-08-01;2024;August;Monetary Policy Decisions;Negative;0.9954955577850342;inflation momentum also weakened notably in prices for nonrent services which had been a major driver of high inflation at the start of the year
2024-08-01;2024;August;Monetary Policy Decisions;Neutral;0.9904853701591492;at its june meeting the federal open market committee maintained the target range for the federal funds rate at 52555
2024-08-01;2024;August;Monetary Policy Decisions;Negative;0.9865610003471376;in its june economic projections the committee retained its outlook for a gradual deceleration in gdp growth but raised its headline and core inflation projections for 2024 and 2025 slightly leaving its expectation of reaching its inflation target by the end of 2026 unchangedin china economic growth is moderating as underlying weaknesses persist
2024-08-01;2024;August;Monetary Policy Decisions;Negative;0.993713676929474;real gdp growth decelerated markedly to 07 quarter on quarter from 15 in the first quarter of 2024 as the real estate downturn has acted as a drag on consumer spending and the fiscal impulse from a late2023 stimulus programme has faded
2024-08-01;2024;August;Monetary Policy Decisions;Negative;0.993409276008606;the release was somewhat below market consensus expectations
2024-08-01;2024;August;Monetary Policy Decisions;Negative;0.965781033039093;in yearonyear terms gdp growth decreased to 47 from 53 in the first quarter
2024-08-01;2024;August;Monetary Policy Decisions;Negative;0.9940369129180908;moreover monthly activity indicators for june showed a slump in retail sales and a further moderation in industrial production both signalling a continued deceleration in the growth momentum at the end of the second quarter
2024-08-01;2024;August;Monetary Policy Decisions;Neutral;0.4975683987140655;only exports have remained a growth driver suggesting that the impact of proposed eu tariffs on chinese exports will be limited
2024-08-01;2024;August;Monetary Policy Decisions;Neutral;0.9755989909172058;a new housing market support package marks a policy shift although its impact on propertyrelated activity cannot be observed yet
2024-08-01;2024;August;Monetary Policy Decisions;Negative;0.9763904809951782;looking ahead the property market is expected to remain a drag on growth with potential upside risk stemming from the new policy measuresin the united kingdom growth picked up again while inflation fell to 2
2024-08-01;2024;August;Monetary Policy Decisions;Neutral;0.4296038150787353;after stalling in april economic activity increased by 04 month on month in may
2024-08-01;2024;August;Monetary Policy Decisions;Negative;0.9796760082244872;the latest observations are for may 2024since the last governing council meeting brent crude oil prices have increased by around 11 on the back of expectations of tighter supply and rising geopolitical concerns
2024-08-01;2024;August;Monetary Policy Decisions;Positive;0.8894749283790588;overall consumers resilience prevails in the face of persistently tight monetary conditions
2024-08-01;2024;August;Monetary Policy Decisions;Neutral;0.9885039925575256;looking ahead headline cpi inflation is only expected to continue falling graduallychart 2oecd cpi inflationyearonyear percentage changessources oecd and ecb staff calculationsnotes the oecd aggregate excludes türkiye and is calculated using oecd cpi annual weights
2024-08-01;2024;August;Monetary Policy Decisions;Negative;0.6516950726509094;this suggests that in many countries wage growth remains high amid tight labour markets
2024-08-01;2024;August;Monetary Policy Decisions;Positive;0.9736586809158324;the governing council is not precommitting to a particular rate pathin any case the governing council stands ready to adjust all of its instruments within its mandate to ensure that inflation returns to its mediumterm target and to preserve the smooth functioning of monetary policy transmission1 external environmentglobal economic activity and trade remained on a steady upward trajectory in the second quarter of 2024 survey data indicate that the global economy is likely entering a period of restocking which should support trade in the period ahead
2024-08-01;2024;August;Monetary Policy Decisions;Positive;0.9449570775032043;inflation continues to moderate yet pressures on services prices are persistentglobal activity excluding the euro area is still on a steady upward trajectory
2024-08-01;2024;August;Monetary Policy Decisions;Neutral;0.9631280303001404;the june global composite output purchasing managers index pmi remained in expansionary territory chart 1
2024-08-01;2024;August;Monetary Policy Decisions;Neutral;0.9158824682235718;the headline index edged down from 540 in may to 532 in june closer to its longterm average
2024-08-01;2024;August;Monetary Policy Decisions;Negative;0.9891787767410278;this reflects a weakening of services activity at the same time as output in the manufacturing sector stayed unchanged
2024-08-01;2024;August;Monetary Policy Decisions;Neutral;0.8240641355514526;services activity moderated across most key economies  including china in particular  while remaining in expansionary territory
2024-08-01;2024;August;Monetary Policy Decisions;Positive;0.9832889437675476;the ecbs global growth nowcasting model confirms that the global expansion is ongoing
2024-08-01;2024;August;Monetary Policy Decisions;Neutral;0.9063767194747924;while this assessment is mainly underpinned by soft data most hard data have also become more supportive
2024-08-01;2024;August;Monetary Policy Decisions;Positive;0.9892848134040833;overall this suggests that global activity growth remained on a steady upward trajectory in the second quarter of 2024chart 1global output pmidiffusion indicessources sp global market intelligence and ecb staff calculationsnote the latest observations are for june 2024global trade rebounded at the start of the year and is expected to strengthen further supported by the recent turn in the inventory cycle
2024-08-01;2024;August;Monetary Policy Decisions;Positive;0.9548879861831664;the expected recovery from last years weak trade figures was confirmed by hard data with global import growth amounting to 06 quarter on quarter in the first quarter of the year
2024-08-01;2024;August;Monetary Policy Decisions;Positive;0.9921668767929076;in the short term stronger industrial production data point towards a further rebound in trade growth
2024-08-01;2024;August;Monetary Policy Decisions;Positive;0.9859780073165894;the recent turn in the global inventory cycle has also boosted trade
2024-08-01;2024;August;Monetary Policy Decisions;Negative;0.9889172315597534;in the second half of 2023 growth in inventories fell sharply and even turned negative suggesting that rising demand was partly met by drawing down stocks
2024-08-01;2024;August;Monetary Policy Decisions;Negative;0.9424713850021362;with new orders continuing to increase in 2024 survey data suggest that inventories are being rebuilt
2024-08-01;2024;August;Monetary Policy Decisions;Positive;0.8995188474655151;in fact pmi readings of inventories at the global level have risen more quickly than measures of new orders
2024-08-01;2024;August;Monetary Policy Decisions;Positive;0.8161767721176147;this suggests that the global economy may be entering a period of restocking which could support trade going forward
2024-08-01;2024;August;Monetary Policy Decisions;Negative;0.9833000898361206;1 inflation across oecd economies continues to moderate yet services price pressures are persistent
2024-08-01;2024;August;Monetary Policy Decisions;Neutral;0.9784055948257446;in may the annual headline rate of consumer price index cpi inflation across oecd countries excluding türkiye declined marginally to 29 compared with 30 in the previous month chart 2
2024-08-01;2024;August;Monetary Policy Decisions;Negative;0.964838206768036;excluding food and energy prices oecd core inflation continued to slow to 32 in may down 01 percentage points from april
2024-08-01;2024;August;Monetary Policy Decisions;Negative;0.9256325364112854;falling goods prices and slower increases for other services components are reducing inflationary pressures in advanced economies
2024-08-01;2024;August;Monetary Policy Decisions;Negative;0.9897688627243042;however inflation in labourintensive activities such as restaurants and hotels recreation culture and health care remains elevated and is only moving sluggishly in the direction of average prepandemic rates
2024-08-01;2024;August;Monetary Policy Decisions;Negative;0.5360389351844788;in addition rent inflation is still elevated and often well above prepandemic levels
2024-08-01;2024;August;Monetary Policy Decisions;Neutral;0.987947642803192;by contrast domestic inflation ticked up marginally to 45 in june from 44 in may remaining elevated at the top of the range of underlying inflation indicators
2024-08-01;2024;August;Monetary Policy Decisions;Positive;0.9873812198638916;in the first quarter of 2024 banks continued to improve their capitalisation and maintained capital ratios well above common equity tier 1 cet1 requirements ensuring a wellcapitalised banking system capable of meeting the sustainable credit needs of the real economy
