Date;Year;Month;Type;sentiment;sentiment_score;sentence
2023-01-19;2023;January;REPORT;Positive;0.8687039017677307;moreover a timely announcement would reassure market participants that the reduction of the app portfolio would take place in a measured and predictable waysome members expressed a preference for reducing the app portfolio at a faster pace or for terminating reinvestments altogether
2023-01-19;2023;January;REPORT;Neutral;0.9293225407600403;it was recalled that the decision affected only part of the eurosystems monetary policy portfolios as it applied to the app but not to the pandemic emergency purchase programme pepp
2023-01-19;2023;January;REPORT;Neutral;0.6087732315063477;moreover a more rapid pace of portfolio reduction had to be seen in the context of the very fast monthly pace of net purchases when the portfolio was built up
2023-01-19;2023;January;REPORT;Neutral;0.7619895339012146;the view was held that investors were able to absorb new issuances even without the eurosystems presence in the market
2023-01-19;2023;January;REPORT;Negative;0.7538994550704956;starting passive balance sheet reductions as part of the normalisation process was regarded as overdue with markets having already expected the ecb to make announcements in this respect at the time of the october monetary policy meeting
2023-01-19;2023;January;REPORT;Neutral;0.90326988697052;an earlier or more significant reduction in the app portfolio would also help policy space to be regained for the futurethe view was also expressed that while staff estimates of the impact of balance sheet reductions on economic output and inflation assumed symmetry  ie
2023-01-19;2023;January;REPORT;Neutral;0.6130334138870239;they assumed that the policy would work through the same channels as had been observed in the balance sheet expansion phase  there were reasons to believe that the effects of quantitative tightening would be asymmetric and weaker
2023-01-19;2023;January;REPORT;Negative;0.8937478065490723;it would therefore be better to regard the portfolio reduction as an element of normalisation operating in the background with interest rates being the ecbs primary tool for setting the monetary policy stanceit was cautioned however that too fast a pace of reduction could lead to the reemergence of bond market fragmentation which could make further interest rate increases more difficult to pursue
2023-01-19;2023;January;REPORT;Neutral;0.9936171770095825;from that perspective a moderate pace was seen as more appropriate in particular as a reduction of the balance sheet was estimated as likely to have only a limited impact on the inflation outlookon the basis of the foregoing discussion it was agreed to announce an average pace for the reduction of the app portfolio that would apply from the beginning of march 2023 and in the second quarter only leaving the pace in subsequent periods to be decided on and communicated at a later point in time
2023-01-19;2023;January;REPORT;Neutral;0.9936135411262512;this would allow the governing council to evaluate investors reactions in the coming months and to recalibrate the pace as necessary
2023-01-19;2023;January;REPORT;Neutral;0.9897891879081726;a remark was made that the principles and modalities guiding the normalisation of the eurosystems monetary policy securities holdings would always be consistent with the outcome of the governing councils monetary policy strategy review including with regard to the ecbs obligation to support the general economic policies in the european union without prejudice to the attainment of the primary objective of price stabilitymembers also agreed with the proposal to continue applying flexibility in reinvesting redemptions falling due in the pepp portfolio
2023-01-19;2023;January;REPORT;Neutral;0.920831561088562;maintaining the existing flexibility in pepp reinvestments was seen as an efficient preemptive approach to countering a potential reemergence of risks to the monetary policy transmission mechanism related to the pandemic and could be justified on the grounds of prudencemembers broadly agreed to communicate that inflation remained far too high and was projected to stay above the governing councils 2 mediumterm target for too long
2023-01-19;2023;January;REPORT;Positive;0.9739423394203186;it was emphasised that signalling an intention to move policy rates sufficiently into restrictive territory at a steady sustained pace to bring inflation back to target in a timely manner was a necessary and powerful message in view of the revised inflation outlook
2023-01-19;2023;January;REPORT;Neutral;0.7491658926010132;the view was held that against the backdrop of the upward revision to the inflation outlook explaining the reasoning behind the governing councils decision was particularly important in the absence of more forceful policy action
2023-01-19;2023;January;REPORT;Negative;0.7964540123939514;consistency and coherence in the governing councils communication was called for as this was seen as strengthening its impact on market expectationsat the same time concern was expressed that communicating an expectation that interest rates would still have to rise significantly at a steady pace to reach levels that were sufficiently restrictive to ensure a timely return of inflation to the governing councils target could be perceived as a departure from the governing councils datadependent meetingbymeeting approach and as reintroducing a form of interest rate forward guidance
2023-01-19;2023;January;REPORT;Neutral;0.8736410737037659;this could focus attention on future meetings and might give rise to problems of time inconsistency as the appropriate path might in the light of new information turn out to be different from that currently envisaged
2023-01-19;2023;January;REPORT;Positive;0.5434627532958984;instead it was suggested that communication should acknowledge that in view of the current inflation outlook interest rates needed to be raised for longer to higher levels than were currently priced in by markets and taken into account in the eurosystem staff inflation projectionsit was also suggested that the governing council should strengthen its calls for fiscal policies to avoid exacerbating inflationary pressures by keeping measures temporary targeted and tailored to preserving incentives to consume less energy
2023-01-19;2023;January;REPORT;Neutral;0.9846091270446777;in this context fiscal vulnerabilities and the need to conclude the reform of the eus economic governance framework could also be addressedfinally it was seen as appropriate to reiterate that the governing council stood ready to flexibly adjust all of its instruments within its mandate to ensure that inflation returned to its mediumterm target of 2the members of the governing council subsequently finalised the monetary policy statement which the president and the vicepresident would as usual deliver at the press conference following the governing council meetingmonetary policy statementmonetary policy statement to the press conference of 15 december 2022press releasemonetary policy decisions
