Date;Year;Month;Type;sentiment;sentiment_score;sentence
2023-01-19;2023;January;REPORT;Negative;0.9501978754997253;that said financial conditions remained tighter than assumed in the september 2022 staff projectionslooking at financing conditions for firms in the latest round of the survey on the access to finance of small and mediumsized enterprises safe firms had reported a widening financing gap  the difference between the change in demand for external financing and the perceived change in its supply  in a deteriorating economic environment
2023-01-19;2023;January;REPORT;Positive;0.4845542013645172;this was accompanied by an increasing share of firms being considered vulnerable defined as firms simultaneously reporting lower turnover declining profits higher interest expenditure and a nondecreasing debttoasset ratio
2023-01-19;2023;January;REPORT;Neutral;0.8834286332130432;the reported larger financing gap and increase in firms vulnerability had both typically been associated with a subsequent fall in gdp in the euro area
2023-01-19;2023;January;REPORT;Negative;0.8827429413795471;mr lane reported that the transmission of the tightening of monetary policy was affecting money and credit developments in line with what had happened in the past
2023-01-19;2023;January;REPORT;Neutral;0.9907907247543335;he noted that in previous tightening cycles the rate on time deposits had closely followed the policy rate while the rate on overnight deposits had been systematically well below the policy rate
2023-01-19;2023;January;REPORT;Negative;0.9925475716590881;with the return of positive policy rates banks were currently restoring the past pricing structure by more strongly increasing those rates that were furthest from their normal distance visàvis the policy rate with rates on overnight deposits recording only minor increases so farlending rates on household mortgages had increased markedly contributing to a moderation in new lending to households driven mainly by lower mortgage lending growth
2023-01-19;2023;January;REPORT;Neutral;0.8972401022911072;rates on loans to firms had also increased substantially
2023-01-19;2023;January;REPORT;Negative;0.9832109212875366;however this increase had not yet translated into a significant moderation in bank lending to firms as firms had significantly reduced bond issuance when faced with an increase in the cost of issuing debt securities that outpaced more sluggish bank lending rates
2023-01-19;2023;January;REPORT;Positive;0.9414994120597839;moreover firms were facing higher borrowing needs in nominal terms as inflation had increased operating costs and investment financing needssumming up mr lane highlighted that amid exceptional uncertainty the substantial upward revision to the inflation profile over the entire projection horizon called for a monetary policy response that significantly reduced the inflation rate within the projection horizon
2023-01-19;2023;January;REPORT;Positive;0.662696123123169;the stronger inflation dynamic in the revised projections meant that the estimated range for the terminal rate that would ensure a return of inflation to target in a timely manner had risen markedly
2023-01-19;2023;January;REPORT;Neutral;0.9680891633033752;raising policy rates to sufficiently restrictive levels and keeping them there would over time reduce inflation by dampening demand and would also guard against the risk of a persistent upward shift in inflation expectationsmonetary policy considerations and policy optionsagainst this backdrop mr lane proposed that the three key ecb interest rates should be raised by 50 basis points at the present meeting
2023-01-19;2023;January;REPORT;Neutral;0.9745148420333862;he also proposed that it should be made clear that interest rates would still have to rise significantly at a steady pace to reach levels that were sufficiently restrictive to ensure a timely return of inflation to the 2 mediumterm target
2023-01-19;2023;January;REPORT;Neutral;0.7449566721916199;at the current juncture taking into account the cumulative 200 basis point increase in the key ecb interest rates since july a 50 basis point increment should be viewed as a sustainable pace at which monetary policy could be tightened in an expeditious manner
2023-01-19;2023;January;REPORT;Neutral;0.7661200761795044;an increase of this magnitude would acknowledge the uncertainties surrounding the state of the economy and the inflation outlook the lags with which the governing councils past policy actions were being transmitted and the overall tightening impulse being delivered across its portfolio of instruments including the reimbursement of tltros
2023-01-19;2023;January;REPORT;Neutral;0.9873226284980774;under conditions of significant uncertainty a steady pace would allow the governing council to learn more about the impact of its decisions on financial conditions and the broader economy thus far and to reassess on a meetingbymeeting basis the level of interest rates that would be sufficiently restrictive to ensure a timely return of inflation to its target
2023-01-19;2023;January;REPORT;Neutral;0.992420494556427;the key ecb interest rates were the primary tool for setting the monetary policy stance
2023-01-19;2023;January;REPORT;Neutral;0.9801065921783447;the governing council should reinforce the impact of its rate hikes throughout the yield curve by announcing principles for normalising the eurosystems monetary policy securities holdings
2023-01-19;2023;January;REPORT;Neutral;0.7776127457618713;mr lane therefore proposed communicating that from march 2023 onwards the app portfolio would decline at a measured and predictable pace as the eurosystem would not reinvest all of the principal payments from maturing securities
2023-01-19;2023;January;REPORT;Neutral;0.9851057529449463;mr lane proposed announcing that the decline would average 15 billion per month until the end of the third quarter of 2023 and that the governing council would determine its subsequent pace over time
2023-01-19;2023;January;REPORT;Neutral;0.9891332983970642;in addition the governing council should signal that the review of its operational framework for steering shortterm interest rates which was to be concluded by the end of 2023 would provide information regarding the endpoint of the balance sheet normalisation processin line with the ecbs monetary policy strategy the governing council should also use the present meeting to assess in depth the interrelation between monetary policy and financial stability
2023-01-19;2023;January;REPORT;Negative;0.9934247732162476;the financial stability environment had deteriorated since the governing councils last review in june 2022 owing to a weaker economy and rising credit risk
2023-01-19;2023;January;REPORT;Negative;0.9942530989646912;in addition sovereign vulnerabilities had risen amid the weaker economic outlook and weaker fiscal positions
2023-01-19;2023;January;REPORT;Negative;0.9669760465621948;tighter financing conditions would mitigate the buildup of financial vulnerabilities and reduce tail risks to inflation over the medium term at the cost of a higher risk of systemic stress and greater downside risks to growth in the short term
2023-01-19;2023;January;REPORT;Neutral;0.7025426626205444;in addition the liquidity needs of nonbank financial institutions could amplify market volatility
2023-01-19;2023;January;REPORT;Positive;0.9839867353439331;at the same time euro area banks had comfortable levels of capital which helped to reduce the side effects of tighter monetary policy on financial stability
2023-01-19;2023;January;REPORT;Positive;0.7022624611854553;macroprudential policy remained the first line of defence in preserving financial stability and addressing mediumterm vulnerabilities2
2023-01-19;2023;January;REPORT;Neutral;0.985639214515686;governing councils discussion and monetary policy decisionseconomic monetary and financial analyseswith regard to the economic analysis members broadly agreed with the assessment of the current economic situation in the euro area and the risks to the outlook provided by mr lane in his introduction
2023-01-19;2023;January;REPORT;Negative;0.9923946857452393;the euro area economy was expected to contract in the current quarter and the first quarter of next year owing to the energy crisis high uncertainty weakening global economic activity and tighter financing conditions
2023-01-19;2023;January;REPORT;Negative;0.9833102822303772;according to the latest eurosystem staff projections however a recession would be relatively shortlived and shallow
2023-01-19;2023;January;REPORT;Negative;0.9899298548698425;growth was nonetheless expected to be subdued in 2023 and had been revised down significantly since the september ecb staff projections
2023-01-19;2023;January;REPORT;Positive;0.8903059959411621;beyond the near term growth was projected to recover as the current headwinds faded
2023-01-19;2023;January;REPORT;Negative;0.9925540089607239;as regards the external environment members generally shared the assessment provided by mr lane that the world economy was slowing in a context of continued geopolitical uncertainty especially owing to russias unjustified war against ukraine and its people and tighter financing conditions worldwide
2023-01-19;2023;January;REPORT;Negative;0.9910071492195129;weakening global activity would also weigh on global trade and euro area foreign demand despite improvements in global supply chain pressures
2023-01-19;2023;January;REPORT;Negative;0.9810968637466431;attention was drawn to the risks surrounding the chinese economy which could lead to renewed bottlenecks in global supply chains
2023-01-19;2023;January;REPORT;Negative;0.9911718964576721;it was underlined that the euro area continued to be confronted by an exceptional degree of global uncertainty of both an economic and a geopolitical nature the impact of which still had to be fully understoodturning to euro area developments members concurred with mr lane that the euro area was likely to experience a mild recession in the last quarter of 2022 and the first quarter of 2023 economic growth in the euro area had slowed to 03 in the third quarter of 2022 high inflation and tighter financing conditions were dampening spending and production by reducing real household incomes and pushing up costs for firms
2023-01-19;2023;January;REPORT;Negative;0.9937835931777954;the past deterioration in the terms of trade reflecting a faster rise in import prices than in export prices continued to weigh on purchasing power in the euro area
2023-01-19;2023;January;REPORT;Negative;0.9350178241729736;on the positive side employment had increased by 03 in the third quarter and unemployment had fallen to a new historical low of 65 in october
2023-01-19;2023;January;REPORT;Positive;0.494037926197052;rising wages were set to restore some of the lost purchasing power supporting consumption
2023-01-19;2023;January;REPORT;Positive;0.9915585517883301;as the economy weakened however job creation was likely to slow and unemployment could rise over the coming quarterslooking ahead it was noted that eurosystem staff had revised down their economic growth projection for 2023 at the same time members highlighted the so far stronger than expected resilience of economic activity
2023-01-19;2023;January;REPORT;Positive;0.9933223128318787;domestic demand had clearly remained more robust in response to higher energy prices than previously feared reflecting the strong rebound in the demand for consumer services following the lifting of pandemicrelated restrictions
2023-01-19;2023;January;REPORT;Positive;0.9925756454467773;the labour market in particular remained robust in turn supporting domestic demand with the result that employment had barely been revised at all in the new projections
2023-01-19;2023;January;REPORT;Positive;0.8473058342933655;while this outcome was seen as good news it would also contribute to higher inflation in the medium term
2023-01-19;2023;January;REPORT;Negative;0.9940586090087891;it was acknowledged that growth was expected to be very close to zero in the coming year so the euro area was facing a very significant economic slowdown compared with 2022while domestic demand had so far been resilient in the face of higher energy prices there was considerable uncertainty about the dampening impact of tighter monetary policy
2023-01-19;2023;January;REPORT;Positive;0.8647969365119934;reference was made to structural models with forwardlooking or rational expectations that suggested a significantly stronger impact of monetary policy on aggregate demand than was embedded in the staff projections
2023-01-19;2023;January;REPORT;Neutral;0.973389208316803;those models also implied more balanced risks to the mediumterm outlook for inflation
2023-01-19;2023;January;REPORT;Negative;0.7942509055137634;at the same time it was remarked that the underlying empirical evidence did not appear to point to a high interest rate sensitivity of aggregate demand and inflation in large parts of the euro area notwithstanding significant heterogeneity in the transmission of monetary policy
2023-01-19;2023;January;REPORT;Positive;0.9786126613616943;in any case the forceful fiscal response to the energy crisis was an important factor behind the resilience of aggregate demand and the labour market even as measures adopted during the pandemic were being phased out
2023-01-19;2023;January;REPORT;Negative;0.9869598746299744;concern was therefore expressed as to how domestic demand would hold up in the face of an expected eventual withdrawal of fiscal supportgiven the performance of economic activity and labour markets it was noted that there was currently less need to revise down estimates of potential output growth at least to the extent that the resilience of the euro area economy was not just driven by fiscal support
2023-01-19;2023;January;REPORT;Negative;0.9778748154640198;however it was possible that the impact of the war  in particular the energy price shock  and the pandemic on the productive capacity of the economy would turn out to be greater and last longer than expected with the result that demand would have to be reduced more strongly to curb inflation
2023-01-19;2023;January;REPORT;Neutral;0.9715781807899475;a smaller output gap would be more consistent with the observed strong dynamics of core inflation
2023-01-19;2023;January;REPORT;Negative;0.5926945209503174;regarding the fiscal policy response to higher energy prices members reiterated that measures should be temporary and designed to help the most vulnerable households and firms so as to limit the risk of fuelling additional inflationary pressures
2023-01-19;2023;January;REPORT;Neutral;0.9803258180618286;fiscal support measures should be temporary targeted and tailored to preserving incentives to consume less energy
2023-01-19;2023;January;REPORT;Positive;0.9882705211639404;fiscal measures falling short of these principles were likely to exacerbate inflationary pressures which would necessitate a stronger monetary policy response
2023-01-19;2023;January;REPORT;Positive;0.859794557094574;moreover in line with the eus economic governance framework fiscal policies should be oriented towards making the economy more productive and gradually bringing down high public debt
2023-01-19;2023;January;REPORT;Positive;0.9887673258781433;policies to enhance the euro areas supply capacity especially in the energy sector could help reduce price pressures in the medium term
2023-01-19;2023;January;REPORT;Neutral;0.6867125034332275;to that end governments should swiftly implement their investment and structural reform plans under the next generation eu programme
2023-01-19;2023;January;REPORT;Neutral;0.9801779389381409;the reform of the eus economic governance framework should be concluded rapidly
2023-01-19;2023;January;REPORT;Neutral;0.9906858801841736;targeted income measures were generally perceived by members as more effective than price measures as the latter hampered the necessary longterm adjustment of energy production and consumption
2023-01-19;2023;January;REPORT;Negative;0.9938847422599792;it was widely highlighted that the current fiscal response was not sufficiently targeted which was creating challenges regarding the outlook for sound public finances and for monetary policy
2023-01-19;2023;January;REPORT;Negative;0.5826441645622253;with a continued relaxation of fiscal rules in 2023 fiscal deficits were seen as likely to be larger than currently projected on the basis of the standard assumptions
2023-01-19;2023;January;REPORT;Neutral;0.62916499376297;however it was also stressed that energy prices remained very volatile and that fiscal policy was currently trying to smooth the effects on households and firms
2023-01-19;2023;January;REPORT;Negative;0.977959930896759;as long as fiscal policy was mainly aiming to smooth the impact of higher energy prices over time it would not necessarily be regarded as expansionaryagainst this background members assessed risks to the economic growth outlook as being on the downside especially in the near term
2023-01-19;2023;January;REPORT;Negative;0.9927230477333069;russias war in ukraine continued to be a significant downside risk to the economy
2023-01-19;2023;January;REPORT;Negative;0.9874465465545654;energy and food costs might also remain persistently higher than expected
2023-01-19;2023;January;REPORT;Neutral;0.5858104228973389;there could be an additional drag on growth in the euro area if the world economy were to weaken more sharply than expectedwith regard to price developments members broadly agreed with the assessment presented by mr lane in his introduction
2023-01-19;2023;January;REPORT;Negative;0.7093391418457031;inflation had declined to 100 in november according to eurostats flash estimate mainly on the back of lower energy price inflation while services inflation had also edged down
2023-01-19;2023;January;REPORT;Negative;0.5602890253067017;food price inflation had risen further to 136 however as high input costs in food production were passed through to consumer prices
2023-01-19;2023;January;REPORT;Positive;0.9595558643341064;price pressures remained strong across sectors partly as a result of the impact of high energy costs throughout the economy
2023-01-19;2023;January;REPORT;Neutral;0.942919909954071;inflation excluding energy and food had been unchanged in november at 50 and other measures of underlying inflation were also high
2023-01-19;2023;January;REPORT;Neutral;0.9914116859436035;fiscal measures to compensate households for high energy prices and inflation were set to dampen inflation in 2023 but inflation would rise again once the measures were withdrawn
2023-01-19;2023;January;REPORT;Positive;0.9820258021354675;supply bottlenecks were gradually easing although their effects were still contributing to inflation pushing up goods prices in particular
2023-01-19;2023;January;REPORT;Neutral;0.7792258858680725;the same was true for the lifting of pandemicrelated restrictions while weakening the effect of pentup demand was still driving up prices especially in the services sector
2023-01-19;2023;January;REPORT;Neutral;0.9805672764778137;the depreciation of the euro in 2022 was also continuing to feed through to consumer prices
2023-01-19;2023;January;REPORT;Positive;0.9895600080490112;wage growth was strengthening supported by robust labour markets and some catchup in wages to compensate workers for high inflationmembers underlined that while headline inflation had slowed down in november inflation was still far too high
2023-01-19;2023;January;REPORT;Negative;0.993862509727478;delays in the passthrough of energy price increases to consumer prices and the recent rebound in gas prices also implied that there was uncertainty as to whether headline inflation had already reached its peak
2023-01-19;2023;January;REPORT;Neutral;0.7372451424598694;the latest data suggested that inflation was becoming much more broadbased and persistent
2023-01-19;2023;January;REPORT;Negative;0.9549245238304138;while the decline in headline inflation in november had been unexpected inflation was still higher than projected in september
2023-01-19;2023;January;REPORT;Negative;0.8485850691795349;as higher inflation was projected to extend into 2024 and 2025 it was no longer driven solely by negative supply shocks the pandemic and energy prices
2023-01-19;2023;January;REPORT;Neutral;0.9898698925971985;abovetarget inflation had now clearly reached the policyrelevant horizon for which the ecb was to be held accountable
2023-01-19;2023;January;REPORT;Negative;0.6915234327316284;indeed even if headline inflation numbers came down sharply in the course of 2023 largely owing to base effects this was not likely to be the case for underlying inflation
2023-01-19;2023;January;REPORT;Positive;0.991051435470581;measures of underlying inflation continued to display very strong monthonmonth dynamics
2023-01-19;2023;January;REPORT;Neutral;0.9734643697738647;this was also reflected in the projections which saw core inflation higher in 2023 than in 2022 more persistent and clearly above target in 2025 this implied an increased risk of inflation becoming entrenched in the euro area economyat the same time it was underlined that the december staff projections for inflation had been revised up significantly especially for the outer years of the projections with an unprecedented revision of projected headline inflation in 2024 it was noted that the upward revision over that horizon reflected to a large extent revised judgement and the time profile of fiscal measures as all relevant technical assumptions eg
2023-01-19;2023;January;REPORT;Neutral;0.9024539589881897;oil prices gas prices the exchange rate and interest rates had been revised since the september exercise in a direction that should have led to lower inflation
2023-01-19;2023;January;REPORT;Neutral;0.8572074174880981;consequently the upward revision of the inflation projections largely reflected an upward revision to domestic cost pressures and an updated judgement on the speed and extent of the passthrough of costs to prices
2023-01-19;2023;January;REPORT;Negative;0.8111170530319214;the recent strengthening of the euro constituted a noteworthy change in the external environment and would likely imply somewhat lower inflationary pressures for the euro area in the period ahead even though the lagged effects of the euros pronounced past depreciation would still be working their way through the economy
2023-01-19;2023;January;REPORT;Neutral;0.8781251311302185;finally it was highlighted that the speed at which inflation was projected to come down had not been revised much from the september projections
2023-01-19;2023;January;REPORT;Neutral;0.7523590922355652;in particular the profile of a steep decline in core inflation when the current quarter was compared with the fourth quarter of 2024 had remained practically unchanged once the higher starting level was taken into accountmembers recalled that wage pressures were key to understanding the risk of secondround effects on inflation
2023-01-19;2023;January;REPORT;Negative;0.5001007318496704;as wage developments in the euro area were accelerating secondround effects through higher wages appeared to be starting to materialise
2023-01-19;2023;January;REPORT;Negative;0.9915607571601868;labour markets continued to be historically tight and there were increasing pressures on wages
2023-01-19;2023;January;REPORT;Positive;0.9651371240615845;compensation per employee which had previously grown at a rate similar to that of negotiated wages was now growing significantly faster
2023-01-19;2023;January;REPORT;Neutral;0.9933298230171204;the growth in unit labour costs had picked up substantially and was expected at the end of the projection horizon to stand at levels that were not consistent with the ecbs inflation target
2023-01-19;2023;January;REPORT;Negative;0.9893594980239868;this was also driven by a decline in labour productivity which might be partly due to workers not having been reallocated since the pandemic
2023-01-19;2023;January;REPORT;Neutral;0.9530673623085022;these factors could be considered to point to secondround effects becoming a reality
2023-01-19;2023;January;REPORT;Neutral;0.9788716435432434;however the view was also expressed that unit labour costs were still relatively contained over the projection horizon even though they had to be monitored closelyfiscal policies were also widely seen as playing a crucial role in determining the degree of persistence of mediumterm inflation
2023-01-19;2023;January;REPORT;Negative;0.540226936340332;in the sensitivity analysis carried out in the context of the projections upside inflation risks stemming from fiscal policy were substantial
2023-01-19;2023;January;REPORT;Neutral;0.6351278424263;fiscal policies were already more expansionary than previously expected and they were likely to become even more expansionary
2023-01-19;2023;January;REPORT;Neutral;0.9921106696128845;however the view was also expressed that the fiscal measures would largely expire or reverse naturally and therefore these could be looked through in the design of monetary policy
2023-01-19;2023;January;REPORT;Neutral;0.9522294402122498;the higher inflation rates projected for the latter years of the projection period were instead a direct consequence of the assumptions made concerning fiscal plans which might well turn out to overestimate the overall inflationary impact of the fiscal policy stance at that horizon
