Date;Year;Month;Type;sentiment;sentiment_score;sentence
2020-01-23;2020;January;Monetary Policy Decisions;Neutral;0.9828040599822998;the governing council expects the key ecb interest rates to remain at their present or lower levels until it has seen the inflation outlook robustly converge to a level sufficiently close to but below 2 within its projection horizon and such convergence has been consistently reflected in underlying inflation dynamics
2020-01-23;2020;January;Monetary Policy Decisions;Neutral;0.9854323267936708;the governing council will continue to make net purchases under its asset purchase programme app at a monthly pace of 20 billion
2020-01-23;2020;January;Monetary Policy Decisions;Neutral;0.9923527836799622;the governing council expects them to run for as long as necessary to reinforce the accommodative impact of its policy rates and to end shortly before it starts raising the key ecb interest rates
2020-01-23;2020;January;Monetary Policy Decisions;Neutral;0.991869568824768;at todays meeting the governing council of the european central bank ecb decided that the interest rate on the main refinancing operations and the interest rates on the marginal lending facility and the deposit facility will remain unchanged at 000 025 and 050 respectively
2020-01-23;2020;January;Monetary Policy Decisions;Neutral;0.9842958450317384;the governing council also decided to launch a review of the ecbs monetary policy strategy
2020-01-23;2020;January;Monetary Policy Decisions;Neutral;0.9738367199897766;further details about the scope and timetable of the review will be published in a press release today at 1530 cet
2020-01-23;2020;January;Monetary Policy Decisions;Neutral;0.9849677681922911;the president of the ecb will comment on the considerations underlying these decisions at a press conference starting at 1430 cet today
2020-01-23;2020;January;Monetary Policy Decisions;Positive;0.973003089427948;the governing council intends to continue reinvesting in full the principal payments from maturing securities purchased under the app for an extended period of time past the date when it starts raising the key ecb interest rates and in any case for as long as necessary to maintain favourable liquidity conditions and an ample degree of monetary accommodation
