Date;Year;Month;Type;sentiment;sentiment_score;sentence
2007-06-28;2007;June;Minute;Negative;0.9900056719779968;some participants noted a risk that the saving rate could rise more than currently foreseen particularly if household wealth were depressed by a further softening in house prices or by a less buoyant equity market that might accompany a potential slowing in the growth of corporate earnings
2007-06-28;2007;June;Minute;Neutral;0.8138132691383362;members generally anticipated that core inflation would remain relatively subdued but concurred that a sustained moderation in inflation had not yet been convincingly demonstrated
2007-06-28;2007;June;Minute;Neutral;0.9835975766181946;in their discussion of monetary policy for the intermeeting period members generally regarded the risks to economic growth as more balanced than at the time of the may meeting
2007-06-28;2007;June;Minute;Neutral;0.9626045823097229;nonetheless several participants emphasized that holding longrun inflation expectations at or below current levels would likely be necessary for core inflation to moderate as expected over coming quarters
2007-06-28;2007;June;Minute;Neutral;0.9471973776817322;however a portion of this increase might be attributed to technical factors and survey measures of longterm inflation expectations had held steady over recent weeks
2007-06-28;2007;June;Minute;Neutral;0.976486086845398;on this point several participants cited the uptick in forward measures of inflation compensation over the intermeeting period derived from treasury inflationindexed securities
2007-06-28;2007;June;Minute;Negative;0.9939013719558716;while total inflation was expected to slow toward the pace of core inflation over time a number of participants noted that recent elevated readings posed some risk of a deterioration in inflation expectations
2007-06-28;2007;June;Minute;Positive;0.9857583045959473;in addition while core consumer price inflation had moderated of late total consumer price inflation had moved substantially higher boosted by rising energy and food prices
2007-06-28;2007;June;Minute;Negative;0.988849401473999;moreover a number of forces could sustain inflation pressures including the generally high level of resource utilization elevated energy and commodity prices the decline in the exchange value of the dollar over recent quarters and slower productivity growth
2007-06-28;2007;June;Minute;Positive;0.7114577293395996;although the housing market remained a key source of uncertainty about the outlook members thought it most likely that the overall economy would expand at a moderate pace over coming quarters
2007-06-28;2007;June;Minute;Positive;0.6834356188774109;still the advance in spending was expected to fall short of income growth and the saving rate was anticipated to trend higher over coming quarters from the unusually low levels of recent years
2007-06-28;2007;June;Minute;Negative;0.9900814890861511;still some decline in the pace of trend productivity growth could not be ruled outa development that could have implications for business costs and price pressures
2007-06-28;2007;June;Minute;Neutral;0.5577065944671631;to be sure personal consumption expenditures appeared to be rising more slowly in recent months than earlier in the year but that development was probably at least in part a result of the rise in gasoline prices which was not expected to be extended
2007-06-28;2007;June;Minute;Negative;0.9796023368835449;although some of the recent slowing in readings on core pce inflation was likely due to transitory factors the staff took some signal from the data and trimmed its forecast for core pce inflation slightly in coming quarters
2007-06-28;2007;June;Minute;Neutral;0.7568432688713074;increases in energy and food prices over the intermeeting period led the staff to revise up its forecast for headline pce inflation during the second quarter but its projection of core pce inflation was revised down
2007-06-28;2007;June;Minute;Positive;0.9891071915626526;as was the case in may economic activity was expected to increase at a rate a little below that of the economys longrun potential for the remainder of the year and to rise at a pace broadly in line with potential output growth in 2008 the projected gradual acceleration in economic activity in coming quarters largely reflected the expected waning of the drag from residential investment and improvements in the pace of business fixed investment
2007-06-28;2007;June;Minute;Neutral;0.9909113049507141;the revisions however left the projection of economic growth over the first half of the year unchanged
2007-06-28;2007;June;Minute;Positive;0.8564197421073914;in preparation for this meeting the staff reduced its estimate of the increase in real gdp in the first quarter and marked up its forecast of the rebound in economic activity in the second quarter in large part because of a more substantial swing in inventory investment than previously expected
2007-06-28;2007;June;Minute;Positive;0.9170852303504944;consumer credit continued to expand at a moderate pace in the first quarter
2007-06-28;2007;June;Minute;Neutral;0.9654836058616638;interest rates available to prime borrowers on both fixedrate and variablerate mortgages increased along with other market interest rates
2007-06-28;2007;June;Minute;Neutral;0.9887230396270752;over the next several quarters total pce inflation was projected to moderate to a pace close to core pce inflation
2007-06-28;2007;June;Minute;Negative;0.9941125512123108;in the household sector mortgage debt expanded at a slower pace in the first quarter reflecting the slowdown in homeprice appreciation over the past year and the lower pace of home sales
2007-06-28;2007;June;Minute;Neutral;0.9829703569412231;acquisitionrelated financing continued to support corporate bond issuance but a significant share of recent issues was reportedly designated for capital expenditures
2007-06-28;2007;June;Minute;Positive;0.9905129671096802;gross bond issuance by nonfinancial businesses surged in may from the already robust pace of earlier in the year
2007-06-28;2007;June;Minute;Neutral;0.9388439059257507;the foreign exchange value of the dollar against other major currencies was little changed on balance
2007-06-28;2007;June;Minute;Positive;0.9870692491531372;equity prices were volatile at times during the intermeeting period but broad stock price indexes advanced modestly on net as favorable news on the economy and announcements of mergers and acquisitions outweighed the drag of higher bond yields
2007-06-28;2007;June;Minute;Neutral;0.7697447538375854;in contrast spreads on speculativegrade corporate bonds narrowed
2007-06-28;2007;June;Minute;Positive;0.9926693439483643;participants generally anticipated moderate gains in consumption spending over coming months supported by the strong labor market and solid growth in personal income
2007-06-28;2007;June;Minute;Neutral;0.9818045496940613;yields on investmentgrade corporate bonds rose in line with those on comparablematurity treasury securities leaving their spreads little changed
2007-06-28;2007;June;Minute;Positive;0.9910763502120972;commercial paper outstanding was unchanged in may but bank lending maintained a strong pace
2007-06-28;2007;June;Minute;Positive;0.6805882453918457;in their discussion of the economic situation and outlook participants noted that economic activity appeared to have expanded at a moderate pace on balance over the first half of the year
2007-06-28;2007;June;Minute;Neutral;0.5319867730140686;after rising at a particularly rapid rate in the first quarter m2 increased at a more moderate pace in april and may
2007-06-28;2007;June;Minute;Negative;0.9857202172279358;moreover a number of participants pointed to rising mortgage delinquency rates and related difficulties in the subprime mortgage market as factors that could crimp the availability of mortgage credit and the demand for housing
2007-06-28;2007;June;Minute;Negative;0.953567624092102;in view of incoming data and anecdotal information participants continued to anticipate moderate economic growth in coming quarters with growth rising gradually to a pace close to that of potential output
2007-06-28;2007;June;Minute;Negative;0.9644864201545715;the recent increase in interest rates for prime mortgages could further dampen the demand for housing
2007-06-28;2007;June;Minute;Neutral;0.8108260035514832;participants also identified a number of downside risks associated with their outlook for residential construction
2007-06-28;2007;June;Minute;Negative;0.91697096824646;housing activity was seen as likely to continue to contract for several more quarters
2007-06-28;2007;June;Minute;Negative;0.9747384786605835;a number of participants noted that inventories of new homes for sale remained quite elevated
2007-06-28;2007;June;Minute;Negative;0.9930104613304138;participants generally agreed that the housing sector was likely to remain a drag on growth for some time yet and represented the most significant downside risk to the economic outlook
2007-06-28;2007;June;Minute;Neutral;0.9851375818252563;these rates of growth were associated with civilian unemployment rates in the range of 412 to 434 percent in the fourth quarter of 2007 and 412 to 5 percent in the fourth quarter of 2008 the central tendency of these projections was 412 to 434 percent in 2007 and about 434 percent in 2008 projections for the rate of inflation as measured by the core pce price index in 2007 were in a range of 2 to 214 percent in 2007 and 134 to 2 percent in 2008 the central tendencies of these projections in 2007 and 2008 were identical to the ranges for those years
2007-06-28;2007;June;Minute;Negative;0.9948016405105591;although starts of singlefamily homes had moved up on balance over recent months permits for new construction continued to decline
2007-06-28;2007;June;Minute;Neutral;0.9877113699913025;the projections for the growth of nominal gdp were in the range of 412 to 512 percent with a central tendency of 412 to 5 percent for 2007 for 2008 the projections for nominal gdp growth ranged between 412 to 512 with a central tendency of 434 to 5 percent
2007-06-28;2007;June;Minute;Neutral;0.9833040237426758;in preparation for the federal reserves semiannual report to the congress on the economy and monetary policy the members of the board of governors and the presidents of the federal reserve banks submitted individual projections of the growth of nominal and real gdp the rate of unemployment and core consumer price inflation for the years 2007 and 2008 conditioned on their views of the appropriate path for monetary policy
2007-06-28;2007;June;Minute;Neutral;0.7547685503959656;against this backdrop participants agreed that the risk that inflation would fail to moderate as expected remained their predominant concern
2007-06-28;2007;June;Minute;Negative;0.9954231381416321;recent data on core consumer prices were encouraging in this regard but participants were wary of drawing any firm conclusions about future trends from a few monthly readings that could reflect transitory influences and remained concerned about forces that could contribute to inflation pressures
2007-06-28;2007;June;Minute;Positive;0.9494841694831848;participants generally expected that inflation would probably edge lower over the next two years reflecting the waning of temporary factors that had boosted prices last year and a slight easing of pressures on resources
2007-06-28;2007;June;Minute;Negative;0.7201052308082581;participants interpreted the most recent information on business spending business sentiment and the labor market as suggesting that the risks to growth were more balanced than at the time of the may meeting despite the ongoing adjustment in the housing sector and the significant recent increases in longerterm interest rates
2007-06-28;2007;June;Minute;Neutral;0.9863627552986145;projections for the rate of expansion in real gdp in 2007 were in a range from 2 to 234 percent in 2007 with a central tendency of 214 to 212 percent for 2008 the projections ranged between 212 to 3 percent with a central tendency of 212 to 234 percent
2007-06-28;2007;June;Minute;Negative;0.9809957146644592;spillovers from the strains in the housing market to consumption spending had apparently been quite limited to date
