Date;Year;Month;Type;sentiment;sentiment_score;sentence
2007-06-28;2007;June;Minute;Negative;0.9817613959312439;the recent narrowing reflected a steep decline in many categories of goods imports and a modest increase in exports especially of agricultural products
2007-06-28;2007;June;Minute;Negative;0.9943864345550537;in japan recent data suggested that growth in the second quarter had moderated from the vigorous firstquarter pace with public spending and net exports likely sources of weakness
2007-06-28;2007;June;Minute;Positive;0.9907474517822266;in the euro area export growth in the first quarter slowed from its rapid fourthquarter pace and the hike in the german valueadded tax likely temporarily depressed firstquarter consumption growth consumer spending showed signs of recovering in recent months and overall economic conditions in the euro area remained solid
2007-06-28;2007;June;Minute;Positive;0.9927886128425598;economic growth in canada rebounded sharply from a disappointing fourth quarter and growth picked up in the united kingdom owing primarily to a robust expansion in the service sector
2007-06-28;2007;June;Minute;Positive;0.9912286996841431;economic activity in advanced foreign economies appeared to have grown at a solid rate in the first quarter
2007-06-28;2007;June;Minute;Neutral;0.9121001362800598;nominal imports of petroleum were flat in april after surging in march despite steady increases in the price of imported oil
2007-06-28;2007;June;Minute;Negative;0.8596653938293457;after no change between the fourth quarter and first quarter the us international trade deficit narrowed in april from its march level
2007-06-28;2007;June;Minute;Negative;0.566317081451416;purchases of medium and heavy trucks dropped further in may continuing to reflect the payback from sales that were pulled forward into 2005 and 2006 in anticipation of tighter emissions standards that took effect in january
2007-06-28;2007;June;Minute;Negative;0.9920361638069153;inventories of light motor vehicles which were pared down to more comfortable levels during the first quarter continued to edge lower through may
2007-06-28;2007;June;Minute;Negative;0.949241578578949;real nonfarm inventory investment excluding motor vehicles slowed appreciably in the first quarter of 2007 as firms in most industries appeared to have made considerable progress in addressing the inventory overhangs that developed in 2006 the adjustment apparently continued into the second quarter as the ratio of inventories to sales for manufacturing and trade excluding motor vehicles ticked down further in april after a march decline
2007-06-28;2007;June;Minute;Positive;0.729985237121582;nonetheless firms retained ample cash in reserve to finance investment
2007-06-28;2007;June;Minute;Negative;0.9929860234260559;the downtrend in the cost of capital was likely curtailed in recent weeks by the rise in corporate bond rates
2007-06-28;2007;June;Minute;Negative;0.9650889039039612;shipments data indicated that spending on aircraft dropped back from the elevated level in the first quarter
2007-06-28;2007;June;Minute;Positive;0.6037154793739319;new orders for trucks picked up in may albeit from very low levels
2007-06-28;2007;June;Minute;Positive;0.9918334484100342;recent data indicated that economic activity in emergingmarket economies remained strong
2007-06-28;2007;June;Minute;Negative;0.48997923731803894;indeed the inventory adjustment reached the point that for the third month in a row the may survey of purchasing managers indicated that on net more firms viewed their customers inventory levels as too low rather than too high
2007-06-28;2007;June;Minute;Negative;0.9910365343093872;growth in china and india appeared to have moderated somewhat from the very high rates of the first quarter
2007-06-28;2007;June;Minute;Positive;0.8314822912216187;over the intermeeting period however investors seemed to reappraise their beliefs that the economic expansion would slow and that monetary policy easing would be forthcoming
2007-06-28;2007;June;Minute;Neutral;0.8821539282798767;headline consumer price inflation stepped up in recent months driven by large increases in the index for energy
2007-06-28;2007;June;Minute;Negative;0.9950543642044067;in contrast spending on transportation equipment declined significantly
2007-06-28;2007;June;Minute;Negative;0.8691909313201904;market participants had largely anticipated the fomcs decision at its may meeting to leave the target federal funds rate unchanged but some market participants were reportedly surprised by the retention of the assessment that inflation was somewhat elevated the publication of the minutes of the may meeting elicited little market response
2007-06-28;2007;June;Minute;Neutral;0.9931328892707825;future policy adjustments would depend on the evolution of the outlook for both inflation and economic growth as implied by incoming information
2007-06-28;2007;June;Minute;Negative;0.9537418484687805;the committees predominant policy concern remained the risk that inflation would fail to moderate as expected
2007-06-28;2007;June;Minute;Negative;0.9535187482833862;although inflation pressures seemed likely to moderate over time the high level of resource utilization had the potential to sustain those pressures
2007-06-28;2007;June;Minute;Negative;0.9509801268577576;core inflation remained somewhat elevated
2007-06-28;2007;June;Minute;Negative;0.8083391785621643;nevertheless the economy seemed likely to expand at a moderate pace over coming quarters
2007-06-28;2007;June;Minute;Positive;0.9848040342330933;in latin america indicators for mexico suggested some recovery from the marked slowdown of the previous few quarters while growth in argentina and brazil appeared to pick up as well
2007-06-28;2007;June;Minute;Neutral;0.5752185583114624;the committees accompanying statement noted that economic growth slowed in the first part of the year and that the adjustment in the housing sector was ongoing
2007-06-28;2007;June;Minute;Neutral;0.7477907538414001;the twelvemonth change in average hourly earnings for production or nonsupervisory workers edged lower in recent months
2007-06-28;2007;June;Minute;Negative;0.782619833946228;after edging higher in april and may median expectations of longerterm inflation fell back in june and remained in the narrow range seen over the past two years
2007-06-28;2007;June;Minute;Positive;0.9807235598564148;household surveys conducted in early june indicated that the median expectation for yearahead inflation increased further consistent with the energydriven acceleration in overall consumer prices in recent months
2007-06-28;2007;June;Minute;Negative;0.9918640851974487;the twelvemonth change in core pce prices in may was expected to be lower than the increase over the yearearlier period however over that longer period the decline in core pce inflation was almost entirely the result of a slowing in its nonmarket component
2007-06-28;2007;June;Minute;Negative;0.9930289387702942;the recent readings had been held down in part by declines in volatile categories such as apparel and tobacco products that were likely to prove transitory the rent components had also decelerated
2007-06-28;2007;June;Minute;Neutral;0.8354734778404236;core pce prices rose 01 percent in april and were estimated to have posted a similar modest increase in may
2007-06-28;2007;June;Minute;Negative;0.9922552108764648;however readings on core inflation had declined
2007-06-28;2007;June;Minute;Neutral;0.987112820148468;at its may meeting the federal open market committee fomc maintained its target for the federal funds rate at 514 percent
2007-06-28;2007;June;Minute;Negative;0.8861460089683533;after a surge in outlays on computers in the first quarter spending on hightech equipment appeared to be rising at a more modest pace in april and may
2007-06-28;2007;June;Statement;Neutral;0.9848771095275879;the federal open market committee decided today to keep its target for the federal funds rate at 514 percent
2007-06-28;2007;June;Minute;Positive;0.9921473860740662;shipments and orders for items other than transportation moved up markedly in march and april after weakness in earlier months and even with the small declines in may the data pointed to a healthy rise in outlays in the second quarter
2007-06-28;2007;June;Minute;Negative;0.9956437349319458;consumer spending appeared to have slowed from its rapid pace earlier in the year while business fixed investment continued to rise at a modest rate
2007-06-28;2007;June;Minute;Positive;0.9854934811592102;upswings in net exports and inventory investment were expected to contribute importantly to the rise in real gdp
2007-06-28;2007;June;Minute;Positive;0.9868813753128052;2 attended portion of the meeting relating to the economic outlook and monetary policy discussionthe information reviewed at the june meeting suggested that the expansion of economic activity rebounded in the second quarter from its subpar pace in the first quarter
2007-06-28;2007;June;Minute;Neutral;0.8929228186607361;fisher ms pianalto and messrs plosser and stern alternate members of the federal open market committee messrs lacker and lockhart and ms yellen presidents of the federal reserve banks of richmond atlanta and san francisco respectively mr reinhart secretary and economist ms smith assistant secretary mr skidmore assistant secretary mr alvarez general counsel ms johnson economist mr stockton economist messrs connors evans fuhrer madigan rasche sellon slifman and wilcox associate economists mr dudley manager system open market account messrs clouse and english associate directors division of monetary affairs board of governors ms liang and mr struckmeyer associate directors division of research and statistics board of governors messrs leahy and wascher deputy associate directors divisions of international finance and research and statistics respectively board of governors mr dale senior adviser division of monetary affairs board of governors mr blanchard assistant to the board office of board members board of governors mr gross 1 special assistant to the board office of board members board of governors mr small project manager division of monetary affairs board of governors mr ahmed 2 and ms kusko 2 senior economists divisions of international finance and research and statistics respectively board of governors mr luecke senior financial analyst division of monetary affairs board of governors ms beechey and mr natalucci 2 economists division of monetary affairs board of governors ms low open market secretariat specialist division of monetary affairs board of governors mr moore first vice president federal reserve bank of cleveland mr rosenblum executive vice president federal reserve bank of dallas ms mester messrs sniderman weinberg and williams senior vice presidents federal reserve banks of philadelphia cleveland richmond and san francisco respectively ms mclaughlin and mr tallman vice presidents federal reserve banks of new york and atlanta respectively ms mcconnell assistant vice president federal reserve bank of new york mr weber senior research officer federal reserve bank of minneapolis 1 attended portion of the meeting relating to monetary policy communications
2007-06-28;2007;June;Minute;Neutral;0.8847233653068542;minutes of the federal open market committee june 2728 2007 a meeting of the federal open market committee was held in the offices of the board of governors of the federal reserve system in washington dc on wednesday june 27 2007 at 200 pm and continued on thursday june 28 2007 at 900 am presentmr bernanke chairman mr geithner vice chairman mr hoenig mr kohn mr kroszner ms minehan mr mishkin mr moskow mr poole mr warshmr
2007-06-28;2007;June;Statement;Neutral;0.6926426887512207;warsh
2007-06-28;2007;June;Statement;Neutral;0.968286395072937;voting for the fomc monetary policy action were ben s bernanke chairman timothy f geithner vice chairman thomas m hoenig donald l kohn randall s kroszner cathy e minehan frederic s mishkin michael h moskow william poole and kevin m
2007-06-28;2007;June;Statement;Neutral;0.9918613433837891;future policy adjustments will depend on the evolution of the outlook for both inflation and economic growth as implied by incoming information
2007-06-28;2007;June;Statement;Negative;0.9816138744354248;in these circumstances the committees predominant policy concern remains the risk that inflation will fail to moderate as expected
2007-06-28;2007;June;Statement;Negative;0.9007503390312195;moreover the high level of resource utilization has the potential to sustain those pressures
2007-06-28;2007;June;Statement;Negative;0.5621121525764465;however a sustained moderation in inflation pressures has yet to be convincingly demonstrated
2007-06-28;2007;June;Statement;Positive;0.9853727221488953;readings on core inflation have improved modestly in recent months
2007-06-28;2007;June;Statement;Negative;0.6648509502410889;the economy seems likely to continue to expand at a moderate pace over coming quarters
2007-06-28;2007;June;Statement;Negative;0.9899935126304626;economic growth appears to have been moderate during the first half of this year despite the ongoing adjustment in the housing sector
2007-06-28;2007;June;Minute;Positive;0.807988166809082;this reappraisal seemed to be based in part on the release of some economic data in the united states and abroad that were more favorable than expected
2007-06-28;2007;June;Minute;Negative;0.9947912693023682;residential construction remained weak as builders worked further to clear high inventories of unsold homes
2007-06-28;2007;June;Minute;Negative;0.9934182167053223;sharp increases in energy prices drove up overall inflation in april and appeared to have done so again in may core inflation seemed to have remained subdued
2007-06-28;2007;June;Minute;Negative;0.9939152598381042;employment continued to rise at a moderate pace the average monthly increase in payroll employment in april and may was a little below that of the first quarter
2007-06-28;2007;June;Minute;Negative;0.9926360249519348;in may employment was boosted by strong hiring in the service sector but the manufacturing and retail sectors continued to shed jobs
2007-06-28;2007;June;Minute;Neutral;0.9891420602798462;business spending on equipment and software in recent months appeared to be about unchanged from the first quarter although the softness was largely confined to outlays for transportation equipment
2007-06-28;2007;June;Minute;Positive;0.9835605621337891;outlays for nonresidential construction appeared to have remained robust early in the second quarter
2007-06-28;2007;June;Minute;Negative;0.9926148653030396;even though the inventory of new homes for sale ticked down in may the months supply in may remained noticeably above its level in late 2006 according to ofheos purchaseonly price index for existing homes houseprice appreciation continued to slow in the first quarter
2007-06-28;2007;June;Minute;Negative;0.9886652231216431;the monthly readings on sales of new and existing homes through may had fluctuated around levels lower than the average over the second half of 2006 some though not all of this weakening in home sales was likely related to the tightening of lending standards for nonprime borrowers that began in february
2007-06-28;2007;June;Minute;Negative;0.9879897236824036;in may singlefamily housing starts declined and adjusted permit issuance for the singlefamily sector stepped down further indicating that builders were intending to slow further the pace of new construction
2007-06-28;2007;June;Minute;Negative;0.9932293891906738;elevated inventories of unsold new homes continued to weigh on residential construction activity
2007-06-28;2007;June;Minute;Negative;0.9398081302642822;although the household wealthtoincome ratio ticked down in the first quarter with the stock market up only a little and house prices remaining soft the increase in stock prices in the second quarter likely made up much of the lost ground
2007-06-28;2007;June;Minute;Positive;0.9575276970863342;in particular real spending on equipment other than hightech and transportation seemed to be rebounding after sizable declines over the previous two quarters
2007-06-28;2007;June;Minute;Negative;0.6987876296043396;real disposable personal income rose at a moderate pace on average in the first four months of the year boosted not only by ongoing gains in wages and salaries but also by unusually large bonus payments and stock option exercises in the first quarter
2007-06-28;2007;June;Minute;Positive;0.9919285774230957;the deceleration primarily reflected a flattening out of outlays for goods in recent months spending on services continued to rise at a solid pace for the quarter as a whole although the monthly pattern was affected by weatherrelated swings in outlays on energy services
2007-06-28;2007;June;Minute;Negative;0.9958243370056152;the pace of real consumer spending appeared to have slowed somewhat in the second quarter after substantial increases late last year and early this year
2007-06-28;2007;June;Minute;Negative;0.974383533000946;capacity utilization in the manufacturing sector in may was close to its longrun average and slightly below its level one year earlier
2007-06-28;2007;June;Minute;Positive;0.5834816098213196;the production of hightech industries also rose albeit at a relatively sluggish pace compared with the brisk expansion seen around the turn of the year
2007-06-28;2007;June;Minute;Positive;0.9582950472831726;manufacturing output edged up in recent months reflecting increases in the output of light motor vehicles other consumer durable goods construction supplies and durable materials
2007-06-28;2007;June;Minute;Positive;0.5188089609146118;industrial production increased modestly in april and may after having been little changed in the first quarter when some manufacturers restrained production to cope with a buildup in inventories
2007-06-28;2007;June;Minute;Negative;0.65325528383255;larger payrolls and a slightly longer average workweek in may led to an increase in aggregate hours the unemployment rate held steady at 45 percent
2007-06-28;2007;June;Minute;Neutral;0.970487117767334;the determinants of household spending were broadly supportive
2007-06-28;2007;June;Minute;Negative;0.8437204360961914;as a result the expected path of the federal funds rate over the coming year was marked up sharply in financial markets
2007-06-28;2007;June;Minute;Negative;0.9619741439819336;to further its longrun objectives the committee in the immediate future seeks conditions in reserve markets consistent with maintaining the federal funds rate at an average of around 514 percent the vote encompassed approval of the text below for inclusion in the statement to be released at 215 pm in these circumstances the committees predominant policy concern remains the risk that inflation will fail to moderate as expected
2007-06-28;2007;June;Minute;Positive;0.787161648273468;measures of longhorizon inflation compensation based on inflationindexed treasury securities edged slightly higher
2007-06-28;2007;June;Minute;Negative;0.9939325451850891;some participants also pointed to evidence of lags in employment adjustments particularly in the construction industry as a factor depressing productivity in recent quarters
2007-06-28;2007;June;Minute;Neutral;0.9845194816589355;in their discussion of this issue participants noted that employment data for 2006 could ultimately be revised down resulting in a corresponding upward revision to productivity
2007-06-28;2007;June;Minute;Negative;0.9957817792892456;the continued tautness of labor markets was something of a puzzle in light of belowtrend economic growth over recent quarters and this development seemed to be connected with slower productivity growth lately
2007-06-28;2007;June;Minute;Neutral;0.6211692690849304;most participants judged labor market conditions to remain rather tight particularly for the most skilled workers
2007-06-28;2007;June;Minute;Positive;0.9886294603347778;the rise in global interest rates was cited as evidence of increasing global demand and some participants pointed to strength of aggregate demand worldwide and its potential effect on the prices of imports and globally traded commodities as contributing to upside risks to us inflation
2007-06-28;2007;June;Minute;Positive;0.9834764003753662;strength in spending abroad and the decline in the exchange value of the dollar were seen as factors boosting us exports
2007-06-28;2007;June;Minute;Neutral;0.6816546320915222;although credit market conditions seemed to remain generally quite accommodative in the days just prior to the meeting the availability of credit to some highly leveraged and other lowerrated borrowers appeared to be tightening a bit and investors seemed to reevaluate the risks associated with investments in complex and illiquid financial instruments
2007-06-28;2007;June;Minute;Negative;0.9945403933525085;longerterm interest rates and the cost of credit generally had moved higher of late the growth of business profits seemed to be moderating and measured productivity growth had been slower
2007-06-28;2007;June;Minute;Negative;0.9915000796318054;at the same time some recognized the possibility that downside risks to investment spending persisted
2007-06-28;2007;June;Minute;Positive;0.9889248013496399;participants noted that inventories appeared to be better aligned with sales boding well for a resumption of inventory accumulation and a pickup in manufacturing activity
2007-06-28;2007;June;Minute;Positive;0.9690779447555542;strength in foreign demand for us goods and services was another factor that seemed likely to contribute to the firming of business spending
2007-06-28;2007;June;Minute;Positive;0.9795039296150208;in particular orders and shipments for nondefense capital goods had stepped up on balance from march through may and survey indicators of business conditions had improved of late
2007-06-28;2007;June;Minute;Positive;0.9470925331115723;a number of participants remarked that the recent data on business spending were more encouraging than those available at the time of the may meeting
2007-06-28;2007;June;Minute;Negative;0.9891409873962402;at the same time participants recognized that consumption growth had held up to date and saw a risk that the saving rate could fail to rise as much as currently expected particularly if equity markets continued to register significant gains
2007-06-28;2007;June;Minute;Negative;0.9179989099502563;several participants noted that higher interest rates and a potential tightening in credit availability might also be factors that could contribute to a rise in the personal saving rate
2007-06-28;2007;June;Minute;Negative;0.8323956727981567;these observations suggested that the recent decline in productivity growth might prove smaller than now estimated and largely transitory
2007-06-28;2007;June;Minute;Positive;0.48916953802108765;some participants further noted that the level of the unemployment rate consistent with stable inflation could be lower than previously thoughta possibility that would help to explain the absence of outsized wage pressures in the current environment
2007-06-28;2007;June;Minute;Negative;0.786521852016449;the incoming data on core consumer prices were viewed as favorable but were not seen as convincing evidence that the recent moderation of core inflation would be sustained
2007-06-28;2007;June;Minute;Negative;0.977301299571991;participants noted that monthly data on consumer prices are noisy and recent readings on core inflation seemed to have been depressed by transitory factors
2007-06-28;2007;June;Minute;Positive;0.9671778082847595;yields on nominal treasury securities at all maturities also rose over the intermeeting period with the most pronounced gains in forward rates three to five years ahead
2007-06-28;2007;June;Minute;Neutral;0.9920098781585693;future policy adjustments will depend on the evolution of the outlook for both inflation and economic growth as implied by incoming information votes for this action
2007-06-28;2007;June;Minute;Neutral;0.7765012383460999;at the conclusion of the discussion the committee voted to authorize and direct the federal reserve bank of new york until it was instructed otherwise to execute transactions in the system account in accordance with the following domestic policy directive the federal open market committee seeks monetary and financial conditions that will foster price stability and promote sustainable growth in output
2007-06-28;2007;June;Minute;Negative;0.9924690127372742;against this backdrop members judged that the risk that inflation would fail to moderate as expected remained their predominant concern
2007-06-28;2007;June;Minute;Neutral;0.5628491640090942;members agreed that while measures of core inflation had improved lately the statement should indicate that a sustained moderation of inflation remained in question and that high levels of resource utilization had the potential to fuel inflation pressures
2007-06-28;2007;June;Minute;Positive;0.8786869049072266;in light of the recent economic data and anecdotal information the committee agreed that the statement to be released after the meeting should indicate that the economy seemed to be expanding at a moderate pace over the first half of the year
2007-06-28;2007;June;Minute;Neutral;0.993890643119812;in these circumstances members agreed that maintaining the target federal funds rate at 514 percent for this meeting was appropriate and that future policy adjustments would depend on the outlook for economic growth and inflation as implied by incoming information
