Date;Year;Month;Type;sentiment;sentiment_score;sentence
2015-12-17;2015;December;Monetary Policy Decisions;Neutral;0.9913573265075684;notes the wage growth rate at the sector level is computed as the weighted average growth in labour cost per employee for all ﬁ rms with at least 20 employees operating in the corresponding industry
2015-12-17;2015;December;Monetary Policy Decisions;Neutral;0.9641860723495485;the sectors above the 45 degree line are those where wage growth exceeds productivity growthchart b productivity and wage growth in twodigit services industries in germany spain france and italy 200107 average yearonyear percentage changes 10francexaxis annual productivity growth yaxis annual wage growth germany italyspain 8 6420 24 6 4 2 0 2 4 6 8 sources compnet data and authors calculations
2015-12-17;2015;December;Monetary Policy Decisions;Neutral;0.9867310523986816;the same procedure is used for sector productivity growth
2015-12-17;2015;December;Monetary Policy Decisions;Neutral;0.9836753010749816;chart c shows the correlation between two measures of wage and productivity misalignment in a given country and sector and the share of firms subject to centralised collective agreements at the national sector or regional level in the corresponding country and sector
2015-12-17;2015;December;Monetary Policy Decisions;Neutral;0.9913573265075684;notes the wage growth rate at the sector level is computed as the weighted average growth in labour cost per employee for all ﬁ rms with at least 20 employees operating in the corresponding industry
2015-12-17;2015;December;Monetary Policy Decisions;Neutral;0.9865199327468872;one example of such institutions is collective bargaining agreements signed at the sector regional or national level
2015-12-17;2015;December;Monetary Policy Decisions;Negative;0.8002653121948242;the design of labour market institutions might prevent firmlevel alignment of wage and productivity growth
2015-12-17;2015;December;Monetary Policy Decisions;Neutral;0.5370908379554749;however there is evidence that misalignments occur owing to the presence of rigidities in the labour market resulting from the design of labour market institutions see also box 4
2015-12-17;2015;December;Monetary Policy Decisions;Neutral;0.9863036274909972;given this large degree of heterogeneity it is reasonable to expect different productivity developments and therefore different wage dynamics in firms within narrowly defined sectors
2015-12-17;2015;December;Monetary Policy Decisions;Neutral;0.9039365649223328;this dispersion is even larger in services with the ratio reaching five times more productive in certain countries
2015-12-17;2015;December;Monetary Policy Decisions;Neutral;0.8552109003067017;to give a sense of the magnitude of this heterogeneity according to compnet data firms in the top 10 of the productivity distribution of a twodigit manufacturing industry are three to four times more productive than firms in the bottom 10
2015-12-17;2015;December;Monetary Policy Decisions;Neutral;0.5372647047042847;sectorlevel evidence may be too aggregated to assess this given the documented large degree of firm heterogeneity even within narrowly defined sectors
2015-12-17;2015;December;Monetary Policy Decisions;Neutral;0.9841167330741882;what really matters for competitiveness however is that wage growth and productivity growth are aligned at the individual firm level
2015-12-17;2015;December;Monetary Policy Decisions;Neutral;0.9547111988067628;in those chart a productivity and wage growth in twodigit manufacturing industries in germany spain france and italy 200107 average yearonyear percentage changes francegermany italyspain 10 8 6 420 24 6 4 2 0 2 4 6 8yaxis annual wage growthxaxis annual productivity growth sources compnet data and authors calculations
2015-12-17;2015;December;Monetary Policy Decisions;Neutral;0.9688327312469482;in the order of 09 percentage point over the coming 12 months
2015-12-17;2015;December;Monetary Policy Decisions;Neutral;0.983352780342102;misalignment is measured first as the ratio of wage dispersion to productivity dispersion in the industry and second as the difference between the median wage growth rate and the median productivity growth rate
2015-12-17;2015;December;Monetary Policy Decisions;Neutral;0.9823300242424012;4 the lower the ratio the greater the misalignment  because it would imply that wages are similar despite large differences in terms of firm productivity  and the larger the difference between wage and productivity growth rates
2015-12-17;2015;December;Monetary Policy Decisions;Negative;0.9915961623191832;the recent crisis has demonstrated that adverse competitiveness developments and structural rigidities increase countries vulnerability and limit their ability to adapt to shocks
2015-12-17;2015;December;Monetary Policy Decisions;Positive;0.8437082171440125;4 noneuro area eu countries are also encouraged to set up similar bodies48 ecb economic bulletin issue 8  2015  box 6the proposed council recommendation reflects the need for a renewed impetus for reforms which are vital in a monetary union to strengthen economic resilience and ensure adequate capacity for economic adjustment
2015-12-17;2015;December;Monetary Policy Decisions;Neutral;0.9765001535415648;2 the report completing europes economic and monetary union is available at httpeceuropaeu prioritieseconomicmonetaryuniondocs5presidentsreport_enpdf 3 with regard to financial fiscal and political union see the box entitled creation of a european fiscal board economic bulletin  issue 7 ecb 2015
2015-12-17;2015;December;Monetary Policy Decisions;Neutral;0.941702663898468;1 european commission on steps towards completing economic and monetary union 21 october 2015
2015-12-17;2015;December;Monetary Policy Decisions;Neutral;0.9521522521972656;changes to the european semester are already being implemented starting with the recent publication of the euro area recommendation as suggested by the commission the alert mechanism report and the annual growth survey 2016 the proposed council recommendation for the creation of competitiveness boards will need to be examined by the council in the coming months which offers some scope for the commission proposal to be clarified and strengthened
2015-12-17;2015;December;Monetary Policy Decisions;Neutral;0.8042134642601013;finally the implementation of structural reforms will be promoted through better use of eu structural funds and technical assistance from the commission services
2015-12-17;2015;December;Monetary Policy Decisions;Neutral;0.9875997304916382;in this respect the commission has announced that it will publish a compendium which will explain in detail how the procedure is applied
2015-12-17;2015;December;Monetary Policy Decisions;Positive;0.8036262392997742;in addition it will strive to improve the implementation of the macroeconomic imbalance procedure through greater transparency and appropriately following up any excessive imbalances that are identified
2015-12-17;2015;December;Monetary Policy Decisions;Neutral;0.978563129901886;both indicators refer to firms operating in narrowly defined manufacturing and services industries
2015-12-17;2015;December;Monetary Policy Decisions;Positive;0.6251298189163208;the commission also announced that it will gradually suggest benchmarks across policy areas to foster the implementation of structural reforms at the national level supporting convergence towards more resilient economic structures
2015-12-17;2015;December;Monetary Policy Decisions;Neutral;0.8389822244644165;economic union aims to ensure that national economic policies through implementing necessary structural measures are geared towards increasing the resilience of national economies and supporting the smooth functioning of economic and monetary union emu as a whole3 in its communication the commission announced improvements to how the european semester process of policy coordination is applied it also proposed a council recommendation for the creation of national competitiveness boards in all euro area member countries4 the commission intends to make the manner in which the european semester is applied more transparent and to reinforce the euro area dimension of the process with a view to promoting policies which ensure the smooth functioning of emu
2015-12-17;2015;December;Monetary Policy Decisions;Neutral;0.984348475933075;both misalignment measures refer to the period 200507 the share of ﬁ rms subject to centralised bargaining refers to 200747 ecb economic bulletin issue 8  2015  box 6box 6 the creation of competitiveness boards in the context of striving towards a genuine economic union on 21 october 2015 the european commission adopted a communication on strengthening the eu governance framework1 to follow up on the shortterm proposals made in the five presidents report2 this box focuses on the proposals that specifically relate to strengthening economic union
2015-12-17;2015;December;Monetary Policy Decisions;Neutral;0.9861998558044434;data are provided by compnet and refer to ﬁ rms with at least one employee in four euro area countries for which matching with wage dynamics network data was possible namely spain italy austria and portugal
2015-12-17;2015;December;Monetary Policy Decisions;Neutral;0.9905908703804016;notes the dispersion is measured as the difference between the 80th decile and the 20th decile of the distribution of the variable in a given industry
2015-12-17;2015;December;Monetary Policy Decisions;Neutral;0.9682808518409728;4 in both cases misalignment is measured at the twodigit industry level and then aggregated to broader sectors manufacturing construction wholesale and retail trade and other services using value added weights to enable the data to be merged with wage dynamics network datachart c wage and productivity misalignment and centralised collective bargaining in broad sectors 200507 16 1412100806040200 03 04 05 06 07 08 09 104 20 246810xaxis share of firms subject to centralised collective bargaining yaxis wage and productivity misalignment within twodigit industries dispersion of wages relative to dispersion of productivity wage and productivity growth rate difference righthand scale sources compnet data 2007 ﬁ rm survey by the wage dynamics network and authors calculations
2015-12-17;2015;December;Monetary Policy Decisions;Negative;0.5376001000404358;this consistency may however be hampered by the design of some labour market institutions which do not take sufficient account of firm specificities
2015-12-17;2015;December;Monetary Policy Decisions;Positive;0.6751958727836609;in summary given the large degree of heterogeneity in the performance of firms within narrowly defined sectors what really matters for cost competitiveness is not the alignment of average wage and productivity developments but the consistency of wage and productivity growth at the firm level
2015-12-17;2015;December;Monetary Policy Decisions;Negative;0.9643848538398744;irrespective of the measure of misalignment used chart c delivers the same message in countries or sectors where wages are not set by firms the misalignment of wage and productivity developments is greater and so will be the loss of cost competitiveness
2015-12-17;2015;December;Monetary Policy Decisions;Neutral;0.991669774055481;in practice it seems this will largely be reflected by more weight being given to the euro area recommendation which will be issued by the council as guidance alongside the annual growth survey for the countryspecific recommendations which are published later in the process
2015-12-17;2015;December;Monetary Policy Decisions;Neutral;0.7261971235275269;the cumulative impact from base effects in energy inflation on overall hicp inflation amounts to approximately 13 percentage points from november 2015 until october 2016 the estimate of this impact is somewhat lower when assuming that there is no trend in oil prices ie
2015-12-17;2015;December;Monetary Policy Decisions;Neutral;0.8590646386146545;this should include a gradual move from rulesbased coordination towards joint decisionmaking
2015-12-17;2015;December;Monetary Policy Decisions;Neutral;0.984605073928833;in past analyses reported in the ecbs bulletin this impact has been computed for each month by subtracting the actual monthonmonth movement from an estimated seasonal effect and a trend namely the average monthonmonth change observed since the mid1990s3 in the case of energy inflation where the series does not show stable seasonal effects this boils down to a simple comparison with the trend which reflects the impact of the longterm rise in oil prices
2015-12-17;2015;December;Monetary Policy Decisions;Neutral;0.9878880381584167;the call to reduce the tax burden on labour income and to reform the labour market has been a regular feature of the european commissions countryspecific recommendations but progress has been rather limited so far31 ecb economic bulletin issue 8  2015  box 1box 1 liquidity conditions and monetary policy operations in the period from 22 july to 27 october 2015 this box describes the ecbs monetary policy operations during the fifth and sixth reserve maintenance periods of 2015 which ran from 22 july to 8 september 2015 and from 9 september to 27 october 2015 respectively
2015-12-17;2015;December;Monetary Policy Decisions;Negative;0.5872828960418701;however this cannot fully replace structural labour market reforms
2015-12-17;2015;December;Monetary Policy Decisions;Positive;0.9888855218887328;for example reducing the labour tax wedge can have positive growth and employment effects especially in the short run
2015-12-17;2015;December;Monetary Policy Decisions;Positive;0.6903518438339233;in addition in many euro area countries there is a need to improve the growth friendliness of the tax system
2015-12-17;2015;December;Monetary Policy Decisions;Positive;0.9774051308631896;farreaching structural labour and product market reforms are called for to improve the potential growth outlook of euro area economies and contribute to the reduction of debt levels
2015-12-17;2015;December;Monetary Policy Decisions;Positive;0.8982996940612793;fiscal discipline should be supplemented by growthenhancing structural reforms
2015-12-17;2015;December;Monetary Policy Decisions;Positive;0.9804926514625548;in particular those countries with high debt levels should achieve progress towards their mediumterm budgetary objectives
2015-12-17;2015;December;Monetary Policy Decisions;Neutral;0.9655525088310242;it is essential that the early warning and corrective instruments introduced in the reinforced fiscal framework are implemented fully and consistently see box 7
2015-12-17;2015;December;Monetary Policy Decisions;Neutral;0.9874929189682008;however the 2016 draft budgetary plans released on 18 november point to insufficient structural adjustment in many euro area countries
2015-12-17;2015;December;Monetary Policy Decisions;Neutral;0.9288338422775269;while governments need to carefully calibrate their fiscal policy stance to strike an appropriate balance between reducing high debt levels and not impairing the 1 see also the box entitled the impact of the influx of refugees on the euro area economy in the december 2015 eurosystem staff macroeconomic projections for the euro area30 ecb economic bulletin issue 8  2015  economic and monetary developmentsrecovery compliance with the requirements of the sgp needs to be ensured
2015-12-17;2015;December;Monetary Policy Decisions;Negative;0.9743366837501526;the projected shortfall from structural efforts is expected to widen the gap with respect to the requirements of the stability and growth pact sgp 
2015-12-17;2015;December;Monetary Policy Decisions;Negative;0.9561288356781006;containing risks to debt sustainability is all the more important in view of the substantial longterm challenges resulting from an ageing population and rising costs for health and longterm care
2015-12-17;2015;December;Monetary Policy Decisions;Negative;0.9615898728370668;as debt levels remain high in many euro area countries further consolidation efforts are needed to set the debt ratio firmly on a downward path
2015-12-17;2015;December;Monetary Policy Decisions;Neutral;0.5219534039497375;in a few countries however the debt level is likely to increase further over the projection horizon
2015-12-17;2015;December;Monetary Policy Decisions;Positive;0.990667164325714;in addition negative deficitdebt adjustments inter alia reflecting privatisation receipts and the use of cash reserves will also contribute to the better debt outlook
2015-12-17;2015;December;Monetary Policy Decisions;Positive;0.7545909285545349;the euro area debttogdp ratio is projected to gradually decline from its peak of 921 of gdp in 2014 to reach 889 of gdp by the end of 2017 the projected reduction in government debt which is slightly higher than that projected in the september 2015 round is supported by favourable developments in the interest rategrowth differential and primary surpluses
2015-12-17;2015;December;Monetary Policy Decisions;Negative;0.992028534412384;euro area average government debt is on a declining path while its level remains elevated
2015-12-17;2015;December;Monetary Policy Decisions;Neutral;0.9889260530471802;during this period the interest rates on the main refinancing operations mros the marginal lending facility and the deposit facility remained unchanged at 005 030 and 020 respectively1 on 30 september 2015 the fifth targeted longerterm refinancing operation tltro was settled for an amount of 155 billion compared with 738 billion in the previous operation in june
2015-12-17;2015;December;Monetary Policy Decisions;Positive;0.578022837638855;this brought the total amount allotted in the first five tltros to 3996 billion2 in addition the eurosystem continued buying public sector securities covered bonds and assetbacked securities as part of its expanded asset purchase programme app with a targeted rate of 60 billion per month3 liquidity needs in the period under review the average daily liquidity needs of the banking system defined as the sum of autonomous factors and reserve requirements stood at 6465 billion an increase of 384 billion compared with the previous review period ie
2015-12-17;2015;December;Monetary Policy Decisions;Neutral;0.9754799008369446;the third and fourth maintenance periods of the year
2015-12-17;2015;December;Monetary Policy Decisions;Neutral;0.936634600162506;that was due mainly to an increase in average autonomous factors which rose by 367 billion to stand at 5335 billion see the table
2015-12-17;2015;December;Monetary Policy Decisions;Negative;0.9844522476196288;the decline in the period under review was related to a reduction in the rates of interest that some treasuries were prepared to accept when placing their excess liquidity in the market
2015-12-17;2015;December;Monetary Policy Decisions;Negative;0.6695776581764221;that decline in government deposits represented a continuation of the overall downward trend observed since september 2014 when the ecbs deposit facility rate was cut to 020 partially offsetting the increase seen in the previous review period when treasuries looking to place cash in the market had few alternatives
2015-12-17;2015;December;Monetary Policy Decisions;Negative;0.951791763305664;notes since all ﬁ gures in the table are rounded in some cases the ﬁ gure indicated as the change relative to the previous period does not represent the difference between the rounded ﬁ gures provided for these periods differing by 01 billion1 includes items in course of settlement33 ecb economic bulletin issue 8  2015  box 1average government deposits also contributed to the decline in liquidity needs falling 63 billion to stand at 793 billion
2015-12-17;2015;December;Monetary Policy Decisions;neutral;0.0;in addition table eurosystem liquidity situation 22 july to 27 october 201522 april to 21 july 2015sixth maintenance periodfifth maintenance period liabilities  liquidity needs averages eur billions autonomous liquidity factors 16757 146 16903 16928 342 16586 376 banknotes in circulation 10539 194 10345 10524 29 10553 126 government deposits 793 63 856 952 318 634 329 other autonomous factors 5425 277 5702 5452 54 5398 173 monetary policy instruments current accounts 4469 1075 3394 4653 369 4284 470 minimum reserve requirements 1130 09 1112 1132 05 1127 05 deposit facility 1504 491 1013 1528 47 1480 450 liquidityabsorbing ﬁ netuning operations 00 00 00 00 00 00 00 assets  liquidity supply averages eur billions autonomous liquidity factors 11425 513 11938 11357 136 11493 339 net foreign assets 6232 265 6498 6191 83 6274 155 net assets denominated in euro 5193 248 5441 5167 52 5219 184 monetary policy instruments open market operations 11304 1932 9372 11755 902 10853 878 tender operations 5334 202 5132 5323 22 5345 88 mros 713 184 897 702 22 724 101 specialterm reﬁ nancing operations 00 00 00 00 00 00 00 threemonth ltros 736 169 905 692 89 781 57 threeyear ltros 00 00 00 00 00 00 00 targeted ltros 3885 555 3330 3930 89 3841 246 outright portfolios 5970 1730 4240 6432 924 5508 790 first covered bond purchase programme 222 22 244 219 06 225 08 second covered bond purchase programme 105 06 111 104 03 107 01 third covered bond purchase programme 1149 278 871 1223 148 1076 124 securities markets programme 1285 82 1366 1271 27 1298 48 assetbacked securities purchase programme 119 44 75 132 25 107 19 public sector purchase programme 3089 1516 1574 3483 786 2696 705 marginal lending facility 04 02 02 01 05 06 03 other liquiditybased information averages eur billions aggregate liquidity needs 6465 384 6080 6707 485 6222 34 autonomous factors15335 367 4968 5575 480 5095 38 excess liquidity 4839 1547 3292 5048 416 4631 913 interest rate developments percentages mros 005 000 005 005 000 005 000 marginal lending facility 030 000 030 030 000 030 000 deposit facility 020 000 020 020 000 020 000 eonia average 0130 0022 0107 0139 0018 0121 0002 source ecb
2015-12-17;2015;December;Monetary Policy Decisions;Negative;0.9258727431297302;other autonomous factors averaged 5425 billion down 277 billion from the previous review period mainly reflecting a reduction in revaluation accounts
2015-12-17;2015;December;Monetary Policy Decisions;Neutral;0.6662591099739075;liquidityabsorbing factors decreased in the period under review on account of a decline in other autonomous factors that was only partially offset by the usual seasonal increase in banknotes in circulation during the summer
2015-12-17;2015;December;Monetary Policy Decisions;Negative;0.9852108359336852;previously those foreign institutions had significantly reduced their cash holdings with the eurosystem to avoid negative interest rates but the review period saw them increase their holdings again possibly owing to a decline in the number of attractive alternatives in the market
2015-12-17;2015;December;Monetary Policy Decisions;Neutral;0.9629729986190796;32 ecb economic bulletin issue 8  2015  box 1monetary policy together with an increase in the liabilities held by foreign institutions with the national central banks
2015-12-17;2015;December;Monetary Policy Decisions;Negative;0.495216429233551;in the euro area the fiscal stance  as measured by the change in the cyclically adjusted balance net of support to the financial sector  is expected to loosen in 2016 before becoming broadly neutral in 2017 based on the december 2015 eurosystem projections the euro area structural deficit will increase by 02 percentage point to 19 of gdp in 2016 as a result of cuts in taxes and social security contributions in several countries and the expenditures related to the refugee inflow and remain at this level in 2017 this also points to a loosening in 2016 compared with the september 2015 projections when the fiscal stance was projected to be broadly neutral
2015-12-17;2015;December;Monetary Policy Decisions;Neutral;0.9407625794410706;3 detailed information on the expanded app is available on the ecbs website wwwecbeuropaeumopoimplementomthtmlindexenhtml 
2015-12-17;2015;December;Monetary Policy Decisions;Neutral;0.9874179363250732;tltros continued to be conducted as fixedrate tender procedures with an interest rate equal to the mro rate
2015-12-17;2015;December;Monetary Policy Decisions;Neutral;0.9716587662696838;the interest rate in each ltro was fixed at the average of the rates on the mros over the relevant ltros lifetime
2015-12-17;2015;December;Monetary Policy Decisions;Neutral;0.9875457882881165;the same procedure remained in use for the threemonth longerterm refinancing operations ltros
2015-12-17;2015;December;Monetary Policy Decisions;Neutral;0.9866687059402466;net assets denominated in euro declined on account of the devaluation of financial assets held by the eurosystem for purposes other than 1 mros continued to be conducted as fixedrate tender procedures with full allotment
2015-12-17;2015;December;Monetary Policy Decisions;Negative;0.9424720406532288;in addition net assets denominated in euro averaged 5193 billion down 248 billion from the previous review period
2015-12-17;2015;December;Monetary Policy Decisions;Negative;0.904390513896942;the appreciation of the euro against the us dollar in the period under review led to a devaluation of net foreign assets
2015-12-17;2015;December;Monetary Policy Decisions;Neutral;0.681464433670044;net foreign assets averaged 6232 billion 265 billion less than in the previous review period
2015-12-17;2015;December;Monetary Policy Decisions;Neutral;0.9114014506340028;the increase in average autonomous factors was mainly a result of decreases in average liquiditysupplying factors  both net foreign assets and net assets denominated in euro
