Date;Year;Month;Type;sentiment;sentiment_score;sentence
2015-02-05;2015;February;Monetary Policy Decisions;Neutral;0.6316221356391907; 
2015-02-05;2015;February;Monetary Policy Decisions;Neutral;0.9843406081199646;they also aim to limit the scope of government action to effective regulation and preserving macroeconomic stability rather than micromanaging decisions by economic actors
2015-02-05;2015;February;Monetary Policy Decisions;Neutral;0.9842920303344728;the broad principles underlying the agenda emphasise the need for markets to play a decisive role in allocating resources to all enterprises regardless of whether they are in private or public ownership with enterprises being able to compete under equal conditions
2015-02-05;2015;February;Monetary Policy Decisions;Neutral;0.9334712624549866;a comprehensive reform agenda was announced at the end of 2013 based on a diagnosis of the structural economic challenges facing china
2015-02-05;2015;February;Monetary Policy Decisions;Neutral;0.8507546186447144;structural reforms are needed to address vulnerabilities
2015-02-05;2015;February;Monetary Policy Decisions;Negative;0.994382381439209;overall although it is likely that chinas growth will continue to decelerate gradually in the foreseeable future in line with its declining potential the downside risks to the economic outlook seem to have increased
2015-02-05;2015;February;Monetary Policy Decisions;Neutral;0.610644519329071;but this will only be significant if oil prices stay low for an extended period of time
2015-02-05;2015;February;Monetary Policy Decisions;Positive;0.985116958618164;it should be noted that the recent fall in oil prices is generally a positive development for china given that it is a major net importer of oil
2015-02-05;2015;February;Monetary Policy Decisions;Negative;0.9949405193328856;moreover high and rising debt levels seem to be constraining local governments ability to continue investing in infrastructure at the same high pace as a few years ago
2015-02-05;2015;February;Monetary Policy Decisions;Negative;0.9933640956878662;a number of defaults or neardefaults on bonds and other financial products something previously unheard of in china also point to growing tensions in the financial sector
2015-02-05;2015;February;Monetary Policy Decisions;Negative;0.989335596561432;furthermore fast credit expansion has led to rising nonperforming loan ratios but these are still at a low level
2015-02-05;2015;February;Monetary Policy Decisions;Negative;0.9877371788024902;note the last observation is for december 201420ecb economic bulletinissue 1  2015 such as steel have also fallen and ppi inflation in china has been negative since early 2012 putting pressure on profit margins in a range of heavy industries
2015-02-05;2015;February;Monetary Policy Decisions;Neutral;0.9584487676620485;note the last observation is for 2013chart b breakdown of total financing percentage of gdp 50100150250 200 50100150250 200 2004 2006 2008 2010 2012 2014total financingbank loans nonbank lending financial market financing source peoples bank of china
2015-02-05;2015;February;Monetary Policy Decisions;Neutral;0.9697489738464355;prices of constructionrelated goods chart a investment percentage of gdp 20304050 20304050 1980 1985 1990 1995 2000 2005 2010 source haver analytics
2015-02-05;2015;February;Monetary Policy Decisions;Negative;0.9909358620643616;anecdotal evidence suggests that property developers especially smaller firms are under pressure to consolidate or scale back activities
2015-02-05;2015;February;Monetary Policy Decisions;Negative;0.9911773204803468;the housing market slowed sharply in 2014 leading to higher inventories and lower house prices
2015-02-05;2015;February;Monetary Policy Decisions;Negative;0.9921982884407043;in addition there has been growing concern among analysts and policymakers about overinvestment and the misallocation of capital across a number of industries  in particular property and related heavy industries
2015-02-05;2015;February;Monetary Policy Decisions;Positive;0.982732892036438;corporate and local government debt has expanded significantly helped by the rapid growth of shadow banking
2015-02-05;2015;February;Monetary Policy Decisions;Neutral;0.9382701516151428;the specific proposals are wideranging including price and financial sector liberalisation the opening up of markets to private firms and foreign competition reform of stateowned enterprises soes fiscal reform as well as land and household registration reform
2015-02-05;2015;February;Monetary Policy Decisions;Positive;0.9692572951316832;if implemented in full they should help reduce the mediumterm risks of an abrupt slowdown in growth
2015-02-05;2015;February;Monetary Policy Decisions;Negative;0.9813287258148192;some promising steps have been taken to date but progress has been uneven
2015-02-05;2015;February;Monetary Policy Decisions;Positive;0.7685781717300415;substantial headway has been made in respect of financial sector reform promoting crossborder capital flows social security and fiscal reform while measures to liberalise the economy and reform soes seem to have been more limited so far
2015-02-05;2015;February;Monetary Policy Decisions;Neutral;0.9610133767127992;1 estimated annual average
2015-02-05;2015;February;Monetary Policy Decisions;Neutral;0.9308835864067078;in terms of purchasing power parity gdp per capita was slightly below 70 of the euro area average in 2013 key economic characteristics of lithuania and the euro area reporting period unit euro area excluding lithuania euro area including lithuania lithuania population and economic activity total population 1 2013 millions 3358 3388 30 gdp 2013 eur billions 99044 99394 350 gdp per capita 2013 eur thousands 295 293 118 gdp per capita ppp 2013 euro 18100 1000 997 675 gdp share of world gdp 2 2013 percentages 123 124 01 value added by economic activity 3 agriculture fishing forestry 2013 percentage of total 17 17 38 industry including construction 2013 percentage of total 246 246 307 services including nonmarket services 2013 percentage of total 736 736 655 monetary and financial indicators credit to the private sector 4 2013 percentage of gdp 1288 1285 458 stock market capitalisation 5 2013 percentage of gdp 569 567 91 external trade exports of goods and services 6 2013 percentage of gdp 437 438 841 imports of goods and services 6 2013 percentage of gdp 402 404 828 current account balance 6 2013 percentage of gdp 22 22 16 labour market 7 labour force participation rate 8 2014q3 percentages 724 724 741 unemployment rate 2014q3 percentages 111 111 93 employment rate 8 2014q3 percentages 644 644 672 general government surplus  or deficit  2013 percentage of gdp 29 29 26 revenue 2013 percentage of gdp 465 465 328 expenditure 2013 percentage of gdp 494 494 355 gross debt outstanding 2013 percentage of gdp 933 931 390 sources eurostat imf european commission ecb and ecb calculations
2015-02-05;2015;February;Monetary Policy Decisions;Neutral;0.9700085520744324;lithuanias population is around 3 million and its gdp accounts for about 04 of euro area gdp
2015-02-05;2015;February;Monetary Policy Decisions;Neutral;0.9679394960403442;as such the countrys adoption of the euro will have no significant impact on the euro areas aggregate macroeconomic data see the table
2015-02-05;2015;February;Monetary Policy Decisions;Neutral;0.8557655811309814;lithuania is a very small economy compared with the rest of the euro area
2015-02-05;2015;February;Monetary Policy Decisions;Neutral;0.9929866194725036;this was the central rate of the lithuanian litas throughout the countrys membership of the exchange rate mechanism ii
2015-02-05;2015;February;Monetary Policy Decisions;Neutral;0.9864580035209656;the conversion rate between the lithuanian litas and the euro was irrevocably fixed at 345280 litas to the euro
2015-02-05;2015;February;Monetary Policy Decisions;Neutral;0.8284882307052612;furthermore dismantling administrative hurdles and investment restrictions in industries such as banking telecommunications and energy would stimulate effective competition enable new firms to enter the market and boost innovation and productivity ultimately putting growth on a more sustainable footing21ecb economic bulletin issue 1  2015 boxes lithuania adopts the eurobox 3 lithuania adopts the e uro on 1 january 2015 lithuania adopted the euro and became the 19th member of the euro area
2015-02-05;2015;February;Monetary Policy Decisions;Negative;0.985557734966278;imbalances have given rise to a number of policy challenges
2015-02-05;2015;February;Monetary Policy Decisions;Positive;0.986505925655365;as regards the financial sector complementing the proposed deposit guarantee system with a clearer framework for the resolution of nonviable financial institutions will help further reduce moral hazard while allowing for more progress in interest rate liberalisation
2015-02-05;2015;February;Monetary Policy Decisions;Neutral;0.617049515247345;while important challenges remain the chinese authorities continue to be committed to the reform process
2015-02-05;2015;February;Monetary Policy Decisions;Neutral;0.649840235710144;in addition measures to liberalise the economy appear quite modest focusing on streamlining administrative approval processes and opening up a number of infrastructure projects and industries to private capital and foreign investment
2015-02-05;2015;February;Monetary Policy Decisions;Neutral;0.96603661775589;some local governments have announced timetables for reforming soe governance and reducing government holdings but without clearly redefining the role of soes
2015-02-05;2015;February;Monetary Policy Decisions;Negative;0.8732364773750305;in other areas progress has been rather patchy
2015-02-05;2015;February;Monetary Policy Decisions;Neutral;0.9637520909309388;labour mobility has also been promoted through a reform of chinas hukou household registration system
2015-02-05;2015;February;Monetary Policy Decisions;Neutral;0.9900280833244324;the daily trading range of the exchange rate was increased to 2 and interest rates are gradually being liberalised
2015-02-05;2015;February;Monetary Policy Decisions;Neutral;0.940330982208252;further action has been taken towards realising capital account liberalisation the shanghaihong kong stock connect pilot programme being a case in point
2015-02-05;2015;February;Monetary Policy Decisions;Neutral;0.9786750078201294;the state council has proposed a deposit guarantee system and approved plans to make local government debt more transparent and sustainable
2015-02-05;2015;February;Monetary Policy Decisions;Neutral;0.5011555552482605;they have set 2020 as the deadline for implementing the bulk of reforms and they have recently reaffirmed their commitment to achieving that goal
2015-02-05;2015;February;Monetary Policy Decisions;Positive;0.9796671867370604;meanwhile leveraging activity has continued to rise since the end of 2007 chinas private sector credittogdp ratio has increased by over 80 percentage points and credit growth remains well in excess of nominal gdp growth despite having moderated somewhat since early 2013 chart b
2015-02-05;2015;February;Monetary Policy Decisions;Negative;0.99349844455719;for the period until the third quarter of 2014 it is likely that this ratio will only decline very marginally in 2014 largely shrugging off the drop in property investment resulting from a weak housing market
2015-02-05;2015;February;Monetary Policy Decisions;Neutral;0.954735279083252;judging by current trends ie
2015-02-05;2015;February;Monetary Policy Decisions;Neutral;0.9828442335128784;the governing council decided on the purchase modalities for the app
2015-02-05;2015;February;Monetary Policy Decisions;Positive;0.5164766311645508;these avenues work through price effects  as mentioned above the pricing of a large variety of assets and loan contracts in the economy are a function of sovereign yields  and through quantity effects as the additional liquidity introduced through the purchases is used by private investors to reallocate their portfolios into a multitude of other assets that are not addressed by the central bank interventions thereby leading to an easing of conditions across broad sources of privatesector financing
2015-02-05;2015;February;Monetary Policy Decisions;Positive;0.8156883120536804;furthermore the ecbs interventions will reduce yields on government bonds which will set in motion a more conventional chain of propagation channels that will support the economic recovery and help bring inflation back to levels below but close to 2
2015-02-05;2015;February;Monetary Policy Decisions;Positive;0.9888439178466796;in this way the announcement of a significant expansion in the size and composition of the eurosystems balance sheet through the app will strengthen confidence and support inflation expectations having a direct impact on real interest rates and thus counteracting an unwarranted tightening of financial conditions
2015-02-05;2015;February;Monetary Policy Decisions;Neutral;0.9802226424217224;the ecbs interventions underscore the governing councils determination to use all available tools within its mandate to address the risks of too prolonged a period of low inflation
2015-02-05;2015;February;Monetary Policy Decisions;Neutral;0.9904519319534302;the app will work through the same channels that have been shown to be associated with quantitative policies in other jurisdictions although the relative importance of these channels may differ
2015-02-05;2015;February;Monetary Policy Decisions;Neutral;0.9824997186660768;second the market for such securities is sufficiently deep and liquid to minimise the potential distortive effects of central bank action on the formation of market prices
2015-02-05;2015;February;Monetary Policy Decisions;Neutral;0.9805392026901244;conducting such purchases in proportions across sovereign issuers that indirectly reflect the economic weight of the various member states in the euro area economy broadens the scope of interventions and thus amplifies their monetary impact
2015-02-05;2015;February;Monetary Policy Decisions;Neutral;0.9939310550689696;purchases will be conducted at a monthly pace of 60 billion and are intended to be carried out until the end of september 2016 and in any case until the governing council sees a sustained adjustment in the path of inflation consistent with its aim of achieving inflation rates below but close to 2 over the medium term
2015-02-05;2015;February;Monetary Policy Decisions;Neutral;0.9858992099761964;first the sovereign yield curve constitutes the bedrock benchmark indicator for pricing a vast array of credit instruments and forms of external finance for the private economy for example bank loans corporate loans and equity
2015-02-05;2015;February;Monetary Policy Decisions;Neutral;0.5182845592498779;at the same time further outright purchases should be composed of assets that both feature a high transmission potential to the real economy and are available in sufficient volumes
2015-02-05;2015;February;Monetary Policy Decisions;Neutral;0.9708583354949952;in this regard balance sheet measures in the form of outright asset purchases allow full control to be taken of the degree of monetary stimulus
2015-02-05;2015;February;Monetary Policy Decisions;Neutral;0.9874655604362488;at the lower bound for policy interest rates the adoption of further quantitative measures that can expand the size and change the composition of the eurosystems balance sheet constitutes the only effective tool to provide further monetary policy accommodation
2015-02-05;2015;February;Monetary Policy Decisions;Neutral;0.9838555455207824;the latest observation refers to november 2014 preliminary data17ecb economic bulletin issue 1  2015 boxes the governing councils expanded asset purchase programmetransmission and key modalities of the ecbs expanded asset purchase programme with key interest rates at their lower bound the governing council considered outright purchases of securities with a high potential for influencing the financing conditions faced by euro area households and firms to be warranted in view of the ecbs price stability mandate
2015-02-05;2015;February;Monetary Policy Decisions;Neutral;0.9921518564224244;the crosscountry standard deviation is calculated over a fixed sample of 12 euro area countries
2015-02-05;2015;February;Monetary Policy Decisions;Neutral;0.9881781935691832;notes the composite indicator of the cost of borrowing is calculated by aggregating short and longterm rates using a 24month moving average of new business volumes
2015-02-05;2015;February;Monetary Policy Decisions;Neutral;0.9792145490646362;chart b composite indicator of the nominal cost of bank borrowing for nonfinancial corporations percentages per annum threemonth moving averages 00020406081012141618 01234567 2004 2006 2008 2010 2012 2014crosscountry standard deviation righthand scalede esfrit nleuro area source ecb
2015-02-05;2015;February;Monetary Policy Decisions;Negative;0.93586403131485;given the weakened mediumterm outlook on price stability and the quantitative shortfall of existing monetary policy measures the governing council judged the prevailing degree of monetary accommodation as insufficient to adequately address the heightened risks of too prolonged a period of low inflation and to ensure that the ecb fulfils its objective of price stability
2015-02-05;2015;February;Monetary Policy Decisions;Neutral;0.989604949951172;purchases of investment grade bonds of euro area sovereigns are an effective instrument in this respect for at least two reasons
2015-02-05;2015;February;Monetary Policy Decisions;Neutral;0.9787105917930604;2 gdp shares are based on a purchasing power parity ppp valuation of the countries gdp
2015-02-05;2015;February;Monetary Policy Decisions;Neutral;0.9838592410087584;the monthly purchases will comprise purchases of assetbacked securities and covered bonds under the abspp and cbpp3 as well as additional purchases of securities issued by euro area governments agencies and eu institutions
2015-02-05;2015;February;Monetary Policy Decisions;Neutral;0.983752965927124;18ecb economic bulletinissue 1  2015 while the ecb will coordinate the purchases the eurosystem will make use of decentralised implementation to mobilise its resources
2015-02-05;2015;February;Monetary Policy Decisions;Neutral;0.9009571075439452;chinas investment reached 46 of gdp in 2013 chart a
2015-02-05;2015;February;Monetary Policy Decisions;Negative;0.9098474383354188;although economic activity has weakened internal imbalances continue to increase  particularly the reliance on creditdriven investment to fuel growth
2015-02-05;2015;February;Monetary Policy Decisions;Negative;0.990287184715271;but much of the slowdown has been structural as the traditional drivers of buoyant chinese growth  favourable demographics manufacturing exports and the countrys accession to the world trade organization  are running out of steam
2015-02-05;2015;February;Monetary Policy Decisions;Negative;0.9948264956474304;cyclical factors have played a role including the softening in global demand and monetary tightening to keep credit growth in check
2015-02-05;2015;February;Monetary Policy Decisions;Negative;0.9892609119415284;taken together these factors should strengthen demand increase capacity utilisation and support money and credit growth thereby contributing to a sustained return of inflation towards a level below but close to 2 over the medium term19ecb economic bulletin issue 1  2015 boxes the outlook for chinas economy risks reforms and challengesbox 2 the outlook for chinas e conomy risks re forms and challen ges chinas economic growth has slowed further in 2014 continuing the moderation seen since the stimulus package implemented in the wake of the financial crisis
2015-02-05;2015;February;Monetary Policy Decisions;Neutral;0.9430329203605652;moreover these decisions by the governing council will support its forward guidance on the key ecb interest rates and reinforce the fact that there are significant and increasing differences in the monetary policy cycles of major advanced economies
2015-02-05;2015;February;Monetary Policy Decisions;Positive;0.9833434820175172;the sizeable increase in the eurosystems balance sheet will further ease the monetary policy stance and the app will decisively underpin the firm anchoring of medium to longterm inflation expectations
2015-02-05;2015;February;Monetary Policy Decisions;Neutral;0.9725831151008606;moreover in the case of euro area member states under financial assistance programmes eligibility will be suspended during reviews and will resume only in the event of a positive outcome
2015-02-05;2015;February;Monetary Policy Decisions;Neutral;0.9805833101272584;with regard to these additional asset purchases the governing council retains control over all the design features of the programme including the purchase allocation asset eligibility and the pace and size of the purchases thereby safeguarding the singleness of the eurosystems monetary policy
2015-02-05;2015;February;Monetary Policy Decisions;Neutral;0.9865843653678894;securities that do not achieve the specified criteria will be eligible as long as the eurosystems minimum credit quality threshold is not applied for the purpose of their collateral eligibility
2015-02-05;2015;February;Monetary Policy Decisions;Neutral;0.968008518218994;with regard to asset eligibility the governing council announced the following criteria
2015-02-05;2015;February;Monetary Policy Decisions;Positive;0.8519126772880554;in particular the chosen regime ensures the effectiveness of sovereign bond purchases by mitigating concerns relating to moral hazard thereby preserving incentives for prudent fiscal policies and the necessary structural reforms
2015-02-05;2015;February;Monetary Policy Decisions;Neutral;0.9933722019195556;the arrangement underlines the choice of the monetary policy instrument that is most appropriate to achieve price stability while taking into account the unique institutional structure of the euro area where a common currency and single monetary policy coexists with 19 national fiscal policies
2015-02-05;2015;February;Monetary Policy Decisions;Neutral;0.9830965995788574;this implies that 20 of the additional asset purchases will be subject to a regime of risk sharing
2015-02-05;2015;February;Monetary Policy Decisions;Neutral;0.983643352985382;the ecb will hold 8 of the additional asset purchases
2015-02-05;2015;February;Monetary Policy Decisions;Neutral;0.9553837776184082;the rest of the ncbs additional asset purchases will not be subject to loss sharing
2015-02-05;2015;February;Monetary Policy Decisions;Neutral;0.9794210195541382;the governing council decided that purchases of securities of european institutions which will constitute 12 of the additional asset purchases and will be purchased by ncbs will be subject to loss sharing
2015-02-05;2015;February;Monetary Policy Decisions;Neutral;0.9768093228340148;with regard to the sharing of hypothetical losses the governing council decided that 20 of the additional asset purchases will be subject to loss sharing
2015-02-05;2015;February;Monetary Policy Decisions;Neutral;0.9599403738975524;the governing council decided to buy securities that fulfil the collateral eligibility criteria for marketable assets in order to participate in eurosystem monetary policy operations
2015-02-05;2015;February;Monetary Policy Decisions;Neutral;0.9054356813430786;a forceful monetary policy response therefore became warranted
2015-02-05;2015;February;Monetary Policy Decisions;Neutral;0.983307123184204;3 based on nominal gross value added at basic prices
2015-02-05;2015;February;Monetary Policy Decisions;Neutral;0.9832021594047546;5 defined as the total outstanding amount of quoted shares excluding investment funds and money market fund shares issued by euro arealithuanian residents at market value
2015-02-05;2015;February;Monetary Policy Decisions;Negative;0.9643009305000304;this suggests that oilspecific supply shocks played a dominant role
2015-02-05;2015;February;Monetary Policy Decisions;Neutral;0.7824819684028625;this is underlined by developments in prices of other commodities which typically correlate strongly with economic activity and demand and which have declined to a much lesser extent compared with oil prices see chart b
2015-02-05;2015;February;Monetary Policy Decisions;Negative;0.9925919771194458;in addition global demand for oil has been softening and oil demand forecasts for 2014 and 2015 have been repeatedly revised downwards1 however the role of demand factors in the decline of oil prices appears to have been limited
2015-02-05;2015;February;Monetary Policy Decisions;Positive;0.9119004011154176;global oil supply has been supported by growth in us shale oil production and steady production from russia iraq and libya while opec decided in november not to lower its production target see chart a
2015-02-05;2015;February;Monetary Policy Decisions;Neutral;0.7168306708335876;3 the participation rate in spain appears to be very resilient whereas the unemployment rate tripled between 2008 and 2013 chart c participation rates in the euro area and the four largest euro area countries population aged 1574 fourquarter moving average index q2 2008  100 96979899100101102103105 104 96979899100101102103105 104 2006 2007 2008 2009 2010 2011 2012 2013 2014euro area germanyfrance spainitaly source eurostat labour force survey26ecb economic bulletinissue 1  2015 box 5 the re cent oil pri ce decline and the e uro area e conomi c outlook the recent large decline in oil prices seems to be mainly driven by supplyrelated factors
