Date;Year;Month;Type;sentiment;sentiment_score;sentence
2015-02-05;2015;February;Monetary Policy Decisions;Neutral;0.9810925126075744;clearly it is of interest to policymakers to understand how these changes are passed through into consumer prices
2015-02-05;2015;February;Monetary Policy Decisions;Neutral;0.9870601892471312;since the launch of emu in 1999 there have been approximately 30 vat rate changes of which twothirds have occurred since the economic crisis
2015-02-05;2015;February;Monetary Policy Decisions;Neutral;0.9766293168067932;overall the data indicate that a there is considerable price dispersion across countries even when specific brands are considered and b price dispersion is substantially higher across countries than within countries ie
2015-02-05;2015;February;Monetary Policy Decisions;Neutral;0.9876093864440918;however since the economic crisis in 2008 there have been a cluster of vat rate changes and the aggregate standard rate has increased to over 205 as at 1 july 2014
2015-02-05;2015;February;Monetary Policy Decisions;Neutral;0.9679598212242126;in january 2007 there was a large jump owing to the 30 percentage point change in the german standard rate of vat from 160 to 190
2015-02-05;2015;February;Monetary Policy Decisions;Neutral;0.991306483745575;the chart illustrates that the average euro area standard rate remained relatively constant between 1999 and 2007 at around 185 although there were some countryspecific changes
2015-02-05;2015;February;Monetary Policy Decisions;Neutral;0.9544014930725098;this is due in large part to the impact of the financial crisis and budgetary pressures but has also occurred in the context of a shifting of the tax burden away from labour towards indirect consumptiontype taxes
2015-02-05;2015;February;Monetary Policy Decisions;Neutral;0.9750655889511108;most countries have a standard rate of vat somewhere between 15 and 252 furthermore in recent years a number of countries have changed mostly increased their vat rates
2015-02-05;2015;February;Monetary Policy Decisions;Neutral;0.9346795678138732;219241 box 3 the passthro ugh of vat rate changes into consumer pri ces1 in europe value added taxes vat play an important role in consumer prices
2015-02-05;2015;February;Monetary Policy Decisions;Neutral;0.9684118628501892;seattle may not be so far from vancouver after all american economic journal macroeconomics  11 2009 pp
2015-02-05;2015;February;Monetary Policy Decisions;Neutral;0.9521998167037964;see gorodnichenko y and tesar ll border effect or country effect
2015-02-05;2015;February;Monetary Policy Decisions;Neutral;0.9843149781227112;by using the disaggregated grocery price dataset it is estimated that crossborder price dispersion can be inflated by as much as 25 if crosscountry differences in price distributions are not taken into account
2015-02-05;2015;February;Monetary Policy Decisions;Neutral;0.984820544719696;thereafter the average rate remained relatively stable for about three years at slightly below 195
2015-02-05;2015;February;Monetary Policy Decisions;Neutral;0.7302663326263428;cit
2015-02-05;2015;February;Monetary Policy Decisions;Neutral;0.8997039794921875;3 reiff a and rumler f op
2015-02-05;2015;February;Monetary Policy Decisions;Neutral;0.9868311882019044;overall the analysis of the ppp dataset strongly supports the conclusions arrived at through the investigation of the disaggregated price data
2015-02-05;2015;February;Monetary Policy Decisions;Neutral;0.9193591475486756;emu 13 includes all countries in the sample of the nielsen dataset emu 10 excludes estonia slovenia and slovakia market leaders are defined as the brand within each region that has the largest quantity share for each product category
2015-02-05;2015;February;Monetary Policy Decisions;Neutral;0.9638822078704834;table 1 border effect in the euro area within versus crosscountry dispersion of unit price excluding vat coefficients of variation countryproduct samples across countries within countries emu 13 all products 037 005 emu 10 branded products 028 003 emu 10 branded products market leaders 029 006 identical products 020 004 sources nielsen and eurosystem staff calculations
2015-02-05;2015;February;Monetary Policy Decisions;Neutral;0.9899407029151917;even for the set of identical products the average unit price dispersion for the exact same product is 20 across countries and 4 within countries
2015-02-05;2015;February;Monetary Policy Decisions;Neutral;0.9904844760894777;for the full range of products in the dataset including private label goods the average unit price dispersion is 37 across countries compared with an average price dispersion of about 5 across regions within a country
2015-02-05;2015;February;Monetary Policy Decisions;Neutral;0.9828189015388488;crosscountry price dispersion is about five to seven times higher than withincountry price dispersion irrespective of whether one considers the full sample of products or varieties of product subsamples that may be broadly comparable or even identical see table 1
2015-02-05;2015;February;Monetary Policy Decisions;Neutral;0.9883291721343994;price dispersion of unit prices is investigated by using coefficients of variation defined as the standard deviation of a unit price for a product over the mean unit price for that product
2015-02-05;2015;February;Monetary Policy Decisions;Neutral;0.9859963059425354;this result confirms the indirect evidence of border effects reported in the sir 2011 which used purchasing power parity ppp data see box 2 for a comparison
2015-02-05;2015;February;Monetary Policy Decisions;Neutral;0.9887931942939758;results are similar when vat is included42ecb economic bulletinissue 1  2015 notwithstanding the caveats regarding the measurement of price dispersion the regional dimension of the dataset makes it possible to obtain a more robust indication of the border effect than was feasible heretofore crosscountry dispersion is significantly higher than crossregional variation within countries suggesting substantial border effects in the euro area
2015-02-05;2015;February;Monetary Policy Decisions;Neutral;0.97953599691391;box 2 border effects  eviden ce from ppp data this box considers evidence on border effects from another data source  eurostats purchasing power parity ppp dataset
2015-02-05;2015;February;Monetary Policy Decisions;Neutral;0.9798765182495116;note based on average unit prices of market leaders of branded products over the period under review
2015-02-05;2015;February;Monetary Policy Decisions;Neutral;0.990604817867279;indeed for several product categories a countryspecific price clustering is often observed irrespective of whether or not i the market leader is the same across regions within a country or ii the market leader is the same across countries  indicating that markets may be segmentedminimum and maximum unit price excl
2015-02-05;2015;February;Monetary Policy Decisions;Neutral;0.9696028232574464;for example in the case of paper towels there are no prices from greece the most expensive country or from the netherlands the cheapest country inside the interquartile range see chart
2015-02-05;2015;February;Monetary Policy Decisions;Neutral;0.9780963063240052;25th to 75th percentile range are disregarded some countries do not figure
2015-02-05;2015;February;Monetary Policy Decisions;Neutral;0.9793865084648132;instead it is generally the case that when prices outside the interquartile ie
2015-02-05;2015;February;Monetary Policy Decisions;Neutral;0.985112726688385;note excluding tobacco and alcohol products41ecb economic bulletin issue 1  2015 grocery prices in the euro area findings from the analysis of a disaggregated price datasetarticleexisted between for example a store in the most expensive part of a large city and a store in a less affluent primarily rural district
2015-02-05;2015;February;Monetary Policy Decisions;Neutral;0.9735093116760254;vat percentages countries all goods including private label branded goods only 2009 2011 2009 2011 be 4 7 18 19 de 20 20 11 10 ee 21 20 13 12 ie 23 17 35 32 gr 10 5 23 17 es 14 13 3 3 fr 4 3 3 5 it 8 10 2 0 nl 21 21 15 15 at 15 11 5 3 pt 23 22 11 11 si 10 11 13 12 sk 19 23 11 15 sources nielsen and eurosystem staff calculations
2015-02-05;2015;February;Monetary Policy Decisions;Neutral;0.9899917244911194;it should be noted that the country rankings in terms of mostleast expensive do not generally change even if unit prices include vatmedian difference from euro area average price level excl
2015-02-05;2015;February;Monetary Policy Decisions;Neutral;0.9128283858299256;it would be more understandable if such price differences 2 this countryspecific clustering of prices may also reflect the impact of possible territorial supply constraints
2015-02-05;2015;February;Monetary Policy Decisions;Neutral;0.9599828720092772;vat for selected products for market leading at region level brands min max paper towels dry pasta 00020406081012 00020406081012 be de ie gr es fr it nl at ptyaxis roll 1015202530 1015202530 be de ie gr es fr it nl at ptyaxis kg carbonated soft drinks tinned tuna 0405060708091011121314 0405060708091011121314 be de ie gr es fr it nl at ptyaxis litre 67891011121314 67891011121314 be de ie gr es fr it nl at ptyaxis kg sources nielsen and eurosystem staff calculations
2015-02-05;2015;February;Monetary Policy Decisions;Neutral;0.9835794568061828;to a large extent the countryspecific studies estimating the passthrough of vat rate changes rely on individual hicp subcomponents with long time series of available data
2015-02-05;2015;February;Monetary Policy Decisions;Neutral;0.988387644290924;detailed productlevel data derived from socalled quaranta tables that are used to validate raw price data and for quality control purposes are utilised
2015-02-05;2015;February;Monetary Policy Decisions;Neutral;0.9706223011016846;first it demonstrates the congruity of the disaggregated price dataset utilised in the rest of this article
2015-02-05;2015;February;Monetary Policy Decisions;Neutral;0.9859936237335204;also the charts for the benelux countries and the german cities not reported provide qualitatively similar results
2015-02-05;2015;February;Monetary Policy Decisions;Neutral;0.9776502847671508;again it is the case that price variation across countries is much higher than within countries both for all products together and for named brands only
2015-02-05;2015;February;Monetary Policy Decisions;Neutral;0.8369544148445129;home electronics paint toys  see chart d these products arguably provide for an even better test case for the existence of a border effect as they more often tend to have named brands are highly tradabletraded and local preferences might be a less important factor influencing prices than in the case of food products
2015-02-05;2015;February;Monetary Policy Decisions;Positive;0.7625713348388672;in addition to confirming the previous analysis for food and beverages the updated ppp data also provide compelling evidence for a border effect when it comes to home and garden products eg
2015-02-05;2015;February;Monetary Policy Decisions;Neutral;0.948109805583954;thus the findings of reiff and rumler 3  that although distance matters borders matter more  appear to be robust
2015-02-05;2015;February;Monetary Policy Decisions;Neutral;0.9640430212020874;chart c dispersion of food and beverage prices within and across countries 0001020304050607 00 01 02 03 04 05 06 07 0001020304050607xaxis within countries cities yaxis across countries citiesall products 2009 all products 2012 sources eurostat ppp database nielsen and eurosystem staff calculations44ecb economic bulletinissue 1  2015 result of geographical distance as while price dispersion across four fairly near capital cities is lower than the euro area average it is much higher than across four large german cities that are geographically much further apart
2015-02-05;2015;February;Monetary Policy Decisions;Neutral;0.9790096282958984;the sir 2011 also confirmed that this larger variation across borders was not the mere chart a rank of prices  cereals ready to eat specific brand 012345678910111213 012345678910111213 be deee iegr esfrit nlat pt sisk 0 1 2 3 4 5 6 7 8 9 10 11 12 13rank cheapexpensivexaxis rank grocery price data yaxis ppp rank sources eurostat ppp database nielsen and eurosystem staff calculationschart b rank of prices  milk refrigerated be de eeiegrit nlat ptsi sk 012345678910111213 0 1 2 3 4 5 6 7 8 9 10 11 12 13012345678910111213yaxis ppp rankxaxis rank grocery price data rank cheapexpensive es sources eurostat ppp database nielsen and eurosystem staff calculations
2015-02-05;2015;February;Monetary Policy Decisions;Neutral;0.963351309299469;this result also holds if only named brands are considered this allows us to control for potential quality differentials
2015-02-05;2015;February;Monetary Policy Decisions;Neutral;0.9291337728500366;this exercise has three benefits
2015-02-05;2015;February;Monetary Policy Decisions;Neutral;0.982437789440155;chart c shows the variation in prices within countriescapital cities and across countriescapital cities in the countries of the euro area for 400 detailed food beverage and tobacco products in both 2009 and 2012 the impact of national borders is clearly visible since the variation of prices is almost always larger across countries than within countries
2015-02-05;2015;February;Monetary Policy Decisions;Neutral;0.9835168719291688;although there are some deviations these tend to be relatively minor and may relate to technical factors such as pack size preferences across countries see section 3 of this article for a more detailed discussion
2015-02-05;2015;February;Monetary Policy Decisions;Neutral;0.9888880848884584;2 in germany data are collected for four cities berlin bonn karlsruhe and munich43ecb economic bulletin issue 1  2015 grocery prices in the euro area findings from the analysis of a disaggregated price datasetarticletext of this article
2015-02-05;2015;February;Monetary Policy Decisions;Neutral;0.9473631381988524;in addition they concern strongly traded product categories and are therefore good test cases for the impact of national borders
2015-02-05;2015;February;Monetary Policy Decisions;Neutral;0.9601917862892152;food accounts for 20 of the overall hicp while home and garden products account for around 13 which is almost half of the nonenergy industrial goods component
2015-02-05;2015;February;Monetary Policy Decisions;Neutral;0.974638819694519;although the ppp dataset generally only includes data collected in capital cities with some exceptions 2 charts a and b show that for two selected product types a wellknown readytoeat cereal brand and refrigerated milk the ranking of prices across countries is almost identical to that seen in the disaggregated price dataset used in the main 1 these product categ ories are an important element of consumers goods baskets
2015-02-05;2015;February;Monetary Policy Decisions;Neutral;0.9388684034347534;1 despite substantial methodological differences the two disaggregated grocery price and ppp datasets are highly congruent
2015-02-05;2015;February;Monetary Policy Decisions;Neutral;0.9786295294761658;third it allows for a comparison with the same product types food and beverages and with another product group home and garden such as home electronics paint toys
2015-02-05;2015;February;Monetary Policy Decisions;Neutral;0.9877449870109558;second it illustrates that the border effect documented in the sir 2011 using data from 2009 is still present in updated data from 2012 and 2013
2015-02-05;2015;February;Monetary Policy Decisions;Neutral;0.9894317388534546;the border effect as documented in the sir 2011 in food beverage and tobacco products has remained largely unchanged
2015-02-05;2015;February;Monetary Policy Decisions;Neutral;0.9773354530334472;4 these approaches are not possible in the case of the dataset used here as the data sample is too short
2015-02-05;2015;February;Monetary Policy Decisions;Negative;0.9008277654647828;an additional problem is that prices change for reasons other than vat rate developments
2015-02-05;2015;February;Monetary Policy Decisions;Neutral;0.9894844889640808;in this regard work from the eurosystem inflation persistence network showed that although prices may change relatively infrequently on average when they do change they tend to do so by large steps both upwards and downwards around 10 on average
2015-02-05;2015;February;Monetary Policy Decisions;Neutral;0.9894641637802124;examples of studies considering new outlet bias are lequiller 1997 for france who suggests a range of 005 percentage point to 015 percentage point per annum hoffmann 1998 for germany who argues that the effect is unlikely to exceed 01 percentage point annually and covas and silva 1999 for portugal who using portuguese micro data found that the effect had changed over time ranging between 025 and 050 percentage point per annum
2015-02-05;2015;February;Monetary Policy Decisions;Neutral;0.9923521876335144;denotes not significant at the 10 significance level50ecb economic bulletinissue 1  2015 evidence of the magnitude of inflation measurement bias in euro area countries is relatively scarce and generally relates to the late 1990s
2015-02-05;2015;February;Monetary Policy Decisions;Neutral;0.8690990209579468;note ns
2015-02-05;2015;February;Monetary Policy Decisions;Neutral;0.958043098449707;scale economies 4f  vat  passthrough 4g  promotion dummy  lower actual prices source eurosystem staff calculations
2015-02-05;2015;February;Monetary Policy Decisions;Neutral;0.9670832753181458;income effect 4e  population density  ns
2015-02-05;2015;February;Monetary Policy Decisions;Neutral;0.9437137246131896;income effect 4d  unemployment rate  ns
2015-02-05;2015;February;Monetary Policy Decisions;Neutral;0.9856552481651306;21 toward a more accurate measure of the cost of living final report to the senate finance committee from the advisory committee to study the consumer price index december 1996
2015-02-05;2015;February;Monetary Policy Decisions;Neutral;0.9743036031723022;22 20 this section draws from gabor e and vermeulen p new evidence on elementary index bias working paper series no 1754 ecb frankfurt am main december 2014 mcquade p substitution to private label products evidence from euro area retail scanner data paper presented to the 2014 european economic association annual congress 2529 august toulouse france
2015-02-05;2015;February;Monetary Policy Decisions;Neutral;0.7803112268447876;23 more recent work on the subject of inflation measurement highlights the uncertainty surrounding estimates of inflation measurement bias in terms of both sign and magnitude and the fact that these estimates may vary over the business cycle
2015-02-05;2015;February;Monetary Policy Decisions;Neutral;0.518936038017273;another source of possible inflation measurement error is the lack of weighting at the elementary index level
2015-02-05;2015;February;Monetary Policy Decisions;Neutral;0.9797611236572266;the boskin commission report 1996 21 highlighted four main sources of possible bias i product substitution bias which occurs with a fixedweight consumption basket that fails to reflect the fact that consumers tend to substitute less expensive goods for more expensive goods when relative prices change ii outlet substitution bias which occurs when shifts to lower price outlets eg
2015-02-05;2015;February;Monetary Policy Decisions;Neutral;0.9761282205581664;4 potential impli c ations o f c han g es in the g ro c ery retail str uc t u re f or in f lation meas u rement 20 the potential for bias in inflation measurement has long been recognised
2015-02-05;2015;February;Monetary Policy Decisions;Neutral;0.6562007069587708;in this respect it is important to educate and inform consumers stressing that their habits may affect prices
2015-02-05;2015;February;Monetary Policy Decisions;Neutral;0.9503311514854432;are significant and economically meaningful
2015-02-05;2015;February;Monetary Policy Decisions;Neutral;0.9874777793884276;time dummies and dummies controlling for product equivalising units are also included49ecb economic bulletin issue 1  2015 grocery prices in the euro area findings from the analysis of a disaggregated price datasetarticleto consume private label goods preferred pack sizes etc
2015-02-05;2015;February;Monetary Policy Decisions;Neutral;0.9876156449317932;19 promotions are defined as a price that drops by more than 625 implying a 25 reduction in a week which is a typical promotion period in a month and increases by more than 625 in the next
2015-02-05;2015;February;Monetary Policy Decisions;Neutral;0.9894649982452391;18 measured as herfindahlhirschman indice s calculated at 5 km radii which are then averaged up to the regions
2015-02-05;2015;February;Monetary Policy Decisions;Neutral;0.9642934799194336;therefore the price of pasta may be more important to and monitored more by italian consumers compared with the price of say strawberry jam
2015-02-05;2015;February;Monetary Policy Decisions;Neutral;0.8601614832878113;discounters are not adequately captured iii quality change bias which occurs when improvements in the quality of products are either estimated inaccurately or not at all and iv new product bias which occurs when new products are introduced into the consumption basket in a sufficiently timely manner
2015-02-05;2015;February;Monetary Policy Decisions;Negative;0.5622584223747253;17 for example italy has a relatively high consumption intensity of pasta
2015-02-05;2015;February;Monetary Policy Decisions;Neutral;0.9685045480728148;24 linz 2009 discusses the impact of a new weighting system on german inflation which gives a higher weight to discounters than previously and results in upward revisions to inflation owing to the passthrough of commodity price shocks
2015-02-05;2015;February;Monetary Policy Decisions;Neutral;0.9551419615745544;2013 using japanese scanner data for grocery prices find an upward bias on average over a long time period which eventually turns from being positive to negative
2015-02-05;2015;February;Monetary Policy Decisions;Positive;0.8380534052848816;overall while the recent oil price decline is expected to significantly decrease hicp inflation in 2015 it should support euro area economic activity in 2015 and 2016 in general the effects of oil price changes on hicp inflation should be temporary as at present futures markets predict a gradual increase in oil prices
2015-02-05;2015;February;Monetary Policy Decisions;Neutral;0.7541192770004272;and steenkamp j how business cycles contribute to privatelabel success evidence from the united states and europe journal of marketing  vol
2015-02-05;2015;February;Monetary Policy Decisions;Neutral;0.9308295249938964;for further evidence see also lamey l dereersnyder b dekimpe mg
2015-02-05;2015;February;Monetary Policy Decisions;Neutral;0.9488006234169006;25 an increasing substitution between private label and branded goods was also estimated for nonstressed countries over the same period
2015-02-05;2015;February;Monetary Policy Decisions;Neutral;0.9552363753318788;evidence from micro data working papers no 201324 bank of canada july 2013
2015-02-05;2015;February;Monetary Policy Decisions;Neutral;0.9542670845985411;632646 and kryvstov o is there a quality bias in the canadian cpi
2015-02-05;2015;February;Monetary Policy Decisions;Neutral;0.9552204012870787;93 no 2 may 2011 pp
2015-02-05;2015;February;Monetary Policy Decisions;Neutral;0.985139787197113;and mcclelland r new evidence on outlet substitution effects in consumer price index data the review of economics and statistics vol
2015-02-05;2015;February;Monetary Policy Decisions;Neutral;0.7858841419219971;handbury et al
2015-02-05;2015;February;Monetary Policy Decisions;Neutral;0.9847424030303956;24 see linz s weighting of outlettypes and regions  a new weighting system for the german consumer price index paper prepared for the 11th meeting of the international working group on price indices ottawa group 2009 handbury j watanabe t and weinstein de how much do official price indexes tell us about inflation nber working paper series no 19504 october 2013 greenlees js
2015-02-05;2015;February;Monetary Policy Decisions;Neutral;0.9762318730354308;nonetheless important insights may be obtained and areas for further research identified
2015-02-05;2015;February;Monetary Policy Decisions;Neutral;0.9401424527168274;one caveat is in order as data are available only for selected grocery goods it is not possible to draw conclusions about the potential for mismeasurement of overall inflation
2015-02-05;2015;February;Monetary Policy Decisions;Neutral;0.9754393696784972;25 lastly as data are available on the volume of sales as well as the average unit price of these sales the possible impact of the lack of weighting at the elementary index level on consumer price indices can be considered
2015-02-05;2015;February;Monetary Policy Decisions;Neutral;0.975459098815918;second when constructing consumer price indices price differences between private label and branded goods are usually implicitly attributed entirely to quality differences thus the price level shift which occurs when consumers turn to cheaper private label products is not taken into account however indirect empirical evidence on the substitution between private label and branded goods using the disaggregated grocery price data suggests that this may not entirely be the case
2015-02-05;2015;February;Monetary Policy Decisions;Neutral;0.9846075177192688;first as information both on market shares and average prices is available across store types the possible implications for inflation measurement of structural changes in retail formats can be considered see box 4
