Date;Year;Month;Type;sentiment;sentiment_score;sentence
2015-02-05;2015;February;Monetary Policy Decisions;Neutral;0.9916826486587524;a number of features of the disaggregated price dataset used in this article enable an analysis of the crosscountry evidence on possible inflation measurement issues for the euro area
2015-02-05;2015;February;Monetary Policy Decisions;Neutral;0.8139756321907043;lastly kryvstov 2013 using canadian data argues that quality bias is not an important source of potential mismeasurement of cpi inflation in canada
2015-02-05;2015;February;Monetary Policy Decisions;Neutral;0.6337211728096008;greenlees and mcclelland 2011 using data from the united states find that that the upward impact on prices from improved item quality offsets most of the downward impact of lowerpriced outlets
2015-02-05;2015;February;Monetary Policy Decisions;Neutral;0.9646704196929932;the noteworthy differences in price levels across different store types even when controlling for composition effects and structural changes in store formats notably the emergence of discounters and the relative decline of traditional store types could have implications for 23 see lequiller f does the french consumer price index overstate inflation srie des documents de travail de la direction des etudes et synthses conomiques institut national de la statistique et des tudes conomiques august 1997 hoffmann j problems of inflation measurement in germany discussion paper 198 economic research group of the deutsche bundesbank february 1998 and covas f and santos silva j outlet substitution bias economic bulletin  banco de portugal september 1999
2015-02-05;2015;February;Monetary Policy Decisions;Neutral;0.9853357672691344;2 price differences suggest markets may be segmented as they reflect data aggregated geographically across urban and rural areas and as such do not in general reflect a single expensive or cheap location
2015-02-05;2015;February;Monetary Policy Decisions;Neutral;0.9890120029449464;all explanatory variables are expressed in similar relative terms and quantitybased variables are instrumented with their third lag to avoid simultaneity
2015-02-05;2015;February;Monetary Policy Decisions;Neutral;0.9828898310661316;the variables capturing the macroeconomic environment such as regional gdp per capita population density unemployment do not seem as important at the regional level while vat differences are significant in explaining price differences across countries
2015-02-05;2015;February;Monetary Policy Decisions;Neutral;0.8047498464584351;alan j auerbach and martin feldstein
2015-02-05;2015;February;Monetary Policy Decisions;Neutral;0.9368556141853333;4 ed
2015-02-05;2015;February;Monetary Policy Decisions;Neutral;0.96871680021286;7 for a fuller discussion see fullerton d and metcalf ge tax incidence handbook of public economics vol
2015-02-05;2015;February;Monetary Policy Decisions;Neutral;0.9764333367347716;services prices a more systematic availability of micro consumer price data would be useful
2015-02-05;2015;February;Monetary Policy Decisions;Neutral;0.985204815864563;to extend the results to other categories eg
2015-02-05;2015;February;Monetary Policy Decisions;Neutral;0.9692378044128418;7 although the relatively low precision and high uncertainty of the individual estimates need to be borne in mind the analysis of vat rate passthrough exploiting crosscountry and crossproduct information has provided some insight regarding food and personal care goods prices
2015-02-05;2015;February;Monetary Policy Decisions;Neutral;0.6543613076210022;these results are broadly in line with theoretical expectations that firms with lower margins are obliged to pass through changes but those with some degree of monopoly power may absorb some of the changes
2015-02-05;2015;February;Monetary Policy Decisions;Neutral;0.8800979852676392;the estimation results also suggest that among branded goods the estimated passthrough of vat rate changes is lowest for the market leader
2015-02-05;2015;February;Monetary Policy Decisions;Neutral;0.7077705264091492;amsterdam elsevier 2002 nonetheless the overall conclusion that there are significant border effects within the single currency area is robust when controlling for distance for the differences in the distribution of individual prices and for diverging business cycle positions across countries
2015-02-05;2015;February;Monetary Policy Decisions;Neutral;0.7990755438804626;thus in the context of the economic crisis and heightened competition some of the impact of the vat rate changes may have been absorbed by margins
2015-02-05;2015;February;Monetary Policy Decisions;Neutral;0.9824105501174928;6 for another example of this methodology applied to these data see merikll j and rm t one currency one price
2015-02-05;2015;February;Monetary Policy Decisions;Neutral;0.9837700128555298;5 inflation persistence and pricesetting behaviour in the euro area a summary of the ipn evidence occasional paper series no 46 ecb frankfurt am main june 2006
2015-02-05;2015;February;Monetary Policy Decisions;Neutral;0.9512500166893004;720 and doliak m dopad janurovho zvenia dph na spotrebitesk ceny the impact of januarys vat increase on consumer prices biatec banking journal ronk 19 no 7 national bank of slovakia september 2011
2015-02-05;2015;February;Monetary Policy Decisions;Neutral;0.9822701811790466;4 see for instance a preliminary assessment of the effect on inflation of the increase in value added tax rates quarterly report on the spanish economy economic bulletin box 4 banco de espaa october 2010 karabalis n and kontelis e indirect tax increases and their impact on inflation in 20102012 economic bulletin no 38 bank of greece 2013 pp
2015-02-05;2015;February;Monetary Policy Decisions;Neutral;0.9867357611656188;6 the sample period covered by the dataset allows us to investigate vat rate changes in six countries estonia greece ireland spain portugal and slovakia
2015-02-05;2015;February;Monetary Policy Decisions;Neutral;0.9880241751670836;that is differences in price developments of treated groups productscountries where the vat rate changed and control groups productscountries where the vat rate did not change are analysed to estimate the impact of vat rate changes
2015-02-05;2015;February;Monetary Policy Decisions;Neutral;0.9916976690292358;one alternative approach to estimating the passthrough of vat rate changes is the socalled differenceindifferences approach which takes advantage of the additional information from the dataset both across countries and across product categories
2015-02-05;2015;February;Monetary Policy Decisions;Neutral;0.9653024673461914;5 in this context the effects of vat rate changes of the magnitude 0520 percentage points are not easy to detect
2015-02-05;2015;February;Monetary Policy Decisions;Neutral;0.9833883047103882;euro changeoverrelated inflation in estonia working paper series no 1732 ecb frankfurt am main september 2014synthetic euro area vat standard rate and number of vat standard rate changes 01234 180185190195200205210 1999 2001 2003 2005 2007 2009 2011 2000 2002 2004 2006 2008 2010 2012 2013number of countries with standard vat rate changes righthand scale aggregated euro area standard vat rate lefthand scale percentage sources european commission and eurosystem staff calculations47ecb economic bulletin issue 1  2015 grocery prices in the euro area findings from the analysis of a disaggregated price datasetarticleon average the results suggest that around onethird to onehalf of a vat rate change is passed through in the month of the rate change
2015-02-05;2015;February;Monetary Policy Decisions;Neutral;0.9892830848693848;finally the variables capturing consumer attitudes willingness 16 the rela tive price equation estimated is set up whereby the unit price of a brand for a specific product in a region is expressed relative to the unit prices of the minimum price location based on the market leaders in each location
2015-02-05;2015;February;Monetary Policy Decisions;Neutral;0.984982132911682;one possible explanation of protracted differences in price levels across countries lies in market segmentation ie
2015-02-05;2015;February;Monetary Policy Decisions;Neutral;0.8919546008110046;retail market structure may have an impact on price levels albeit in a complex manner
2015-02-05;2015;February;Monetary Policy Decisions;Neutral;0.9846434593200684;perhaps reflecting the labourintensive nature of this sector differences in wages of lowskilled workers are also found to be important in explaining observed price differences as are differences in rents albeit not as robustly
2015-02-05;2015;February;Monetary Policy Decisions;Neutral;0.9470400214195251;the market leaders and ease the potential entry and growth of new producers increasing competition  see table 2 significant effects on prices from retail market concentration are also found that depend on the level of aggregation buying group vs parent group confirming that relevant policies regarding retail structures may indeed be beneficial for consumers
2015-02-05;2015;February;Monetary Policy Decisions;Neutral;0.9718570113182068;2 consumer attitudes which are measured by a consumption intensity calculated as the number of units sold per person per month in a location 17 and b consumer cost indifference measured as the average pack size while there is a negative relationship between pack size and unit price it is still the consumers choice which pack size to buy3 retail market concentration indices for a the parent group level and b the buying group level18 4 other regional variables which may be important for determining price levels such as a local costs such as wages and rents b gdp per capita c the unemployment rate d population density e vat rates and f a dummy variable capturing promotions19 the results suggest that there is scope for lowering price dispersion and lowering prices in some countries by implementing product market reforms that aim to reduce the rents of the incumbent producers ie
2015-02-05;2015;February;Monetary Policy Decisions;Neutral;0.9576253890991212;16 1 competition in the producer market which is captured by a the relative quantity share of the market leader which can be seen as a relative measure of monopoly power b the relative quantity share of other brands that are not the market leaders and c the relative quantity share of private label products
2015-02-05;2015;February;Monetary Policy Decisions;Neutral;0.9863117337226868;this is done by regressing relative prices on possible explanatory variables split into four main categories
2015-02-05;2015;February;Monetary Policy Decisions;Neutral;0.9761937856674194;in view of the evidence of both microeconomic market structure consumer attitudes and macroeconomic position in the cycle determinants of price differences it is important to try to holistically account for as many factors as possible at the same time
2015-02-05;2015;February;Monetary Policy Decisions;Positive;0.9693709015846252;48ecb economic bulletinissue 1  2015 these results suggest that appropriate competitionenhancing policies for example the removal of zoning restrictions retail outlet size restrictions or populationbased restrictions might benefit consumers by lowering prices
2015-02-05;2015;February;Monetary Policy Decisions;Neutral;0.985054075717926;other control variables are included in the vector xj and are comprised of regional dummies regional population density regional per capita gdp and the regional unemployment rate
2015-02-05;2015;February;Monetary Policy Decisions;Neutral;0.7812524437904358;price discrimination which may be related to differences in retail market concentration competition between producers bargaining power allocation between producers and retailers differences in consumer habits and differences in local costs such as wages and rents
2015-02-05;2015;February;Monetary Policy Decisions;Neutral;0.985981583595276;15 these findings are based on econometric investigations where the following equation was estimated at the regional level ln pij  ai  bk  hbgj  hpcj  xj  ij where the dependent variable is the average price level net of the vat and in natural logs for good i sold in region j and the main explanatory variable is the herfindahlhirschman index hhi computed at the buying group hbgj and at the parent company level hpcj
2015-02-05;2015;February;Monetary Policy Decisions;Neutral;0.9872779846191406;13 a buying group is an organisation of retailers that combines the bargaining power of its members in order to be able to purchase goods at a more advantageous rate than might be achieved through individual negotiation
2015-02-05;2015;February;Monetary Policy Decisions;Positive;0.808317244052887;on balance the results suggest that a lower degree of regional competition higher concentration at the parent company level is associated with higher prices
2015-02-05;2015;February;Monetary Policy Decisions;Neutral;0.7631067633628845;15 by contrast the indications of a downward impact on prices arising from higher concentration at the buying group level are not robust across product categories
2015-02-05;2015;February;Monetary Policy Decisions;Neutral;0.968090295791626;a statistically significant upward impact on prices from increased concentration lower competition at the parent company level is found by regressing price levels on regional concentration indices
2015-02-05;2015;February;Monetary Policy Decisions;Neutral;0.785067081451416;at the buying group level  is associated with lower prices1314 whether the downstream or upstream effects dominate is largely an empirical question
2015-02-05;2015;February;Monetary Policy Decisions;Positive;0.4110995233058929;on the other hand increased retail concentration upstream or closer to the producer  ie
2015-02-05;2015;February;Monetary Policy Decisions;Neutral;0.6426855325698853;at the store and parent company levels  is associated with higher prices
2015-02-05;2015;February;Monetary Policy Decisions;Negative;0.9050999879837036;on the one hand increased retail market concentration or less competition downstream or closer to the consumer  ie
2015-02-05;2015;February;Monetary Policy Decisions;Neutral;0.9373881816864014;14 see cia panna e and colonna f the effect of retail sector concentration on prices and sme performance in italy 2011 mimeo
2015-02-05;2015;February;Monetary Policy Decisions;Neutral;0.9766365885734558;the price differences remain substantial even in a comparison of the 25th and 75th percentiles
2015-02-05;2015;February;Monetary Policy Decisions;Positive;0.5645919442176819;22 for a more detailed discussion of these factors see also the box entitled potential measurement issues in consumer price indices monthly bulletin  ecb april 2014table 2 variables explaining price differences relative to minimum price location variables sign mechanism 1  product market competition 1a  market leader share  increased monopoly power 1b  other brands share  increased competition 1c  private label share  increased competition 2  consumer attitudes2a  consumption intensity  increased consumer attention 2b  consumer cost indifference  increased consumer awareness 3  retailer competition3a  retail herfindahlhirschman index hhi parent company level  reduced competition 3b  retail herfindahlhirschman index hhi buying group level  countervailing producer power 4  other control factors4a  wages of lowskilled workers  increasing cost 4b  rents of retail shops  increasing cost 4c  gdp per capita  ns
2015-02-05;2015;February;Monetary Policy Decisions;Neutral;0.9864902496337892;moreover for several product categories the market leaders across countries are the same producers offering the same products
2015-02-05;2015;February;Monetary Policy Decisions;Negative;0.987188994884491;past experience points to a negative realtime bias of the output gap of the order of 1 of gdp over the 200313 period
2015-02-05;2015;February;Monetary Policy Decisions;Neutral;0.9516206979751588;however the output gap which largely determines the adjustment requirements under the new decision matrix is an unobservable variable subject to considerable revisions over time
2015-02-05;2015;February;Monetary Policy Decisions;Neutral;0.9889812469482422;compared with previous requirements applied in the review of draft budgetary plans for 2015 for example italys required structural effort under the preventive arm would be halved to 025 of gdp keeping in mind that compliance with the debt rule is a binding requirement under the sgp
2015-02-05;2015;February;Monetary Policy Decisions;Neutral;0.9348744750022888;periods in which the output gap is positive and larger than zero
2015-02-05;2015;February;Monetary Policy Decisions;Neutral;0.9899769425392152;2 as a criterion within this matrix an assessment is made as to whether the economic situation is improving or deteriorating by distinguishing whether real growth exceeds or falls short of a countryspecific potential growth rate34ecb economic bulletinissue 1  2015 beyond the provisions of the existing sgp code of conduct which states that in principle economic good times should be identified as periods where output exceeds its potential level ie
2015-02-05;2015;February;Monetary Policy Decisions;Neutral;0.9012272357940674;in this respect the communication goes 1 the communication does not however define a severe economic downturn and thus the conditions for triggering the general escape clause see article 51 of regulation eu no 14661997 and article 35 of regulation eu no 14671997 which allows structural adjustment under both the pacts preventive and corrective arms to be paused in the event of a severe economic downturn in the euro area or the eu as a whole as long as fiscal sustainability is not at risk
2015-02-05;2015;February;Monetary Policy Decisions;Neutral;0.9824231863021852;in good times defined by an output gap of above 15 of gdp the required structural effort gradually increases to above 075 of gdp and above 1 of gdp for countries with debt below and above 60 of gdp respectively
2015-02-05;2015;February;Monetary Policy Decisions;Neutral;0.9917941689491272;in normal times defined by an output gap of between 15 and 15 of gdp the required structural effort is 05 of gdp for countries with debt below 60 of gdp and above 05 of gdp for countries with debt above 60 of gdp
2015-02-05;2015;February;Monetary Policy Decisions;Neutral;0.9910517334938048;this compares with requirements of 01 and 05 of gdp for these groups of countries respectively in the 2014 european semester
2015-02-05;2015;February;Monetary Policy Decisions;Neutral;0.9865109920501708;in addition in very bad times defined by an output gap of between 3 and 4 of gdp the required structural effort is reduced to zero and 025 of gdp for countries with debt below and above 60 of gdp respectively
2015-02-05;2015;February;Monetary Policy Decisions;Neutral;0.9792823195457458;2 according to this matrix irrespective of the debt level no fiscal adjustment is needed which is equivalent to granting a waiver in countries faced with exceptionally bad times defined by negative growth or an output gap of below 4 of gdp
2015-02-05;2015;February;Monetary Policy Decisions;Neutral;0.991160213947296;1 to this end it includes a matrix that specifies the fiscal adjustments needed according to the size of the output gap and economic growth for countries with government debt below 60 of gdp and for those with government debt above 60 of gdp
2015-02-05;2015;February;Monetary Policy Decisions;Negative;0.9460355639457704;the commissions communication defines economic good times and granulates economic developments which are worse than what is experienced in normal times into bad very bad and exceptionally bad economic times
2015-02-05;2015;February;Monetary Policy Decisions;Neutral;0.9797734022140504;in particular in assessing the appropriateness of each countrys progress towards its mto the council and the commission have to assess whether a higher adjustment effort is made in economic good times whereas the effort might be more limited in economic bad times
2015-02-05;2015;February;Monetary Policy Decisions;Neutral;0.9704806804656982;the regulation further specifies that member states with a debt level exceeding 60 of gdp or with pronounced risks of overall debt sustainability are required to achieve an annual improvement in their structural balance that is higher than 05 of gdp
2015-02-05;2015;February;Monetary Policy Decisions;Neutral;0.9455252289772034;the new treatment of cyclical conditions under the sgps preventive armunder article 51 of regulation eu no 14661997 which lays down the provisions for eu countries under the sgps preventive arm member states which have not yet reached their mediumterm budgetary objective mto are required to pursue an annual improvement in their structural budget balance of 05 of gdp as a benchmark
2015-02-05;2015;February;Monetary Policy Decisions;Neutral;0.9864051342010498;this box outlines the main elements of the communication and its implications for surveillance under the eus fiscal governance framework
2015-02-05;2015;February;Monetary Policy Decisions;Neutral;0.8965024948120117;3 in particular the boom period of 200607 was not identified as economic good times in real time
2015-02-05;2015;February;Monetary Policy Decisions;Neutral;0.964387834072113;consequently the required fiscal adjustment towards the mto determined by the new matrix in real time might turn out to be smaller than the adjustment that would have been warranted based on ex post data
2015-02-05;2015;February;Monetary Policy Decisions;Negative;0.9617856740951538;this could undermine the aim of the pacts preventive arm which is to build buffers in economic good times
2015-02-05;2015;February;Monetary Policy Decisions;Neutral;0.983125627040863;the treatment of structural reforms under article 51 of regulation eu no 14661997 countries may deviate from the adjustment path towards their mto if they have implemented major structural reforms which improve longterm fiscal sustainability
2015-02-05;2015;February;Monetary Policy Decisions;Neutral;0.9810113906860352;an important condition that applied under the old investment clause has been dropped as there is no longer any reference to compliance with the debt rule
2015-02-05;2015;February;Monetary Policy Decisions;Neutral;0.9817177057266236;as with the old investment clause member states need to ensure a safety margin so that the 3 of gdp deficit reference value is respected
2015-02-05;2015;February;Monetary Policy Decisions;Negative;0.9614052772521972;negative gdp growth with a negative or a large negative eu output gap forecast the new investment clause can be activated on the basis of economic developments in the member state concerned either negative gdp growth or an output gap below 15 of gdp
2015-02-05;2015;February;Monetary Policy Decisions;Neutral;0.5415059924125671;the clause now pertains to capital expenditure on projects cofunded by the eu including the structural and cohesion policy the transeuropean network and the connecting europe facility as well as the newly established european fund for strategic investment efsi 4 while the activation of the old investment clause hinged on negative economic developments in the eu as a whole ie
2015-02-05;2015;February;Monetary Policy Decisions;Negative;0.9654548168182372;this was controversial as public investment is different in nature from structural reform
2015-02-05;2015;February;Monetary Policy Decisions;Neutral;0.9833639860153198;the investment clause was introduced by the commission in 2013 by subsuming investment under the abovementioned major structural reform clause of the sgp
2015-02-05;2015;February;Monetary Policy Decisions;Neutral;0.9861987829208374;this was applied in 2013 and 2014 but had been discontinued for 2015 allowing countries under the sgps preventive arm to deviate temporarily from the adjustment path towards their mto to accommodate additional public investment
2015-02-05;2015;February;Monetary Policy Decisions;Neutral;0.8784037232398987;3 see also kamps c leinerkillinger n sondermann d de stefani r and rffer r the identification of fiscal and macroeconomic imbalances  unexploited synergies under the strengthened eu governance framework occasional paper series no 157 ecb frankfurt am main november 201435ecb economic bulletin issue 1  2015 boxes flexibility within the stability and growth pactthe treatment of public investment the commissions communication has reestablished the investment clause
2015-02-05;2015;February;Monetary Policy Decisions;Neutral;0.9401895403862;without modifying existing regulations it clarifies and at the same time extends the flexibility of applying the rules of the stability and growth pact sgp in three major areas i cyclical conditions ii structural reforms and iii public investment
2015-02-05;2015;February;Monetary Policy Decisions;Neutral;0.8669415712356567;countries subject to an excessive deficit procedure remain obliged to achieve their fiscal consolidation targets
2015-02-05;2015;February;Monetary Policy Decisions;Neutral;0.9902701377868652;the excessive deficit procedure edp the commission will take into account the existence of a dedicated structural reform plan which must provide detailed and verifiable information as well as credible timelines for adoption and delivery as a relevant factor when recommending opening a procedure and when setting the deadline for correction of the excessive deficit or extending that deadline
2015-02-05;2015;February;Monetary Policy Decisions;Neutral;0.9724241495132446;under the pacts corrective arm ie
