Date;Year;Month;Type;sentiment;sentiment_score;sentence
2015-02-05;2015;February;Monetary Policy Decisions;Negative;0.9933425784111024;annual consumer price inflation  at 15 in december  is hovering at close to two and a halfyear lows and is expected to decline further reflecting both the slowdown in demand and the current weakness in commodity prices
2015-02-05;2015;February;Monetary Policy Decisions;Negative;0.845450222492218;in a longer term perspective chinese growth continues on its path of gradual deceleration see box 2 although the recent drop in oil prices could provide some temporary support
2015-02-05;2015;February;Monetary Policy Decisions;Negative;0.994013488292694;quarterly gdp growth slowed to 15 in the final quarter of 2014 on the back of weakness in the housing market and heavy industries
2015-02-05;2015;February;Monetary Policy Decisions;Negative;0.9951096177101136;growth momentum in china has slowed and inflation remains low
2015-02-05;2015;February;Monetary Policy Decisions;Neutral;0.9880021810531616;at the same time annual cpi inflation excluding food and energy remained broadly stable at around 13
2015-02-05;2015;February;Monetary Policy Decisions;Positive;0.9751384258270264;annual cpi inflation eased further to 05 in december 2014 owing to lower energy prices
2015-02-05;2015;February;Monetary Policy Decisions;Negative;0.9949086308479308;while activity will be supported by higher real disposable income in view of falling energy prices survey indicators point towards a nearterm slowdown in the pace of expansion
2015-02-05;2015;February;Monetary Policy Decisions;Negative;0.9934000968933104;the decline in longterm yields reflected market expectations of a further weakening of inflation dynamics in an environment of weak growth as well as increasing market expectations of sovereign debt purchases by the ecb
2015-02-05;2015;February;Monetary Policy Decisions;Negative;0.944017767906189;the yield on us treasuries with a tenyear maturity see chart 4 recorded a decline similar to that of euro area yields suggesting that global factors may have contributed to the decline in the synthetic measure of the tenyear aaarated euro area government bond yields
2015-02-05;2015;February;Monetary Policy Decisions;Neutral;0.9748511910438538;the spreads between sovereign bonds in germany and other euro area 1 the per iod under review is from 4 december 2014 to 21 january 2015 chart 3 eonia expectations based on the overnight index swap yield curve percentages per annum 04000408121620 04000408121620 2014 2015 2016 2017 2018 2019 202021 january 2015 post june governing council meeting 5 june 2014 interest rate cut 30 september 2014 sources reuters and ecb calculationschart 4 tenyear government bond yields percentages per annum 0005101520253035 0005101520253035 2012 2013 2014jan
2015-02-05;2015;February;Monetary Policy Decisions;Neutral;0.9610839486122132;july jan july jan jan julyeuro area united states sources euromts ecb and bloomberg
2015-02-05;2015;February;Monetary Policy Decisions;Positive;0.4391998946666717;for the same period construction production stood 05 above the figure for the third quarter when it also recorded a decline
2015-02-05;2015;February;Monetary Policy Decisions;Positive;0.974459707736969;3 economi c activity following six quarters of positive output growth most recent hard data remain consistent with a further moderate economic expansion in the fourth quarter of 2014 in october and november industrial production excluding construction stood on average 03 above its thirdquarter level when production contracted by 04
2015-02-05;2015;February;Monetary Policy Decisions;Neutral;0.9838252067565918;on 1 january 2015 lithuania adopted the euro and became the 19th member of the euro area see box 3
2015-02-05;2015;February;Monetary Policy Decisions;Neutral;0.8059318661689758;in contrast a weakening of the currencies of central and eastern european countries mitigated the depreciation of the euro in effective terms
2015-02-05;2015;February;Monetary Policy Decisions;Neutral;0.9900007247924804;the danish krone continued to trade close to its central rate within erm ii while danmarks nationalbank reduced interest rates twice over the review period
2015-02-05;2015;February;Monetary Policy Decisions;Neutral;0.9831361174583436;following the announcement of the swiss national bank on 15 january 2015 that it would discontinue its minimum exchange rate target of 120 swiss francs per euro the euro depreciated sharply against the swiss franc to trade at around parity thereafter
2015-02-05;2015;February;Monetary Policy Decisions;Negative;0.9828258156776428;higher volatility and the decline in risk appetite supported the japanese yen leading the euro to decline by almost 8 against the japanese currency
2015-02-05;2015;February;Monetary Policy Decisions;Neutral;0.7494955658912659;the euro also continued to depreciate  albeit at a slower pace  against the pound sterling which reached a sixyear high against the single currency
2015-02-05;2015;February;Monetary Policy Decisions;Negative;0.9955028891563416;in the united kingdom shortterm indicators point to a slowdown in economic activity while inflation has fallen to very low levels
2015-02-05;2015;February;Monetary Policy Decisions;Negative;0.9921537041664124;the euro fell by 58 against the us dollar which was supported by market uncertainty in an environment of declining oil prices and heightened geopolitical tensions
2015-02-05;2015;February;Monetary Policy Decisions;Negative;0.9679247736930848;overall the euro weakened by 34 in tradeweighted terms over the review period
2015-02-05;2015;February;Monetary Policy Decisions;Negative;0.8983674049377441;the euro continued to depreciate amid expectations of further diverging monetary policies in the euro area and abroad
2015-02-05;2015;February;Monetary Policy Decisions;Neutral;0.7580335736274719;the stock market in the united states weakened over the review period  the standard  poors 500 index declined by 19  and implied volatility increased slightly
2015-02-05;2015;February;Monetary Policy Decisions;Neutral;0.9829527139663696;stock market uncertainty in the euro area as measured by implied volatility increased and ended the review period at levels that are at the higher end of the range recorded over the past two years
2015-02-05;2015;February;Monetary Policy Decisions;Negative;0.9940223097801208;the predominance of dampening factors such as weak growth momentum and the political uncertainties in greece abated in the week of the monetary policy meeting of the governing council amid market expectations of sovereign debt purchases by the ecb
2015-02-05;2015;February;Monetary Policy Decisions;Neutral;0.9500733613967896;the broadbased euro stoxx equity price index increased by 31 over the review period as a whole
2015-02-05;2015;February;Monetary Policy Decisions;Neutral;0.9843811988830566;in the euro area stock prices increased in the last part of the review period
2015-02-05;2015;February;Monetary Policy Decisions;Neutral;0.8936381340026855;note the euro area bond yield is based on the ecbs data on aaarated bonds which currently include bonds from austria finland germany and the netherlands9ecb economic bulletin issue 1  2015 update on ec onomic and m oneta ry de v e l op m ent s economic activitycountries remained relatively stable although in greece political uncertainties led the spread to increase by more than 200 basis points
2015-02-05;2015;February;Monetary Policy Decisions;Negative;0.9940404295921326;in the euro area the subdued inflation outlook and declining benchmark bond yields which reflected among other things the global increase in risk aversion weighed on the exchange rate
2015-02-05;2015;February;Monetary Policy Decisions;Negative;0.8974752426147461;meanwhile annual consumer price inflation continued to ease to 24 in november driven largely by lower energy prices
2015-02-05;2015;February;Monetary Policy Decisions;Negative;0.702531635761261;at the end of 2014 the government announced a stimulus package and a reduction in the effective corporate tax rate in order to support growth
2015-02-05;2015;February;Monetary Policy Decisions;Positive;0.9594680666923524;the second data release confirmed the decline in japanese real gdp by 05 quarter on quarter in the third quarter of 2014 highfrequency indicators point to a return to positive albeit weak growth in the fourth quarter
2015-02-05;2015;February;Monetary Policy Decisions;Positive;0.992131769657135;the ecbs monetary policy measures should support a further improvement in credit flows
2015-02-05;2015;February;Monetary Policy Decisions;Negative;0.9885975122451782;these developments have been facilitated by a broadbased and substantial reduction in lending rates recorded since summer 2014 despite the improvement in lending conditions as reported in the january 2015 euro area bank lending survey credit standards still remain relatively tight
2015-02-05;2015;February;Monetary Policy Decisions;Negative;0.8716204166412354;the decline in loans to nonfinancial corporations has continued to moderate while the growth of loans to households has stabilised at a slightly positive level
2015-02-05;2015;February;Monetary Policy Decisions;Neutral;0.6407712697982788;supported by the ecbs monetary policy measures the ongoing recovery and the assumption embedded in futures markets of a gradual increase in oil prices in the period ahead inflation rates are expected to increase gradually later in 2015 and in 2016 the monetary analysis indicates that the annual growth of m3 recovered further in november
2015-02-05;2015;February;Monetary Policy Decisions;Negative;0.99461430311203;on the basis of current information the shortterm inflation outlook remains weak and annual hicp inflation is likely to stay very low or negative in the coming months
2015-02-05;2015;February;Monetary Policy Decisions;Negative;0.717499852180481;euro area hicp inflation declined significantly in december to 02
2015-02-05;2015;February;Monetary Policy Decisions;Negative;0.9354762434959412;meanwhile although labour markets have shown some further signs of improvement unemployment remains high and unutilised capacity is expected to diminish only gradually
2015-02-05;2015;February;Monetary Policy Decisions;Positive;0.9844569563865662;overall the latest economic indicators and survey results remain consistent with a moderate economic expansion in the euro area in the short term while the recent fall in oil prices should support growth in the longer term
2015-02-05;2015;February;Monetary Policy Decisions;Neutral;0.9778426289558412;at its meeting on 22 january 2015 based on its regular economic and monetary analyses the governing council of the ecb conducted a thorough reassessment of the outlook for price developments and of the monetary stimulus achieved so far
2015-02-05;2015;February;Monetary Policy Decisions;Neutral;0.9872586131095886;the exchange rate of the euro has depreciated further both in nominal effective terms and against the us dollar
2015-02-05;2015;February;Monetary Policy Decisions;Negative;0.9955444931983948;longterm interest rates also reached new historic lows reflecting weak growth momentum and subdued inflation dynamics as well as market expectations of sovereign debt purchases by the eurosystem
2015-02-05;2015;February;Monetary Policy Decisions;Negative;0.9951438903808594;in euro area financial markets shortterm money market rates have declined further in an environment of increased excess liquidity temporarily reaching new historic lows
2015-02-05;2015;February;Monetary Policy Decisions;Negative;0.9891547560691832;the decline in energy prices has lowered inflation rates globally
2015-02-05;2015;February;Monetary Policy Decisions;Positive;0.991287887096405;global trade is showing signs of strengthening
2015-02-05;2015;February;Monetary Policy Decisions;Negative;0.957835018634796;economic conditions in russia have deteriorated further but spillovers to other emerging markets remain limited to date
2015-02-05;2015;February;Monetary Policy Decisions;Negative;0.9895427227020264;growth in the united states remains robust momentum is slowing in china and activity in japan has not regained traction
2015-02-05;2015;February;Monetary Policy Decisions;Positive;0.6218733787536621;nevertheless the recovery remains gradual and economic developments vary across regions
2015-02-05;2015;February;Monetary Policy Decisions;Neutral;0.8651525378227234;  3ecb economic bulletin issue 1  2015 contents update on economi c and monetary developments summary 5 1 exter nal environment 6 2 financial developments 8 3 economic activity 9 4 prices and costs 11 5 money and credit 12 boxes box 1 the governing councils expanded asset purchase prog ramme 15 box 2 the out look for chinas economy risks reforms and challenges 19 box 3 lithuan ia adopts the euro 21 box 4 recent developments in the labour force participation rate in the euro area 24 box 5 the rec ent oil price decline and the euro area economic outlook 26 box 6 trends in profit margins of euro area nonfinancial corporations 29 box 7 flexibil ity within the stability and growth pact 33 arti c le grocery prices in the euro area findings from the analysis of a disaggregated price dataset 37 statisti c s s 15ecb economic bulletin issue 1  2015 update on economi c and monetary developments su mmary the recent decline in oil prices is supporting the global economic recovery
2015-02-05;2015;February;Monetary Policy Decisions;Neutral;0.9540531635284424;at the same time euro area stock prices have increased
2015-02-05;2015;February;Monetary Policy Decisions;Positive;0.9921566247940063;recent developments in retail trade and car registrations are in line with continued positive private consumption growth in the fourth quarter while the production of capital goods points to a modest expansion of euro area investment
2015-02-05;2015;February;Monetary Policy Decisions;Neutral;0.988440752029419;as a result the governing council decided  first to launch an expanded asset purchase programme encompassing the existing purchase programmes for assetbacked securities and covered bonds as well as purchases of eurodenominated investmentgrade securities issued by euro area governments and agencies and european institutions in the secondary market for futher details see box 1  second to change the pricing of the six remaining targeted longerterm refinancing operations tltros by removing the 10 basis point spread over the rate on the eurosystems main refinancing operations that applied to the first two tltros  third in line with its forward guidance to keep the key ecb interest rates unchanged6ecb economic bulletinissue 1  2015 1 external environment the recent decline in oil prices is supporting the global economic recovery
2015-02-05;2015;February;Monetary Policy Decisions;Negative;0.7218109369277954;according to the futures curve markets have priced in only a gradual increase in oil prices for the coming years
2015-02-05;2015;February;Monetary Policy Decisions;Negative;0.6330915093421936;as japans economy failed to regain sustained traction after the hike in vat in april the government announced further fiscal stimulus measures
2015-02-05;2015;February;Monetary Policy Decisions;Neutral;0.6760115027427673;this was already reflected in a drop in annual cpi inflation to 08 in december from the rate of 17 that had prevailed since august
2015-02-05;2015;February;Monetary Policy Decisions;Negative;0.9845389127731324;at the same time falling oil prices are expected to lead to lower cpi inflation in the short term reinforced by downward pressures from the appreciation of the us dollar
2015-02-05;2015;February;Monetary Policy Decisions;Positive;0.9912891387939452;on balance the income windfall for consumers from lower oil prices is expected to more than offset the negative impact from the further strengthening of the us dollar since december thus providing a boost to the overall outlook for the united states
2015-02-05;2015;February;Monetary Policy Decisions;Negative;0.956238090991974;recent data remained robust suggesting only a slight moderation in growth in the final quarter of the year
2015-02-05;2015;February;Monetary Policy Decisions;Positive;0.9812652468681335;according to the third estimate real gdp growth increased by 12 quarter on quarter in the third quarter of 2014 which is the strongest growth rate in almost a decade
2015-02-05;2015;February;Monetary Policy Decisions;Positive;0.992098331451416;us activity was stronger than expected and indicators point to robust growth in the short term
2015-02-05;2015;February;Monetary Policy Decisions;Negative;0.8744187951087952;note the latest observation is for the fourth quarter of 2014 for pmi and the third quarter of 2014 for gdp7ecb economic bulletin issue 1  2015 external environmentupdate on ec onomic and m oneta ry de v e l op m ent songoing weakness in commodity prices it is expected that significant downward pressures on global inflation will continue
2015-02-05;2015;February;Monetary Policy Decisions;Negative;0.989211082458496;in response to a wellsupplied oil market brent crude oil prices continued to decline sharply in december and january see chart 1 and stood on 21 january 2015 about 31 below the levels of early december in us dollar terms
2015-02-05;2015;February;Monetary Policy Decisions;Neutral;0.9529998898506165;note the futures curve is dated 21 january 2015chart 2 global composite output pmi and gdp lefthand side diffusion index quarterly averages righthand side percentages quarterly data 18120600061218 35404550556065 2008 2009 2010 2011 2012 2013 2014quarteronquarter global gdp righthand scale composite output lefthand scale sources markit and ecb
2015-02-05;2015;February;Monetary Policy Decisions;Negative;0.7807855010032654;annual oecd inflation excluding food and energy fell further to 17 in november
2015-02-05;2015;February;Monetary Policy Decisions;Neutral;0.8429440855979919;the fall in inflation was broadbased across major economies except for russia which experienced a significant increase
2015-02-05;2015;February;Monetary Policy Decisions;Neutral;0.9155005812644958;as a result annual consumer price inflation in the oecd area decreased further to 15 in november
2015-02-05;2015;February;Monetary Policy Decisions;Negative;0.9935518503189088;however the global pmi for new manufacturing export orders moderated in the final quarter of 2014 falling energy prices are leading to a decline in global inflation
2015-02-05;2015;February;Monetary Policy Decisions;Positive;0.9493123292922974;the volume of world merchandise imports excluding the euro area increased by 34 on a threemonthonthreemonth basis in october moving further above its longterm average
2015-02-05;2015;February;Monetary Policy Decisions;Positive;0.9904775619506836;global trade continues to show signs of strengthening
2015-02-05;2015;February;Monetary Policy Decisions;Negative;0.9888317584991456;despite the support from lower oil prices the global economic recovery remains gradual and surveys point to some softening in the growth momentum in the fourth quarter of 2014 the composite output purchasing managers index pmi excluding the euro area fell slightly in december to a level below both its longterm average and its thirdquarter reading see chart 2
2015-02-05;2015;February;Monetary Policy Decisions;Positive;0.9838252663612366;as lower oil prices lead to a redistribution of income from net oil producers to net oil consumers this supports global demand as net oilconsuming countries tend to have a higher propensity to spend
2015-02-05;2015;February;Monetary Policy Decisions;Neutral;0.9654045701026917;given the chart 1 brent crude oil prices and futures usd or eur per barrel 020406080100120140160 020406080100120140160usd eurfutures usd futures eur 2008 2009 2010 2011 2012 2013 2014 2015 2016 sources bloomberg and ecb staff
2015-02-05;2015;February;Monetary Policy Decisions;Positive;0.7210351228713989;the outlook of a gradual recovery is also confirmed by more timely survey data
2015-02-05;2015;February;Monetary Policy Decisions;Negative;0.9931458234786988;the euro area composite output purchasing managers index pmi declined from the third quarter to the fourth quarter mainly reflecting a weakening in sentiment for the services sector
2015-02-05;2015;February;Monetary Policy Decisions;Positive;0.5098345279693604;however the average for the fourth quarter remains consistent with moderate positive growth signalling a continuation of the ongoing gradual recovery see chart 5
2015-02-05;2015;February;Monetary Policy Decisions;Neutral;0.7438127398490906;mfi issuance of debt securities remained negative and the ongoing contraction of balance sheets and the strengthening of the banks capital base is reducing the need for banks to seek funding via debt securities issuancechart 9 m3 and loans to the private sector annual rate of growth and annualised threemonth growth rate 420246810121416 420246810121416 2005 2006 2007 2008 2009 2010 2011 2012 2013 2014m3 annual growth rate m3 annualised threemonth growth rateloans to the private sector annual growth rateloans to the private sector annualised threemonth growth rate source ecbchart 10 credit standards and net demand for loans to nonfinancial corporations and households for house purchase net percentages 7550250255075 7550250255075credit standards  loans to nfcs credit standards  loans to households for house purchase demand  loans to nfcs demand  loans to households for house purchase 2008 2009 2010 2011 2012 2013 2014 source ecb14ecb economic bulletinissue 1  2015 the january 2015 euro area bank lending survey points to improvements in lending conditions however credit standards remain tight from a historical perspective see survey at wwwecbeuropaeustatspdfblssurvey_201501pdf
2015-02-05;2015;February;Monetary Policy Decisions;Positive;0.5482085943222046;at the same time the cost of deposit funding for euro area banks remained broadly stable while yields on bank bonds declined slightly
2015-02-05;2015;February;Monetary Policy Decisions;Neutral;0.9340202808380128;rates on loans to households for house purchase also fell in november the costofborrowing indicator for households for house purchase decreased to 26
2015-02-05;2015;February;Monetary Policy Decisions;Neutral;0.8973520994186401;rates on loans to nfcs declined further in november in particular in the case of longterm loans the costofborrowing indicator for euro area nfcs fell to 25 in november compared with 28 in june
2015-02-05;2015;February;Monetary Policy Decisions;Negative;0.9897505640983582;the declines were due to the ecbs accommodative monetary policy stance the decrease in banks composite funding costs which have stabilised close to historically low levels and increased competition among banks for loans
2015-02-05;2015;February;Monetary Policy Decisions;Neutral;0.5181771516799927;the reductions in bank lending rates have been sizeable since summer 2014 the overall nominal cost of external financing for euro area nfcs declined in the fourth quarter of 2014 after having stabilised in the autumn of 2014 the cost of marketbased debt has continued to fall in january 2015 while the cost of equity has stabilised
2015-02-05;2015;February;Monetary Policy Decisions;Negative;0.8442999720573425;the annual growth of loans to households increased marginally to 07 in november thus remaining slightly above the average observed since early 2013 despite these positive trends the consolidation of bank balance sheets and further deleveraging needs in some economic sectors and banking jurisdictions still curb credit dynamics
2015-02-05;2015;February;Monetary Policy Decisions;Neutral;0.9890407919883728;the annual rate of change in mfi loans to nfcs adjusted for sales and securitisation was 13 in november compared with 16 in october and the trough of 32 in february
2015-02-05;2015;February;Monetary Policy Decisions;Neutral;0.9263514280319214;banks continued to ease credit standards for loans to both nfcs and households in net terms in the fourth quarter of 2014 see chart 10
2015-02-05;2015;February;Monetary Policy Decisions;Positive;0.9812316298484802;the gradual improvement in credit dynamics was visible across households and firms
2015-02-05;2015;February;Monetary Policy Decisions;Positive;0.5751073956489563;this figure largely reflects the net purchases by foreigners of securities issued by euro area residents and current account surpluses13ecb economic bulletin issue 1  2015 update on ec onomic and m oneta ry de v e l op m ent s money and creditloans to the private sector continue to recover gradually
2015-02-05;2015;February;Monetary Policy Decisions;Positive;0.7565522789955139;in the 12 months to the end of november 2014 mfis net external assets increased by 315 billion
2015-02-05;2015;February;Monetary Policy Decisions;Positive;0.673545777797699;in addition international investors again showed a keen interest in euro area securities
2015-02-05;2015;February;Monetary Policy Decisions;Negative;0.9820266366004944;the annual rate of change in longerterm mfi financial liabilities excluding capital and reserves held by the moneyholding sector declined further in november
2015-02-05;2015;February;Monetary Policy Decisions;Neutral;0.6760738492012024;while some investors have moved from less liquid deposits included in m3 towards riskier assets outside m3 other investors have shifted away from longerterm financial liabilities thereby supporting m3 growth
2015-02-05;2015;February;Monetary Policy Decisions;Neutral;0.558353841304779;the low remuneration of monetary assets encourages money holders to prefer overnight deposits to other deposits or marketable instruments within m3 even though there are signs that the contraction of marketable instruments is phasing out
