Date;Year;Month;Type;sentiment;sentiment_score;sentence
2015-03-19;2015;March;Monetary Policy Decisions;Neutral;0.9438315629959106;liquidity provisionthe average amount of liquidity provided through open market operations increased by 61 billion to 759 billion in the period under review on account of both the increase of 44 billion in the takeup in tender operations and the increase of 174 billion in outright portfolios
2015-03-19;2015;March;Monetary Policy Decisions;Negative;0.991300880908966;it remains difficult to anticipate investment activities of treasuries against the background of increasingly negative shortterm money market rates and volatile excess liquidity
2015-03-19;2015;March;Monetary Policy Decisions;Neutral;0.9369516968727112;although the volatility of government deposits remained high it was in line with that observed since the rate cut of september 2014 the average absolute error of weekly forecasts of autonomous factors increased considerably in the period under review from 48 billion to 87 billion mainly on account of forecasting errors with respect to government deposits
2015-03-19;2015;March;Monetary Policy Decisions;Neutral;0.7121010422706604;this increase was due primarily to more volatile net assets denominated in euro as well as to the demand for banknotes which reflected the endofyear pattern
2015-03-19;2015;March;Monetary Policy Decisions;Neutral;0.8702712655067444;for the first two operations the rate was set at the mro rate prevailing at the time of the takeup plus a fixed spread of 10 basis points39ecb economic bulletin issue 2  2015 liquidity conditions and monetary policy operations in the period from 12 november 2014 to 27 january 2015boxesthe volatility of autonomous factors increased considerably during the period under review reversing the decline observed in the previous period
2015-03-19;2015;March;Monetary Policy Decisions;Neutral;0.9829452633857728;all tltros are conducted as fixed rate tender procedures with full allotment and the rate is fixed over the life of the operation
2015-03-19;2015;March;Monetary Policy Decisions;Neutral;0.9885098338127136;3 in the first two tltros conducted in september and december 2014 counterparties were entitled to an initial borrowing allowance equal to 7 of the total amount of their loans to the euro area nonfinancial private sector as at 30 april 2014 excluding loans to households for house purchase
2015-03-19;2015;March;Monetary Policy Decisions;Neutral;0.979095697402954;2 with respect to the first tltro see the box entitled liquidity conditions and monetary policy operations in the period from 13 august to 11 november 2014 monthly bulletin  ecb december 2014 available at httpswwwecbeuropaeupubpdfmobu mb201412enpdf
2015-03-19;2015;March;Monetary Policy Decisions;Neutral;0.9687299132347108;the interest rate in each ltro was fixed at the average of the rates on the mros over the respective ltros lifetime
2015-03-19;2015;March;Monetary Policy Decisions;Negative;0.5487518906593323;however it continued to trade very close to its central rate within erm ii as danmarks nationalbank purchased foreign exchange in the market and lowered interest rates on repeated occasions
2015-03-19;2015;March;Monetary Policy Decisions;Negative;0.8471320271492004;the euro also remained relatively stable against the currencies of commodity exporting countries which came under downward pressure as a result of declining oil prices as well as against currencies of central and eastern european eu countries
2015-03-19;2015;March;Monetary Policy Decisions;Neutral;0.9670121669769288;45ecb economic bulletin issue 2  2015 factors behind recent household saving patterns in the euro areaboxesbox 4 factors behind recent household saving patterns in the euro area the savingtoincome ratio is an important indicator of households behaviour that has an impact on the dynamics of real private consumption and more generally the pace of economic growth
2015-03-19;2015;March;Monetary Policy Decisions;Neutral;0.9102187752723694;in principle households consumptionsaving decisions are influenced by a variety of factors
2015-03-19;2015;March;Monetary Policy Decisions;Neutral;0.9751057028770448;insufficient implementation of countryspecific reform recommendationsthe commission gives an important weight to policy commitments in assessing the degree of severity of imbalances
2015-03-19;2015;March;Monetary Policy Decisions;Neutral;0.5962322950363159;this raises questions about the application of the procedure and the effectiveness of its preventive arm
2015-03-19;2015;March;Monetary Policy Decisions;Neutral;0.972116470336914;however every year the number of countries with excessive imbalances is growing from zero in 2012 to five in 2015 whereas the eip has been never invoked by the commission
2015-03-19;2015;March;Monetary Policy Decisions;Neutral;0.873563289642334;this outcome is concerning because one of the key reasons for introducing the mip was to help prevent the emergence of harmful imbalances and foster the unwinding of already existing imbalances
2015-03-19;2015;March;Monetary Policy Decisions;Negative;0.9768013954162598;reflections on the 2015 indepth review conclusionsthe outcome of the 2015 indepth review shows that the imbalances are becoming increasingly severe in a number of countries
2015-03-19;2015;March;Monetary Policy Decisions;Neutral;0.9889407753944396;in the cases of croatia and france however the commission did announce that it was considering opening an eip in may 2015 should the respective governments not have committed to implementing decisive structural reforms by then
2015-03-19;2015;March;Monetary Policy Decisions;Neutral;0.9922519326210022;while credible commitments are a necessary step for reforms to happen assessing the degree of imbalances should be mainly based on effective policy action
2015-03-19;2015;March;Monetary Policy Decisions;Neutral;0.9821181297302246;the corrective arm of the procedure
2015-03-19;2015;March;Monetary Policy Decisions;Neutral;0.976735770702362;colour code red for countries with an escalation of the procedure green for countries with a steppingdown and blue for the countries which entered the procedure in 201549ecb economic bulletin issue 2  2015 the 2015 macroeconomic imbalance procedureboxesdespite having identified excessive imbalances in five countries the commission is currently not proposing to activate the excessive imbalance procedure eip
2015-03-19;2015;March;Monetary Policy Decisions;Neutral;0.9739760160446168;legend 1  no imbalances 2  imbalances which require monitoring and policy action 3  imbalances which require monitoring and decisive policy action 4  imbalances which require specific monitoring and decisive policy action 5  excessive imbalances which require specific monitoring and decisive policy action 6  excessive imbalances which require decisive policy action and the activation of the excessive imbalance procedure
2015-03-19;2015;March;Monetary Policy Decisions;Neutral;0.9510833024978638;1 recital 22 of eu regulation no 11762011 on the prevention and correction of macroeconomic imbalancestable a macroeconomic imbalance procedure categories 1 2 3 4 5 6 2014 2015 2014 2015 2014 2015 2014 2015 2014 2015 2014 2015 dk dk be be hu hu ie ie hr hr lu lu bg nl de es es it fr mt mt de se fr si si it at at nl ro pt lt lt se uk bg lv lv uk fi ee ee fi po po cz cz sk sk source european commission
2015-03-19;2015;March;Monetary Policy Decisions;Neutral;0.9820298552513124;it is the first year that the commission has formally introduced the classification of imbalances in six levels although these were already implicitly used in the 2014 exercise see table a
2015-03-19;2015;March;Monetary Policy Decisions;Neutral;0.9907097816467284;italy and croatia have been in the same category since 2014 this year romania level 2 and portugal level 5 have entered the procedure following the end of their macroeconomic adjustment programmes
2015-03-19;2015;March;Monetary Policy Decisions;Neutral;0.987471044063568;the commission decided to step up the procedure for germany from level 2 to 3 france from level 4 to 5 and significantly for bulgaria from level 2 to 5 and to deescalate the procedure for slovenia from level 5 to 4
2015-03-19;2015;March;Monetary Policy Decisions;Neutral;0.9837925434112548;the commission has thus decided not to make full use of all available steps under the mip ie
2015-03-19;2015;March;Monetary Policy Decisions;Negative;0.8060449957847595;past experiences have shown that policy announcements very often have not been implemented as confirmed by the commissions assessment of the implementation of countryspecific recommendations csrs which raises concerns about the progress made see table b
2015-03-19;2015;March;Monetary Policy Decisions;Neutral;0.9454907774925232;table b european commission assessment of the implementation of the 2014 countryspecific recommendations reform recommendations bebghr czdk de ee esfr ieitlv ltluhumt nlat ptplro sisk fiseuk 1 2 3 4 5 6 7 8 fully addressed substantial progresssome progress limited progress no progress source european commission
2015-03-19;2015;March;Monetary Policy Decisions;Neutral;0.9878474473953248;notes the following categories are used to assess progress in implementing the 2014 csrs no progress the member state has neither announced nor adopted any measures to address the csrs
2015-03-19;2015;March;Monetary Policy Decisions;Negative;0.99482661485672;following the recent fall in oil prices surveybased inflation expectations at shorter maturities have declined substantially
2015-03-19;2015;March;Monetary Policy Decisions;Neutral;0.6316221356391907; 
2015-03-19;2015;March;Monetary Policy Decisions;Neutral;0.9390704035758972;it is important to make full and effective use of the instruments of the mip including its corrective arm in order to reduce the potential risks to the smooth functioning of emu
2015-03-19;2015;March;Monetary Policy Decisions;Negative;0.9928601384162904;given the need to reduce vulnerabilities and boost sustainable growth in the above countries and in the rest of the euro area the lack of progress calls for a major steppingup of the reform effort
2015-03-19;2015;March;Monetary Policy Decisions;Neutral;0.7665876150131226;this assessment appears to be in contrast with the repeated call for decisive policy action made by the commission and points to a weakness of the preventive arm of the mip
2015-03-19;2015;March;Monetary Policy Decisions;Neutral;0.9654775857925416;the countries in categories 4 and 5 of table a spain ireland and italy made some progress on the majority of the csrs while france made limited progress on the majority of the csrs
2015-03-19;2015;March;Monetary Policy Decisions;Neutral;0.9869053959846495;in particular among the countries which were expected to take decisive policy action during the 2014 mip ie
2015-03-19;2015;March;Monetary Policy Decisions;Neutral;0.9823548197746276;while in some countries the reform effort has been stepped up in the majority of the countries progress has been rather limited see table b and not commensurate with the remaining vulnerabilities
2015-03-19;2015;March;Monetary Policy Decisions;Neutral;0.9914069175720216;fully addressed the member state has adopted and implemented measures that address the csrs appropriately50ecb economic bulletinissue 2  2015 focusing on the euro area countries the commission concludes that none of them has fully addressed any of the 2014 recommendations
2015-03-19;2015;March;Monetary Policy Decisions;Neutral;0.9220019578933716;these measures go a long way towards addressing the csrs
2015-03-19;2015;March;Monetary Policy Decisions;Neutral;0.9057258367538452;substantial progress the member state has adopted measures most of which have been implemented
2015-03-19;2015;March;Monetary Policy Decisions;Neutral;0.9475082755088806;these measures are promising but not all of them have been implemented yet and implementation is not certain in all cases
2015-03-19;2015;March;Monetary Policy Decisions;Neutral;0.9642655849456788;some progress the member state has announced or adopted measures to address the csrs
2015-03-19;2015;March;Monetary Policy Decisions;Negative;0.9835259914398192;limited progress the member state has announced some measures to address the csrs but these measures appear insufficient andor their adoptionimplementation is at risk
2015-03-19;2015;March;Monetary Policy Decisions;Neutral;0.9912931323051452;this category also applies if a member state has commissioned a study group to evaluate possible measures
2015-03-19;2015;March;Monetary Policy Decisions;Neutral;0.965071737766266;outcome of the 2015 indepth reviewthe outcome of the 2015 indepth review shows that the european commission has identified five countries with excessive imbalances bulgaria france croatia italy and portugal
2015-03-19;2015;March;Monetary Policy Decisions;Negative;0.6743260025978088;it is anticipated that this will feed gradually into higher price and wage pressures over time
2015-03-19;2015;March;Monetary Policy Decisions;Neutral;0.8202353715896606;in case of repeated failure to present an adequate plan or in case of noncompliance with an approved plan the council may impose financial sanctions on the euro area country in question
2015-03-19;2015;March;Monetary Policy Decisions;Neutral;0.9873656034469604;by contrast if imbalances are found to be excessive the excessive imbalance procedure should be initiated on a recommendation from the commission
2015-03-19;2015;March;Monetary Policy Decisions;Negative;0.993934452533722;on the other hand upward pressure on the saving ratio has been generated mainly by increased uncertainty via a strengthening of precautionary motives to save and by elevated household deleveraging pressures in several countries
2015-03-19;2015;March;Monetary Policy Decisions;Negative;0.9947222471237184;on the one hand downward pressure on the saving ratio has emanated from weak developments in real disposable income via consumption smoothing behaviour  see chart b from the relatively low interest rates which discourage savings and from high unemployment which led to forced dissaving in some countries
2015-03-19;2015;March;Monetary Policy Decisions;Neutral;0.9612278938293456;since 2011 the saving ratio has remained broadly stable at relatively low levels reflecting compensatory effects of various factors that influence households decisions
2015-03-19;2015;March;Monetary Policy Decisions;Positive;0.934122622013092;however alongside improving consumer confidence during the recovery phase in 2010 the saving ratio declined again
2015-03-19;2015;March;Monetary Policy Decisions;Neutral;0.9754717350006104;this surge may also have been triggered by the expansionary fiscal policies prevailing at the time which allowed households to use the increase in real disposable income to raise their propensity to save a mechanism referred to as a ricardian effect
2015-03-19;2015;March;Monetary Policy Decisions;Neutral;0.9286250472068788;the rather high uncertainty prevailing at the time caused the saving ratio to rise to 149 in the first quarter of 2009 mainly on account of precautionary chart a euro area household saving ratio and consumer confidence percentages of disposable income percentage balances 2000 2002 2004 2006 2008 2010 2012 2014saving ratio lefthand scale consumer confidence righthand scale inverted 160 155150145140 135 130125120uni201040 uni201035 uni201030 uni201025 uni201020 uni201015 uni201010 uni20105 0 510 sources eurostat and eu commission dgecfinchart b euro area household saving ratio real disposable income and private consumption percentages of disposable income yearonyear growth rate saving ratio lefthand scale real disposable income right uni2010hand scale real private consumption righthand scale 160 155 150 1451401351301251204 3 2 1 0 uni20101 uni20102 uni20103 4 2000 2002 2004 2006 2008 2010 2012 2014 sources eurostat and ecb calculations46ecb economic bulletinissue 2  2015 motives
2015-03-19;2015;March;Monetary Policy Decisions;Negative;0.5987094640731812;all in all given the opposing effects of these factors the household saving ratio remained relatively stable at around 13 a low level by historical standards
2015-03-19;2015;March;Monetary Policy Decisions;Negative;0.9822733998298644;in the period from 2008 to 2010 the household saving ratio surged temporarily driven primarily by faltering consumer confidence before declining again
2015-03-19;2015;March;Monetary Policy Decisions;Neutral;0.9656806588172911;before the economic and financial crisis the saving ratio fluctuated between 13 and 15
2015-03-19;2015;March;Monetary Policy Decisions;Neutral;0.9868009090423584;analysing households saving behaviour in the euro area from a historical perspective a number of specific periods can be distinguished each characterised by a different degree of influence of key driving factors
2015-03-19;2015;March;Monetary Policy Decisions;Neutral;0.899433434009552;this stabilisation was due to a number of factors which have broadly offset one another
2015-03-19;2015;March;Monetary Policy Decisions;Neutral;0.9574519395828248;the euro area household saving ratio has stabilised at relatively low levels in recent years in comparison with the historical average
2015-03-19;2015;March;Monetary Policy Decisions;Neutral;0.9623915553092957;the effects on consumption of adverse but temporary shocks to disposable income by contrast are usually mitigated by a decrease in the saving ratio a mechanism referred to as intertemporal consumption smoothing
2015-03-19;2015;March;Monetary Policy Decisions;Neutral;0.9096096158027648;for example in periods of high uncertainty households typically increase the share of their disposable income that they save on precautionary grounds
2015-03-19;2015;March;Monetary Policy Decisions;Neutral;0.906923770904541;in the first phase of the recession and its aftermath ie
2015-03-19;2015;March;Monetary Policy Decisions;Neutral;0.7562429308891296;viewed across countries saving patterns have been very heterogeneous in recent years
2015-03-19;2015;March;Monetary Policy Decisions;Neutral;0.988229513168335;the humpshaped pattern of the euro area saving ratio in the first phase of the recession ie
2015-03-19;2015;March;Monetary Policy Decisions;Neutral;0.892930805683136;in the period from 2008 to 2010 was largely driven by developments in spain and to some extent also by those in france and the smaller euro area economies see chart c1 the sharp increase of household savings in spain mirrored an acceleration of household real disposable income growth in 2009 see chart d which was driven at least partly by supportive fiscal measures 1 in this box smaller euro area economies refers to all euro area economies excluding germany spain france and italychart c household saving ratios in the large euro area countries gross savings as a percentage of the fourquarter moving sum of gross disposable income 681012141618 681012141618euro area germany franceitaly spain rest of the euro area 2000 2002 2004 2006 2008 2010 2012 2014 sources eurostat and ecb calculations
2015-03-19;2015;March;Monetary Policy Decisions;Neutral;0.9915012121200562;if it concludes that imbalances are indeed present the member state concerned receives policy recommendations from the eu council based on the recommendation of the commission preventive arm
2015-03-19;2015;March;Monetary Policy Decisions;Neutral;0.9897356033325196;following a first screening on the basis of a set of indicators the commission conducts indepth reviews for a selected group of countries to assess the severity of the imbalances signalled by the indicators
2015-03-19;2015;March;Monetary Policy Decisions;Neutral;0.9897357225418092;the mip covers all eu member states with the exception of those subject to a macroeconomic adjustment programme
2015-03-19;2015;March;Monetary Policy Decisions;Neutral;0.9033588171005248;overall irrespective of the underlying mechanism available evidence suggests that sustainably lower oil prices should temporarily support the household saving ratio while the income gains translate progressively into higher consumption 48ecb economic bulletinissue 2  2015 box 5 the 2015 macroeconomic imbalance procedure the macroeconomic imbalance procedure mip introduced in november 2011 is a cornerstone of the eus strengthened governance framework which aims to prevent the emergence of harmful macroeconomic imbalances and to correct them when they are excessive
2015-03-19;2015;March;Monetary Policy Decisions;Neutral;0.9700198173522948;a precautionary savings motive could for instance explain the humpshaped response of the saving ratio since households tend to first save part of the windfall gains and wait to see whether the increase in real income is sustained
2015-03-19;2015;March;Monetary Policy Decisions;Negative;0.974833607673645;even if sustained increases in real income owing to decreases in energy prices are generally surrounded by more uncertainty than increases in real income from other sources
2015-03-19;2015;March;Monetary Policy Decisions;Negative;0.9609420299530028;the expected humpshaped response of the saving ratio may be linked to the uncertainty surrounding energyrelated increases in real disposable income
2015-03-19;2015;March;Monetary Policy Decisions;Neutral;0.5431610345840454;at the same time this will be mirrored by a further increase in consumption as households start to spend more of the increase in their real disposable income
2015-03-19;2015;March;Monetary Policy Decisions;Neutral;0.6585126519203186;after a few quarters however the saving ratio is likely to return to its initial level
2015-03-19;2015;March;Monetary Policy Decisions;Positive;0.5943137407302856;this can be expected as historical regularities suggest that an increase in real disposable income driven by permanently lower energy prices is initially largely saved
2015-03-19;2015;March;Monetary Policy Decisions;Positive;0.9858261942863464;looking ahead the relatively sharp drop in oil prices observed since the summer of 2014 should support a temporary rebound of the saving ratio
2015-03-19;2015;March;Monetary Policy Decisions;Positive;0.9785277247428894;in spain by contrast the saving ratio continued to decline while that in italy has  after stabilisation  increased since the middle of 2013 reflecting a recovery of households real disposable income
2015-03-19;2015;March;Monetary Policy Decisions;Positive;0.8911629915237427;while households real disposable income continued to increase in france in the first phase of the recession and on average also in the smaller euro area economies in 2009 it declined in italy throughout the period from 2008 until 2013 the overall stable household saving pattern at the euro area level since 2011 reflects broadly stable saving ratios in germany france and on average in the smaller euro area economies
2015-03-19;2015;March;Monetary Policy Decisions;Neutral;0.9760670065879822;note the figures for the rest of the euro area refer to the differences in levels between the euro area aggregate and the sums total for the four largest countries as quarterly sectoral accounts data are not available for all euro area countries47ecb economic bulletin issue 2  2015 factors behind recent household saving patterns in the euro areaboxesin that period
2015-03-19;2015;March;Monetary Policy Decisions;Neutral;0.9569881558418274;note the figures for the rest of the euro area refer to the differences in levels between the euro area aggregate and the sums total for the four largest countries as quarterly sectoral accounts data are not available for all euro area countrieschart d household real disposable income growth in the large euro area countries average annual percentage changes 642026 4 642026 4 2002 2004 2006 2008 2010 2012euro area germany franceitaly spain rest of the euro area 2014 sources eurostat and ecb calculations
2015-03-19;2015;March;Monetary Policy Decisions;Neutral;0.9842409491539;1 under this corrective arm the country concerned has to submit a corrective action plan outlining policy measures to address the excessive imbalances which must be endorsed by the council
2015-03-19;2015;March;Monetary Policy Decisions;Positive;0.9854658842086792;amid the strengthening of economic growth in the united states see section 1 the labour market recovery has recently consistently gathered pace
2015-03-19;2015;March;Monetary Policy Decisions;Neutral;0.9600682854652404;it remained broadly stable in the two years prior to the crisis see chart a
2015-03-19;2015;March;Monetary Policy Decisions;Neutral;0.979536771774292;the increase in central bank credibility which has resulted in more anchored inflation expectations over time and the presence of downward nominal wage rigidities have also been put forward in the literature to explain why inflation may have been less responsive to economic slack than in the past
2015-03-19;2015;March;Monetary Policy Decisions;Negative;0.9592487215995787;support also came from a further decline in the annual rate of change in mfi longerterm financial liabilities excluding capital and reserves held by the moneyholding sector which stood at 48 in the fourth quarter of 2014 and 57 in january 2015 compared with 34 in the third quarter
2015-03-19;2015;March;Monetary Policy Decisions;Negative;0.9801712036132812;this moderation may reflect market expectations of lower future returns on euro area assets particularly among international investors
2015-03-19;2015;March;Monetary Policy Decisions;Positive;0.9902432560920716;relative to its peak in mid2014 the contribution from the mfi sectors net external asset position moderated significantly in the fourth quarter of 2014 but remains positive supported by the sizeable surplus in the current account
