Date;Year;Month;Type;sentiment;sentiment_score;sentence
2015-03-19;2015;March;Monetary Policy Decisions;Neutral;0.9729962348937988;the volume of world merchandise imports increased by 13 on a threemonthon threemonth basis in december
2015-03-19;2015;March;Monetary Policy Decisions;Negative;0.986318826675415;global trade lost some momentum towards the end of 2014 and is expected to recover only gradually
2015-03-19;2015;March;Monetary Policy Decisions;Negative;0.9789295792579652;these developments are anticipated to have a negative impact on euro area foreign demand
2015-03-19;2015;March;Monetary Policy Decisions;Negative;0.8685511946678162;in the medium term lower energy prices will potentially undermine investment in the exploration of oil and gas deposits
2015-03-19;2015;March;Monetary Policy Decisions;Negative;0.9913018941879272;with business confidence depressed and uncertainty remaining high investment is expected to fall
2015-03-19;2015;March;Monetary Policy Decisions;Neutral;0.6559813618659973;it is expected that household consumption will be affected by high inflation which weighs on real disposable incomes
2015-03-19;2015;March;Monetary Policy Decisions;Negative;0.9368493556976318;in particular in russia the recent turmoil in financial markets is expected to push the economy into recession in 2015 the sharp depreciation of the rouble and monetary tightening will mean a sizeable increase in financing costs potentially exacerbating funding problems for firms already facing sanctions that restrict their access to external financial markets
2015-03-19;2015;March;Monetary Policy Decisions;Negative;0.983913779258728;lower oil prices are also weighing on the prospects of oil exporters
2015-03-19;2015;March;Monetary Policy Decisions;Negative;0.9940199851989746;in latin america mediumterm prospects appear to be weaker than previously expected following a period of disappointing growth outturns as growth has been dampened by supplyside bottlenecks and high domestic imbalances in some key economies see chart 3
2015-03-19;2015;March;Monetary Policy Decisions;Neutral;0.973495066165924;1 euro area foreign demand is expected to increase from 28 in 2014 to 51 by 2017 compared with the december 2014 projections expectations for global growth and foreign demand have hardly been revised
2015-03-19;2015;March;Monetary Policy Decisions;Neutral;0.8888136148452759;in addition nominal wage rigidities still prevail in many countries making it more difficult to cut wages in absolute termssurveybased measures of longterm inflation expectations suggest that inflation will gradually return to levels close to 2 see chart 24
2015-03-19;2015;March;Monetary Policy Decisions;Neutral;0.9595997333526612;market services is defined as the remaining difference to total services
2015-03-19;2015;March;Monetary Policy Decisions;Negative;0.9657803773880004;however the decline in longterm surveybased inflation expectations has been much less pronounced than that in marketbased expectations
2015-03-19;2015;March;Monetary Policy Decisions;Neutral;0.7388412356376648;from its postcrisis peak in early may 2014 to its low on 23 january 2015 the broadbased neer weakened by around 10 although it has stabilised in recent weeks with the return of capital inflows following the ecbs announcement of its expanded asset purchase programme after the 22 january 2015 governing council meeting see the financial developments section
2015-03-19;2015;March;Monetary Policy Decisions;Neutral;0.8254339694976807;as confidence returned following the ecbs announcement of outright monetary transactions it rebounded and strengthened continuously until may 2014 changes in market expectations regarding the ecbs future monetary policy stance relative to that of other major central banks then initiated a period of weakening of the euro during which the different neers as well as many bilateral euro exchange rates fell to levels close to neer38 or below neer19 their longerterm averages
2015-03-19;2015;March;Monetary Policy Decisions;Negative;0.9928500652313232;the euro temporarily fell to a low in summer 2012 in the context of the euro area sovereign debt crisis
2015-03-19;2015;March;Monetary Policy Decisions;Neutral;0.9729780554771424;from a longerterm perspective such large movements are not unusual and had also been observed before the crisis see chart a
2015-03-19;2015;March;Monetary Policy Decisions;Neutral;0.6425861716270447;1 the neer of the euro has experienced large swings since the outbreak of the global financial crisis
2015-03-19;2015;March;Monetary Policy Decisions;Neutral;0.9926226139068604;for the euro area the two most relevant neers are calculated with respect to a narrow and a broad set of trading partners comprising 19 the neer19 and 38 the neer38 countries respectively
2015-03-19;2015;March;Monetary Policy Decisions;Neutral;0.9310246109962464;however the overall decline since may of last year masks a divergence in the evolution of the different bilateral exchange rates
2015-03-19;2015;March;Monetary Policy Decisions;Neutral;0.9855297207832336;5 average current account holdings in excess of minimum reserve requirements42ecb economic bulletinissue 2  2015 box 3 recent movements in the effective exchange rate of the euro the nominal effective exchange rate neer constitutes a useful aggregate measure of the exchange rate fluctuations that affect economies through their trade links as it combines the various bilateral rates visvis individual trading partners into a single indicator
2015-03-19;2015;March;Monetary Policy Decisions;Positive;0.9567201137542723;the decrease in the eonia resulted from a slightly stronger passthrough of the september 2014 interest rate cut to shortterm rates which could partly relate to generally more ample liquidity conditions and a better acceptance of the possibility of passing the negative deposit facility rate on to the deposit base
2015-03-19;2015;March;Monetary Policy Decisions;Neutral;0.9739457964897156;interest rate developmentsthe eonia averaged 03 basis point and 47 basis points in the eleventh and twelfth maintenance period respectively
2015-03-19;2015;March;Monetary Policy Decisions;Positive;0.937667191028595;the increasing use of the deposit facility could signal a stronger interest by several counterparties for holding excess liquidity at the deposit facility for operational and regulatory purposes
2015-03-19;2015;March;Monetary Policy Decisions;Neutral;0.9818832874298096;in the period under review relative recourse to the deposit facility increased to 27 of excess reserves5 compared with an average of 23 during the previous review period
2015-03-19;2015;March;Monetary Policy Decisions;Neutral;0.72001713514328;the use of the deposit facility also increased further from an average of 271 to 419 billion
2015-03-19;2015;March;Monetary Policy Decisions;neutral;0.0;4 a new reserve maintenance period calendar was implemented to align it to the new frequency of six weeks for governing council meetingseurosystem  liquidity situation 12 november 2014 to 27 january 201513 august to 11 novembertwelfth maintenance periodeleventh maintenance period liabilities  liquidity needs averages eur billions autonomous liquidity factors 15971 357 15614 16036 179 15857 85 banknotes in circulation 9962 239 9723 10055 257 9798 62 government deposits 683 55 738 663 53 716 45 other autonomous factors 5326 173 5153 5317 25 5343 67 monetary policy instruments current accounts 2178 214 1963 2363 508 1854 28 minimum reserve requirements 1063 09 1054 1062 02 1065 07 deposit facility 419 147 271 502 230 273 37 liquidityabsorbing finetuning operations 00 00 00 00 00 00 00 assets  liquidity supply averages eur billions autonomous liquidity factors 10980 105 10875 10986 17 10969 14 net foreign assets 5720 174 5546 5764 122 5643 23 net assets denominated in euro 5260 70 5329 5222 104 5326 08 monetary policy instrumentsopen market operations 7586 612 6974 7913 898 7015 04 tender operations provided 5465 438 5027 5734 739 4995 82 mros 1133 110 1023 1190 157 1033 81 specialterm refinancing operations 00 00 00 00 00 00 00 threemonth ltros 434 176 258 490 155 335 73 threeyear ltros 2364 937 3301 2115 685 2800 236 targeted ltros 1534 1089 445 1939 1113 826 00 outright portfolios 2121 174 1947 2179 159 2020 86 first covered bond purchase programme 290 29 319 288 07 295 14 second covered bond purchase programme 128 08 136 128 01 129 04 third covered bond purchase programme 250 239 11 305 152 153 125 securities markets programme 1441 40 1481 1441 01 1440 23 assetbacked securities purchase programme 12 12 00 17 15 02 02 marginal lending facility 04 02 02 05 03 02 00 other liquiditybased information averages eur billions aggregate liquidity needs 6057 261 5796 6116 161 5954 77 autonomous factors 4994 253 4741 5053 163 4890 70 excess liquidity 1530 351 1178 1798 737 1060 72 repayment of threeyear ltros 11117 365 752 889 661 228 07 interest rate developments percentages mros 005 003 008 005 000 005 000 marginal lending facility 030 003 033 030 000 030 000 deposit facility 020 003 017 020 000 020 000 eonia average 0031 0033 0002 0047 0044 0003 0000 source ecb note since all figures in the table are rounded in some cases the figure indicated as the change relative to to the previous period does not represent the difference between the rounded figures provided for these periods differing by 01 billion1 for the repayments of the threeyear ltros the sum in eur billions is used instead of the average41ecb economic bulletin issue 2  2015 liquidity conditions and monetary policy operations in the period from 12 november 2014 to 27 january 2015boxesgiven the higher level of excess liquidity daily current account holdings increased considerably by 21 billion on average to 218 billion as compared with the previous period
2015-03-19;2015;March;Monetary Policy Decisions;Positive;0.7261323928833008;however overnight rates remained well above the deposit facility rate of 20 basis points
2015-03-19;2015;March;Monetary Policy Decisions;Neutral;0.3461704552173614;in the eleventh maintenance period excess liquidity decreased slightly to a level of on average 1051 billion the lowest average level recorded since the settlement of the first threeyear ltro at the end of 2011 in the twelfth maintenance period by contrast excess liquidity increased considerably to average 176 billion notably reflecting the allotment of the second tltro and the endofyear effects40ecb economic bulletinissue 2  2015 excess liquidity fluctuated significantly especially during the twelfth maintenance period which was also the first maintenance period with an extended length of 49 days4 from a low of 709 billion on 24 november 2014 excess liquidity rose to 2612 billion on 31 december 2014 before declining to 1265 billion on 27 january 2015 owing to higher autonomous factors and the relative decline in open market operations
2015-03-19;2015;March;Monetary Policy Decisions;Neutral;0.9768620133399964;decomposing this change into individual contributions see charts b and c shows that while most major currencies contributed to this downward movement the intensity persistence and timing of the bilateral patterns differed considerably
2015-03-19;2015;March;Monetary Policy Decisions;Neutral;0.9700398445129396;notes the latest observation is for 20 february 2015
2015-03-19;2015;March;Monetary Policy Decisions;Neutral;0.9686806797981262;the danish krone which participates in erm ii was subject to appreciation pressures visvis the euro during this period
2015-03-19;2015;March;Monetary Policy Decisions;Neutral;0.8931407928466797;the euro also strengthened against the swedish krona over the review period reflecting among other things the recent easing of monetary policy by sveriges riksbank see the financial developments section
2015-03-19;2015;March;Monetary Policy Decisions;Negative;0.9016164541244508;the chart covers the period from 6 may 2014 to 20 february 201544ecb economic bulletinissue 2  2015 the weakening of the broadbased neer was mitigated by the euros strengthening by around 40 visvis the russian rouble which came under marked pressure in the context of the tensions in ukraine
2015-03-19;2015;March;Monetary Policy Decisions;Neutral;0.974242091178894;others comprises the danish krone the swedish krona the algerian dinar the chilean peso the icelandic krona the israeli shekel the moroccan dirham and the venezuelan bolivar
2015-03-19;2015;March;Monetary Policy Decisions;Neutral;0.9399810433387756;notes cee comprises the bulgarian lev the czech koruna the croatian kuna the hungarian forint the polish zloty and the romanian leu commodity comprises the australian dollar the canadian dollar the norwegian krone and the new zealand dollar eme comprises the hong kong dollar the singapore dollar the korean won the indonesian rupiah the indian rupee the malaysian ringgit the philippine peso the taiwan dollar the thai baht the argentine peso the brazilian real the mexican peso the south african rand and the turkish lira
2015-03-19;2015;March;Monetary Policy Decisions;Neutral;0.9826322793960572;the chart covers the period from 6 may 2014 to 20 february 2015chart c contribution by currency to the change in the neer38 percentage points 321012 321012 1 2 3 4 5 6 7 8 9 10 1 chinese renminbi 2 us dollar3 pound sterling4 swiss franc5 japanese yen 6 russian rouble 7 cee 8 eme 9 commodity 10 otherscontribution sources ecb and ecb calculations
2015-03-19;2015;March;Monetary Policy Decisions;Neutral;0.981075406074524;1 the weights which combine information on both imports and exports reflect the importance of different countries in euro area trade in manufactured goods see also schmitz m et al revisiting the effective exchange rates of the euro occasional paper series no 134 ecb frankfurt am main june 2012chart a nominal effective exchange rate of the euro neer19 and neer38 index q1 1999  100 130 120110 100 90 80130 120 1101009080 1999 2001 2003 2005 2007 2009 2011 2013neer 19 neer 38average for neer 19 average for neer 38 source ecb
2015-03-19;2015;March;Monetary Policy Decisions;Neutral;0.9399810433387756;notes cee comprises the bulgarian lev the czech koruna the croatian kuna the hungarian forint the polish zloty and the romanian leu commodity comprises the australian dollar the canadian dollar the norwegian krone and the new zealand dollar eme comprises the hong kong dollar the singapore dollar the korean won the indonesian rupiah the indian rupee the malaysian ringgit the philippine peso the taiwan dollar the thai baht the argentine peso the brazilian real the mexican peso the south african rand and the turkish lira
2015-03-19;2015;March;Monetary Policy Decisions;Negative;0.9928914308547974;at the end of the review period the euro also traded lower against the japanese yen which was supported by declining risk appetite
2015-03-19;2015;March;Monetary Policy Decisions;Neutral;0.5727318525314331;the 20 depreciation of the euro visvis the swiss currency which has a weight of around 5 in the neer38 made up about onetenth of the decline in the neer38
2015-03-19;2015;March;Monetary Policy Decisions;Neutral;0.9413647055625916;in contrast to the steady weakening of the euro against these two currencies the depreciation against the swiss franc occurred abruptly after the announcement by the swiss national bank on 15 january 2015 that it would discontinue its minimum exchange rate target of 120 swiss francs per euro
2015-03-19;2015;March;Monetary Policy Decisions;Neutral;0.9412402510643004;the dollar gained about 20 vis vis the euro as did the chinese renminbi which accounted for another quarter of the overall depreciation
2015-03-19;2015;March;Monetary Policy Decisions;Negative;0.9087947607040404;the dollar was supported by expectations of further diverging monetary policies in the euro area and the united states market uncertainty in an environment of declining commodity prices and heightened geopolitical tensions see chart c
2015-03-19;2015;March;Monetary Policy Decisions;Neutral;0.9883953332901;average refers to the average since 1 january 1999recent movements in the effective exchange rate of the euroboxes43ecb economic bulletin issue 2  2015 looking at developments in bilateral exchange rates from may 2014 to late february 2015 half the fall in the neer38 was accounted for jointly by the us dollar and the chinese renminbi
2015-03-19;2015;March;Monetary Policy Decisions;Neutral;0.981276512145996;the euro depreciated by around 10 against the pound sterling and the currencies of a number of emerging market economieschart b evolution of selected euro exchange rates and weights in the neer38 percentage changes percentages 1050510152025 201001020304050 1 us dollar 2 chinese renminbi3 swiss franc 4 pound sterling 5 japanese yen6 russian rouble7 cee8 eme9 commodity 10 neer381 2 3 4 5 6 7 8 9 10change lefthand scale weight in neer38 righthand scale sources ecb and ecb calculations
2015-03-19;2015;March;Monetary Policy Decisions;Neutral;0.8542329668998718;excess liquidityexcess liquidity rose by 351 billion to average 153 billion over the period under review with significant differences between the two maintenance periods
2015-03-19;2015;March;Monetary Policy Decisions;Neutral;0.7871493101119995;indeed the repaid amount was partially offset by a higher takeup in both the threemonth ltro and the mro and coincided with a temporary decrease in the autonomous factors
2015-03-19;2015;March;Monetary Policy Decisions;Neutral;0.7082912921905518;looking slightly beyond the period under review the maturity of the first threeyear ltro on 29 january 2015 did not trigger any significant drop in excess liquidity which remained above 150 billion
2015-03-19;2015;March;Monetary Policy Decisions;Negative;0.9062405824661256;in addition government deposits continued to decrease over the last maintenance period under review to an average of 66 billion compared with 72 billion in the previous maintenance period that ended in december 2014 indeed national treasuries increasingly tried to invest their excess liquidity in the market which explains the lower volume of government deposits held with the eurosystem to some extent
2015-03-19;2015;March;Monetary Policy Decisions;Neutral;0.9903691411018372;developments followed the usual endofyear pattern with an increase of 41 billion between 12 november 2014 and 2 january 2015 preceding a decline until the end of the twelfth maintenance period
2015-03-19;2015;March;Monetary Policy Decisions;Neutral;0.6235445737838745;where liquidityabsorbing factors are concerned banknotes in circulation increased by on average 24 billion
2015-03-19;2015;March;Monetary Policy Decisions;Neutral;0.8542870283126831;the increase in autonomous factors resulted from the combined effects of several components
2015-03-19;2015;March;Monetary Policy Decisions;Neutral;0.6045777201652527;this increase was due to higher autonomous factors which stood at an average level of 4994 billion
2015-03-19;2015;March;Monetary Policy Decisions;Neutral;0.984975278377533;the eleventh and twelfth maintenance periods of 2014 during the period under review the interest rates on the main refinancing operations mros the marginal lending facility and the deposit facility all remained unchanged at 005 030 and 020 respectively1 on 11 december 2014 the second targeted longerterm refinancing operation tltro was conducted with 1298 billion being alloted compared with 826 billion for the first operation2 3 in addition to the new covered bond purchase programme cbpp3 the first purchases under the new assetbacked securities purchase programme abspp took place at the end of november 2014 liquidity needsin the period under review the aggregate daily liquidity needs of the banking system defined as the sum of autonomous factors and reserve requirements increased by 26 billion in comparison with the previous review period that from 13 august to 11 november 2014 to average 6057 billion
2015-03-19;2015;March;Monetary Policy Decisions;Neutral;0.5956243276596069;where liquidityproviding factors are concerned net assets denominated in euro decreased by on average 7 billion to 526 billion
2015-03-19;2015;March;Monetary Policy Decisions;Neutral;0.9868401288986206;marketbased inflation expectations data for the first quarter of 2015 are based on an average of daily data up to 25 february 201538ecb economic bulletinissue 2  2015 box 2 liquidity conditions and monetary policy operations in the period from 12 november 2014 to 27 january 2015 this box describes the ecbs monetary policy operations during the reserve maintenance periods ending on 9 december 2014 and 27 january 2015 ie
2015-03-19;2015;March;Monetary Policy Decisions;Neutral;0.9796060919761658;meanwhile survey measures of longterm inflation expectations have remained more stable and are consistent with a gradual return of inflation to the longerrun goal of the federal reserve systemchart c outofsample forecasts for pce inflation annual percentage changes 10123456 10123456 2005 2007 2009 2011 2013actual data forecast range sources bureau of economic analysis and ecb staff calculations
2015-03-19;2015;March;Monetary Policy Decisions;Negative;0.8610378503799438;while marketbased measures of fiveyear inflation expectations five years ahead have declined substantially since mid2014 see chart d this could partly be due to a decline in inflation risk premia
2015-03-19;2015;March;Monetary Policy Decisions;Neutral;0.9468444585800172;in the long term inflation expectations should provide an anchor for inflation
2015-03-19;2015;March;Monetary Policy Decisions;Neutral;0.9752777814865112;both of these effects however are expected to fade in the medium term
2015-03-19;2015;March;Monetary Policy Decisions;Negative;0.973517894744873;first the sharp decline in oil prices since last summer is expected to lead to a significant decline in headline inflation in the short term with annual inflation rates turning negative in the first half of 2015 this effect is compounded by the recent appreciation of the us dollar which is exerting downward pressure on import prices
2015-03-19;2015;March;Monetary Policy Decisions;Neutral;0.9918320775032043;however other drivers of inflation are expected to act as offsetting forces
2015-03-19;2015;March;Monetary Policy Decisions;Neutral;0.9587474465370178;note dynamic outofsample forecasts are for the first quarter of 2008 to the fourth quarter of 2014 with the forecast range derived from four different phillips curve models augmented with import prices and either the unemployment gap the shortterm gap the mediumterm gap or the combined unemployment and participation gap as slack measureschart d longterm measures of inflation expectations annual percentage changes 10 15 20 25 30 35 40 10 15 20 25 30 35 40 2004 2006 2008 2010 2012 2014fiveyear forward five years ahead breakeven inflation rate spf tenyear pce spf tenyear cpi university of michigan fiveten years sources federal reserve board university of michigan survey of professional forecasters and bloombergnotes the breakeven inflation rate relates to cpi inflation the spf inflation expectations are for pce or cpi inflation ten years ahead and the university of michigan expectations are not related to a specific price index
2015-03-19;2015;March;Monetary Policy Decisions;Neutral;0.8717814683914185;this reflected among other things an increase in foreign official institutions euro denominated deposits with the eurosystem and reversed the trend observed in the preceding review period when some foreign official institutions tried to reduce their cash holdings with the eurosystem in order to avoid the application of a negative interest rate
2015-03-19;2015;March;Monetary Policy Decisions;Neutral;0.983386218547821;1 mros continued to be conducted as fixed rate tender procedures with full allotment
2015-03-19;2015;March;Monetary Policy Decisions;Neutral;0.9854726195335388;the same procedure remained in use for the three month longerterm refinancing operations ltros
2015-03-19;2015;March;Monetary Policy Decisions;Negative;0.5320033431053162;these purchases 372 billion and 23 billion respectively at the end of the period under review largely offset the decline that resulted from the maturity of some bonds in the securities markets programme portfolio and in the two previous covered bond purchase programmes
2015-03-19;2015;March;Monetary Policy Decisions;Neutral;0.7662569284439087;in addition the liquidity provided through outright portfolios increased by on average 174 billion on the back of the implementation of the cbpp3 and the abspp
2015-03-19;2015;March;Monetary Policy Decisions;Neutral;0.9885282516479492;in particular some counterparties repaid 398 billion on 17 december 2014 to participate into the second tltro which was allotted on the same day
2015-03-19;2015;March;Monetary Policy Decisions;Neutral;0.9106481075286864;given that the maturity of the two threeyear ltros was approaching the pace of early repayments had accelerated
2015-03-19;2015;March;Monetary Policy Decisions;Neutral;0.6865285634994507;overall the decline resulting from early repayments of the threeyear ltros in a total amount 1117 billion was more than offset by the 1298 billion allotted in the second tltro as well as by increases of 11 billion and 176 billion in the average takeup of the mros and the threemonth ltros respectively
2015-03-19;2015;March;Monetary Policy Decisions;Positive;0.8111885786056519;liquidity provided through the tender operations increased to average 5465 billion compared with 5027 billion in the previous period
