Date;Year;Month;Type;sentiment;sentiment_score;sentence
2015-03-19;2015;March;Monetary Policy Decisions;Negative;0.9397848844528198;spreads on investmentgrade corporate bonds continued their decline while abs spreads remained broadly stable
2015-03-19;2015;March;Monetary Policy Decisions;Negative;0.9912263751029968;yields on lowerrated euro area sovereign bonds also fell but were more volatile amid uncertainty about greeces continued access to financial assistance
2015-03-19;2015;March;Monetary Policy Decisions;Neutral;0.9749956130981444;since the declines in yields on aaarated longterm euro area sovereign bonds coincided with increases in equivalent us bond yields the decoupling of euro area and us government bond yields continued
2015-03-19;2015;March;Monetary Policy Decisions;Negative;0.9913358688354492;in this context euro area bond yields declined across instruments maturities and issuers and in many cases reached new historical lows
2015-03-19;2015;March;Monetary Policy Decisions;Positive;0.8921403884887695;favourable developments in financial markets have led to lower bank funding costs which have gradually been passed on to the cost of external finance for the private sector
2015-03-19;2015;March;Monetary Policy Decisions;Neutral;0.8613337874412537;in december 2014 and most of january 2015 financial market developments were to a large extent driven by market expectations regarding the announcement of the app
2015-03-19;2015;March;Monetary Policy Decisions;Neutral;0.995258629322052;they are intended to be carried out until endseptember 2016 and will in any case be conducted until the governing council sees a sustained adjustment in the path of inflation which is consistent with its aim of achieving inflation rates below but close to 2 over the medium term
2015-03-19;2015;March;Monetary Policy Decisions;Neutral;0.967591404914856;the combined monthly purchases of public and private sector securities will amount to 60 billion
2015-03-19;2015;March;Monetary Policy Decisions;Neutral;0.9389394521713256;following the monetary policy initiatives taken by the ecb between june and september 2014 which included further interest rate cuts the introduction of targeted longer term refinancing operations tltros and purchases of selected private sector assets under the assetbacked securities purchase programme abspp and the third covered bond purchase programme cbpp3 the governing council decided in january 2015 to expand its asset purchase programme app to encompass as of march eurodenominated investmentgrade securities issued by euro area governments and agencies and european institutions
2015-03-19;2015;March;Monetary Policy Decisions;Neutral;0.6543440222740173;new information on securities holdings 72 statistics s15ecb economic bulletin issue 2  2015 economic and monetary developments overview with a view to pursuing the ecbs price stability mandate the governing council has taken a number of monetary policy measures to provide a sufficient degree of monetary policy accommodation
2015-03-19;2015;March;Monetary Policy Decisions;Neutral;0.9535114765167236;  3ecb economic bulletin issue 2  2015 contents economic and monetary developments overview 5 1 external environment 8 2 financial developments 12 3 economic activity 17 4 prices and costs 22 5 money and credit 27 6 fiscal developments 33 boxes box 1 assessing us inflation developments using the phillips curve 35 box 2 liquidity conditions and monetary policy operations in the period from 12 november 2014 to 27 january 2015 38 box 3 recent movements in the effective exchange rate of the euro 42 box 4 factors behind recent household saving patterns in the euro area 45 box 5 the 2015 macroeconomic imbalance procedure 48 box 6 effects of ecommerce on inflation 51 box 7 followup to the review of draft budgetary plans for 2015 55 articles progress with structural reforms across the euro area and their possible impacts 59 who holds what
2015-03-19;2015;March;Monetary Policy Decisions;Negative;0.9579383730888368;on the other hand a significant scalingback of automatic wage indexation may imply that any downward adjustment in wage growth is less pronounced than may have previously been the case
2015-03-19;2015;March;Monetary Policy Decisions;Positive;0.936681032180786;the asset purchase programme has already produced a substantial easing of broad financial conditions
2015-03-19;2015;March;Monetary Policy Decisions;Positive;0.9890663623809814;the ecbs monetary policy measures have resulted in an improvement in bank financing conditions with yields on unsecured bank bonds declining to historical lows in the fourth quarter of 2014 this improvement has been gradually passed through to bank lending rates for households and nonfinancial corporations nfcs which in the third and fourth quarters of 2014 fell substantially
2015-03-19;2015;March;Monetary Policy Decisions;Positive;0.9587324857711792;the reduction in bank funding costs and in bank lending rates in the second half of 2014 can be partly attributed to the tltros which are designed to improve banks access to longerterm liquidity and stimulate credit growth in the real economy
2015-03-19;2015;March;Monetary Policy Decisions;Positive;0.8042144179344177;the tltros should also have helped narrow margins on loans to euro area households and nfcs
2015-03-19;2015;March;Monetary Policy Decisions;Positive;0.992414653301239;furthermore the progress made in structural reforms and fiscal consolidation should gradually benefit the real economy
2015-03-19;2015;March;Monetary Policy Decisions;Positive;0.9702370166778564;the accommodative monetary policy stance  substantially reinforced by the app  is expected to support real gdp growth in both the short term and beyond
2015-03-19;2015;March;Monetary Policy Decisions;Negative;0.5693829655647278;growth in activity is expected to increase on account of the recent improvements in business and consumer confidence the sharp fall in oil prices the weakening of the effective exchange rate of the euro and the impact of the ecbs recent monetary policy measures
2015-03-19;2015;March;Monetary Policy Decisions;Positive;0.9919987320899964;the economic recovery is expected to strengthen and broaden gradually
2015-03-19;2015;March;Monetary Policy Decisions;Positive;0.9904859662055968;shortterm indicators and survey results point to a further improvement in economic activity at the beginning of 2015 it appears that euro area activity has been supported by the significant fall in oil prices since july 2014 an environment of improving business and consumer sentiment will support the effective transmission of the policy measures to the real economy contributing to a further improvement in the outlook for economic growth and a reduction in economic slack
2015-03-19;2015;March;Monetary Policy Decisions;Negative;0.8723300099372864;the economic recovery firmed gradually in the second half of 2014 real gdp increased by 02 quarter on quarter in the third quarter of the year and according to eurostats flash estimate by 03 in the fourth quarter which was somewhat higher than previously expected
2015-03-19;2015;March;Monetary Policy Decisions;Positive;0.9865095019340516;the substantial additional easing of the ecbs monetary policy stance supports and reinforces the emergence of more favourable developments in euro area economic activity 
2015-03-19;2015;March;Monetary Policy Decisions;Positive;0.9739162921905518;overall recent developments suggest that the ecbs monetary policy measures are contributing to an easing of bank lending conditions and more generally to restoring the proper functioning of the monetary policy transmission mechanism
2015-03-19;2015;March;Monetary Policy Decisions;Positive;0.9700782299041748;moreover the january 2015 euro area bank lending survey confirmed the assessment that credit supply constraints were gradually receding and demand for loans was recovering
2015-03-19;2015;March;Monetary Policy Decisions;Negative;0.9789583683013916;bank lending to the private sector has continued to recover confirming the occurrence of a turnaround in loan dynamics at the beginning of 2014 in particular the decline in loans to nfcs has continued to moderate over recent months while the growth of loans to households has stabilised at positive levels
2015-03-19;2015;March;Monetary Policy Decisions;Positive;0.98988276720047;annual growth in the broad monetary aggregate m3 is still supported by its most liquid components with the narrow monetary aggregate m1 growing robustly
2015-03-19;2015;March;Monetary Policy Decisions;Neutral;0.6945011615753174;6ecb economic bulletinissue 2  2015 recent data also indicate a firming of money and credit dynamics
2015-03-19;2015;March;Monetary Policy Decisions;Negative;0.8914382457733154;the nominal cost of nonbank external finance for euro area nfcs continued to decrease in the fourth quarter of 2014 and in the first two months of 2015 as a result of a further decline in both the cost of marketbased debt and the cost of equity
2015-03-19;2015;March;Monetary Policy Decisions;Neutral;0.9763997793197632;the ecbs monetary policy measures appear to have also promoted a narrowing of the crosscountry dispersion of borrowing costs especially for nfcs although credit conditions remain heterogeneous across countries
2015-03-19;2015;March;Monetary Policy Decisions;Neutral;0.9909560084342957;in order to underpin the effectiveness of the tltros in supporting lending to the private sector the governing council decided at its january meeting that the interest rate for the remaining tltros would be equal to the rate on the eurosystems main refinancing operations thus removing the 10 basis point spread over the mro rate that applied to the first two tltros
2015-03-19;2015;March;Monetary Policy Decisions;Positive;0.8921296000480652;lower oil prices are expected to benefit net oilconsuming countries while weighing on prospects for oil exporters
2015-03-19;2015;March;Monetary Policy Decisions;Positive;0.8920164108276367;on balance however it is likely that they will support global demand as oilimporting countries which benefit from the price decline tend to have a higher propensity to spend than oilexporting countries
2015-03-19;2015;March;Monetary Policy Decisions;Positive;0.992620050907135;robust growth in the united states is also supporting the global outlook
2015-03-19;2015;March;Monetary Policy Decisions;Positive;0.9925695061683656;activity remained strong in the last quarter of 2014 led by personal consumption and residential investment
2015-03-19;2015;March;Monetary Policy Decisions;Negative;0.9517420530319214;thereafter the projected pickup in world economic activity is expected to diminish spare capacity
2015-03-19;2015;March;Monetary Policy Decisions;Negative;0.9901800155639648;ongoing weakness in commodity prices is expected to contribute to low global inflation in the short term
2015-03-19;2015;March;Monetary Policy Decisions;Neutral;0.9333860278129578;global inflation is expected to remain low in the short term and to rise only gradually thereafter
2015-03-19;2015;March;Monetary Policy Decisions;Negative;0.9763925075531006;however in other large emerging market economies inflation has increased where currency depreciation has led to higher import prices or a lack of credibility in domestic monetary policy has been reflected in continued high inflation expectations
2015-03-19;2015;March;Monetary Policy Decisions;Negative;0.99202698469162;outside the oecd countries inflation in china has also moderated in recent months as broad disinflationary pressures persist
2015-03-19;2015;March;Monetary Policy Decisions;Neutral;0.9837904572486876;annual consumer price inflation in oecd countries decreased to 05 in january 2015 at the same time annual inflation excluding food and energy has remained more stable see chart 4
2015-03-19;2015;March;Monetary Policy Decisions;Positive;0.9796897172927856;in addition the oil price futures curve implies some recovery over the coming years as do futures prices for nonoil commodities
2015-03-19;2015;March;Monetary Policy Decisions;Negative;0.9942982792854308;global inflation has fallen in recent months driven mostly by declining energy prices
2015-03-19;2015;March;Monetary Policy Decisions;Negative;0.9837035536766052;in china high credit growth and leverage pose risks to financial stability
2015-03-19;2015;March;Monetary Policy Decisions;Negative;0.7923074960708618;a faster normalisation of monetary policies than currently expected by markets could trigger a reversal of risk sentiment
2015-03-19;2015;March;Monetary Policy Decisions;Negative;0.9886279702186584;however there is uncertainty regarding the degree of slack in the economy and the extent to which higher demand will lead to higher wage and inflation pressures
2015-03-19;2015;March;Monetary Policy Decisions;Negative;0.7937671542167664;as discussed in box 1 inflationary pressures in the united states are expected to remain limited
2015-03-19;2015;March;Monetary Policy Decisions;Negative;0.980011820793152;while the impact of lower oil prices on the global outlook for growth might be stronger than that embedded in the march 2015 ecb staff macroeconomic projections in the united states markets continue to expect the pace of interest rate increases to be slower than envisaged in the latest fomc projections
2015-03-19;2015;March;Monetary Policy Decisions;Negative;0.4889863729476928;note emes refers to emerging market and developing economies as defined by the imf11ecb economic bulletin issue 2  2015 external environmenteconomic and monetary developmentsrisks to the outlook for global activity remain tilted to the downside
2015-03-19;2015;March;Monetary Policy Decisions;Negative;0.9875923991203308;geopolitical risks also continue to weigh on the outlook and a scenario in which tensions between russia and ukraine reescalate would have adverse implications for global growth
2015-03-19;2015;March;Monetary Policy Decisions;Neutral;0.9726951122283936;chart 4 inflation in the oecd area yearonyear percentage changes and contributions in percentage points 210123456 210123456 2007 2008 2009 2010 2011 2012 2013 2014energy foodexcluding food and energytotal sources oecd and ecb calculations
2015-03-19;2015;March;Monetary Policy Decisions;Negative;0.5166336297988892;notes the latest observation is for january 2015 the calculation of the contributions is based on ecb staff calculations12ecb economic bulletinissue 2  2015 2 financial developments in december 2014 and most of january 2015 financial developments were driven largely by market expectations about the expanded asset purchase programme app which was announced after the meeting of the ecb governing council on 22 january 2015 before the app announcement euro area bond yields declined across instruments maturities and issuers and reached new historic lows in many cases
2015-03-19;2015;March;Monetary Policy Decisions;Neutral;0.790817141532898;yields on aaarated longterm euro area government bonds declined while equivalent us bond yields increased so that the spread between the two widened further
2015-03-19;2015;March;Monetary Policy Decisions;Negative;0.991709291934967;yields on shorterterm bonds such as aaarated twoyear government bonds also declined moving into negative territory in some countries
2015-03-19;2015;March;Monetary Policy Decisions;Neutral;0.8985129594802856;as a result yields on 10 and 30year aaarated government bonds declined between early december and early march by about 50 basis points standing at 04 and 11 respectively on 4 march
2015-03-19;2015;March;Monetary Policy Decisions;Positive;0.92319917678833;however being directly affected by the app  and also benefiting from reductions in liquidity risk premia  yields on longerterm aaarated government bonds declined slightly more strongly than eonia swap rates
2015-03-19;2015;March;Monetary Policy Decisions;Negative;0.9625200629234314;yields on aaarated euro area government bonds also declined owing to expectations relating to the app announcement see chart 6
2015-03-19;2015;March;Monetary Policy Decisions;Neutral;0.9904168844223022;in comparison with early december 2014 in early march 2015 the point at which markets expected the eonia to return to positive levels moved back by 7 months from july 2017 to february 2018 a broadly similar development was recorded for the future path of the three month euribor
2015-03-19;2015;March;Monetary Policy Decisions;Positive;0.7086403965950012;these developments are consistent with market participants expecting a significant but gradual increase in excess liquidity as a result of the app announcement
2015-03-19;2015;March;Monetary Policy Decisions;Neutral;0.982394516468048;from early december 2014 to early march 2015 the eonia forward curve thus became more inverted bottoming out at a level of 015 for the first eight months of 2016 which is close to the current deposit facility rate of 020 see chart 5
2015-03-19;2015;March;Monetary Policy Decisions;Negative;0.9840497374534608;the announcement of the app  and the expectations preceding it  resulted in eonia forward rates declining significantly
2015-03-19;2015;March;Monetary Policy Decisions;Neutral;0.9505121111869812;box 2 looks at liquidity conditions and monetary policy operations in greater detail
2015-03-19;2015;March;Monetary Policy Decisions;Negative;0.6170871257781982;it averaged 004 over that period about 3 basis points lower than the average for the previous three months
2015-03-19;2015;March;Monetary Policy Decisions;Positive;0.6570059061050415;the eonia decreased between early december 2014 and early march 2015 amid higher levels of excess liquidity
2015-03-19;2015;March;Monetary Policy Decisions;Negative;0.9880614280700684;the euro weakened substantially
2015-03-19;2015;March;Monetary Policy Decisions;Positive;0.6869381070137024;furthermore stock prices in the euro area increased significantly
2015-03-19;2015;March;Monetary Policy Decisions;Negative;0.993151307106018;following the announcement of the app and in february and march euro area government bond yields continued to decline
2015-03-19;2015;March;Monetary Policy Decisions;Negative;0.9798052906990052;yields on lowerrated euro area government bonds also declined but they displayed greater volatility linked to the uncertainty surrounding greeces continued access to financial assistance
2015-03-19;2015;March;Monetary Policy Decisions;Neutral;0.8912733793258667;1 see the march 2015 ecb staff macroeconomic projections for the euro area available at httpwwwecbeuropaeupubpdfother ecbstaffprojections 2015enpdfchart 3 real gdp growth in emerging market economies percentage changes 024681012 024681012 brazil russia india china emesaverage 200008 average 201114 source imf world economic outlook database
2015-03-19;2015;March;Monetary Policy Decisions;Positive;0.968380331993103;from early december 2014 to early march 2015 declines in yields tended to be stronger for lowerrated government bonds than for higherrated ones partially reflecting an increased search for yield in response to low  and falling  yields
2015-03-19;2015;March;Monetary Policy Decisions;Negative;0.9257367253303528;this outlook reflects the expectation that the boost to global demand from the fall in oil prices will be broadly outweighed by less favourable prospects in some emerging market economies
2015-03-19;2015;March;Monetary Policy Decisions;Neutral;0.5744743347167969;according to the march 2015 ecb staff macroeconomic projections world real gdp growth excluding the euro area is expected to rise from 36 in 2014 to around 4 in 2016 and 2017
2015-03-19;2015;March;Monetary Policy Decisions;Negative;0.9889215230941772;as the economy moves towards a more sustainable path growth is likely to moderate
2015-03-19;2015;March;Monetary Policy Decisions;Positive;0.517791748046875;however the chinese political leadership has placed increasing emphasis on tackling financial fragilities and macroeconomic imbalances in a longerterm perspective
2015-03-19;2015;March;Monetary Policy Decisions;Positive;0.9668322801589966;in china while the housing market slowdown weighed on growth in the fourth quarter of 2014 the decline in oil prices continued robust consumption recent monetary easing and modest fiscal stimulus are expected to provide some temporary support for the economy
2015-03-19;2015;March;Monetary Policy Decisions;Positive;0.9911198019981384;nearterm prospects have improved in some emerging market economies particularly in oil importing countries
2015-03-19;2015;March;Monetary Policy Decisions;Negative;0.980438470840454;at the same time the abrupt appreciation of the swiss franc following the decision in january by the swiss national bank to abandon the cap on the swiss franceuro exchange rate is expected to have a significant adverse impact on the countrys economic outlook chiefly through lower exports
2015-03-19;2015;March;Monetary Policy Decisions;Positive;0.9917479753494264;in addition the recovery in demand and easing of credit conditions should spur business investment
2015-03-19;2015;March;Monetary Policy Decisions;Positive;0.9917013049125672;lower growth in china will have knockon effects on those asian economies with which it has close economic and financial links but many countries in emerging asia should benefit in the short term from the boost from lower oil prices to real disposable incomes
2015-03-19;2015;March;Monetary Policy Decisions;Positive;0.9911913275718688;looking ahead although continued fiscal consolidation efforts are expected to dampen growth falling energy prices and accelerating wage growth should support real disposable incomes and private consumption
2015-03-19;2015;March;Monetary Policy Decisions;Positive;0.9896736145019532;in japan after the slump in activity following the vat hike in april last year growth resumed in the fourth quarter of 2014 looking ahead the underlying drivers of growth are expected to strengthen slowly benefiting from the gains in household real incomes provided by the lower oil price the boost to export growth from the recent depreciation of the japanese yen and lower fiscal drag following the government announcement that additional stimulus would take place in the next fiscal year
2015-03-19;2015;March;Monetary Policy Decisions;Positive;0.4968425929546356;the growth momentum in most other advanced economies outside the euro area has also firmed up
2015-03-19;2015;March;Monetary Policy Decisions;Positive;0.992659032344818;improved confidence stronger demand and low interest rates are likely to spur business investment offsetting lower capital expenditure in shale oil industries
2015-03-19;2015;March;Monetary Policy Decisions;Positive;0.9878809452056884;waning household deleveraging continued improvements in the labour and housing markets and the boost to real incomes from lower oil prices are expected to support private consumption
2015-03-19;2015;March;Monetary Policy Decisions;Positive;0.9907864928245544;looking ahead although the appreciation of the us dollar will temper export growth a sustained upturn in domestic demand is expected supported by continued accommodative financial conditions and a moderating fiscal drag
2015-03-19;2015;March;Monetary Policy Decisions;Positive;0.990031123161316;the labour market also continued to improve with employment expanding at a vigorous rate
2015-03-19;2015;March;Monetary Policy Decisions;Positive;0.982930600643158;despite some softening in the fourth quarter of 2014 the uk economy is also continuing to expand at a relatively robust pace
2015-03-19;2015;March;Monetary Policy Decisions;Positive;0.9852046966552734;in particular confidence remains high in india amid signs that the growth momentum is improving
2015-03-19;2015;March;Monetary Policy Decisions;Positive;0.9873098731040956;as an oilimporting country it will benefit from the lower oil prices which help to contain both inflation and the current account deficit while allowing the government to cut fuel subsidies and support fiscal consolidation
2015-03-19;2015;March;Monetary Policy Decisions;Negative;0.9632419347763062;central and eastern european countries are also expected to benefit from strengthening domestic demand as improved labour market dynamics and the recent decline in oil prices are expected to support household consumption10ecb economic bulletinissue 2  2015 elsewhere the outlook is for weaker activity
2015-03-19;2015;March;Monetary Policy Decisions;Positive;0.9582170844078064;overall the global recovery is expected to pick up gradually
2015-03-19;2015;March;Monetary Policy Decisions;Positive;0.9263599514961244;as a result although global trade is expected to pick up as cyclical weakness unwinds and global investment recovers it is unlikely to expand at the same pace as in the 1990s and 2000s when large emerging market economies were integrating into the global economy greatly expanding global trading opportunities
2015-03-19;2015;March;Monetary Policy Decisions;Negative;0.8570461273193359;at the same time structural factors have affected global trade as firms have reduced the complexity and length of their supply chains which means that the expansion of global value chains is no longer supporting global trade growth to the same degree as in the past
2015-03-19;2015;March;Monetary Policy Decisions;Negative;0.995097815990448;in recent years cyclical weakness in business investment which typically has a high import content has restrained the pace of global trade
2015-03-19;2015;March;Monetary Policy Decisions;Positive;0.9884325861930848;looking further ahead world trade is expected to strengthen at a very moderate pace
2015-03-19;2015;March;Monetary Policy Decisions;Positive;0.9909693598747252;having declined in previous months the global pmi new export order index recovered in december 2014 and stabilised in january 2015 suggesting more resilience in global trade at the turn of the year
