Date;Year;Month;Type;sentiment;sentiment_score;sentence
2003-08-12;2003;August;Minute;Positive;0.9926570057868958;members commented that current financial conditions remained a positive factor in the outlook for the economy even after the recent rise in longterm interest rates
2003-08-12;2003;August;Minute;Positive;0.9490537047386169;m2 continued to grow briskly in june and july reflecting in large part the nearzero opportunity cost of holding money the effects of mortgage refinancing activity and the reduction in personal income tax withholdings
2003-08-12;2003;August;Minute;Negative;0.9931538105010986;indeed mortgage refinancing activity appeared to have declined substantially according to some reports prospectively lessening the support for some consumer and other spending fostered by the extraction of equity from housing
2003-08-12;2003;August;Minute;Neutral;0.9288923144340515;votes for this action
2003-08-12;2003;August;Minute;Positive;0.6733697056770325;indeed in light of the persistence of substantial margins of underutilized capital many business contacts indicated that they intended to meet growing demand by adding staff before increasing output capacity
2003-08-12;2003;August;Minute;Positive;0.9639332890510559;looking ahead much would depend on further growth in demand for business products and services and associated evidence of rising profits building on indications of strengthening in both in recent months
2003-08-12;2003;August;Minute;Negative;0.99461430311203;it was clear nonetheless that business sentiment toward capital expenditures remained exceptionally cautious
2003-08-12;2003;August;Minute;Neutral;0.4968678057193756;several noted that nonresidential building appeared to have stabilized in various parts of the country after a long period of decline and there were reports that new construction projects had been initiated in some areas
2003-08-12;2003;August;Minute;Positive;0.9614282846450806;members also reported some signs of renewed venture capital activity
2003-08-12;2003;August;Minute;Negative;0.5347187519073486;for now survey and anecdotal reports on business capital spending intentions were somewhat more encouraging than earlier but were still generally mixed with only a small number of firms planning robust capital spending programs
2003-08-12;2003;August;Minute;Negative;0.994856595993042;since the year 2000 business capital expenditures had been mostly limited to replacement demand for equipment and software and with nonresidential construction activity displaying pronounced weakness total business fixed investment had until recently been on a declining trend
2003-08-12;2003;August;Minute;Negative;0.7432321906089783;even so a number of factors suggested that the risks from higher interest rates might not be large
2003-08-12;2003;August;Minute;Positive;0.8798561096191406;members were encouraged however by evidence in recent months that an upswing in spending for capital equipment and software might be under way including more purchases by firms of nonhightech equipment as well as an ongoing rise in purchases of computing equipment and related peripherals
2003-08-12;2003;August;Minute;Positive;0.9287440180778503;these included the possibility that the higher rates in part reflected growing optimism about the economic outlook that would engender a faster pace of business spending more than offsetting the effects of the higher rates on consumer spending
2003-08-12;2003;August;Minute;Negative;0.9713498950004578;the weakness in business inventories that had damped the expansion thus far this year appeared to be continuing in the current quarter according to numerous business contacts
2003-08-12;2003;August;Minute;Positive;0.9886754751205444;moreover longterm interest rates were still relatively low risk spreads had narrowed in recent months and stock prices had held firm recently perhaps in part as a result of several upside surprises in secondquarter profit reports
2003-08-12;2003;August;Minute;Neutral;0.6915634274482727;several members reiterated that business spending was the critical factor that would govern to a substantial degree the timing and extent of the acceleration in overall economic activity
